speakerGroups,speaker,theText,pageNumbers,title
0,"11)0 Usp Of Kcprrscntatibes. Friday, G August, I0o7. A.m., And Read Prayers. On Log Timber",BUDGE T AND TARIFF the Acting Prime Minister if he will give instructions to have the index to the Customs Tariff prepared in the same form as that of the other little volume which has,14,Setup
1,Mr Speaker Tookthe Chair At 10.30,,14,Tariff Commission S Re
2,Mr Tudor,"I desire to know frombeen distributed to honourable members this morning? I think it might be done with very little trouble. Sir WILLIAM LYNE the matter. No doubt it can be done. able gentleman give instructions for the printing of a schedule showing the old and the new rates of duties in parallel columns ? Sir WILLI AM LYNE last night that I intended to have that done. rates of duties have been largely increased, to impose Excise duties similar to those proposed last year if proper labour conditions are not complied with ? Sir WILLIAM .LYNE -The matter escaped my memory when dealing with the Tariff last night; but I afterwards gave an interview to representatives of the press in regard to it. ""I would not attempt to pass a Tariff without making some provision of the kind, either in the manner followed last year, or in some better or easier way, if one can be discovered. Labour Committee to report? members of that Committee will be able to give me a great deal of assistance, and I shall be glad to have all the information that I can get. I decline 'to say now, definitely, how this matter will be dealt with; but an endeavour will be made to adopt the easiest.and most effective method. present method is tested, it will be found unconstitutional. Sir WILLIAM LYNE -Quite so. When the Bill is brought down, we shall propose the best method of which we are informed. notice of the honourable gentleman that the production of log timber is avery important-native industry? He proposes to admit such timber free of duty, while giving high protection to exotic industries. supposed that any one or two human beings could make a perfect Tariff. The present Minister of Trade and Customs and myself, together with the officers of the Department, have worked very hard in trying to perfect our proposals, but I have no doubt that some anomalies will be discovered. I think, however, that you, Mr Speaker, ruled on [60]2 a previous occasion that the rates of proposed duties could, on the motion of a Minister, be raised or lowered. items in the schedule. item in the schedule. That ruling will give an opportunity, similar to that taken when the right honourable member for Adelaide was in charge of the Tariff, for ths I think I said removal of inequalities. I hope that in Committee honourable members will give us as much information as possible, because I do not desire the continuance of anomalies, nor do I wish to see anything omitted which honourable members think should be ""dealt with. that the reports of the Tariff Commission were made available to honourable members only last night, and that the Budget papers have only just come into their hands, is it the intention of the Government to commence the discussion of the Tariff proposals as early as next Wednesday? Will they not postpone it until a later date? Sir WILLIAM LYNE I am glad that the question has been asked. I have been considering the matter, and I think now that it will be better not to commence the discussion next Wednesday. There are certain measures which I hope to see put out of the way before the consideration of the Tariff is commenced. I hope that nothing will interfere with the Tariff discussion once it is beenn. Mr 'McDONALD,-We should have a week to consider the information which has been put before us. stand that it is not intended to commence the Budget debate next Wednesday? wish to clear off the business-paper other measures whose consideration has been commenced, before proceeding with the Budget and Tariff debates. I hope that, when those debates are commenced, we shall go right on until we finish them, allowing nothing else to intervene. discussion of the Budget will, as far as possible, be kept distinct from the did cussion of the Tariff. Sir WILLI AM LYNE I do not think that we can discuss the Budget witho it discussing the Tariff.",14,Tariff Commission S Re
3,Mr Joseph Cook,Will the honor,15,Tariff Commission S Re
4,Mr Glynn,"I s it intended, where the",15,Tariff Commission S Re
5,Mr Kelly,Why not wait for the,15,Tariff Commission S Re
6,Sir William Lyne,No doubt the,15,Tariff Commission S Re
7,Mr Glynn,"It is possible that, if the",15,Tariff Commission S Re
8,Mr Fisher,Has it escaped the,15,Tariff Commission S Re
9,Sir William Lyne,It is not to be,15,Tariff Commission S Re
10,,I shall see to Mr. JOSEPH COOK -In connection with,15,Tariff Commission S Re
11,Sir William Lyne,Timbe r is an,15,Tariff Commission S Re
12,Mr Mcdonald,In view of the fact,15,Tariff Commission S Re
13,Mr Joseph Cook,Are we to under,15,Tariff Commission S Re
14,Sir William Lyne,That is so. I,15,Tariff Commission S Re
15,Mr Joseph Cook,"I hope that thegentleman see that the reports of the two sections of the Tariff Commission are made available to honourable members, so that they may have an opportunity to peruse them before the Tariff discussion is commenced ? that last night. Sir WILLIAM LYNE I shall give end ? instructions at once to have additional copies printed-ther e are one or two copies in print-so that every honourable member can have one. type? Sir WILLI AM LYNE most of them are, and therefore the printing will not take very long. orable gentleman name the date when he proposes to commence the Budget discussion? It is a most remarkable thing for the Treasurer to tell honourable members that the consideration of the Budget is postponed indefinitely. There should be a day fixed for the commencement of the discussion. that I have taken an irregular course. Obviously honourable members think that the discussion should not be commenced next Wednesday. That is shown by the question which I have been asked. When the honourable member for Parramatta spoke to me on the subject last night, I answered him before I had given the matter proper consideration. I shall not fix a date now, though I anticipate that the discussion will be commenced about Tuesday week. I shall give honourable members plenty of notice. to fix Wednesday than Tuesday week. Sir WILLIAM LYNE I am not particular about the dav, and next week I shall give honourable members ample notice of the date fixed. Minister definitely promise to supply a sufficient number of copies of the reports of both sections of the Tariff Commission to make a copy available for every honourable member? Sir WILLIAM . LYNE -That is my intention. member should have a copy,and I shall give instructions, as soon as possible, for the work of printing to be expedited. tleman say that the reports of the Tariff Commission are already in type? nearly so. then, to issue copies of these reports this afternoon, so that honourable members may be able to study, them during the week Sir WILLIAM LYNE I do not think that that can be done, because all the reports are not yetin type. In some of them the recommendations have been merely written in, so that they should not become known to any but responsible perI think that sons. The work of printing and issuing will be done as quickly as possible. given to understand ""that it has taken the Ministry months to digest the information gathered by the Tariff Commission, and honourable members will,-therefore, require some considerable time to make themselves fully acquainted with the Commission's recommendations. They cannot do it in addition to their ordinary parliamentary business, while the House is sitting, and I do not think therefore I ask if the Treasurer will be willing to consent to an adjournment from, say, Thursday next until the following Wednesday, in order to give honourable members an opportunity to try to digest the information which has been made available to them? Sir WILLIAM LYNE I shall not make a definite promise at the present moment, because something may happen which will prevent such an adjournment; but personally, I shall not offer any objection if honourable members generally desire an adjournment from Thursday next until Tuesday or Wednesday of the following week. OILS. W ill the Acting Prime Minister, upon notice,1. Has his attention been drawn to the statement contained in a document handed by the Prime Minister( Mr Deakin) to the Colonial Conference lately held in London, which document states (see page 264, Report of Colonial Conference) that olive oil, to ..thevalue of ^145,859, was in one year imported into the I think that every honourable United Kingdom from Australia? 2. Is the statement true? 3. If true, why was such misleading information as that contained in the ""BountiesB ill Memorandum supplied to this House?",15,Tariff Commission S Re
16,Mr Poynton,Will the honourable,16,Olive Cocoanut And Mineral
17,Mr Fuller',The Treasurer promised,16,Olive Cocoanut And Mineral
18,Mr Fisher,Are all the reports in,16,Olive Cocoanut And Mineral
19,Mr Joseph Cook,Will the hon,16,Olive Cocoanut And Mineral
20,Sir William Lyne,,16,Olive Cocoanut And Mineral
21,", Mr Joseph Cook",It would be better,16,Olive Cocoanut And Mineral
22,Mr Fuller,,16,Olive Cocoanut And Mineral
23,Mr Kelly,D i d the honourable gen,16,Olive Cocoanut And Mineral
24,Sir William Lyne,"Not all, but",16,Olive Cocoanut And Mineral
25,Mr Kelly,"Would it be possible,",16,Olive Cocoanut And Mineral
26,Mr Mcdonald,We have been,16,Olive Cocoanut And Mineral
27,Mr Hedges Asked The Acting Prime,"4. Is the Minister aware that the Bounties Memorandum stated that 85,433 olive trees produced 15,202 gallons of oil? 5. Is the Minister aware that at the same rate -of production it would require millions of trees to produce olive oil of the value alleged to Jiave been exported in one year? to the honourable member's questions are as follow :1 and 2. The amount of ^145,859 in question should have been specified as representing cocoanut oils and mineral oils. It was erroneously classed asolive oil. 3, 4, and 5. The information furnished in the BountiesB ill Memorandum is believed to be accurate. In Committee (Consideration resumed from 8th August, vide page 1625). Clause 22The master of every vessel shall (unless the vessel is actually performing quarantine under the supervision of a quarantine officer) forthwith, after becoming aware that any disease has broken out on his vessel which he believes or suspects or has reason to believe or suspect to be a quarantinable disease(a) Notify a quarantine officer of the breaking out of the disease, and (i) Hoist the quarantine signal at the maintop of his vessel and keep it so hoisted until he is authorized by a quarantine officer to take it down or until the vessel is released from quarantine. Penalty : F if t y pounds. way of amendmentThat all the words from "" The master"" to "" quarantinable disease"" inclusive, lines 1 to 7, ibe left out, with a view to insert in lieu thereof the following words :""When the master of any vessel becomes aware that(a) any eruptive disease; or (i) any fever disease attended with glandular swellings; or (r) any disease which he believes or suspects, or has reason to believe or suspect, to be a quarantinable diseasehas broken out on board his vessel, he shall forthwith (unless the vessel is actually performing quarantine under the supervision of a quarantine officer)"" movedThat in paragraph 6 the word "" fever"" be left out, with a view to insert after "" w it h "" the words "" fever and."" Amendment of the amendment agreed to. to me that this clause imposes a very great burden upon the masters of vessels. In -cases of fever, no matter whether they be of a contagious character or not, they are bound to report the occurrence. If they fail to do so they are liable to a very severe fine. How can a master obtain definite knowledge that disease actually exists on board his vessel ? I would further point out that the clause provides that he is liable for not reporting the matter if he believes or suspects, or has reason to believe or suspect, that a quarantinable disease exists on board. Then how is the Minister to determine whether the master believes or suspects the presence of a quarantinable disease on his ship ? To my mind, it is a pity that our legislation should be either in the direction of working hardship or of proving futile. are defined in the Bill. the words employed are "" diseases which are contagious and infectious."" ney-General) [10.49] -The master of any vessel will know exactly what are quarantinable diseases, and the Bill empowers the Governor General to proclaim other diseases to be quarantinable. "" infectious."" Act, no officer would recommend the declaration as a quarantinable disease of a disease which was not of the kind usually dealt with in Quarantine Acts. I feel sure that no undue hardships will be thrown upon the masters of vessels under this provision. Of course, they must be under some obligation to report an outbreak of disease. ease exists on board his vessel the master must have knowledge. board, and he certifies that a patient is suffering from disease, of course the master must have knowledge. It is merely a question of fact which is involved. The master must have reasonable grounds for his belief. Amendment, as amended, agreed to. Clause, as amended, agreed to. Clauses 23 to 28 agreed to. Clause 291. Except as prescribed, the master of a vessel subject to quarantine shall not quit, or knowingly or negligently suffer any person to quit, his vessel, or knowingly or negligently permit any goods to be removed from his vessel. Penalty : One hundred pounds.",16,Olive Cocoanut And Mineral
28,Sir William Lyne,.The answers,17,Quaranti Ne Bill
29,Upon Which Mr Groom Had Moved By,,17,Quaranti Ne Bill
30,Upon Which Amendment Mr Wilson Had,,17,Quaranti Ne Bill
31,Mr Glynn (Angas) [10.48],It seems,17,Quaranti Ne Bill
32,Mr Groom,Quarantinabl e diseases,17,Quaranti Ne Bill
33,Mr Glynn,In most Quarantine Acts,17,Quaranti Ne Bill
34,Mr Groom (Darling Downs,Attor,17,Quaranti Ne Bill
35,Mr Glynn,Feve r is not described as,17,Quaranti Ne Bill
36,Mr Groom,In administering the,17,Quaranti Ne Bill
37,Mr Fisher,But to believe that a dis,17,Quaranti Ne Bill
38,Mr Groom,"If there be a doctor ondesire to know whether the Bill contains any provision which will enable the Governor General in Council to allow persons liberty to quit either quarantine vessels or quarantine grounds. Of my own personal knowledge, certain notable individuals have been permitted to leave vessels which were undergoing a period of quarantine, and also to quit quarantine grounds. I fancy that the measure contains a provision to prevent that. quarantine vessel or quarantine grounds has to be authorized by a quarantine officer. tended that wholesale liberty to leave such places shall be granted, but of course I apprehend that there may be circumstances in which the granting of such permission would be perfectly justifiable. Clause agreed to. Clauses 30 to 33 agreed to. Clause 34.1. Where a vessel has arrived at any port from a proclaimed place, or is subject to quarantine, and the quarantine officer is satisfied that no person on board is actually suffering from a quarantinable disease, but is not satisfied that the vessel is free from infection, he may, subject to this section(a)'refrain from giving a certificate of pradisease, but he has reason to suspect that tique j (i) permit the vessel to proceed on her voyage without performing quarantine at a quarantine station; (e) permit any passengers for that port and their effects to be landed; (d) permitany cargo on the vessel for that port to be landed. 2. The vessel shall continue to be subject to quarantine until pratique is granted. 3. All persons landed in pursuance of this section shall continue subject to quarantine until such period as is prescribed, and, while so subject, shall be under quarantine surveillance, and shall comply with the regulations relating to quarantine surveillance. Penalty : One hundred pounds. 4. AH cargo and passengers' effects landed under this section shall be subject to treatment and disinfection as prescribed. With the general provisions of this clause I am in perfect agreement, but I wish to ask the Attorney-General whether it has been copied from the States Quarantine Acts, and whether it is a provision which is to be enforced save under the most exceptional circumstances ? I take it that it confers a reserve power which should be held by the Commonwealth, but it is certainly a very sweeping power if it is to be exer-cised in awholesale fashion. ney-General) [10.56] -This is an entirelynew provision which is not contained in any of the States Quarantine Acts. It was introduced, I believe, chiefly upon the recommendation of Dr. Elkington, the ..Health Officer of Tasmania. into operation only in exceptional cases? a certain amount of latitude upon vessels, and at the same time to provide for their surveillance. It is a power which will be exercised with caution. would point out that this provision vests in. quarantine officers, in cases in which quarantinable diseases are not actually found onboard vessels, the power of detaining them in quarantine upon the mere chance that such diseases may develop. Would it not be better to impose a safeguard against its abuse by providing that Parliament shall be notified of cases in which the power is exercised ? ney-General) [1.0.58] -When any vessel arrives in port and the quarantine officer is satisfied that no person on board is actually suffering from a quarantinable the vessel is not free from infection, he refrains from giving her a certificate of pratique, permitting her, however, to proceed! from port to port without performing quarantine. The ship continues to be under surveillance. She would practically be under surveillance all along the coast. permit the vessel to proceed if there be no quarantinable disease on board. there is no quarantinable disease on board, but is not satisfied that she is free from infection, he will refuse to grant pratique, but the vessel will be permitted to proceed under surveillance. substitute the words ""believes that thevessel is not altogether free from infection"" for "" is not satisfied that the vessel is free from infection "" ? is to be preferred in its present form. If a quarantine officer entertains any suspicion regarding a vessel, he must exercise this power. Of course, his suspicion must .be a reasonable one. The provision has",17,Quaranti Ne Bill
39,Mr Fisher (Wide Bay) [10.53],I,18,Quaranti Ne Bill
40,Mr Groom,Liberty to leave either a,18,Quaranti Ne Bill
41,Mr Fisher,I presume it is not in,18,Quaranti Ne Bill
42,Mr Kelly (Wentworth) [10.55],,18,Quaranti Ne Bill
43,Mr Groom (Darling Downs,Attor,18,Quaranti Ne Bill
44,Mr Kelly.ti Presume It Will Be Put,,18,Quaranti Ne Bill
45,Mr Groom,It is intended to confer,18,Quaranti Ne Bill
46,Mr Kelly (Wentworth) [10.57},I,18,Quaranti Ne Bill
47,Mr Groom (Darling Downs,Attor,18,Quaranti Ne Bill
48,Mr Kelly,But the officer is bound to,18,Quaranti Ne Bill
49,Mr Groom,If he be satisfied that,18,Quaranti Ne Bill
50,Mr Kelly,Would it not be better to,18,Quaranti Ne Bill
51,Mr Groom,"I think that the clausebeen inserted upon recommendation. However, I will take a note of what the honourable member has said. The objection which I entertain to this clause is the very opposite of that urged by the honourable member for Wentworth. Apparently, he wishes to make it more lax, whereas I think it is already too lax. Under present conditions, if a medical officer is not satisfied that a vessel is free from infection, it is his duty to order her into quarantine.* This clause will give the quarantine officer a discretion which I hope will not be too widely exercised. The object of this provision is very clear. have a more or less extended course of incubation ; and it is proposed that in certain circumstances a vessel from an infected port should be allowed to proceed on hei way along the coast to a certain extent under observation. I think, however, that the Government are proposing to give the honourable member for Wentworth more than he is entitled to ask for. cial concession. complains that this provision is too rigid, and desires that, in certain cases, Parliament should be appealed to. suggestion to the Minister. ber has suggested that the precautions taken to prevent the introduction of disease should not be so rigid as they are under the regulations of the States. ber desires that the quarantine officer shall be compelled to grant pratique unless a disease has developed upon a vessel. of the kind. ber certainly suggested that unless Parliament had been appealed to, the quarantine officer should not be allowed to exercise his power to detain a vessel merely because he _ was not satisfied that she was free from infection. clause is too wide. It proposes to give the quarantine officer too much liberty. I hope that in the regulations we shall have a recognition of the liability of the Commonwealth to be very seriously affected by a lax interpretation of this provision. should not have risen again to speak to this clause but for the extraordinary complexion which the honourable member for Laanecoorie has put upon my remarks. I cast the responsibility upon the Minister, but suggested that the clause might be redrafted so that it would be more in accorddance with the view to which he had given expression. The honourable gentleman said that the power would be exercised onlj where the quarantine officer was not satisfied that a vessel was free from infection. ' I quite agree that such a power is necessary. I entirely fail to understand why the honourable member for Laanecoorie Certain diseases should have attributed to me the view that the quarantine officer should not be permitted to exercise such a power as is proposed to be given him under this clause. Very few of the Bills submitted to this House have passed through the ordeal of consideration in Committee so well as this has done. I think it is an admirI have asked for no speable proposal that a quarantine officer, finding that a vessel has no disease on board -bu t not satisfied that she is free from infection-shal l be empowered to allow her to proceed to the next port of call, where a further examination may be made. TheI have simply offered a provision is an ideal one. tion is good, but we cannot always guarantee a capable administration. A quarantine officer in one of the smaller ports might without reason declare thlat he was not satisfied in regard to the existence of disease on a vessel. honourable member should assail the wording of the clause when 'what he has in mind I have made no suggestion is really an attack on the administration. I cannot suggest how the clause could be improved unless, as suggested by the honororable member for Laanecoorie, we made it more stringent than it is. I prefer to charge the administration with the appointment of competent officers. If the' officers do not carry out their duties satisfactorily I think the they should be dismissed. As long as Parliament keeps a tight rein on the administration we shall be able to protect the interests of the country generally, as well as those who may be affected by any vessel being ordered into quarantine. Under the clause as it stands, a quarantine officer may,",18,Quaranti Ne Bill
52,Mr Salmon (Laaneccorie) [1:1.0],,19,Quaranti Ne Bill
53,Mr Kelly,,19,Quaranti Ne Bill
54,Mr Salmon,The honourable member,19,Quaranti Ne Bill
55,Mr Kelly,,19,Quaranti Ne Bill
56,Mr Salmon,The honourable mem,19,Quaranti Ne Bill
57,Mr Kelly,No.,19,Quaranti Ne Bill
58,Mr Salmon,The honourable mem,19,Quaranti Ne Bill
59,Mr Kelly,,19,Quaranti Ne Bill
60,Mr Salmon,The honourable mem,19,Quaranti Ne Bill
61,Mr Kelly (Wentworth) [11.2],I,19,Quaranti Ne Bill
62,Mr Fisher (Wide Bay) [11.4],,19,Quaranti Ne Bill
63,Mr Kelly,It is when the administra,19,Quaranti Ne Bill
