speakerGroups,speaker,theText,pageNumbers,title
64,Mr Fisher,"I fail to see wfay therefuse pratique if he thinks there is a danger of a quarantinable disease breaking out .on board a vessel whilst she is proceeding along the coast. need not tie up. the ship. proceed further along the coast to another port, where there will be an opportunity to ascertain whether his suspicions are well grounded. member think that the central administration in all these cases ought to know what is going on ? would have to report, and his report would be filed with the central authority. officer who permits a vessel to proceed on her voyage under these circumstances will be required to give notice to the quarantine officer at the next port of call. sume that a quarantine officer would fail to advise the central office of what .he had done in such circumstances? to see any objection to the clause. designed to give elasticity in connection with the administration where elasticity is necessary. suspicion that a quarantinable disease exists on board a vessel coming into port passengers will be allowed to land, subject to some observation, whilst the vessel herself will be permitted to proceed on her voyage, and may be dealt with at the next port. This is a fair and reasonable provision. Clause agreed to. Clause 35 (Order to perform quarantine). should like to know whether sub-clause 2, which provides thatIf a vessel has arrived in Australia from a proclaimed place, the quarantine officer shall (except as prescribed) order her into quarantine, has any bearing on clause 14, which empowers the Governor General to exempt certain vessels trading between Australia and New Zealand or Fiji, and other places adjacent to Australia. that there are a good many communicable -diseases in the South Sea Islands. Would the Governor General have power to exempt a vessel coming from one of these ports .when there was an outbreak of disease -there? Would he have power to exempt a man-o'-war or any other vessel coming from, say, Fiji? and by so doing suspend the law of the State. torney-General) [ n . 10] -Unde r this Bill we have power to issue a proclamation declaring that any place beyond or in Australia is infected with a quarantinable dis.ease, and all vessels coming from a proclaimed place would be ordered into quarantine immediately on arrival. There are certain conditions prescribed in respect to oversea vessels generally. It might not be necessary to require vessels regularly trading between, say, New Zealand and Australia to perform the same conditions as vessels coming from eastern ports. But the intention of this clause is not to relax the conditions. Even if an exemption had been granted in respect of vessels coming from any of the South Sea islands, it would be removed immediately a quarantinable disease broke out there. The island on which the outbreak occurred would at once toe declared a proclaimed place. It is Clause agreed to. Clauses 36 to 38 agreed to. Where there is only a vague Clause 39 (Performance of quarantine by vessel). should like to know what power a quarantine officer has to detain a vessel. The only way in which to prevent a vessel leaving port is to detain her papers, and that is a power vested entirely, under the Customs Act, in officers of the Customs Department. A quarantine officer could not detain a ship. provides that the owners of a vessel shall be subject to certain pains and penalties in the event of their refusing to obey the order of a Customs officer. could refuse to give a vessel her papers. out them. not enter another port without them, so that the honourable member's argument is ridiculous. done.",19,Quaranti Ne Bill
65,Mr Archer,And at the same time he,20,Quaranti Ne Bill
66,Mr Fisher,He may allow her to,20,Quaranti Ne Bill
67,Mr Kelly,Does not the honourable,20,Quaranti Ne Bill
68,Mr Fisher,The quarantine officer,20,Quaranti Ne Bill
69,Mr Groom,Unde r the regulations an,20,Quaranti Ne Bill
70,Mr Fisher,I s it reasonable to as,20,Quaranti Ne Bill
71,Mr Palm Er (Echuca) [11.7],I fail,20,Quaranti Ne Bill
72,Mr Bamfor D (Herbert) [N.8],I,20,Quaranti Ne Bill
73,Mr Glynn,"He could exempt them,",20,Quaranti Ne Bill
74,Mr Groom (Darling Downs,At,20,Quaranti Ne Bill
75,Mr Liddell (Hunter) [11.12],I,20,Quaranti Ne Bill
76,Mr Fisher,"The Customs Act simply,",20,Quaranti Ne Bill
77,Mr Liddell,The Customs officer,20,Quaranti Ne Bill
78,. Mr Fisher,Sometimes they sail with,20,Quaranti Ne Bill
79,It Is Well Known Mr Liddell,But a vessel could,20,Quaranti Ne Bill
80,Mr Fisher,"Such a thing has beer*""ney-General) [11.13] -The clause itself gives the authority to detain, and we must have such a power. to go into quarantine. vessel is lying could be declared a quarantine station. A vessel might be ordered to go into quarantine, and a quarantine officer has authority to detain her there. Of course, the only way in which a vessel can be detained is by the exercise of the power of the community. The power of detention is clearly given to the quarantine officer under this clause. -MI. LTDDELL .(Hunter) [11.14] Although theoretically we have power to detain a vessel, in reality we have not. A case occurred only the other day, when a ship master, whose vessel it was sought to -detain, simply snapped his fingers and sailed away. on at the next port? granted his papers, and he would have no trouble at the next port, which might be Hong Kong or anywhere else. We cannot simply tie a vessel up with a bit of rope, nor is the naw ahvavs at our disposal for the purpose of enforcing detention. If, in such a case as that cited by the honourable member for Hunter, a ship's captain takes his vessel away, what does it matter? So long as the captain does not trv to land infected goods or passengers, why should we trouble about his sailing away from the port and the Commonwealth? Clause agreed to. Clauses 40 to 45 agreed to. Clause 46When quarantine has been performed by any vessel or persons in accordance with this Act and the regulations, she and they shall forthwith be released from quarantine. think this clause could be improved by the addition of some words. been introduced in order to provide that, if a vessel has performed quarantine at the first port of entry, quarantine will no longer be necessary at subsequent ports of call. I move That the following words be added"" After proof of performance of quarantine, and proper certificate to this effect, vessels shall be liable to no further detention on the same account for which such vessels have performed quarantine."" ney-General) [11.20] I am sorry that I cannot accept the amendment, the words of .which would have an unduly wide effect not desired by the mover. the New South Wales Act. Act deals with a small coast line, whereas the Bill will affect vessels sailing, say, from Port Darwin to Hobart, or from Thursday -Island to Adelaide. Further, the clause applies not only to oversea boats but to Inter-State boats; and the words "" on the same account"" might mean an outbreak of a similar disease. The vessels are subject to quarantine until they have been granted pratique, when they go free. If, however, a disease should break out oni a vessel which has been granted pratique, or there is reason to suspect that disease has broken out, there must be a reserve power of control over her. be liable to quarantine at each port of entry ? break, or reason to suspect an outbreak, of disease. The object of the Bill is to prevent the unnecessary quarantining of vessels at each port. oversea vessel would be liable after she has been released, because she is then no longer an oversea vessel. liable to the same quarantine as Inter-State boats, if disease should break out. the amendment. Amendment, by leave, withdrawn. Clause agreed to. Clauses 47 to 49 agreed to. Clause 50 (Animals or plants to be landed at declared ports) The Bill has When the Treasurer was in charge of the Bill temporarily, I asked him what ports were likely to be declared, and I gathered from him that the Attorney-General would be able to make some declaration on the point. I asked the question because I think there is a misapprehension abroad in regard to this matter. Certain importers of",20,Quaranti Ne Bill
81,Mr Groom (Darling Downs,Attor,21,Quaranti Ne Bill
82,Mr Fisher,What is the power?,21,Quaranti Ne Bill
83,Mr Groom,A vessel may be ordered,21,Quaranti Ne Bill
84,Mr Fisher,The place at which a,21,Quaranti Ne Bill
85,Mr Groom,"That is so, if necessary.",21,Quaranti Ne Bill
86,Mr Salmon,But how would he get,21,Quaranti Ne Bill
87,Mr Liddell,The Customs had.,21,Quaranti Ne Bill
88,Mr Salmon (Laanecoorie) [It.16],,21,Quaranti Ne Bill
89,Mr Liddell (Hunter) [11.18],I,21,Quaranti Ne Bill
90,Mr Groom (Darling Downs,Attor,21,Quaranti Ne Bill
91,Mr Liddell,A similar provision is in,21,Quaranti Ne Bill
92,Mr Groom,The New South Wales,21,Quaranti Ne Bill
93,Mr Liddell,Then a vessel will still,21,Quaranti Ne Bill
94,Mr Groom,Only if there is an out,21,Quaranti Ne Bill
95,Mr Glynn,I do not think that an,21,Quaranti Ne Bill
96,Mr Groom,Such a vessel will be,21,Quaranti Ne Bill
97,Mr Liddell,I ask leave to withdravr,21,Quaranti Ne Bill
98,Mr Kelly (Wentworth) [11.25],"stud stock have the impression that under the Bill the first port of entry will be the "" declared port,"" and as this may be Fremantle, they will have no opportunity to inspect their stock while it is in quarantine. I am convinced that so intelligent-so brilliant-a : Ministry as the present one would not contemplate such extreme action* I only ask the Minister to give a general idea now as to what are likely to be the "" declared ports."" I presume each capital of Australia, at any rate, will be "" declared."" ney-General) [11.26] -It is impossible to sav what may or may not be the specified ports, but I should think that all the existing ports which have been found necessary will be declared, unless for some very strong reason. it may even be necessary to appoint special ports for a time. For instance, as I said yesterday, valuable stock might be consigned to a northern port of Western Australia, or to the Northern Territory, and, instead of requiring them to be brought to one of the ordinary ports of entry, special arrangements might be made for their being landed direct, always providing that they were quarantined and safeguarded. However, these are matters which must be left fo administration. I can promise that every facility will be given for the declaration of necessary ports. absolutely necessary that at the ports of entry every facility in the shape of hospitals, water supply, servants, and so forth should be provided for the treatment of disease. A ship which sails under a charter party must proceed to the port mentioned in the charter, and, further, the policy of insurance makes a similar stipulation. ber not think that a man, before placing goods on board, will ascertain the destination of the ship? in the charter party were Newcastle, and that was a declared port, but was not furnished properly with quarantine requisites, it would be necessary for the quarantine officer there to direct the vessel with its crew and passengers to be taken to Sydney. It would be impossiblefor a vessel, if Newcastle were mentioned in the charter party, to make the first port of call any other port, without violating the terms of the charter, and of the insurance policy. To insure the proper carrying out of the Bill it will be necessary to establish fully equipped administrative offices and hospitals at the -various ports of call. Clause agreed to. Clauses 51 and 52 agreed to. Clause 53(1) A quarantine officer shall make a careful inspection of all imported animals before they are delivered to the importer. (2) If the imported animals are accompanied by a certificate of an approved veterinary surgeon at the port of shipment, certifying that he had examined the animals prior to their shipment, and that they then were in good health and free from disease, and the quarantine officer is satisfied that during the voyage they have not suffered from any disease or been exposed to infection, and were free from disease at the time of landing, and that there is no danger of their introducing any disease, he may, subject to the regulations^ give to the, importer a certificate to I can conceive that that effect, and may allow them to be delivered to the importer without being required to perform quarantine. (3) In all other cases the quarantine officer shall order the animals into quarantine. v Now that the principal clauses have been passed, I join in congratulating the Attorney-General on the manner in which the Bill has run the gauntlet of searching criticism, and on the fact that it has emerged in almost the same form as that in which it was introduced. tion. amendment has been accepted by the Government, but it is more a method of procedure than a real alteration in principle. The question of appointing properly-qualified officers has already been discussed and decided; but I desire to again emphasize the necessity for insuring that at the principal ports of entry, and also in the case of internal areas, the principal officers shall be duly qualified veterinary surgeons. A qualified medical officer has to make the inspection in connection with human beings, and there will be a qualified If the port mentioned entomologist to investigate the diseases of plants; and I hope the same principle wilt be applied in connection with the examination of stock. nev-General) [11.32] I am sure that the Minister ini making any appointments will bear in mind the necessity of selecting thoroughly competent officers. There is no doubt that in Australia generally the position of veterinary surgeons has considerably improved; and in Melbourne there is a proper institution for their training. At the",21,Quaranti Ne Bill
99,Mr Groom (Darling Downs,Attor,22,Quaranti Ne Bill
100,Mr Liddell (Hunter) [11.27],It is,22,Quaranti Ne Bill
101,Mr Groom,Does the honourable mem,22,Quaranti Ne Bill
102,Mr Liddell,,22,Quaranti Ne Bill
103,Mr Sampson O Unmera) [11.30],,22,Quaranti Ne Bill
104,Mr Archer,There is one big altera,22,Quaranti Ne Bill
105,Mr Sampson,I know that an',22,Quaranti Ne Bill
106,Mr Groom (Darling Downs,"Attorsame time, we do not wish to act unjustly towards the existing State officers. I think the assurance has already been given that, inselecting officers for the administration of this measure, the present policy of the Commonwealth will be followed, which is to select the best qualified men who apply. As it has been found necessaryto submit horses and dogs to quarantine in every case, I move That after the word ""animals,"" line 4, the into quarantine any animals declared by words ""other than horses or dogs"" be inserted. proclamation to be subject to quarantine. be subjected to quarantine invariably ? clamation will have to be issued under .They have brought new diseases to Ausclause 55 excluding all animals from the extralia .carried, will not deprive the authorities very dangerous cne. The matter is not one of the power to order camels, or any other which directly affects my constituents; but, animals, into quarantine. T shall consult if I represented a stock-raising constituency, my expert advisers in regard to the honorI should be expected to offer very strenuous able member's suggestion. Representations have been made by the tralia at large are affected. Secretary for Agriculture for New South Wales in regard to this provision. I unpointing out. This is a very dangerous inderstand that some animal diseases take novation. longer to incubate than the time occupied in travelling here from other countries, and, sire to do away with quarantine altogether. therefore, it is necessary to quarantine animals on arrival in Australia, notwithstanding that they may be accompanied that I should call the Minister's attention with certificates stating that they started to the fact that very strong objections to free from disease. The fact that animal this provision are taken by experts. quarantine will be the subject of regulaa report which I have received from the tions does not affect the issue. We should Chief Inspector of Stock in South Austrainsist on a sufficient period of quarantine lia,"" a man of very wide experience, he in every case to determine that imported describes this and one or two other exanimals are not bringing with them any empting provisions as exceedingly dangerdisease. As practically all the-stock that ous. is imported is brought here for stud puras compared with the well thought-out poses, it is not a serious matter to their provisions governing animal quarantine in owners to have themkept in quarantine South Australia, and says that it would for a few weeks; I believe that a period be a calamitous thing for the Statesi f the of forty days is insisted upon by most of administration of quarantine fell into the the States authorities. If any new disease hands of persons who were not qualified affecting animals spread through this counby the possession of intimate knowledge try, it might take years to eradicate it, of all matters affecting the treatment ' of and then only at tremendous expense, or quarantined stock, and of the dangers to it might never be stamped out. and-fast rule that every imported animal officer the power to allow animals to be shall .be quarantined ? that, if imported animals are accompanied much danger if the measure is properly by the certificate of an approved veterinary administered. surgeon at the port of shipment, stating that, on examination prior to shipment, will probablv be given on the day of shipthey were found to be in good health and ment, but disease may incubate after the free from disease, and if the quarantine animals are landed. officer is satisfied that they have not suffered from disease, or been exposed to infection during the voyage, ""and are free from disease at the time of landing, he may allow them to be delivered to the importer without quarantine. in conjunction with clause 55. a quarantine officer may examine and order emption provided for in sub-clause 2 of The amendment, if clause 53. I regard this sVib-clause as"" a opposition to the provision. InH e speaks of the Bill as very crude be apprehended and guarded against. He W ill it not be a hard thinks it dangerous to give to a quarantineimported without quarantine. PersonN o . The clause provides ally, it seems to me that there cannot be",22,Quaranti Ne Bill
107,Mr Salmon,"Should not camels also If what I think necessary is done, a pro",23,Quaranti Ne Bill
108,Mr Groom,,23,Quaranti Ne Bill
109,Mr Kelly,,23,Quaranti Ne Bill
110,Mr Archer,,23,Quaranti Ne Bill
111,Mr Kelly,,23,Quaranti Ne Bill
112,Mr Groom,The clause may be read,23,Quaranti Ne Bill
113,Mr Kelly,C l a u s e 55 provides that,23,Quaranti Ne Bill
114,(Wentworth) [11.34],Mr SAMPSON The interests of Aus,23,Quaranti Ne Bill
115,Mr Kelly,T h a t is what I am,23,Quaranti Ne Bill
116,Mr Salmon,Most stock raiders de,23,Quaranti Ne Bill
117,Mr Archer,That is absolutely wrong.,23,Quaranti Ne Bill
118,Mr Glynn (Angas) [11.40],I think,23,Quaranti Ne Bill
119,Mr Kelly,"The certificate relied uponculty might be met by inserting after the word "" m a y "" some such words as ""after reporting to the chief officer authorized in the State."" an amendment which will meet the honourable member's suggestion. that the officers administering the Act may not all be experts, and .it would not be well to give such men unqualified discretion in this matter. camels recently imported into Western Australia brought with them surra, a most dangerous disease, whose introduction is causing considerable anxiety among the stock owners throughout the Commonwealth. What we have particularly to guard against is the importation of disease from certain countries where diseases exist which, if introduced into Australia, would be disastrous to our stock, industry, and to every branch of commercial life dependent upon it. mention rinderpest and surra. .Before an animal should be allowed to be imported without undergoing quarantine, the presentation of a certificate from approved authorities, certifying chat not only was it not suffering from disease when it left the port of shipment, but that no disease of any of certain kinds enumerated was prevalent in the. country from which it came should be insisted on. place whence stock came, we should regard it as a place from which they should not be imported. of that sort in the Bill, and I certainly think that there should be. It is too big a matter to be left to regulation, and it is of vital concern to the stock industry. I think that there have been cases of rinderpest even in New Guinea. That disease has always been a menace to stock-owners, and no regulation can be too stringent to protect the stock industry of Australia from its importation. wish to point out a very serious inconsistency in this clause. It expressly provides that all imported stock must be accompanied by-.the certificate of a thoroughly qualified veterinary surgeon that they were free from disease at the port of shipment, whereas at the port of entry the power to determine whether they shall be ordered into quarantine is vested in an officer who has: no special qualifications. I think that at least we ought to be prepared to do what we compel other countries to do. In my opinion we should have a thoroughly qualified man at the head of affairs. General) [11.48] I fear that honourable members imagine that this clause confers far wider powers than it is intended to I believe that confer. It was inserted for this reason: New Zealand, to our own knowledge, is absolutely free from a great many of the diseases which affect stock. The same remark is applicable to England, from which country stock are imported. The clause is intended to provide that if stock are imported from those clean areas, and are accompanied by the certificates of a veterinary surgeon at the port of shipment, that they are free from disease, they may be admitted into the Commonwealth without being required to undergo a period of quarantine. But I recognise the force of the contention of the honourable member As instances of such disease I might for Capricornia. I can assure him that the intention of the Government practically coincides with the desire which he has expressed. The power to admit stock' without subjecting them to quarantine was only intended to be exercised in the cases which I have mentioned. I will see if it is not possible to get a clause framed declaring that if imported animals have been shipped from a port which we are satisfied is free from disease We require to be satisfied that the country from which they are imported is free from disease. honourable member that Australia is a large country, and that whilst disease amongst stock might exist in Western Australia, Tasmania might be perfectly free from it. pest may be carried in packages or clothing-indee d in anything. In that way it might be transported. hundreds of miles inland. Mv. GROOM I will have the clause carefully looked into, and see if it is not possible to embody the idea of the honourable member in an amendment. The honourable member for Angas thinks that we shall assume a very serious responsibility if we authorize any officer to permit",23,Quaranti Ne Bill
120,Mr Glynn,I think that the diffi,24,Quaranti Ne Bill
121,Mr Groom,I shall try to have framed,24,Quaranti Ne Bill
122,Mr Glynn,It has been suggested,24,Quaranti Ne Bill
123,Mr Archer (Capricornia) [11.44.],,24,Quaranti Ne Bill
124,Mr Groom,If a disease existed in the,24,Quaranti Ne Bill
125,Mr Archer,There is no provision,24,Quaranti Ne Bill
126,Mr Sampson (Wimmeta) [11.47],I,24,Quaranti Ne Bill
127,Mr Groom (Darling Downs,Attorney,24,Quaranti Ne Bill
128,Mr Archer,That will not be sufficient.,24,Quaranti Ne Bill
129,Mr Groom,I would point out to the,24,Quaranti Ne Bill
