speakerGroups,speaker,theText,pageNumbers,title
0,"And Read Prayers. Terday Served, On The Clerk, Requiring Him To Attend Ori The 27 Th Instant At'the Court Of Petty Sessions, Melbourne, .In Connexion With An Information' Filed Against Robert Murray Smith, And Others, For Permitting The Publication In A Newspaper Which They Own Of An Unsigned Article Contrary To The Electoral Act, And To Produce The Writ Issued On The 6th May For The Election Of A Member To Serve For The Division Of Wer","riwa,' and the letter from the Chief Electoral Officer to me, dated 12th June. If honourable members do not object, the Clerk; or his representative, will attend andproduce the documents required."" ' : $?ause of ftrprrsrntatibes ' Tuesday, 25 June, 1912. -''",14,Setup
1,"Mr Speaker Took The Chair,At 3 P.m.,",,14,Werriwia Election
2,Mr Speaker.^A Subpeena Was.yes,"a Message from His Excellency the Governor General recommending an appropriation for the purposes of the Bill. following papers :Census anil Statistics Act-Regulations Labour and Industrial Statistics (Agents and Correspondents)-Statutory Rules 1912, No. Speech, as read by the Clerk, be agreed to by 116. Agents (Provisional)-Statutory Rules 1912, No. 118. Commerce (Trade Descriptions) Act-Regulation s Address :"" and to inform Your Excellency that Amended (Provisional)Statutory Rules 1911, No. 204. Statutory Rules 191a, No. 53. . Customs Act-Proclamatio n prohibiting the expeace and good order, and to uphold the lavv portation of leather, & c , when for human within the Commonwealth; for its maladminiswear, containing barium. Defence Act Military Forces Regulations for its grossly partisan actions and appointAmended (Provisional)Statutory Rules 19™ , No. .111. Statutory Rules 1912, No. 112. Financial Amended (Provisional)-Statutory Rules ister and Treasurer) [3.6] The very 191a, No. n o . Excise Act-Regulatio n Amended (Provisional) -Statutory Rules 1912, No. 5. Naval Defence Act-Nava l Forces-Regulation s amendment prevented me from having more Amended (Provisional)Statutory Rules 1912, No. 108. Statutory Rules 1912, No. 109. Papua-Ordinanc e of 191a-No. 2-Supplemen support of the charges made by the amend-, tary Appropriation 1911-1912, No. 2. Public Service ActAppointment of W. H . Vincent as Assistant has been longer in prominent political posiEngineer (Electrical), ClassD , Public Works tions and in office than any other member Branch, Department of Home Affairs, Cenof this Chamber, and it could not have tral Staff. Sew Rules 19*12, No. 117. Department of External Affairs-Promotion s me lo determine, but his action has .placed of.. J. A, Carrodus as Clerk, 4th Class. H . C. Elvins to new position of 4th Class which an opponent with ordinary courtesy Clerk. W. L . Smallhorn to new position of 3rd told that we shall hear enough-about our Class Clerk, Northern Territory Branch. nnancial unfitness, and. the' press has Quarantine Act-Regulation s Amended (Provisional)-Statutory Rules 1912, No. 105. -Prime Minister has any communication to make to the House in reference to the '.hitch in the negotiations with the Government of South Australia in connection with ..the granting of land ' for the proposed transcontinental railway. Mr .FISHER -The information we have supports the supposition that an amicable arrangement will be arrived at, but I cannot, while the amendment on the Address-in-Reply remains undisposed of, answer questions relating to policy. Debate resumed from 21st June (vide That the Address-in-Reply to His Excellency's the House. That the follow.ng words be added to the the Government merits the censure of the House and the country for its failure to realize its national and constitutional obligations, for flagrant neglect of its duty to secure industrial tration of public affairs and public departments; ments, and its reckless irresponsibility in the financial affairs of the Commonwealth."" lengthy speech made by the Leader of the Opposition ohFriday in moving his than a few minutes in which to reply to him then. The most remarkable thing about his speech was the absence of statements in ment. The honourable and learned member been from mere inadvertence that he failed Regulation' (Provisional) Statutory to deal with the charges made in the amendment. What his. motives are it is not for me, as Prime Minister, in a difficulty ir» would not have placed me. We have been reiterated its declarations about our extravagance so often that its writers are beginning to believe that they are true, although they .not had the courage to make charges to which replies.could be furnished. week to state all my charges against the. Government. learned member-should have.taken a week.' We would gladly offer him another day before replying, our desire being that the-",14,Werriwia Election
3,Mr Speaker Reported The Receipt Of,,15,Governor General S Speech Address In Reply
4,Quarterly Returns Of House Rents By House U P On Whic H Mr Deakin Had M O V E D,,15,Governor General S Speech Address In Reply
5,Mr Mahon,I wish to know if the,15,Governor General S Speech Address In Reply
6,"Page 107), On Motion By Mr Bennett",,15,Governor General S Speech Address In Reply
7,And' Allowance Regulations Mr Fisher (Wide Bay,Prime Min,15,Governor General S Speech Address In Reply
8,Mr Deakin,I should have needed a,15,Governor General S Speech Address In Reply
9,Mr Fisher,"Then the honourable and.fullest light shall be thrown on our adoperate with the States then, and at any ministration. His position and his abilities future time. As an earnest of what we demand some reply. I shall commence by proposed to do I stated that we had an dealing with his statement that we made open; door. We were prepared to take provision tor a Commonwealth Savings them into partnership; we said that in proBanki n order to embarrass and injure the portion to the capital they subscribed they States by taking business from their savshould share in the profits, and all that we ings banks. The Leader of the Opposition asked for that would be that they should in the Senate has characterized the gentledo their banking business with the Commonman whom we have appointed Governor of wealth Bank as far as practicable. the Commonwealth Bank as not a first-class hanker, a remark which I very much repose to give them any share in the actual gret. stand in the first Kink of bankers in Austhe States exactly the same importance in tralia. to criticise the appointment, seeing that the nor less. appointee is the only one this Government has made who is not an ex-Labour man. from the truth as any could be. The name trol. That is the policy of the Government, of the gentleman appointed to the imporand we could not allow any party to come tant office is Denison Samuel King Miller, into an arrangement of the kind with who was born on the 8th March, i860, at greater power than we have had ourselves Fairy Meadow, near Wollongong, in New and interfere. South Wales. On the 19th August, 1876, he was a probationer in the Bank of New sult the States before you passed the meaSouth Wales, at Deniliquin; on the ist sure ? April, 1882, he was a clerk at the head office, in Sydney; on the 27th August, 1895, member say now that the appointee of a he was an accountant at the head office; State was to have equal power with the on the 28th November, 1900, he was assisGovernor of the bank ? tant to the general manager; on the ist January, 1907, he was general manager's inspector; on the ist January, 1909, he tion of what the honourable member has just was metropolitan inspector, and on the ist said. June, 1912,he became Governor of the Commonwealth Bank of Australia. That, should restrain himself. I think, will speak for itself, regarding the standing of the gentleman who occupies ing about the matter. this high position. the honourable member's statement prove? made regarding the Commonwealth Bank trol of the Commonwealth Bank absolutely by the Leader of the Opposition had refree from political interference. We could ference, not so much to the question of thenot allow the State Governments to have bank itself, as to the question of the Savlarger powers than those possessed by the ings Bank management, and the action of Commonwealth Parliament and Government the Government in regard to it. What was under the Act. Therefore we did not proour action regarding the Savings Bank propose that the States should have control, alposal ? We stated, as a matter of policy, though we went so f a r as to suggest that as we have always told the people from there might be boards of discussion which the platform, that a Commonwealth Bank, could advise, with the power left in the without a Savings Bank, would be an hands of the Governor to veto their proanomaly. When both banks were provided posals if he thought it desirable. for in the one measure a discussion arose in this House and I stated, on behalf of is the point. Then they were not to have the Government, that we were ready to coan equal voice in the management? M . JOSEPH COOK -But you'did not procontrol. the management as the Commonwealth GoT h a t statement is as far placed absolutely outside of political contacked wherever we can be attacked. The",15,Governor General S Speech Address In Reply
10,Mr Atkinson,He said that he did not,16,Governor General S Speech Address In Reply
11,,"Mr KEX-LV -In any case it seems unfair vernment itself would have, neither more",16,Governor General S Speech Address In Reply
12,Mr Fisher,,16,Governor General S Speech Address In Reply
13,Mr Joseph Cook,"Yes; but what does to interjections, because w-e desire to be at",16,Governor General S Speech Address In Reply
14,Mr Fisher,The charge which was Government passed an Act making the con,16,Governor General S Speech Address In Reply
15,Mr Fisher,We proposed to give Fo,16,Governor General S Speech Address In Reply
16,Mr Joseph Cook,The final decision?,16,Governor General S Speech Address In Reply
17,Mr Fisher,T h a t matter has been,16,Governor General S Speech Address In Reply
18,Mr Atkinson,Why did you not con,16,Governor General S Speech Address In Reply
19,Mr Joseph Cook,Does the honourable,16,Governor General S Speech Address In Reply
20,Mr Fisher,"No , not at any time.",16,Governor General S Speech Address In Reply
21,Mr Joseph Cook,That is a contradic,16,Governor General S Speech Address In Reply
22,Mr Fisher,The honourable member,16,Governor General S Speech Address In Reply
23,Mr Joseph Cook,There is no restrain,16,Governor General S Speech Address In Reply
24,Mr Fisher,1 am rather favorable,16,Governor General S Speech Address In Reply
25,Mr Joseph Cook,"Hear, hear! Thatthe Premiers' Conference in Melbourne was concise, and, I think, easily understood. It was submitted in these wordsThe States to become partners with the Commonwealth in the Commonwealth Bank(a) by supplying portion of the capital, not exceeding one h a l f ; (A) by each State becoming responsible for the liabilities of the Bank in proportion to the capital subscribed by it ; (c) by -each State sharing the profits in procent, of the new money available for investportion to capital subscribed by it . Each State to use the Bank as far as practicable as its banker. The Commonwealth Bank to take over the Savings Bank of each State, whether Government or Trustee, as a going concern. After the Commonwealth Bank has taken over the business of the State Savings Bank, the State Government to have first call on any amount which it repays to the Savings Bank in redemption of loans existing when the Bank was taken over; also, to have first call on three-quarters of tbe amount of deposits in the State available for investment. Yet, after that proposal being submitted to the Premiers, we have the Leader of the Opposition stating that the States have been dealt with unfairly so far as the Savings Banks are concerned. to be-for one year or for ten years? time. honourable member reads his calendar is different from the way in which I do. "" All t i m e "" meant as long as they wished to have it . They were to have it absolutely for as long as they wished to keep it . That was the proposal made to the States. this proposal for all time-thi s Government ? tical control in the management of this lutely as to that, but there is every indibank after all. able member has been in dreamland. A t us notice that they did not desire to conthat time there was no Governor of the bank tinue the use of our post-office premises appointed, and we were free to negotiate. after a certain date. The Queensland GoWe did negotiate, and the Government were vernment followed suit, with the result that condemned for taking too long in trying to these Governments have absolutely freed us make an arrangement. It was said, "" Why from any responsibility in the matter. I do you not appoint your Governor; why do not think that I need dwell any further do you not do this thing, that thing, on that point. and the other t h in g ? "" Hie Governor was appointed under the vernment declined their alternative offer. Act the Governor had command of this concern, and we were not free then, tive offer? The proposal made to without coming to Parliament, to make an arrangement with the States. Unfortunately the States did not weigh the proposal which we submitted to them. In my opinion, the proposal was altogether too broad if you were dealing with it as a practical proposition; so broad indeed that it gave to the Statesf u l l control for all time of the Savings Bank money there was at the time. It gave them first call on 75 per ment afterwards, and an equal chance with everybody else for the balance of the money available for investment. Could anything more generous than that have been placed before the Premiers? Yeti t was turned down as though it was an attempt on the part of the Commonwealth Government to aggrandize themselves at the expense of the State enterprises. mitted after the passing of the Act? to the Premiers' Conference in January last in furtherance of a promise made in this House, clearly set out again and again, by myself; and if there is any point in what the honourable member says, it is that we should have fdlt ourselves incapable of F o r all time. carrying that out. conferred with the States before passing The way in which the the Act. to tell the House that all the State Governments were not against accepting these terms, but up to the time of the appointment of the Governor of the bank we were unable to bring about an agreement with who offered them all, and there the matter stands. Treasurer would not accept your terms if you gave him the lot. cation that the statement is correct, because",16,Governor General S Speech Address In Reply
26,Mr Fisher,,17,Governor General S Speech Address In Reply
27,Mr Fairbairn,Fo r how long was that,17,Governor General S Speech Address In Reply
28,Mr Fisher,,17,Governor General S Speech Address In Reply
29,Mr Fairbairn,That,17,Governor General S Speech Address In Reply
30,Mr Fisher,,17,Governor General S Speech Address In Reply
31,Mr Joseph Cook,But,17,Governor General S Speech Address In Reply
32,Mr Fisher,They d i d .,17,Governor General S Speech Address In Reply
33,Mr Joseph Cook,Then there is poli,17,Governor General S Speech Address In Reply
34,Mr Fisher,Apparentl y the honorthe Victorian Government immediately gave,17,Governor General S Speech Address In Reply
35,Mr Gordon,Was not that offer sub,17,Governor General S Speech Address In Reply
36,Mr Fisher,Yes. It was submitted,17,Governor General S Speech Address In Reply
37,Means For No Mr Gordon,Likewis e you should have,17,Governor General S Speech Address In Reply
38,Mr Fisher,I am glad to be able,17,Governor General S Speech Address In Reply
39,Mr Parker Moloney,The Victorian,17,Governor General S Speech Address In Reply
40,Mr Fisher,I cannot speak abso,17,Governor General S Speech Address In Reply
41,As Soon As Mr Deakin,The Commonwealth Go,17,Governor General S Speech Address In Reply
42,Mr Fisher,"What was their alternawasThat in consideration of the Commonwealth country lands? Hank refraining from entering into savings bank business, the States agree to provide on loan to given cover both city and country lands. the Commonwealth Bank, on terms to be arranged, a monthly amount equal to 25 per I shall be prepared to give honourable memcent, of the increase in the excess of deposits bers opposite all the information they ask over withdrawals in the States' Savings Banks. gentleman approve of that? agree to that. I ask the honourable gentleready said so. The complaint made on man whether he approves of it. sider it. matter dealt with by the honourable gentlethousands, of estates that have been broken man. He referred to the failure of the up as the result of our land tax legislation. Land Tax Act to give effect to the policy of this Government. Honourable gentlemen member will give the Prime Minister a list opposite, as honourable members will rememof those estates. ber, told us that the land tax would bring in a revenue amounting to from ^3,000,000 have contended that the Act did not operate to ,£5,000,000. As a matter of fact, it at all in the way we said it would, and brought in a revenue,of something less than yet it is now estimated that the revenue J£I,500,000. This year the estimated refrom the tax will be reduced. venue from the land tax is even less than that amount, and that is a clear indication sioner's return shows the number of large that it is having the effect we desire. Land estates has been reduced by 1,000, and is being cut up into smaller areas and, as that they have been broken up into 19,000 we hoped, large estates are being broken up. I have a report from the Land Tax small farms. Commissioner, in which he says that in his opinion not less than ,£18,000,000 worth members opposite were not disappointed beof land has been broken up and sold. showing that sales and purchases of taxable hands. land had been effected between the 1st October, 1910, and 30th June, 1911, to a total value of ^18,188,293. b g city properties? : as I have just said. orable gentleman lay that return on the the tax being reduced? table, with a description of the land? supply all other information asked for by year will be less than it was last year. honourable members during this debate I pass from that matter to deal again very if it' is possible for us to do so. available as to the number of new settlers orable members should know how the money 011 the land? Tax Commissioner is not in posesssion of withstanding the opposition to it, and the that information. That is quite another fact that honourable members opposite sugmatter. man any figures showing the subdivision of for. tleman has referred only to sales of land, the other side was that our legislation has : ber for Bourke informs me that he knows, cause the Land Tax has been operative. I have stated some facts from a return I am hoping to get, and I shall lay it on gentleman suggest that the Land Tax Comirrelevant. briefly with what was said about the Aushas been invested. The Australian Notes gested that it was dangerous legislation.",17,Governor General S Speech Address In Reply
43,Mr Deakin,The main article of it,18,Governor General S Speech Address In Reply
44,Mr Fisher,Does the honourable,18,Governor General S Speech Address In Reply
45,Mr Deakin,I ask the Prime Minister. and they are always going on.,18,Governor General S Speech Address In Reply
46,Mr Fisher,We were unable to,18,Governor General S Speech Address In Reply
47,Mr Deakin,I should require to conhad no such effect. The honourable mem,18,Governor General S Speech Address In Reply
48,Mr Fisher,"I pass now to another not only of hundreds, but. he believes, of",18,Governor General S Speech Address In Reply
49,Mr Anstey,Within nine months.,18,Governor General S Speech Address In Reply
50,Mr Fisher,Yes. There is a return the table immediately it comes into my,18,Governor General S Speech Address In Reply
51,Mr Groom,Does that include sales of missioner would withhold any information ?,18,Governor General S Speech Address In Reply
52,Mr Fisher,It covers taxable land honourable gentleman has quoted is almost,18,Governor General S Speech Address In Reply
53,Mr Richard Foster,Will the hon,18,Governor General S Speech Address In Reply
54,Mr Fisher,"Certainly , and we shall revenue to be derived from the tax this",18,Governor General S Speech Address In Reply
55,Mr Sampson,I s there any statement tralian note issue. It is as well that hon,18,Governor General S Speech Address In Reply
56,Mr Fisher,"Obviously , the Land Act has been singularly successful, not",18,Governor General S Speech Address In Reply
57,Mr Groom,Has the honourable gentle,18,Governor General S Speech Address In Reply
58,Mr Fisher,The figures I have,18,Governor General S Speech Address In Reply
59,Sir John Forrest,The honourable gen,18,Governor General S Speech Address In Reply
60,Mr Fisher,Exactly. I have al,18,Governor General S Speech Address In Reply
61,Mr Groom,Perhaps the honourable,18,Governor General S Speech Address In Reply
62,Mr Fisher,Our honourable friends,18,Governor General S Speech Address In Reply
63,Mr Anstey,The Land Tax Commis,18,Governor General S Speech Address In Reply
64,Mr Fisher,I hope that honourable,18,Governor General S Speech Address In Reply
65,Mr Deakin,That is what we want.,18,Governor General S Speech Address In Reply
66,Mr Fisher,Does the honourable,18,Governor General S Speech Address In Reply
67,Mr Deakin,No; but that what the,18,Governor General S Speech Address In Reply
68,Sir John Forrest,I s the amount of,18,Governor General S Speech Address In Reply
69,Mr Fisher,"It is estimated that thethe Opposition generally. The Opposition press, and some people who claimed to be financiers, have condemned it, and we are promised more of this condemnation. An honourable member sitting behind the right honourable member for Swan has promised to tell us more about the unsoundness' of that legislation. The point I wish to emphasize is that the basic principle of our note-issue is that neither the banks nor private persons are asked to bring their gold to the Treasury and accept notes instead of it. If they prefer to have the notes they can bring their gold to the Treasury and get them, and if at any time they want gold they can bring their notes back to the Treasury and get gold for them. They have perfect freedom in the matter. It is true that the notes are legal tender as between person and person, except in the case of the Treasurer, who must pay in gold. There is, therefore, absolute security to all who hold our notes. We have to remember also the great convenience it is to have an Australian currency passing, between State and State without any charge for exchange, and that it also provides for greater safety. do when the gold is exhausted? hausted, because, as the honourable member for Indi pointed out the other night, if half-a-dozen lorry-loads are taken away by the banks we can bring the gold back again by calling in our accounts and balances, which in many instances are at very short date. lorries could be filled up. lorry loads were required? with eighty lorries f u l l of gold. not got that quantity of gold. interjection of the honourable member has disclosed the crux of what he conceives to be a danger, namely, the probability that the banks and the people will all demand gold for their notes at the same time. I will not speak for the great financiers on the Opposition side of the House, but I will spealc for the electors who vote for the Labour party, and I say that they will never be so insane. fidence in their own country, and ' in a principle which is sound, although it may be new to my honourable friends, and in It was suggested^ by no circumstances will they do what has been done in other places, make an unreasonable demand on the Treasuryf b r the sake of precipitating a financial crisis. I go so far as to say what I recently said on the platform in the electorate of Werriwa, that the banks are too intelligent and too careful of their own interests to make a raid on the Treasury, because such an act would undoubtedly recoil upon themselves. Buti f they did make a disloyal attack on the Treasury we could meet it, and afterwards they would require to be dealt with as people should be dealt with who endeavoured to do an injury to the community. ThenI would ask, "" Where has this money been invested?"" It has been invested with the banks themselves and with the States. When we hear the chatterI ought not to say "" chatter "" perhapswe have taken moneys from the States which we are using. for Commonwealth work. What have we done? In the first place we advanced New South Wales£ 1 , 0 0 0 , 0 0 0 and Victoria ^980,000. Western Australia received ,£650,000, and Tasmania ,£500,000. Then by way of fixed deposit New South Wales received anI t cannot become exother ,£1,000,000 ; Queensland, . £ 7 3 0 , 0 0 0 ; the banks in Melbourne, ,£200,000 ; the banks in Brisbane, , £ 2 0 0 , 0 0 0 ; and the banks in Launceston, ,£25,000. The balance on current account is .£19,215 4s. 6d., the total note issue being ,£9,494,043, against a gold reserve of A t any rate, the first forty £4,305,107. to take those notes because they would lie liable to a 10 per cent, tax if they did member that that is not so. The banks O h , yes we have. The are liable to no tax at all. monwealth notes, they must use their own notes, and if they use their own they are liable to a tax. the subject. The honourable member says that each bank must have its own notes. They have coneither its own notes or Commonwealth notes, and if it uses its own notes it must pay a tax of 10 per cent.",18,Governor General S Speech Address In Reply
70,Sir John Forrest,Who said so?,19,Governor General S Speech Address In Reply
71,Mr Fisher ',,19,Governor General S Speech Address In Reply
