speakerGroups,speaker,theText,pageNumbers,title
143,Mr Roberts,"And on a very liberalthe power of a Parliament to decide that a solicitor may charge 6s. 8d. for giving a little advice, and 3s. 4d. for reading a letter, it should be an easy matter for a Parliament to decide what are fair rates of wages to be paid in certain industries. passed the measure I have named, fixing the rates of wages to be paid in the sugar industry u n t i l such time as they should be altered by an award made under the State Industrial PeaceA c t . Act, the Sugar Cultivation Act of 1913, was passed providing what persons may be employed in the sugar industry. Cert a in persons are prohibited from growing cane, and certain others are not to be employed, but there is not a single word in the Act which complies with the request of the ex-Prime Minister that Japanese, Chinese, and Hindoos shall be excluded. TheA c t lays it down that unless a man can pass a dictation test of about fifty words, he is not to get a certificate; but administration depends very largely on a Government which was in favour of the. employment of coloured labour in the industry. same test as for admission into Australia ? to deal with the statements of the Treawith the request of the ex-Prime Minister Affairs. to Mr Denham, which was that coloured labour should be kept out of the industry. was much surprised to hear the Leader of According to a telegram that. I received the Opposition claim the production of the other day, coloured labour is certainly sugar as a primary industry, which it is not being excluded from the industry in the duty of this Parliament to encourage; the Bundaberg district, because, at Pemotherwise I do not understand the action berfcon, six coloured men are employed of the honourable member for Capricornia. there as carriers, and between twenty and If the history of the sugar industry, as ret h i r t y other Asiatics are scattered over lated to us to-night, shows anything at the district. In all probability, there are all, it is that, whatever class of industry it more Asiatics employed further north belongs to, it is not a primary industry in than in the Bundaberg district. The honthe sense that it is able to depend on it orable member for Yarra, when Minister self. Furthermore, what we have heard of Trade and Customs, before proclaiming shows that the action of the Labour party the repeal of the Acts, would have asked in this Parliament has been very detrithe Queensland Government what had mental to the interests of Australia as * been done to carry out the promise made whole. The Leader of the Opposition by Mr Denham; and that request would says that years ago the Labour party were have been altogether apart from the atinstrumental in introducing this legislatention that the ex-Minister would have tion. I , for one, take pride in the fact given to the quantity of sugar which was that, along with others-and notably the in bond at the time, and which would honourable member for AngasI opposed escape duty if the proclamation went the legislation; and it would be very in forth before the duty was collected. I structive to compare the prophecies then notice that an attempt has been made by made by honourable members opposite the supporters of the Government to put with the prophecies made by honourable the blame on fhe Labour Government and members on this side. A f t e r nearly eleven If it is in party for not introducing a certain clause into the sugar legislation j but that cannot save the present Government from the charge of blundering. The attempt to fasten the term "" in c a p a c it y "" on the ex-Minister of Trade and Customs will not shield the present Minister from the great The Queensland Parliament blunder he committed in allowing the loss of revenue, variously estimated from £150,000 upwards. mit that they do not know, how much the Another loss is. tained. not have any great difficulty in finding out the amount of duty which ought to be paid, but there will be great difficulty-if they succeed, as I suppose they may, in passing retrospective legislation-in ascertaining how much was grown by white labour, and how much by black-ho w much sugar ought to escape the bounty. I hope that the Minister of Trade and Customs may get out of his difficulty^ but he will certainly have some trouble if the millers refuse, as they apparently are refusing, to consent to the refiners paying the Excise that is due on the sugar. I I s that not the shall avail myself of another opportunity",27,Advantage Expected Carried The Company Is Apparently
144,Mr Higgs,Quite so.,28,Advantage Expected Carried The Company Is Apparently
145,Mr Mcwilliams,,28,Advantage Expected Carried The Company Is Apparently
146,Mr Higgs,That has nothing to do surer regarding' the Department of Home,28,Advantage Expected Carried The Company Is Apparently
147,Mr Mcdonald,The Government ad,28,Advantage Expected Carried The Company Is Apparently
148,Mr Tudor,I think it could be ascer,28,Advantage Expected Carried The Company Is Apparently
149,Mr Higgs,The Government may,28,Advantage Expected Carried The Company Is Apparently
150,Mr Conroy (Werriwa) [4.55],"Iyears we find that this industry has cost the Commonwealth over £14,000,000, while the total production, in addition to what it has cost the owners of the sugar lands, has been only £11,000,000. Manifestly, there has been a loss of nearly £4,000,000 of money, but, as some of this has gone into the Treasury, and has been expended for general purposes, we may take it that the cost to the community, in order to keep going a business that is not suitable to Australia, has been £10,000,000. In fact, the more we go into the matter the more we realize that this is what might be termed a blacklabour industry. sugar industry? ent result there might have been had this £10,000,000 been used in a different way-if it had been lent to young men willing to start wheat production on the share system. For each of such young men, £300 would have been quite sufficient, and we know that every sugar producer is costing a great deal more. On the average, those to whom this money could have been advanced would' have been able to repay it in about three years. In the first three years, with an advance of £1,000,000 , employment would have been given to 10,000 men in share-farming, and those men would have become the backbone of the country. In the second three, with the advance of another £1,000,000, and re-lending out of the first million, employment would have been given to 20,000 more, and in the third three years to 40,000 more. MrJ . H . CATTS -With whom would they have shared ? with whom they would have shared; they would have probably shared with themselves or with their fathers; at any rate, they would have had capital to start on their own account. MrJ . H . CATTS -Should we finance the squatters on half-share terms? finance a single squatter, but to finance the sons of farmers, who are directly concerned in the primary industries. Under such a plan as I have indicated, we should, at the end of ten years, have given employment to 70,000 farmers, who would have been returning the money advanced, and not costing the country a penny. The money would then have been available to advance to others. munity making a living by taking in each other's washing. would have had to sell their products in the markets of the world against the competition of the world. Theirs is a real primary industry; and if it were not for the primary industries no secondary industry could exist. would apply to any other industry. way. My point is that another class of men would have been put on that land. By granting them assistance in the same manner in which we have built up the sugar industry, and at practically the same cost, we could have placed 70,000 young farmers on the land working on shares, who would all be of great benefit to the countryj earning something for themselves over and above the cost of production. able member say that they could grow wheat on the sugar country? the sugar industry passing out. Take poultry and eggs; they return three and three quarter millions, nearly three times the value of the sugar production. The average area under sugar is 140,000 acres, and we contribute £ 7 per acre to keep that land under cultivation, though I have been told this land is the richest land in Australia, or, some say, in the world. If we have to contribute £ 7 per acre to keep rich land in cultivation, then the more rich land we have the worse off we are. We ask the man on poor land to contribute to the owner of the rich land. B ut this is the monstrous proposition that is assented to by Parliament, that the richer the land is the less it is able to support itself, and the greater the contribution demanded from the man on poor land in order that the rich land may be held under cultivation. at this juncture ? pointing out what it costs the community to grow sugar cane. Much has been said about the repeal of the Excise and",28,Advantage Expected Carried The Company Is Apparently
151,Mr Austin,,29,Chapman What The Try That Has Been Built Up I N The Same
152,Mr Conroy,Yes.,29,Chapman What The Try That Has Been Built Up I N The Same
153,Mr Austin Chapman,Nonsense!,29,Chapman What The Try That Has Been Built Up I N The Same
154,Mr Conroy,Think what a differ,29,Chapman What The Try That Has Been Built Up I N The Same
155,Mr Conroy,It does not matter,29,Chapman What The Try That Has Been Built Up I N The Same
156,Mr Conroy,It is not proposed to,29,Chapman What The Try That Has Been Built Up I N The Same
157,Mr Lairdsmith,It is like a com,29,Chapman What The Try That Has Been Built Up I N The Same
158,Mr Conroy,Such producers,29,Chapman What The Try That Has Been Built Up I N The Same
159,Mr Sampson,The same argument,29,Chapman What The Try That Has Been Built Up I N The Same
160,Mr Conroy,It must be an indus,29,Chapman What The Try That Has Been Built Up I N The Same
161,Mr Laird Smith,Does the honor,29,Chapman What The Try That Has Been Built Up I N The Same
162,Mr Conroy,I am talking about,29,Chapman What The Try That Has Been Built Up I N The Same
163,Mr Page,Why raise the fiscal issue,29,Chapman What The Try That Has Been Built Up I N The Same
164,Mr Conroy,"I am engaged inBounty Acts, but both of them should have been repealed long before this, and undoubtedly the sugar duty has been the great hindrance to fruit-growers and jam-makers, preventing considerable employment in these industries. In sugar cane growing we are attempting to carry on a black or yellow or brown man's industry, and the Leader of the Opposition is unable to say how any fresh trade can be carried on unless there is new machinery introduced. port sugar for jam-making, they get a f u l l drawback from the Customs. applies when the jam is exported. per ton on jam and other fruits put into food of that nature. mention this, but if the honourable member went into this matter he could obtain evidence from the very best men engaged in the business. North Sydney, Mr G. B . Edwards, speaking from his experience as manager of a large jam manufacturing concern, pointed out what a serious hindrance the duty on sugar was to the jam manufacturing trade. My point is that we have 140,000 acres under cultivation, and we have collected the money for its cultivation from other people not engaged in the growing of sugar. does not cease. We find roughly that it has cost the Commonwealth Parliament £10,000,000, which could have been used in other directions. If we were anxious to encourage people on the land, we could have made an advance of £300 to every share farmer, allowing three years for repayment, as is usually done, and thus we could have had 70,000 young fellows employed on the land developing it , and engaged in a primary industry that would return a great deal to the country over the cost of production. ago. lutely right then, when the honourable member agreed with me on so many occasions. of my ways. bananas. the point of view of cost, apart altogether from Free Trade and Protection. I have shown that, in poultry and eggs, we produce three times the value of the sugar output, and that is an industry conducted on the poorer lands of the Commonwealth. From this time forward, the sugar industry will depend upon the Tariff only. The production may be 190,000 tons, but the people of the Commonwealth will still pay not less than a million pounds sterling, which is, no doubt, to be a continuing payment. In an ordinary business concern, people may consider the advisability of advancing a million or two to get a return of £10,000,000, but we have a definite statement from the Leader of the Opposition that there is no hope for the sugar industry, except with the introduction of new machinery. Are we to call on the poorest citizens fo pay for machinery for this industry? I merely incidentally MrJ . H . CATTS -What do you suggest? should abolish all the duty except what The late member for may be required to provide revenue for expenditure in other directions. MrJ . H . CATTS -You would abolish the industry? had so many years in which to establish itself, and it is still not self-supporting, clearly we are paying too much for the whistle. The competition apply to all industries. is very valuable, and then another honourable member says that it is so rich that the growers cannot live on it . If that be so, this House assents to the proposition that 140,000 acres of land in Queensland, which is some of the richest agricultural land in the world, requires a contribution of £ 7 per acre from people living on poorer land, and people who have no land at all to keep it in cultivation. Surely folly could not further go. honourable member's remarks place the Prime Ministeri n an awkward predicaI t shows I was absoment. Labour party have never grasped the situation. They could never have had any I have since seen the error idea of the true position, or surely they would not have permitted such a state of affairs to continue. Thati t has continued We should look at this from for so long is very much to the blame of all Governments of the Commonwealth. I hope that this Parliament w ill look at the",29,Chapman What The Try That Has Been Built Up I N The Same
165,Mr Fisher,If the jam-makers im,30,Chapman What The Try That Has Been Built Up I N The Same
166,Mr Conroy,The drawback only,30,Chapman What The Try That Has Been Built Up I N The Same
167,Mr Fisher,There is duty of £ 1 4,30,Chapman What The Try That Has Been Built Up I N The Same
168,Mr Conroy,,30,Chapman What The Try That Has Been Built Up I N The Same
169,Mr Page,You told us this ten years,30,Chapman What The Try That Has Been Built Up I N The Same
170,Mr Conroy,,30,Chapman What The Try That Has Been Built Up I N The Same
171,Mr Page,,30,Chapman What The Try That Has Been Built Up I N The Same
172,Mr Conroy,Only in the matter of,30,Chapman What The Try That Has Been Built Up I N The Same
173,Mr Conroy,I suggest that we,30,Chapman What The Try That Has Been Built Up I N The Same
174,Mr Conroy,Possibly; but as it has,30,Chapman What The Try That Has Been Built Up I N The Same
175,Mr Roberts,You r remarks would,30,Chapman What The Try That Has Been Built Up I N The Same
176,Mr Conroy,We are told this land,30,Chapman What The Try That Has Been Built Up I N The Same
177,Mr Roberts,I am afraid that the,30,Chapman What The Try That Has Been Built Up I N The Same
178,Mr Conroy,"They show that the matter from a common-sense point of that it would not make the slightest d if view, and will not t r y to further enference to the value of the lands in the courage what seems to be a black-labour Richmond River district whether they were industry. I have heard the scale of wages used for growing sugar-cane or not. Do not read out, and it appears that it has honourable members know that the value been absolutely necessary to pass an Act of those lands is determined, not by the of Parliament to enable men to receive artificial sugar returns from them, but by 8s. a day in harvest time in the sugar the genuine returns produced by their districts. Hearing that, I was astounded occupation for other purposes ? We might to find that it was thought necessary to have the lands in these districts occupied still continue a bonus to preserve such an by men whose industry would be an abindustry. If the sugar industry cannot solute gain to the country, but we have pay better wages, except under compulby a high Tariff, and the payment of sion, than that to those employed bounties, diverted their industry into an in carrying it on, it ought to be unprofitable channel. abolished altogether. Honourable members opposite have frequently said that desires that these lands should be turned -an industry which cannot pay proper into poultry farms? wages should be abolished. The yearly sum which we are called upon to contristead of to an unproductive, industry. bute to the up-keep of this industry, We should have in the occupation of these would pay the wages of every one emlands substantial farmers, who would be ployed in sugar cultivation a dozen times a gain to the community, men who would -over. If honourable members opposite are be able to pay their share of the taxation -content that the money of the Commonof the country, instead of men who must wealth should be dissipated in this call upon other sections of the community fashion, what becomes of their claim that to help them; upon persons who are not 'their object is to help the poorer citizens owners of rich land, but of poor land, -of the community? We are casting unand upon every infant in the community. f a ir burdens upon them, and I am as I did hope that after ten years' experitonished that honourable members do not ence of this method of dealing with the see that it is the duty of Parliament to sugar industry Parliament would have look at this matter in that way. From been willing to retrace its steps, but I the point of view of defence, will any find that, as in times past, the interests honourable member contend that by the exof a small section of the community, propenditure of £1,000,000 we could not provided that it be a fighting section, previde a better defence than could be put vails over the interests of a larger numup by the 3,000 or 4,000 small farmers ber of people who are unable to fight for engaged in this industry? the industry all along the coast, even to this House, even from the members of the the north of Cairns. able member has reminded me of that, because I wish to tell him that if we The honourable member for North Sydney passed a law prohibiting the growing of tried to fasten on this side of the House a single stick of sugar-cane on these a charge that they have maligned the lands, they would still, as far as Maryland-owners of Australia by reason of borough, remain of the same value, and some action taken by the ex-Minister of be worth from £ 2 5 to £ 3 0 per acre. they grow on the land? upon it , and might feed two head of orable gentleman wil l be found quite capcattle per acre upon it , as they are now able of giving an explanation which will doing in the Richmond River district. I am be satisfactory, not only to honourable satisfied that these lands as far north as members, but to the whole of the people Maryborough would be placed under some of Australia. A f t e r suggesting that we sort of cultivation. 'Every one must see had insulted the land-owners, and did themselves, and who do not appear to party terming itself a Labour party on the opposite side. Home Affairsi n connection with the conduct of the recent elections. I want to O ' MALLEY W h a t could say at once that I do not know what order was issued by the ex-Minister of",30,Chapman What The Try That Has Been Built Up I N The Same
179,Mr Higgs,Farmers are engaged in have the representation they deserve in,31,Chapman What The Try That Has Been Built Up I N The Same
180,Mr Conroy,I am glad the honor,31,Chapman What The Try That Has Been Built Up I N The Same
181,Mr King,,31,Chapman What The Try That Has Been Built Up I N The Same
182,Mr Conroy,"They could grow grass Home Affairs, but I believe that the hon",31,Chapman What The Try That Has Been Built Up I N The Same
183,Mr Higgs,The honourable member,31,Chapman What The Try That Has Been Built Up I N The Same
184,Mr Conroy,"To any productive, in",31,Chapman What The Try That Has Been Built Up I N The Same
185,Mr Charlton (Hunter) [5.9],"little honour to this National Parliament, the honourable member for North Sydney, almost in the same breath, grossly in sulted every elector who voted for honourable members sitting on this side. He practically designated all who supported honourable members on this side as spielers and loafers. which ill becomes any member of this Parliament. are concerned, I confidently assert that, upon inquiry, it will be found that, in proportion to their numbers, the number of land-owners who occupied positions in polling booths throughout Australia in connection with the recent elections will compare very favourably with the numbers appointed to such positions from other sections of the community. understand that the order issued by the ex-Minister of Home Affairs did not in any way refer to small land-owners. referred to the big squatters. big squatters and farmers in a large way, for reasons which, no doubt, were held to be sufficient by the honourable gentleman. I should like to say that, so far as honourable members on this side are concerned, they have always endeavoured to deal out even-handed justice to the farmers, as well as to other people in Australia. In the Parliament of New South Wales, as well as in the Federal Parliament, I have represented districts in which there are a great many farmers. that the Labour party is the political party that looks best after their interests, and we consequently get a very large measure of support from them. It would be well if the honourable member for North Sydney were more careful in the statements he makes in this House, and did not endeavour to fasten a stigma upon this side, while at the same time insulting every elector in Australia of a different way of thinking from himself. The honourable member for Werriwa takes exception to the amount of money expended in connection with the sugar industry. The honourable member is of opinion that it would be far better for the Commonwealth, instead of fostering that industry and encouraging the production of sugar by white labour, to expend the money in some other direction, and preferably by inducing people to take up land on the share-farming system. First of all, we would require to find the lane? on which to settle the 70,000 farmers the honourable member spoke about. But, apart from that difficulty, I venture to assert that the legislation enacted by the Commonwealth Parliament some years ago to deal with the sugar industry has That is language rendered a splendid service to Australia. The honourable member for Werriwa preSo far as the land-owners tended that the industry is fit only for black labour, and I may take it from his remarks that he is an advocate of black labour, so far as sugar growing in Queensland is concerned. This Parliament in its wisdom took the view that the industry could be carried on by white labour, and it has been abundantly proved that Parliament was right in taking that view. IA t the time when this legislation was brought in we had something like 10,000 Kanakas producing sugar in Queensland. To-day there are considerably fewer than He a r , hear! It 1,000. In place of the Kanakas we have white men working in the sugar fields. We have a population of nearly 40,000 It referred to the supported by the production of sugar. In addition to that, we are told by the Queensland Government that there is room for still greater settlement in the sugar-growing districts. There are large areas of land available for people desirous of taking it up for sugar production, so that within the near future we can look forward to becoming self-supporting in this respect. Yet the honourable member who has preceded me advocates that we should repeal the duty on sugar and allow Very many of them realize it to come in free. What would that mean 1 It would mean that sugar production in Queensland and on the Richmond River would be a thing of the past. It would not be possible for the farmers there to compete with sugar imported from abroad. Consequently, the Commonwealth would lose, because, after a l l , we all know that every inhabitant of the Commonwealth is a source of wealth, and, if we shut up avenues of support for 40,000 people in an industry that is capable of being extended to support as many more, it will certainly be a bad thing for an Australian Legislature to do. The honourable member's argument is purely a Free Trade one from start to finish, and if applied to any other industry would have equally injurious results. In fact, it would mean paralyzing hundreds of industries in Australia, and we should lose a considerable part of our population. It is only by fostering our own industries",31,Chapman What The Try That Has Been Built Up I N The Same
186,Mr Kingo ' Malley,,32,Chapman What The Try That Has Been Built Up I N The Same
