speakerGroups,speaker,theText,pageNumbers,title
0,"Itjouse Of Ftrprrsentattbes. Tuesday, 86 August, 1913. And Read Prayers. Of A Message From His Excellency The Governor","General, recommending an appropriation for the purposes of this Bill. Referred to the Committee of Supply. MB. JUSTICE ISAACS. Minister stated that Mr Justice Isaacs,, when Attorney-General, represented South. Australia as against the Commonwealth. To that I replied, "" Not as against the. Commonwealth""; but the PrimeM in ister answered, ""Yes."" I ask the honourable member whether he is now pre-, pared to withdraw that statement, which, appears in Hansard, and has been published in the press of the various States, seeing that Mr Justice Isaacs did not represent the South Australian Government, asagainst the Commonwealth. the statement; my recollection is that I made the correction later in the speech, in which the statement was made. I "" withdraw the statement absolutely. wish to say, too, that I understand that Mr Justice Isaacs, when Attorney General, did not accept a brief from the . South Australian Government, though hefurnished to that Government an opinion: for which he received payment. ister whether Mr Justice Isaacs furnished an opinion in which the Commonwealth was involved, or against the Commonwealth 1 unable to answer all these questions in detail. The honourable member must give notice. Minister inform the House whether any member on the Government side who has been ill has been refused a pair by the Opposition ? I am aware. I ask the Prime Min-",12,Setup
1,"Mr Spbakee Took The Chair At 3 P.m.,.",,12,Pairs
2,Mr Speaker Reported The Receipt,,12,Pairs
3,Mr Frazer,Last week the Prime,12,Pairs
4,Mr Joseph Cook,I withdraw,12,Pairs
5,Mr Frazer,I,12,Pairs
6,Mr Joseph Cook,I really am,12,Pairs
7,Mr Mathews,Will the Prime,12,Pairs
8,Mr Joseph Cook,"Not so far as*DAY LABOUR. be good enough to furnish copies of the report on the day labour versus contract system, made by a Royal Commission when he was Postmaster-General of New South Wales? esting to honourable members, and I should like each member to have a copy. member, the question was not reported on. tion of the Prime Minister or of the M in the late Lord Chief Justice of England, ister of Trade and Customs to a statement and to return his retainer ? by the Premier of New South ^Vales, which has appeared in the Sydney Mornthe letter to which the honourable member ing Herald. The paragraph containing has directed attention. In regard to tbe the statement reads as follows: The Premier( Mr Holman) has advised the City Council that to combat the statements that which I have already given; have appeared in some English newspapers concerning the small-pox outbreak cablegrams had been forwarded to Mr Coghlan and the officer in charge of the State's agency in San Francisco, asking them to give wide publicity to the fact that the epidemic is of a very mild type, and that of the 400 cases no deaths have occurred, and no patients have been dangerously ill. Has notice been taken of that statement by the Government, or will notice be taken of it? Isi t intended to back up the Premier of New South Walesi n the endeavour to remove the stigma which has been cast by this Government on the whole of Australia? to answer questions generally, but I may inform the honourable member that some time ago a message was sent by the Commonwealth to the H i gh Commissioner, telling him exactly the nature of the outbreak. That message was somewhat on the lines of the statement to which the honourable member has drawn my attention. there is published a letter signed by MrM . Meagher, of Bathurst, who, discussing the question whether the Attorney General should continue to hold the Marconi Company's general retainer, saysThe late Sir Charles Russell held a general retainer for the London Times. This paper was publishing a number of articles attacking Parnell and his party. hands were tied in Parliament, and because of his general retainer he could not deal with such questions as "" Parnellism and Crime"" as freely as he would wish. He wrote to Mr Soames, the Times solicitor, as follows :W ill the Prime Minister Dear Sir,-As the writings in the Times under the title Parnellism and Crime, and in relation to that subject, are now under discussion in Parliament, in which discussion i may be called upon to take part, 1 think you It would be very interwill agree with me that it would be better, at such a juncture, I should not continue to hold the general retainer for the Times. The w o r d "" general "" is used there in a very emphatic sense. I would ask the Attorney-General whether he is disposed at the present juncture to adopt a similar attitude in regard to the MarconiI wish to direct the attenCompany to that which was adopted by MrW . H . IRVINE I have read other part of his question I do not propose to give any answer other than that personal explanation. In last Saturday's issue of the Register and the Advertiser, both of which newspapers are published in Adelaide, I am credited with having made the following statementHe did not believe the present Sydney outbreak was small-pox at all, but the dictum of the Medical Union, which was the closest and narrowest in the world, had to be obeyed. He protested against the Government's action in having quarantined Sydney on account of the damage it had done in this State, and also New South Wales. He also objected to the Commonwealth, through the Naval Board, finding well-paid jobs for half-pay Navy officers in connection with the administration of the Navy Act, as had been done in the case of the lighthouse exprrt. Some honourable members may hold the views which have thus been attributed to me. I wish to say that I expressed no opinion on the quarantining of Sydney, that I did not mention small-pox during the course of my speech, and that I did not criticise the appointment of the lighthouse expert. HowI came to be credited In this morning's Age with having expressed these views I do not know. following papers: Defence Act-Military Forces-Regulation s Amended, &c. (Provisional)-Statutory Rules Russell felt that his 1013, Nos. 227, 228. Invalid and Old-age Pensions Act -Statement re Pensions for twelve months ended 30th June, 1913.",12,Pairs
9,Mr Riley,,13,Papers Ministers Laid Upon The Table The
10,Mr Joseph Cook,S o far as I re,13,Papers Ministers Laid Upon The Table The
11,Mr West,,13,Papers Ministers Laid Upon The Table The
12,Mr Groom,I am not in a position,13,Papers Ministers Laid Upon The Table The
13,Mr Frazer,,13,Papers Ministers Laid Upon The Table The
14,Mr Frazer,"I desire to make a-Parramatta ) ting the motion which I intend to propose in regard to the business of the day I should like to make mention of the death of an old and respected member of this HouseI mean the Honourable William Knox, who, for many years, was one of our most highly-esteemed representatives here, and one of the most useful members withal that this chamber has known. He was a man of patriotism and zeal in the public service of the country-on e whose example all may worthily emulate, though few certainly will excel. It seems as if death has laid a heavy toll on the members of this Commonwealth another is to be counted amongst those who have gone hence, and lef t their labours to be carried on by others. We can but acquiesce in these visitations from time to time, and hope that we may do our duty as f a it h f u l l y as he did who has just gone from amongst us. I am quite sure that I voice the feelings of the whole House when I say that we tender our sincerest sympathy to the bereaved ones, and pray that a kind Providence may assuage their grief and soften the blow to them. The Prime Minister quite correctly said that he spoke for the whole House when he expressed sympathy with the widow and family of the late Honourable William Knox, who, both in a private and public capacity-especiall y in his own State -ha s rendered valuable service to the community. The head of the Government also very fittingly referred to the severe toll demanded by Nature of the people's representatives in this Parliament. I have expressed my views on that subject before, and I do not wish to repeat them. Our sympathies go out to the bereaved ones. Nature demands that we must all go hence at some time, and however much we may differ as to the methods which should be followed in carrying on the government of the country we all recognise f a it h f u l service by any honourable member, no matter what political views he may hold. important for us to recollect that every person who enters this Chamber enters it as the choice of a majority of the electors of his constituency. The position which OP THE Honorable he holds is, therefore, a very honourable one. I join with the Prime Ministeri n offering our sympathy to .the widow and [3.12] -Before submitrelatives of the late Honourable William Knox, and in placing on record our recognition of the public services which he rendered. I wish to add a few words to what has already been said by the Prime Minister and my respected leader, because the late Honourable William Knox was the oldest friend I had in politics. It is more than forty years ago when he, one of the handsomest men in Melbourne, took my part as one of the youngest officials in a bank in this city, and thus rendered me a kindness which afterwards cemented into a friendship that was never broken. Later on, I followed the study of another Parliament. One after profession, whilst he remained associated with the bank. Few men have filled as large a position as he has, and though we differed politically, our friendship was never estranged. I wish, therefore, to pay my meed of praise to one who proved himself a true friend and a kindhearted gentleman, especially when I brought the unemployed movement under his noticea movement which he assisted monetarily and in other ways. I join in the hope which has been expressed, that his bereaved ones may have God's help to enable them to bear their affliction, and, in conclusion, I would say, as every one else here will say, "" God rest his soul."" Prime Minister and Minister of Home Affairs) [3.18] I move That the business on the notice-paper preceding notice of motion No. i be postponed until after consideration of Order of the Day No. 3. I offer no objection to the proposal of the Prime Minister, although I expected that the notice-paper would have been arranged in the order in which the Government intended to proceed with business. I further anticipated that the Treasurer would have extended to honourable members the usual courtesy, by issuing to them copies of the SupplyB ill beforehand It is very Sir JOH N FOBBEST -Copies of the Bill were issued on Saturday. I missed it , and my secretary must have missed it , too.",13,Papers Ministers Laid Upon The Table The
15,Mr Joseph Cook (Prime Minister,,14,Order Of Business
16,Mr Fisher (Wide Bay) [3.15],,14,Order Of Business
17,Dr. Maloney (Melbourne) [3.17],,14,Order Of Business
18,Mr Joseph Cook (Parramatta,,14,Order Of Business
19,Mr Fisher (Wide Bay) [3.19],,14,Order Of Business
20,Mr Fisher,"I have not seen a copy.get it on Saturday. had not been too busy electioneering they might have been able to arrange the business-paper in such a way as to permit of Supply being brought on that the business-paper has been arranged in accordance with the usual practice. can arrange the business-paper in any order that he pleases. Standing Orders. more particularly of the position when the Address-in-Reply is under consideration, which, understanding order No. 21, must be disposed of before other business, except of a formal character, can be entered upon. There is, further, a no confidence amendment to the Address. Question resolved in the affirmative. MAIL SERVICES : COMMISSION OF MAN NEW DAH "" : REPAIRS-COMPULSOR Y TARY TRAINING : SENIOR CADETS: USF. OF STATE SCHOOL GROUNDS: SERGEANTENCE TO UNIONISTS . posedThat the Standing Orders be suspended in order to enable nil steps to be at once taken to obtain Supply before the Address-in-Reply to His Excellency the Governor General's SpeechI was surprised to has been agreed to by the House, and to pass a further SupplyB ill through all its stages without delay. MrM c DONALD (Kennedy) [3.22] I enter my protest against the suspension of the Standing Ordersa procedure to which, both in Federal and I would point out State politics, I have always objected. To my mind, there, could be no more serious invasion of our parliamentary privileges than is involved by the suspension of the Standing Orders. The Government of the day, whether it be a Not under our Labour or a Conservative Administration , Bhould protect to the fullest extent the procedure of the House. A time may I am speaking now come when party feeling is running high, and when the one side or the other, having behind it a strong servile majority, will by this means rule the Housei n a way that the people do not desire. This is a proposal against which every honourable member in ordinary circumstances should take a stand; but as I understand that on the present occasion the suspension of the Standing Orders is desired in order to obtain Supply, I do not intend to take very strong exception to it . I shall, however, continue to protest, as I or REPEALING ACTSof the Standing Orders from time to time. endorse the words that have just fallen from the lips of the honourable member for Kennedy. The motion which the Treasurer would like to move is, I think, OLD-AGE PENSIONS : one that was heard in the early history of this House, when an enthusiastic pressman leant over the gallery, and said, "" I move that this House adjourn for forty purple years."" Such a motion OF OVERCOATS : COUNTRY would probably suit the Treasurer. I do not propose to offer any objection to the taking of the steps necessary to enable the Public Service to be paid, but I wish to emphasize the point that the present do any business. If they had they would MILIspeedily get out of the way the motion for the adoption of the Address-in-Reply, and would push on with the business of papers that it is proposed to ask for the adjournment of this House at an early date to enable honourable members to entertain our parliamentary visitors from Great Britain. The Government, apparently wanting an excuse for not pushing on the business, intend to avail them? selves of this opportunity to secure an adjournment, on the plea that members of",14,Order Of Business
21,Sir John Forrest,,15,Uniforms And Duties The Country I Learn From To Day S News
22,Mr Fisher,If the Government,15,Uniforms And Duties The Country I Learn From To Day S News
23,Mr Speaker,,15,Uniforms And Duties The Country I Learn From To Day S News
24,Mr Fisher,The Prime Minister,15,Uniforms And Duties The Country I Learn From To Day S News
25,Mr Speaker,,15,Uniforms And Duties The Country I Learn From To Day S News
26,Mr Frazer,Who does arrange it?,15,Uniforms And Duties The Country I Learn From To Day S News
27,Mr Speaker,,15,Uniforms And Duties The Country I Learn From To Day S News
28,Motion (By Sir John Forrest) Pro,,15,Uniforms And Duties The Country I Learn From To Day S News
29,Mr Higgs (Capricornia) [3.24],"Ibhe Commonwealth Parliament should be able to tour the country with their guests, who, by the way, we are most anxious to see enjoy themselves while in the Commonwealth. In the circumstances, I do not offer any objection to this motion. The Treasurer to-day is so very mild and courteous that one really finds it difficult honourable member suggested, early in to offer any objection whatever. wish to express my pleasure that some honourable members have at last learned the lesson that the Standing Orders should not be lightly suspended. I quite agree with what has been said by the honourable member for Kennedy, but regret that when from time to time, during the first five years of the Commonwealth Parliament, I objected to the Standing Orders being suspended I did not receive the support of honourable members now sitting in Opposition. A t that time they sat behind another Administration, and gave it their f u l l support. On almost every occasion on which such a motion as this was submitted I pointed out that it was not in accordance with the best parliamentary practice, and should not be encouraged; but I cannot say I ever received the support of a member of the Labour party. In this instance there is some excuse for the action proposed. Who delayed the last general election so long that a SupplyB ill could not be brought forward until the financial year bo! which it related had already been entered upon ? rightly have been held last March or A p r i l , We should then have been able to meet by the 1st June-befor e the beginning of the present financial year. I do trust that now that we have in power a sound Administration they will correct this ' procedure at the first opportunity, and that we shall at last have the granting of Supply, as it ought to be, within the control of the House. I , therefore, welcome the support of honourable members opposite, who have announced their objection to the suspension of the Standing Orders, and have no doubt that M i nisters will gladly receive it in bringing our procedure in this respect into that f u l l aud proper order from which it ought never to have departed. is obvious that the honourable member for Werriwa is trying to score off the Opposition by urging that the general election should have taken place at an earlier date. The honourable member, who professes to be a student of the Constitution, ought to know that under the Constitution the Senate continues to exist until the 30th June, so that if the general election had taken place in A p r i l , and Parliament had been called together, as the June, any members of the Senate who had been defeated at the polls would have been able to take part in the passing of the SupplyB ill . That is what is advocated by the enthusiastic constitutionalist who has been returned-temporarily , I hope-by the electors of Werriwa. the honourable member is particularly pleased that the honourable member for Werriwa has been returned. The Government has far more docile supporters. The honourable member for Werriwa urges that the late Government were responsible for keeping the Housei n existence longer than was necessary, with the result that we have now to pass a SupplyB ill when we ought to be dealing with the Estimates for the current financial year. He must have forgotten his constitutional knowledge, of which he used to give us the benefit when he was a member of the House on a previous occasion. Apparently, he recognises and approves of the pernicious principle that defeated senators should continue to take part in the legislation of the country. deal with Money Bills. liant gem of constitutionalism! Does the honourable member say that the Senate has not to deal with this B ill ? Has the Senate not to pass this B ill ? member's reading of the Constitutionwell! member recommend the Prime Minister or the Treasurer to make any payment under this SupplyB ill simply because it had been passed by this House? in which even the honourable member, in his indiscretion of to-day, would accept no responsibility. Here was a case where no Government could, under any consideration, be justified in allowing a Senate, composed of some members who might have been rejected by the popular votes",15,Uniforms And Duties The Country I Learn From To Day S News
30,Mr Conroy (Werriwa) [3.25],I,16,Uniforms And Duties The Country I Learn From To Day S News
31,Mr Frazer (Kalgoorlie) [3.28],It,16,Uniforms And Duties The Country I Learn From To Day S News
32,Sir John Forrest,Poo r fellow!,16,Uniforms And Duties The Country I Learn From To Day S News
33,Mr Frazer,I do not think that,16,Uniforms And Duties The Country I Learn From To Day S News
34,The Elections Should Mr Conroy,But the Senate does not,16,Uniforms And Duties The Country I Learn From To Day S News
35,Mr Frazer,Her e is another bril,16,Uniforms And Duties The Country I Learn From To Day S News
36,Mr Conroy,If that is the honourable,16,Uniforms And Duties The Country I Learn From To Day S News
37,Mr Frazer,Would the honourable,16,Uniforms And Duties The Country I Learn From To Day S News
38,Mr Conroy,That is another matter.,16,Uniforms And Duties The Country I Learn From To Day S News
39,Mr Frazer,"It is another matterof the various States of Australia, to deal not completed by the end of the financial with a SupplyB ill for the current finanyear; and the course followed in regard cial year. The argument of the honorto them is the course taken in previous able member was all intended to show years. I may point out that, although that the late Government were interested £650,000 may be approved by Parliain making the elections as late as possiblement, for Treasurer's That was not the case. Recognising the is constitutional position, the Government £500,000 shall be voted under this head wished to meet Parliament with the new when the Estimates for the whole of the Senate. Supply had been granted only financial year are before the House. As I t ill the end of June; and as soon as the say, the course now taken is exactly the result of the elections was known, the late same, I believe, as that taken last year. Government resigned in order that the present Government should be free from not. ask for so much, yet the present Treaembarrassment and able to call Parliament surer always grumbled. together early in the financial year. Question resolved in the affirmative. In Committee of Supply: surer) [3.32] I move That a sum not exceeding Nine hundred and vance will be debited to that appropriasixty-four thousand five hundred and ninety-six tion, and the Treasurer's Advance will be pounds be granted to His Majesty for or torelieved of nearly the whole of the liawards defraying the services of the year ending 30th June, 1914. I regret to have to ask again for Supply buildings from the beginning of the finanbefore the Estimates-in-Chief are on the cial year until we have an appropriation. table, but the position has been unavoidThis SupplyB ill , like the last one, is able for one reason and another. I hope, based on the Estimates of the previous however, that it will not be long before year. I shall be able to announce the date when which will be paid under it are the ordithe Estimates will be laid before the nary statutory increments, due to officers House. Honourable members will notice whose salaries do not exceed £ 1 8 0 a year. that the Supply asked for is for one There is nothing novel or unusual in the month. The Bill provides for the ordiB ill . nary votes £694,596, for refunds it provides £20,000, and for the Treasurer's Advance £250,000. a Treasurer's Advance for a month? funds are required to pay cable receipts, istration. It is very interesting to hear which come to the Government in the first the Treasurer deprecating any criticism instance, and have to be paid to the Eastin relation to the amount for the Treaern Extension Telegraph Company and surer's Advance, and suggesting that it tlie Pacific Cable Board, and also for postis not much, and that later on the matter age on postal notes, and the repaywill be adjusted. ment of money paid into the revenue i i i error. As to the Treasurer's Advance, same as did the late Government. honourable members are aware that the first SupplyB ill provided for £400,000, a very different tale from that which and I now ask for £250,000 more. This the Treasurer and the Prime Minister is no doubt a large amount, but the reaused to tell when in Opposition. They son is that until we have an appropriathen asked what the money was required tion for works and buildings the numerfor, and used language sufficient to sugous works throughout the Commonwealth gest to the people outside that it was not have to be paid for out of this Advance. necessary, and might be misused. In the All these works, I may say, have been case of the late Government the amount authorized by Parliament, but they were first asked for in a SupplyB ill for a Advance, it not intended that more than from memory, but I think the late Government asked for as much as we are asking for. As soon as we have an appromoney now voted to the Treasurer's A d bility. This is merely a temporary measure to enable us to pay for works and The only increases of salaries The Treasurer, of course, needs money to meet the obligations of the Commonment to pass this measure, whatever our",16,Uniforms And Duties The Country I Learn From To Day S News
40,Sir John Forrest (Swan,"Trea priation for works and buildings, the",17,Uniforms And Duties The Country I Learn From To Day S News
41,Mr Frazer,"The sum of £250,000 for wealth, and it is the business of Parlia",17,Uniforms And Duties The Country I Learn From To Day S News
42,Sir John Forrest,Yes. The reviews may otherwise be as to the admin,17,Uniforms And Duties The Country I Learn From To Day S News
43,Mr Fisher,The late Government did,17,Uniforms And Duties The Country I Learn From To Day S News
44,Sir John Forrest,I am speaking,17,Uniforms And Duties The Country I Learn From To Day S News
45,Mr Fisher (Wide Bay) [3.37],,17,Uniforms And Duties The Country I Learn From To Day S News
46,Sir John Forrest,We are doing the,17,Uniforms And Duties The Country I Learn From To Day S News
