speakerGroups,speaker,theText,pageNumbers,title
432,Mr Finlayson,"Y o u cannot conthey anticipated the action of the Government. Last year, the production of sugar in Australia was only 130,000 tons, and the requirements of the country 226,000 tons, so that 96,000 tons had to be imported to make up the shortage. Why was it that on the 24th July, 32,000 tons of Australian sugar was in stock? Why were the companies selling imported sugar, and keeping Australian sugar in bond? They would not have done that had they not thought that there was a chance of the Excise being repealed. It was not necessary to repeal the Excise and Bounty Acts at the same time. The Queensland Government must have fel t that those Acts would not be repealed, because the measures .passed by the Queensland Parliament are so worded that I am sure the Labour Government, had it remained in power, would not have repealed the Commonwealth sugar legislation. One of the terms of the agreement with the Queensland Government was that the employment of coloured labour in Queensland should be prohibited. It is a mere quibble for the Minister to say that, had such a prohibition been enacted, the B i ll containing it would not have received the Royal assent. member's time has expired. DoI understand that the honourable member desires to avail himself of the additional time which is allowed him under the Standing Orders? mere quibble for the Minister of Trade aud Customs to argue that if the employment of black labour had been directly excluded by the Act it would not have received the. Royal assent, and that, therefore, a dictation test was imposed. Queensland statute-book Acts which specifically exclude Asiatics aud coloured aliens from employment in certain undertakings, and those Acts received the Royal assent. How many years ago? they were passed years ago is an additional reason for believing that the Royal assent would not have been withheld from the Sugar Cultivation Act , because the present K in g has been much more liberal in expressing his views upon these matters than have previous rulers. assent has been given to democratic measures which have almost surprised the people, because a few years ago it would have been impossible to have obtained that assent. What about our Navigation Bill? New Zealand could not get the Royal assent to the provisions of its Navigation B ill , and yet that assent has been given to our Navigation B ill , which contains even more drastic provisions. I would further point out that the dictation test will f a i l in its purpose unless we can depend upon the administration. That is where it will f a i l , because the administration of that test is now in the hands of those who all their political lives have been associated with what is known as the black-labour party. It is an easy matter to put a dictation test to any coloured alien that he can pass. If , for example, a Japanese presented himself, the officer administering the Act could easily impose a dictation test in Japanese. A dictation test is practically useless from the stand-point of safeguarding the sugar industry from the employment of coloured labour. ber give any instance of that? able member is doubtless thinking of what The honourable was said this afternoon to the effect that under our Immigration Restriction Act a dictation test is applied. B ut as that dictation test is applied by men who have no particular interest in any other part of the world, it is naturally applied in a It is a much more reasonable and expeditious manner. In this particular instance we set out to accomplish one thing. The payment of the sugar bounty and the imposition of the Excise duty were intended to accomplish only one object-to do away with the employment of coloured labour As a matter of fact, and to establish the sugar industry on a already has upon her white-labour basis. We wish to insure the continuance of that policy, and the Sugar Cultivation Act passed by the Queensland Parliament does not give us the guarantee that we had a right to expect. No wonder that the Queensland Government made section 1 of that Act This Act may be cited as "" The Sugar Cultivation Act of 1913,"" and shall commence and take effect on and after the date of the commencement of the Act of the Parliament of the Commonwealth intituled the Sugar Bounty Abolition Act IQI2. When these Acts were in their final stages The Royali n the Queensland Legislature, the Premier of that State is reported to have",57,Honourable Membebs Anothe R Squat
433,The Chairman,,58,Honourable Membebs Anothe R Squat
434,Mr Finlayson,Yes.,58,Honourable Membebs Anothe R Squat
435,Mr Stumm,When were they passed?,58,Honourable Membebs Anothe R Squat
436,Mr Finlayson,The fact that read,58,Honourable Membebs Anothe R Squat
437,Mr Patten,Can the honourable mem,58,Honourable Membebs Anothe R Squat
438,Mr Finlayson,"No. The honormade a remark to the effect that "" If Mr can be consummated. The Queensland GoFisher does not like to take these he can vernment failed to carry out their part of carry out the work himself."" evident, therefore, that the Premier of a manner which can be regarded as satisQueensland had a suspicion that the factory to this House. measures would be objected to. another complaint to make in regard to in the Acts passed by this Parliament at them. growers that they would receive the tion, there was no reason why he should bounty, and, in addition, the difference have hurriedly proclaimed them. This between the bounty and the Excise, House met on the 9th July. The Queenswhich is estimated at 2s. 2d. per ton. land Bills were not then through the ParBut all that the Sugar GrowersA c t of liament of that State. An ad journment of 1913 provides is that in No. 1 district this Chamber took place on the 9th July, the grower shall receive 9s. 8d. per ton and if there be any force in the Minister's for his cane, that in No. 2 district he contention that he was acquainted with a shall receive 9s. 2d. per ton, that in No. defect in our legislation, it would have 3 district he shall be paid 8s. 8d. per ton, been the easiest possible thing for him to and that in No. 4 district he shall receive have put through a B ill on that date to 8s. 2d. per ton, in addition to the basic guarantee the payment of the Excise on price, but there is no stipulation the sugar of the past season. There is as to what shall be the basic price upon yet another aspect of this matter: Some which those payments shall be made. A t honourable members appear to think that the present time, there are contracts the payment of the sugar bounty was dewhich are not affected by this B ill . But pendent on the collection of the Excise, there is no guarantee that the caneand that the Sugar Excise RepealA c t growers will get a basic price which will had to be proclaimed because the bounty give them the advantage of the difference had to be paid. The idea is ridiculous. between the bounty and the Excise. If The sugar bounty was paid out of the the basic price in No. 1 district is settled Consolidated Revenue, and was absolutely at 12s. per ton, the grower will get on guaranteed to the growers, even though the top of it 9s. 8d. per ton. But there a single shilling of Excise had never been is nothing to guarantee that the millcollected. Consequently the Government owners will not reduce the price to 8s. are quite out of court. per ton, and that would make the amount lutely without an argument when they which the grower would receive 17s. 8d., suggest that the two Acts passed by this instead of 21s. 8d. per ton. That is a Parliament had to be proclaimed simulweakness in the Act which the Labour taneously. Government would not have allowed to pass, and consequently the two Statutes which we passed last session would not have been proclaimed. I entirely object now. to the suggestion of the honourable member for Kooyong, that it was necesbounty will be paid, although it is unsary to automatically proclaim the fortunate that its payment has been deSugar Bounty Abolition Act and the layed so long. It is equally unfortunate Sugar Excise RepealA c t . The honourable that the Minister of Trade and Customs member stated that immediately the should have been in such a hurry to Queensland Parliament enacted certain please his political friends in Queensland legislation we were in honour bound to that he was induced to take action withissue the necessary proclamations. I disout realizing what he was doing. Of sent from that view in to to. We came course, he was quite consistent, because to a certain arrangement, and we had a during the last session, when this matter perfect right to say whether that arrangewas before the House, there was no memment had been f a it h f u l l y carried out. ber of the Opposition who was more in If each of two parties agree to perform sistent than he was that we should repeal certain undertakings, each must be satisboth the bounty and the Excise, and be fied that the other has f a it h f u l l y carried content to accept the word of the Queensout his part of the agreement before it land Premier that he would pass the proI t is the agreement with the Commonwealth in If the MinisterI have of Trade and Customs discovered a defect We wished to guarantee to the the instance of the Labour AdministraThey are absogally withholding the payment of bounty mised legislation. Day after day it was",58,Honourable Membebs Anothe R Squat
439,Mr Higgs,The Government are ille,59,Honourable Membebs Anothe R Squat
440,Mr Finlayson,"I believe that thea case of "" Mr Denham has promised to pass certain legislation. Can you not aocept his word?"" will recollect that Mr Denham could not get a reply from the late Government u n t i l the 5th December. was made on the 5th September. that. again. of Trade and Customs continually insisted that both the Sugar Bounty and the Sugar Excise Acts should be repealed on the strength of the promise of the Queensland Premier. doubt as to whether we could accept that promise as one that was likely to be faith f u l l y honoured. Subsequent events have absolutely justified our fears in that respect. did accept it on the 5th December of last year. last year, the honourable member for Wide Bay sent his telegram to Mr Denham, in which he p u t the alternative proposals. Immediately afterwards Mr Denham said he preferred the alternative proposition, and, on the strength of that, legislation was ultimately passed in this Parliament and assented to on 24th December. reserve this power to protect the interests of the Commonwealth and the sugar growers. Acts would not be proclaimed u n t i l the Queensland Legislature had carried out its part of the bargain. That is the difference. The suggestion of the honourable member for Darling Downs was that we should pass our repealing Bills,« leaving the Queensland Parliament to carry out its part of the compact in accordance with the promise of the Premier of that State. We objected to that, saying, "" We shall hold in reserve this power not to bring our legislation into operation by proclamation u n t i l Queensland has carried out its part of the bargain."" Labour Government had been in power these two Acts would never have been proclaimed until Queensland had passed more satisfactory measures. Queensland's legislation in this regard is not satisfactory, but the Minister of Trade and Customs, in his anxiety to accommodate and oblige his political friends in Queensland, rushed in , proclaimed the repealing Acts, and the Commonwealth has suffered a loss of revenue amounting to £128,296. unfair accusation. it . It is not a matter of doubt. ActionI know all about was taken by the present Minister of We have had it over and over Trade and Customs, and the loss of My point is that the Minister revenue has been suffered. The Government now come down with the suggestion that in some way or other they are going to collect the money, but it is remarkable that in the statement of Ministerial policy Some of us expressed a submitted to the House there was no suggestion that this was going to be part of the programme for the session. There was no hint of such a thing. This only goes to bear out the statement made fro m this side of the House that the Ministry have blundered. L it t le by little they are try ing to get out of the difficulty, with the result that they are becoming more deeply involved. The statement made by theO h , no. Minister to-night in regard to his knowledge as to the sugar in bond at the time of the issue of the proclamation is, to my mind, the most damaging admission he has made. I must, however, keep my promise to my honourable friend, and will reserve for a later occasion further remarks that I desire to make in regard to this question. [9.58] I have followed very closely the debate on the SupplyB ill , and more parWe said that our repealing ticularly the remarks made by the honourable member for Kennedy and the honourable member for Brisbane The latter opened his speech with a reference to the abuse which he said had been heaped upon the Opposition by honourable members on this side of the House. He then referred to the financial proposals, to the cotton industry, to matters of defence, and, finally, to the sugar question. I do not know that there has been from this side of the House any abuse of the Opposition which has not been exceeded by that which tlie Opposition has heaped on If the us. I am quite certain that throughout the length and breadth of Australia during the recent election campaign no statement was made by honourable members on this side that could not be verified. Speaking for myself, I made no statement in public that I am not prepared to support and substantiate with evidence at any time. Coming to the question of finance,",59,Honourable Membebs Anothe R Squat
441,Mr Gboom,The honourable member,60,Honourable Membebs Anothe R Squat
442,Mr Finlayson,,60,Honourable Membebs Anothe R Squat
443,Mr Gkoom,But the late Government,60,Honourable Membebs Anothe R Squat
444,Mr Finlayson,,60,Honourable Membebs Anothe R Squat
445,Mr Gboom,On the 5th December of,60,Honourable Membebs Anothe R Squat
446,Mr Finlayson,,60,Honourable Membebs Anothe R Squat
447,Mr Austin Chapman,That is a most,60,Honourable Membebs Anothe R Squat
448,Mr Tudob,It is absolutely correct.,60,Honourable Membebs Anothe R Squat
449,The Request Mr Finlayson,The facts support,60,Honourable Membebs Anothe R Squat
450,,"But we kept in Mr HANS IRVIN E (Grampians)to which reference has been made by the honourable member for Kennedy and the honourable member for Brisbane, I have heard the ex-Prime Minister and members of the Opposition speak of the deficit which they found on taking office, and which they claim to have converted into a surplus. During the election campaign there were many references to the unex]3ended earnings received from the taxpayers which were placed to the credit of the Commonwealth. Members of the Labour party said that when they came into power they were faced with a deficit of £451,000, and the present Leader of the Opposition declared that he converted that deficit into a surplus of from £2,000,000 to £2,500,000. That, he said, would be the surplus shown at' the end of the financial year which closed on 30th June last. I have verified his figures, and know that they are correct. point that I .wish to make is that the right honourable gentleman never told the people of his great inheritance as the result of the expiration of the Braddon section in 1910. know that under the Braddon section of the Constitution it was provided that 15s. out p i every £ 1 collected from Customs and Excise should be returned to the six States which created the Federation. But neither the present Leader of the Opposition, nor any of his supporters, to my knowledge, referred to that fact, or to the expiration of that section. Of the small deficit of £451,000, a sum of £450,000 exactly was provided by the Deakin-Cook Government for old age pensions. The Deakin-Cook Government knew, when they were going before the electors in 1910, that although that deficit existed the Commonwealth, as the result of the expiration of the operation of the Braddon section, would in future receive from Customs and Excise a much larger revenue than had ever been obtained before. While the Fisher Government were in office-and I say, clearly and distinctly, that it was a period of misrulethe Commonwealth received from Customs and Excise over £16,000,000 more 4 than had been received during the administration of any previous Ministry. The Fisher Government also collected about £4,500,000 from the land tax which they introduced, making in all an additional revenue of about £20,500,000. And yet they talk about the small deficit of £451,000! the Commonwealth, and knew that within three years the Commonwealth would receive an additional £20,500,000, I should not worry much about leaving a small deficit of £450,000, more especially when the deficit, as in this case, was in curred in providing for national works, and in carrying out other national purposes. The Deakin-Cook Government knew, when they went to the electors in 1910, that the Braddon section was about to expire, and that a larger revenue would consequently be available to the Commonwealth. Honourable members opposite, who, in reality, are only delegates-delegate s of an irresponsible body outside Parliament-shoul d have been truth f u l in their statements^ They should have made reference to the expira-tion of the Braddon section; but in no newspaper published in Australia did I But the ever see any evidence that they had done so. What they did claim was that they were Heaven-born financiers, who had brought the country out of a state verging on r u in , and had converted a deficit The people of Australia into a substantial surplus. they did? .. Fisher Government during their three years of office practically ruined the country. The honourable member for Wide Bay, when Treasurer of the Commonwealth, in 1912, brought down a statement showing that he estimated to receive £20,422,000 iu that, the year of our greatest prosperity, and that the expenditure would be £22,681,541. In other words, in the year of our greatest prosperity he proposed to expend £2,261,541 more than he would receive. And yet the Labour party call themselves heaven-born financiers. To the individual their policy means increased taxation and a decrease in the purchasing power of the sovereign. The Labour Government undertook to perform great things, but we now find employment scarce and money dear. And what made money dear? The policy of the Fisher Government and their sup 1 porters. Money is dear all over the world; but in Australia, up to June, 1910, there was probably the cheapest money in the wide world, considering the size of the country. Nearly four years ago I remember money being sent from Melbourne to New York, where it is earning If I were Treasurer of 7 per cent., and yet at that time money",60,Honourable Membebs Anothe R Squat
451,Mr Webstek,I s it not true that,61,Honourable Membebs Anothe R Squat
452,Mr Hans Irvine,"No. Thehere, on gilt-edge security, could be obtained at 3 | per cent. there was stagnation all round here. stagnation here; but at present we have financial Labour party, who do not know what finance means. to work on financial reform, and, first of all, introduced a Commonwealth note issue, which had the effect of filching from the banks, and taking out of circulation, about £10,000,000. factor in making mouey dear, because, when money is drawn out of circulation, it must cost more. that during the last three years the purchasing value of the sovereign has decreased by 12-J to 15 per cent., so that for ' what a man could purchase for £ 2 l is . three years ago he has now to pay £ 3 . say that. say so. cally driven capital out of the country. I would abolish the 10s. note, and, in fact, abolish the Commonwealth note issue altogether, because it is of no earthly use, if its only effect is to decrease the purchasing power of the sovereign. would abolish the Australian Navy! the Australian Navy. And here I should like to point out that it was not the Socialist party, but the Liberal party, who instituted the Australian Navy. a Liberal Government which brought out Admira l Henderson and Lord Kitchener, and the schemes of those two experts have been adopted. from probably every platform throughout Australia, have been guilty of the misstatement-of the w i l f u l perversion of the truth-that the credit for the establishment of the Australian Navy is due to them. in my electorate I found that statements had been made by Labour candidates that if the Liberal party were returned to power, old-age pensions would go. who introduced old-age pensions ? Liberal party. an old-age pensions scheme was operating in Victoria, where it was introduced by Sir George Turner, as Premier of the State. pensions scheme is in 'existence to-day because of the efforts of the Liberal party T h a t was because in the past, when there was no Labour party in existence. Now the PrimeM in The r e was no ister proposes to extend old-age pensions, and make them even more beneficial to crucifixion, all through the humanity by means of the insurance scheme he has foreshadowed in his memoThe late Government set randum. However, it was the question of finance with which I desired to deal. When the ex-Prime Minister submitted his Budget on 3rd August, 1912, he proposed to take from the accumulated unThis was the chief expended earnings of the previous year a sum of £2,261,541 to make the public ledger balance. There is marvellous Mr Knibbs tells us finance! orable member last session ? from Australia with the f u l l consent and concurrence of my electors, and I am here to-day, in spite of remarks made by honourable members opposite, and to their great surprise, with a larger majority than Mr Knibbs did I ever had before, and I prophesy that I The Labour party has practishall have even a larger majority on the next occasion. What the people of Australia think of the finance of the Labour Government is shown in the £act that that Government was deservedly "" turned clown."" I have said on the platform, and I repeat here, that in reality the Labour party and Government committed Australia, during their three years of No ; I support power, to a capital expenditure of over £100,000,000, which the taxpayers of Australia wil l have to provide. We have heard honourable members opposite talk It was about clean rolls, clean administration, preference to unionists, and so for t h ; b u t the great heart of the people of Australia has declared clearly and distinctly that Yet the Labour party, there is to be no preference. According to Mr Knibbs, there are about 430,000 unionists in Australia, with an estimated population of 4,600,000. Roughly, this means one unionist to every twelve of the population, and the other eleven have to Then, again, wherever I went bow the knee to the Labour party. They are to have no right to live or work ^unless they join the unions of which honourable members opposite are delegates. The unionists ? asked a man whether he is a unionist or a non-unionist. Our party stands for industrial unionism, but is totally opAs a matter of fact, the old-age posed to political unionism. When the",61,Honourable Membebs Anothe R Squat
453,Mr Lairdsmith,,62,Honourable Membebs Anothe R Squat
454,Mr Hansirvine,,62,Honourable Membebs Anothe R Squat
455,Mr Webster,Mr Knibbs did not,62,Honourable Membebs Anothe R Squat
456,Mr Hansirvine,,62,Honourable Membebs Anothe R Squat
457,Mr Webster,The honourable member,62,Honourable Membebs Anothe R Squat
458,Mr Hansirvine,,62,Honourable Membebs Anothe R Squat
459,Mr Mcdonald,Wher e was the hon,62,Honourable Membebs Anothe R Squat
460,Mr Hansirvine,I was away,62,Honourable Membebs Anothe R Squat
461,Bu T Mr Laird Smith,D o you employ,62,Honourable Membebs Anothe R Squat
