speakerGroups,speaker,theText,pageNumbers,title
0,"Jqouse Of Licpresruidlibra. Thursday, 87 November, 1913. P.m., And Read Prayers. Of A Message From His Excellency The Go","verner-General recommending an appropriation for the purposes of this Bill. NEW HEBRIDES. clear and informative explanation given yesterday by the Minister of External Affairs in reference to the control of the position to give a speedy delivery. I , New Hebrides, I ask the honourable gentleman if the Government is pressing on the Imperial Government the necessity of having the Commonwealth directly represented at any future Convention by which it is proposed to vary the terms of offer, and at the same time called for the present protectorate, or to frame new conditions and terms for the control of the islands! able member that the expediency of the Commonwealth being not only consulted, but also, if possible, represented, was communicated by despatch to the Imperial Government about six weeks ago, and that the despatches that have passed between us and the Colonial Office have been based, not on mere conjecture, but on a full knowledge of the position communicated to us by the Imperial Government. day's Argus that the Department of Home Affairs has accepted tenders for four engines, of which two are to be delivered at Kalgoorlie, and the other two at Port Augusta. The successful tenderer is an importing, not a manufacturing, firm, and I , therefore, ask the Honorary Minister whether the engines are to be manufactured in Australia, and, if so, what are the conditions in regard to subletting ? will readily understand, in the organization of a big railway construction work like the line from Kalgoorlie to Port Augusta, it is necessary to look a considerable distance ahead with a view to providing adequate locomotive power for extended construction. The further the line is pushed from its base, the greater the number of locomotives and.the supply of rolling-stock required to maintain supplies for continuous construction. Some time ago it was recommended to me by the Engineer-in-Chief for Commonwealth Railways that it was essential to obtain more engines very quickly. I accordingly had all the manufacturers of locomotives in Australia approached, to ascertain whether they could manufacture the engines, and all, without a single exception, replied that they were not in a therefore, decided to invite quotations for quick supply from oversea firms, and the American Baldwin Company, represented here by Newell and Co., made the most satisfactory offer. We accepted this tenders locally for the other locomotives that we require. which I referred are to be imported ! not imported the work would have to stop. Minister at what date the Government turned down the tender of Walkers Limited, Maryborough, Queensland, for engines suitable for the Oodnadatta line!",12,Setup
1,Mr Speaker Took Tha Chair At 2.30,,12,Kalgoorlie To Port Augusta Railway Locomotives Smal L Contracts Stam
2,Mr Speaker Reported The Receipt,,12,Kalgoorlie To Port Augusta Railway Locomotives Smal L Contracts Stam
3,Mr Sampson,Following on the,12,Kalgoorlie To Port Augusta Railway Locomotives Smal L Contracts Stam
4,Mr Glynn,I can assure the honor,12,Kalgoorlie To Port Augusta Railway Locomotives Smal L Contracts Stam
5,Mr Tudor,It was stated in Mon,12,Kalgoorlie To Port Augusta Railway Locomotives Smal L Contracts Stam
6,Mr Kelly,As honourable members,12,Kalgoorlie To Port Augusta Railway Locomotives Smal L Contracts Stam
7,Mr Tudor,Then tbe four engines to,12,Kalgoorlie To Port Augusta Railway Locomotives Smal L Contracts Stam
8,Mr Kelly,Yes. If they were,12,Kalgoorlie To Port Augusta Railway Locomotives Smal L Contracts Stam
9,Mr Fisher,"I ask the Honoraryto by the honourable member for Yarra are for the Kalgoorlie to Port Augusta line, been given an opportunity to tender for the manufacture of the engines just referred to? ously one of which notice should be given, but, speaking off-hand, I am confident thab Walkers Limited was invited, with other Australian manufacturers of locomotives, to give tenders, and that the firm replied that it was not in a position to accept a contract for speedy delivery. objection to laying the correspondence on the table? member see all the papers. cently in the Argus a statement, purporting to come from Perth, to the effect that a contract for clearing along the route of the transcontinental railway has been let by the Government, and sub-let by the contractor at inadequate rates, and that, further, the men employed are working on Sundays. I ask the Minister if he has inquired into the truth of these statements, and, if so, with whab result? was good enough to inform me before lunch that he would ask the question. DirectlyI heard of the press statement referred to, I had inquiries made, and the following wire has been received from the Acting Supervising Engineer at the Kalgoorlie end of the line:Clearing contractor states he is doing clearing on day labour, same wages and hours as ourselves. He is paying for firewood by the cord. Similar arrangement as followed by cutting contractors on all wood tramways, and is paying is. more. Understand State Government obtains our sleepers on same system. tried day labour, and one man took ten days to cut 54 cords. If we abandon present system firewood will cost 50 per cent. more. It is obvious that the newspaper statement is without foundation. In reply to a question that was asked yesterday about the carrying out of the work at the western end of the line with day labour, I desire to say that the work so far arranged on the small contract system is as follows: Clearing. . . 29 miles at ^25 per mile; cutting and stacking firewood, 100 cords at 15s. 6d. per cord; side drains, at 4s. per lmeal chain (quantity of work not specified); cuttings, gd. per cubic yard (quantity not specified); formation, 12s. to 16s. per lineal chain (quantity not specified); cleaning out well at Cardonia, £2. per square foot (total quantity 25 feet); boring at Dingo Rock, at 5s. per foot; rock lank sinking at Dingo Rock, 6s. per cubic yard for first 200 cubic yards, 3s. per cubic vard for next 150 cubic yards; tank sinking at Jumania, 6s. per cubic yard (total quantity 50 cubic yards); erection of telegraph line by piecework also in hand Minister if it is the intention of the Government, the policy of letting work by contract having been adopted, to maintain the staffs now at Melbourne, Port Augusta, and Kalgoorlie? system of piece-work or small contracts, and it is not the intention of the Government to maintain staffs in excess of the requirements. A t the present juncture I I can let the honourable am not in a position to say that the staff which we have is excessive, but the matter will be kept in view in connection with any change of system. the Assistant Minister of Home Affairs whether it is the intention of the Government to use the new engines for ballasting purposes and general construction work on the Kalgoorlie to Port Augusta Railway? engines we have already, as far as possible, on ballast work. These are small engines, which are unsuitable for the heavy track-laying plant necessary in connection with plate-laying. state whether, in connection with the transcontinental railway, he is taking into consideration the advisableness of purchasing some of the Diesel oil engines, having regard to the saving which would be secured by their use in the matter of water ? I understand that an advance One contractor has been made in the use of such engines, and that they are now being employed in Switzerland. internal combustion engines in order to cut out the difficulties of bad water and comparative scarcity of water in the district was taken into consideration very shortly after the present Government succeeded to office. sidered and turned down by the late Administration. If the right honourable",12,Kalgoorlie To Port Augusta Railway Locomotives Smal L Contracts Stam
10,Mr Kelly,The engines just referred,13,Kalgoorlie To Port Augusta Railway Locomotives Smal L Contracts Stam
11,Mr Fisher,Has Walkers Limited,13,Kalgoorlie To Port Augusta Railway Locomotives Smal L Contracts Stam
12,Mr Kelly,The question is obvi,13,Kalgoorlie To Port Augusta Railway Locomotives Smal L Contracts Stam
13,Mr Fisher,Has the Minister any,13,Kalgoorlie To Port Augusta Railway Locomotives Smal L Contracts Stam
14,Mr Kelly,,13,Kalgoorlie To Port Augusta Railway Locomotives Smal L Contracts Stam
15,Mr Fowler,There appeared re,13,Kalgoorlie To Port Augusta Railway Locomotives Smal L Contracts Stam
16,Mr Kelly,My honourable friend,13,Kalgoorlie To Port Augusta Railway Locomotives Smal L Contracts Stam
17,Mr Bamford,I ask the Honorary,13,Kalgoorlie To Port Augusta Railway Locomotives Smal L Contracts Stam
18,Mr Kelly,We have adopted a,13,Kalgoorlie To Port Augusta Railway Locomotives Smal L Contracts Stam
19,Mr Lairdsmith,I wish to ask,13,Kalgoorlie To Port Augusta Railway Locomotives Smal L Contracts Stam
20,Mr Kelly,Yes. We shall use the,13,Kalgoorlie To Port Augusta Railway Locomotives Smal L Contracts Stam
21,Mr Conroy,Will the Minister,13,Kalgoorlie To Port Augusta Railway Locomotives Smal L Contracts Stam
22,Mr Kelly,The question of using,13,Kalgoorlie To Port Augusta Railway Locomotives Smal L Contracts Stam
23,Mr Pisher,Not before?,13,Kalgoorlie To Port Augusta Railway Locomotives Smal L Contracts Stam
24,Mr Kelly,"The proposal was conmember wishes to have that put in, he can have it. I did not touch on the matter until the right honourable member mentioned it. I did not wish to deal with these controversial subjects, but as the right honourable member insisted upon a reply to his the Honorary Minister yesterday, I asked., interjection he got it. We immediately the Prime Ministeri f it was now too late got into touch with the Diesel Engine proto prevent the importation of the sixteen"" position, but were not able to arrange ammunition waggons which the Defence any contract for the supply of a locomotive Department proposes to bring out; and of that type. We have got into touch whether it would not be possible for the with another firm, representing the Department simply to import one to be Thomas internal combustion enginea used as a pattern in manufacturing type of engine which the ex-Minister of locally the remaining waggons.' I wish Home Affairs, I think, had under conto know whether any further information sideration-and we have effected a conis available. tract with the company for the supply of a locomotive. If we can secure a satisan entirely new type, and are required factory type of internal combustion engine for defence purposes as early as possible. the cost of working the transcontinental Each gun has attached to it three wagrailway will be very seriously modified. ter promised the Leader of the Opposiabsolutely necessary for the development tion that he would make available the of the present defence system; but it is papers relating to this matter. I should proposed to manufacture locally from the like to ask whether they are in the buildtype imported the remaining two waggons ing; and, if so, will the honourable gentlerequired for each gun. It is hoped that man make them available as soon as poswe shall be able to have manufactured sible, in view of his statement that the within Australia all future supplies. Government intend to import these engines instead of having them manufactured locally? of the Opposition that he could see the July, and again on 30th September, I papers at any time. I am not sure about put questions to the Minister of Trade the advisableness of making public, at and Customs in regard to reciprocal trade present, all the papers; but the honourable relations between Australia and Canada. member may see them whenever he likes, The latest information given me was that and satisfy himself that every care has the matter was under consideration. Will been taken to see that we did not import the Minister inform the House whether these engines without absolute necessity any progress is being made? to do so. local engines before. out a shadow of foundation. railway engines, to which reference' has been made, are to cost over £5,000 each, I wish to ask the Assistant Minister of some questions yesterday in reference to Home Affairs whether they are the ordithe profit and loss on the telephone businary steam locomotive engines, or internal ness of the Department in town and councombustion engines? tion are the ordinary steam locomotives sheet figures setting forth the position. known as the "" P "" class, New South Wales engines. It is an absolute fact. more than the others did. gons; but the Department proposes to imconcerning the matter. TOWN AND COUNTRY try districts, and I then promised to have",13,Kalgoorlie To Port Augusta Railway Locomotives Smal L Contracts Stam
25,Mr Pishes,That is incorrect.,14,Telephone Services
26,Mr Kelly,,14,Telephone Services
27,Mr Ttjdor,The Honorary Minisport only one for each gun. They are,14,Telephone Services
28,Mr Kelly,,14,Telephone Services
29,Mr Pishee,You have turned down at present to make any public statement,14,Telephone Services
30,Mr Kelly,That statement is with,14,Telephone Services
31,Mr Penton',Seeing that these,14,Telephone Services
32,Mr Kelly,The engines in quesextracted from the departmental balance,14,Telephone Services
33,Mr Penton,"They are costing £1,000",14,Telephone Services
34,Mr Kelly,That is not so.,14,Telephone Services
35,Mr Mathews,In the absence of,14,Telephone Services
36,Mr Kelly,Thes e waggons are of,14,Telephone Services
37,,I informed the Leader Mr FINLAYSON -On the 9th,14,Telephone Services
38,Mr Groom,I am not in a position,14,Telephone Services
39,Mr Agar Wynne,"I was askedI propose now to put them before the House1. I have had a statement prepared which enables it to be seen where the loss on the telephone branch is taking place, that is, whether it is in the city or in the country exchanges. 2. This statement shows that in the telephone exchange business for the Commonwealth as a whole the revenue exceeded the working expenses (exclusive of interest, depreciation, and Central Office administration expenses) by j£i/,4Si. 3. In exchange networks, which serve populations of over 100,000, the surplus was £18,753, notwithstanding the fact that in the Sydney network tliere was a deficit of ^37,420. 4. In exchange networks serving between 10,000 and 100,000 population there was a surplus of £'3>9S35. In exchanges with more than fifty subscribe r serving populations with under 10,000 population, there was a surplus of ^1,645. 6. In exchanges with less than fifty subscribers there was a deficit of ^17,592Tt will be seen, therefore, that the only exchanges whicli were worked at a loss, taking the Commonwealth as a whole (and excluding interest, depreciation, and Central Office administration), are the exchanges with less than fifty exclusive services. On telephone exchange business there was a total loss of j£i73,Su, made up as follows:The charge for interest was The charge for depreciation was 56,648 Central Office administration charge was ... Less excess of revenue over working expenditure I have all the items set out here, and, as I think the document w i ll prove in teresting, I move That the paper be printed. Question resolved in the affirmative. the Postmaster-General has just read will appear in Hansard; and I should be glad if the honourable gentleman would arrange for honourable members to have advance proofs as early as possible. bers can have advance proofs as soon as they can be supplied by the Hansard Staff. presenting the Minister of Defence, upon noticeWill lie lay on the table of the House all papers in connection with the dismissal of Captain Hughes Onslow? of Defence is of opinion that no good purpose w ill be served by laying those papers on the table of the House. honourable members insist on having the papers, we shall produce them, but we think that no good purpose can be served by their production. titled to a trial ? man "" desire those papers to be laid on the table? to a t r i a l . t r i a l , and, I think, a very much more deliberate t r i a l than the late Government gave CaptainH a r d y. the case any better-tw o wrongs do not make a right. "" wrong "" ? £ Prime Minister, I suppose there is. ... 129,471 MAIL BAGS. 191,292 General, upon notice1. On what authority was the sailmaker ... ... 17,4.81 brought from Sydney to report on the uniformity of mail bags? -73.8"" 2. Were officers in Melbourne who understand the work thoroughly, and also the conditions of this State, asked to give their opinion; and if not, why not? 3. Is the Postmaster-General aware that all recommendations made by the expert re the State of Victoria have been rejected? 4. Is it true lhat since the expert has gone I take it that what back to Sydney he has been given f u l l charge of Commonwealth stores? 5. Why are the Government seeking to have mail bags made by contract in Victoria, while the Postal Department are turning out the bags in Sydney? to the honourable member's questions are1. The authority of the permanent head of the Department. It is considered that the services of all"" officers should be available in any part of the Commonwealth in which the Department may require tbem, without regard to tbe particular State in which they may happen to reside. 2 . Yes. 3. No ; I am not aware that such is the case. 4. It is not true. 5. The bags for which tenders are to be called are those which were manufactured by the Harness Factory. The late Government made an",14,Telephone Services
40,Mr Thomas,,15,Navalboard Case Op Captain Onslow
41,Mr Agar Wynne,Honorabl e mem,15,Navalboard Case Op Captain Onslow
42,Mr Watkins Asked The Minister Re,,15,Navalboard Case Op Captain Onslow
43,Mr Joseph Cook,The Minister,15,Navalboard Case Op Captain Onslow
44,Mr Pisher,Why?,15,Navalboard Case Op Captain Onslow
45,Mr Joseph Cook,"Of course, if",15,Navalboard Case Op Captain Onslow
46,Mr Tudor,Surely the man is en,15,Navalboard Case Op Captain Onslow
47,Mr Joseph Cook,"Does ""the",15,Navalboard Case Op Captain Onslow
48,Mr Tudor,I say that he isentitled,15,Navalboard Case Op Captain Onslow
49,Mr Joseph Cook,He has had a,15,Navalboard Case Op Captain Onslow
50,Mr Mcdonald,T h a t does not make,15,Navalboard Case Op Captain Onslow
51,Mr Joseph Cook,I s there a,15,Navalboard Case Op Captain Onslow
52,Mr Mcdonald,According to the,15,Navalboard Case Op Captain Onslow
53,"... ... 5,173 Mr Fenton Asked The Postmaster",,15,Navalboard Case Op Captain Onslow
54,Mr Agarwynne,"The answersexception in tbe case of New South Wales, and I have approved of that being continued, so ISng as thc cost of making the bags in Sydney reasonably approximates to the cost of making them from outside. following papers: Telephone Exchanges-Working Summarized under Groups according to Population-Al l States. Ordered to be pointed. Lands Acquisition Act-Land acquired -under, atBurnie, Tasmania-Fo r Defence purposes. Drouin, Victoria-Fo r Defence purposes. Hammond Island, Queensland-Fo r Quarantine purposes. Kalgoorlie, Western Australia-Fo r Defence purposes. Lithgow, New South Wales-Fo r Defence purposes. Pialligo, partly in Federal Territory and partly in New South Wales-Fo r Federal Capital purposes. Tailem Bend, South Australia-Fo r Postal purposes. M INISTER OF DEFENCE : REPRESENTATION OF DEPARTMENT IN THE HOUSE DE TION-CADE TDRILLS : PAYMENT OF TORY : AMMUNITI ON WAGGONS MILI TARY OF NAVIGATION NAVAL ADMINISTRATION-KALGOORLI E TO PORT AUGUSTA Question-That Mr Speaker do now leave the chair, and the House resolve itself into Committee of Supply-pro posed. told throughout the election campaign that if the present Government were returned to power they would give fair treatment to Australian industries; and members of the Labour party know how, in Victoria, all the candidates on onr side were hounded down because it was said they were not true to the principle of Protection. The Age denounced every candidate on the Labour side, but praised all the candidates on the other side, including that tried and true Protectionist, the present member for Flinders. fiscal question ? Accountsment have broken away from their promises. ment have been in power as many months as the late Government were years. to be correct. The late Government did re-open the Tariff on two occasions. have left it alone. Canberra, and Goorooyarroo, spitting on. marks will receive a lot of applause from the Government side. Several honourable members interjecting, honourable member for Yarra be allowed to proceed with his speech without undue interruption. "" close season "" for the ejection of honourable members, for they seem to be at liberty to interject without any motion from the Prime Minister. 'REGULATIONS QUEENSLAND honourable members to order. ment, in their Ministerial statement, promised that they would deal with any Tariff anomalies that might be discovered. There is no doubt that anomalies must arise from time to time; and the Age BE EF this morning tells us of one industry that is being absolutely strangled, and I want to know if the Government are going to deal with it . However, my object in rising is to call the attention of the country to the fact that the Department of Home Affairs has accepted tenders in connection with the transcontinental railway for the supply of two locomotives at Kalgoorlie at £5,200 each, and two at Port Augusta at £4,844 each. These are imported engines, and I should like to know why there should be this difference in price. freights.",15,Navalboard Case Op Captain Onslow
55,Mr Tud Or (Yarra) [2.55],We were,16,Certificates Naval
56,Mr Austin Chapman,Why raise the,16,Certificates Naval
57,Mr Tudor,Becaus e the Govern,16,Certificates Naval
58,Mr Sampson,The present Govern,16,Certificates Naval
59,Mr Tudor,That does not happen,16,Certificates Naval
60,Mr Jensen,They might just as well,16,Certificates Naval
61,Dr. Maloney,It was not wort h,16,Certificates Naval
62,Mr Tudor,No doubt those re,16,Certificates Naval
63,(Formal),Mr SPEAKER I must ask that the,16,Certificates Naval
64,Mr Tudor,"Apparently , this is tlie",16,Certificates Naval
65,Mr Speaker,I have just called,16,Certificates Naval
66,Mr Tudor,The present Govern,16,Certificates Naval
