speakerGroups,speaker,theText,pageNumbers,title
0,"$}Ouse Of Lirpresrntattrjes. Friday, Is August, 1915. A.m., And Read Prayers. Ter Of Trade And Customs Wnether The Government Have Taken Any Action Re","garding the export of sheepskins to America which, as I have previously pointed out, has assumed very large proportions since the outbreak of the war ? sheepskins to America is greater than it has been in previous years, it represents only about one-tenth of the total export trade in that commodity. The Government have decided that steps shall be taken under the powers which I possess.as Minister of Trade and Customs, to prohibit for the time being the export of sheepskins to America. ' KALGOOELIE-POET AUGUSTA able member for Swan asked me a question on the 29th ult. as to the water supply on the east-west railway. I now lay upon the table a report by the Engineer-in-Chief for Commonwealth Bailways, giving particulars available, as follows: The Secretary, Department of Home Affairs. With reference to the question asked of the Minister hy the Right Honourable Sir John Forrest, M.P., P.C, G.C.M.G., namely: "" W ill he obtain and place on the table a report from the 35ngineer-in-Chief for Eailways, as to the water supply on the east to west railway, showing(a) The situation of the wells, tanks, and dams already finished or in course of construction, and their capacity T (6) The number of bores put down for artesian supply of water, and what success has been obtained in securing fresh water? ic ) How much water has been conserved in the respective tanks? [212]2 I have to report as follows:(a) The situation of the wells, tanks, and dams already finished or in course of construction, and their capacity:Wells. Capacity. Miles from Kalgoorlie. 144 Goddard's Estimated supply up to Creek 10,000 gallons of salt water per day. Condensing plant erected. 22 0 Estimated supply up I wish to ask the Ministo 10,000 gallons fresh water per day. Tanks. 69 Karonie Reservoir with a capa(Cardonia) city of 5,000,000 gallons, and weir with a capacity of approximately 2,750,000 gallons. Weir completed. Reservoir nearing completion. 104 Reservoir to be constructed witb a capacity of 7,000,000' gallons. Work about to commence. 132 Reservoir being constructed with a capacity of 3.000,000 gallons. Work well in hand. Wells. Capacity. Miles from Kalgoorlie. 158%} A group of wells, in all estimated supply 30,000 gallons per day fresh water. 169 Estimated supply 8,000 gallons per day. 187* D.400 gallons per day. 205 10.000 gallons per day. 210J 40.000 gallons per day. 216 10.000 gallons per day. 2504 Small supply. Tanks. 53 Bookaloo Reservoir, with a capacity, 6,000,000 gallons, about completed. Reservoir, with a capa94 Windabout city, 5,000,000 gallons, under construction, nearing completion. Reservoir, with a 130 Eucolo capacity 5,000,000 gallons, under construction, nearing completion. 282 Kychering Reservoir to be constructed. Capacity 3.000,000 gallons. Plans in band. Construction to be commenced shortly.",4,Setup
1,Mr Speaker Took The Chair At 10.30,,4,Eastern Division
2,Mr Eiley,,4,Eastern Division
3,Mr Tudoe,Whil e the export of,4,Eastern Division
4,Mr Aechibald,"The right honor(6) The number of bores put down for artesian supply of water, and what success has been obtained in securing fresh water;Depth of bore. Miles from Kalgoorlie. 205 water. 220 236 feet .. Small supply good drinking water. 235 per day; suitable [10.34] I desire to bring before t i e water for drinking. 250 per day; brackish of the Prime Minister, a matter of water. 280 J water. 310 water. Bores being sunk now at 265 miles, 319 miles. patriotic offers of help and co-operation Other bores to follow. Depth of bore. Miles from Port Ausustn. 411 water. 426 water. 438 463 per day; salt water. 493 progress. 523 ^--""1 (c) How much water has been conserved in the respective tanks? None of the reservoirs are yet complete. The enable h i m to secure applications and deweir at Cardnnia has conserved approximately posits in the usual way, but was informed 700.000 to 800.000 gallons: the silt pit at that he could not be supplied with them Bnoknlno approximately 500.000: and at Lake without the authority of the Governor, Windabnut approximately 50.000 gallons. In addition to the tanks being constructed in Mr Miller, who was then in Sydney. It the Eastern Division, as referred to in the was promised that he should be communiforegoing item (re) land at Phillips' Ponds cated w it h without delay. Some few days (approximately 114 miles from Port Augusta) wns acquired, on which there isprovided elapsed, and the application was again storage for approximately 2.000.000 gallons. made. Mr Emery was then informed This storage is now being increased so as to that Mr Miller would not allow these provide at least double that quantity of water. forms to be issued to the State Savings Also an old tank at Mnnalena (approximately 70 miles from Port Augusta) has been taken Banks. over from the South Australian Government. decision. A week later, namelv, on 2nd This provides for a storage of approximately inst., the Commissioners of the State 97,000 gallons. the honourable member for Kooyong a letter intimating his desire to move the adjournment of the Housei n order to discuss a definite matter of urgent public importance, namely, "" The notation of the war loan and the treatment of the State Savings Banks by the Governor of the Approximate result. Commonwealth Banki n connection therewith."" 440 feet .. Small supply of salt Five honourable members having risen in their places, Question proposed. 323 feet .. Supply of 7,000 gallons Sir ROBERTBEST (Kooyong) 400 feet .. Supply of 7,000 gallons House, and especially under the attention urgency and importance relating to the 884 feet .. Supply of 10,000 galtreatment of the State Savings Banks by Ions per day; salt the Governor of the Commonwealth Bank. 1,371 feet .. Unlimited supply; salt My. complaint is that the Governor of the Commonwealth Bank has rejected the made by the Victorian State Savings Banki n connection with the flotation of Approximate result. the war loan by refusing to supply it with the printed forms of application. In the prospectus of the loan, which was 309 feet.. Small supply salt issued on 24th ult., it is provided, 334 feet . . Unlimited supply salt amongst other things, that application forms may be obtained from and deposits 480 feet . . Small supply salt forwarded through the media of head 500 feet .. Supply of 600 gallons offices and branches of any bank throughout the Commonwealth or any Post Omoe 360 feet .. Boring operations in where money order business is conducted. Mr Emery, the Inspector-General of the' 100 feet . . Boring operations in Victorian State Savings Bank, applied to progress. the Melbourne manager of the Commonwealth Bank for the necessary forms to No reasons were given for this Savings Bank instructed the InonectorGeneral to write to the Prime Minister, and on that day he wrote to h i m as f o l lows :BANK AND STATE SAVINGS The prospectus of the Commonwealth War Loan states that applications, deposits, and I have received from instalments may be received at anv bank. This should apparently include the State_ Savings Bank, but so far we have not received the necessary authority or forms, though we have applied to the Commonwealth Bank for them.",4,Eastern Division
5,Mr Speaker,".It is the desire of my Board that the fullest Savings Bank, and,-having received but facilities be given to the depositors in the State a formal acknowledgment, Mr Emery Savings Bank to subscribe to the loan, and also that depositors should understand that the loan saw tbe Prime Minister, and told him has thc fullest support of the State Savings exactly what had taken place. Bank. Many of our depositors being unable to Prime Minister thereupon agreed with obtain in the bank where they are accustomedthe Inspector-General, and, to his credit, to transact business the facilities which it is announced are offered at all banks, will be disapproved of tlie contention of the State couraged from applying for the bonds. In bringing the matter under your notice, mised to communicate at once with Mr. it is hoped that arrangements may be made to Miller. I understand that on the 4th place this bank in the same position as all other August, the Prime Minister did commubanks. It is tlie duty of the Commonwealth Bank wealth Bank, but as the Inspector-Geneto enlist the aid and co-operation of every ral heard nothing further, he interinstitution, and particularly such a valuviewed Mr Allen at the Treasury, on the able institution as the State Savings 6th August. Mr Allen informed Mr. Bank, in the notation of this loan. But Emery that the Prime Minister had forif the Governor of the Bank was under warded to Mr Miller his approval of the the misapprehension that the bankers State Savings Bank's request for forms, mentioned in the prospectus did not in and had even added a wish that the forms clude the State Savings Bank, I tell him should be supplied. On the 9th August that the H i gh Court has held that the Mr Emery again saw Mr Allen, who in State Savings Bank is a bank. cided the very reverse of that. orable gentleman is utterly wrong. The ister, to communicate again by telegram H i g h Court decided by a majority of four with Mr Miller, and urge that the reto one that the State Savings Bank is a quest of the State Savings Bank might bank. that if such a technical objection has last. Yet, although three weeks have been taken by the Governor of the Bank elapsed since this question was raised, up it is a paltry one, and should not be to this moment those forms have not been tolerated for one moment. Savings Bank is a recognised public in stitution of great standing; it is the people's bank, and to reject and spurn its co-operation in a matter of this kind is tice to the State Savings Bank? most unworthy, and constitutes an act of grave indiscretion. to keep the Commonwealth Bank free furthe r than to say that this great public from political influence. in this connection the Governor of the draw special attention to the fact that in Bank is usurping an authority which he Sydney also applications were made by is not entitled to. I am not proposing to the head of the State Savings Bank of interfere with him in the administration New South Wales to Mr Miller, who of the affairs of the Bank. This loan is directly refused to supply the forms. being floated by the Treasurer with the authority of Parliament, and the Comany reason for his refusal? monwealth Bank is a mere agent for doing what the Prime Minister, as Treavernor of the Bank wishes to rely on his surer and representative of this Parliatechnical view of the law that the State ment, desires that it shall do. On the Savings Banks are not included as banks, 2nd August the letter I have already I draw attention to the case of The Comquoted was written to the Prime Minismissioners of the State Savings Bank of ter by the Inspector-General, at the in of Victoria (defendants) appellants, and stance of the Commissioners of the State Permewan, Wright and Company The Savings Bank Commissioners, and pronicate with the Governor of the Commonformed him that no reply had yet been Mr Allen very courteously promised, no B ut even were it not so, I say be complied with. That was on Monday The State supplied, notwithstanding the fact that application for them has been made in both Sydney and Melbourne. Mr J. H . CATTS -What is the injusmember cannot judge that matter for himI thought you wished self I shall not attempt to explain it institution is not being treated in the same I desire to m Limited",5,Adjournment Formal Commonwealth Warloan Common Wealth Banks
6,Mr Fisher,The H i g h Court dereceived from the Governor of the Bank.,6,Adjournment Formal Commonwealth Warloan Common Wealth Banks
7,Sir Robert Best,"The righ t hondoubt, at the instance of the Prime Min",6,Adjournment Formal Commonwealth Warloan Common Wealth Banks
8,Mr Hampson,,6,Adjournment Formal Commonwealth Warloan Common Wealth Banks
9,Sir Robert Best,"Certainly , but way as the private banks.",6,Adjournment Formal Commonwealth Warloan Common Wealth Banks
10,Sir Robert Best,If the honourable,6,Adjournment Formal Commonwealth Warloan Common Wealth Banks
11,Mr Bamford,Did Mr Miller assign,6,Adjournment Formal Commonwealth Warloan Common Wealth Banks
12,Sir Robert Best,"No. If the Go(plaintiffs) respondents, on appeal from the Supreme Court of Victoria. TheH i g h Court heldThat the Commissioners of the State Savings Bank of Victoria, whose real and substantial business was of that nature, are bankers within the meaning of section 88 of tbe Bills of Exchange Act 1909, and section 83 of the Instruinvest in the loan, and the people would ments Act 1890 (Vict.), notwithstanding that under the Savings Banks Act 1901, repayments of deposits were only permitted on production of the depositor's pass-book witb his order for payment. cision ? Sir ROBE RT BEST -That is the decision of our H i gh Court. It was so held by Justices Isaacs, Duffy, Powers, and Rich, the Chief Justice alone dissenting. I ask honourable members to reflect for a moment how great and serious this indiscretion is. Here we are launching, for the first time, a large loan on our local markets; and it is a loan for an amount that must, more or less, strain our resources, while it is accompanied with the knowledge that possibly other loans are to follow. It has been made essentially a people's loan, launched, to a considerable degree, on the same lines as the loans of the Imperial Parliament, the idea and aim being to democratize the financial operation by the fixing of the denominations. It would be naturally thought that aid would be sought from the State Savings Banks, which could be of the greatest heln and value-thos e democratic institutions which are well and favourably established in every State. There are something like 2,000,000 people-almos t half our population-associate d with the Savings Banks, and to their credit there is upwards of £82,000,000. people throughout Australia have been accustomed to do all their business through the Savings Banks; and, remembering that, we can realize how grave a mistakehas been made by the Commonwealth Banki n not securing their help. member say whether the application for egregious mistake. This is a matter in the forms was made in the interests of the which we should all pull togetherSavings Banks themselves or of the deno source of help should be rejected positors ? solely and purely for patriotic reasons. of the Commonwealth Bank rather than It is to the disadvantage of the State contumeliously put aside. Savings Banks to co-operate in this way, has, I think, misconceived his position. because it means the withdrawal of moneys from these banks and their in a mistake-it qannot possibly be a misvestment, in the war loan. MrJ . H . CATTS -Why, the Victorian Savings Bank has tried to stop the war loan by raising its interest! Sir ROBERTBEST It is the first essential that every facility and encouragement should be given to the people to naturally be anxious to operate through the banks to which they have been accustomed. I am speaking now, not on behalf of Victoria alone, but also on behalf I s that the latest deof New South Wales, because the Savings Bank of the latter State has been in cooperation with the Inspector-General The Inspector-Generali n Sydney directly appealed to Mr Miller himself, and was directly refused, much to his indignation. the Savings Banks is less than that of the Commonwealth loan. As Victoria has been referred to, let us look at the state of affairs in that State. We have a population of 1,300,000, or 1,400,000; and no fewer than 700,000 people have accounts at the Savings Bank, representing in this one State alone a credit of upwards of £25,000,000. When an appeal, as in this case, is made to the many rather than to the few, as in previous cases, the Savings Banks are, above all other institutions, those from which cooperation and help should be soughtthey should not only be invited to helpbut that help should be catered for. The Savings Banks have, expressed their anxiety to help; and this, it must be Thousands of remembered, to their own disadvantage. But their anxiety arises from purely patriotic reasons. However, their overtures in this connection are rejected ancl spurned. I desire l o make no reflection on Mr Miller, whom I believe to be an earnest and zealous public officer; honourable but in my opinion he has made an -and the Savings Banks should have Mr Miller take !",6,Adjournment Formal Commonwealth Warloan Common Wealth Banks
13,Mr Fisher,,7,Adjournment Formal Commonwealth Warloan Common Wealth Banks
14,Mr Bamford,Can the,7,Adjournment Formal Commonwealth Warloan Common Wealth Banks
15,Sir Robert Best,It was made been taken to the arms of the Governor,7,Adjournment Formal Commonwealth Warloan Common Wealth Banks
16,Mr Fisher,F o r how long?,7,Adjournment Formal Commonwealth Warloan Common Wealth Banks
17,Sir Robert Best,I cannot say.,7,Adjournment Formal Commonwealth Warloan Common Wealth Banks
18,Mr Sampson,The interest given by,7,Adjournment Formal Commonwealth Warloan Common Wealth Banks
19,Sir Robert Best,Of course it is.,7,Adjournment Formal Commonwealth Warloan Common Wealth Banks
20,Mr Mathews,"It must be more thantend to say. I can only tell the honorPersonally, I do not think Mr Miller able member tliat three weeks of work should be charged with anything imand help from the States Savings Banks proper without direct proof. has already been prevented by reason of this mistake on the part of the Commonmonwealth Bank Governor. «ess without the help of the State Savings any attack on the right honourable gentleBanks! will; we dare not contemplate for a also the Leader of the Opposition. moment that it will be anything but a success. It would be a great reflection has done what would be expected of a on the people of Australia if it were common-sense business man under the cirnot; but if we are to make this and cumstances. subsequent loans a success, we must all proval of the co-operation and help of the co-operate in this great patriotic work. State Savings Banks being secured, but Any financial institution would fail in his approval and wishes in this .matter its duty if it did not proffer its aid; and have been flouted, and the wishes of Par-I repeat that, of course, the loan is liament have also been flouted. going to be a success. WhatI wish to say is that the Governor of the Bank appears to have altogether mistaken his position in this matter. He is not the Parliament have not been flouted ? principal, but is only the agent of Parliament and the Government; and the been flouted at all. Treasurer is our mouthpiece. The Treasurer has expressed his approval of these would be more correct to say that they institutions being availed of, and it is conhave been ignored. temptible to advance technical reasons why it should not be. I have no doubt that honourable gentleman make out his case the Prime Minister will explain why his without dealing with me. I shall have wishes, which should be law in this the opportunity of reply. matter, are not absolutely respected. It cannot be suggested for a moment with making a statement of the facts. I would reason or justice that this is an attempt ask my right honourable friend to be good to interfere with the management or administration of the Commonwealth Bank. enough to send for the letter of the 4th I cannot help being amused to see, in August to Mr Miller, and the telegram the prospectus and advertisements of the from Mr Miller on the 9th August, and loan, the prominence that is given to verify to the hilt everything I have said. the Commonwealth Bank, as though it They will, no doubt, speak for themselves. were the principal. that the prospectus had been issued from ceived most courteously by the right honthe Bank itself. However, that is simply orable the Prime Minister. by tlio way. I have no feelings regarding Mr Miller except those of respect, and teously. I have already paid my tribute to him as a public officer; but when a _ great proaching my right honourable friend for mistake such as this is made, it is the that. I am simply desirous of showing duty of Parliament to see it rectified. I that he approved of the request-and this -desire, moreover, to say to Mr Miller is what I want to emphasize-that forms that he lays himself open to the gravest should be supplied to the States Savings suspicion, and, indeed, to the charge, Banks. I have no personal feeling in the that the object he has in viewI do not matter at all, but I ask the House to conmake the charge or say this, but people generally do say it-is to divert the template whether it is not exceedingly uncustomers of the StatesSavings Banks wise in a time like the present, when all to the Commonwealth Bank in order to should be co-operating and helping, to reable gentleman is responsible. man. He has expressed his apI t would appear May I also say that Mr Emery was reject the offers of a State Savings Bank,",7,Adjournment Formal Commonwealth Warloan Common Wealth Banks
21,Sir Robert Best,I do not presecure some of tlie business of the former.,8,Adjournment Formal Commonwealth Warloan Common Wealth Banks
22,Mr Riley,The loan will be a suc,8,Adjournment Formal Commonwealth Warloan Common Wealth Banks
23,Sir Robert Best,Of course it,8,Adjournment Formal Commonwealth Warloan Common Wealth Banks
24,Mr Fisher,Mak e the attack on me.,8,Adjournment Formal Commonwealth Warloan Common Wealth Banks
25,Mr Joseph Cook,The right honor,8,Adjournment Formal Commonwealth Warloan Common Wealth Banks
26,Sir Robert Best,I do not make,8,Adjournment Formal Commonwealth Warloan Common Wealth Banks
27,Mr Fisher,"But I ask you to, as does",8,Adjournment Formal Commonwealth Warloan Common Wealth Banks
28,Sir Robert Best,The Treasurer,8,Adjournment Formal Commonwealth Warloan Common Wealth Banks
29,Mr Fisher,They have not.,8,Adjournment Formal Commonwealth Warloan Common Wealth Banks
30,Sir Robert Best,The wishes of,8,Adjournment Formal Commonwealth Warloan Common Wealth Banks
31,Mr Fisher,My instructions have not,8,Adjournment Formal Commonwealth Warloan Common Wealth Banks
32,Sir Robert Best,Perhaps it,8,Adjournment Formal Commonwealth Warloan Common Wealth Banks
33,Mr Fisher,No r ignored; but let the,8,Adjournment Formal Commonwealth Warloan Common Wealth Banks
34,Sir Robert Best,I am simply,8,Adjournment Formal Commonwealth Warloan Common Wealth Banks
35,Mr Fisher,I receive everybody cour.,8,Adjournment Formal Commonwealth Warloan Common Wealth Banks
