speakerGroups,speaker,theText,pageNumbers,title
36,Sir Robert Best,"I am not rewhich should have been the first to have been accepted in this matter. I feel especially strongly upon this point, because I know that the Savings Bank had no selfish motive to serve, and that all the overtures made were animated solely by patriotic motives. The bank was anxious to do something which, thoughi t would have been to its own disadvantage, would have had the higher object of securing the success of the national loan. suggest, notwithstanding the loss of tliree weeks of valuable time, in view of the prestige which w ill be secured by the successful flotation of this loan, and the effect of this prestige upon any future loan, that the Prime Minister should, at least, see that the mistake of the Governor is rectified, and that facilities are at once given to the State Savings Banksi n the direction they desire. now. not. office and get the forms. honourable member honourable member's time has expired. Minister and Treasurer) [ 1 1 . 5 ] sorry I did not hear the opening remarks of the honourable member's speech, but since I came into the ChamberI have heard more about the patriotism and the determination of this bank to help the Commonwealth loan, than we are likely to hear about any other matter for a long time. .1 am not here to complain at the attitude of the Victorian State Savings Bank, but it is a singular fact that immediately the Commonwealth war loan was announced it altered its conditions of investment in a way that was not calculated to benefit the war loan. 1 per cent, below the loan rate. mattei-? want to add that the Bank has a perfect motives."" That is my rejoinder. right to manage its own business in its own way, and for its own protection. poor one. Not a single word of complaint at tlie Bank's action has been uttered by any comment. responsible man associated with the Commonwealth Government. patriotic motives? the Commonwealth Bank has been attacked, and, incidentally, the Government's position has been also attackedbecause the honourable gentleman cannot dissociate himself from the reI would mark of the Leader of the Opposition that I am the person to be blamed. right honourable gentleman was the person to be blamed. I said the right honourable gentleman was responsible. responsible, who is to blame? Nobody else will get the blame if I am responsible. I do not ask to be sheltered from any responsibility of mine by somebody else being made a victim. The fact is* that it was long after tlie loan had been launched that Mr Emery saw' me. friend was not in the chamber when I said that within two or three days application was made to the Melbourne manager of the Commonwealth Bank for tliese forms but they were not supplied. Mr Millery was subsequently communicated with, and he also refused to give them. the Victorian State Savings Bank was I am raised, on the issue of the prospectus for the Commonwealth loan, to 3$ per cent, on deposits ranging from £ 1 to £350. Previously the range was, I believe, £ 1 to £ 1 5 0 at 3£ per cent. It was also raised to 3£ per cent, on deposit stock from £ 1 0 to £1,000, and on deposits and deposit stock together up to £1,350. ings Banksp u t up their rates in the same way? the Commonwealth Bank. but, on the authority of the honourable member for Kooyong, the whole of the W h a t does t h a t attitude which some persons have recently taken up, and also displayed in the""House,",8,Adjournment Formal Commonwealth Warloan Common Wealth Banks
37,Mr Riley,They have the facilities,9,Adjournment Formal Commonwealth Warloan Common Wealth Banks
38,Sir Robert Best,"No, they have",9,Adjournment Formal Commonwealth Warloan Common Wealth Banks
39,Mr Riley,They can go to any post,9,Adjournment Formal Commonwealth Warloan Common Wealth Banks
40,Sir Robert Best,Let me tell the,9,Adjournment Formal Commonwealth Warloan Common Wealth Banks
41,Mr Speaker,Orde r ! Order! The,9,Adjournment Formal Commonwealth Warloan Common Wealth Banks
42,"Mr Fisher (""Wide Bay",Prime,9,Adjournment Formal Commonwealth Warloan Common Wealth Banks
43,Mr Sampson,Its interest rate is still,9,Adjournment Formal Commonwealth Warloan Common Wealth Banks
44,Sir Robebt Best,,9,Adjournment Formal Commonwealth Warloan Common Wealth Banks
45,Mr Fisher,"Having stated that, I has been inspired by "" p u r e l y patriotic",9,Adjournment Formal Commonwealth Warloan Common Wealth Banks
46,Mr Hannan,Was it done witb,9,Adjournment Formal Commonwealth Warloan Common Wealth Banks
47,Mr Fisher,No w the Governor of,9,Adjournment Formal Commonwealth Warloan Common Wealth Banks
48,Mr Joseph Cook,I did not say the,9,Adjournment Formal Commonwealth Warloan Common Wealth Banks
49,Mr Fisher,E x a c t l y ; and if I am,9,Adjournment Formal Commonwealth Warloan Common Wealth Banks
50,Sir Robert Best,My right honourable,9,Adjournment Formal Commonwealth Warloan Common Wealth Banks
51,Mr Fisher,The rate of interest in,9,Adjournment Formal Commonwealth Warloan Common Wealth Banks
52,Mr Kelly,H a v e all the State Sav,9,Adjournment Formal Commonwealth Warloan Common Wealth Banks
53,Mr Fisher,I do not think so.,9,Adjournment Formal Commonwealth Warloan Common Wealth Banks
54,Mr Mahon,It is a deliberate blow at,9,Adjournment Formal Commonwealth Warloan Common Wealth Banks
55,Mr Fisher,"I do not say that it is,",9,Adjournment Formal Commonwealth Warloan Common Wealth Banks
56,Sir Robert Best,"If so, it is a very",9,Adjournment Formal Commonwealth Warloan Common Wealth Banks
57,Mr Fisher.*,"It is just a preliminaryister say that the rate of interest generally ties and facilities that will be offered to has not increased ? been a good deal of excitement this mornthem to them. ing. I have heard some mention of keeping heads cool. I trust that honourable "" prospectuses."" members will bear that advice in mind. Six minutes of the Prime Minister's time [11.16] I have listened very carefully has expired, and as he has only a quarter of an hour in which to speak, I ask honourable members to refrain from interjecting. will suffice me. The Governor of the Commonwealth Rank has not disobeyed my friends .opposite are in a grinning any of my orders. He has not been mood to-day. They seem to grin at the dilatory to any extent that would cause slightest provocation. I do not know me to reflect upon his conduct. I am in whether to sympathize with the Prime favour of the States Savings Banks being Minister or condemn him, but I have given every facility to assist in the flotanever heard such a long drawn-out sneer tion of our loan, but I am desirous of in this Parliament before against the knowing whether all the States are in States, and all that concerns them. H is favour of it . Victoria has communicated speech, from beginning to end, contained with New South Wales, and New South nothing but innuendoes, sneers, jibes, and Wales and Victoria have acted together. jeers, at these great State institutions. Lately they have generally done so"" from patriotic motives."" wrong in their doing so ? immediately, the publio became acquainted simply because the rate of interest paid with the fact, and the matter finds its by these institutions had gone up. Has way into politics, action is taken, not not the rate of interest been going up to the advantage of the public in in every financial institution in Austerests, but, in my opinion, to the tralia ? Does not the rate of interest in detriment of bhem. But I am not here to the Savings Banks always bear a definite complain as to that. The States Savings relation to the amount that the State Banks will get their opportunity in ample Governments pay for loans? That haa time to perform all the patriotic services always been the case from time immethat they are capable of performing. morial. Why, therefore, should a readThey have even the opportunity of rejustment of those rates excite all these verting to their old rate of interest if jeers and jibes from my right honourable they so desire. They can go back to the friend ? I have said that he is responposition that obtained prior to the issue sible, and not Mr Miller. Mr Miller of the Commonwealth War Loan. They is merely the agent of the Treasurer in can render such purely patriotic serthis matter, and my right honourable vices as will tend to make this loan sefriend has to take the responsibility for cure, but before they became anxious whatever the Governor of the Commonabout the loan, its success was already aswealth Bank does, so long as it is done,, sured, since, apart from the States Savasi n this case, with his knowledge. The ings Banks, or even other banks, the feelright honourable-gentleman has not given ings of the people of Australia generally, us any reason for the delay in refusing those with little to spare as well, happily, to give the States Savings Banks these as also those who have much to spare, have facilities for the last three weeks. been so aroused for patriotic and financial reasons-the y recognise that it is a good investment-as to assure the success ister has told us tliat he approved of of the loan. The honourable member for granting these facilities to the StatesKooyong need not be under any misapSavings Banks. the States Savings Banks. They will reto the Prime Minister. gentleman propose to pour oil on the A quarter of an hour troubled waters? Why? These institutions are entitled to do what they have done. All through his speech the Prime Minister communicated no facts. He simply indulged in ' one long drawn-out sneer against the States",9,Adjournment Formal Commonwealth Warloan Common Wealth Banks
58,Mr Sampson,Does the PrimeM in prehension with regard to the opportuni,10,Adjournment Formal Commonwealth Warloan Common Wealth Banks
59,Mr Speaker,Order! There has ceive their prospectuses. We shall send,10,Adjournment Formal Commonwealth Warloan Common Wealth Banks
60,Mr Fisher,,10,Adjournment Formal Commonwealth Warloan Common Wealth Banks
61,Mr Joseph Cook,I s there anything,10,Adjournment Formal Commonwealth Warloan Common Wealth Banks
62,Mr Fisher,"Nothing at all, but, Savings Banks and their management:",10,Adjournment Formal Commonwealth Warloan Common Wealth Banks
63,Sir Robert Best,"I said "" for m s , "" not",10,Adjournment Formal Commonwealth Warloan Common Wealth Banks
64,Mr Joseph Cook (Parramatta),,10,Adjournment Formal Commonwealth Warloan Common Wealth Banks
65,Mr Higgs,Does the right honourable,10,Adjournment Formal Commonwealth Warloan Common Wealth Banks
66,Mr Josephcook,I am glad that,10,Adjournment Formal Commonwealth Warloan Common Wealth Banks
67,Sir Robert Best,"The PrimeM i nclear that Mr Miller has been flouting the Prime Miuister for at least three weeks in this matter, and if the trouble is now to be remedied it will be so much the better. It is better to do it late than not to do it at all. Sir ister did not say that application forms would be forwarded. the right honourable gentleman intends that the States Savings Banks w ill get the forms. will get them. They will be sent to them. does the Leader of the Opposition desire? ing more, but I think that there is justifiable cause for complaint in the fact that whereas private institutions have been given every facilit y by this Socialistic Government, socialistic institutions have been treated by it with contempt. fare, is it? Minister's speech a non-party speech? I deeply regret this kind of temper and treatment of the States at the present juncture. If ever there was a time when the States and the Commonwealth, particularly in regard to financial matters, should act in close and cordial association and co-operation, it is the present. There should not be this feeling between the Prime Minister and the managers of these State institutions that apparently exists. What is wrong w i th two State Banks conferring as to or conducting common business upon the same principles? They have to do it in close association w it h their State Governments. should they not confer ? Does the Prime Minister believe that, when they meet together to settle their own common differences, they are doing something unpatriotic ? they are setting the Prime Minister a good example, and he ought to meet with them, although he is in antagonism w i th them in. all these financial matters. to look out. stood that the right honourable gentleman was quite able to take care of ""himself and his Government. that when we have stripped of all their part of the Prime Minister, the plain fact remains that Mr Miller has been trying I take it that to steal a march on these gentlemen, and that he has been trying to obtain for himself and his Bank some advantage at their expense. look at these facts without having such an attitude towards State enterprises and | State Governments at this, of all times, is most unfortunate. What reason can there be for not giving these State banks an agency just as it is given to private banks ? agency concerned. It is a question of dignity. work for nothing, tliere is a question of agency involved. The private banks have deposits amounting to £170,000,000 or £180,000,000, while the State Savings Banks have deposits amounting to over £80,000,000. They represent half the total savings of the people. They represent more particularly the savings of the workers, andthey ask for facilities for bheir clients, just, as the private banks desire, facilities, for those who do business with them. But the Government, which is supposed chiefly to represent the great working classes of Australia;-it is constantly making that claim-ha s deliberately set aside the State Savings Banks as agents of workmen, while at the same time it places all possible facilities in tlie Why hands, of those who represent the private banks. All should have been treated alike, and I am pleased' that the Prime Minister has said that, even at this, the eleventh hour-becaus e there is not much time left-h e is going to "" take care that not. the State Savings Banks are treated in the same way that private banks are treated."" could always obtain the forms; but we shall now send them to them. tain them.",10,Adjournment Formal Commonwealth Warloan Common Wealth Banks
68,Mr Joseph Cook,,11,Moloney Wha T More Impression Burnt Into His Mind Such An
69,Mr Josep Hcook,,11,Moloney Wha T More Impression Burnt Into His Mind Such An
70,Mr Fishek,,11,Moloney Wha T More Impression Burnt Into His Mind Such An
71,Mr Parker,,11,Moloney Wha T More Impression Burnt Into His Mind Such An
72,Mr Joseph Cook,I desire noth,11,Moloney Wha T More Impression Burnt Into His Mind Such An
73,Mr Ozanne,This is non-party war,11,Moloney Wha T More Impression Burnt Into His Mind Such An
74,Mr Joseph Cook,Was the Prime,11,Moloney Wha T More Impression Burnt Into His Mind Such An
75,Mr Fisheb,Certainly,11,Moloney Wha T More Impression Burnt Into His Mind Such An
76,Mr Joseph Cook,In so meeting,11,Moloney Wha T More Impression Burnt Into His Mind Such An
77,Mr Fishes.:,"When I see them, I have",11,Moloney Wha T More Impression Burnt Into His Mind Such An
78,,It is quite Mr. JOSEPH COOK I always under,11,Moloney Wha T More Impression Burnt Into His Mind Such An
79,Mr Fisher,No t with them.,11,Moloney Wha T More Impression Burnt Into His Mind Such An
80,Mr Josephcook,It seems to me,11,Moloney Wha T More Impression Burnt Into His Mind Such An
81,,I have said that they Mr FISHER I do not think that is so.,11,Moloney Wha T More Impression Burnt Into His Mind Such An
82,Mr Joseph Cook,No one can,11,Moloney Wha T More Impression Burnt Into His Mind Such An
83,Mr Fisher,There is no question of,11,Moloney Wha T More Impression Burnt Into His Mind Such An
84,Mr Joseph Cook,Even if they,11,Moloney Wha T More Impression Burnt Into His Mind Such An
85,Mr Fisher,The State Savings Banks,11,Moloney Wha T More Impression Burnt Into His Mind Such An
86,Sir Robert Best,"They could not obmaking an incorrect statement. question of dignity. made here this morning is tliat the Victorian State Savings Bank asked for these forms, and could not obtain them. Representatives of the bank then interviewed the Prime Minister, and received a promise that their request would be complied with, but that has not yet been done. That is the complaint, but if the Savings Banks are now to get what they want no more remains to be said on the subject. Question resolved in the negative. Treasurer consider the advisableness of remitting to the Public Accounts Committee tlie question of the creation of a Supply and Tender Board, so that it may examine the machinery at present in existence in the various States, and furnish a report on the subject? is a very good one. The sooner we have a Supply and Tender Board consisting of men of the highest capacity obtainable the better. Board, in my opinion, has been delayed far too long, but in war time it is dimcult to break in upon existing practices. I view favourably the suggestion made by the honourable member. -state whether steps have yet been taken by the State Parliaments to legalize participation by trustees, on behalf of their beneficiaries, in the Commonwealth War Loan? ing with the matter have been introduced in all the State Parliaments, and passed by one or two of them. I shall ascertain (he exact position later in the day, and advise the honourable member. It is essential that such measures should be passed by all the State Parliaments. The State -Governments have promised that they shall be, but some of them are suggesting a compromise. In no circumstances can we compromise in a matter of this kind, and the States must decide either for or against the proposal. The power of the Commonwealth has been limited again and again by tlie eternal system of compromise. All that is involved is a REPORT BY MR . ANDERSON. Prime Minister, in the absence of the Postmaster-General, whether an assurance report on the Postal Department will be laid on the table of the House before the proposed adjournment takes place ? sired to send a wireless message to the troopship Runic, and was informed by the officer in charge of the telegraph office in these premises that the charge was 5d. per word. He subsequently advised me that he had received from head-quarters an intimation that while that was the ordinary rate, a special rate of l i d . per word was charged in respect of troopships. Can the Postmaster-General advance any reason why the men on our troopships or friends desiring to communiThe appointment of such a cate with them by wireless should be charged double the ordinary rates? member had better give notice of his question, so that I may give him f u l l in formation on the subject. I would point out that in this respect troopships are in a very different position from ordinary C a n tlie Prime Minister merchant vessels. MR. ATLEE HUNT'S VISIT.:-ACQUISITIO N OF HOTEL PROPERTIES. ternal Affairs give any reason why Mr. AtleeH u n t , secretary of hia Department, should have been despatched to the Northern Territory, seeing that the Admin istrator was here only two months ago ? ministratorwas not in Melbourne two months ago. To be exact, he has been in Darwin since March. MrH u n t has been sent to the Northern Territory for several good reasons, any one of which would be suflicient to justify his visit. We are initiating there a new policy in connection with the liquor traffic, and it is necessary that he should visit the Territory to assist in establishing that",11,Moloney Wha T More Impression Burnt Into His Mind Such An
87,Mr Joseph Cook,Some one is,12,Northern Territory
88,Mr Fishes,,12,Northern Territory
89,Mr Joseph Cook,The allegation,12,Northern Territory
90,Mr Richard Foster,Will the,12,Northern Territory
91,Mr Fisher,Yes; I think the idea,12,Northern Territory
92,Mr Kelly,,12,Northern Territory
93,Mr Fisher,,12,Northern Territory
94,Mr Thomas,I desire to ask the,12,Northern Territory
95,Can Be Given That Mr Mcc. Anderson's,,12,Northern Territory
96,Mr Fisher,Yes.,12,Northern Territory
97,Mr Orchard,Yesterday I de,12,Northern Territory
98,Mr Spence,I think the honourable,12,Northern Territory
99,,I think that Bills dealMr RILEY --Can the Minister of Ex,12,Northern Territory
100,Mr Mahon,"F i r s t of all, the A dpolicy. Then, againj the Administrator a has for some time heen urging that the lands officers dealing with lands in the Territory, and now stationed in Melbourne, should be transferred to Darwin. Opinions on the point are divided, and it is necessary that MrH u n t should go to Darwin and look into-the matter himself, so that we may avoid the risk of sending these men up there only to have to bring tnem back again. There are other reasons why MrH u n t should visit Darwin at this time, and I anticipate that the Department will reap considerable advantage from his trip. External Affairs state whether any definite principles have been laid down by the Government as to the basis upon which hotel properties in the Northern Territory will be acquired, and, if so, whether it is intended to deal with the matter by special Ordinance? far been made, but we sliall probably deal with the matter by special Ordinance. GUNS. the attention of the Prime Minister to a sub-leader in to-day's Age dealing with the manufacture of machine guns in Australia, and to ask whether the Government will take the matter into immediate consideration, and, if necessary, place themselves in communication with the I m perial Government with a view to the manufacture of machine guns in Australia ? vernment ordered machinery for the manufacture of machine guns. MrW . ELLIOT JOHNSON -When w ill tion be postponed. It is very difficult to that machinery arrive? mium to secure early delivery, but those questions is given only on the preI cannot say on what date the machinery vious day. Notice should be given on will be delivered. BILL. ister state whether the Murray Waters at 10.30. The information sought in theAgreement B ill has been passed by all the question must be obtained from Port State Parliaments concerned, and if he Darwin. In f u t u r e when the honourable proposes, during the current year, to advance to those States the the notice-paper, I hope he w ill give us £1,000,000 promised, in connection with sufficient time to enable us to obtain the the Murray waters scheme? tion yesterday. The Government will not take action until all' the State Parliaments concerned have passed the necessary Bills to give effect to the Murray waters scheme. When they have done so we shall be prepared to pay our proportionate share. I tliink I may make the same promise on behalf of the Leader of the Opposition, because both parties are pledged to allow the work to go on. ter introduce a B ill to provide for it ? anything of the kind until the Stateshave taken the necessary action; but I am sure the Leader of the Opposition would not object to the Commonwealth making a small contribution, even without the direct authority of Parliament, in order to give effect to the policy to< which we are pledged. External Affairs, upon noticeIn regard to a naturalized Chinese, named Leung See, otherwise known as Ah SeeI wish to direct 1. Did he work, as a carpenter, to thesatisfaction of the railway officersfor a period of twenty years? 2. Has he now been dismissed; and, if so,. is it because he is non-unionist? 3. Is it known that he is willing to become a unionist, but cannot do so,, because Chinese are not admitted? 4. Was his claim for employment supported by the Government Secretary at Port Darwin? 5. Were instructions issued that he should be dismissed; and, if so, by whom,, and was it because of unionist pressure ? obtain replies to questions which are toW e paid a special prebe asked on Friday morning if notice of Wednesday so that the officers may havetime to secure the information required. ment received the notice-paper at 9 W ill the PrimeM in o'clock this morning, and the House met financial member has a similar question to place on -information.",12,Northern Territory
101,Mr Groom,Will the Minister of,13,Discharge Of Naturalized Chinaman
102,Mr Mahon,No arrangement has so,13,Discharge Of Naturalized Chinaman
103,Sir Robert Best,,13,Discharge Of Naturalized Chinaman
104,Mr Fisher,Months ago this Go,13,Discharge Of Naturalized Chinaman
105,Mr Fisher,,13,Discharge Of Naturalized Chinaman
106,Mr Fenton,,13,Discharge Of Naturalized Chinaman
107,Mr Fisher,I answered this ques,13,Discharge Of Naturalized Chinaman
108,Mr Sampson,Will the Prim© Minis,13,Discharge Of Naturalized Chinaman
109,Mr Fisher,We ought not to do,13,Discharge Of Naturalized Chinaman
110,Mr Joseph Cook,"Hear, hear!",13,Discharge Of Naturalized Chinaman
111,Mr Palmer Asked The Minister O F,,13,Discharge Of Naturalized Chinaman
