speakerGroups,speaker,theText,pageNumbers,title
164,Mr Mcgrath,"He has not to do it.the matter was before the Committee on a previous occasion, the Minister gave an assurance that f u l l opportunity would be given for the discussion of this point when it came back from another place. to recommit the clause, but the clause was uot recommitted. Committee would have the fullest opportunity of discussing this particular question after the B ill had been dealt with by the Senate. nothing to do w i th the point of order. orable member for Maribyrnong is quite within his province in moving this amendment. TheB ill provides for pensions to the dependants of soldiers who have lost their lives at the front. The amendment submitted by the honourable member simply seeks that a widowed mother shall be placed in the same position as a widow. I submit that the amendment is perfectly in order. amendment is in order. As I take it , the Minister's objection is that its incorporation in the B ill will increase the expenditure. If that objection is valid, the Committee would have no power to increase a proposed pension from £ 5 2 to £ 5 2 10s. expenditure without a further message relevant to the B ill if we were discussing from the Crown. duced an amendment has been accepted by ask is that widowed mothers be added to the Government in another place which the list of dependants. has had the effect of increasing the pension payments. that amendment in the B ill . They made it. any extra message. . the amendment in the Senate. that make ? The Minister says this action ance with the rules of the House, apart was taken in the Senate, but the original altogether from what may have been message was delivered to this House. I s done previously, as suggested by the honi t suggested that an amendment of this orable member for Barrier, in regard to I understand that when description can be made in the Senate and not here? Senate was covered by the original message. pensions have been increased by the amendment moved in the Senate. We only admit that the definition has been altered. like that. We might just as"" well argue that the amendment proposed by the honourable member for Maribyrnong w ill not increase the cost, but w ill Order ! That has simply make an alteration in t i e definition. This is not a comic opera; it is a Parliament. Supposing grandchildren had been omitted from the list of possible dependants, and the Committee desired to put them in , is it suggested that the Committee would not have power to make that addition? It seems to me that the point raised by the Minister is not tenable. the point bf order raised by the Minister, because, rightly or wrongly, there was an impression in the minds of several honI also claim that the orable members, when the B ill was before us previously, that some alteration would be made in another place. would bring the matter under the notice of the Government. Chairman wil l not be a party to tying the hands of honourable members in the matter of moving to add to the list of the measure itself, and we are in exactly charge of the B ill has asked my ruling on the point of order-that as the inserput tion of the words proposed by the honourable member for Maribyrnong would increase expenditure, they are not covered is not my provinoe to restrict debate, matter, and I am asked to give a ruling",18,Forces May Then Be Granted A Pension At Such Rate
165,Mr Hannan,,19,Forces May Then Be Granted A Pension At Such Rate
166,Mr Jensen,No.,19,Forces May Then Be Granted A Pension At Such Rate
167,Mr Thomas,The Minister promised,19,Forces May Then Be Granted A Pension At Such Rate
168,Mr Hannan,,19,Forces May Then Be Granted A Pension At Such Rate
169,The Chairman,,19,Forces May Then Be Granted A Pension At Such Rate
170,Mr Chablton,I claim that the hon,19,Forces May Then Be Granted A Pension At Such Rate
171,Mr Thomas,,19,Forces May Then Be Granted A Pension At Such Rate
172,Mr Jensen,No.,19,Forces May Then Be Granted A Pension At Such Rate
173,Mr Thomas,We could not do it?,19,Forces May Then Be Granted A Pension At Such Rate
174,Mr Jensen,No.,19,Forces May Then Be Granted A Pension At Such Rate
175,Mr Abchibald,You cannot increase dependants. It would be an amendment,19,Forces May Then Be Granted A Pension At Such Rate
176,Mr Thomas,Sinc e the B ill was introthe same position to-day. All that we,19,Forces May Then Be Granted A Pension At Such Rate
177,Mr Jensen,The Government,19,Forces May Then Be Granted A Pension At Such Rate
178,Mr Thomas,Exactly; but without by the Governor General's message. It,19,Forces May Then Be Granted A Pension At Such Rate
179,Mr Jensen,The Government moved but if my attention is called to a specific,19,Forces May Then Be Granted A Pension At Such Rate
180,Mr Thomas,"What difference does upon it , I am bound to do so in accord",19,Forces May Then Be Granted A Pension At Such Rate
181,Mr Abchibald,The action of the,19,Forces May Then Be Granted A Pension At Such Rate
182,Mr Jensen,We do not admit that,19,Forces May Then Be Granted A Pension At Such Rate
183,,I understood that the Mr THOMAS It is of no use to argue,19,Forces May Then Be Granted A Pension At Such Rate
184,Mr Penton,I am surprised at,19,Forces May Then Be Granted A Pension At Such Rate
185,Mr Jensen,-No. I promised that I,19,Forces May Then Be Granted A Pension At Such Rate
186,Mr Fenton,I am sure that the.,19,Forces May Then Be Granted A Pension At Such Rate
187,The Chairman,"The Ministeri na matter which is not before the Chair to-day and has not been before the Chair at any time. The rules of procedure are clear. All Money Bills are preceded by a message from the Crown making provision for certain expenditure and no more, and the provisions of the B ill must be kept within the limits of that expenditure. Apart from the statement oi the Minister thatwidowed mothers are already provided for in the B ill , and therefore there is no necessity for the amendment, as the Minister in his responsible position says that the insertion of the words proposed by the honourable member for Maribyrnong would increase the expenditure beyond the provision in the Governor General's message, I am bound to rule that the amendment is not in order. The only method honourable members could adopt to secure the end they desire would be to solicit the Government to bring down another message to cover the addition to the B ill which they propose. The amendment is not in order. posedThat the War Pensions Bill 191.5 be referred back to the Governor General with the view of making provision for the widowed mother and the mother dependant who is in the same position as a wife of a member of the Expeditionary Forces. in charge of the Committee for the time being, I can only deal with the specific matter referred to it , namely, the amendments made by the Senate. TheB ill itself is not now before the Committee, and as the amendment submitted by the honourable member refers to the B ill , he must take some other step to have it considered. A t the present juncture he is not in order in moving it . previous ruling, Mr Chairman, was correct, but I believe that the Committee is empowered to deal with the matter in a way that will carry into effect the wishes and desires of the majority of honourable members. the honourable member. The Committee has the power to do what it chooses, but not at this particular juncture. I must confine the debate to the matters embodied in the amendments made by the Senate and sent to us for acceptance or otherwise. Opportunity will be afforded to the honourable member at another time to seek what he desires to obtain. [12.27] I desire to speak to the amendment made by the Senate. It is quite evident that the desire of the majority of members of the Committee is to liberalize the provisions of this Bill to a greater extent than the Government propose, and I am surprised that the Government have not recognised the fact. Honourable members are just as responsible to the community as are the Ministers. We are constantly asked whether such and such a provision is a fair way of dealing with men who go to the front, or their dependants. Many of us have attended meetings and urged that the men of the country should volunteer for the front, and without any qualification we have asserted that the country would look after their dependants. We could not ask a man to go to the f r o n t unless we made that assertion. I suppose every honourable member has said it . The trouble, however, is that, although we pass a B ill for that purpose, much of it is rendered useless by regulations. hind the regulations. They are based upon the Act. several instances in which regulations have prevented the wishes of honourable members being carried into effect. In one case the wife of a man who had been but eleven mouthy in Australia before volunteering to go to the f r o n t is in ill-health, and has two children. She is anxious to return to England for the period of the war, because she has no friends here, and she knows that during her ill-health she can find friends in England, who will look after her and her family. She has no I recognise that your desire to leave Australia altogether. If lier husband returns from the war, it is their desire to settle in Australia; but the moment she leaves Australia she gets nothing from us, and is thrown on the world. That is done by regulation. In another case, a young man who was a shipI quite agree with wright earning £ 3 12s. a week, and kept his mother in England, submitted to the Defence Department the receipts for the money he had sent to her. He was desirous of having her put in the same position as if she lived in Australia, but now, because he has enlisted, his widowed mother loses her source of income, and gets nothing. That also is done by regulation, and I do not think it is fair.",19,Forces May Then Be Granted A Pension At Such Rate
188,Amendment (By Mr Mathews) Pro,,20,Forces May Then Be Granted A Pension At Such Rate
189,The Chairman,"Placed as I am,",20,Forces May Then Be Granted A Pension At Such Rate
190,Mr Mathews,,20,Forces May Then Be Granted A Pension At Such Rate
191,The Chairman,,20,Forces May Then Be Granted A Pension At Such Rate
192,Mr Mathews (Melbourne Ports),,20,Forces May Then Be Granted A Pension At Such Rate
193,Mr Thomas,D o not let us shelter be,20,Forces May Then Be Granted A Pension At Such Rate
194,Mr Mathews,"I have in mindWhen we ask these men to go to the front , ttihose who remain behind talk about the «ost. They should be prepared to provide the money to treat our soldiers and their dependants in a fair and square manner. While I am desirous of supporting the Government in order that we may have the B ill liberalized in the direction tliat honourable members desire, I shall vote against this amendment that comes from another place. Surely the wishes of honourable members who are trying to do their best in regard to the great recruiting movement for the defence of the Empire are worthy of consideration. provided for. in which she is not. As I could not get any satisfaction from the Defence Department, I submitted them to the Prime Minister. mother with two sons at the front receives nothing because she is not dependent on either of them. I know three cases of women dependent on sons, but they are not widows. In one case the husband is an invalid ; in another case tlie husband took a moonlight f l it , and went to the SouthA f r i c an war, and did not come back again. leave anything behind for tlieir mothers? tain amount of their pay behind. They leave what they can. A man who goes to the f r o n t needs at the very least 2s. a day. adequate enough to keep the mothers in the way in which they were kept prior to their sons going to the war. W h y should the mothers be penalized because those who maintain them have gone to the front? Bringing this question down to one of hard, matter-of-fact, fair dealing, these mothers shoulcl be considered pounds. The Minister has conceded that that I shall do all I can to prevent this House adjourning for any protracted period while the war is on, because this Chamber provides us with the only opportunity we can have of ventilating grievances. The War Committee is making provision for a big recruiting movement, but I think I am justified in refusing to do anything more u n t i l provision is made for the dependants of those who go to the front . I shall vote against the amendment until specific provision is made to deal fairly and squarely with all tliese cases. We should not leave them to be dealt with by regulation. We should know what these regulations are to be before we agree to the B ill . -The Minister has scarcely investigated the possible effect of widening the term "" d e p e n d a n t"" in order to meet the wishes of a majority of the Committee. If he had studied the expenditure involved he would have no hesitation in giving effect to that desire. According to the latest Commonwealth Year-Book there are in the Commonwealth 475,000 married women between the ages of twenty-one and forty-five. We may take it that the widows 'of soldiers killed and I have given cases the wives of those incapacitated would be amongst tliose who are between the ages of twenty-one and forty-five years. The wider definition made by the Senate, so In another case a widowed as to include all married women 'regardless of their financial position, would cover all women who are bereft of their husbands. The widowed mothers who have sent sons to the f r o n t may be inferred to be those over forty-five years of age; and there are in the Commonwealth between forty-five and sixty-five years of age 54,000 widows. Under the Act in its present form the great the sons majority of widows will be provided for because they are mostly dependent on 1 the earnings of their children, and therefore the inclusion of widowed mothers without any condition as to dependency would involve only a very small addiThe allowance to dependants is not tional expenditure. I admit thab the widening of the term "" dependants"" in regard to the wives and children of those soldiers who are killed or incapacitated w ill mean a substantial increase in the total war pensions. But the inclusion of the widowed mother will not increase the expenditure by many thousands of the claim on behalf of the wives and chilA l l I can say is dren of those killed at the f r o n t is just, but I do not think that any one will dispute that the widowed mother has an equal claim, and in 90 per cent, of the cases she will be found to be more or less dependent on the earnings of her children. According to the income tax returns the number of widows receiving an independent income is very small, and therefore the amount that would be paid in . pensions to those widowed mothers who enjoy such incomes would be a very small addition to the total amount paid.",20,Forces May Then Be Granted A Pension At Such Rate
195,Mr Jensen,The widowed mother is,21,Forces May Then Be Granted A Pension At Such Rate
196,Mr Mathews,,21,Forces May Then Be Granted A Pension At Such Rate
197,Sir John Forrest,D o not,21,Forces May Then Be Granted A Pension At Such Rate
198,Mr Mathews,They leave a cer,21,Forces May Then Be Granted A Pension At Such Rate
199,Mr Jensen,They are considered.,21,Forces May Then Be Granted A Pension At Such Rate
200,Mr Mathews,,21,Forces May Then Be Granted A Pension At Such Rate
201,Mr Sampson (Wimmera) [12.35].,"All of tbe half-million married women between the ages of twenty-one and forty-five years would be entitled, without any conditions being imposed, to draw pensions in the event of their husbands being killed or incapacitated. But the widows of the Commonwealth number only about one-tenth of the married women; many of them are provided for under the present terms of the B ill , and therefore the additional number that would be included it' the amendment 1 am suggesting were made would not be very great, and the increase in expenditure would be very small. small expenditure justice would be done to women who are equally as deserving as the wives of soldiers. A t this time, when we are asking the best manhood or the Commonwealth to go to the f r o n t we should give an assurance that reasonable justice will be meted out to the dependants of those who are killed. If we do not give that assurance now we shall not give it at all. Eveni f the meting out of justice involves a very large expenditure of public money, it is the duty of ourselves and of the generations that will follow to shoulder that expenditure, l t is not a matter of generosity but a simple act of justice, and the payment oi these pensions is a proper responsibility to be shouldered by those of us who do not go to the front. move That the Senate's amendment No. 1 be amended by leaving out the words "" by omitting."" If this amendment is carried it will be an indication to the Government that the inclusion of tbe widowed mother is desired by members of this Committee. The Government have stated that they are not prepared to accept the responsibility of including tlie widowed mother as honourable members have suggested, but I suppose the Government will obey the expressed wish of the Committee. If my amendment is defeated that will end the discussion, b u t the carrying of it will be an instruction to the Government to make the necessary alteration. If the Government refuse to make the amendment that is desired the House wil l b3 able to deal with them afterwards. Navy) moved no doubt with a definite intention. . The question now arises-wha t am I to do? In order that I may confer with' the members of the Government, I think that we ought to report progress. Progress reported. Sitting suspended from 12.51 to 2.15 p.m. B ill returned from the Senate without amendment. Y e t by that SMALL ARMS FACTORY, Debate resumed from 12th August (vide BALDThat, in view of the report of the Parliamentary Standing Committee on Publio Works, it is desirable that a Small Arms Factory, with necessary provision for housing workmen, be erected forthwith at Canberra. The Public Works Committee gave f u l l consideration to this question, free altogether from party considerations. A l though the division of tlie members of the Committee on the question might suggest a different conclusion, I do not believe that there is really any party tinge in the matter. The members of the Committee are working very harmoniously together, as I think is shown by the amount of work done. The Committee, when it has presented itsi report to the House, has done its d u t y ; and tlie acceptance or rejection of the report cannot mean any reflection on its members. ceeded their duty. opinion. lawyers on this side, but cheap law is not good. As I say, it is for the House and the Government to adopt or reject the report; and whatever the decision may be, it will convey no reflection on the Committee. Personally, I have no feeling in the matter. As chairman of the Public Works Committee, I considered the evidence with an open mind, and gave a vote which I believed to be in the in [12.50] -The amendment is in the interests of the whole of the people of Australia. The Commonwealth possesses a territory of 900 square miles, of determination. which we ought to be proud. What does",21,Forces May Then Be Granted A Pension At Such Rate
202,Mr Thomas (Barrier) [12.45],I,22,Canberra
203,Mr Jensen (Bass,"Minister for the terests, not of any particular place, but",22,Canberra
204,Mr Hannan,-And,22,Canberra
205,Mr Jensen,And determination.,22,Canberra
206,"Page 5751), On Motion By Mr Archi",,22,Canberra
207,Mr Riley (South Sydney) [2.15],,22,Canberra
208,Mr Carr,The Committee have ex,22,Canberra
209,Mr Riley,T h a t is a matter of,22,Canberra
210,Mr Carr,It is a matter of law.,22,Canberra
211,Mr Riley,"Evidently there are manythe Commonwealth propose to do with that territory? Isi t proposed to keep it for sheep and cattle grazing, or just for spectacular purposes ? If this Government and Parliament are not prepared to develop the Territory they should hand it back to the State of New South Wales. tory was taken over the New South Wales people have been wondering for what purpose the Commonwealth wanted it. wealth has not done much with it up to now, and it will be a reflection on us, as representatives of the people, if we are not able to rise above mere parochial in terests, and concentrate our energies on making the Territory worthy of the Commonwealth. W h a t righ t has the Commonwealth to monopolize 900 square miles of land unless it is prepared to develop it? sums in purchasing land there; and if the area is to be of any use, we should make it the centre of all Federal factory and other utilities, with a view to bringing in some return. The honourable member for Gippsland has expressed the opinion that the Public Works Committee went outside their reference and functions when they recommended the removal of the Small Arms Factory to Canberra. we "" may ""-hav e been at faul t there. orable member for legal advice later on. It is the policy of the Labour Government and party that this Territory shall remain the property of the Commonwealth for all time in the interests of the whole of the people; and we have now a golden opportunity of demonstrating to the civilized world what can be done in the way of nationalization of land. We have an opportunity of getting away from the slum conditions that prevail throughout the world, and building up a model city with good social conditions for the industrial classes; and yet we find honourable members who are prepared to regard, I shall not say personal interest, but personal views, as to the claims of a certain district, in preference to looking at the matter from a broad national stand-point. spend the money in providing more rifles? for Lang has always advocated the furtherance of the Federal Capital scheme; and I shall be very, much in terested to note how he votes on the present occasion. MrW . ELLIOT JOHNSON -This is not the proper time. now! We have, as I say, an opportunity to place a large population of a manufacturing class within the Territory; and by doing so we shall not add to the value of private land, but add to the wealth of the whole of the people. Like the honourable member for Macquarie, I am a representative of New South Wales, and might be expected to take a similar stand; but I was returned as a representative of We have already spent enormous the Commonwealth as a whole, and must take a broader view. The honourable member for Perth, who is a member of the Public Accounts Committee, spoke last night on this question, and was quite logical from his point of view. He asked what need tliere is for a Small Arms Factory elsewhere now that two shifts have O r else abandon it . been established at Lithgow? He is against the expenditure of money on additions to the factory, because the two shifts now working are turning out almost as many rifles, some 2,000 a month, as could be turned out if the Factory were duplicated We mayI say, and worked eight hours. In view of what he believes will be the early close of the war, the honourable member does not see any need for greater expenditure on miliI shall come to the hontary preparations; and, moreover, he has told us that the rifles at present in use will be obsolete in a few years, rendering unnecessary any new factory or plant for their production. But if that argument is worth anything at all, it applies, not only to other classes of armament, but also to warships. Wheni t was proposed to build war vessels for Australia, there were honourable members who declared that, before they were completed, they would be obsolete. not be fa r from obsolete! war vessel is better than no vessel at all. The small Navy we have has been some protection to our people, although there were some who sneered at it . It is true that there are always continual changes",22,Canberra
212,Mr Patten,Eve r since the Terri,23,Canberra
213,Mr Riley,Certainly the Common,23,Canberra
214,Mr Mathews,O r else abandon it .,23,Canberra
215,Mr Riley,,23,Canberra
216,Mr Carr,That is the legal aspect.,23,Canberra
217,Mr Riley,,23,Canberra
218,Mr W. Elliot Johnson,Why not,23,Canberra
219,Mr Riley,The honourable member,23,Canberra
220,Mr Riley,"No t now, Oh Lord, not",23,Canberra
221,Mr Mcwilliams,The Brisbane will,23,Canberra
