speakerGroups,speaker,theText,pageNumbers,title
125,Mr Boyd,"I have tried on two orthink they cam get along very well without ue, and do not see why we should .be consulted or considered in any way. The only purpose for' which we have been paid since the W a r Precautions Act has been in existence has been to talk. me that Parliament has been tied up to the talking stake. According to an old French proverb, "" the goat browses where it is tethered."" with the Parliament for allowing the Government to do this thing. allowed the. Government to do anything of the kind. meeting under normal peace conditions, instead of being a Parliament elected during the war, and if it understood its responsibilities, the Government would be removed from office for an action of this k in d ; b u t Parliament seems to be infected with sleeping sickness. All the old vigour, vim and snap have departed from our political life. all right. rable member, I think the death rattle is in this Parliament's throat. condition into which Parliament has degenerated that the people might well say with Milton, "" I will fetch him hence and solemnly attend with silent obsequy and funeral t r a in . "" ter for Works and Railways and Acting Attorney-General) House to take a brief glance at the position, of the world in regard to shipping. -members know well the war necessities which Minister( Mr Hughes) to purchase the Austral line of ships, a course which subsequent events more than amply justified. They know, also, the trouble that arose as the war progressed, owing to the sinking of ships by enemy action, and the intensification of the shipping shortage all over the world. The position became such that we in Australia had to seriously consider how we could help the primary producers to export their products, and help ourselves by importing those things which were necessary. About the 12th July, , 1917, the Prime Minister made a stateA n d vote money. ment to the House, pointing out .the It seems to necessity for Australia to take some action to promote local shipbuilding in order, to meet the necessities of our situation. In addition to encouraging local building, steps were taken to have vessels constructed for us in the United States of America. Boats of any kind were being bought at the highest possible rates, irrespective of speed and tonnage; and acting wiselv, I believe, the Government made The Parliament has not certain contracts for the building of wooden ships in the United States of America. Now that the war is over, those If this Parliament were vessels ar© not suitable for normal requirements; but had we possessed them during the war, they would have rendered invaluable service to Australia. Parliament approved of the action of the Government in starting shipbuilding in Australia. That was an entirely new enterprise, and to an island continent like Australia, which is dependent for its national . prosperity on the export of primary products, an essential industry. Shipbuilding yards Avere started at Williamstown; the Government of New South Wales were Such is the encouraged to undertake shipbuilding at Walsh Island; and the Commonwealth also utilized the plant at Cockatoo Island. Six vessels were p u t in hand, each of 5,500 tons. Three of these have been launched; they are a credit to Australia, and give .promise of the establishment of a permanent shipbuilding industry in the Commonwealth. Contracts for fourteen [ 4 . 6 ] I ask the other vessels were placed, some w it h retrospective private firms throughout the Commonwealth. Later, the Government deHonorable cided to acquire larger vessels, and orders were placed in Australia for compelled the Prime four ships of 12,S00 tons each. That shipbuilding programme will occupy two and a-half years; b u t we realized that even that would not give us all the boats which we ought to have. It was necessary, therefore, to supplement that scheme by obtaining ships in the Old Country if we could. Honourable members are",32,Shipbuilding Government Contracts
126,Mr Watkins,,33,Shipbuilding Government Contracts
127,Mr Boyd,Quite so.,33,Shipbuilding Government Contracts
128,Mr Kelly,W h y decry Parliament?,33,Shipbuilding Government Contracts
129,Mr Boyd,Becaus e the f a u l t rests,33,Shipbuilding Government Contracts
130,Mr Kelly,,33,Shipbuilding Government Contracts
131,Mr Boyd,,33,Shipbuilding Government Contracts
132,Mr Jowett,The honourable member is,33,Shipbuilding Government Contracts
133,Mr Boyd,When I listen to the hon,33,Shipbuilding Government Contracts
134,Mr Groom (Darling Downs,"Minisaware (that sin.ee the restoration of peace 'there has .arisen a tremendous demand .aM over the world for shipping. prices axe offered for ships of every .kind. All tbe yards in Great Britain are working at their fullest capacity, and endeavours are being made to start new shipbuilding enterprises. Were TO in Aust r a l i a to remain idle, and do nothing for our new nation that had in reality just come into international being as the result of the great war? The Government -felt that they were under an obligation to do something to meet our necessities. The honourable member Q Mr Boyd) stated that he had a conversation w it h the Acting Prime Minister{ MrW a t t ) , who had given him Acting Prime Minister told the honourable (member was true in letter and in spirit. Neither the Prime Minister( Mr Hughes) nor anybody acting in his behalf, nor the Government in Australia, had entered into any contract for the pur;chase of ships at that date; but some time later the Government d i d t r y to get possession of certain boats of a large type. MT . GROOM -About A p r i l of this make a statement to the contrary. Cabiyear; but owing to the large demand for net knew what it was* doing, and took shipping, and the delay that took place action w it h a f u l l sense of responsibility. in accepting the opportunity that was The Government could not submit the presented,, those vessels were lost to us. proposals to tlie House and awaitTowards the end of June, or the beparliamentary sanction. We had either ginning of July, we were afforded an to act promptly or lose the opportunity opportunity of obtaining other ships altogether. from Vickers and Company, and, subsequently, two more from Beardmore. possible to get options over these shipsSuch is the exceptional demand for shippending the obtaining .of parliamentary p in g in the Old World that it is imposauthority ? tions for shipbuilding. tenders would have been absolutely hope that. less. The only thing we could do was to look about, and take advantage of any to do it? .reasonable and just opportunity which presented itself. The honourable member an offer of ships was before -the Governfor Henty says t h a t we ought to have ment^ there was .a slight delay .in conbrought the matter before the House, sidering it , aud owing to the great .deand obtained parliamentary sanction .bemand for ships .the opportunity was lost. fore taking action. the course pursued by the ^Government sponsibility placed upon fche Government.rests, not w it h the Prime Minister, or <of .securing proper .and sufficient .tonnage with both .of the Ministers abroad, but -for .the .export of .our primary products, with the whole Cabinet, .and we gladly -take it iu.pon .ourselves. High Mr (RICHARD POSTER -Cabinet musttake the responsibility. purchase -was carried out w it h the knowledge and approval of Cabinet. Mr .BOYD -When? Vickers was signed on ;or about the 4th July of this year. fche .time. for Henty July authority was given for the purchaseof other boats fro m Beardmore. Australia associate themselves with thiscertain assurances. What the purchase ? ated w it h it all through the transaction. Cables passed between Cabinet and the Prime Minister. Ministers in Australia were'conversant with the facts, and acceptf u l l responsibility for the action t h a t wastaken. Prime -Minister a blank cheque. orable member has already heard me'Calling for utterly hopeless -to have attempted to doMr -KELLY -Was any attempt madeResponsibility for I remind honourable members of the re-",33,Shipbuilding Government Contracts
135,Mr Rodgers,On what date ?,34,Shipbuilding Government Contracts
136,Sible To Get F R O M .Any British Firms Quota,. Mr GROOM -It would have been,34,Shipbuilding Government Contracts
137,Mr Groom,My point is that this,34,Shipbuilding Government Contracts
138,Mr Groom,The contract w it h .,34,Shipbuilding Government Contracts
139,Mr Boyd,The House was sitting at,34,Shipbuilding Government Contracts
140,Mr Groom,That is so. On 17th,34,Shipbuilding Government Contracts
141,Mr Kelly,W h e n did Ministers in,34,Shipbuilding Government Contracts
142,Mr Groom,We have been associ,34,Shipbuilding Government Contracts
143,Mr Higgs,The Government gave the,34,Shipbuilding Government Contracts
144,Mr Groom,We did not. The hon,34,Shipbuilding Government Contracts
145,Mr Sampson,Would it not have been,34,Shipbuilding Government Contracts
146,Mr Groom,"On a previous occasionand I particularly call their attention to the operations of the "" Conference Shipping Lines."" Tho activities of the Conference are of very great importance to Australia, and neither the Government nor Parliament can overlook that fact. Combinations in shipping are not of recent growth. Even before the war they were becoming an Empire problem of very serious import. During the war tonnage was greatly reduced, and on the declaration of peace the Shipping Conference developed and consolidated to a remarkable extent. The Conference lines comprise the following: Gross register. Peninsular and .Oriental Steam Navigation"" Company Royal Mail Steam Packet Company ... ... ..: 1,675,696 Cunard Steam-ship Company Limited Furness, Withy, and Company Limited Ellerman Group ... ... 913,116 Alfred Holt and Company T. and J. Harrison ... Total The majority of those companies have one or more lines trading to Australia. lian agent of the Conference is the ma'whom the Government appointed to deal with shipping, Sir Owen Cox. or not that is correct; but I am dealing with the proiblem which Australia has to face. Since that list of Conference lines was prepared a Japanese line and the Eastern and' Australian Company have been added. Let the House consider what that shipping monopoly means to the producers and the exporters of primary produce. with their five ships, to beat that combination ? ships. We are hoping that the competition of them, and the ships we are building locally, will have a considerable effect upon shipping freights. Nobody knows better than does the honourable member how the Conference operates in influencing trade into its own channels. These lines work on a deferred rebate [415] system, under which shippers are compelled to sign a declaration at the end of given periods to the effect that they havo not shipped any cargo by vessels outside those controlled by the Conference. I shall mention to the House an illustration of how even Governments may be compelled by the Conference to toe the mark. The Government of Victoria booked"" a certain amount of space on the Commonwealth ship Bulla, but owing to the fact that they were notified that they might lose a considerable sum of money in deferred rebates, they withdrew the shipment from the Commonwealth line. That is an illustration of the operationsof this Combine. I have shown the circumstances which faced the Government. ... 1,833,020 Shipping was short all over the world. What vessels were available for Australia were under the control of a Combine. ... ... ... 540,956 Shipbuilding firms in the UnitedK in g dom were building vessels as fast as they ... ... ... 1,084,927 could. We could not successfully ... 556,427 call for tenders. It was impossible ... 283,301 to get quotations without considerable delay. It was our obligation 6,887,443 to do our best to enable our exporters and primary producers to get their produce to market o n . f a i r terms, and when the opthe Austraportunity came there was only one step possible for Ministers. We were in communication with the Prime Minister( Mr. Hughes), and acting completely in unison with h i m ; and in the fulfilment of the trust imposed on us, we felt it our duty to approve these contracts, and be prepared to accept the responsibility. ment acquaint Parliament immediatelyaction was taken? Minister( Mr Watt) informed honor1 able members that the ActingM i nister for the Navy( Mr Poynton) would make a statement at an early date, and last week that Minister informed the House that these obligations had been entered into. It was only a few days ago that the House practically adopted the policy put forward in the Ministerial statement, which contained the following :During the past year the shipbuilding pol icy of . the Commonwealth has been energetically pursued. Two steel vessels have been",34,Shipbuilding Government Contracts
147,Mr Mcwilliams,And,35,Shipbuilding Government Contracts
148,Mr Groom,I do not know whether,35,Shipbuilding Government Contracts
149,Mr Boyd,"Did the Government hope,",35,Shipbuilding Government Contracts
150,Mr Groom,Not with only the five,35,Shipbuilding Government Contracts
151,Mr Fowler,Why did not the Governr,35,Shipbuilding Government Contracts
152,Mr Groom,"The Acting Primelaunched in Australia, ten more are under construction, and contracts have been entered into for another ten. The contracts for wooden ships in Australia have, for the most part, been cancelled. It is the intention of the Government, when opportunity offers, to dispose of similar ships built on the Pacific coast of America. The policy of the Government is to continue the Commonwealth Line of Steamers, and to build larger and faster vessels for our oversea trade, so that the producers of our exportable primary products shall be assured satisfactory shipping facilities at reasonable rates. Negotiations in this direction are at present in progress. The information members wanted was embodied in that paragraph. vernment have merely given effect to a policy which has been adopted not only by the House, but by Australia. Minister( Mr Groom) has not answered the honourable member for He n t y ( Mr Boyd) . not of the Commonwealth owning a line of only question under discussion was whether right to enter into contracts on behalf of the people of Australia without submitting them to Parliament. question the Government have failed to answer. for.e the people at the next election, if they do hot answer more f u l l y other questions that w ill be put to them they w ill have absolutely nothing to submit to the people. tained. conditions may have applied during the war, but they do not obtain to-day. Parliament was sitting when these contracts with Vickers and Beardmore were completed.. There is a difference between the purchase of the fourteen or fifteen ships when we wer.e at war, and the contract just entered into. did not give the House any information in regard to those-ships. given. honourable member to contradict me in a parrot-like fashion. The information was given to the House. I am heartily in accord with what the Minister has saidin regard to fighting the Combine, but I agree w it h the honourable member for Henty that when -an announcement of policy has to be made it should come from a Minister, and not from a public servant. In March last we were told by Mr Larkin, a very estimable man, and a very good servant of the ComThe Gomonwealth, that the Government did not propose to withdraw their ships-wit h which I am in accord-and were going to fight the Ring-if they were able to do it . However, that was a statement which should have been made by a Minister. Would the Ministerf o r the Navy permit That honourable member did Mr Macandie to put h i m aside and set out attack the wisdom or otherwise the policy of the Naval Department? Or would the Treasurer allow Mr Collins to. steamers. He said that the set.out the policy of the"" Department of the Treasury? The Primie Minister, ( Mr. the Government have fche Hughes) and the Ministerf o r the N a v y ( Sir Joseph Cook) were in England at the time Mr Larkin made his statement. That Why did they not makeit? long before the statement was made by I .answered it f u l l y , Mr Larkin, I informed the House that' we intended to continue in the shipping business. Steam-ship line is not yet legally constituted. voted by Parliament in the Estimates, and no exception has been taken to the Commonwealth being committed to a policy of shipbuilding in Australia. fore Parliament; but the vessels to which the honourable member for Henty( Mr. Boyd) takes exception are the three to be built by Vickers and the twoto .be built by Beardmore's. I understand that they are vessels of from 12,000 tons to 20,000 tons burden. On Thursday last the Acting Ministerf o r the N a v y ( Mr. Poynton) gave us details in regard to 'all the other vessel's, but uot",35,Shipbuilding Government Contracts
153,Mr Tudor' ( Y A R R A ) [4.24],The,36,Shipbuilding Government Contracts
154,Mr Groom,,36,Shipbuilding Government Contracts
155,Mr Tudor,When Ministers are be,36,Shipbuilding Government Contracts
156,Mr Corser,No option could be ob,36,Shipbuilding Government Contracts
157,Mr Tudor,That is absurd. Such,36,Shipbuilding Government Contracts
158,Mr Pigott,The honourable member,36,Shipbuilding Government Contracts
159,Mr Tudor,Pul l information was.,36,Shipbuilding Government Contracts
160,Mr Pigott,It was not.,36,Shipbuilding Government Contracts
161,Mr Tudor,It ia useless for fche,36,Shipbuilding Government Contracts
162,Mr Poynton,"As a matter of fact,",36,Shipbuilding Government Contracts
163,Mr Rodgers,The Commonwealth,36,Shipbuilding Government Contracts
164,Mr Tudor,The money has been,36,Shipbuilding Government Contracts
165,Mr Boyd,"Hear, hear!",36,Shipbuilding Government Contracts
166,Mr Tudor.,"That matter was be-one detail in regard to these five.. If Parliament allows Ministers to enter into contracts for five ships, costing about £2,000,000, without a knowledge of the details of the vessels, the purchase of the Shaw Wireless Works w ill be only a circumstance compared w i th what this transaction may turn out to be. I disagree with the honourable member for Henty on the question of the advisability of the Commonwealth owning a line of steamers, and as to fighting the Combine of ship-owners, but I am in accord w i th him when he says that public tenders should be called now for the building of these vessels. we get the result of those tenders, it w ill itself clear. be a very long time before we establish a orable member to see that in connection Commonwealth line of steamers. about shipbuilding as the honourable memtion or implication of f r a u d or corrupber does. member's statement shows exactly how Australia through a private f i r m , tenders much he does know. tion to-day is different from what it was during the war. The honourable member case in all contracts oversea. for Henty is right in saying that many honourable members who were returned at different, and the honourable member the last election are blind-folded supought to have sense enough to know it ! porters of the Government, and that they are prepared to condone any offence M in honourable member is an authority on isters may commit. .now than we were under the honourable have not more than the honourable memmember's Government. has never voted against the Government ought to have a lot of sense, because I on any matter-no t even on an amendhave never known h i m use any inside the ment to a B ill . member for Grey( Mr Poynton), as a ting when these contracts were entered private member, brought forward an into, but we did nofc know anything of amendment on a War LoanB ill to repeal them u n t i l questions were asked by the exemption of the holders of war loan various members. bonds from payment of income tax, he been going on fOT over three months; and was supported from this side of the House, unless we decide that' tenders must be but we were told that it was an absurd called in the case of any. large expendiproposal. Yet, within six months, when ture of money, we shall be giving . up the Government brought down that very our rights as a Parliament. amendment as a Ministerial proposal, honourable members who previously opposed it allotted for the discussion of a motion of were found voting for it . No Governthis kind is not sufficient to enable us to ment has had more subservient followers do justice to the question. It might have [415]2 than are to Ibe found sitting behind Ministers to-day. The honourable member for H in d marsh ( Mr Archibald) said that right should be done on every occasion. Right should be done in this case. Tenders should be called for these vessels. Unless that is done, and unless the fullest daylight is let in , we shall be opening the door to f r a u d and corruption. The honourable member for Henty says that it is even now said in Collins-street and other places the city of Melbourne. If we wait u n t i l is said; but this Parliament should keep It is the duty of every honwith every contract on behalf of the GoI know nearly as much vernment we keep clear of any suggestion. Every one here w ill admit that if The honourable business of this kind were transacted in would be called and the price stated. sense. ber. When the honourable House or outside. Parliament was sitThis business has I regret exceedingly that the time",36,Shipbuilding Government Contracts
167,Mr Hector Lamond,,37,Shipbuilding Government Contracts
168,Mr Tudor,,37,Shipbuilding Government Contracts
169,Mr Hector Lamond,,37,Shipbuilding Government Contracts
170,Mr Tudor,,37,Shipbuilding Government Contracts
171,Mr Latrd Smith,,37,Shipbuilding Government Contracts
172,. Mr Tudor,The honourable member,37,Shipbuilding Government Contracts
173,Dr. Maloney,It is being said a l l over,37,Shipbuilding Government Contracts
174,Mr Tudor,I do not know where it,37,Shipbuilding Government Contracts
175,,I know that the posiMr ARCHIBALD -S o it ought to be.,37,Shipbuilding Government Contracts
176,Mr Tudor,And it ought to be the,37,Shipbuilding Government Contracts
177,Mr Archibald,The conditions are,37,Shipbuilding Government Contracts
178,Mr Tudor,I do not think that the,37,Shipbuilding Government Contracts
179,,We are a bit freer Mr ARCHIBALD -Heaven help me if I,37,Shipbuilding Government Contracts
