speakerGroups,speaker,theText,pageNumbers,title
175,Under Clause 19 This Board Mr Brennan,"T h a t is so. I haveChair. He is a member of the Country party, and yet assails the Labour party. He has done so this afternoon. It is not a question of putting it to his lips when he feels "" so dispoged."" He stood in his corner this afternoon and told us that he supports the honourable member for Angas( Mr Gabb), and will take the only further step necessary to establish a state enterprise in connection with this industry. be in the arms of honourable members on this side, and our arms about his neck. But he saya, "" Oh, you Labour members. I adopt your principles, but I attack you for certain political reasons""-in cidental to his representation of the electorate of Wimmera. and the world is mine,"" does not apply to the party opposite. He applied it to certain imperfectly healed patches of the"" pact of which honourable members have some knowledge. He was referring to certain blackmailers who shall not be named, but whose ideiftity has been indicated by my honoured leader. We have departed from the sound principles of constitutional government. We have seen the dav come in our own time and generation when private enterprise is to be overwhelmed by government interference; when wool and wheat, peas, potatoes, peanuts, and other things are to be controlled by this Parliament in the interests of the people. Some have taken the plunge, 'like the honourable member for Wimmera, and are swimming in these uncharted seas as confidently as if they had been returned to advance the great cause of socialism. Others, like the small boy, have taken off their clothes to bathe, but dipping their toes in the water, have remarked, "" Ah, but it is cold,"" and do not take the plunge. Of such is the honourable member for Kooyong( Mr Latham). I am glad to know that you, Mr Temporary Chairman( Mr Cook), as a representative of the primary producers, uphold the right of the Government to interfere w i th private enterprise. gratulate you on the great success of your party in inducing the National party to bend to its w ill . On the foref r o n t of the P r i m a Minister's banner, when he came into this Parliament, and on the forefron t of the banner of his spouse, the Leader of the Country party [190] -thes e dual leaders-wa s ""Restoration of Constitutional Government. Banishment of Socialism from the Land. We are the Australian Fascisti."" The Prime Minister declared himself another Mussoli n i . So they came, creating new hope in the hearts of the people, and telling them that for ever the dangerous revolutionaries were banished from power, and that in future sober and safe lines The honourable member should of government would be followed, in short, that there was to be a throwback to the reactionary times of half a century or more ago, in order that not merely industries, but the Commonwealth as a. whole, might be stabilized. There are. some people outside this Parliament who, seeing the Prime Minister-the still, strong man-sittin g at the table, would imagine that he really is leading the Ministry and governing the Commonwealth. But the leadership comes from the Country party, the members of which are entitled to take to themselves all possible kudos for what they have done in this Parliament. Well may the honourable member for Wimmera look sad; I fear that he has backed the wrong horse. Let us look at the legislation that has been introduced during this session, and ask ourselves who has dictated it . The answer is that honourable members in the ministerial corner have dictated it in the interests of their masters who sent them here; and when the still, strong leader speaks as though he leads, he actually speaks and leads only as the pliant instrument of the reactionaries of the Country party, who, in turn, serve faithfull y the squatter and the middleman under an unconvincing pretence of serving the working farmer. Thus the patchy pact has been maintained in p a r t; I wonder for how long. Out of this situation there comes a homely illustration of the old proverb that "" Honesty is the best policy."" When principle gave way to expediency, all seemed well, for a time, and nothing but expediency appeared to matter, but gradually the mortification of distrust and suspicion is being set up in the body of the composite conspiracy party, whose disintegration is in process. One member I conleaves it , and then another leaves it , and comrades jump in to take the jobs that have been vacated. And by-and-bye, when they in tur n have been conducted to the bathroom, some other colleagues, who vowed allegiance to them, will spring forward to grasp the spoils that have been laid down by the",32,Dried Fruits Export Control
176,Mr Jackson,"His song, "" Love me",33,Dried Fruits Export Control
177,Mr Brennan,"Apparentl y not.latest victims. So the pact will proceed until the next general election, when the trump, of the electoral archangel shall call them to account, and the compact be disrupted into invisible atoms. Tlie( Mr Cook) I remind the honourable member that there is nothing in the clause about the pact. .tinctly provides "" t h a t the board may accent control of any dried fruits placed under its control for the purposes of this Act."" If I have said anything that is in consistent with the terms, of that clause I apologize, but it seems to me that everything I have said was directly germane to the clause, and to the amendment moved by the honourable member for Angas. I have referred to those gentlemen, who, for the advancement of personal interests, have diverted public funds into private pockets, and I have spoken of their methods. attitude towards members of the Labour party who support this and similar bills? I shall vote with them in support of the principle of the bill. bers of the Labour party do not oppose this class of legislation. believe in the principle underlying it , and for the moment we are not conoerned with the motives actuating members of the Country party. We support the bill in the hope that by a variety of amendments it may be brought completely into harmony with the views and policy of the Labour party. prove of th6 principle of the amendment. I shall not, like the honourable member for Kooyong( Mr Latham), take the risk of pronouncing judgment as to its legality, and shall certainly not give an opinion in opposition to his, because that would be rank heresy, as well as a breach of the rules of the affiliated unions of which he and I are members. The Labour party stands for the interests of the primary producer, as it does for the interests of the wage earner and every other class we of the Country party is a constant reiteration of "" t h e primary producer"" until at night one dreams that phrase. It is as if there were no person who had work to do in this country but the p r i mary producer; no , person who had to pay through the nose for primary products, and nobody worthy of consideration other than the primary producer, for whom honourable members of the Country party claim to speak exclusively. A few evenings ago I entered a small shop in a main street of Melthe only apples for sale were quoted at 8d. per lb., and the oranges at 3d., 4d., and 5d. each. A few months hence The clause diswhen we travel into the country we may see within 15 or 16 miles of Melbourne trees laden with beautiful apples, and the ground strewn with windfalls which apparently are not worth gathering. W ill the primary producers wake up and explain why in a country which produces a superabundance of f r u it which w ill keep for a year, the m a j o r it y of people of the working classes cannot afford the luxury of purchasing it . W it h the greatest respect I say to the dairymen, orchardists, and stockbreeders, that they could do a great deal more for themWhat, then, is my selves instead of constantly sitting on the doorstep of the Cabinet. I believe in Government interference w i th private enterprise, but I do not believe in the p r i Memmary producer becoming a regular mendicant at the door of Parliament House. We The long faces of honourable members of the Country party would lead one to think that the lot of the primary producer was similar to that of the dweller in the slums of some of the great cities of Europe and other continents, that they are reduced below the capacity of self-help, and must have the Fort h a t ' reason I apaid of this Parliament for everything. I do not agree with that. As a rule the primary producer has some independence, and enough grit and capacity to do something for himself by co-operative effort. One thing I wish h i m to do is to endeavour to organize the marketing of his f r u it at prices which, whilst ensuring to him an adequate return, will bring that essential article of diet within the means of some of the poor electors of such densely populated districts as Batman, East Sydney, and West Sydney. of the community, but all Those people do not include any primary hear from honourable members producers, but let them be considered sometimes. There is no reference to them in this b ill, or in any other of the bills that have been introduced by the present Government during .this session, and if we talk about improving their lot we are at once accused of having hoisted the red flag of socialism, and honourable members",33,Dried Fruits Export Control
178,Mr Brennan,"of the Country party retire, precipitately, into their caves. In their caves for the moment I leave them. that the committee will vote for the amendment. The honourable member for Kooyong( Mr Latham) has said that it does not give the powers which I seek to confer, and that in any case there are constitutional difficulties in the way. the power that the honourable member desires to give-and I do not think it does -ther e are constitutional difficulties that will defeat it . argue a constitutional question with a King's Counsel, but the very opposite opinion has been given by other gentlemen as eminent in the. legal profession as the honourable member for Kooyong. risk the amendment being declared unconstitutional, in the hope that it may do something for those engaged in the production of dried fruits. The honourable member was wrong in saying that I doubted his honesty of purpose. I merely expressed a conviction that he would not support compulsion on this question in any form. reason to regard him as other than a gentleman, he belongs to a profession which 'requires him sometimes to argue that black is white, and in this HouseI think he will do his best to show his party to the greatest advantage. His statement that I had been offensive to h i m was quite uncalled for . I desire to place on record the other amendments I shall move if that now before the committee is accepted. I propose to move the insertion of. the following .provisions: 1. Tho board shall determine from time to Duncan-Hughes, J. G. Maxwell, G. A. time the extent to which it is necessary, for Foster, R. W. the effective operation of this act, and the fulFrancis, F. filment of its. purposes, that 'the board should Francis, J Pratten, H. E. exercise control over the export of dried fruits Gardner, S. I j . from-the Commonwealth of Australia, and may Green, R. assume control of any such dairy produce Gregory, H. accordingly. 2. In any such case the control of the Hurry, G. board shall operate as from a time to be speoified in that behalf by the iboard by notice given in conformity with this act. 3. Notice by the board of its intention to assume control of any dried fruits may be TSrennan, F. given either by service on the owner of any Forde. F. M. ' dried fruits or on any person having possesGabb, J. M. sion thereof, or by publication in any newsGreen, A. paper or newspapers, in accordance with such Lacey, A. W. conditions as may be prescribed. Every such Mathews, J. notice shall, subject to the provision of this McNeill, J. act, have effect according to dts tenor. 4. The control to be exercised by the board over any dried fruits may, as the board in any case determines, be absolute or limited. 5. All dried fruits of which the board has I hope assumed absolute control shall be shipped as the board directs, and shall be sold and disposed of only by the board, or by direction of the board, at such times and tin such manner and on such terms as the board in it's discretion determines. 6. Where the board has assumed limited control the extent of its control shall be defined I said that if it does give by notice as .aforesaid, or by agreement between the board and the owners pf the dried fruits or other persons having authority io enter into an agreement with the board ""with respect to such dried fruits. I shall not presume to If my amendment to this clause is agreed to, that' amendment w ill follow later. I have read it in answer to the suggestion that if my amendment is carried I have really nothing to follow it , and therefore the withdrawal of the bill for a Therefore, I am prepared to certain period would be necessary. The position is that the Government does not desire the bill to have a compulsory effect, nor to give the board the powers that it should have in order to function properly. I ask honourable members to support tbe amendment. Question-That the words proposed to J stand part of the clause-put . The committee divided. Ayes .. .. . . 29 Noes .. .. . . 1.6 Majority 13 AYES. Bamford, F. W. I Jackson, D. S. Bowden, E. K. 'Latham, J. G. Bruce, S. M. ; Lister, J. H. Cameron, l.J. Mackay, G. H. Cameron, M. Mann, E. A. Corser, E. B. C. Manning, A. G. Page, Dr. Earle| Paterson, T. i Watson, W. Whitsitt, J. T. H. 1 Tellers: Howse, Sir NevilleI Hunter, J. A. J. i Marr, C. W. C. NOES. Anstey, F. iO!Keefe, D. J. Hilev. i i . Scullin, J. H. Stewart, P. G. West, J. E. Tellers: Cunningham, X>. L. Moloney, Parker Fenton, J. E.",34,Tempora Ry Chairman Bourne To Buy Some F R U I T And
179,Mr Gabb (Angas) [ 5 . 4 0 ],,35,Tempora Ry Chairman Bourne To Buy Some F R U I T And
180,Mr Latham,,35,Tempora Ry Chairman Bourne To Buy Some F R U I T And
181,Mr Gabb,,35,Tempora Ry Chairman Bourne To Buy Some F R U I T And
182,Whilst I Have No Be Omitted ( Mr Gabb S Amendment),"'Chapman, Sir Austin -Groom, Sir Littleton Atkinson, L . Gibson, W. G. Lambert, W . . H . H ill , W. C. Ilyrie, Sir Granville Seabrook, A . C. Bayley, J . G. Marks, W . M . McDonald, C. Johnson, Sir Elliot Killen, W . W . Hughes, \ V . M . Thompson, V. C. Prowse, J . H . Question so resolved io the affirmative. Amendment negatived. Clause agreed to. Clause 17 agreed to. Clause IS (Contracts for shipment of dried fruits). wish to know whether the consent of the hoard has first to be obtained before dried fruits can be exported. A contract or order for a small quantity of dried fruits may be received from Java or Singapore. If it will be necessary for the board to approve of the contract before the Customs Department can certify that the dried fruits may leave this country, special regulations should be issued allowing the Customs Department to permit the export of small quantities of dried fruits by persons who obtain a licence ancl comply with the conditions therein laid down. ter and Minister for External Affairs) [5.55] -This clause deals only with con' tracts for shipping, and not with the issuing of licences or with the powers of tlie board respecting them. provides that a contract may be entered into in conformity with conditions approved by the board. In the case of Eastern trade, I have no doubt at all that general conditions will be laid down under whicli a shipping contract will be permitted in tlie case of a person wishing to export dried fruits, and he will be able to make his shipping arrangements without obtaining tbe approval of the board for each specific shipment. I do not think that there will be the slightest interference in cases such as that suggested by the houorable member. Clause agreed to. Clause 19(1.) Without limiting any authority specinot think that the circumstances sugfically conferred on the board w i th respect to gested by the Prime Minister are likely any dried f r u it s placed under its control, the Blakeley, A. board shall have f u l l authority to make such Charlton, M . arrangements and give such directions as it Coleman, P. E. thinks f it for the following matters:. . . Mahony, W. G. ter and Minister for External Affaire) Makin,' N . J. O. [5.56] I move to make this clause read Maloney, D r. as follows:McDonald, P. . ( 1 . ) The board, with respect to any dried McGrath, D . C. fruit s placed under its control, shall have f u l l Riley. C. authority to make such arrangements and give Watkins, D . such directions as it thinks f it for the followYates, G. E. ing matters:. . . This is a drafting amendment suggested by tlie Attorney-General's department. It is not intended in any way to alter the purpose of the clause. Amendment agreed to. Clause, as amended, agreed to. Clauses 20 and 21 agreed to. Clause 22Moneys held in the fund uninvested by the boa i-d may be lodged either at call or on fixed deposit, or partly at call and partly on fixed deposit, with the Commonwealth Bank, or with any other prescribed bank, and while in such bank shall be held to be moneys of the Crown. This clause provides that uninvested moneys held by the board may be lodged with the Commonwealth Bank or with any other prescribed bank. Unless the Prime Minister ca""n assure me that such moneys will be lodged solely with the Commonwealth Bank, I shall move an amendment to delete the words "" or with any other prescribed bank."" ter and Minister for External Affairs) [6.0] -There is really no need for the honourable member to move an Clause 18 amendment, because, if I understand rightly, his desire is that the finances of the board shall be conducted solely through the Commonwealth Bank. It is the intention of the Government that the Commonwealth Bank shall be employed wherever possible, but circumstances may arise which will make desirable and convenient the use of another bank. For instance, transactions might be required in a place where there is no branch of the Commonwealth Bank, and grave inconvenience, and possibly loss, might be caused to the producers if , in such a case, special banking arrangements had to be made.",35,Tempora Ry Chairman Bourne To Buy Some F R U I T And
183,Mr Gregory (Swan) [5.52],I,36,Pairs
184,Mr Bruce (Flinders,Prime Minis,36,Pairs
185,"Lazzarini, H . P. Mr Bruce (Flinders",Prime Minis,36,Pairs
186,Mr West (East Sydney) [5.59],,36,Pairs
187,Mr Bruce (Flinders,Prime Minis,36,Pairs
188,Mr West (East Sydney) [6.1],"I doto arise. wealth Bank are established in every town in Australia. The Government should do all the business required under the provisions of this measure through the object to the manner in which the TemCommonwealth Bank. toThat the word ""either"" be left out, with a committee hurriedly, and in a manner view to insert in lieu thereof the words "" in an account""; That the words "" in an account "" be inserted The Government were opposed to my after tlie word"" partly "" second occurring. tion ? ter and Minister for External Affairs) have moved it. [6.5] I hope the honourable member will portant principle. not press his proposal, for I assure him been slighted, and therefore I movethat the Government intends to use the Commonwealth Bank wherever possible. consideration of clause 22. It is most desirable, however, that the power to use another bank should be given to the board if the need to use it arises. member objects to is only a safeguard. With all due respect to the Prime Miniscedure in committee unless the committee, ter, I am not satisfied to leave the clause through its Chairman, formally reports as it is. I move That the words "" or with any other prescribed bank"" be left out. Amendment negatived. Clause, as amended, agreed to. Clause 23 agreed to. Clause 24All moneys received by the board in respect of tlie sale of dried fruits or otherwise howto it on two occasions, did not convince soever (except moneys forming part of the the honourable member, who was very fund) shall be paid by the board into a sepaanxious that the committee should decide rate account at a bank to be approved by the the question.' Minister. That the words "" at a bank to be approved by the Minister be left out with a view to insert in lieu thereof "" in the Commonwealth Bank "". Accounts will be opened by the board in whether it was being put or not. the principal cities of the Commonwealth, and in my opinion it should be mandatory for the board to trade with tion on the Chairman of Committees. the Commonwealth Bank wherever it is As a rule, when there is a misunderpossible. ter and Minister for External Affairs) had persisted in a request that the clause [6.11] -Although I cannot see any necesshould be put again, it would probably sity for the amendment, I have no obhave been put again. jection to it. Amendment agreed to. Clause, as amended, agreed to. Branches of the CommonClauses 25.to 29 agreed to. Title agreed to. Bill reported with amendments. porary Chairman of Committees ( Mr to clause 22. He put the question to the which was not at all commendable. amendment, but that ought not to have man. The amendment would have imI t contained an imI feel that I have That the bill be re-committed for the re-The redress that the honourable member The phrase that the honourable apparently feels that he deserves is, of course, obtainable only in committee, for the House has no authority over the proit to the House. am sorry that a misunderstanding has arisen to prevent the honourable member for East Sydney( Mr West) from testing the feeling of the committee on his amendment, which was of some importance. The Prime Minister, who spoke the amendment was put hurriedly, and in a way that did not make it clear standing, the clause is put again, and if He did not do so, and the question has been decided. The honourable member for East Sydney was indignant at the slight he thought",36,Pairs
189,Amendments (By Mr Bkuce) Agreed Cook) Dealt With An Amendment I Moved,,37,Pairs
190,Mr West,What about my suggesinfluenced the conduct of the Chair,37,Pairs
191,Mr Brtjce (Flinders,Prime Minisproved the bill; otherwise I should not,37,Pairs
192,Mr West (East Sydney) [6.6],,37,Pairs
193,Mr Gabb (Angas) [6.10],I movedivision.,37,Pairs
194,Mr Brtjce (Flinders,Prime Ministhe honourable member for East Sydney,37,Pairs
195,Mr West (East Sydney) [6.14],I,37,Pairs
196,Mr Speaker (Rt. Hon. W. A. Watt).,,37,Pairs
197,Mr Brennan (Batman) [6.17],I,37,Pairs
198,Mr Mann,He did not call for a,37,Pairs
199,Mr Brennan,That was because,37,Pairs
200,Mr Jackson,That was not so.,37,Pairs
