speakerGroups,speaker,theText,pageNumbers,title
0,"Other Honourable Members On This Side, I Am Very Far From Desiring That The Cession Should Close At An Early Date, And I Am Aware That, Under The Standing Orders Which Mr Speaker So Strictly","and , if I may be allowed to say it, so ably interpretsI may not ask a question arising out of an answer given to another honourable member. But, in a speech made by the Prime Minister recently-for the purpose of identification, I may say that in it he spoke of blackmailers, cut-throats, sectionists, and other has stated in a speech that the people owe undesirables; the right honourable gentleman will remember the speechhe stated likely to close when the measures appearing on the notice-paper, with the exception of certain minor measures, were disposed of. Having regard to the fact that, in the process of debate, minor measures may develop into major measures, I shttuld be glad if the right honourable gentleman would inform the House which are the minor measures on the paper that are likely to be jettisoned before the session closes? of having made any speech in which I referred to cut-throats, and I have, therefore, been somewhat embarrassed in the effort to identify the speech to which the honourable member refers. making any speech in which I referred to the work which has to be dono before the session closes. As the honourable gentleman has asked what are the measures with which it is not intended to proceed, I shall take an opportunity at an early date to inform the House what are the proposals of the Government. to address.a question to you. Those of us who come to Parliament House between the hours of 9 and 10 o'clock in the morning are compelled to swallow quantities of dust stirred up by the sweeping pf the cleaning staff, which uses the most antiquated carpet appliances, so that as much dust arises as goes into the sweepers. I wish to ask whether better methods might not be adopted, including, if necessary, the laying down of rubber carpets. with the system of cleaning adopted in the building, but I shall confer with the staff, ancl see whether it is advisable to install better methods, and, if possible, will have it done. the National par.ty an undying debt of gratitude for its action during the war in saving the honour and prestige of Austhat the session was tralia. Therefore, I ask the right honourable gentleman, Who was the first Leader of this party that has saved the honour and prestige of Australia? What recognition has the Nationalist party made of his great services? What has become of him ? Is nob to-day his birthday, and what does the Government propose to do to recognize his past services? the questions which the honourable member has asked are well within his own knowledge. The Leader of the Nationalist party during the period of the war, when it rendered such unforgettable services to Australia, was the right honourable gentleman who now represents North Sydney( Mr W. M . Hughes). Whilst Indeed, I cannot remember I do not altogether appreciate the form in which the questions are couched, it affords me very great pleasure to answer them, as it enables me personally-ari d I am sure I may also add on behalf of the whole House-to congratulate the right honourable member on the occasion of his birthday. : expressing my compliments? for Defence received any correspondence from the Townsville Chamber of Commerce in regard to the survey of Magnetic Passage, about 35 miles from Magnetic Island? This passage was recently negotiated by a vessel from Portland, in the United States of America, of 8,000 tons dead weight capacity,and",13,Setup
1,Mr Brennan,In common with,13,Survey Of Magnetic Passage
2,Mr Beuce,I have no recollection,13,Survey Of Magnetic Passage
3,' Mr Jackson,"I wish, Mr Speaker,",13,Survey Of Magnetic Passage
4,Mr Speaker,I am not acquainted,13,Survey Of Magnetic Passage
5,Mr Anstey,The Prime Minister,13,Survey Of Magnetic Passage
6,Mr Brtjce,The answers to most of,13,Survey Of Magnetic Passage
7,Mr Anstey,Should I be in order in,13,Survey Of Magnetic Passage
8,Mr Speaker,Not at this stage.,13,Survey Of Magnetic Passage
9,Mr Bamford,"Has the Ministerdrawing 25 feet of water. It is urgently necessary that the channel should he buoyed or marked in some way for the convenience of shipping. Is any attention being given to the matter? from the Townsville Chamber of Commerce to-day, and it has been referred to the Navy Board. The Geranium is in the vicinity of Townsville at the present time, engaged in survey_ work. She has a seaplane with her, and some photographs of the stretch of water referred to by the honourable member have already been taken. The matter is receiving the earnest consideration and the immediate attention of the department. Ministers statement that the session w ill Kay had full authority to both speak and vote, last only another two or three weeks, has holding a Governor General's commission to act the Government yet decided whether the as Australian delegate. -sugar embargo w ill be extended beyond the present term? If he cannot give a similar congress. definite answer now, will he give one before the House rises for the recess? session would end in two or three weeks; I remarked that I saw no reason why it asked the Postmaster-General, should not close within that period. The noticeGovernment has not come to a decision ' In accordance with the avowed policy of the about the sugar embargo. embargo will continue until next year, a new and highly artistic design of Australian I do not think it is likely that an anstamps issued, depicting the industries and nouncement w ill be made before the scenic beauty spots of the Commonwealth? House rises, but the Government's decision w ill be made known in ample time to enable those interested in the industry to stances it is not intended to make any know exactly where they stand. MrE . RILEY asked the Postmaster General, upon notice1. What countries were represented at the Stockholm Conference by Ministers? 2. How many days did the congress sit, and on how many did the Postmaster-General attend? 3 Was Mr Kay, after the Postmaster-General retired from the congress, allowed to speak and vote, although not having been appointed by the Governor General, and there being no authority in the Postmaster-General's commission to delegate his authority to any one else? 4. Did a technical adviser accompany the Postmaster-General, as promised by the Prime .Minister; if so, who? honourable member's questions are as follow :1. Seventy-three countries were represented at the congress, very many of them by their respective Postmasters-General, but which of the latter held Ministerial office I cannot say. Certainly some of them did. 2. Up to the time of my departure from Stockholm, the congress had sat for a fortnight, and I had attended all sittings of the congress ilield. In addition, I had convened several meetings of dominion representatives, and also attended two meetings of all British representatives, at which matters affecting the Empire were fully discussed. After being in session for a fortnight, the congress adjourned for at least eight days, and I was called to London to attend to important matters which were pending there, and which required immediate personal attention. 3. Mr Kay was empowered to speak at all meetings of the congress, but Australia only had one vote, which I exercised at all meetings In view of the Prime at which I was present. Subsequently Mr 4. Yes; Mr Kay accompanied the Postmaster-General, having previously attended a upon As the Government of advertising the Commonwealth abroad, will he consider the question of having alteration in the design of the stamps now current. Defence, upon notice1. Is it a fact that it is proposed to transfer the Ordnance Stores now in Melbourne to the Seymour Depot? 2. Is it a fact that it is intended to send the present Melbourne staff to the Seymour Depot; and, if so, will he state what provision is to he made for their housing accommodation? honourable member's questions are as f o l low : 1 and 2. No.",13,Survey Of Magnetic Passage
10,"Mr Bowden""",I received a letter,14,Ordnance Stores Melbourne
11,Mr Eorde,,14,Ordnance Stores Melbourne
12,Mr Bruce,I did not say that the,14,Ordnance Stores Melbourne
13,Mr Gibson,The answers to the,14,Ordnance Stores Melbourne
14,Mr Fenton (For Mr A. Geebn),,14,Ordnance Stores Melbourne
15,Mr Gibson,Unde r present circum,14,Ordnance Stores Melbourne
16,Mr Fenton Asked The Minister F O R,,14,Ordnance Stores Melbourne
17,Mr Bowden,"The answers to theGeneral, upon notice1. Is it a fact that the Postmaster-General's Department, is importing telephone and telegraph insulators from Austria or elsewhere? 2. Will he inform the House as to the quantity and value of insulators supplied to the Department by the Maribyrnong Pottery? 3. Have these locally-made insulators given satisfaction ? 4. If so, will he instruct his officers to purstruction of the branch to serve the chase supplies from the local manufacturers? honourable member's questions are as follow :1. Yes, because of the fact that it was impracticable to obtain in the Commonwealth sufficient insulators to meet the department's requirements at the time. 2. One million five hundred and ninety-four thousand insulators, valued at £57,060, wore supplied by the Firebrick Insulator and Pottery Company, a branch of whose works is situated at Maribyrnong. 3. Yes. 4. It is the practice -of the department to obtain all supplies of insulators from Australian manufacturers, so far as they arc able to meet the demand. fence, upon notice.1. Will he state if child endowment is provided for in the salaries of the draughtsmen and armament artificers in the Defence Department ? 2. If not, will he provide for same in the classification now being considered? honourable member's questions are as follow :1. It is assumed that military draughtsmen and armament artificers are referred to. Child endowment is not payable, as both of these classes of employees are paid special rates under special conditions. 2. No. dent of the Executive Council) [2.47]. I move That, in accordance with the provisions of the Commonwealth Public Works Committee Act 1013-1921, the following proposed work be referred to the Parliamentary Standing Committee on Public Works for investigation and report, viz.:-Federa l Capital: Northern Main Sewer-Extension of sewer from main intercepting sewer on Commonwealth-avenue, across Molonglo River, to serve the northern portion of the city. The Public. Works Committee has already investigated and reported to Parliament concerning the main outfall sewer at Canberra, the main intercepting sewer within the city boundary, and the main serving the southern portion of the city. The time has now' come when consideration should be given to the connorth-eastern portion of the city. The present proposal comprises the construction of a main sewer leading northwards from the junction of the southern and main intercepting sewers on Commonwealth-avenue, across the Molonglo River, sfnd extending eastwards as far as Prospect-parkway. At the present time, this district is served by local treatment works, the reticulation thereto being so arranged that it may easily be connected with the proposed sewer when constructed. The population on the northern side of the city is increasing. With the advent of private enterprise and the transfer of the Seat of Government to Canberra, the present works will be inadequate to meet the demand, and it will be necessary to connect the service with the main city sewerage scheme. The proposed development is in general conformity with the scheme submitted by the Federal Capital Advisory Committee in its first general report. A plan indicating the proposed .route of the sewer is submitted herewith. This sewer will be laid in the form of precast concrete pipes of similar construction to those used for the southern intercepting sewer. The estimated cost of the proposed northern main sewer is £82,000. Question resolved in the affirmative. sident of the Executive Council) [2.50]. That, in accordance with the provisions of the Commonwealth Public Works Committee Act 191-3-21, the following proposed work be referred to the Parliamentary Standing Committee on Public Works for investigation and report, viz :Federal Capital: Sewage Treatment Works. The construction of treatment works at the termination of the main outfall sewer, at Western Creek.",14,Ordnance Stores Melbourne
18,Mr Fenton Asked The Postmaster,,15,Federal Capital Sewage Treatment Works
19,Mr Gibson,The answers to the,15,Federal Capital Sewage Treatment Works
20,Mr West Asked The Minister For De,,15,Federal Capital Sewage Treatment Works
21,Mr Bowden,The answers to the,15,Federal Capital Sewage Treatment Works
22,Mr Atkinson (Wilmot,Vice-Presi,15,Federal Capital Sewage Treatment Works
23,Mr Atkinson (Wilmot,"Vice-PreThe gravitation, sewerage scheme adopted for the Federal Capital involves the construction of works at the outfall to treat the sewage, in order that an innocuous effluent may he obtained for discharge into the Molonglo River. In 1915, the Public Works Committee, when considering the general sewerage scheme for Canberra, and approving of the main outfall sewer, suggested that ""prior to the date on which it is proposed to erect treatment tanks, exhaustive inquiries be made, with a view to the installation of the most up to-date system then obtainable."" that time, methods of sewage disposal have been the subject of close investigation by experts in various parts of the world, and the results of these experiments, and the conclusions arrived at by leading authorities were carefully reviewed, before a method of treatment for the Federal Capital was adopted by the technical advisers of the Government. In Order that the sewerage scheme may be in operation by the time Parliament is transferred to Canberra, it is necessary that preliminary action should now be taken iii connection with the treatment works, and accordingly a scheme has been formulated for reference to the Public Works: Committee. The scheme provides for-the installation of a first unit of sediwith this motion, which relates to the 'promentation tanks and trickling niters to deal with 500,000 gallons daily, being the sewage from 5,000 people, plus the flushing water necessary for scouring the sewers in the initial stages, and for the installation of a small experimental unit capable of treating the sewage of 500 people by the activated sludge method, so arranged that either crude sewage or settled sewage from the tanks can be passed through it. The present proposal provides for these units to be increased, as necessity arises, to treat the sewage of 10,000, and, later, of 25,000 people. immediate requirements at a minimum of cost, and at the same time offer possibilities of developing alternatives at a later date, after experience of Canberra conditions has supplied the necessary local data on which to form a definite opinion as to the direction in which future expansion should be made. I lay upon the table a plan showing the general locality of the works, and an outline of the proMr Atkinson. posed scheme. The estimated cost of treatment works to provide for 25,000 people is £60,000, of which, it is anticipated, £37,000 would be expended within the next three years. meeting at Canberra within three years, and I should like an assurance from the Minister that the treatment works will be sufficiently advanced to meet requirements at the date of the transfer. provision is being made to meet all reSince quirements when Parliament first assembles at Canberra. posed expenditure of this kind must be governed by the probable influx of population into Canberra. We have been told that a big city will grow there, and that as soon as the land is thrown open for selection many people will take up residential and business blocks. So far no attempt has been made to make the land available for selection, and population cannot go there until that is done. We were assured that the first sale of leases would be held in September or October, but it has been further postponed. It is not in order to discuss the land policy at Canberra in connection vision of certain sewage treatment works. get from the Minister some definite statement as to when land will be available for selection so that we may estimate at what rate the population of the city will increase. land will be made available, but I do sedimentation know that leases in the business area are to be sold shortly. Question resolved in the affirmative. WAYS AND MEANS (Formal). It is designed to provide for Question-That Mr Speaker do now leave the chair-resolve d in the negative. BILL. In committee (Consideration resumed from 24th September, vide page 4719) : Clause 2Sections one, two, five, and twenty-nine of this act shall commence on the day on which this act receives the Royal assent and the remaining sections of this act shall commence on a date to he fixed by Proclamation :",15,Federal Capital Sewage Treatment Works
24,Mr E. Riley,Parliamen t will be,16,Dried Fruits Export Control
25,Mr Atkinson,I understand that,16,Dried Fruits Export Control
26,Mr Gregory (Swan) [2.55],Pro,16,Dried Fruits Export Control
27,Mr Speaker (Rt. Hon. W. A. Watt).,,16,Dried Fruits Export Control
28,Mr Gregory,I desire merely to,16,Dried Fruits Export Control
29,Mr Atkinson,"I cannot say when theProvided that a Proclamation under this Bection shall not issue unless and until, at a understanding between Great Britain and poll of growers taken in the prescribed manner throughout the Commonwealth, a majority of votes have been given in favour of tlie act being brought into operation. By introducing such measures as this, the Government seems to be dealing piecemeal with our various industries, without any attempt to organize them at a l l. If our primary industries are to flourish, we must in a few years take uniform and comprehensive action to deal with Australian products, and to obtain markets for them overseas. I shall quote a few figures respecting the importation of currants into Britain. Last year the currants imported into Britain from Australia amounted at £278,000, and from other countries, 967,000 cwt., valued at £3,000,000. Other dried fruit s imported into Britain from Australia amounted to 102,000 cwt., valued at £483,000, and from other countries, 1,312,000 cwt., valued at £5.714,000. These figures show that there is a splendid market in Britaini t self for Australian dried fruits. I believe that the scheme outlined in the bill, if put into operation, will be of some benefit to the producers, but assistance will be needed in other directions if their industry is to flourish at all. I have been greatly impressed with speeches recently delivered on this subject by party leaders in the British House of Commons. They seem to be unanimous that something must be done by way of organization to bring about the satisfactory marketing of the products of the dominions in Britain itself. The Secretary of State for the Colonies( Mr Thomas), following in tbe footsteps of his predecessor, is strongly in favour of this. The Prime Minister( Mr Bruce), when introducing the bill, mentioned the I m perial Economic Committee that had been appointed by the Imperial Conference. I believe that committee was established to encourage trade within the Empire. The ex-Prime Minister of Great Britain( Mr Baldwin) made a most important proposition. Mr Philip Snowden, the Chancellor of the Exchequer, when delivering his budget speech recently, referred to that proposal as one certainly of the most drastic character. A number of honourable members in this chamber would disapprove of it , but I am inclined to support it , because we should do everything possible to bring about a better trade the dominions. According to the Journal of the Parliaments of the Empire, Mr. Thomas, when dealing with this subject, saidIt is unfair to adopt the policy that, unfortunately, has been adopted in the past, of assuming that on these Empire questions one party alone is the patriotic party. It is not true. We resent it, and we shall be able to prove that it is not true. Equally we are prepared outside these fiscal controversies to consider every question without party bias or prejudice. Mr Asquith, the leader of the Liberal party, saidThere was a great deal still left undone in the development of Imperial resources, in the to 77,000 cwt., valued extension of credit facilities, in tbe improvement and transportation and the storage and marketing of produce. Mr Asquith welcomed the suggestion for the establishment of a permanent I m perial Economio Committee. The Prime Minister of Great Britain( Mr Ramsay MacDonald) spoke in a similar strain, and said that the people of Great Britain had a perfect right to decide their own fiscal issues in the same way as the dominions had the right to settle their own domestic affairs. I shall now refer win. When I was dealing with this matter the other night, the honourable member for Wakefield ( Mr Foster) win had not since changed his opinion. So far as I know, the statement of Mr. Baldwin still stands that Great Britain should be prepared to take produce from Australia. under a misapprehension. I thought the honourable member was referring to something else. stated that there was no reason why a satisfactory trade arrangement should not last for the best part of a generation. an arrangement. statedThe Colonial Secretary referred on the previous day to the discussion at the Imperial Conference on the question of a definite economic Council of the Empire, His Majesty's Government had submitted to all the Dominion Governments a proposal of a definite character under that head. Mr Baldwin had made one of the biggest socialistic proposals he had ever-",16,Dried Fruits Export Control
30,Mr Fenton (Maribyrnong ) [3.0],,17,Dried Fruits Export Control
31,To The Proposition Submitted By Mr Bald,,17,Dried Fruits Export Control
32,"Asked, By Interjection, Whether Mr Bald",,17,Dried Fruits Export Control
33,Mr Foster,I made that interjection,17,Dried Fruits Export Control
34,Mr Fenton,Mr Baldwin also,17,Dried Fruits Export Control
35,Mr Bruce,We would welcome such,17,Dried Fruits Export Control
