speakerGroups,speaker,theText,pageNumbers,title
207,Mr Jackson,"Developmen t is the i mcome into the scheme, and that seems tof r u it sent from Queensland to the southat each end with a railway of 3-ft. 6-in. ern states has to be transferred at Wal langarra from the narrow, gauge of Queensland to the 4 f t . 8-^ in . gauge of New South Wales. No less than 250,000 head of live stock had to be transferred at the Queensland border last year. Queensland is a state w i th great promise, and I believe that it w ill eventually become the most productive part of the Commonwealth. anxious to assist in the development of that portion of Queensland which w ill be served by the proposed line. A t the present time, the traffic northward, on the coastal line, passes over the Clarence River by punt, but the New South Wales Government has £1,000,000 in the construction of a bridge over the Clarence. The provision of the punt resulted in a 35 per cent, increase in the traffic, and I have no doubt that when the proposed line is completed it will pay handsomely. The bridge to be erected w ill be the most expensive in Australia. line is only the first instalment of the work necessary for the unification of gauges, so that the people may travel between Brisbane to Perth without changing trains. The bill should be supported by all honourable members who regard themselves as true Australians. MrI t . GREEN (Richmond) [8.25] I having brought down this bill, for it is the first practical step towards tbe consummation of an ideal that has long been cherished-the unification of the railway gauges of the Commonwealth. I do not intend to repeat the arguments of t h e ' honourable member for South Sydney( MrE . Riley), but I agree with his contention that the proposal is of the utmost importance from the national point of view. The gauge that is accepted throughout the world as the best, and that has been adopted as the standard gauge for Australia, is New South Wales. The Commonwealth has built the transcontinental line from Kalgoorlie to Port Augusta on the 4-ft. 8£-in. gauge, but the other states have railways of 5-ft. 3-in. or 3-ft. 6-in. gauge, whilst South Australia has both gauges. The fact that the East-West line connects gauge is responsible for heavy charges' in transporting rolling-stock. It is a great pity that Australia does not enjoy the benefits of a uniform gauge as does the United States of America,' where rolling stock can be sent over the lines of riva l companies. H a d it not been for the breaks of gauge, this country would have been saved the expense caused at Albury New South Wales is when fodder had to be distributed for starving stock. The honourable member for South Sydney supported the present . proposal on the ground of its value from a defence stand-point. No t long ago I referred to the comparative isolation of the various capital cities of Australia, decided to spend and I likened them to a series of islands that had direct communication w i th one another only by sea. A person desiring to travel by r a i l between Sydney and Melbourne, or Sydney and Brisbane, or Adelaide and Perth, has to change trains, and in time of war when it became necessary to transport I hope that the proposed new troops from one state to another, enormous congestion and delay would take place at the breaks of gauge. With a unified gauge delay at the borders would be obviated, and transportation of troops would be further facilitated by the interchangeability of Commonwealth and state rolling-stock. During the great war rolling-stock from Great Britain, and even from America, was used on the French and Belgian railways, becongratulate the Government on cause the 4-ft. 8i-in. gauge was common to all those countries. I am glad to say that the old parochialism and interstate jealousies which existed before federation, and of which the varying railway gauges are a relic, are dying out. A t one time a New South Welshman was anathema to Victorians, and that feeling existed even during the early part of the war. When I transferred early in 1915 from a New South Wales regiment of light horse to a Victorian infantr y battalion 1 committed two unpardonable offencesI was not only a light horseman entering an infantr y battalion, but that of the mother state of I was a New South Welshman joining a Victorian unit. But as the war proceeded and men from different parts of Australia were assembled in the various unite, interstate divisions disappeared, and we were glad to bo known only as "" Aussies."" The Australian Imperial Force Australia. I believe that people of the younger generation are gradually freeing of the old parochialism differences, and are taking pride in their citizenship of Australia as a whole. the advancement of this projected railway I pay a tribute to the honourable for Wimmera( Mr Stewart). last year I had the pleasure of accompanying him-he Works and Railways-and General( Mr Gibson) over a big portion of the route to be traversed by this line, and we were able to see some of the country that will be opened up. velopmental sideration, was required, and it was difficult to get it constructed by Queensland and New South Wales, because of their gauges. provided for the Commonwealth forward the scheme for the unification of gauges by assisting those two states to build a line from the terminus at Kyogle to South Brisbane. operation it will do a great deal of developmental work, and the traffio will be sufficient to pay working expenses and interest, and possibly to establish a sinking fund. cularly the portion on the New South Wales side of the border, is probably the most closely-settled iu Australia. is impossible to imagine the richness of the country on both sides of the Macpherson Range. member for AVimmera made him an even more ardent advocate of the line than he had been before, and although he is a Victorian representative, deal to bring about the agreement which has permitted of the introduction bill. great deal of unmerited censure, and almost abuse, from the people and press of his own state, but being convinced that he was right, he persisted in his advocacy of the line. No credit is due to the Premiers of Western half fused to bear any share of the cost of constructing the railway. in recent months there have been changes of government and I should like the Prime Minister to Mr II. Green. tried to' bring back to inform the House whether the present the same national spirit, and premiers have been consulted. It is possible that they may take a different view themselves from that expressed by their predecessors, and interstate and that Victoria and South Australia, at any rate, w ill withdraw their' parochial For objections and recognize the national character of this project. The Prime member Minister mentioned that the Government In May of of New South Wales has promised to construct a bridge over the Clarence was then Minister for River to connect Grafton and South the PostmasterGrafton. I am sorry that that undertaking is not contained in the agreement. If the promise of the New South Wales Its deGovernment is bona fide there can be no possibilities demanded conobjection to its inclusion in the docubut an interstate railway ment that is now before the House. If that were done we would have some assurance that the bridge w ill be available for different traffic by the time the railway is comAn excellent opportunity w.as pleted. Last year I was present at a to help reception by the mayors of Grafton and South Grafton to the Treasurer ( D r . Earle Page), the Postmaster-General( Mr Gibson), and the then Ministerf or When the line is in Works and Railways( Mr Stewart). Among others present was Sir Joseph Carruthers, the leader of the New South Wales Legislative Council, and he definitely promised that the state government The area to be served, partiwould construct a bridge over the Clarence River. I cannot credit a newspaper statement that he has since denied having rural district made the statement, because it was heard Without seeing it it by all those who were present at that reception. To make assurance doubly sure the undertaking should be included in The visit of the honourable the bill. A bridge at that noint has been promised for over 40 years. Between Grafton and South Grafton, the Clarence River is over half a mile wide, he did a great and has a maximum depth of 70 feet. It is a magnificent stream, but instead of of this being, as it should be, a great asset to the For that attitude he received a country, its very size and grandeur have acted as a bar to progress. Before constructing the north coast line from Sydney to South Grafton, the New South Wales Government should have built a bridge over the Clarence Victoria, South Australia, and River as an outlet for the traffie Australia, who in bef r o m the rich lands of the north of their respective states recoast which are now served by the railway from Grafton to Murwillumbah. However, That railway commences on the north in each of those states, bank of the Clarence, and ends on the south bank of the Tweed. I ts position is worse than that of the transcontinental railway. The town of Lismore, with a population of over 10,000 people, supplied with gas, water, electricity, and sewerage services, is absolutely unconnected by rail with any other part of the Commonwealth,, and will remain so until a bridge is built across the Clarence River at Grafton. For years past the New South Wales Government has promised to build this bridge. I should like the bill to contain a provision making it obligatory for the New South Wales Government to construct a bridge across the Clarence River. The agreement provides for the re-grading and re-laying of the line between Grafton and Kyogle. This is at present a light line laid with 60-lb. rails. In the summer iime a cloud of dust follows the train, much to the inconvenience of the passengers in the rear carriages. The newest engine used on that line was built in 1S78. use on that line? runs regularly only between Casino and Kyogle. that that line should . be re-graded and rc-laid so that heavy express traffic can be carried upon it. The proposed line will run practically straight from Brisbane South, saving a distance of 100 miles in the journey from Brisbane to Sydney, and will give the magnificent north coast district of New South Wales access to the Brisbane market, which is at present denied to it. A l though a representative of New South Wales, I am glad that this line will traverse Queensland territory. I am not a "" state righter,"" as are many other honourable members. I do not recognize state boundaries. I represent the whole of Australia, including Tasmania. I appeal to honourable members to rise above petty jealousies and to think, not of individual states, but of Australia as a whole. versation in the chamber is persisted in, coupled with interjections, I shall have Railways in 1920:to take action and name some honourable member. vides for the construction of a railway gauges of many of the existing lines, which 97 miles in length, at a cost of £3,500,000. remain This is not an exorbitant sum, considering even if the adoption of a uniform gauge was the engineering difficultes involved in crossing the Macpherson Range. The line, when constructed, will carry not only an increased interstate passenger traffic, but also heavy timber and other traffic. No loss will be sustained by the Commonwealth, because the line, when in use, is certain to show a profit. We shall experience none of the losses that are from year to year incurred on the Oodnadatta railway. AgainI ask honourable members to take a broad and national view of this agreement. do not intend to lecture honourable members on this subject, as did the honourable member whohas just spoken, because I believe that they are endowed with just as much intelligence as I have myself. Although a Queenslander, I intend to put the case for the proposed railway from Grafton to South Brisbane from the viewpoint of an Australian. It seems to me a pity that we should have state boundaries, and the consequent jealousies, in this country. Without them many existing petty jealousies would not have arisen. When important national projects, such as that to unify the railI t is very necessary way gauges of Australia, are being discussed, people are inclined to consider only whether the district iu which they live will be benefited. This railway is a national one, and is one of the links in the proposed scheme to connect up the various capitals of Australia with a uniform gauge railway. On that ground I appeal to honourable members to put aside party politics and state rights, and to support the agreement. It so happens that Queensland and New South Wales are the states particularly interested in this railway, which really is the forerunner of others connected with the scheme. That the other states will not immediately benefit is no reason why honourable members should oppose this national project. The following is a report by the Commonwealth Railways Commissioner It appears to me to be unnecessary to estimate for or consider at present tbe adoption run from distributing centres, would naturally as they are for many years to come, immediately decided on, and it would only be",40,Bruce
208,Mr Bowden,I s not a motor train in,43,Bruce
209,Mr R. Green,"Yes, but it",43,Bruce
210,Mr Speaker,Orde r ! If conmade to the Minister for Works and,43,Bruce
211,Mr R. Green,The agreement proof a uniform gauge throughout Australia. The,43,Bruce
212,Mr Forde (Capricornia) [8.55],"Inecessary to consider at the outset the provision of a uniform gauge connecting the capitals. This could be accomplished by(1) Connecting Kyogle and Brisbane with a 4-ft. 8£-in. gauge line. This, I understand, has been favourably reported on by both New South Wales and Queensland. (2) By building a separate 4-ft. 8£-in. gauge line from Albury to Melbourne. (3) By building a 4-ft. 8£-in. Hue from Hay to Port Augusta, via Crystal Brook, with a 4-ft. 8^-in. connection to Adelaide, via Morgan. (4) By altering the gauge from Kalgoorlie -to Perth from 3 f t . 6 in. to 4 f t . 8£ in. The foregoing would, in my opinion, largely do away with the present difficulties and inconvenience caused by the varying gauges in existence throughout Australia, and could be followed as funds permitted, and as traffic developed, by the gradual extension of the gauge which has been adopted as the Australian standard. This proposed line is to be constructed in river districts of New South Wales, accordance with the recommendation paragraph fact ried out in New Queensland able members of other. states from supthe United States of America have both porting it. The re-conditioning line from Grafton to Kyogle, a distance of of railway construction in those countries 85 miles, will cost £S00,000; the making various gauges were adopted in different of the line from Kyogle to the Queensdistricts, and, years later, these gauges land border, a distance of 27 miles, will had to be unified. cost £857,000; and the portion from the of Queensland border to South Brisbane, a tion is but another case of history distance The total cost of the work, which will be way gauges was a question of public im£3,500,000, is to be met by the Commonportance in Great Britain as far back as wealth providing one-fifth and the five 1846, but it was not u n t il 1872 that the states on the mainland four-fifths of the uniformity money on a -per capita basis. ments for which these various will wealth, £1,127,000; Victoria, tralia, £177,000. South Australia and Western are not prepared to. pay their share at adopted. Coming down to more recent present, and the Commonwealth will have history, I refer honourable members to to pay it for them until they see the the report on the defence of Australia, light. able benefit and to Australia, tion of a complete nect Brisbane with Perth. length of that journey is 3,040 and trains have to be changed five times sulted in lines that would appear to be more en route. the struggles of a mother and her children to the defence of the country. Mr Forde at a, break of gauge station such as Wallangarra or Albury, will have realized the inconvenience, confusion, and discomfort that that involves, although that aspect of the matter is of minor importance. Break of gauge stations greatly increase the cost of transportation. A t Wallangarra, for in stance, a special transhipment staff has to be employed permanently. It is the same at Albury. The construction of the Grafton to South Brisbane line will reduce the travelling time of the Sydney to'Brisbane journey fro m 26 hours to 20 hours, and will shorten the journey by at least 100 miles. The proposed line will pass through and encourage settlement in some of the finest country in Australia, and will make available to the rich Kyogle district and to the other northern in which contain some of the best land in the 1 of that report. The Commonwealth, the important metropolithat this work is to be cartan market of Brisbane. Australia is not South Wales and singular in that she has to face a break should not deter honorof gauge problem, for Great Britain and of the had that experience. In the early days Australia's lack foresight in railway construcof 70 miles, £1,250,000. repeating itself. The unification of railof gauges was secured. The payTwo years after the first railway line was parties built in New South Wales, the then chief be responsible are: -Commonengineer for railways recommended to the £700,000; New South Wales, government of the day that before the Queensland, £410,000; rails met at the Murray River the New £819,0p0; South AusSouth Wales railway system should be £267,000; Western Australia, converted to the 5-ft. 3-in. gauge to secure Unfortunately, Victoria, uniformity with Victoria, but, unforAustralia tunately, his recommendation was not The line will be of considerdated the 11th July, 1910, which Lord to the southern states Kitchener presented to the Commonfor it is a secwealth Government,, paragraph 11 of scheme to conwhich readsThe present I would also mention that railway construcmiles, tion has, while developing the country, reAny one who has witnessed favorable to an enemy invading Australia than Different gauges in most of tbe states isolate each system, and the want of systematic interior is'always eager to obtain from the Goconnexion makes the present lines running invernment grants in aid of Tasmania. land of little use for defence, though possibly of considerable value to an enemy who would have temporary command of tbe sea. Lord Kitchener, looking at the problem of the defence of Australia with the eyes of an expert, realized what a fearful been wrongly informed, and I shall look danger our differing railway gauges would to the honourable member to support the be to us if ever this country were invaded. bill, although I assure him that I do not Although some honourable members of wish to cajole him into doing so if he this chamber tell us, in season and out of is not favorable to the proposition. Cerseason, that the matter of paramount imtainly, a few years have passed since the portance to them from a national point 1914 Premiers' Conference was held, but of view is the defence of the country, I the lapse of time has only made more ap regret to learn that they intend to oppose parent than ever before the necessity for this bill. I hope that before doing so u n if y in g our railway gauges. The subthey will give earnest consideration to the ject has not come to the f r o n t suddenly. wisdom of making a start to unify our It Has been discussed,, as Mr Fisher railway gauges for defence purposes. The pointed out, ever since the establishment unification, of railway gauges has been of federation. discussed at almost every premiers' conference for the last 25 years, and you, Mr Speaker, as an ex-premier of Victoria, have, I feel certain, participated in some of those conferences, Victorian, and I believe he has decided and I have no doubt that you have taken to adopt the policy of the Age newspaper, your part in urging the desirableness of and oppose the construction of this line, unification. The report of the conference but I shall not allow him to stifle m y of premiers, in Melbourne, in Novemdiscussion of the project. ber, 1914, attributes the following remarks to Mr Andrew Fisher, then I hope the honourable member for CapriLabour Prime Minister of AustraliaThe Commonwealth Government was strongly as a term of reproach. in favour of a uniform railway gauge throughout Australia, and was prepared to go a long way in the matter of raising the money. ThisI did not, for if I have not grown to like question had been discussed ever since federathe Victorian climate I have learned to tion, and nothing tangible had yet been done. appreciate her people. The conversion of Since the last conference, the matter had become more urgent, from a defence point the railway gauges of Australia to a of v.iew. Failing an agreement on the question standard gauge was first recommended by of unification, he asked the states to consider a Royal Commission on the 11th A p r i l , an alternative proposal to give the Common1913, but the work was not proceeded wealth the power and facilities to construct a strategic railwav to connect Adelaide and with, on account of the prohibitive cost. Brisbane, but taking a more direct route inThat commission estimated that the cost land. This route would be much safer, from of conversion of all lines to the 4 f t . 8£ in . a defence point of view, and would shorten the distance between the centres very considergauge would be £37,164,000, which, it ably. It had been advocated by the military apportioned as follows:-Ne w South experts. He asked what co-operation would Wales £120,000; Victoria, £6,117,000; the states afford the Commonwealth in the Queensland, £12,578,000; South Ausmatter of Crown lands if it constructed the line. tory. history .to honourable members who are would probably be at least twice as much in doubt. orable member for Darwin intends to estimated expenditure involved in carryoppose this b ill , and it is therefore necesing out the limited scheme to connect all sary to remind h i m of these facts. He the capitals proposed in 1913, was I intend to oppose the building of this railway. 1 should speak for himself. He is a cornia did not use the word "" Victorian "" tralia, £6,228,000; Western Australia, £10,840,000; and the Commonwealth GoT h a t is ancient hisvernment, £1,281,000. If an attempt were made now to convert the existing It is very necessary lines to the 4-ft. 8J-in. gauge, the costI understand that the honas it was estimated to be in 1913. The",43,Bruce
213,Mr Whitsitt,,45,Bruce
214,Mr Fokde,,45,Bruce
215,Mr Whitsitt,I have not said that,45,Bruce
216,Mr Fokde,Then I hope that I have,45,Bruce
217,Mr Latham,We all know that.,45,Bruce
218,Mr Forde,The honourable member,45,Bruce
219,Mr Speaker (Rt. Hon. W. A. Watt).,,45,Bruce
