speakerGroups,speaker,theText,pageNumbers,title
0,"House Of Representatives. Wednesday, So June, 1926. Groom) Took The Chair At 2.30 P.m., And Read Prayers. Read The Newspaper Cablegrams Stating That The .Canadian Government Has Been Defeated, And Tbat A General Election Is Imminent, The Result Of Which Cannot Be Known Until After The Date Fixed For Tho Imperial Conference? I N These Circum","stances, does not the right honourable gentleman think it wise to suggest that the oonferenco should be postponed until Canada can be represented at it? zie King, has resigned, and that a general election may bo held in November. There is, however, no definite information that a general election will follow this crisis in the Canadian Parliament. If an election has to be held, the date of the Imperial Conference may have to be reconsidered. Doubtless this matter is now receiving the attention of the British Government. ister say how many , of the States have accepted the Commonwealth offer of a grant for road construction, and when the House may expect a statement by him in regard to this matter? Victoria, Queensland, Tasmania, and Western Australia have definitely indicated that they propose to take advantage of the Commonwealth offer. I understand that the Government of South Australia intends to adopt a similar course, but the intentions of the Government of New South Wales have not been indicated. The Commonwealth's proposals will form part of the financial policy of the Government to be stated in the Treasurer's budget speech. (Hon. Sir Littleton",14,Setup
1,Mr Speaker,,14,Commonwealth Roads Grant
2,Mr West,"Has the Prime Minister,",14,Commonwealth Roads Grant
3,Mr Brtjce,I have read in the press,14,Commonwealth Roads Grant
4,"That The Government, Led By Mr Mcken",,14,Commonwealth Roads Grant
5,Mr Makin,Will the Prime Min,14,Commonwealth Roads Grant
6,Mr Brtjce,"The Governments ofMinister whether the Government will consider the advisability of appointing a woman to assist the Tariff Board when it is inquiring into items for the use of women and children, particularly apparel and the materials for making it? ber's suggestion will receive consideration. need for the amending bill which the of the Minister for Defence to the honourable member for Corio and to myself with reference to the probable abolition of the boys' training ship Tingira and its transfer to Geelong, and to the Minister's statement that the whole question of boys' training was under review, will an opportunity be provided to the Parliament to discuss this vital matter before any decision is reached, or, if the Government has arrived at a decision, before it is put into operation? posal referred to in the first portion of the honourable member's question is still under consideration. I suggest that the second part of the question might be put upon the notice-paper. General inform the House whether, in accordance with the new Arbitration Act, the deputy presidents of the Arbitration Court have been asked to continue their work, but to confine themselves to cases already part heard? Isi t true that the new court, when appointed, will deal only with general matters and not with specific plaints? If so, will not the work of the court become greatly congested within the next six months? Will the Attorney-General consider the advisability of introducing a small amendment of the Arbitration Act to allow the two deputy presidents to deal with cases already listed, the hearing of which otherwise might be delayed for a considerable time ? tration Act provides for the continuance of the powers and functions of the deputy presidents of the Arbitration Court, in order that they may determine part-heard cases; but it is not correct to say that the new court about to be constituted will deal only with general matters. It will function under the act until amended, in accordance with the existing constitutional powers of this Parliament, or with the further powers which the people are to be asked to confer upon this legislature. In the circumstances, there is no honourable member has suggested. bate in this House, the Minister representing the Minister for Home and Territories promised that consideration would be given to the suggestion that distinctive names should be attached to those areas now known as Northern Australia and Central Australia. Has the Minister any information on that subject to give to the House? suggestion would be brought under the notice of the Cabinet, but the pressure of other more urgent business has prevented it from being dealt with. I hope, however, that, in the near future, the Government will be able to attach appropriate names to those very important parts of Australia. in William-street, Sydney, encroaches on the roadway and seriously interferes with pedestrian and vehicular traffic there. Does the Postmaster-General know when that monstrosity will be removed? ter has caused the honourable member much concern; but the department is doing its best to have the building removed, and if the honourable member has been in that vicinity lately he will have noticed that it is now being removed. There was more involved than the mere removal of the post office, because it housed a telephone exchange, the removal of which has necessitated an expenditure of a sum of about £200,000. It is expected that a new post office on the existing site will be ready within nine months'"" time.",14,Commonwealth Roads Grant
7,Mr Parsons,I ask tlie Prime,15,William Street Post Office Sydney
8,Mr Brtjce,The honourable mem,15,William Street Post Office Sydney
9,Mr Marks,Adverting to the reply,15,William Street Post Office Sydney
10,Sir Neville Howse,The pro,15,William Street Post Office Sydney
11,Mr Blakeley,Will the Attorney,15,William Street Post Office Sydney
12,Mr Latham,The amending Arbi,15,William Street Post Office Sydney
13,Mr Gullett,During a recent de,15,William Street Post Office Sydney
14,Mr Marr,I did promise that this,15,William Street Post Office Sydney
15,Mr West,The post office building,15,William Street Post Office Sydney
16,Mr Gibson,"I know that this matter noted the extraordinary differences of pronunciation given to the name of the. Federal Capital by many authorities and by the press? Will he confirm the pronunciation given to the name by Lady Denman when she christened the city, placing the emphasis on the first, not on the second, syllable? cannot satisfy the desire of the honourable member that I should give the official pronunciation of Canberra. him, too, that the object of questions is not to elicit opinions from Ministers. ister consider bringing down a bill to settle, once for all, the pronunciation of the word Canberra? ber's suggestion will receive consideration, but I foresee that the Attorney General's Department may have difficulty in expressing exactly the intention of Parliament in its draft of the measure. projection of certain works in the Northern Territory, has the Prime Minister received from the Women's Service Guild being obtained. of Perth a request to make arrangements for the special protection of native women; and if so, will he take steps to comply with it? sentations, and they will be given con senting the Minister for Home and Tersideration. senting the Minister for Home and Territories, upon notice1. Are the activities of the Chairman of the Expropriation Board at Rabaul directed in the best interests of the development of the Mandated Territories? 2. Has there been a wholesale dismissal of returned soldiers engaged in plantation managing and in other capacities, all of whom in the past appear to have given entire satisfaction to the BoardI 3. Will he furnish the number of returned soldiers dismissed from employment in the Mandated Territory during the last 6ix orable member's questions are as follow:1. Tlie activities of the Chairman of the Expropriation Board are directed in the best interests of the management of such properties in the Mandated Territory of New Guinea as come within his control. 2.. No, but as the expropriated plantations are sold, the staff of the Expropriation Board is naturally reduced. This reduction is effected, as far as practicable, by the non-reengagement of men whose contracts are exI remind piring. Most of the plantations sold have been acquired by ex-employees of the Expropriation Board. 3. The actual number of returned soldiers whose contracts have been terminated by the Expropriation Board in New Guinea is being secured by radio, and will be furnished to the honourable member at an early date. for Trade and Customs, upon noticeWhat proportion of the 8,110 cwt., value £9,770, of electrical conduit piping, tariff item 152B, that was imported into Australia since the 1st January, 1926, came from Germany, and what proportion came from England? SALE OF PLANTATIONS, 1 ritories, upon notice1. Will he supply the names of the plantations in GroupI . (Mandated Territories) that were sold, showing at the same time the monthly production of copra on each from January to May inclusive? 2. Will he show figures indicating over the period January-May inclusive the monthly production of copra on the following plantations:-Raniolo, Ulareu, Malapo? orable member's questions are as follow:1. The names of the plantations in GroupI . of Expropriated Properties sold to date are:Ulaveo, Gumanur, Matanatar, Tokua, Kuradai, Ablingi, Ravalien, Palmalmal, Put Put, Warangoi, Kabanga, Maulapao, Kenabot, Tobera, .. In^Ji Varzin, Kuraibu, Raniolo, Gire Gire, Natava,",15,William Street Post Office Sydney
17,Mr Marks,Has the Prime Minismonths?,16,Mandated Territories Production Of Copra
18,Mr Bruce,I am afraid that I,16,Mandated Territories Production Of Copra
19,Mr Bowden,Will the Prime Min,16,Mandated Territories Production Of Copra
20,Mr Bruce,The honourable mem,16,Mandated Territories Production Of Copra
21,Mr Mann,In connection with the,16,Mandated Territories Production Of Copra
22,Mr Bruce,I have received repre,16,Mandated Territories Production Of Copra
23,Dr. Nott Asked The Minister Repre,,16,Mandated Territories Production Of Copra
24,Mr Marr,The answers to the hon,16,Mandated Territories Production Of Copra
25,Mr Gregory Asked The Minister,,16,Mandated Territories Production Of Copra
26,Mr Pratten,The information is,16,Mandated Territories Production Of Copra
27,Dr. Nott Asked The Minister Reprer,,16,Mandated Territories Production Of Copra
28,Mr Marr,"The answers to the honWunabugbug, Tovakundum, Wangaramut, Kabaira, Vunakambi, Vunaeoco, Gavit, Tovanakus, Rangarerc, Pondo, Upper Seeberg, Lassul, Nainbung, Neinduk, Vunabere, Galtum, New Massawa, Old Massawa, Guntershohe, Bioko, Inabui, Makada, Kapsu, Matupi Farm, Mortloelie Group (Custodian's interest only), Bomana. The chairman of tlie Expropriation Board has been asked by radio to forward as soon as possible details of the monthly output of copra from those properties. 2. See reply to Question No. 1. for Health, upon notice1. Since 1st January, 1026, how many tons of New Zealand potatoes have been condemned at Melbourne, Sydney, Brisbane, and Adelaide, because of a disease known as corky scab? 2. What action does the Government intend to take to prevent such a disease being introduced into Australia? 3. How many tons of New Zealand potatoes have been imported into Australia since 1st January, 1926, and what are the names of the importers? 4. Bow many tons of Australian potatoes wore exported to New Zealand in 1923, 1924, and 1925? to the honourable member's questions are as follow: 1. Twenty-five tons at Melbourne. The information is being obtained from the other States. 2. The action now prescribed includes certificates from New Zealand, inspection and examination on arrival, with condemnation of diseased consignments. There has been no indication that tliis is insufficient. 3 and 4. This information will take an appreciable time to collect, but will be supplied to the honourable member at a later date. P UBLIC SERVICE : TRANSFER OF "" EX EMPT "" AND TEMPORARY EMPLOYEES. representing the Minister for Home and Territories, upon notice1. Isi t the intention of the Government to transfer to Canberra temporary and "" exempt"" Federal employees now in service with the the staff of the Prime Minister's Department, Central Administration ? 2. Is it a fact that many of these employees ments and communications passing between are returned soldiers with many years' service the Government and outside persons? in Federal departments? 3. If these employees are not to be transwith the Melbourne Beraldl ferred, will the Government tell them so without further delay? 4. If their services are to be dispensed with, will they be treated in the same way as similar employees in the Repatriation Department? 5. If they are to be transferred to Canberra, will steps be taken to place them on a permanent basis in the Public Service? U. If transferred as temporary employees, will they receive tlie same consideration in respect to housing as permanent employees? orable member's questions are as follow :1. As a policy,, it is not the intention to transfer any temporary employee. It is possible that certain exempt employees will, of necessity, be transferred to Canberra. 2. There are returned soldiers in temporary and exempted employment, and a certain number have some years' service. 3. As full notice as possible will be given employees whose services are to be dispensed with. 4. No; their services will be terminated in the manner usually applied to temporary employees'. 5. No. Many exempt employees would not be eligible for -permanent appointment under the conditions prescribed by the Public Service Act, and, further, the creation of permanent positions may not be desirable. 6. See answer to 1. The conditions of transfer of those exempt employees who will be transferred to Canberra will be considered in due course. for Markets and Migration, upon noticeWhether tlie information regarding migration, asked for on the 9th June {Hansard, page 2814), is yet available? amount of work is involved in the preparation of the information asked for by the honourable member, but I hope to be able to furnish him with a reply to his question to-morrow. Minister, upon notice.1. What is the position of Mr Lazarus on and what is the amount of his salary? 2. Does he have access to confidential docu3. Was Mr Lazarus formerly associated 4. If so, is he still in the service of that newspaper, and in what capacity?",16,Mandated Territories Production Of Copra
29,Mr Mcgrath Asked Tbe Minister,,17,Prime Minister S Department Position Of Mr Lazarus
30,Sir Neville Howse,The answers,17,Prime Minister S Department Position Of Mr Lazarus
31,Mr Gullett Asked The Minister,,17,Prime Minister S Department Position Of Mr Lazarus
32,Mr Marr,The answers to the hon,17,Prime Minister S Department Position Of Mr Lazarus
33,Mr Charlton Asked The Minister,,17,Prime Minister S Department Position Of Mr Lazarus
34,Mr Paterson,A considerable,17,Prime Minister S Department Position Of Mr Lazarus
35,"Mr Coleman"" Asked The Prime","rarily occupying the position of assistant private secretary, as published in Commonwealth Gazette, No. 54 of the 17th June, 1926, at a salary of £450 per annum. Mr Lazarus, who formerly was associated with the Herald, was selected in accordance with the usual custom to accompany the Australian delegation to the forthcoming Imperial Conference in the capacity of publicity officer. It is a practice dating back fo many Conferences to select an active member of the press for this purpose rather than detach the regular Commonwealth publicity officer from the Prime Minister's Department, whicb. is naturally always considerably weakened during the absence of an important delegation. Mr Lazarus was taken on in advance in order that he might familiarize himself with the many and complex subjects with which he will have to deal, and he naturally has access to these documents. At the conclusion of the Conference, Mr Lazarus will relinquish his duties. ister, upon noticeWill he furnish a list of the commissions and boards established by the Federal Government from 1st July, 1917, to 31st Docember, 1922, and from 1st January, 1923, to present date, and the total cost to the Government of such commissions and boards? on the lines indicated. Minister, upon notice1. How many commissions, boards, and otlier autliorities created by or under the control of the Commonwealth Government, have operated during the past twelve months, or are at present in existence; and what was or what are the designations and functions of the same? 2. On what other specified authorities, corporations, &c, Governmental, semi-Governmental, or private, is the Government represented, and by whom? 3. What is the personnel and what are the salaries of tlie representatives referred to in questions 1 and 2? 4. What other costs (if any) have been incurred by the Commonwealth Government as a result of the transactions, &c., of the authoripended for a time, and gold would have had ties referred to in questions 1 and 2? ing obtained, and a reply will be furnished at the earliest possible date. LINE OF STEAMERS. ister, upon notice1. Isi t a fact that Mr Larkin, chairman of the Commonwealth Shipping Board, is in London; if so, how long has he been there? 2. Isi t a fact that the head-quarters of the Commonwealth Shipping Board is in Sydney? -3. What salary does Mr Larkin receive as chairman ? . 4. What expenses, if any (a) in Australia, (0) outside Australia, has he been allowed since his appointment? 6. IS it a fact that, apart from salary and expenses, he receives an amount for entertainment purposes; if so, how much has he received? being obtained. noticeWhether the Commonwealth Bank lent the private hanks the sum of £15,000,000 in notes during tlie year 1925 at i i per cent.? the honourable member's question is as follows:No. Tlie Commonwealth Bank at no time has lent private banks the sum of £15,000,000. To clear up misconceptions, I will narrate the exact facts that gave rise to the suggestion. In the year 1924, exchange difficulties became intense, and transfer of money from London to pay for the sale of Australian products overseas cost about £5 in every £100. This was serious, but worse was threatened because it appeared that exchange was likely to break down altogether, so tliat the money could not be transferred at all. In these circumstances, the Commonwealth Bank came to the rescue, and undertook to lend to the other banks, if necessary, a sum not exceeding £15,000,000, the banks to pay interest to the Commonwealth Bank at the Bank of England rate of the day. The exchange position immediately was relieved, and money was transferred from London to Australia in payment for primary products at a cost of £3 10s. per cent. If this action had not been taken by the Commonwealth Bank, it seems clear that the sale of primary products would have had to be susto be brought from America. Then, ontlie resumption of sales, the primary producers would have been compelled to pay an extravagant rate to get their money from London. Though the Commonwealth Bank undertook to",17,Prime Minister S Department Position Of Mr Lazarus
36,Mr Bruce,Mr Lazarus is tempo,18,Commonwealth Ban K Loans To Private Banks
37,Mr Forde Asked The Prime Min,,18,Commonwealth Ban K Loans To Private Banks
38,Mr Bruce,A list will be furnished,18,Commonwealth Ban K Loans To Private Banks
39,Mr Coleman Asked The Prime,,18,Commonwealth Ban K Loans To Private Banks
40,Mr Bruce,The information is be,18,Commonwealth Ban K Loans To Private Banks
41,' Mr Mcgrath Asked The Prime Min,,18,Commonwealth Ban K Loans To Private Banks
42,Mr Bruce,The information is,18,Commonwealth Ban K Loans To Private Banks
43,"Mr Cook Asked The Treasurer, Upon",,18,Commonwealth Ban K Loans To Private Banks
44,Dr. Earle Page,"The answer tolend £1.5,000,000 to the banke, as a matter of fact the highest amount lent at any time was only £2,SOO,000. This was in February, 1025, and tlie whole of the advances were repaid by July of that year. BILL. Debate resumed from 29th June (vide That the bill be now read a second time. When the debate .was adjourned last night I was about to reply to two questions asked by the honourable the Leader of the Opposition ( M t . Charlton) and the honourable member for Darling( Mr Blakeley). The honourable the Leader of the Opposition said that much of the land in this country was not put to proper use, and when I asked why, he replied, "" Because the owners will not put it to the best use."" The honourable member for Darling then interjected, "" There is a lot of good agricultural land in the electorate of the honourable member for Wakefield that is used for rearing sheep, but is admirably suited for agriculture."" In 1923-24 Government led the way towards the resumption of the most valuable of the estates in South Australia, which were being used for rearing sheep while hundreds of farmers were wanting land within the rainfall line. ment made a very successful move, which was anything but pleasing to the holders of the resumed estates, but they, however, soon recognized that, in the national in terests, it was right that their lands, which were of good qualitv. with excellent rainfall, should be made available for subdivision into relatively small areas. A t that time, there was not much to choose between producing wool and wheat. Wheat was as low as Is. 9d. a bushel, and wool, certainly not of the best quality, was being sold at from 4d. to 4 i d . per l b . The State Government bent its energies to the subdivision of the large estates, which were progressively subdivided as the demand + arose for smaller holdings. In almost every in stance they were acquired, not by compulsion, but by arrangement. The temper of the people demanded the change, and the owners wisely realized that they were not able to resist the pressure of [141] public opinion. But the position to-day is entirely different, for there are no squatters' estates l e f t in the Wakefield electorate. Indeed, there is not a big pastoral estate held by a squatter within the rainfall line in South Australia. The electorate of Wakefield, in common with other districts within the rainfal l area, has world-renowned breeders of stud sheep, and we have no longer to demand that these estates shall be cut up, but we have to think very seriously whether we have not gone too far in cutting up the valuable preserves of the breeders of the best stud stock in the world. Honourable members know that wool and wheat, particularly wool, carried us through our troubles during the long period of the war. I wish to inform the honourable member for Darling that five or six breeders of first class stud sheep are selling large areas of the remaining portions of their estates because costs are so high that they cannot show a profit on their business. These breeders are taking up a mere song, enormous areas farther back in Western Australia, and they have taken the best of their sheep with them. They have thus given an impetus to the development of the woolthe South Australian producing industry in Western Australia. That move is of great importance to that State. It would be a calamity if the Government went beyond reasonable bounds in interfering with the breeders of stud stock, for that might result in The GovernAustralia losing the type of carcass and merino wool sheep for which this country is famous the world over. It has been stated by intelligent men that we are doing wrong in allowing our best stud stock to be sent from Australia to other parts of the world. Some of the mosj valuable merino rams that this country has ever produced have been sold to the Government of South Africa. ever produced. able member for his correction. It is contended that we are stimulating the production in other countries of a quality of wool which will run Australia out of the market. means that' they must constantly introduce new blood ? they have not the right type of country. An American visitor who inspected a",18,Commonwealth Ban K Loans To Private Banks
45,"Page 3611), On Motion By Mr Bruce",,19,Second Beading
46,Mr Poster (Wakefield) [2.52],,19,Second Beading
47,Mr Prowse,The best the world has,19,Second Beading
48,Mr Foster,I thank the honor,19,Second Beading
49,Mr Rodgers,The honourable member,19,Second Beading
