speakerGroups,speaker,theText,pageNumbers,title
160,Boothby ( Mr Duncan,"Hughes), Austrade journals, the Minister for Trade and Customs( Mr Pratten) is a prohibitionist. Repeatedly when he was a private member the honourable gentleman protested against the policy of borrowing abroad instead of within Australia, and so retaining the interest in this country. Apparently he now subscribes to a policy which is a continuance of the principle he denounced, and involves the flooding of Australia with British goods, to the detriment of local secondary industries. It is a remarkable fact that when honourable members opposite change from the back benches to the Ministerial bench their views change with chameleon-like rapidity. son) that he should not follow the example of some of his colleagues, but should be loyal in ofiice to the principles he professed as a private member. For the information of honourable members, I quote this criticism of the Minister for Trade and Customs and the Government's immigration proposals"" Borrowing abroad clashes with our policy of protecting our own industries,"" said Mr balance of 35,000 by immigration. Great Pratten recently, "" and our national policy of protection is not complete unless we are self-supporting in regard to our public finance."" There is nothing ambiguous about this. It is a clear and definite statement of a fundamental truth. It is the most important truth that Australia has to learn to-day. The £34,000,000 migration loan is no different from other loans. Britain is not going to send us money-sh e is going to send us £34,000,000 worth of manufactured goods. If Mr Pratten favours tliis loan, he goes back on his definite statement quoted above. If he does not favour it, ho should not silently acquiesce in it. It is up to Mr Pratten to say just where he stands. The Minister for Trado and Customs is continually advocating that Australia shall be self-contained. If our protective policy were really effective, very little money would be raised by the Customs Department j but some honourable members who profess protectionist principles act as if they were free traders. I never do anything to belittle this land of my adoption. I suspect that behind this enthusiasm in certain quarters for immigration is some scheme which is not in the interests of Australia. What is the need for the haste that is being shown other than the desire of the British and Commonwealth Governments to help the British manufacturers? The honourable member for Hume( Mr Parker Moloney) quoted a speech made in England by the Prime Minister( Mr Bruce). Such remarks should never have fallen from the lips of any Australian, and as PrimeM i nister the right honourable gentleman should have placed the interests of Australia first and l e f t other parts of the Empire to look after themselves. The development of Australia has been remarkable. W it h in 140 years a large and prosperous community has been established here, with conditions of living, traditions, and ideals, that are an example to the rest of the world. A t the end of the eighteenth century the population of Australia totalled only 5,000. One hundred years later it I suggest to the new Minister had increased to 3,765,000, and at the end of the first quarter of the 20th century it ' was nearly 6,000,000. Those figures indicate very rapid progress, especially when regard is paid to the fact that our people enjoy conditions better than obtain in any other country. Since the census in 1921, the population of the Commonwealth has increased at the rate of 117,000 per annum-7 0 per cent., or 82,000 by natural increase, and the gold discoveries have caused the rapid influx of people to other countries, but the settlement which followed was not of bhe permanent character of that in Australia, and the prosperity was only ephemeral. Some honourable members have made extravagant statements about the d r if t of population from the country to the cities. That evil is not peculiar to Australia. If I were a GermanI should naturally wish to see Berlin, and if I lived in the French provinces I should want to go to Paris. The gregarious instinct of mankind, and the desire for gaiety and life, are responsible for much of the d r if t from the rural areas to the great centres of population. Another fact to be remembered is that, owing to the development of mechanical invention and the application of advanced knowledge and science to industry, fewer hands are employed now than formerly in connection with the production of foodstuffs. I suppose that fewer men are employed in the primary industries to-day than when I was a boy. Immigration to America reached such proportions that Congress was compelled to limit the influx. Of the 3,036,789 square miles in the TJnited States of America, 1,500,000 square miles is utilized for farming. I understand that the American Congress acted on the",44,Second Beading
161,For Markets And Migration ( Mr Pater,"principle that every nation should be .able to feed itself, and that it is economically unsound for population to increase at a rate disproportionate to the production of foodstuffs. Congress had a national stocktaking. It surveyed the land that was not suitable for the production of foodstuffs-the surface of rivers, lakes, and swamps, and land too steep for cultivation or occupied by railways and cities-mad e allowance for the area that must be devoted to pastoral purposes, and came to the conclusion that, as there was not, in the TJnited States of America itself, a very large area capable of producing foodstuffs, the country could not be overrun with immigrants if provision was to be made for the natural excess of births over deaths among the American American writer recently declared t h a f more of the good things in l if e should be Melbourne, gave evidence before a comleft for those already living in America, mission that half of those who were comthe idea being that an inrush of immigrants, which might possibly interfere with the existing standards of living, would deprive the ipeople of America of some of the privileges enjoyed by them. A t a recent function in London, at which Lady Cook, the wife of the H i g h Commissioner, was present, Miss P. Taylor, of Melbourne, said that Australia needed women with capital to take up land settlement. how this lady came to make such a statement. I do not think that women would succeed in the arduous task of tryin g to make virgin land productive. In New South Wales, a gentleman who occupies a position in. the Upper HouseI call it the Chamber of Fossils Groom) -The honourable, member should not speak disrespectfully of other legislatures in the Commonwealth. Mi-. WEST . ^ As the House of which I am speaking is not elected by the people, I do not regard its members as legislators. tors, and as such are entitled to respect. of that body put forward a scheme for 1,000,000 farms, on which he proposed to settle 1,000,000 people. men who make proposals like that ought to be in mental hospitals. This gentleman is a large land-owner, and some time ago was mixed up in land transactions. There has been more scandal in New South Walesi n connection with land resumption than in connection with any other phase of the State's development. Land has been resumed at a value which rendered it quite impossible for the purchaser to make a livin g on his block, and at the same time pay interest on his capital outlay. We are told by Mr. Allan, the Premier of Victoria, that there is no need for the Migration Commission to look for land in his State, because it is not available. Yet honourable members say that there is any amount of land available in Australia for the settlement of immigrants. It is time steps were taken to make it known overseas that the land is not available for this purpose. people themselves. One Quite recently, some people who are connected with the charity organizations of pelled to seek their assistance were immigrants who had come Ao Australia within the previous twelve months, and that some of them were not mentally fitted to compete w i th Australians in the employment market. Facts like these rivet themselves on my memory, and it is no wonder that I do all I can to prevent people from coming to Australia to occupy the unfortunate position of those I cannot understand who, through their inability to compete w it h active, lively, energetic Australians, are compelled to walk the streets of our cities and be a burden on the benevolent institutions of the States. I come now to the probable cost of the scheme proposed. British manufacturers are always willing to lend money to those countries to which their goods are sent. I have no desire to frighten honourable members, but I think the taxpayers will put an end to the scheme when they realize what it will cost and what damage it will do' to Australia's industries. I presume that the interest payments w ill gradually increase u n t i l the tenth year, when the amount payable will probably be £1,360,000. For the previous nine years it w ill probably A t any rate, a member total £1,800,000. I estimate that the cost of administration will be £20,000 a year. The chairman is to be paid £5,000 a year, I think that and each of the other commissioners will very likely receive £3,000 a year. Each",45,Second Beading
162,Mr Speaker (Hon. Sir Littleton,,46,Second Beading
163,Mr Speaker,They are legisla,46,Second Beading
164,Mr West,"commissioner will need a clerk, a typist, here when we have no means of employand a messenger. Tliere will also be ofiice ing them? Nothing is so injurious to a expenses. A t any rate, I have estimated nation as unemployment. It breeds disthe total cost of interest and office excontent among the workers, and is therepenses at £3,360,000 over the ten years. fore a dangerous element in the comAdding to this the amount of the loan munity. Unemploymentmust react on itself, there will be at the end of ten the prosperity of a nation. The vested years an addition of £37,360,000 to our interests of GreatB r it a in have not the public debt. Judging by the type of people's welfare at heart. The British immigrants we are getting, by the time Government subsidized the mining in the £34,000,000 has been spent, many of dustry to the extent of £35,000,000 solely those who have been brought to Australia to assist railway and shipping interests. at this enormous cost will be in their Those activities are considerably overgraves. Judge Bevan, of New South Wales, has able margin of profit, and at the same told us that a large proportion of those who time give to the workers f a i r wages and appear before him for trial, are recent conditions. arrivals from the other side of the world. Vickers and Company, have considerably The £34,000.000 will be paid to us, not reduced their capital with the object of in. money, but in goods, and the people returning to pre-war conditions. who are sent out to Australia by the aid bill has nothing to recommend it . Many of this money, w ill assist to introduce of the Government's supporters view it into Australia articles which could very with disfavour. The sooner that we have well be produced in Australia itself. It a change of government the better. would ference to When I was a youth, I heard that New be only too glad to come to Australia if South Wales had borrowed £4,000,000 a Labour Government were in power. from GreatB r it a in . I went to the wharf They would be prepared to suffer hardto meet the vessel that I thought would ships for the first few years, knowing bring the money to Australia, and, of that prosperity is inevitable under the course, I was disappointed. I had not regime of a Labour Government. then learned that loans from GreatB r i are proud of Australia, and we should do tain are re-paid by our exports to that nothing to upset our present high stancountry, and that actually no money dard of living. We should not encourage changes hands. works, such as railways, harbours, and no means of absorbing them. public buildings are constructed from has made great strides in railway conloan monies, they become assets, but the struction. The government there granted loan of £34,000,000 for immigration purcertain lands to the Canadian-Pacific poses w ill be of no benefit to Australia, Railway Company. Bailways were conancl will saddle posterity with an interest structed, and the land made available for burden in the same way as the war debt settlement. When the settlers failed, the of. £400,000,000. The British Governblocks were re-sold at a considerable ment has shown itself to be incompetent profit. to deal effectively with its unemployunder a system that would not be tolerated ment. It is incurring enormous expense in Australia. Our railway line from the in the payment of unemployment doles, eastern States to Western Australia is and the money would be better spent in one of the longest in the world. employing the men on work of public the aid of water conservation, many Utlity. That Government is now tryof our desert lands have been successfully ing to foist its undesirable citizens on cultivated. Much has been accomplished Australia. It has not forgotten that at in Australia in the short space of 50 one time. Australia was the dumping years. We should open up additional ground for criminals from GreatB r it a in . avenues of employment before we attempt .It is time that Ave stopped this practice. to bring immigrants here. What is the use of bringing immigrants person would refuse to go on the land Others will be in institutions. capitalized. They cannot show a reasonMany large firms, such as The not make very much difA f t e r the experience of the maladminisif the £34,000,000 came tration of the Conservative Government us in gold instead of goods. of Great Britain, the people there would We When developmental immigrants to come here while we have Canada Canada obtained her railways With Any sane under the present unfavorable conditions. We cannot prevent the d r if t to the cities. This House would be wise the British Government a loan of £34,000,000 for immigration purposes. The whole scheme has apparently been undertaken at the instigation of the British Government, which, in view of the difficulties surrounding it in the matter of unemployment in Great Britain, believes that as a result of this agreement it will be relieved of some responsibility. I do not think for a moment that the authorities in Great Britain consider that the scheme will be the success which tJhe Prime Minister and some of his supporters anticipate. spend loan money in bringing new settlers to Australia, as the debt thus incurred will have to be borne by the future generations. adopt the policy of the Labour administration of 1910 to 1913, when over 87,000. immigrants were brought to Australia yearly without the expenditure of one penny of loan money. I inquired if the proposed expenditure could be investigated by the Public Accounts Committee, but was informed that as a question of policy was involved no such investigation could be made by that committee. I desire to remove the impression in the minds of many persons that honourable members on this side of the House are opposed to i m migration in any form. We are only op? posed to immigration schemes under which large numbers of persons are brought to Australia for whom no employment is available on arrival. Wheni n Sydney a few days ago I was informed that from 400 to 500 men were awaiting work where the construction of the Kyogle to South Brisbane railway is to be commenced. Those men are not loafers, as some would suggest, as many of them possess credentials from foremen of government departments or private contractors. A good deal of preliminary work has to be undertaken before a start can be made with the construction of the line. State Government 1 the State Government, as the 'amended agreement submitted by the Minister for Works and Railways( MrH ill ) was only, ratified by this House on Friday last. I am objecting to the action of the Government in bring more people to Australia when so many deserving Australians are vainly seeking work. The proposals of to refuse to accept from the Government are so unsatisfactory that I trust honourable members will oppose the second reading of the bill. -Although this is really a machinery measure it is, I think, one of the most important which has been submitted for the consideration of Parliament. The bill embodies a serious attempt to provide machinery to deal in a practical manner with the population and development of Australia, which are two of the most pressing problems we have to face. Honourable members opposite who have adverI t is a pernicious system to sely criticized the b ill , still appear to be obsessed with the idea that every wage earner brought into this community will be a competitor for work of which they The Government should sav there is insufficient for those already here. The idea rests upon fallacy, as it is a well-known economic maxim that increased population means an increased demand for products of labour, and is a contributing factor to increased general prosperity. to the land. Sir ELLIOTJOHNSON Of course. They must have access to the l a n d ; and in Australia there are millions of acres awaiting development. We cannot expect a community consisting of only a handful * of people to be allowed to continue indefinitely, without molestation, to occupy this vast continent. Hitherto our protection has been the might of the British navy, which alone has stood between us and the danger of losing this country. Our limited population, which occupies only part of the fringe of our coastal area, would be quite inadequate to protect this country against any powerful foreign nation that was looking for vacant land upon which to settle its surplus population. Not far from our shores there are over-peopled countries whose increase is in a very much greater ratio than our own to the area, of the country. The true basis of comparison as to the growth of countries is not the It cannot be the fault of percentages quoted by the honourable member for Darling( Mr Blakeley), but a percentage based on the figures showing the increase in population in comparison with the acreage of the country. Judged by that standard, we are in a very serious",46,Second Beading
165,Mr Mark,Is not that the fault of the,48,Second Beading
166,Mr West,,48,Second Beading
167,Sir Elliot Johnson (Lang) [ 9 3 8 ] .,,48,Second Beading
168,Mr Yates,"If the people have accesscondition. We must, if we intend to preserve this nation, take effective steps to develop the land of this country and to fill the vast, empty spaces, which are the envy of many people who realize that we have failed to make use of the magnificent heritage which we have received from the British nation. The idea that bringing more workers into the country will prejudice the interests of the wage earners here has been exploded. H a l f a century ago the same idea prevailed in the TJnited States of America. When that country had a population of 25,000,000, attention was drawn to the large numbers of immigrants from Great Britain and other parts of Europe, and the cry was raised by the industrialists that the local labour market was being flooded, and that the chances of employment of American workmen would be proportionately lessened. But when the population had increased to 50,000,000, the general prosperity of the country, and of every individual in it , had relatively increased, and, when the population had increased to 100,000,000. the conditions of industry were better still. factor ? Sir ELLIOTJOHNSON main factor, because every unit added to the population creates a demand for the production of several other units, so that if more units are added to the community the demand for the production of the workers must be increased. fore, the introduction of more labour into a new country, instead of being a menace to the workers, benefits them by increasing the demand, and expanding th« market for their production. migrants are absorbed into industry. agree with those honourable members on this and the Opposition side of the House who hold that we should first provide means of employment for those who are here, and that we should not continue to bring migrants into this country unless we have the means of profitably utilizing their labour. The question of natural opportunity arises here, and in my view the main function of any Government is primarily to see that, so far as possible, equality of natural opportunity is provided for every one; and, secondly, the preservation of law and order and constitutional government on sound principles. I agree with the view that, so long as the natural resources of the country are monopolized by a few persons to the exclusion of those who desire to develop them, so long shall we have to face the problem of poverty of a section of the community; but with equality of opportunity I have no fear of the effects of introducing more labour into this country. I believe that the Government, in bringing forward this bill, is desirous of organizing migration scientifically, and in the best interests of the country. The idea that the British Government is advancing this money merely to get r i d of the unemployed and unemployable of that country, is a mistake. According to the Herald of this evening, that point was raised at the Empire Press Union Migration conference, which is now in session. The report of the proceedings statesThe Dominions Secretary ( Mr L. S. Amery) pointed out that it was a false perspective to regard migration as merely relieving Great Britain's unemployment, which must he solved in Britain. The true basis of partnership of Empire communities was the fully developing of each and not overstocking the I s population the only dominions' labour markets. The press should not paint Eldorados and unduly emphasize failures, but give knowledge interesting to poor It is the men and ambitious middle-class families. Those remarks show that the British Government is alive to the importance of not sending migrants here for the purpose of overstocking our labour market. To do that would be disastrous; Therebut we have our trade unions, which, I should say, can be trusted to look after that aspect of the matter. prevent the labour market from being glutted if migrants are dumped into the country. majority of the migrants who come here will be, of course, wage earners, and will probably be absorbed into the different trade unions, which will then be able to exercise a beneficial influence on the conditions of employment. Further than that, we have our arbitration courts, wages boards, and other tribunals for the regulation of wages and for ensuring to tbe workers a standard of living compatible with the dignity of Australian labour. I ' have never been an advocate of cheap labour. I believe that "" the labourer is worthy of his hire,"" and that well-paid labour, productively and congenially employed, is",48,Second Beading
169,Mr Yates,,49,Second Beading
170,Mr Fokde,But only so long as the,49,Second Beading
171,Sir Elliot Johnson,Quite so. I,49,Second Beading
172,Mr Forde,Ho w can trade unions,49,Second Beading
