speakerGroups,speaker,theText,pageNumbers,title
86,Mr Paterson,"The honourable memmember will find that at the end of ten years the rate of interest paid by the States will have been about 2 per cent. I have no doubt that Great Britain would be prepared to make available, not £34,000,000, but hundreds of millions if it could get relief from the extraordinary conditions existing in that country to-day. British Government is spending something like £60,000,000 a year to supply its people with food, clothing, and shelter and to avoid a revolution. It has had an extremely hard struggle since the war, and it would be a great relief to it if for every £1,000 of the £34,000,000 it is lending, one British could be sent to Australia. not sure that the commission w ill be able to administer the immigration scheme successfully, and, therefore, I oppose the bill. I quite appreciate the attitude of some of the supporters of the Government. The honourable member for Wakefield ( Mr Poster), enthusiastic as he is, is not too sure of the b ill, and advises caution. He said that the Government should be careful to see that the scheme is carried out properly: sideration the way in which the returned soldiers of this country were settled on the land"" settled "" in more ways than onei-w e can see that the same bribery and corruption which took place then mav take place under the commission provided for in this bill. to take place under the commission. because those who managed the soldier settlement were the officers of the Lands Departments of the different States, and they knew the quality of the land they were handling. The British Government lays down an important qualification, that for every £1,000 of the £34,000,000 to be made available one man must be settled on the land. We did not obtain such a result with soldier settlement; in fact, we found that we could not do it for £2,000 a settler. The cost of settling returned soldiers on the land has been anything up to £3,000 for each settler. Certain States -including , I frankly admit, Statesi n whioh Labour governments are in power -hav e accepted the scheme, and have undertaken to settle migrants on the land at a cost of £1.000 each. I do not think it can be done. The honourable commission may be, we cannot reasonably expect it to do something that no one has vet been able to do. A State may accept a loan of £5,000,000 and may submit a scheme which the commission may accept. The scheme may include a proposal to construct a railway at a cost of, £3,000,000, with the object of opening up The certain lands. A f t e r that £3,01)0,000 has been spent, the State borrowing the money will have to show that the required number of men has been settled on the land. If lands have to be compulsorily resumed, surveyed, and subdivided, and the many attendant charges met, the State concerned will have to appeal to the Comsubject monwealth or to the British GovernI am ment to be relieved of its liability to place a man on the land for every £1,000 spent. The Commonwealth Government has already played no unimportant part in solving the labour problems of Great Britain. I would do everything possible to assist the unfortunate workers of Great Britain, provided that in so doing I was not injuring the people of Australia; and if mio-rants are to come to Australia. I would When we take into conrather they came from. B r it a in than from any other country. The Government that brought down this bill to provide more employment and to create openings for more workers is the Government that did so much to send employment out of this country. Honourable members will recollect how this Government, in a burst of patriotic sympathy with It will be more likely the Mother Country, decided to send £5,000,000 of the taxpayers' T h a t may be so, money to Englandi n order that the unemployment, starvation, and degradation of the workers of the Clyde and the naval shipbuilding yards at Home might be, to some extent, relieved. While sending work from Australia to the unemployed of the Clyde, the Government left the iron workers of Australia unemployed. If that £5,000,000 had been spent in Australia, it would have helped to provide work for many of the unemployed in this country. This Government, with consideration for all countries but its own, decided to send that work abroad. Every government's responsibility is first to its own people, before even the people of the Mother Country. The primary object of the bill is to bring more population to Australia, and to place on the land men who are capable However capable the",24,Second Beading
87,Mr Blakeley,,25,Second Beading
88,Mr Lazzabini,,25,Second Beading
89,Mr Blakeley,"of cultivating it . from tbe British Isles people suitable for the l a n d ; they are not available there. They have not been available there for the past 20 years, and they are not likely to be available for the next 20 years. Much land is out of use -jn England, although that country does not produce all its own foodstuffs. It has been said in the House of Commons, and in many articles on migration, that it is foolish of the dominions to expect from the Mother Country migrants suitable for land settlement. Some honourable members and others wish to see this country increase its population with f reat rapidity; but why the hurry? The 'rime Minister has put forward the argument that if we are to hold our country for the white races, we must be prepared to defend it against a hostile lation of Australia in the same period. force. Does that mean that the League of Nations, of which we are a member, will .turn to us and say, "" Australia, you have so many million acres of land which are not being' put to their proper -use, and you have raised barriers against the entry into your country of the members of coloured races. We ask you to remove those restrictions, and to make your country available to those who need and desire it . "" Minister was exaggerating when he made that statement. out its own destiny, and will do so, I have.no doubt, without the aid of the League of Nations. The attitude of the International Labour Conference which was held recently was indicative of that of all such conferences to the ambitions, aspirations, and outlook of Australia. It is difficult for a person 12,000 psychology of such a conference and its view of our aspirations, particularly -with regard tralia policy. other countries say, "" We will accept your White Australia policy, foolish as it is; but what about those races which are not coloured, such as the Italians, the Jugo Slavs, the Maltese, and the Greeks?"" We of the Labour party would not allow migrants to come to this country unti l the landless have land and the workless have work; but even if we wanted them, we would not be prepared to take the dregs of Europe merely because they were human beings Mt-. BRENNAN -Or were white. Mr Blakeley. responsibility, but that does not compel us to rush headlong into any scheme that promises to give us an addition of 2,000 to our population every year. It needs to be emphasized that Australia is among the foremost nations of the world in the matter of increase of population. The right honourable the Prime Minister stated the increase of the population of different countries over a period of 20 years. He said that in that period the population had increased by 30,000,000 in the TJnited States of America, by 3,750,000 in Canada, by 41,000,000 in China, and by 13,000,000 in Japan. He did not state the percentage of increase, and to that extent his figures were misleading. A f t e r quoting those figures, he referred to the paltry increase of 2,000,000 in the popuI t was quite improper of him to paint such a picture to the disadvantage of this country. During the past ten years we have added 2 per cent, to our population, and in this respect we stand with New Zealand and Canada at the head of the list of the nations. honourable the Prime Minister was to The Prime show the increase of population relatively to the size of the different countries. member must agree that a comparison, except of percentages, is 'unfair. able the Prime Minister, in answer to an interjection, did say that there was a greater percentage increase of population in Australia than in any other country. miles away to realize the wealth Statistician, M t . Wickens, has supplied me with figures showing the percentage increase of the population of. the to the White Ausmost important countries of the world Some representatives ot from 1881 to 1921. The increase in New Zealand, which is at the head of the list, was 23 per 1,000 of the population per annum. Australia is second on the list, with an increase of 22 per 1,000. per annum, and the other countries follow in this order: The TJnited States of America, 19 per 1,000 per annum; Canada, 18 per 1,000 per annum; Japan, 11 per 1,000 per annum; England, 9 per 1.000 per annum; Scotland, 7 per 1,000 per annum; and Spain, 7 per 1.000 per annum. Ireland even because they is at the bottom of the list with a decrease of 3 per 1,000 per annum.",25,Second Beading
90,We Cannot Obtain Mr Blakeley,We have a great,26,Second Beading
91,Mr Maxwell,The object of the right,26,Second Beading
92,Australia Has To Work Mr Blakeley,The honourable,26,Second Beading
93,Sir Neville Howse,The r i g ht honor,26,Second Beading
94,Mr Blakeley,"The CommonThe Commonwealth Statistician has also made available the information that at the present rate of increase the population of Australia will be 10,000,000 in 1951. rate will be maintained for 20 or 30 years, but, in my opinion, modern inventions and means of transportation will lead to wonderful developments. I believe that in less than ten years huge international air liners will be operating, which will be of great advertising value to Australia, and will lead to a rapid increase in her population. But even at the present rate of increase it is estimated that in 1986 our population will be 20,000,000; in 2026, 40,000,000; and in 2056, 80,000,000. Although we shall not be worrying about vital statistics in 2056, we must recognize that the period between 1926 and 2056 is inconsiderable in the life and development of a nation. This Government is confirmed in the habit of appointing boards to take over the responsibilities which it should carry. In the course of this debate I have jotted down at haphazard, as they have occurred to me, particulars of various government boards that are operating. My list is as follows:-Commonwealt h Shipping Board, whioh has taken over the management of the Commonwealth Government line of ships and the Cockatoo Island Dockyard; Nauru Island Phosphates Commission, though its appointment was in evitable, and I do not blame the Government for it ; Meat Council; Repatriation Commission; Tariff Board; Federal Capital Commission; War Service Homes Commission ; Northern Territory Commission; Dairy Produce Export Control Board; Dried Fruits Export Control Board; M u r r ay Waters Commission: the Council of Scientific and Industrial Research; the Deportation Board, of which I should like some information, by the way; and the Commonwealth Board of Trade, in addition to which we have our representative on the boards of Amalgamated Commonwealth Oil Refineries Limited. 1 have no doubt that any honourable member, after a few minutes' thought, could add a dozen more boards to the list that I have given. In my opinion, we shall act most unwisely if we take any steps that might lead to large numbers of migrants coming here indiscriminately. Years ago the Government of. the TJnited States of America, at the behest of its commercial magnateswho desired to get rich quick, encouraged any kind of migrant who was: healthy and could work to settle in the It is difficult to say -whether the that country. No inquiries were made as to educational attainments, mentality, or morality; a man was sufficiently , qualified for admission into the country if he would work. But thinking people in America have long foreseen the inevitable result of such a policy, and the whole nation is to-day confronted with a most serious position in consequence of it . The nationals who migrated to America years ago did not .become Americanized, but set up settlements of their own in almost every big city. It is quite easy, in the iron and steel, and also the coal districts of America, to find colonies of Greeks, Maltese, southern and northern Italians, and numerous other nationals, who were brought to the country merely for exploitation purposes. This motley multitude of mixed nationalities constitutes a grave problem in the TJnited States of America. In order to prevent any addition to the difficulties that they are facing in this regard, and to ensure that, in the future, the great proportion of their immigrants shall be of the Nordic race, the Americans have instituted a quota system, similar to that which we have in operation, to control immigration. They decided, first of all, to take the 1892 quota, but soon dis. covered that that would not give the results that they desired, and so they are now taking the 1881 quota. In my opinion, Australia, in the future, w ill be faced with a position similar to that which confronts America unless extreme care is taken in controlling her migration policy. I realize, of course, that the proposed board could easily be prevented from permitting undesirable migrants from coming here, for Parliament could l i m it its power in that direction, or even disband it . The honourable member for Wakefield ( Mr. Wireless Limited and the Foster), in a characteristic speech, has argued that we should agree to this b ill , for it would enable us to help the Old Country to solve her problems. Ever since I have been in this Parliament, the honourable member has given expression to similar flag-flapping sentiments, and I am informed on reliable authority that he has done so throughout his whole political career. He would be well advised to give his own country a little more attention and other countries a little less, -for, as the honourable member for Werriwa( Mr Lazzarini) aptly pointed out last night, he is supporting a government that exports work but imports workers. The honourable member, on at least five occasions in the last three years, has accused the bricklayers of Australia of .going slow, and has said that they lay -50 per cent, less bricks in a given time than did the bricklayers of twenty years -ago. If he would read a little more about industrial happenings in other countries, he would find that, with notable exceptions of the Leverhulme, Ford, and Fry type, capitalists in every land are accusing the workers of their own country of going slow. article on English industrial affairs in which it was alleged that the workers of that country were constructing less, winning less coal, and generally producing less in a given time now than they did ten years ago. The bricklayers there also were accused of doing less work than formerly. One wonders whether, if these British workers concerning whose welfare the honourable member for Wakefield come to Australia, he would accuse them of going slow just as he now accuses our own people of doing so. To my mind it is unpatriotic of honourable members opposite to constantly attack the Australian workman. Minister( Mr Bruce), prior to and during the last election, did this for political purposes, but immediately after the election he admitted that Australia was comparatively free from strikes. That fact, however, had not prevented him from bringing down his ludicrous Deportation B ill . I maintain that Australia is more free from strikes than any other country. Trade unionists, whether their party has been in or out of power, have been able by the weight of numbers, to secure industrial conditions unparalleled in the history of civilization. The policy of the Labour party on the subject under discussion is clear and definite. We believe that tlie present immigration policy of the capitalist governments is directed to flooding the Australian labour market, reducing working class standards, and the providing of cheap labour to sweating employers. We' arc emphatic that public money should not be expended for these purposes. Afr. Blakeley. We declare that Australia is capable, under good government, of supporting in happiness a mueli larger population; but to protect our fellow workers from being deluded from false statements into leaving home and kindred merely to become tools of sweaters, we insist tliat land, housing accommodation, and employment be provided for overseas immigrants before they are invited to come to Australia. ment before migration. the Labour party is in a minority in this House, its policy regarding i m migration has the approval of, not only the workers, but also a large number of other people. But, even if support of that policy were confined to Only recently I read an the industrialists, no immigration scheme could be carried out successfully without the cordial approval and co-operation of Labour. The appointment of commissions and the creation of cumbersome machinery w ill not solve the problem. First of all, there must be no doubt that those who desire land will have itmade available to them. A t Darlington Point, New South Wales, a few days ago, there were over 4,000 apis so interested, were to plicants for one 'block. A t Grafton, a few weeks ago, 4,000 applications were received for a few blocks, and there has been equally keen inquiry at Narrabri, Nyngan, Moree, and other places in New -South Wales. I realize that the applicaThe Prime tions were not all made by bona fide land seekers; but, if we reduce the figures by 25 per cent., we obtain a f a i r l y correct estimate of the number keenly desirous of getting land. Since there is no need to bring large numbers of immigrants to Australia for defence or any other purposes, I oppose the bill in its entirety. prised at the attitude assumed by members of the Opposition. They are apparently tryin g to make this all-important measure a party one, although no bill should be further removed than this from party politics. The honourable member for Darling( Mr Blakeley) made many It statesgood points, such as the necessity for a searching inquiry as to the area of suitable land available for settlement. Australia cannot be expected to remain in the possession of the comparatively small population of 6,000,000, in view of the overcrowded condition of other countries at no great distance from her own shores.",26,Second Beading
95,Mr Fentois',That places develop,28,Second Beading
96,Mr Blakeley,"Yes ; and, although",28,Second Beading
97,Mr Cook ( I N D I ) [ 4 . 2 6 ],"I am surOur most pressing need is provision for defence; and I liave always contended that our best means of defence is a large white population engaged in primary and secondary industries. I was interested to hear the remarks of the honourable member for Wakefield ( Mr Foster), who pointed out that there are large areas of land available for settlement in various parts of the Commonwealth, and I agree with him that experts should be appointed to ascertain the acreage available, its locality and value, and the purpose for whioh it is suitable. In Queensland, Western Australia, and the Northern Territory, there are millions of acres of good land awaiting settlement. absurd to say that those parts are useless. If reasonable facilities, such as roads and railways, were afforded, water provided, and markets found, it could be turned to profitable use. large estates have been re-purchased in the Roma district, in Queensland. Water was thought to be scarce there, but artesian bores have revealed the presence of inquiry should be held into the number and nature of developmental works that might be carried out advantageously, because I take it that the money available could be spent in various directions, such as on road construction and water conservation. Much has been said about the d r if t of the population to the cities. As I pointed out in this House a few days ago, it is largely caused by the legislation that has been placed on the statute-books by past governments, both in the State and Federal arenas. cial character that has resulted in the building up of the cities at the expense of the country. legislation "" ? hours and pay ancl conditions of labour of those engaged in secondary industries. If these rates of pay and conditions were applied to rural industries, the cost of production would be so great as to render the exportation of many of our p r i mary products impossible. I agree w i th the honourable member for Henty( Mr Gullett) that, if the country had been as well catered for as the cities, that d r if t would never have occurred. When we hear of a dairyman, whose assets are worth £1,600, obtaining an income of only £170 per annum, out of which he mustsupport a family, while his son, who is single, earns £312 a year in the city, there is something radically wrong. If the wages and hours of employment in the country could be made as attractive as those in the cities, there would be no talk about an exodus from rural life. At present 96 per cent, of our export trade is represented by primary products, and it would be impossible to retain that trade if the artificial conditions that obtain in the secondary industries were It is applied to rura l pursuits. The opposition of the Labour party to this migration scheme is explained by the proceedings at the Labour conference now being held in England, and the meetings of the various Several trade and labour councils from which honourable members opposite take their directions. All parties receive more or less direction from the organizations with which they are associated. unlimited supplies of it . An The workers' opposition to migration is founded on the fear that the new arrivals w ill compete w i th them in the labour market. I would be the last to support any policy that would have that effect; but I sincerely believe that if our population were doubled by a well organized and carefully-regulated scheme of migration, every worker in Australia would be infinitely better off. The misfortunes of some of the soldier settlers have been advanced as a reason for abandoning migration and land settlement. W h a t legislation? Honourable members w ill credit me with having some knowledge of the conditions and requirements of the man upon the land, and I say that governments w ill be simply courting disaster if they attempt to establish men in primary production under the conditions that applied to many of the soldier settlers. There is very little truth in the statements that have been made that exorbitant prices were paid for land for closer settlement. The cause of the failure of many of the soldier settlers is ""to be found in the conditions under which they started. To the cost of, say, 150 acres of land worth £10 per acre had to be added expenditure on fencing, the building of a house, the making of yards, and the purchase of a small dairy herd and implements. B y",28,Second Beading
98,Mr Scullin,,29,Second Beading
99,Mr Cook,Legislatio n of an artifi,29,Second Beading
100,Mr Scullin,"What is the "" artificial",29,Second Beading
