speakerGroups,speaker,theText,pageNumbers,title
113,Mr Patehson,"Look what Australiascheme is to provide work for migrants. MrE . RILEY vided before' the migrants come here. The development of our primary industries does not -present a problem to us, for they are developed so well that we are in a difficulty to find markets for our over-production; the problem that we have to solve is the establishment of secondary industries. If the Government could show us that this scheme would be successful in that connection, I should be very glad. In my opinion, we should act wisely if , instead of setting up this costly commission, we co-operated with the State Governments in developmental projects. sufficiently attractive, people will be glad to come here, without special inducements being held out to them. listened with a great deal of interest to this debate, and with some surprise to some of the speeches that have been delivered by honourable members opposite. It appears to me that their view of the urgency of the question is out of perspective. In my opinion, the matter is urgent, not only from the point of view of population, but also of defence. The time is rapidly approaching when we shall have to put aside our domestic ideas as to the wisdom or otherwise of adopting a comprehensive migration policy. A f t e r Senator Drake-Brockman's return from Geneva, where he represented Australia at the F if t h Assembly of the League of Nations, he delivered a speech in the Senate which I commend to honourable members. He said that he had sensed an unmistakable desire on the part of the representatives of the nations there assembled to l if t the question of migration from the plane of domestic, on to the higher plane of international politics; and he stressed its great importance in affecting the relations of different nationals. Honourable members w ill remember having seen quite recently in the press the report of the sensational debate on our White Australia policy that occurred at an international Labour conference held in London. The majority of representatives there from the Orient, as well as the rhajority of those who represented the British Labour movement, strongly opposed our policy; but I am glad that Dr. Evatt, a member of ment, who is visiting Great Britain, took up the cudgels on its. behalf, and It should be procaused the conference to take a more reasonableview of the matter. That incident indicates that we must look at this as a question of international politics. Reference has been made during the debate to the possibility of this scheme enabling us to assist Great Britain to solve her acute unemployment problem. I trust that we shall not lose sight of that aspect of it . We owe our very existence to Great Britain, and it ill becomes us to sneer at her, for we should look to her at once in any time of national disaster. In that circumstance, if we can possibly help herto solve her problems, it is in If we make the conditions cumbent upon us to do so. Whatever may be the position of the other self governing dominions in the Empire, it cannot be denied that Australia and New Zealand are absolutely dependent upon I have the goodwill of Great Britain. Our position is entirely different from that of the Dominion of Canada, which has at her back for defence purposes the whole American continent; and we are also in a different position from SouthA f r i c a , where, I am sorry to say, there seems to be a desire to "" cut tbe painter."" Australia mustsink or swim with Great Britain. If by any reasonable means we can introduce into this country migrants of the British race, and relieve Great Britain to some extent of a pressing responsibility, we should by all means do it . Being 12,000 miles from the heart of the Empire, we surely must consider it wise to bring to a successful issue as soon as possible a proper scheme of development and migration. member confine immigration to Britishers ? migrants shortly. Australia, with a population of only 6,000,000, has potentialities exceeding those of the TJnited States of America. W it h its long coast line it is most vulnerable, and it would be difficult to defend, yet we flaunt the challenge of a White Australia before the teeming millions of the Orient, whose envious eyes are ever cast upon us. If only. for the sake of national safety, it is imperative that we should develop our heritage to the fullest extent. References have been made to the New South Wales Parliathe small percentage increase in our' population. The honourable member for",34,Second Beading
114,Mr Gibson,The object of this,35,Second Beading
115,Dr. Nott (Herbert) [ 5 . 2 5 ],,35,Second Beading
116,Mr Coleman,Would the honourable,35,Second Beading
117,Dr. Nott,"I shall deal with foreignDarling( Mr Blakeley), who scorned the warning given by the Prime Minister( Mr Bruce), referred, probably without realizing the significance of. his remarks, to the importance of this aspect. The population of Australia increased during a given period by 2,000,000, and that of Japan increased during the same period to the extent of 13,000,000. But while Australia's natural annual increase is only 140,000, that of Japan is almost 1,000,000. remains exactly the same in each case. over deaths in Australia is practically insignificant, and therefore it is necessary for us to look for a suitable class of m i grants. preference to people of our own k it h and kin, and it is regrettable that the various schemes that have' hitherto been introduced for migration and development have almost without exception failed to produce the results expected, sometimes on account of the inhospitable "" views publicly expressed, but more often, perhaps, because of unsuitable officials. am quite prepared to give credit where it is due, and I have no hesitation in saying that under the present scheme the problem is now being tackled in an earnest endeavour to meet the needs of the nation. plan is that the commissioners will be appointed for seven years, and if they are not successful it will be impossible to dispense with their services. pect of the matter. We have the privilege of showing preference to British migrants, bub if we refuse to admit any migrants at all, we may be faced with the necessity of accepting the nationals of other countries whether we like them or not. It is useless to say that the League of Nations would come to our rescue. The claims of other nations have to be considered by tlie League. A certain proportion of the present population of Australia is composed of people with oriental ideas, and they do not favour the White Australia ideal. If we do not solve the problem of keeping Australia white, others will do it for us. That would mean an influx of migrants that we could not control, and a position might arise somewhat akin to that obtaining in the TJnited States of America. Reference has been made to the anxious eyes cast upon Australia by Southern' European migrants. I think that the honourable member for Darling referred to "" Italians and the dregs of Europe""; but Australia must be prepared to deal with the problem of this migration. I am familiar with the conditions under which Italian migrants live in Australia, and I take no exception to them because of their nationality. I do And the house room not object to Italians on the score that they are not white. They have been white men from the day's of the Roman Empire that existed before the British Empire was dreamt of. If we are to judge nations by their achievements in art, science, and literature, I suggest that the Naturally, we desire to give Italians occupy as proud a position as any white race in Europe. If one thinks of the name of a great"" personage of British nationality, he can easily conjure up the name of some Italian who has similarly contributed in a large measure to the advance of oivilization. It is unfair, therefore, to regard Italian migrants as in any way inferior to British migrants. I The Italians themselves do not ask for preference over other migrants, but when they conform to our immigration laws, they expect to be treated at least as well as other nationals. I have no objection to the admission of a certain proportion of foreigners of white extraction, irrespective of their nationality, provided they conform to all the requirements of our immigration laws. Now that the people of Latin races have been prevented from entering the TJnited States of America to I shall come to that as the same extent as previously, other outlets must be found for the surplus population of Southern Europe, and if this Parliament is not prepared to assist in bringing Australia to a f u l l state of development, pressure w ill assuredly be be made on it from such directions that it w ill not be left for Australia to determine what quotas of foreign nationals are to be admitted. When Mr. Gillies was Premier of Queensland, and a number of It a l i a n migrants were about to land in that State, he telegraphed to the Prime Minister peremptorily requesting h i m to prevent their entrance. I suggest that matters of international importance should be dealt with through diplomatic channels in order to avoid giving offence to other powers. Unless we can",35,Second Beading
118,Mr Maxwell,,36,Second Beading
119,Dr. Nott,Yes. The excess of births,36,Second Beading
120,Mr Coleman,The trouble under this,36,Second Beading
121,Dr. Nott,"prove that there is good reason for our desire to reduce the number of migrants from foreign countries to certain quotas, we are liable to cause trouble. The Lender of the Opposition ( Mr Charlton) did not appear to be particularly happy in his remarks about this measure. He seemed to forget the fact that, when supporting the North Australia B ill , he said that it would be an excellent idea if a certain proportion of the money to be made available under the migration agreement could be used for the development of that part of the Commonwealth. For the rest he merely laid emphasis upon what he regarded as the economic menace of flooding the country with i m migrants. There is no intention on the part of the Government to flood Australia w i th new settlers to such an extent as to cause a serious menace to the workers. necessary, as the honourable member for South Sydney( MrE . Riley) pointed out, to develop our secondary industries vigorously. But between primary and secondary producers I draw no distinction, since each section is dependent on the activities of the otlier. Despite our tariff wall, Queensland in the last ten years has absorbed only an additional 1,600 employees in its secondary industries. ""While the population of the State has increased by only 14 per cent, in that period, its taxation has increased by 280 per cent. responsible for that. Mr ""WEST -Railway construction has helped in that direction. enter honourable member concerning the Queensland railways. is losing £2,000,000 per annum under the The secondary industries are indispensable as a means of providing markets and lucrative employment for our people. Unfortunately, most Australian rural occupations are seasonal. annual crops of wool, wheat, and sugar are being garnered, there is abundant employment at high wages, and the workers are happy and contented; but when the harvesting period is over, great numbers of people slide down the great plane that leads to the cities, and temporarily, at least, are unemployed. Unless and until the Commonwealth develops schemes such as that outlined in this bill, we cannot, even with the aid of a protective tariff, develop our secondary industries sufficiently to give profitable employment to our people, and provide a home market forprimary produce. I listened with interest to the honourable member for Werriwa( Mr. Lazzarini) relating how he, when an incipient primary producer, was compelled to leave the land, whereas had the leasehold system been in operation he would still be indulging his natural predilection for a life on the land, instead of representing an important constituency in this House. The honourable member for Hume( Mr Parker M'olonev) stated that on one occasion 4,000 persons applied for one block of land. If the disappointed 3,999 are still looking for land, I advise them to For many years it w ill be apply to the Queensland Government for leasehold blocks. Two years ago, 1,800 blocks in the Burnett district were made available for selection, and only 850 were taken up. Of those 850 settlers, already 150 have found that they cannot make a living under leasehold conditions, and have l e f t their holdings. completed, and there is a means of getting produce to the market, a different tale will he told. isting leasehold conditions still obtain when the railway reaches the settlement, the balance of the leaseholders will leave by the first train. member oxpect to settle migrants on the land when the native-born will not stay I shall be delighted to there ? available, and taxation been lighter, the The State department Burnett settlers would have had a chance to meet their obligations. that taxation t accordance with this bill will be preceded by an investigation by the commission, While the and I hope that any men placed upon the land in accordance with the commission's recommendations will have a good opportunity to make a living. We have heard a good deal said about the advantages which the leasehold system offers to the individual. Honourable members opposite who advance that argument are doing",36,Second Beading
122,Mr Fenton,The war is largely,37,Second Beading
123,Dr. Nott,,37,Second Beading
124,Mr Forde,When the railway is,37,Second Beading
125,Dr. Nott,I predict that if the ex,37,Second Beading
126,Mr Yates,Ho w does the honourable,37,Second Beading
127,Into A Discussion With The Dr. Nott,Had the freehold been,37,Second Beading
128,Present Labour Administration. Mr Yates,W ill the migrants escape,37,Second Beading
129,Dr. Nott,"Any settlement scheme inmerely lip-service to a plank of their party's platform . in order to tickle the palates cf their supporters. The honourable member for Capricornia ( Mr Porde) cannot deny that under the leasehold system there are 23,000,000 acres less uuder cultivation in Queensland than there were ten years ago; nor can he deny that when the site of the TradesH a l l in Brisbane was resumed recently, and a lease of it was offered to the Trades Hall Council, that body refused it , and asked for the freehold. honourable member to connect his remarks with the bill. some arguments advanced earlier in the debate. The honourable member for Hume( Mr Parker Moloney) never misses an opportunity to talk of the returned soldiers, and condemn the present Government for its action towards them. Persons who are possessed of virtue rarely find need to parade it , and every returned soldier throughout the length and breadth of Australia knows how honourable members on this side have stood in defence of their rights. post-war services of members on this side of the chamber, the honourable member for Hume would do well to recollect the disservice that was done to the soldiers during the anxious period of the war by the people with whom he is associated. settlement, I was informed by many of the settlers that they had made from £400 to £500 each last year by growing cotton and maize, and they expect to do even better this year. corresponded with me tell a different story. The honourable member for Wannon( Mr Rodgers) seems to be terrified by the powers that this bill will confer upon the proposed commission. He need not fear any commission that is composed of men of the calibre of Mr Gepp. Even the honourable member for Wannon referred to him as the master mind of Australia, and if the Government can induce four of the master minds of this country to direct its immigration and development policy, Australia must benefit substantially. Crown, giving only part of his time to a particular subject, must remain a tyro in respect of it ; and the country will fare much better if experts are appointed to devote the whole of their time to the development of migration and development in co-operation with the States. No honourable member can point to any board appointed in the past that has not justified its existence. I am confident tliat when a commission is concentrating upon this great problem and working in collaboration with the States, a sound and practical scheme will be evolved which will mean much to the development of Australia. I should like to see the provisions of the bill broadened so as to cover the development of the Mandated Territories. I assume that this scheme will be applicable to the Northern TerriI was merely replying to tory, but it is our bounden duty to promote, so far as is practicable, the development of those territories over which we hold mandates; and, when the committee stage is. reached, I shall suggest that a certain portion of this money shall be allocated for that purpose. This bill will have my whole-hearted support. Australia is held by only a handful of people, and when we see the populations of other countries, particularly those in When referring to the the f a r East, overflowing their native boundaries, we must realize that the peopling and development of our island continent is an urgent problem, for which we should make every effort possible to find an early solution. [6.01 I congratulate the honourable member for Herbert (Dr. Nott) upon his speech. He was the first honourable member to direct attention to the fact that immigrants other than those of British stock may be dealt with under this bill. There seems to be a' general assumption that the terms "" m i g r a n t "" and "" m i g r a tion "" refer only to people of British origin. ' There is no justification for that reading of the bill . The dictionary defines "" migration "" as meaning-amon g other things-the movement of persons .and tribes from one country, locality, & c , to settle in another, or their removal from one place of residence to another. There is no etymological distinction between m i gration and immigration, but for sentimental reasons we have chosen to differenA Minister of the tiate between their uses. No court would hold that the term "" i m m i g r a t i o n "" excluded British migrants, or that "" m i grants "" referred only to persons of British stock.",37,Second Beading
130,Mr Speaker,Order! I ask the,38,Second Beading
131,Dr. Nott,,38,Second Beading
132,Mr Fobde,On a visit to the Burnett,38,Second Beading
133,Dr. Nott,Thos e settlers who have,38,Second Beading
134,Mr Duncan,"HUGHES (Boothby)ber is surely not contending that under this bill migrants can be introduced from countries other than the TJnitedK in g dom? the bill, migrants from foreign countries, as well as from the United Kingdom, may be admitted. There is nothing to suggest that migration refers only to British migrants; but if , as I believe, that is the intention of the Government, it should be expressly stated in the bill . an agreement under which £34,000,000 is to be advanced to the Commonwealth by the British Government. orable member wil l not find in the bill any phrase which would prevent a migration agreement from being made with some foreign country. agreement as well as the bill , and the agreement provides for an advance of £34,000,000 to be expended in bringing migrants from the United Kingdom. the honourable member realize that reference is made in the bill to other migration agreements? principal migration agreement is that between the Commonwealth Government and the British Government. not exclude any other agreement, and I speak as one who has had some small experience in studying the draftin g of bills. I may be wrong, but, if so, I prefer not to be interrupted while my remarks are unfinished. No doubt, under the bill the Government intends to provide chiefly for British immigration, but the fact that it relates to development and migration indicates, in the absence of an excepting clause, that the control of ail immigration is contemplated. That being so, I am perfectly free, and tbe honourable member for Herbert( D r . No t t ) took the same view, to deal w it h the whole subject of immigration. commission would take over the complete management of immigration. point which I wish to put to the Ministeri n charge of the bill. It appears to me that there is a certain vagueness in its terms. That is quite right and proper so f a r as the intention is to prevent the adoption of any cut-and-dried scheme before the commission has been appointed; but there is an unA s I read desirable vagueness about certain of its provisions. Although the Leader of the Opposition ( Mr Charlton) does not agree w it h my view of its scope, I think that he w ill probably agree with me that, if this bil l is to apply to foreign as well as to British immigration, it is well that the House should know that fact in advance. never agree to the bill if the amount of The hon£34,000,000 were to be used to bring foreign migrants here. matter wns first mentioned by the honourable member for Herbert, but I propose to go further into details than he did. I wish to deal w it h several general points. The first is whether the commission is to have any say respecting the immigration of people of foreign descent, even if that say is limited to the giving of advice. In other words, is this commission, when formed, to have the right to say to the Government, "" We wish to express our views on the immigration of foreigners "" ? If it is not to have the right, and if its work is to be confined entirely to B r it is h immigration-althoug h I see no indicaT h a t does tion of that in the bill-honorabl e members w ill agree with me that its scope is relatively limited. If , on the other hand, the commission is to have a say in regard to immigration generally, another question arises, which was mentioned by the honourable member for Herbert, and also by Senator Drake-Brockmani n another place since his return this year from the meeting of the Assembly of the League of Nations. I regret that a parliamentary rule prevents me from quoting from his exceedingly interesting speech, and I shall, therefore, refer to the speech that I delivered in this House last year, when the Immigration*Bill was being discussed. The few opinions that I tried to establish at that time have been more than amply confirmed by what has occurred since. I hope that I have made it clear to the T h a t is a House that I am now considering the general subject of immigration. I wish to refer to three points that I put forward last year. I then suggested, first,",38,Second Beading
135,Mr Chablton,The honourable mem,39,Second Beading
136,Mr Duncan,HUGHES,39,Second Beading
137,Mr Chablton,This bill incorporates,39,Second Beading
138,Mr Duncan,HUGHES,39,Second Beading
139,Mr Charlton,But we must read the,39,Second Beading
140,Mr Duncan,HUGHES -Does not,39,Second Beading
141,Mr Fobde,Claus e 3 says that the,39,Second Beading
142,Mr Duncan,HUGHES,39,Second Beading
143,Mr Maxwell,"Unde r the bill , the",39,Second Beading
144,Mr Duncan,HUGHES,39,Second Beading
145,Mr Chablton,The House would,39,Second Beading
