speakerGroups,speaker,theText,pageNumbers,title
68,Taking Place In Great Britain. Mr Mar,,24,Sgivgs
69,Mr Parsons,"The Minister deThe honourable gentleman stated in reply that he obtained his information from an authentic letter. Subsequently in an interview with the MinisterI asked him to show the letter to me. stated that the letter appeared in e. newspaper. As the Minister was not prepared to supply the name of the person referred to, except privately, I endeavoured to obtain the information from other sources. ter in Adelaide, and he told me that the Minister had interviewed several winemakers in Melbourne, to whom he made similar statements, allegedly emanating from a wine merchant recently returned from Great Britain. Five times subsequently Mr Salter, in conversation, mentioned the name of Mr ""Walker, and I am quite prepared to declare that it was Mr final dividend on the ordinary shares at the Walker to whom the Minister referred. Mr Walker has since written to the honourable gentleman denying that he made the statement referred to. I shall drop the subject there. If honourable members paid a visit to my electorate they would realize how grave is the concern of the wine-growers over this bill, which will ruin many if passed; therefore, even the Minister must excuse me if I appear to overstep the bounds of parliamentary procedure when speaking on this matter. I shall deal with British wines. The TEMPORARY CHAIRMAN"" Does the honourable member intend to connect his remarks with the advisability of raising or lowering the duty? Mr .PARSONS I do. It has been alleged that ""everything in the garden that is, the vineyard is lovely."" On the previous occasion the Minister did not refer at all to British wines. Afterwards he brought that matter up, and now he has given us some very interesting information. He. has told us that the British Government has increased the excise on British wine by 6d. a gallon, premium of 10s., were also carried bringing the price up to 5s. 6d., as against 9s. Id. a gallon which is the landed price of Australian wine. That is not going to be of very much help to the Australian growers. I wish to give .the House some information about the operations of the British company, Vine Products Limited. In The Wine Trade Beview of 9th March, 1928, there is a report of the last annual meeting of shareholders of this company, of which the following statement appears:Dividend of 30 per cent -Futur e of British He then Wines -The chairman in moving the adoption of the report and accounts expressed the hope that shareholders would consider that events had justified the optimism expressed at the last meeting, and that the profit of £170,000 for 1927 was more than satisfactory. . . . The trading profit after charging all expenses Thus, during the period from March to March, since the last reduction of our bounty, the profits made by this company increased by over 70 per cent. The balance available after deducting the dividend on the preference shares, and the interim dividend on the ordinary shares, was £125,174. The directors proposed to pay a rate of 35 per cent, per annum, making a total of. 30 per cent, for the year. . . . With regard to the position of. the wine trade generally, and their company in particular, he had already said that their profit this year had been secured before receiving the full benefit from the company's Dominion wine operations. In that connection he particularly had in mind the trade anticipated from their contract with the Co-operative Wine Farmers' Association of South Africa. Abnormal shipments of wine from Australia to secure the full export subsidy payable up to 31st August, 1927, by the Commonwealth Government, had, however, been responsible for a heavy drop in the price of Australian wines, an uneconomic stimulation not likely to occur again, as from that date the subsidy had been reduced by Is. a gallon. . . . The home market still offered a very wide scope for expansion, at the present time, whilst there were various other countries into which they might carry their enterprises with profitable results. The. business of Vine Products' Limited had grown from small beginnings to its present proportions against much prejudice and trade opposition, and to-day all must recognize the immense possibilities of British wines for British people. Mr John Davie, C.A., seconded the motion, which was ""carried unanimously, and resolutions increasing the capital of the company to £585,000 by the creation of 140,000 additional ordinary shares of 5s. each, to be issued at a unanimously. I have received a letter from Mr R. C. H . Walker, in which the following statement occurs:Under date 6th March, Sir Ernest Rutherford writes:"" British wines ought to be taxed at least as high as Dominion wines, and I have told the Chancellor of the Exchequer, and also the Chairman of Customs so, pointing out that it is in no way a British",24,Sgivgs
70,I Interviewed Mr Sal,"was £172,025, as against £102,850 last year.industry. The fermentation of the imported 'must' is only a preliminary step to the ordinary labour in an English wine merchant's cellar of laying up, fining, racking, and bottling, &c. Your High Commissioner seems to be diffident about pushing your interests, because the hidebound civil servant here has got into his head that it is a British industry. It is increased, and our wines are now paying the Greeks who have made a fortune out of it."" I have also a letter from Mr C. S. Panton, secretary of the Federal Viticultural Oouncil of Australia. I wish honourable members to understand that, in quoting facts and figures supplied by the wine makers) I do so only because they are in a better position to obtain the information than are the growers. My sympathies are all with the growers. I have said to the wine-makers that they are strong enough to look after themselves, but that I was concerned with protecting the interests of the grape-growers. On the subject of the bounty, however, there is no difference between the growers and the winemakers; they are united in protesting against this reduction. which I have referred statesYou will have noticed that the Imperial budget only increases tlie excise on ""British wines "" by Od. a gallon, whicli will be of but little value, if any, to the Empire wines. The British Vine Products Limited last year made a profit of £170,000. It has decided to issue 140,000 ordinary shares at os. each. The TEMPORARYCHAIRMAN But what has this to do with Australia or the wine bounty? with it : The sole reason that the Government has advanced for reducing the bounty is that Australian wines can now compete on a lower bounty than the present one with other wines which are being sold in Great Britain. I am trying to prove to the Committee that there are factors operataing in Great Britain which will make it absolutely impossible for our wines to compete there if the bounty is reduced. The company of which 1 have spoken has issued 140,000 ordinary 5s. shares, which are being sold at 15s. or a premium of 10s. They w ill probably be offered to ordinary shareholders in the proportion of one to ten. The existing shares are quoted on the market at 31s. 9d. Why is it that this company has been making such large profits during the last twelve months? The reason is that the British Government increased the tariff on imported wines' in A p r i l of last year. Prior to that date our sweet wines were paying, on a prefefental basis, a duty of 2s. a gallon. That duty was 4s. a gallon. Because of that alteration in the duty the British company, Vine Products Limited, has come into its own, and has been able to capture the trade which, to a considerable extent, formerly belonged to us. Even with the increased excise rate of 6d. a gallon, this company is still able to sell its«products at 5s. 6d. a gallon. They increased their turnover to such an extent that last year their profits were raised to the extent of 70 pev cent. They are creating a large amount of new capital with which they intend to expand their business still further. That is an answer to the statement of the Prime Minister( Mr Bruce) that it was impossible for them to expand their business because they were not able to obtain The letter to the necessary space. They are going to build that additional space. If the Government persists with this measure it w ill have to come to the rescue of the industry again, as it had to do in 1924. Some years ago large areas were planted on the river Murray, against the advice of those who had been connected with the wine industry for many years. The growei'3 had no market for their product, and, on the advice of the Federal Viticultural Council of Australia, the Government saved the industry by introducing s measure which made provision for the It has this to do payment of a bounty. Now, in opposition to the studied advice of that council, and in spite of the protestations of the growers themselves, the Government is acting in a manner that w ill prove prejudicial to the industry. I prophesy that before many months have passed the Government w ill have to turn again to the Federal Viticultural Council for advice as to what steps should be taker, to rectify the position. I do not think any person has suggested that the Federal Viticultural Council has ever "" p u t anything over "" the Government. Upon that council are honourable men who have been connected w i th the wine-making industry for many years. They are growers themselves, and have grown up from",25,Sgivgs
71,Mr Parsons,"boyhood alongside the older men who are engaged in production. The interests of the wine-makers are closely wrapped up with those of the growers, and vice versa. If the Government wishes to obtain advice, let it turn to, the source which provided it with such good advice in 1924, when it brought down' a well-considered bill that saved the industry from destruction. To-day the Federal Viticultural Council has, what it did not have in 1924, the united support of the growers throughout the industry. If the Government will heed the warning of that council and those growers, it will refrain from reducing the bounty at the presenttime. RecentlyI had an interview with Mr Gursansky, the president of the Barossa Grape-growers' Association, with which is affiliated the Returned Soldiers' Association at Barossa. Unfortunately, early in the year a very disastrous frost spread right through the Murray valley, and a week or so later a similarly heavy frost swept through the Barossa district, with the result that there has been a very poor yield this year. The TEMPORARY CHAIRMAN"" The honourable member's time has expired. [4.15] -One' s sympathies go out to the sons) because, under very trying conditions, he is making a plea on behalf of a large section of the people he represents: Government. he does or not, the Government will have a majority. The honourable member for Wakefield ( Mr Foster) summed up the position rightly when he said that the party whip had been cracked. Of course, the Government will prevail, no matter what the honourable member for Angas may say. That honourable member may make very telling speeches to his constituents upon the iniquity of this proposal, but he will also have to explain why he is unwavering in his support of a Government that will commit this injustice against a large section of the primary producers of Australia. member for Angas voted against the Government on the motion for the second reading of the hill. vernment has the number of supporters necessary to pass the bill, and, of course, it will allow the honourable member for Angas to have his little say. able member that I have neither sought nor obtained its permission to do so. vernment will tolerate the honourable member, secure in the knowledge that it has the necessary numbers at its back. The, honourable member is aware of that also. He is only beating the air. We shall probably find the honourable member for Indi( Mr Cook) supporting the honourable member for Angas in his denunciation of this iniquity that is being perpetrated against primary producers; yet he is a supporter of the pact which makes it possible for a Minister who is a member of the party that calls itself the Country party, to inflict that iniquity. son) to make no effort to refute the arguments that were advanced on the motion for the second reading of the bill, and that are being repeated at this, the committee stage, in opposition to the proposal of the Government. I do not believe that he has answered one of the objections that have been raised by the opponents of the measure. If he were sitting in the corner, where he sat before the days of. the pact, he would condemn, just as strongly as has the honourable member for Angas, a government which is prepared to commit such an injustice upon a large section of the primary producers. This is an act of repudiation. When the moved the second reading, and again the other day, the Minister endeavored to excuse the attitude he is adopting by saying that the increased preference that has been given by-the British Government to Australia, has quite changed the face of the matter. He has repeated that argument so often that he has probably convinced himself of its truth. any one else. not"" convinced any one who wishes to see a fair thing done by the industry or the people who are engaged in it. He has ignored altogether the changed .circumstances in Great Britain itself. With a wave of the hand, as though it meant",26,Sgivgs
72,Mr Parker Moloney (Hume),,27,Sgivgs
73,Honourable Member For Angas ( Mr Par,,27,Sgivgs
74,Mr E. Riley,Yet he will vote for the,27,Sgivgs
75,Mr Parker Moloney,Whethe r,27,Sgivgs
76,Mr Duncan,HUGHES -The honourable,27,Sgivgs
77,Mr Parker Moloney,The Go,27,Sgivgs
78,Mr Parsons,I can assure the honor,27,Sgivgs
79,Mr Parker Moloney,The Go,27,Sgivgs
80,I T I L L Becomes The Minister ( Mr Pater,,27,Sgivgs
81,Mr Parsons,He has not convinced,27,Sgivgs
82,Mr Parker Moloney,"He hasnothing, he has dismissed the arguments which have heen advanced by those who sit on this side, as well as by some Government supporters, who for the time being are in opposition to it, with regard to the industry that has sprung up in Great Britain for the manufacture of a cheap wine from the ""must,"" or unfermented grape juice imported from Spain, which, upon entering Great Britain, pays no duty, and is undercutting wine from Australia, and all other wines that are sold on the British market. matter last week. honourable member may have dealt with it to his own satisfaction, but his words 4s. did not carry conviction to any other honourable member. The honourable so. gentleman said that Great Britain has increased the duty on foreign wines; but he lightly skimmed over the fact that the manufacture of this cheap wine in Great Britain nullifies the advantage, which appears on paper only, in favour of Australian wines. . general increase of the tariff on wine imports has stimulated the production of so-called British wines. so! The Minister has made no attempt to explain that serious situation; in fact, Australia to place before the Minister the I do not know whether he is aware to what extent the wine industry of Great Britain is developing. development. ing to the Wine Trade Beview, the British company that is manufacturing wine from imported must is called the Vine Products Limited. ago it had a capital of £30,000; but that has now been increased to £585,000. capital is watered. so. Last year the company's profits culty is to get from the Government, any amounted to £48 per cent., and its manureliable factures to 2,500,000 gallons of wine. cheap wine against which the Australian in Great Britain was 2,000,000 gallons, wine .has little chance of competing. The and not 3,000,000 gallons, as had been Minister cannot dispose of those facts stated. Luckily, w# have at^hand a cable with a wave of the hand. As a matter of fact, the Australian wine industry is receiving no advantage from the British preference. The honourable member for Angas said that the preference was the same now as previously. The Minister contended that the preference had been increased. tive preference had been increased. the preference has been increased it must be admitted that it has been nullified by the stimulus that the increased tariff has given to the production -of British wines. been increased; but it is now effective. only construction that I can put on the Minister's words is that the position now is the same except that it is different. honourable member's mind when I reply. Minister has, up to the present, failed to give us any satisfactory information. According to the honourable member for Angas a deputation is coming from South case for the growers there. Evidently those engaged in the wine trade of that State have not been convinced by the Minister's statement. As I have said before, if the Minister were to-day sitting iu the Corner, as a private member, he would be just as loud as we are in protesting against the conditions of the export wine trade. private member would be more convincing than he is to-day. so, and his arguments would certainly be information. The Prime Minister, when replying to a deputation which waited upon him, said that the",27,Sgivgs
83,Mr Paterson,I dealt with that,28,Sgivgs
84,Mr Parker Moloney,The,28,Sgivgs
85,Mr Scullin,"As a matter of fact, the",28,Sgivgs
86,Mr Parker Moloney,That is,28,Sgivgs
87,Mr Paterson,I am well aware of its,28,Sgivgs
88,Mr Parker Moloney,Accord,28,Sgivgs
89,Mr Scullin,And two-thirds of the,28,Sgivgs
90,Mr Parker Moloney,That is more eloquent and forcible. The diffi,28,Sgivgs
91,Mr E. Riley,So-calle d wine.,28,Sgivgs
92,Mr Parker Moloney,It is quantity of Australian wines in bond,28,Sgivgs
93,Mr Paterson,I said that the effec,28,Sgivgs
94,Mr Parker Moloney,Even if,28,Sgivgs
95,Mr Parsons,The preference is still,28,Sgivgs
96,Mr Parker Moloney,That is,28,Sgivgs
97,Mr Paterson,The preference has not,28,Sgivgs
98,Mr Parker Moloney,The,28,Sgivgs
99,Mr Paterson,I shall clear the,28,Sgivgs
100,Mr Parker Moloney,The,28,Sgivgs
101,A Few Years Mr Scullin,The Minister as a,28,Sgivgs
102,Mr Parker Moloney,"I thinkreceived by the Renmark Growers' Distillery Limited, which company, the honourable member for Wakefield will agree, is a reliable source of information. about the wine trade. lieve that it is a co-operative concern controlled by the growers. settlers. company cabled for information to Harper's Wine and Spirit Journal, of Great Britain, and received a reply to the effect that 3,386,000 gallons of Australian wines were in bond in Great Britain, and that the quantity of wine manufactured in Great Britain last year amounted to 2,488,872 gallons. figures taken from the statistics of the United Kingdom on the 29th February, 1928. figures show that the statement of the Prime Minister is unreliable, and that our statements about the increase in the manufacture of British wine have not been exaggerated. year produced a quantity of wine from cheap imported juice which totalled only about half a million gallons less than the quantity of wines exported from Australia. a serious situation. When the Minister says that the increased preference has placed Australian wines on a better footing, he forgets that a new competitor in the British market is doing serious injury to our trade. The Minister should explain the situation in the interests, not only of the wine-growers, but also of honourable members supporting the Government, who will be forced against their will to vote for this measure. The Government's proposal is to reduce the bounty by 9d. a gallon, and it is no concession to be told that the amendment now moved will confer some benefit on those who have entererd into contracts. The benefit they will get will not extend beyond twelve months. The most serious objection to the Government's proposal is that the growers were given to understand that the bounty would operate until August, 1930!,' that is', for three years. It has been said that the late Minister for Tradeand Customs( Mr Pratten), made it plain to the growers and distillers when the original bill was introduced, that although the bill proposed to pay a bounty of Is. 9d. a gallon for three years, that rate would last only until the British preferential duties were altered in favour of Australian wines; but I submit that all that the growers and distillers had to guide them was the act itself. The growers probably never heard of the Minister's statement, and I am not aware that steps were taken to convey to them the words uttered by the Minister. In the circumstances it is quite reasonable to suppose that they knew nothing about the Minister's words, and that all they had to guide them was the act itself, which contained nothing to indicate that the. full bounty would terminate this year; but on the contrary stated that the bounty would last until August, 1930. Some growers are referring to the present measure as a repudiation bill. The term is not too strong; in fact it is the only way in which one would expect them to describe the bill. The Minister for Markets cannot put forward Great Britain last the excuse that when the late Minister for Trade and Customs was introducing the' bill in March of last year, he informed the growers and distillers that the bounty might terminate when the British preferThat is ence was altered. since then I have reminded them of what was likely to happen. not know what steps the Minister took to remind them. The wine-growers I have met have assured me that they have had nothing to guide them but the act itself. I should like to know if the Minister went among the wine-growers in South Australia or wrote to their associations. I have not heard that he has communicated with any of them in the areas in which I come into contact with the growers. of complaint. like to know what steps the Minister took to make the growers aware of the possible termination of the Bounty -The growers themselves tell me they regard this 8",28,Sgivgs
103,Mr Foster,"That, company knows all",29,Sgivgs
104,Mr Parker Moloney,I be,29,Sgivgs
105,Mr Foster,It is owned by soldier,29,Sgivgs
106,Mr Parker Moloney,That,29,Sgivgs
107,Mr Foster,Thos e are the latest,29,Sgivgs
108,Mr Parker Moloney,Thos e,29,Sgivgs
109,Mr Paterson,On several occasions,29,Sgivgs
110,Mr Parker Moloney,I do,29,Sgivgs
111,Mr Foster.',That is their great cause,29,Sgivgs
