speakerGroups,speaker,theText,pageNumbers,title
146,F R O M Mr Panton To Mr Salter,"warehouses. If this be the ease with wine exported under the bounty of 3s. per gallon, with exporters asking for only a bare margin over cost in order to attract buyers, how much of the 1929 export surplus will be unsaleable, with the makers compelled to ask a higher price in order to make up even a little of the 9d. reduction in the bounty? And, if the wine-makers see no prospect of exporting the surplus over Australian requirements of the 1929 vintage, will they be prepared to purchase more grapes than they can find a market for as wine? The position is undoubtedly serious, and, like in all crises through which the industry has passed, the grower has generally been the chief sufferer. This gentleman also saysThe wine-maker has, to his credit, purchased more than his requirements rather than close down on his growers before the whole crop was harvested, and has found no compensation awaiting him by way of improved markets. But with prices at a high level, made compulsory by government regulation, with the general financial depression restricting trading credits, and with no prospect before him oi disposing of a heavy vintage overseas, the one course open to the maker will be to buy only such quantities as will be necessary for his requirements, and, provided the London market remains as at present, his requirements will be 3,000,000 gallons of sweet wine less than can be made from grapes available. Allowing for the wine distilled to furnish the spirit for these 3,000,000 gallons, it represents in all about 35,000 tons of grapes, for which there may be no buyers. The Government has fixed the price of grapes. There is an old saying that you can take a horse to water but you cannot make him drink. I am entirely in accord w i th the policy of fixing the price of grapes, but if the wine-maker has no outlet for his wine, he w ill only buy sufficient grapes at the fixed price to produce the wine for which he has an outlet. The balance of the grapes w ill be left ou the vines. Of what use is it to get a better price for one's grapes if one can dispose of only three-fourths of them ? If the export trade becomes entirely unprofitable, fhe only course open to the wine-maker w ill be to cut out his export trade. W it h the cutting out of the export trade away goes the only hold the Government has on the wine-maker to compel him to pay a fixed price for the grapes he buys; the wine-maker not being in receipt of any bounty w ill be able to pay what he likes for his grapes. in the old position again. recently I was in conversation with a wine-maker, whose advice was to "" Out the bounty out altogether."" I asked hi m what that would mean. He said-""We w ill get back to normal."" I asked what that meant, his reply was"" Ordinary normal conditions."" I wanted to know how the grower would be affected, I was informed that the grower would get "" a reasonable price for his grapes,"" and when I asked what the wine-maker considered a reasonable price for grapes, the reply was"" £5 a ton for doradillos; £6 a ton for lexias; and £7 a ton for shiraz grapes."" The prices for these grapes at the present time are £6, £8 and £10 10s. respectively. That w ill be the position of the growers when this bill is passed. Another prominent grower of Tanunda has expressed himself in the following words:Now, if we get a slump next year, the Murray people will be yelling for help; it is a way they have when anything goes wrongI do not agree with thatAll irrigation lands are government leases, not freehold. Millions of public money are locked up in the irrigation settlements, and in addition to this, the soldier settlements are a government pledge to provide returned soldiers with a reasonable livelihood. If a slump comes, the Murray will be the first to suffer, as, instead of purchasing spirit from the Murray distilleries, the wine-makers in Barossa will have sufficient grapes at their door to provide for their needs. I do not want to keep slogging at this matter. Surely the Minister has heard enough to convince him that he has made a false step. It is better to retreat from a false position than to butt your head against a stone wall, because you have not the moral courage to beat a retreat. "" To err is human; to forgive, divine."" If the Minister w ill admit that he has erred, we shall excuse him because he is human, and he w ill have the divine forgiveness of the whole of the vine producing districts of Australia. I want to giye the committee the real reason why this reduction in bounty has been made and my authority is the Treasurer. A f t e r a visit to the grape districts of Victoria where he interviewed many grapegrowers, the Treasurer returned to Canberra and said that the grape-growers realized that at a time when the Commonwealth was in a financial difficulty the",44,Sgivgs
147,Mr Jfostek,And the growers w ill be,45,Sgivgs
148,Mr Parsons,"That is so. Quitereduction of the wine bounty was inevitable. Pioneer of Renmark was.Hitherto we have been assured that the proposed reduction liad nothing to do with the financial position, but was being made befor cause tlie industry, and especially the working member for Hume( Mr Parker Moloney) wine-makers, were making excessive profits. If the Treasurer had gone into the grapevernment is inflicting an injustice upon growing districts of South Australia his the growers. The honourable member for eyes would have been opened; he would Adelaide( Mr Yates), on the other have found that, so far from this agitahand, said that while the growers have tion having been promoted by the winereceived some benefit, the bounty was makers, the growers were united to a. really a boost to big business, and that man. kerie said to me"" What has gone wrong of wine-maker s who are already well with Mr Paterson? I never thought he off. would do such a thing against the priable member regarded that assertion a? mary producer."" That remark was first an argument for the continuation of the made to me by a member of the Country Party, and one of the keenest supporters old rate of bounty. of the Minister for Markets in the Murray valley. When a man's friends turn Moloney) from him he should accept that as an indication that he has taken a wrong felt by the growers. step. I appeal to the Minister and to the committee to realize that the growpaid only on condition that the wineers are reasonable men, who know makers pay a fair price to the growers their business, and are working hard to for their grapes. That the price stipustabilize their industry. They honestly lated by the Government is fair believed that the bounty was fixed at Is. to the growers can be easily proved. 9d. for three years. The Growers' CoWhenI was in Mildura eighteen operative Distillery at Waikerie has a months ago a deputation of doralarge quantity of wine which it cannot dillo growers requested that the then export. These co-operative distilleries minimum price of £5 per ton should be are in the worse position because, unlike increased to £6 a ton. The Government the proprietary companies, they have not has actually fixed a price which is 10s. great financial resources to support them in excess of that for which the deputaduring a. temporary cessation of the extion asked. The price of doradillo port trade. lieved by the Commonwealth of indebtedgrapes, correspondingly higher. ness to the amount of £200,000 because have been told by the honourable member Parliament realized that they could not for Wakefield that following the reducafford to pay it, and who were forced to tion of the bounty wine-makers will pay approach the State Government for adthe fixed price in respect of the export vances after the disastrous frosts of last trade only, and cut the prices for grapus year, will be unable to export their wine to be converted into wine for the local because the Government's action in remarket. ducing the bounty is placing them in a worse position than they occupied in 1924. As the years go by a man's adaptment's action was a distinct inducement to ability diminishes, and he is less capable the wine-makers to do that. of turning to new methods of earning a livelihood. The Government would member for Angas( Mr Parsons) went so have been more humane had it forced far as to say that some makers might rethese growers out of the industry in 1924 strict themselves to manufacturing for the instead of encouraging them to fight on local trade only, so that they might be for four years and then letting them free, to pay whatever price they thought down. ilr. Parsons. The TEMPORARY CHAIRMAN. The comment by the Murray( Mr Watkins) -Order! The honourable member's time has expired. Markets) [8.50] -The honourable said that by reducing the bounty, the GoGrower after grower at Waifour-fifths of it -went to swell the profits I do not know whether the honorThe honourable member for Hume( Mr Parker said that any reduction of the bounty would be immediately The Government has stipulated that the bounty shall be The growers who were regrapes is £6 -10s., and, of better quality We fit for grapes. I remind the commitee that the wine industry is very handsomely",45,Sgivgs
149,Mr Paterson (Gippsland,Minister,46,Sgivgs
150,Mr Foster,I said that the Govern,46,Sgivgs
151,Mr Paterson,"The honorableprotected against importations. The duties are from 12s. 6d. to 14s. per gallon on wine in bulk, and from 15s. to 18s. per gallon on bottled wine. The dried-fruits industry is able to obtain a payable price for that portion of its produce which is sold in Australia. There is no reason why the wine industry should not do likewise, and be able to pay a fair price to the growers of grapes used for the manufacture of wine for consumption in Australia. Sheltered by a high-tariff wall, the wine-makers have the market to themselves, and are selling a commodity the price of which has not to be cut to the bone as if it were a necessary article of food. A payment of an additional £2 per ton for grapes is equivalent to an increase of Id. per bottle of sweet wine. If the difference between the fixed prices for grapes and prices formerly prevailing, is set down at £2 per ton, will any one say that the Australian market can not carry the necessary trifling increase amounting to Id. per bottle on sweet wine and less still on dry wine. The Commonwealth Government would be surprised if the wine-makers took the action that some honourable members have suggested is threatened. legislation has been to help the growers, and if the threatened action were taken, the Government would have to review the position and safeguard them in another way. makers do what the honourable member has suggested they will do, it will be time enough for the Government to decide what further steps it shall take; but I do not believe that they contemplate any action of that kind. The honourable member for Angas challenged me to name the gentlemen who, I said, had admitted that the industry could carry on profitably with a bounty of Is. per gallon on the wine exported. I did not say that the wine-makers were about the reduction; human nature being what it is, that was not to be expected; but I said, and repeat, that some of them admitted that the industry could make a reasonable profit""not easy money"" as one remarkedwith a bounty of Is. per gallon as soon as the London market readjusted itself to the changed conditions. I do not feel called upon to mention their names. them. I deny that statement. member is practically challenging my veracity; surely he is carrying his championship of the wine-maker3 beyond the bounds of good taste. When men come to me and discuss their business frankly I should not be acting fairly by them if I divulged their names. But I again assure the committee that more than one wine maker has admitted that the industry can carry on profitably on the basis of the new bounty and the existing price of grapes. I shall briefly reiterate the main points upon w-hich the Government bases the reduction. The alteration of the British tariff has given a substantial advantage to our wine-makers. Continental unblended wines against which ours have to compete were formerly dutiable at 2s. 6d. per gallon; the duty is now Ss., an increase of 5s. 6d. per gallon. The duty on Australian wines has been increased from 2s. to 4s., leaving our winemakers with an advantage of 4s. per galThe whole purpose of this lon. Previously their actual advantage over continental competitors was only 6d. per gallon; to-day it is 3s. 6d. per gallon more than it was then. Of course, wines from South Africa or any other British dominion are on the same footing as our own. In regard to blended wines, the latest advice I have is that the efforts to mix 2 or 3 gallons of low-strength wine with 1 gallon of highstrength wine have been a failure, and have been abandoned. If any blending is done now it is confined to the mixing of 1 gallon of low-strength wine with 1 gallon of highstrength wine. If 1 gallon of 25 degrees strength, dutiable at 3s., is blended with 1 gallon of 42 degrees strength, dutiable at 8s., the average duty of 5s. 6d. still leaves our wines of greater strength enthusiastic with an advantage of Is. 6d. a gallon. A little over twelve months ago, when .the bounty was reduced to Is. 9d., our winemakers had an advantage of only 6d. per gallon. Eveni f low and high strength wines can be blended successfully in equal parts, and assuming that the blending costs nothing, the Australian exporter is Is. per gallon better off than he was a year",46,Sgivgs
152,Mr Foster,Ho w could it do that?,47,Sgivgs
153,Mr Paterson,"""When the wine",47,Sgivgs
154,Mr Parsons,On behalf of the lot of,47,Sgivgs
155,Mr Paterson,"The honorableago with his continental competitors. That in itself is a justification for a reduction proposal to reduce the bounty, I , toof the bounty by 9d. a gallon. A good deal has been said to-day concerning the position in regard to British wine. The honourable member for Hume( Mr Parker Moloney) stated that I had failed to deal with that matter on Friday last. As a matter of fact I spoke on it at some length, and to-day I was accused of having made a second-reading speech on the subject. Reference was made by one honourable member to-day to a letter which had been received from Mr Walker, who urged that the excise on so-called British wine should be at least as high as the duty on dominion wines. What is the position? Rather less than a month ago the excise on British wine was raised from la. to Is. 6d. a gallon. We have been informed that the ingredients for the blending of that wine pay a duty of 6d. a gallon, and Australian wine is one of those ingredients. If we add this amount to the new rate of excise of Is. 6d., we find that the new excise on British wine up to 27 degrees is equivalent to 2s. a gallon. We are informed that in almost all cases British wine is of 27 degrees strength or lower, so that the taxation on it very closely approximates the duty on dominion wines of a similar strength. The additional excise on British wines, plus the duty on ingredients, practically places them on the* same taxation footing, strength for strength, with wines produced in the dominions. These facts, then, fully justify the alterations in the bounty which have been made. With regard to the amendment submitted by the lett), I desire to say that the Government is prepared to accept it. did not have an opportunity to speak during the second-reading debate, and I do not propose now to deal with all the various points that have been raised by other honourable members. As has been stated, the clause under discussion is really the bill, and I observe that in the discussion on it, you, sir, have allowed honourable members to deal with almost every aspect of the wine industry. ThoughI do not wish to speak at length, I desire to make my position clear. As a representative of a large number of primary producers who are vitally concerned in the Government's gether with the honourable members for Wakefield and Angas, joined a number of grape-growers from South Australia on a deputation to the Prime Minister to discuss this matter. There is no doubt that they are very much concerned over the proposed action of the Government. The right honourable the Prime Minister and the Minister in charge of the bill have emphasized, over and over again, that the Government has the interests of the grapegrowers at heart, but the Minister has suggested that, in advancing reasons why the bounty should not be reduced, the wine-makers were attempting to mislead me and other honourable members. He endeavoured to persuade the committee that in spite of all that had been said by the wine-makers, and by certain honourable members in their comstituencies, it was possible, owing largely to changed circumstances in Great Britain, for the industry to carry on under the reduced bounty. In effect, the Minister's statement was calculated to make one believe that the wine-makers were endeavoring to "" put one over"" honourable members. I agree with the Leader of the Opposition ( Mr Scullin) that when we were considering legislation for a bounty on wine for export a blunder was made in not granting assistance to the dried fruit-growers, concurrently with the growers of doradillo grapes. Why should a bounty be given to growers of doradillo grapes and denied to producers of dried fruits ? The point has not been sufficiently stressed that the producer of doradillo grapes, and of dried fruits is not infrequently one and the same person. The honourable member for Henty( Mr Gullett) has submitted an amendment to clause 3. Evidently he fears that without the provision which he seeks to include in the bill, there will be a tendency to increase the acreage devoted to the growth of doradillo grapes. I should like to point out that the increase in production of wine has been due, not to increased acreage, but to the fact that a large quantity of grapes previously absorbed by the dried-fruits industry has been diverted into the wine-making industry. We had an unfortunate experience",47,Sgivgs
156,Honourable Member For Henty ( Mr Gul,,48,Sgivgs
157,Mr Stewart (Wimmera) [9.5],"Iduring the war years in connection with the granting of a bounty upon canned fruits. So many leakages occurred that it would have been better if the Government had bought all the fruit from the growers and buried it. It appears that under this bill the wine-makers' measure will be ful l and running over, but, unfortunately, the growers will get only that which runs over, which may be nothing. I endorse the remarks of the honourable member for Wakefield ( Mr the Leader of the Opposition and other Foster) concerning the unwisdom of introducing the bill at this juncture. The time is most inopportune. The Government, if it had intended to reduce the bounty, should have taken action much earlier, instead of waiting until the middle of the season when the grapes were being picked. The honourable member for Indi( Mr Cook) appeared to balance on the tight rope very well indeed. seemed to be torn with conflicting emotions. He did not wish to criticize unduly the Government, and at the same time he desired to put himself right in the eyes of fruit-growers in his constituency. my sympathy. ber Hughes) chided him gently for his attitude. The clause touches a very important issue. The problem of markets is really the problem of the cost of production. vitally the future of settlers in the Murray valley and the huge works undertaken by the Government to ensure the success of settlers engaged in the fruit-growing industry. The Minister suggested that the deputation of fruit growers which waited upon him in Melbourne last September had asked that the export bounty should be sufficient to bring the price received for all dried fruits for export up to the level of Australian prices. position. What they asked for was a bounty sufficient to return to the grower his cost of production. It is significant that all those engaged in the industrythe Australian Dried Fruits Association, the wine-makers, the doradillo growers, and the Returned Soldiers' League are unanimous in urging upon the Government that the passage of this bil will create a very serious position. If , as the result of this reduction in the bounty, wine-makers refuse to buy grapes in the usual quantities, and at a payable price, the effect will be that a very large proportion of the grapes now used in wine-making will revert to the dried-fruits industry. This is a point which I wish to impress strongly upon the Government. The problems of .the industry will not be solved by this reduction; but other problems will be created. I was glad to hear honourable members on both sides of the chamber support an export bounty on dried fruits. Whether the growers are producing doradillo grapes or any other drying varieties of fruit, if they are engaged in an industry that depends upon an export trade, they are compelled under the present economic system' to compete in the markets of the world, and at the same time submit to Australian He costs of production. They have to pay Australian rates of wages, buy Australian implements at high prices, pay high railway freights and water rates, and purchase dear clothing. Sooner or later it will be necessary to face The honourable member has the unanswerable fact that no industry The honourable memthat depends upon export can carry on extraordinary that, while we are spending millions of pounds on water conservation along the Murray Valley, reduced production is being simultaneously preached. This bill affects But, unless we have a reduction in production costs, we must have either bounties upon exports in the case of all primary industries, or reduced production. These are ugly alternatives; but we cannot escape from the fact that all our primary export industries must choose one of the three. Whatever may be the outcome, it seems to me that the wine-makers, by threats of refusing to buy the grapes if the Government's intention is carried out, are That is not the creating a serious position, and I am glad that the Minister recognizes it. The Minister has stated that he will see that the interests of the grape-growers are safeguarded, and I appreciate the manner in which he has committed the Government in that respect. The position r.f the dried fruits industry is had enough already; but if the Government's present 1 intention is given effect to, and more fruit than heretofore is diverted to the",48,Sgivgs
