speakerGroups,speaker,theText,pageNumbers,title
0,"House Of Representatives. Tuesday, 15 May, 1988. Groom) Took The Chair At 3 P.m., And Read Prayers. Assent Reported. Issr/E Or'wsit. Groom)","I propose to issue a writ for the election of a member to serve for the electoral division of Martin; in the State of New South Wales, in the place of the Hon. Herbert Edward Pratten deceased. The dates in.connection with the election will be fixed as follow:-Issu e of writ, Thursday, 24th May, 1928; nominations, Tuesday, 5th June, 1928; polling, Saturday, 16th June, 1928; return of writ, OB or before Wednesday, 27th June, 1928. WI NE EXPORT BOUNTY BILL. ' this morning from grape-growers on the Murray River, particularly at Berri, intimating that a deputation is on the way tq Canberra to interview .the Government upon the proposed reduction of tbe wine bounty, and desiring me to ask that the further consideration of the Wine Export Bounty Bill be deferred until after ita arrival to-morrow. I should like to know if the Prinie Minister will accede to this request? Bounty Bill has been before the House for (Hon. Sir Littleton-",13,Setup
1,Mr Speaker,,13,Marti N Electoral Division
2,Mr Speaker (Hon. Sir Littleton,,13,Marti N Electoral Division
3,Mr Poster,I received a telegram,13,Marti N Electoral Division
4,Mr Bruce,"As the Wine Exportsome time, and the amendments which the ""Government proposes tb have made in it have been in circulation for several days, I regret that I find it impossible to postpone its consideration in committee. Representations in regard to the bounty have been received by the Government from many sources, and the honourable.member for Wakefield ( Mr Foster), and the honourable member for Angas( Mr Parsons), have placed tbe position of the growers before the Government very fully, but I cannot agree to any further postponement of the consideration of the bill. the Prime Minister has read a statement in the Sydney Morning Herald to-day concerning the dispute between the .Marine Oooks' Union and the Huddart Parker line of steamers. The owners are now tying up tbeir boats. The statement referred to is as follows:An offer aiming at a settlement was received in Melbourne yesterday morning from the Federal Secretary of the Marine Cooks' Union( Mr Tudehope J, who forwarded the following telegram from Sydney:-""Our members to resume under suspended award; question of roster to be subject of conference if required after resumption. Abovo terms, if agreed to, will be subject to ratification at our meeting attention of the Minister for Health to-morrow morning. In view of these negotiations, again request extension of time until to the following paragraph which has Wednesday."" In view of the request of the cooks, which might bring about a settlement, will tbe right honourable gentleman use his influence with the owners of the steamers or make overtures to them, to induce them to suspend action in regard to the tying up of their boats, so that they may meet in conference with the cooks, and a possible large industrial upheaval may be prevented ? Australia has been held up for some weeks past owing to this unfortunate dispute between the cooks and the owners of one of the lines of steamers -trading on our coast. -concerned is acting in contempt of the Arbitration Court, a body constituted under statute of this Parliament, and has nad its award cancelled. To my mind, its proper course now is to place itself completely Tinder the jurisdiction of the court, and unless it does so I shall not feel disposed to take any action in regard to the matter at this stage. NEW SOUTH WALES COAL-FIELDS. Prime Minister promised to refer to the Development and Migration Commission the proposal of a German company to establish works for the extraction of by-products from coal. I should like to know if the Commission has yet reported on the proposal, and, if it has not done so, whether, in view of the unemployment among coal-miners at the present time, the right honourable gentleman will expedite its investigations ?. ferred to the Development and Migration Commission, and since then the Commission has been actively engaged in investigating it. The Commission is now awaiting a reply to certain questions'submitted to Mr Fanning, 'the gentleman responsible for the proposal. appeared in the Brisbane Daily Telegraph :Portion of the proposed agreement stated that the radium was to. remain thc property of the Commonwealth, and that it was entrusted on loan to the board, which was responsible to the department for its safe custody and care. The board was to arrange for the radium, when not in use, to be stored in strong rooms or safes approved by the department, and the board was not to allow any portion of the radium to be used outside the Brisbane Hospital. Tf that paragraph is correct, I should like to know what arrangements tbe Commonwealtb proposes to make with the States for the treatment of persons outside the metropolitan area who may be The union suffering from cancer? matter is still under consideration. Arrangements have not yet been concluded with the States. I understand that in the case of New South' Wales these will be completed this week; but it will",13,Marti N Electoral Division
5,Mr Laoey,I should like to know if,14,Cancer Treatment By Radium
6,Mr Bruce,Much of the trade of,14,Cancer Treatment By Radium
7,Mr Charlton,Quite recently the,14,Cancer Treatment By Radium
8,Mr Bruce,The proposal was re,14,Cancer Treatment By Radium
9,Dr. Nott,I . wish to direct the,14,Cancer Treatment By Radium
10,' Sir Neville Howse,"The wholebe several weeks before I am in a position to supply the information the honourable member desires. I assure the honourable member that every effort will be made to provideradium treatment for people outside the metropolitan areas who are suffering from cancer. last I heard a statement broadcasted by wireless, in which it was said that dentifrices were mostly perfumed soap, and had a tendency to cause pyorrhoea and other gum complaints, and that there was only one-Pebeco, a German preparation-whic h did not do so. I should like to know from the Postmaster-General if it is the privilege of "" A "" class broadmonwealth has not previously been a casting stations to accept contracts for advertising in that manner. Listeners-in had to submit to quite an extended dissertation upon the bad effects of all but the advertised dentifrice. I wish to know how much advertisement and how much entertainment listeners-in may expect from broadcasting programmes. of the matter referred to by the honourable member, but I shall have inquiries ister inform the House whether finalitv made into the subject. ister whether he is prepared to give us the ment and Migration Commission and the full reply to the American note regarding Victorian Government? If the negotiadisarmament ? statement on the subject laterin the day. decision ? Prime Minister whether arrangements have yet been completed ""with the Government of Victoria for a further lease by the Commonwealth of Federal Government House in Melbourne? If so, what are the terms of the lease? heen made with the Government of Victoria for the further occupation of the residence by His Excellency the Governor General. The Commonwealth is to continue to use the residence for a period of ten years, and thereafter until the contract is terminated by either Government. The State of Victoria is to receive from the Commonwealth £2,500 a year, to be applied either in payment of rent for Federal Government House, or in payment of interest and sinking fund in respect of a residence to be acquired for the Governor of Victoria. I understand that the Victorian Government recently purchased "" Stonington,"" the house which has been occupied by the State Governor' since the St. Kilda-road residence was made available to the Governor General at the beginning of federation, and the money given by the Commonwealth can be applied to the payment of interest and sinking fund upon the capital sum involved. The Comtenant of Pederal Government House, Melbourne, in the ordinary sense, inasmuch as it has never paid rent for the residence, although it has been, and will continue to be responsible, for its maintenance, which costs several thousand pounds a year. has been reached in regard to the proposed establishment in Geelong of the Textile Schoolwhich has been the subtions have not been completed, -will the the present state of the negotiations. upon noticeWhether tlie first quinquennial investigation of the Commonwealth Superannuation Fund has been completed; and, if so, when will the report be tabled and made available? tion has been completed, and the report has been received, but it has not yet been considered by the Government.",14,Cancer Treatment By Radium
11,Mr Yates,On Saturday evening,15,Commonwealth Superannuation Pund
12,Mr Gibson,I have no knowledge,15,Commonwealth Superannuation Pund
13,Mr Penton,I ask the Prime Minject of negotiation between the Develop,15,Commonwealth Superannuation Pund
14,Mr Bruce,I propose to make a Prime Minister take steps to expedite a,15,Commonwealth Superannuation Pund
15,"Pederal Government House, Mr Bruce",I shall ascertain,15,Commonwealth Superannuation Pund
16,Mr Duncan,HUGHES I ask the,15,Commonwealth Superannuation Pund
17,Mr Bruce,Arrangement s have,15,Commonwealth Superannuation Pund
18,Mr Lister,Can the Prime Min,15,Commonwealth Superannuation Pund
19,"Mr Coleman Asked The Treasurer,",,15,Commonwealth Superannuation Pund
20,Dr. Earle Page,"-The investigaOn the 24th A p r i l , 1928, the honourable asked the following questions:1. How many officers over the age of 30 years have heen appointed or transferred, with continuity of service, from the Public Service of the various States of the Commonwealth since the coining into operation of the Superannuation Act? 2. Taking into consideration the several dates of retirement of those officers, what would be the total amount of their contributions to the fund. (a) On a rate for age basis; and (fi) Assuming that they were allowed the concession of the cheap contributions for the first four units menon at the time the airmen referred to landed tioned in section 13 (5) of the Superannuation Act? 3. What is the total sum involved in the difference between the amounts shown under (a) and (ii) of paragraph 2 of this question? I am now able to furnish the following information:1. 37. 2. (a) £10,673 7s. 3d. (6) £7,799 lis. 9d. 3. £8,873 los. Od. NEW GUINEA. TRIC LIGHTING . MrM c GRATH asked the Minister for Home and Territories, upon noticeWhat are the names and official positions of the members of the Administrative Advisory Council in the Mandated Territory of New Guinea? visory Council of New Guinea consists ofThe Government Secretary, Mr H. H. Page. The Treasurer, Mr H. C. Townsend. H. C. Cardew. The Director of Public Health, Dr. E. T. Brennan. The Director of Agriculture, Mr G. H. Murray. The Administrator may, upon the request of any member of the council, or of his own motion, and shall, upon the request of the council by resolution, require the attendance of any officer of the Public Service for the purpose of assisting the council in the discussion of any question in respect of which the officer has expert knowledge. On the 4th May the honourable member following questions:1. Is it a fact that the aeroplane landing ground at Rabaul has been covered by buildings ? 2. If so, where are aeroplanes now to land in the vicinity of Eabaul? I am now* in receipt of the following information from the Administrator:-1. There is no official landing ground for aeroplanes at Rabaul. An old race-course was used by Messrs. Mustard and Parer for this purpose, at their own risk. This area had been resumed by the administration as a site for a native hospital, and was partly built at Eabaul. The construction of the native hospital is now almost completed. 2. It is doubtful whether a suitable landing ground can be found in the vicinity of Eabaul, but one may possibly be located a few miles out of the town. The selection, preparation and control of sites for aerodromes in New Guinea is, however, a matter which comes within the jurisdiction of the Civil Aviation autliorities. On the 3rd May, the honourable member inter alia, the following question:Is it a fact that public money is to be OF ADVISORY COUNCILspent on the electric lighting of the adminisbeing spent in lighting the town? I am now in a position to inform the honourable member that a system of electric lighting was installed at Government House, Rabaul, some years ago and a new engine has recently been purchased by the administration for the purpose of reconditioning this system. Conditions governing the supply of electric light for the township of Rabaul are now being drawn up by the administration. On their completion, it is proposed to call for tenders for the lighting of the town. Home and Territories, upon noticeWhen will the information sought by the honourable member for Eeid on the 29th March last, concerning Federal Capital Commission Hotels, be supplied? tions asked by the honourable member were1. Is it a fact that staffs, menus, services and facilities to guests are being reduced by the Federal Capital Commission hotels?",15,Commonwealth Superannuation Pund
21,Member For Ballarat ( Mr Mcgrath),,16,Hotels Public Accounts Committee S Investigations Housing Rating
22,Sir Neville Howse,The A d,16,Hotels Public Accounts Committee S Investigations Housing Rating
23,"The Commissioner Of Native Affairs, Mr Canberra.",,16,Hotels Public Accounts Committee S Investigations Housing Rating
24,For Ballarat ( Mr Mcgrath) Asked The,,16,Hotels Public Accounts Committee S Investigations Housing Rating
25,"For Ballarat ( Mr Mcgrath) Asked,",,16,Hotels Public Accounts Committee S Investigations Housing Rating
26,Mr Coleman Asked The Minister For,,16,Hotels Public Accounts Committee S Investigations Housing Rating
27,Sir Neville Howse,"The ques2. Isi t a fact that the tariffs are being raised? 3. Does the Federal Capital Commission intend to pursue a policy of giving less service in return for higher tariffs? I am now in a position to inform him as follows:1. No; but the Commission, in view of its' responsibility to conduct the hotels on a commercial basis, has been carefully examining the organization to assure itself that there has been no waste, over-lapping, or unnecessary work. The object has been to' reduce expenditure, if possible, consistently with affording guests a standard which will compare favourably with hotels of similar grade elsewhere. 2. The tariff schedules of the hotels "" Canberra,"" ""Acton,"" ""Kurrajong,"" ""Ainslie,"" and "" Wellington"" have been revised and an amended schedule will come into operation on and from the 21st May, 192S. This schedule provides for both increases and decreases. 3. No. See answer to 1. Home and Territories, upon notice1. Has his attention been drawn to a statement in the press of the 8th instant that the Federal Capital Commission claimed that certain evidence tendered to the Public Accounts Committee in regard to Canberra was false and that, in consequence, the Commission contemplated placing the matter before the Crown Law authorities? 2. Is it a fact that the publication of this threat may have a detrimental effect on the investigations of that committee? 3. Will he take immediate action to see that witnesses giving evidence unfavorable to the Commission are given the same opportunity (without fear of legal proceedings) as others to present their case? 4. Is the Public Accounts Committee giving an opportunity to the Commission to answer any charges made against it ; if so, what is the mission ? reason for the Commission taking up such an attitude? to the honourable member's questions are as follow:] . Yes. .2. It is not considered that the investigations of the committee are likely to be prejudiced. 3. No action appears to be necessary. 4. Presumably, yes. The matter originated out of an inquiry addressed to the Commission by a press representative, but the Commission advises that the press report does not express clearly the purport of the Commission's reply, which was to the effect that it was considering the question of obtaining legal opinion as to whether certain evidence constituted perjury or not. The Commission explains, in this connection, that it was concerned not so much with the attacks on itself, to which it will reply in due course, as with the effect upon the public mind of untrue statements in regard to Canberra. On the 10th May the honourable memme the following questions:1. Isi t a fact that residents in the Federa' Capital Territory, many of whom are at pre sent paying £104 to £208 per annum renta' have been served with rating charges of 4d in the £1 for general rates, and 2d. in the £1 for lighting, on a pro rata, basis, to the end of last year? 2. Is it also a fact that with each notice was an intimation that if the rates were not paid within 30 days, 10 per cent, would be added; if so, what is the reason for penalizing those who are unable to pay on such short notice ? 3. Is it intended to impose further charges for sewerage, water, and road rates; if so, what rates are to be applied, and from what date? '4. Is it a fact that those rates will make tenants liable for amounts up to £25 per annum ? 5. What further charges, in addition to those mentioned above, will have to be met by persons residing in the Federal Capital Territory? 6. Under what ordinance are tenants made liable for rates? 7. Is it a fact that in no other part of Australia are tenants held responsible for the payment of rates? 8. Has_ legal opinion been obtained as to the legality of making tenants, and not the owners of the land, liable for rates as well as rent; does the Government endorse the action of the Commission, and will they support the Commission should any legal proceedings be taken by residents in regard to these charges? 9. Is it a fact that the values of certain allotments of land at Eastlake are being increased by the Commission for rating purposes, and that lessees have been advised that, if dissatisfied, they may appeal to the Com10. Does this mean that the authority which fixed the values will decide the appeal; i i so, will the Minister remedy what appears to be an injustice? I am now in a position to supply h i m with the following answers:1. Yes. 2. Yes. The penalty is provided for in section 15 (3) of the Rates Ordinance 1920, for the Territory for the Seat of Government. 3. Rates for sewerage and water will be imposed, but these have not yet been struck; they will be in respect of the year 1928. There is no power to strike any special road rate. 4. See answer to No. 3. 5. Owners of leases under the City Area Leases Ordinance, or similar ordinances, will be required to contribute half the cost of providing kerbing and guttering and permanent footpaths when constructed. In the case of persons who are tenants of Commission houses, the cost of such services-excludin g permanent footpaths-is included in the",16,Hotels Public Accounts Committee S Investigations Housing Rating
28,Mr Anstey Asked The Minister For,,17,Hotels Public Accounts Committee S Investigations Housing Rating
29,Sir Neville Howse,The replies,17,Hotels Public Accounts Committee S Investigations Housing Rating
30,Ber For Ballarat ( Mr Mcgrath) Aske'',"capital cost on which the present rental is based. No other rates are payable under present conditions. 6. The Rates Ordinance 1926, and the Building and Services Ordinance 1924-1925. 7. No. 8. Legal opinion has not been obtained on the point, as the ordinance provides that the occupier, lessee, or holder of the land is liable for the rates. It is the duty of the Government to uphold the action of thc Commission in all cases where such action is taken pursuant to the requirements of the law. 9. Yes; in accordance witli the requirement of the Rates Ordinance that' a valuation shall be made from time to time. Section8 of the ordinance provides for appeals to the Commission from any such assessment. 10. Yes. The appeals have not yet been dealt with, and there is consequently no indi-. cation that injustice is likely to be done. If the system should be shown to work unfairly, consideration will bo given to the question of providing any necessary remedy. MrA . GREEN asked the M in is t e r for Trade and Customs, u p o n noticeWhy was the Western Australian Advisory Committee not invited to, or advised regarding, the conference in Melbourne dealing with the exportation of Australian fauna? representatives to the conference in quest i o n was e n t i r e l y in the hands of the v a r i o u s State Governments, and Government of ""WesternA u s t r a l i a dec l in e d to send representatives. u p o n notice1. Has he received a suggestion that the Federal Government should control as a Crown Colony the northern section of Western Australia and Queensland, also the Northern Territory? 2. If so, will he state if it is intended to populate such colonywith coloured indentured labour ? honourable member's questions are as f o l low :1. Suggestions should take over portion of the north of Western Australia havo been received by the Government. In this connection 1 would refer the honourable inember to my statement in this House on Friday, 9th March, 1928, replying to the honourable member for Kalgoorlie, outlining the proposal which had been made by the Commonwealth Government to the Government of Western Australia for the taking over by the Commonwealth of portion of the north of Western Australia. Suggestions were also made to the States of Queensland and Western Australia, in 1925, in connection with the appointment of the North Australia Commission, having in view the inauguration of a policy of joint action for the development of those portions of Queensland, Western Australia, and the Northern Territory, which lie north of the 20th parallel of south latitude. 2. No. WIBE-LESS EQUIPMENT . Trade and Customs, upon notice1. What lighthouses, if any, in Westen Australia, are fitted with wireless equipment? 2. In view of thc isolation of officers on the attended lights on the north-west coast of Western Australia, and the recent rapid development in wireless will he bring before his officers the advisability of installing this necessary means of communication at the lighthouses indicated? being obtained. Postmaster-General, upon notice1. Isi t a fact that telegraph rates from the The a p p o in t m e nt of Federal Capital to the several State capitals are not uniform? 2. If so, what is the authority for such differentiation, and w i ll consideration be given the to bringing tlie rates into conformity with the principle of 63 and 64 Vict., chapter 12, section 99? honourable member's questions are as follow:1. Yes. Intrastate telegraph rates are charged on telegrams from the Federal Capitalto Sydney, and interstate rates to other State capitals 2. These rates have been charged under the Post and Telegraph Rates Act. The question raised by the honourable member w ill receive consideration in connection with the Post and Telegraph RatesB ill now before Parliament. The answers to the WAR PENSIONS. charge of Repatriation, upon noticethat the Commonwealth 1. How many appeals has he received from the 2,518 rejected applications for waT pensions, as reported in the Repatriation Commission report for the year ended 30th June, 1927? 2. How many of such appeals were (a) allowed, and (6) rejected, by the Minister? 3. How many appeals has the Minister received against the 3,763 pensions cancelled or discontinued during the year? 4. How many of such appeals were (a) allowed, and (6) rejected, by the Minister.",17,Hotels Public Accounts Committee S Investigations Housing Rating
31,Mr Bruce,,18,Telegraph Rates
32,"Mr West Asked The P R I M E M I N I S T E R ,",,18,Telegraph Rates
33,Mr Bruce,,18,Telegraph Rates
34,Mr A. Green Asked The Minister For,,18,Telegraph Rates
35,Pauna. Mr Bruce,The information is,18,Telegraph Rates
36,Sir John Gellibrand Asked The,,18,Telegraph Rates
37,Mr Gibson,The replies to the,18,Telegraph Rates
