speakerGroups,speaker,theText,pageNumbers,title
46,Mr Fenton,"As regards theand due for replacement. The Brisbane and the Adelaide were laid down before the 1st January, 1920, and sixteen years only from date of completion in 1916 and 19542, respectively, must elapse before they are deemed over age and capable of replacement. It will therefore be noted that the Brisbane is the first on our list of replacements. The seaplane carrier Albatross, of 5,000 tons, is included in the list of vessels given in annex III of part II . of the treaty. This vessel may be retained, and its tonnage is not taken into account in determining the tonnage subject to limitation. If , however, it is desired later on of the TJnited States of America, who exto replace this vessel, then the tonnage necessary for that purpose will be charged agaiust the tonnage of the nearest appropriate combatant category. For the purposes of negotiation with the other Powers, it was agreed between the dominions and the British Government that the navies of the British Commonwealth should be taken as one unit. The domestic questions of the distribution amongst the various dominions of the total tonnage allotted to the British Commonwealth under the treaty, and the consequent allotment of responsibility for the maintenance and replacement of vessels, remain to be determined. It was agreed that these matters could be more appropriately discussed at an imperial gathering, and undoubtedly they will be brought under notice by the British Government at the forthcoming Imperial Conference. Other nations have nothing to do with other naval men who may have earned arrangements regarding the disposition marvellous reputations, but may toof the British Navy among the component day be somewhat out of touch with parts of the Empire. We have four modern movements. cruisers, an aircraft carrier, a sloop, some particularly well served by this treaty, destroyers, submarines, and minor craft, inasmuch as it ends, until 1935 at least, with which other nations have nothing all competition in all classes of naval whatever to do. Of this treaty, it can be said that so -Great Britain, the United States of far as Australia is concerned, it does proAmerica, and Japan-whic h are also the vide for a fleet strength which the expert three great Pacific powers. This is a advisers of the British Admiralty were fact which I do not think can be too prepared to accept as sufficient to ensure strongly emphasized. the safety of our lines of communication in the present international situation. If it had been proposed to extend the League Covenant were ignored by the term to ten years, I doubt whether the makers of the treaty? British experts would have sanctioned the arrangement. However, unless amended Nations has not yet finished with the Mr Fen ton. in the meantime, the present agreement remains in force for a period of five years, when circumstances may be reviewed, and the strength of the various fleets estimated, so that we shall know just what to do. plain the moderate enthusiasm with which the treaty was received throughout the world? the fullest knowledge of what took place at the conference, the general opinion is that it has achieved much good. I had a conversation with the President, pressed himself as satisfied that the conference had done splendid work. I also spoke to ex-admirals of the British Navy, who gave every credit to the Naval Conference for having taken a distinct step towards the reduction of naval armaments. ter knows what Admirals Beatty and Jcllicoe said. be a naval expert; I can go only upon what is said by those who are in a position to know. When men of the standing of Sir Charles Madden, First Sea Lord, and Sir William Fisher, who probably stands next to him in knowledge of modern naval requirements, say that they are prepared to vouch for the safety of trade routes under tbe present agreement, I am prepared to accept their word, even in preference to that of Australia, too, is construction between the oceanic powers explain why the Kellogg Pact aud the",26,Approval Of Treaty
47,Mr Morgan,Will the Minister ex,27,Approval Of Treaty
48,Mr Fenton,Among those with,27,Approval Of Treaty
49,Mr Archdale Parkhill,The Minis,27,Approval Of Treaty
50,Mr Fenton,I do not profess to,27,Approval Of Treaty
51,Mr Moroan,Will the Minister,27,Approval Of Treaty
52,Mr Fenton,"The League ofmatter. might say, was the best part of it, because of the good feeling that was created. As a matter of fact, the conference was not ended, but only adjourned for the purpose of allowing France and Italy to conduct negotiations in an endeavour to come to a satisfactory arrangement. The three oceanic powers, Britain, the United States of America, and Japan, will confer with France and Italy at the League meeting at Geneva, and discussions will be re-opened. each other's throats again. notice of everything one reads. The following table compares the naval strength of the three principal powers as they were in 1914 and 1929, and as they will be as a result of this treaty:1914. 1029. Tons. British Empire. Battleships Cruisers Aircraft Carrier! Destroyers Torpedo Boats 17,906 Submarines 2,160,326 1,201,930 Japan. Jlattleshlps Cruisers Aircraft Carriers Destroyers Torpedo Boats Submarines 3,539 2,364 522,082 United States of America. Jlattleshlps Cruisers Aircraft Carriers Destroyers 35,099 307,155 Torpedo Boats Submarines 348,403 1,095,992 The honourable member for Darling Downs( Mr Morgan) asked me just now how I accounted for the very modest enthusiasm with which the treaty has been received by the peoples of the world. to frame any such treaty that would excite more than moderate enthusiasm among the peoples of the world? not. General Dawes, the American Ambassador to London, stated when he returned to his own country that opposition to the treaty had developed in each of the signatory countries. Certain persons in Japan opposed it, saying that it was inimical to the best interests of Japan. Similarly, it was opposed by certain sections in Great Britain, and by others in the United States of America. States of America seems perfectly satisfied with it now. Senate vote on the treaty I should say that they are. Generally speaking, I think the people of Great Britain are also satisfied with the treaty. Lord Derby, speaking at New York some weeks ago, saidI am opposed to the party ut present in power in Great Britain; but I say it would have been a calamity if no decision had been August, December, 1936. arrived at. Great Britain must protect her trade routes, for one week without outside food supplies would reduce us to starvation. Tons. Tons. So you will see that the Navy is everything to us. But I believe the best arrangement, in 1,200,535 556,350 428,750 all the circumstances, has been arrived at, 770,750 327,111 839,000 and I will support the treaty. 115,350 135,000 144,753 157,585 150,000 He is a broad-minded and tolerant man, 26,382 45,534 52,700 and on this occasion I believe he ex1,105,450 pressed the opinion of the great majority of the people of Great Britain. General 260,480 301,320 273,820 Dawes puts the matter in this way: The 235,365 232,855 208,850 opponents of the treaty in Japan claim 61,270 81,000 20,334 110,395 1.05,500 that Great Britain and the United States 66,068 62,700 get the advantage; the opponents of the treaty in Great Britain claim that the 771,908 721,870 United States and Japan get the advantage ; and the opponents of the treaty in the United States of America claim that 529,796 525,850 456,200 272,244 106,001 323,500 Great Britain and Japan get the advan76,286 135,000 150,000 tage. The average man will draw the 3,223 proper conclusion, as did the Naval Con8,041 80,700 52,700 ferencey-that instead of any one of the 1,117,400 nations getting the advantage, the treaty represents a common sense settlement fair to all. I regard that as a very true summing up of the position. When the report is circulated, honourable members will know in more detail what was done at the conference. A full discussion will take place on the second reading of the bill. I am proud that, as the representative of Australia, I was able, on its behalf, to affix my signature",27,Approval Of Treaty
53,Mr Morgan,Franc e ancl Italy are at,28,Tonnage By Categories Of The Fleets Of The True Principal Powers
54,Mr Fenton,On e cannot take,28,Tonnage By Categories Of The Fleets Of The True Principal Powers
55,Mr Maxwell,Would it be possible,28,Tonnage By Categories Of The Fleets Of The True Principal Powers
56,"The End Of The Conference, I Mr Fenton",Probably it would,28,Tonnage By Categories Of The Fleets Of The True Principal Powers
57,Mr Abchdale Pabkhill,The United,28,Tonnage By Categories Of The Fleets Of The True Principal Powers
58,Mr Fenton,"Judging by theto a three-power treaty. prefer that it had been a five-power treaty. Every endeavour was made to obtain such a treaty, but the claims of certain nationalities were of such a character that we could not agree to them, and on those points they for the time being were excluded. I may mention, however, that this treaty was signed by the five powers in regard to certain points. An important point gained is that there will be a holiday in battleship construction until 1936. In 1935, another uaval conference of the various nations will be held. The whole situation will then be reviewed again, and I hope that still further reduction will be agreed to. The reduction in battleship construction and of construction in certain other lines will represent a saving of between £52,000,000 and £70,000,000 to Great Britain during the next five years. President Hoover has estimated that the total saving to the people concerned in the next five or six years will be something like £500,000,000. Surely that must be a wonderful relief to the overburdened taxpayers who would have been called upon to contribute immense sums for this naval construction. The treaty that has been signed by the British Commonwealth of Nations, the TJnited States of America, and Japan, was signed on behalf of 650,000,000 people; and there are favourably affected by that signing, over 1,000,000,000 people. The signing of the Five-Power Pact affects two-thirds of the people of the world. Surely, then, the conference was worthwhile! I believe that the world is hungry for peace. It may be asked, what can the mere handful of 6,500,000 people in Australia do in regard to the peace of the world? There might have been some justification for that question before the great war; but records speak foT themselves, and having contributed what we did on that occasion, surely we can do something to bring about peace! We ought to do all that lies within our power in that direction. We should not only think, but pray for peace. A great deal yet. remains to be done. The world was left broken by the last war; and it is still suffering, and will continue to suffer for many years, from the cumulative effects of it . ifr. Fenton. I would BeforeI left Australia. I had given to me figures that showed that war and the preparations for war by the principal nations of the world between 1905 and 1925 involved an expenditure of no less a sum than £61,000,000,000. During the war 20,000,000 men were under arms, and I believe that it is safe to say that 10,000,000 were killed, wounded, died, or were otherwise seriously affected in some way. I hold the view that all war is hell, the last to a greater extent than any that preceded it. If one can believe what one reads, and what one hears from those who ought to know, if there is to be another world war-and God forbid that there should be-it will be 1,000 times more hell than the last. With that fact staring us in the face, can any intelligent man or woman view with equanimity the possibility of another world war? All our efforts, therefore, should be directed towards ensuring the peace of the world. This conference may not have achieved a great deal; it certainly did not come up to my expectations, or the expectations of those who desired a much bigger reduction of armaments; but a step in the right direction has been taken. My prayer and my trust is, that further steps will be taken towards that end, until the peoples of the world arrive at the conclusion that, from whatever aspect it is considered, war is nothing more or less than harmful and wasteful. If we wish our civilization to disappear, we have only to look for another war. I believe that the public conscience has been developed, and that if it is stirred a little more the people of the world will decide, not in favour of, but against war. I had one of my most impressive experiences overseas when four women, representing Britain, the TJnited States of America, France, and Japan, presented to the conference petitions containing millions of signatures of the women of their respective countries. Those women delivered magnificent speeches. I believe that they not only spoke from their own hearts, but also interpreted the feelings of the women of the world. I hope the day will soon come when in this and every other country the people will have their backs to the black night of war, and their face? turned to the bright morning of a lasting world's peace. They will then be able to sing with heart and voiceKing out the thousand wars of old, Ring in a thousand years of peace. adjourned. In committee (Consideration resumed from 29th July, vide page 4886): Postponed clause 6Section (sixteen of the principal act is amended(a) by omitting from paragraph (6) all the words'commencing with the words "" ( b ) in the case of a member"" and ending with the words "" profits of the company: "" and inserting in their stead the words"" ( b ) in the case of a member, shareholder, depositor or debentureholder of a company( i ) dividends, bonuses or profits (but not including a reversionary bonus issued on a policy of life insurance) credited, paid or distributed by the eompany (whether a resident or an absentee)' ( 2 . ) '. . . ' Provided that, where the company distributes, to a member or shareholder who is a resident, any income upon which it is exempt from income tax under paragraph (q) of sub-section (1.) of section fourteen of this act as dividends, bonuses, among its members or shareholders, the income so distributed shall not be assessable income of the member or shareholder; "" ; (/) by omitting paragraph (d) and inserting in its stead the following paragraph :"" ( d ) money derived by way of royalty or bonuses, and any amount received by way of premium, fine or foregift or consideration: "" Provided further that this paragraph shall not apply to( i i i ) any lease from the Commonwealth or a State being a perpetual lease without revaluation or a lease with a right of purchase;""; . . Section proposed to be amended16. The assessable income of any person shall include(h) in the case of any person who sells or otherwise disposes of to another person '(otherwise than by way of testwmeiitary disposition) (a) either as a whole or in separate parts, the whole of the assets of a business carried on by him, for . . . Provided that the assessable income of the person who has so sold or disposed of assets for the purpose of putting an end to the whole of a business. carried on by him, or in consequence of the acquisition or resumption of land, used by him for a business carried on by him, under the provisions of any law of the Commonwealth or a State which contains provision for the compulsory acquisition or resumption of land, shall not include any amount in respect of any Hoe stock, included in the assets so sold or disposed of which, in the opinion of the Commissioner or a. Deputy Commissioner, were ordinarily used by that person for breeding purposes except that, when such live stock includes sheep in the wool, there shall be included in the assessable income of that person the amount which, by applying the provisions of sub-sections (2.) and (3..) of section seventeen of this act, is found or determined as the price or value of the wool as distinct or profits from the sheep. and Treasurer) [4.30] I movethe words "" or would, if it were a resident, be : exempt"", be inserted. That after the word ""exempt"", in the proviso to sub-paragraph b (i) 2, paragraph a, The amendment is intended to preserve to residents of Australia who are shareholders in absentee companies the existing exemption from tax enjoyed by them on dividends paid to them out of extraAustralian income of the company; subject, however, to the limitation that the income distributed in dividends has been liable to income tax outside Australia, or that the goods from the sale of which the income was derived were subject in the country of their production to an export duty or royalty charge. The present",28,Tonnage By Categories Of The Fleets Of The True Principal Powers
59,Debate (On Motion By Mr Latham),,30,Income Tax Assessment Bill
60,Mr Scullin (Yarra,"Prime Ministerform of the bill in this connection grants the exemption described to a resident of Australia who is a shareholder in a company which is resident in Australia within the meaning of that term as expressed in. the bill, but it does not exempt a resident who is a shareholder in an absentee company. It is uot intended to discriminate between those two classes of resident shareholders. amendment will remove the discrimination. Amendment agreed to. [Quorum formed.] and Treasurer) [4.33] I moveTbat alter the word "" act"" in the proviso to sub-paragraph b (i) 2, paragraph </, the words "" or any income derived from sources outside Australia prior to the 1st July, 1920,"" be inserted. The intention of this provision is that the new liability to tax on dividends shall relate for the first time to income of the kind described, which is derived by a company on and after the 1st July, 1929, and distributed in dividends. It is not intended that dividends paid out of extraAustralian income which has been derived by the company prior to the 1st July, 1929, shall be taxable, notwithstanding that it may be distributed after that date. This intention, however, has not been fully expressed in the bill, and the amendment is designed to make the position clear. Amendment agreed to. observe ""that, by paragraph /, this clause introduces a provision for the taxation as income of the consideration received for the assignment or transfer of a lease, or for goodwill, or a licence in respect of a business carried on on the leased property, or for surrendering a lease, goodwill, or licence. I can understand the object that is sought to be attained. I am familiar with the methods that have been adopted in connection with the transfer of certain properties, to diminish the amount payable as rent by assigning an amount to goodwill or a licence. One can also understand the theory which underlies the idea that the payment of consideration for the transfer or assignment of a lease shall be regarded as income. There is some doubt as to whether such receipts are income or capital. Section 55 of the Constitution prevents more than one tax being included in a bill. I assume that the Government has examined this point, and is satisfied that there is no risk of this legislation being declared invalid. When an effort was made to deal with this matter in 1924 the Government proposed to introduce special legislation to tax these The proposed particular receipts. ter and Treasurer) [4.37] I assure the Leader of the Opposition that the Commissioner of Taxation has been in consultation with the Crown Law Department in regard to this clause, and they artsatisfied that these receipts are commuted rent and not an accretion of capital. I move That thu following words be added to subparagraph (iii), paragraph /-""o r for grazing or agricultural purposes."" This paragraph is to ensure that tax is paid on the profit made from the sale of an hotel lease, but I do not think it should apply to Crown lands held under lease and used for the purpose of primary production. I am, therefore, asking that the qualification already contained in the act be extended, in view of the necessity for stimulating export and inducing men to take up these waste areas, many of which would not be held if there were not some stimulus above the ordinary opportunities for profit. and Treasurer) [4.42] -The purpose of this clause is to remove an anomaly that arose through the action of another place some years ago. The profit on the sale of a lease is spread over the terms of the lease, and is allowed as a deduction ""irrespective of the purpose for which the lease is used. ""We cannot give the concession both ways. The right honourable member for Cowper (Dr. Earle Page) would grant it to the seller of the lease but not to the purchaser, but my opinion is that the purchaser should be encouraged. leases without a right of purchase. were accepted, another amendment would be necessary in Clause 12. I cannot accept itAmendment negatived.",30,Income Tax Assessment Bill
61,Mr Sctjlliir (Yarra,Prime Minister,31,Income Tax Assessment Bill
62,Mr Latham (Kooyong) [4.34],I,31,Income Tax Assessment Bill
63,Mr Scullin (Yarra,Prime Minis,31,Income Tax Assessment Bill
64,Dr. Eaele Page (Cowper) [4.39],,31,Income Tax Assessment Bill
65,Mr Scullin (Yarra,Prime Ministei,31,Income Tax Assessment Bill
66,Dr. Earle Page,I am referring to,31,Income Tax Assessment Bill
67,Mr Scullin,"If this amendmentI move That after paragraph h the following paragraph be inserted:"" Aa by inserting in the first proviso to paragraph (ft) after 'land,' second occurring, tlie words or by reason of ; drought, fire, flood, or other adverse conditions over which he had no control' "". When capital invested in an undertaking is realized, the proceeds are regarded as capital. I desire to provide for other contingencies to which the man on the land is subject. For instance, when on account of drought he is compelled to reduce bis flocks, the sale should be regarded as A realization of capital and the proceeds should not be taken into account as income. It might so happen that in the compulsory realization of his sheep the pastoralist was fortunate enough to get more for them than he actually paid, but as he has been obliged to reduce the capital which produces bis income be should uot be required to pay income tax on that profit. In one case which came to my notice a pastoralist who was forced to realize his capital through drought would have had to pay income tax on £3,500. tions "" is a very general phrase. use in the act in connection with the provisions for appeal to a relief board. and Treasurer) [4.50] I understand that the right honourable member's amendment, if carried, would exempt from taxation the sale of stock if it were forced upon the taxpayer by drought or other adverse conditions, but what would happen when the taxpayer replenished his stock ? If he be exempt from taxation when he is selling his stock, be must be exempt from deductions when he is replenishing his stock. If the replacement were at a higher value thau the forced sale, the amendment would penalize the taxpayer. be forced to go out of business. being wound up, it would be treated 1 accordingly. not, at the time, expect to go out of business. exceptional case. The amendment, if [174] carried, would penalize the majority of the taxpayers who were forced to sell thei r stock in time of drought and to replenish later at a higher value. The right honourable member for Cowper (Dr. Earle Page) has moved an amendment to meet an exceptional case. The majority of stock-owners do not treat their stock as capital, but there are odd people who do. They do not treat their stock as stock-in-trade. They treat as capital the value of their land, plus stock sufficient to stock the property. position may, because of drought, be forced to sell 50 per cent, of his stock. In that case, he would treat the sale, not. as a sale for the purpose of obtaining profits, but as a realization of capital. That is the point which the right honourable member for Cowper has taken. I cannot conceive of forced sales so increasing the taxpayers' credit as to cause him to show a profit. I have been informed that such cases exist. forced to sell, and showed a loss, he would be allowed a deduction. carried, it will not cause any loss to the department. hardly ou other stock-owners ? majority of them do not treat their stock as capital. The amendment, if carried, would do no harm to the Commonwealth, nor would it be of much use. support the amendment of the right honourable member for Cowper (Dr. Earle Page), fully realizing the force of what the Prime Minister( Mr Scullin) has said. A taxpayer who treats breeding taxpayer may stock as capital may be forced to sell because of drought. If he is exempt from taxation on that account, then, when he replenishes his stock, he must be exempt from deductions. The taxpayer has made his choice as to what metbod he will employ in preparing his returns. He has done that with his eyes open. He must realize that on some transactions he may gain an advantage, and on others be",31,Income Tax Assessment Bill
68,Dr. Eaele Page (Cowper) [4.45].,,32,Income Tax Assessment Bill
69,Mr Mctiernan,""" Adverse condi",32,Income Tax Assessment Bill
70,Dr. Eaele Page,It is already in,32,Income Tax Assessment Bill
71,Mr Scullin (Yarra,Prime Minister,32,Income Tax Assessment Bill
72,Dr. Eable Page,The,32,Income Tax Assessment Bill
73,Mr Scullin,If his business were,32,Income Tax Assessment Bill
74,Dr. Eable Page,The taxpayer may,32,Income Tax Assessment Bill
75,Mr Scullin,That is rather an,32,Income Tax Assessment Bill
76,Mr Huntee (Maranoa) [4.52],,32,Income Tax Assessment Bill
77,Mr Scullin,That is breeding stock.,32,Income Tax Assessment Bill
78,Mr Huntee,Yes. A man in that,32,Income Tax Assessment Bill
