speakerGroups,speaker,theText,pageNumbers,title
192,Mr Latham,"He is liable for theproceed against one of these individuals justify the giving of this power. They instead of against the public officer of readthe company. The provision in the bill is as follows:Notwithstanding anything contained iu this section, and without in any way limiting, altering or transferring the liability of the public oflicer of a company, every notice, procution. What is needed is a power to select i-eis or proceeding which under this act or the regulations thereunder may be given to. -served upon, or taken against the company or its public officer may, if the Commissioner thinks fit, :be given to, served upon, or taken against any director, secretary, or other offithe Commissioner, he is the real offender, cer of the company or any attorney or agent of the company. The amendment that is now proposed is that the director, secretary, officer, attorney, or agent shall have the same liability as the company or the public officer would have had if proceedings had been taken against the company or the public officer. I suggest that it is going too far to give to any officer of the Commonwealth the right to say that "" A , the public officer, is liable, and B, the company is liable; but I think fit to proceed against C,a director, D, the secretary, E, an officer, or F, an agent of the company; and any one of those whom I select shall have the same liability as the company or the public officer."" Nothing has been said to show that it is necessary to have legislation of this extraordinary character. and Treasurer) [8.43] -The latter part of the argument of the Leader of the Opposition, would have a great deal of force if we were to assume that we had a Commissioner who would exercise this power in an arbitrary, an unjust, and a stupid manner. great deal to the aiscretion of the Commissioner; and if in the exercise of his discretion he were to act so foolishly as to pass over the real offender and serve notice upon a director who had not offended, the only remedy would be to appoint a new commissioner. posal is put forward, not because there is a difficulty in finding the right person, but with the object of getting at the right person. of straw might be put up? prepared notes of the department, to power? greater than . are conferred by It was noticed in the Abrahams 'brothers' case that the public officer of the private companies formed by these persons was the secretary to the main eompany formed by these people. That public oflicer is a man of straw, and no good result would have followed his proseune of the real owners, or the principal executive oflicer of the companj . . . . why not ? made liable for an offence with which he was not connected? to get at the real offender and not merely at the man of straw. real offender. doing; if the honourable gentleman can suggest a better way I shall be glad of his assistance. This provision has been closely scrutinized by the Taxation Commissioner and the Attorney-General'? Department. trying to find a substitute for the real offender? get at the real offender and not the substitute. of such a company as this clause contemplates deserve to be held liable ? a company must take his share of responsibility; if he finds himself in an awkWe have to leave a ward position, he will have only himself to blame. company too? sioner thinks fit. This proman does wrong, aud, if the Commissioner thinks fit, he can fine any officer of the company. Opposition is stretching the meaning of the clause. Such special pleading might deceive this committee. Parliament has",47,Income Tax Assessment Bill
193,Mr Scullin (Yarra,Prime Minister,48,Income Tax Assessment Bill
194,Mr Hughes,"I s it thought that a man be effective elsewhere, but it will noi",48,Income Tax Assessment Bill
195,Mr Scullin,I quote from the well given to the Commissioner of Taxation,48,Income Tax Assessment Bill
196,Mr Latham,O r a director.,48,Income Tax Assessment Bill
197,Mr Scullin,"If, in the opinion of",48,Income Tax Assessment Bill
198,Mr Latham,Why should a man be,48,Income Tax Assessment Bill
199,Mr Scullin,We must have power,48,Income Tax Assessment Bill
200,Mr Latham,Then provide for the,48,Income Tax Assessment Bill
201,Mr Scullin,That is what we are,48,Income Tax Assessment Bill
202,Mr Paterson,I s not the Treasurer,48,Income Tax Assessment Bill
203,Mr Scullin,No; we are trying to,48,Income Tax Assessment Bill
204,Mr Mctiernan,Does not the director,48,Income Tax Assessment Bill
205,Mr Scullin,The director of such,48,Income Tax Assessment Bill
206,Mr Latham,And any officer of the,48,Income Tax Assessment Bill
207,Mr Scullin,"Yes, if the Commis",48,Income Tax Assessment Bill
208,Mr Latham,It is an outrage. One,48,Income Tax Assessment Bill
209,Mr Scullin,"The Leader of thelegislation on any other public servant. Members have deplored the necessity for giving such power to any one person, but I am not aware that it has ever been misused or abused. has. not always unbiased. When the princir-ls skulk in the background and put up a man of straw to take the brunt of the prosecution, the Commissioner must have power to charge any officer or direcfurther than is intended. How are we tor of the company. to select an innocent man; he will choose the one whom he believes to be the real culprit. Every offender is already provided for. A company, a public officer, or any other officer or servant of the company who is guilty of a breach of the law, or any person who aids or abets the commission of an offence may be prosecuted. The only effect of the new provision is to enable the Commissioner to select somebody who otherwise would not bear any liability, and obtain against him penalties that would not be obtainable against him apart from this provision The provision is absolutely unjust. the Commissioner to prove the guilt of the person charged. company or the public officer, and if he proves that either is guilty, a penalty can be imposed on any other officer or director whom he selects. feel somewhat embarrassed. Two former Attorney-Generals of the Commonwealth, a former Attorney-General for New South Wales, and the honourable member for Corangamite ( Mr Crouch), who also is a lawyer, disagree as to the meaning of the provision now before the committee. When lawyers differ, how is a layman to decide? Apparently, I have no alternative but to vote with the Government, and let it bear the responsibility. The Leader of the Opposition has stated that if the company is found guilty the Commissioner may exact penalties against an innocent man, who may have had no association with the offence. If that interpretation can be sustained, the Government is taking a serious responsibility. The Prime Minister said that the Abrahams brothers put forward a man of straw. That practice is not new; unscrupulous companies that are sailing close io the wind resort to that expedient, for obvious reasons. To enable the Commissioner to catch the man who, he thinks, is really liable, whether technically or not, this amendment is proposed ; but, apparently, it goes very much He is not likely to safeguard the innocent? We may assume that the Commissioner will exercise his tremendous power justly, and with the utmost care, but it seems to me that a great wrong may be done, for which there will be no remedy. The provision might be improved by compelling the Commissioner to establish a connection between the offence and the person charged. The Leader of the Opposition ( Mr Latham) has pointed out that the Commissioner may, in the unwarrantable exercise of his discretion and in the absence of any evidence connecting an officer or director with an offence, saddle him with liability. Will the Prime Minister say whether that is intended or is possible? and Treasurer) [8.59] -It is for the court to decide whether an officer whom the Commissioner believes to be guilty is or is not guilty. mean that if the company is guilty an officer of it may be punishable although he is innocent? , the Commissioner power to take proceedings against an oflicer or director. His guilt or innocence will be determined at his trial. I shall read the proviso to the honourable member, because tbe impression has been caused that the Commissioner can pronounce any person guilty. has been guilty. Notwithstanding anything contained in this section, and without in any way limiting, altering or transferring the liability of the public officer of a company, every notice, process or",48,Income Tax Assessment Bill
210,Mr Bell,Many taxpayers think it,49,Income Tax Assessment Bill
211,Mr Scullin,Thei r judgment is,49,Income Tax Assessment Bill
212,Mr Latham (Kooyong) [8.49],,49,Income Tax Assessment Bill
213,Mr Maxwell,The onus would lie on,49,Income Tax Assessment Bill
214,Mr Latham,As against either the,49,Income Tax Assessment Bill
215,Mr West (East Sydney) [8.52],I,49,Income Tax Assessment Bill
216,Mr Hughes (North Sydney) [8.54].,,49,Income Tax Assessment Bill
217,Mr Maxwell (Fawkner) [8.58],,49,Income Tax Assessment Bill
218,Mr Scullin (Yarra,Prime Minister,49,Income Tax Assessment Bill
219,Mr Hughes,But does not the clause,49,Income Tax Assessment Bill
220,Mr Scullin,The clause only gives,49,Income Tax Assessment Bill
221,Mr Latham,"Yes, if some one else",49,Income Tax Assessment Bill
222,Mr Scullin,"The proviso readsproceeding which under this act or the regulation thereunder may be given to, served upon or taken against the company or its public officer may, if the Commissioner thinks fit, be given to, served upon or taken against any director, secretary, or other officer of the company or any attorney or agent of the company. bility of the company on the person whom the Commissioner chooses to serve notice upon. Will the Prime Minister read the amendment ? honourable member for Fawkner is satisfied. He was misled by the Leader of the Opposition ( Mr Latham) into believing that the Commissioner has power to find a person guilty. This is the addition proposed by the amendmentAnd that a director, secretary, officer, attorney, or agent shall have the same liability in respect of that notice, process or proceeding as the company or public officer would have had if it had been given to, served upon, or taken against the company or its public officer. There is no liability on the part of a person upon whom notice is served beyond the liability to proceedings being taken against him. The honourable member for Fawkner clearly understands that. proceedings. ter is now saying is entirely different from what he said previously. He said that the object of this provision was to place tbe liability upon one who was not a man of straw. proceedings against the actual offender. ing been taken officially, the charge has then to bo proved against the person concerned. ""public officer"" under the law is liable. That officer, in a fraudulent company, is usually a dummy. We can proceed against the dummy, aud gaol him, but we cannot deal with the real offender in the ""background. proved against the person selected by the Commissioner. the whole purpose of this provision. Quesiton-That the words proposed to so added-put . The committee divided. ( THE CHAIRMAN-MB . McGBATH.) Ayes -. .. 40 Noes -.. 25 Majority 15 AYES. Anstey, F. Lacey, A. W. Beasley, J. A. Lazzarini, H . P. Blakeley, A . Lewis, A. Chifley, J. B. Long, W. J. Crouch, R. A. Lyons, J. A. Culley, C. E. Maloney, Dr. Cunningham, L . I Martens, G. W. Curtin, J. McNeill, J. Cusack, J. J. McTiernan, E. A. Eldridge, J. C. Moloney, Parker Fenton, J. E. Riley, E. Forde, F. M . Riordan, D. Frost, C. W. Rowe. A. E. Gabb. J. M . Scullin, J. H . Gibbons, G. A. Tully, J. T. Green. A. West, J. E. Guy, J. A. Yates, G. E. Holloway, E. J. James, R. Tellers: Jones, P. Price, J. L . Keane, R. V. Riley, C. NOES. Bell, G. J. Marks, W. M. Cameron, D. Maxwell, G. A. .Cameron, M. Morgan, A. C. Corser, Bernard Nairn, W. M . Francis, J. Page, Dr. Earle Gardner, S. L. Paterson, T. Gregory, H . Prowse, J. H. Gullett, H . S. Stewart, P. G. Hawker, C. A. 8. Thompson, V. C. H ill , W. C. White, T. W. Hughes, W. M . Tellers: Latham, J. G. Bayley, J. G. Mackay. G. H . Hunter. J. A. J. PAIR. Watkins. D. | Killen, W. W. Question so resolved in the affirmative. Amendment agreed to. Clause, as amended, agreed to. Postponed clause 24 (Application of act). ter and Treasurer) [9.9] I move That after sub-clause 2 the following new sub-clauses be inserted"" ( 2 A . ) The second proviso inserted by paragraph (c) of section eight of this act in subsection ( IA . ) of section twenty of the Principal Act shall apply to assessments for the financial year beginning on the first day of July One thousand nine hundred and twenty-five and all subsequent years. (2B.) The amendment effected by paragraph (n) of section eleven of this act shall be deemed to have commenced on the date of the commencement of the Income Tax Assessment Act 1928."".",49,Income Tax Assessment Bill
223,Mr Maxwell,I am satisfied.,50,Income Tax Assessment Bill
224,Mr Latham,That imposes the lia,50,Income Tax Assessment Bill
225,Mr Scullin,I am glad that the,50,Income Tax Assessment Bill
226,' Mr Maxwell,That is so.,50,Income Tax Assessment Bill
227,Mr Latham,That is in respect of the,50,Income Tax Assessment Bill
228,Mr Scullin,Yes.,50,Income Tax Assessment Bill
229,Mr Latham,What the Prime Minis,50,Income Tax Assessment Bill
230,Mr Scullin,The object is to take,50,Income Tax Assessment Bill
231,Mr Maxwell,The proceedings hav,50,Income Tax Assessment Bill
232,Mr Scullin,The point is that the,50,Income Tax Assessment Bill
233,Mr Maxwell,The charge must be,50,Income Tax Assessment Bill
234,Mr Latham,That is not so.,50,Income Tax Assessment Bill
235,Mr Scullin,"It is so, and that is",50,Income Tax Assessment Bill
236,Be Added ( Mr Scullin's Amendment) Be,,50,Income Tax Assessment Bill
237,Mr Scullin (Yarra,"Prime MinisThe purpose of this amendment is to do an act of justice to co-operative societies. Previously provision was made that cooperative societies should have certain exemptions from income taxation, but it was found that the wording of the section did not fulfil the intention of Parliament. A co-operative society in South Australia carrying on the business of selling to some of its shareholders and buying from others of its shareholders does not, according to the wording of the section, share in the exemption, although it was the clear intention of Pailiament that it should do so. The clause as it stands amends the section to apply to a co-operative society of that, description. But the amendment that I am now moving will give this section' a retrospective effect. This involves a refund of £2,500. This Government, as was the previous Government, is prepared, where it is found that the intention of the act is clear, to patch up the flaw in its provisions and to make them retrospective even to the extent of depleting Commonwealth revenue. It is a poor law that will not operate both ways. In this case justice is being done to at least one co-operative company. £2,500 be refunded to one co-operative society ? I commend the action of the Government in regard to this retrospective concession. The previous Government approved of exemptions in the case of co-operative societies. At the same time. I protest against the retrospective application of the first part of clause 24. I consider that to be uncalled for and unnecessary. should like to ask the Prime Minister why new sub-clause 2B should be retrospective only to the commencement of the Income Tax Assessment Act 192S. Is that on account of tbe original provision having been introduced then? the operation of the provision. of making these particular concessions retrospective; but I think that a distincact is repealed and the following section tion should be drawn between such legisinsertedS3 in (1.)its stead:lation as this and any legislation which attempts to impose a retrospective liability. Por that reason these new subclauses are to be distinguished from other sub-clauses appearing in the original clause. I am opposed to some of those provisions, for reasons that I have already given. I have been informed by a genuine trading co-operative society in South Australia that it has been unable to take advantage of the exemptions provided in the act, because seven-twenty-fifths of its business is done with non-members. Will this amendment meet such a case? and Treasurer) [9.16] -This amendment does not deal with that aspect of the question. Amendment agreed to. Clause, as amended, agreed to. and Treasurer) [9.17] I move That the following new clause be inserted:"" 12A. Section twenty-five A of the principal act is repealed and the following section inserted in its stead:25A. Where, in respect of property of any person from the use or ownership of whicli assessable income may be derived, any expenditure is incurred by that person im connection with the acquisition or use of that property and a deduction in respect of that expenditure has been allowed or is allowable under any other provision of this act, and the whole or any part of the proceeds of the sale of that property is assessable as income of that person, no deduction shall be allowed from the proceeds so assessable in respect of the expenditure so allowed or allowable. "" The object of this amendment is to prevent double deductions being made, principally by land-dealers. It has been brought under the notice of the department since the introduction of this bill, that certain land-dealers are, in particular cases, able to make deductions in respect of wire and wire netting used in the construction of fences, and that they are also able to make another deduction in respect of the same transaction. This amendment, will prevent that being done. Proposed new clause agreed to. toI admit the justice That the following new clauses be inserted:"" 22A. Section eighty-three of the principal In any taxation prosecution the averment of the prosecutor or plaintiff",50,Income Tax Assessment Bill
238,Mr Stewabt,Will the whole of that,51,Income Tax Assessment Bill
239,Mr Scullin,I think so. .,51,Income Tax Assessment Bill
240,Dr. Earle Page (Cowper) [9.12],,51,Income Tax Assessment Bill
241,Mr Latham (Kooyong) [9.13],I,51,Income Tax Assessment Bill
242,Mr Scullin,That is the date of,51,Income Tax Assessment Bill
243,Mr Latham,,51,Income Tax Assessment Bill
244,Mr M. Cameron (Barker) [9.15],,51,Income Tax Assessment Bill
245,Mr Scullin (Yarra,Prime Minister,51,Income Tax Assessment Bill
246,Mr Scullin (Yarra,Prime Minister,51,Income Tax Assessment Bill
247,Amendments (By Mr Scullin) Agreed,"contained in tlte information, complaint, declaration or claim shall be prima facie evidence of the matter or matters averred. (2.) This section shall apply to any matter so averred although(a) evidence in support or rebuttal of the matter averred or of any other matter is given by witnesses ; or (6) the matter averred is a mixed question of law and fact, but in that case the averment shall be prima facie evidence of the fact only. (3.) Any evidence given by witnesses in support or rebuttal of a matter BO averred shall be considered on its merits and the credibility and probative value of such evidence shall be neither increased nor diminished by reason of this section. (4.) The foregoing provisions of this section shall not apply to(a) an averment of the intent of the defendant; or (i>) proceedings for an indictable offence or an offence directly punishable by imprisonment. (5.) This section shall not lessen or affect any onus of proof otherwise falling on the defendant.'"" "" 22B. Section eighty-five of the principal act is amended by omitting from paragraph (c) the word 'justice' and inserting in its stead the word ' distress'."" Title agreed to. Bill reported with amendments and report-by leave-adopted . Bill-by leave-rea d a third time. In Committee of Supply: Consideration resumed from 2Sth July (vide page 4807;Balance of proposed vote, £16,560, agreed to. Proposed votes-Departmen t of Trade and Customs, £9,715; Department of Health,' £10,000; and Territories of the Commonwealth, £92,805, agreed to. ResolvedThat there be granted to His Majesty to the service of the year 1930-31 for the purposes of additions, new works, buildings, &c, a sum not exceeding £130,570. Besolution reported. Standing Orders suspended and resolution adopted. Besolution of ""Ways and Means covering Resolution of Supply reported and tration; migration will be dealt with adopted. ^OrderedThat Mr Scullin and Mr Fenton do prepare and bring in a bill to carry out the foregoing resolution. passed through all its stages without amendment or debate. THE PARLIAMENT. In Committee of Supply: Proposed vote, £77,620, postponed. Proposed vote, £314,500. increased expenditure under this item is £36,000. Although £22,000 of this increase is accounted for by the fact that the activities of the Development and Migration Commission have been taken over by the Prime Minister's Department, there still remains an increase of between. £2,000 and £3,000 concerning which I sbould be glad to have an explanation from the Prime Minister. and Treasurer) [9.31] -The expenditure for 1929-30 was £5S,426; the estimate for 1930-31 is £S2,040. The extra expenditure incurred by taking over the activities of the Development and Migration Commission is £22,764, so that the net increase is about £850. Provision has been made for the activities of the Development and Migration Commission to be taken over by the Prime Minister's Department as from the 30th June, 1930. Salaries for the development branch of the Prime Minister's Department amount to £25,300. As a matter of fact, the administrative costs of my department have been reduced, apart from automatic increases to officers, cost of living allowances, and the extra expenditure incurred as a result of taking over the work of the Development ana? Migration Commission. Mi'. YATES -Does this item include immigration ? later.",51,Income Tax Assessment Bill
248,"Bill Brought Up By Mr Scullin, And",,52,Prime Minister S Department
249,Mr Gullett (Henty) [9.30],The,52,Prime Minister S Department
250,Mr Scullin (Yarra,Prime Minister,52,Prime Minister S Department
