speakerGroups,speaker,theText,pageNumbers,title
0,"That He Have Leave To Bring In A Bill For Able Fact That Though There Has Been Much An Ajct Relating To The Imposition, Assesscriticism Of Our Constitution, Very Little Ment And Collection Of A Tax Upon The Sale Value Of Goods Manufactured In Australia Of I T Has Been Directed Against Section And Sold By A Person Not Being Either The 55, Which Makes The Present Proceeding Manufacturer Or A Purchaser From The Manunecessary. The Bills Are Now Before The Facturer, And For Other Purposes. That He Have Leave To Bring In A Bill For An Act Relating To The Imposition, Assesssolidated In A Memorandum For Tbe Use Of Ment And Collection Of A Tax Upon The Sale' Houorable Members During The Debate, Value Of Certain Goods Manufactured In Ausand Also For Public Use. Tralia And Applied By The Purchaser To His Own Use, And For Other Purposes. That He Have Leave To Bring In A Bill For The Fact That Australian Finances Aro An Act Relating To The Imposition, Assessto","day suffering from a number of ills. ment and collection of a tax upon the sale The fact that there has been a tremenvalue of goods imported into Australia, and dous loss of customs revenue has been for other purposes. That he have leave to bring in a bill for an mentioned frequently. The loss of customs act relating to the imposition, assessment -revenue, which is an indirect tax, and and collection of a tax upon the sale value one which had been growing for many of goods imported into Australia and sold by years, has very seriously embarrassed the importer, and for other purposes. That he have leave to bring-in a bill for Commonwealth finances. It has, therean act relating to the imposition, assessfore, become necessary for the Government and collection of a tax upon the sale ment to look for new sources of revenue. value of goods imported into Australia and The proposed sales tax will tap a source of sold by a person other than the importer, and revenue very much akin to that exploited for other purposes. That he have leave to bring in a bill for by the customs duties.. I propose to an act relating to the imposition, assessgive a brief history of sales taxation, ment and collection of a tax upon the sale though many honourable members are value of certain goods imported into Australia, doubtlesss familiar with the subject from purchased by a taxpayer, and applied to his reading of its operation in other own use, and for other purposes. That he have leave to bring in a bill for countries. Just after the war most Euroan act relating to the imposition, assesspean countries were in a very difficult ment and collection of a tax upon the sale position-worsee than we are in Austravalue of certain goods in Australia, dealt lia or, at any rate, as bad. They were with by lease, and for other purposes. read a first time. (No. 1). and Treasurer) [3.0] I move That the bill be now read a second time. so as to carry on ordinary government I ask for your ruling, Mr Speaker, as services. to whether it is permissible to cover all adopted the sales tax more as an experithese bills in one debate. They relate ment, although it had been tried out in to one subject, and the only reason for some countries earlier. It was regarded, introducing nine bills is to meet constihowever, as an emergency measure, and tutional requirements. -As matters it is permissible for the debate services, commercial and professional. on the first bill to cover the other bills The rate was fixed in the first instance also. reflection on the Constitution that it is cent. At that time it yielded up to 36 necessary to have nine bills in order to per cent, of the total revenue ' of pass one assessment act. It is a remarkHouse, and it is hoped to have them conThere is no need for me to emphasize t unable to import goods and collect custion had almost disappeared, and the principal countries of Europe turned to and enable them to carry on. I u those conditions, when the income of the people was reduced, and the nations almost existed for maintaining national revenue The European countries the first important country to impose the tax was Germany, in 1918. That the bills relate to cognate turn-over tax, applicable to all goods and at \ per cent., and was gradually in-",17,Setup
1,"Bills Brought Up By Mr Scullin, And Toms Revenue; Revenue From Income Taxa",,17,Second Reading
2,Mr Scullin (Yarra,"Prime Minister exhausted, the paramount need still",17,Second Reading
3,Mr Speaker (Hon. Norman Makin). Country Imposed What Is Known As A,,17,Second Reading
4,Mr Scullin,"It is somewhat of a creased until, in 1924, it stood at 2£ perGermany. Other countries which followed Germany's example in 1920 were, France, Canada, and Czecho-Slovakia. The following year Belgium, Italy, Hungary, Roumania and Russia adopted the turn-over tax, and in 1923 it was adopted by Austria and Poland. In 1925, Turkey also imposed this tax. The methods employed in the various countries differed considerably in detail, but of that, the tax was increased to 3 per I do not propose to enlarge on them beyond saying that in the main they were turn-over taxes-that is, they were applicable to all transactions. In many instances they included services, commercial and professional. In others they applied to every transaction, wholesale and retail, and no matter how frequent the transactions, no matter how often parthe manufacturer sold direct to the W ticular goods were sqld, the tax was coltailer or to the wholesale merchant, and lected every time. In all countries where the tax was in operation the Government received very substantial returns from it. however, was fixed at 6 per cent. Later, The measure now before us follows very closely the system in operation in Canada, where the sales tax was first imposed in 1920. vernment that introduced it has now been cent. defeated. reduced the tax has recently been defrom it? feated. fact had anything to do with its defeat. much as £15,000,000 a year, and has proabout as relevant as the honourable memprofessor of economics at the Holyoke ber's interjection. When the sales tax University, in the United States of was introduced in Canada that country America, has examined the results of was passing through a period of general' sales taxation, and, in an article contridepression. The financial, economic and buted to a review, sayscommercial conditions were far from good. Customs revenue had fallen, and ELEVENTH income taxation yields were greatly reduced. The war times profits tax had also failed as a source of revenue. In auspices of the League of Nations was being 1920 the Government imposed a tax on carried manufacturers and wholesalers. The to manufacturers, when selling articles, paid portant taxes were falling behind, because 1 per cent, on everything they sold to the they were not adapted to existing conditions. wholesalers, aud the wholesalers paid 1 The same writer points out that this per cent, when they sold goods. That form of taxation rendered remarkable made 2 per cent., if the second sale was service to Germany during a period of made direct to the retailer or to the depreciating currency, financial dispublic. If the manufacturer sold direct organization, and budgetary distress. He to the retailer, he paid 2 per cent., but states that it was of great help to the every sale made by a manufacturer or by French Treasury, and it was recognized' a wholesale merchant was subject to a tax of at least 1 per cent. In many instances there were several transactions, each of which paid 1 per cent. It became known as the multiple tax, because often the tax was collected several times on the same goods. In 1921 economic conditions in Canada were still very bad. The business depression was acute, but, in spite cent. The following year it was increased to 4£ per cent., that is, the manufacturers and wholesale merchants together paid a tax of 4£ per cent. In 1924, the multiple tax was abolished, and legislation introduced providing for the payment of the tax once only, as we propose shall be done here. Thus, whether no matter how many transactions occurred, only one tax was paid. The rate, in 1924 it was reduced to 5 per cent., and from the third or fourth month in 1924 until 1926 it remained at that figure. In 1927 it was reduced to 4 per cent., and it has been reduced 1 per cent, each year figures here. At one time it yielded as vided as much as 24 per cent, of the When financial reconstruction under the on in Austria, the turnover tax proved; be a valuable device for furnishing a dependable revenue at a time when other im-",17,Second Reading
5,Mr Arghdale Parkhill,The Gosince then until it now stands at 1 per,18,Refobt Of The Commissioner General Of The League Of Nations Fob Austria
6,Mr Scullin,The Government that,18,Refobt Of The Commissioner General Of The League Of Nations Fob Austria
7,Mr Latham,I doubt whether that,18,Refobt Of The Commissioner General Of The League Of Nations Fob Austria
8,Mr Scullin',"My reply was just national revenue. Professor Comstock, a",18,Refobt Of The Commissioner General Of The League Of Nations Fob Austria
9,Mr Gregory,Ho w much do they get,18,Refobt Of The Commissioner General Of The League Of Nations Fob Austria
10,Mr Scullin,"I have not thethat during a critical period the turnover tax was the most trustworthy tax of all. When, under the auspices of the League of Nations, the financial reconstruction of Austria was being carried on, the turnover tax proved to be a valuable device for furnishing a dependable revenue at a time when other important taxes were falling behind because they were not adapted to the existing conditions. That statement is made in the l l t h report of the CommissionerGeneral of the League of Nations for Austria. I have a number of quotations from authoritative sources, and if honourable members desire to study a comprehensive review of general sales and turnover taxes, I commend to them a splendid v work on the subject that has been published by the National Industrial Conference Board of the United States of America. That work contains contributions by a large number of persons, who are representative of commercial, manufacturing and other interests in the United States of America. lished? drafting of this legislation, the Government found that the constitutional problem was a serious one, and obtained the advice of outside counsel. Mr E. M . Mitchell, K . C , advised that, in view of the High Court's interpretation of section -55, and of possible future interpretations, the safest course was to have an assessment act and a rates act for each subject of taxation. Thus it is necessary to introthe value of the sale. Any sale that is -duce nine separate assessment bills and nine separate rates bill to do precisely what, in Canada, can be done with one assessment act and one rates act. The sales tax that is to be imposed by these measures will apply to what will be -called "" sale value"" in connection with -6ales, and transactions which are in the -nature of dispositions of goods in the -ordinary course of trade, that take place -on and after the 1st August next. The term ""sale value"" is employed instead of the term ""sale price,"" for many reasons. There are numerous transactions that are not actually sales; for -example, goods may be leased in return for a rental or a royalty. In such a -case, the ownership does not change, but the perpetual use of the goods does. In effect, it is a sale, although legally it cannot be so termed. The sale value in those circumstances will be determined by the Commissioner. Further, so as to preserve the protective incidence of the tariff, the tax will be payable on imported as well as locally-manufactured goods. The retailer who imports goods will pay the tax at the time of their entry, and consequently a sale value must be fixed. That value will be the dutypaid value of tbe goods. It will be upon that value that the retailer who imports will pay the tax. In cases where a manufacturer or a wholesale merchant is also a retailer the tax will apply to the price for which his goods are sold to the consumer. able gentleman say that in cases where a retailer imports goods, he pays the tax upon their arrival in Australia? ported and sold by the importer, he pays the tax; but where the importer sells to a wholesale merchant, who will be registered, no tax will be paid on that saleI n the it will not be paid until the goods are sold to a retailer. In every case, the tax will be paid on the last transaction, no matter how many hands the goods may pass through. A check will be imposed by the registration of manufacturers and wholesale merchants. the last price? made to a registered person will not be taxed; but when that registered person sells to an unregistered person the sale will be taxed. in suspense against a registered person. taxes in other countries, to which I have referred, are usually multiple taxes that are applicable to all transactions. In such cases, a low rate becomes a high rate, the original 2 per cent, increasing to as much as 10 per cent. Tbat accounts for some of the early criticism of this proposal. Those who have argued that this tax will amount to as much as 10 per cent, or 15 per cent, have evidently had in mind what has happened in connection.",18,Refobt Of The Commissioner General Of The League Of Nations Fob Austria
11,Dr. Eable Page,When was it pub,19,Refobt Of The Commissioner General Of The League Of Nations Fob Austria
12,Mr Scullin,In 1929.,19,Refobt Of The Commissioner General Of The League Of Nations Fob Austria
13,Mr Maxwell,Did the right honor,19,Refobt Of The Commissioner General Of The League Of Nations Fob Austria
14,Mr Scullin,Wher e goods are im,19,Refobt Of The Commissioner General Of The League Of Nations Fob Austria
15,Dr. Eable Page,Will it be paid on,19,Refobt Of The Commissioner General Of The League Of Nations Fob Austria
16,Mr Scullin,It will be paid upon,19,Refobt Of The Commissioner General Of The League Of Nations Fob Austria
17,Mr Hughes,The tax will not be held,19,Refobt Of The Commissioner General Of The League Of Nations Fob Austria
18,Mr Scullin,"No. The turnoverwith multiple taxes iu other countries. That does not occur where the tax operates on only one transaction. This proposal is that the tax shall be charged only once. Manufacturers and wholesale merchants will be registered, but retailers will not be. Sales to registered persons for re-sale will not be taxed. Goods and raw materials purchased for use in manufactures will not be taxed at the time they are purchased. The question of contracts has been raised, and I have received a considerable amount of correspondence regarding it. If a contract for the delivery of goods over a number of months was entered into on or before the 9 th July, those deliveries will be exempt from this taxation. If , however, a contract was entered into after the 9th July, any deliveries made after the 1st August will be taxable as sales. The reason for that is obvious. For example, if , before the notification in the the royalty is to be taken into considerabudget speech on the 9th July that it was proposed to impose a sales tax, a firm entered into a contract at a fixed price to operate over a period of six or twelve months, it would have to deliver at that price, and, consequently, it would be unreasonable to expect it to pay this tax. But any contract that was entered into after that announcement is in quite a different category. The various transactions, acts, or operations that will be covered by the general scope of the sales tax may be summarized as follows:In the case of goods manufactured in Australia: Goods that are sold by tbe manufacturer to an unregistered person will be taxed, the tax being payable by the manufacturer. When goods have been purchased from the manufacturer by a registered person, and then sold by the latter to an unregistered person, the tax will be paid by the registered person who has purchased from the manufacturer. When goods are sold to an unregistered person by a registered person, who is neither a manufacturer nor a purchaser from a manufacturer, the tax will be payable by the registered person. In the case of imported goods: When goods are imported by an unregistered person, the tax will be payable by the importer at the time of the entry of the goods for home consumption. When goods are imported by a registered person and sold by him to an unregistered person, tax is payable by the registered person on the sale price of the goods. When imported goods are sold to an unregistered person by any person in Australia other than the importer, tax is payable by the vendor who sells to the unregistered person. When goods are purchased from local manufacturers or imported: When goods are purchased by a registered person and applied by him to his own use, tax is payable by the registered person on the fair market value at which the goods would have been sold by him in the ordinary course of trade if so sold. When goods are sold or transferred by the owner to another person subject to payment of a royalty, Avhether that payment is or is not associated with any other kind of payment in respect of the goods, tion in ascertaining the sale value for the purpose of the tax. As to goods which are the subject of a lease granted by the owner, the terms of the lease are to be taken into account in ascertaining the sale value for the purpose of the tax. In respect of goods produced or manufactured in Australia the exemptions areBacon and iiaras. Bags and sacks used in marketing primary products described below. (This exemption also applies to imported goods of this kind.) Beer (because it is the subject of the special revenue duty of excise). Bread. Boxes, cases, and crates, and wood in shooks for the manufacture of boxes, cases, and crates used in marketing any goods specified in this schedule when the Commissioner is satisfied that the boxes, cases, and crates have been or will be so used .within such time as the Commissioner considers reasonable in the circumstances. Butter, including margarine and similar substitutes for butter. Cheese. Cigarettes. Cream. Dried fruits. Electricity. Fertilizers and raw materials for use in the manufacture of fertilizers. (This exemption also applies to imported goods of this kind.) Flour, including bran, pollard, and semolina. Foods for poultry, birds and live-stock. Gas illuminating or heating, from coal. Meat, raw. Metals as recovered from ores. Milk products, viz., casein, milk powder, milk, condensed or concentrated. Newspapers. Pastry, but not including cakes or biscuits. Petrol. Sugar. Water, supplied by public authorities. Wool packs. (This exemption also applies to imported wool packs.) Goods (imported or Australian) sold for export by the purchaser. Goods (imported or Australian) exported by the owner whether or not they are for subsequent sale. Primary products derived directly from operations carried on in Australia in(a) Mining; (6) cultivation of land; (c) maintenance of animals, poultry, and bees; (d) fisheries; (e) timber-getting, and which have not been subject to any process or treatment resulting in an alteration of the form, nature, or condipert from the Sales Tax Department. He tion of the goods. Goods sold by or to a government or government authority in so far as they are the subject of a sale by or to that government speaks in the highest terms of his qualior authority. The foregoing exemptions are expressed in the schedules to the respective assessment bills to the extent required by the scope of each bill. As the bills relate to different subjects of taxation, there is necessarily some variation in the extent to which exemptions are specified in each schedule. For example, the bills dealing with goods manufactured in Australia which are the subject of ordinary sales, contain the full list of exemptions of Australian manufactured goods. In the case of imported goods, a shorter list is shown in the schedule, according to requirements. In respect of all imported goods except those which are subject to the special revenue duties of Customs, the sale value will be taxable. The exempt goods which are subject to the special revenue duties of customs are-Petrol, tobacco, cigarettes, cigars, films, newsprint, and wireless valves. If any person who has imported goods without having been liable to pay sales tax in respect of them at the time of their entry at the customs for home consumption, exports those goods or sells them to a purchaser for export by him, no sales tax will be payable on the sale value in respect of either the act of exportation or the sale for export legislation? Sir. Scullin. One of the features of a salestax is the simplicity of its administration. The experience of other countries is that it is administered much more simply than the income tax or the land tax; it is certainly much easier to collect than a war-time profits tax. Vendors who are liable to pay tax will be required to render monthly returns of their sales not later than seven days after the close of each calendar month. The return will be accompanied by a remittance of the amount of tax payable in respect of the taxable sales. We hope that we are avoiding many of the mistakes and difficulties which attended the introduction of this taxation in other countries. Starting later than they, we are benefiting by their experience, and we are indebted to the Government of Canada for the loan of the services of Mr G. W. Jones, an exhas shown himself a very capable officer, and the Commissioner of Taxation fications and the assistance he has given to the department. I take this opportunity to thank the Government of Canada for its prompt compliance with my request that it should make an officer available to give us the benefit of the Dominion's experience in this class of taxation. The machinery of the Income Tax Assessment Act has been adapted to the sales tax for the recovery of taxes. Machinery similar to that established by existing legislation is provided in regard to objections and appeals. The taxpayer will have the right to refer a matter in dispute to a board of review, and a question of law may be taken to the High Court. quired each year? be renewed annually. The Assessment Act will come up for revision only when amendments are found necessary. I regret that I was not able to submit the bills to the House earlier; the delay is due to the difficulties of drafting, caused almost entirely by section 55 of the Constitution.",19,Refobt Of The Commissioner General Of The League Of Nations Fob Austria
19,Mr Gregory;,Will a rates bill be re,21,Refobt Of The Commissioner General Of The League Of Nations Fob Austria
20,Mr Scullin,No; though it may,21,Refobt Of The Commissioner General Of The League Of Nations Fob Austria
