speakerGroups,speaker,theText,pageNumbers,title
14,Able Member For Adelaide ( Mr Yates),"election the Govermnent is alone responsible. Instead of shedding crocodile tears over the lot of thc unemployed, the honourable member for Adelaide would have done better had he, during the last two years, used his influence and his vote to induce the Government to do something to relieve unemployment. It is in bad taste for the honourable member, now that everything is in the melting pot, to try to make an issue out of the unemployment problem. I take it that honourable members will put their platform before the electors in due course. The members of the group to which I belong will not be backward in doing so, and we have a very definite policy for the soludone so at this stage of the proceedings. tion of the unemployment problem. We will state that policy clearly and unequivocally, so that, all who hear or read it will be able to understand it. Our policy statement will not be loaded with a superfluous verbiage which might he made to mean anything. There will be about it no ambiguity behind which we can shelter when asked to stand by our pledges. The honourable member for Adelaide endeavoured, I think, to create the impression that the members of the group to which I belong were in some way lacking in sympathy with the unemployed. If we had been able to see any hope that the Government would do something to relieve the distress and want from which so many thousands of citizens are suffering, we would have been prepared to condone even some measure of maladministration in order that it might carry out its policy. It was because for two years we had had from the Government nothing but vacillation and exhibitions of hopeless ineptitude that we decided to take the step we did, being quite indifferent whether the Government remained, in office or not. matters little to the unemployed whether the present Government remains in office, or the Opposition is returned. will have a bitter experience. from the bitter experience of the last two years. Government supportersI am not including the Attorney-General-wil l at least give me credit for being honest, and for doing what I believed to be right. tion ? ing to the statements of the honourable member for Adelaide, and giving my record of two years, which has to be adjudged hy the people as to whether it is worthy or unworthy. the constituencies? members are inspired to make statements challenging the bona fides of other honourable members, they must expect an answer. I have been forced, therefore, to speak; I should not otherwise have On behalf of the group which I represent, I express my keen appreciation of your impartiality, Mr Speaker, and of the masterly manner in which you have conducted the proceedings of this House. You have upheld the dignity of that office with much credit to yourself. I also wish to express my appreciation of the work of the Chairman of Committees, of the members of the Hansard staff, and the otlier officers of Parliament. We appreciate the efficient service rendered to us by our officers. I "" regret that I have been compelled to reply to statements which I consider a reflection upon the integrity of the members of my party. -I join with the honourable member for Werriwa( Mr Lazzarini) in his recognition of your impartiality, Mr Speaker, throughout the whole of the proceedings of this Parliament, and I deeply appreciate the courtesy that yov have extended to me. I also wish to endorse the references which have been made to the efficient service of the parliaSo far as we can see, it mentary officers As we shall not have another opportunity in this chamber of referring to it, I should like to have some information now from the Prime Minister( Mr Scullin)' or the: Postmaster-General( Mr A. Green) as to the Government's decision or attitude in regard to broadcasting. There is no doubt that the coming electoral campaign will be a short one, and that the facilities offered by means of the A class stations will be a big factor in the",18,Honourable Membebs Hear Hear
15,Mr Brennan,The honourable member,19,Honourable Membebs Hear Hear
16,Mr Lazzarini,I am speaking,19,Honourable Membebs Hear Hear
17,Mr Lewis,Why all this self-adula,19,Honourable Membebs Hear Hear
18,Mr Lazzarini,I am simply reply,19,Honourable Membebs Hear Hear
19,Mr Lewis,Why not say all this in,19,Honourable Membebs Hear Hear
20,Mr Lazzarini,When honourable,19,Honourable Membebs Hear Hear
21,Mr Beasley (West Sydney) [5.58].,"decision of the people. It is customary, I believe, for the A class stations, under the direction of the Postmaster-General, to offer these facilities to the respective parties contesting the election. I believe that opportunities are provided in each State for the broadcasting of messages by the different parties. As this election will in some way with my return to this be fought upon important issues, I should like .to have from the Postmaster-General or the Prime Minister an intimation as to the decision of the Government in this matter. AVe are anxious that our opinions shall be known throughout the country. ""We are not asking for any privilege which is not extended to any other party. I am desirous of knowing before we leave Canberra exactly where we stand in regard to broadcasting, and whether we are to have the same concession as will be extended to other parties in this House. had the great privilege of seconding the 'motion for your elevation to the Chair, Mr Speaker, and I should like now, at the termination of this Parliament, to express the great pleasure that I have had in ner sided over the deliberations of -the chamber. It is of great satisfaction to this Parliament to know that its presiding officer has its respect and entire confidence, ancl, furthermore, that he upholds the highest traditions of British parliamentary institutions. I express my indebtedness to the Clerk, the Clerk Assistant, and the members of the reporting staff for the consideration that they have shown to me. I have not been sufficiently long in Parliament to feel quite comfortable in carrying out the duty that is imposed upon me, and I should be lacking in recognition of the help I have received if I failed to express my great indebtedness to those who have assisted me. To honourable members opposite, in particular, I give my good wishes. I admire them for the part that they have played in the public life of this country. I differ from them, but I believe that our differences are useful to the community, because they permit this great nation to make the best choice between candidates for the well-being of the country. I hope that they will have a happy and prosperous Christmas, in which their constituents will share. I hope, too, that my constituents will be bappy and prosperous, and that they may think their happiness and prosperity are associated Parliament. [6.2] I wish to join with other honourable members in paying my tribute to you, Mr Speaker, the Chairman of Committees, and the officers of the House. My object in rising is to impress upon the Government the great necessity, in view of the fact that we are to have a rush election, for allowing all parties the freedom of the air. At election time, and particularly during a record short campaign, the people of Australia want to know more than they do at any other time about the issues that have to be determined, and if there is any undue restriction upon the use. of the air, it will be very unfair to them and to the parties which will suffer as a result of foolish interference with the liberty that belongs watching the admirable manto all political parties. I am not speakin which you have preing with any knowledge of what may be the Government's intention, but in view of the fact that this will be the last opportunity that honourable members on this side of the House will have of placing their views before the Government on this important subject, I earnestly hope, and I think, that all honourable members on this side will join with me, that the Government will be as generous as possible to all parties, and not take up thc stand that only its supporters, and say, the official opposition, shall have the right to address the people over the air through the A class broadcasting stations. During the recent election in Great Britain practically the whole of the publicity, and all the policy speeches were put to the people over the air. It has now become the recognized practice in all countries that have established well organized broadcasting systems, to allow the utmost freedom, not only to political parties, but also to candidates, in placing their views before the electors. This country has not reached the stage at which candidates can expect to be given that privilege, but we certainly can expect that any party",19,Honourable Membebs Hear Hear
22,Mr Curtin (Premantle) [6.0],I,20,Honourable Membebs Hear Hear
23,Mr Thompson (New England),"wbich is recognized by the electors as a party-and I am speaking particularly of the Country party-shal l have the right that is given to any other party to broadcast its views. It is a question not of the size of the party, but whether every party is to be given an opportunity to use this magnificent means of placing its views before the people. In the coming election we shall have practically three weeks' campaign, which will make it utterly impossible for country members to travel throughout their electorates and personally place their views before their constituents. It will he comparatively simple for the representatives of metropolitan constituencies to get into contact with their electorates. We can safely say that the majority of the country electors will not have personal interviews witli their candidates, particularly with thc leaders of the parties. reason I strongly urge, on behalf of the Country party, the fairnessI shall not express it otherwise""-of extending to the representatives of all recognized parties the privilege of addressing the electors of Australia in this way. to add my word of appreciation to what has been said regarding the impartial manner in which you, sir, have conducted the affairs of this House for the past two years. The honourable member for West Sydney( Mr Beasley) and his associates must feel gratified to know that their action has deprived the waterside workers of this country of privileges which the present Government gained for them. They entered into a combination with the Opposition which madethat possible, ancl I feel that it is only right that we should remind them that what has happened is clue to their action. -With profound gratitude, I acknowledge the most generous references that have been made to the service which I have rendered during my 'occupancy of the Speakership. It is with intense satisfaction that, at the conclusion of my term of oflice, I have heard the expressions of confidence aud goodwill of honourable members of all parties. this Parliament' there have been moments of agitation and periods of strain, and I am proud that honourable members have been, kind enough to say that I have worthily upheld the tradition of the high office which I have occupied for two years. I thank them for their assistance at all times, and their compliance with my requests from the chair. My period of office has been one of the most delightful experiences of my life. For that I express my appreciation of the loyal service of the Chairman of Committees acted in that capacity, but also as Deputy Speaker. I am grateful also to the Temporary Chairmen for the manner in which they have discharged their responsible duties. To the others who have assisted with the work of the House-to the Clerks, the members of the Hansard staff, the messengers, the Library staff, the officers of the Joint House Committee, ancl all who have assisted in the smooth working of ParliamentI pay my tribute. On their behalf I thank honourable members for what has been said regarding their loyal and efficient service. Whatever the future may have in store for us, I extend to all honourable members my best wishes for the coming Christmas season, ancl express the hope that their earnest desire for the public welfare may be realized in the greater prosperity of the people of Australia during the coming year. Question resolved in the affirmative. House adjourned at 6.11 p.m.",20,Honourable Membebs Hear Hear
24,Mr Gibbons (Calare) [6.7],I wish,21,Honourable Membebs Hear Hear
25,Mr Speakebj'(Hon,Norman Makin).,21,Honourable Membebs Hear Hear
26,Dr. Maloney,You deserve them.,21,Honourable Membebs Hear Hear
27,Mr Speaker,During the life of,21,Honourable Membebs Hear Hear
28,"( Mr Mcgrath), Not Only When He Has","oo4rao*-Ocnera? r S °^ Saint Michael and Saint George, Governor General and Commander-in-Chief in and over the Commonwealth of Australia. that the Governor General may from time to time by Proclamation or otherwise prorogue the Parliament, and dissolve the House of Representatives: And whereas it is expedient to dissolve the House of Representatives: Now therefore I , thc Governor General aforesaid, do by this my Proclamation lissolve the House of Representatives as on and from the twenty-seventh day of November, One thousand nine hundred and thirty-one, and I discharge Honourable Senators from attendance on that date. Given under my Hand and the Seal of the Commonwealth of Australia at Canberra this twenty-sixth day of November, in the year of our (L.S.J second year of His Majesty's reign. GOD SAVB THE KING ! Council, Knight Commander of the Most Distinguished Order Lord One thousand nine hundred and thirty one, and in the twenty7 By His Excellency's Command, J. H . SCTJLLIN.",21,Honourable Membebs Hear Hear
29,By His Excellency The Right Honourable Sir Isaac Alfred,,22,Whereas By The Constitution Of The Commonwealth Of Australia It Is Provided
