speakerGroups,speaker,theText,pageNumbers,title
0,"House Of Representatives. Wednesday, 30 October, 1935. The Chair At 3 P.m., And Read Prayers. Honourable Members That Copies Of The Report Of The Directors, And Of The Balance","sheet as at the 30th June, 1935, of the Commonwealth Oil Refineries Limited, have been. placed on the table of the Library. ter any cognizance of the nature of the reported peace terms which the Italian Government has communicated to the Government of France, and which were subsequently communicated by that Government to the Government of thu United Kingdom? If he has, will he inform this House of their nature? Furthermore, will he permit this House to consider and express an opinion upon them before further steps are taken in respect of the imposition of sanctions? orable member place his question on the notice-paper. At the same time, I ask leave to make a brief statement in regard to sanctions. Leave granted. formed honourable members that Proposal",10,Setup
1,Mr Speaker (Hon. G. J. Bell) Took,,10,Italo Abyssinian Dispute
2,Mr Lyons,I desire to inform,10,Italo Abyssinian Dispute
3,Mr Curtin,Has the Prime Minis,10,Italo Abyssinian Dispute
4,Mr Lyons,I suggest that the hon,10,Italo Abyssinian Dispute
5,Mr Lyons,"I have previously inI . of the Sanctions Co-ordination Committee relating to the prohibition of arms and munitions of war to Italy had been put into operation, and that the Commonwealth Government had accepted in principle Proposal II -Financia l sanctions. The Government on the 25th October also decided to accept in principle Proposal III --Prohibitio n of imports from Italy or Italian colonies-and Proposal IV -Prohibitio n of certain munitions of war exports to Italy. The nature and extent of these proposals were previously indicated to honourable members. The Secretary-General of the League of Nations was informed of this decision, and notified "" that the Commonwealth Government will be prepared to put the proposals completely into operation within a period not less than fourteen days subsequent to the 31st October or any date agreed upon by the Coordination Committee "". This Committee will meet on the 31st October to fix the date from which the sanctions will operate. Tho Government has also given consideration to Proposal V. of the Coordination Committee, relating ia mutual assistance. This proposal indicates the obligations of State members of the League under paragraph 3 of article 16 of the Covenant with reference to the operation of the most-favoured-nation clause so far as obligations under treaties containing such clauses are affected hy reason of the suspension of commercial relations with Italy. For example, in the case of the.determination of suspension of a trade agreement between Italy and a State member of the League, other countries entitled to any concession or preferential treatment would automatically lose the right of the particular joncession. Section1 (a) of the proposal is designed to counteract this, and provides that League members other than Italy entitled to claim rights; shall still continue to receive them as though I' were still receiving those rights. This section would not affect Australia, as we have no commercial agreement with any countries under which preferential treatment in regard. to any commodity is accorded. In addition, Proposal V. asks State members to purchase commodities previously obtained from Italy from other State members, and to endeavour to Mr Lyons. alleviate the position of State members who have suffered loss through the imposition of economic sanctions by an increase of purchases. The Commonwealth Government has accepted this proposal in principle, and the Secretary-General of the League is being so informed this afternoon. Draft legislation to give effect to Proposals II . , III . and IV . is now being prepared, anil the bill will be introduced at an early date. Mi'. OTJRTIN -I s it a fact that the Government intends to prohibit, or has prohibited, exports of raw materials to Italy, vide sanction No. 4? ( Mr Menzies) proposes to introduce almost immediately a bill dealing with sanctions. A full statement of the Government's intentions will then be made. Minister inform me whether there is any truth in the broadcast statement attributed to Mr Lloyd George to the effect that, the Anglo-Persian Oil Company, in which the Commonwealth Government holds a small interest, is still supplying petrol to the Italian Air Force which is engaged in the bombing of thu villages of Abyssinia? tion on the matter for the honourable member. the nearness of Armistice Day, when n large number of honourable members will meet returned soldiers in their constituencies, will the Minister for repatriation consider, either the introduction before that day of the proposed bill tn amend the Repatriation Act, or, if unable to do that, the making of a statement that will indicate approximately tbe alterations of the law to which he proposes to ask this House to agree? make a statement in the matter. The proposed measure, although drafted, has yet to receive the final approval of Cabinet, but I hope to introduce it at an early date. The points which the honourable member has in mind will then come up for discussion.",10,Italo Abyssinian Dispute
6,Mr Lyons,The Attorney-General,11,Proposed Repatriation Legislation
7,Mr Holloway,Can the Prime,11,Proposed Repatriation Legislation
8,Mr Lyons,I shall obtain infn -.na,11,Proposed Repatriation Legislation
9,Mr Hawker,In consideration of,11,Proposed Repatriation Legislation
10,Mr Hughes,"I am not prepared tnof the negotiations of the Minister directing negotiations for Trade Treaties( Sir the Belgian Government has withdrawn the notice given to the Commonwealth Government terminating the provisional trade agreement concluded in November, 1934, in relation to Belgian, glass and Australian meat and barley. The arrangement embodied in the original agreement, providing for the unrestricted entry of Australian'meat and barley into Belgium, will continue in force, but, in accordance with the terms of ""that agreement, is subject to denunciation at two months' notice from either Government. reports, the Minister directing negotiations for Trade Treaties is about to leave, or has left, London for Australia. Will the Prime Minister inform the House without delay of the consultations or trade agreements into which that gentleman has entered with the different foreign governments with which he has been in negotiation, or shall we have to await his return, which may not eventuate until the closing days of the session, when an opportunity may not present itself to discuss the work with which he has been entrusted? honourable member is concerned about the completion of trade agreements between Australia and other countries. No agreements have been concluded, nor will they be until the Minister directing negotiations for trade treaties returns to Australia. That will be the time when an announcement will necessarily be made to Parliament. But, as I have already said, the treaty between Belgium and Australia will be continued in force. ter say whether the Minister directing negotiations for trade treaties has yet left Europe, and when he is expected to arrive in Australia? munication to-day from the Minister in question, and though I forget the exact dates mentioned in it, it was to the effect that he is just about to leave Europe. of the Minister for Commerce been drawn to an article in the Glasgow Herald of the 23rd July, headed "" Scottish gesture to South Africa. Big market for Ilenry GuUett) in Brussels, citrus fruits if shipped direct""? I ask this question in view of the serious difficulty facing our citrus growers in the marketing of their product. the article referred to by the honourable member, but the Commonwealth Government is this year paying a bounty of 2s. a case to encourage the export of oranges to the United Kingdom, which, of course, includes Scotland. in the Melbourne Herald that Lasseter's reef has been found, refound, and rerefound., and has now, apparently, been moved into Western Australia, that rich specimens which Mr Hummerston had obtained for his original find were, it is stated, cruelly stolen from him by some villains in a public place, and that raining is about to be placed on an industrial basis by the Commonwealth Government, I ask the Minister for the Interior whether, in order that the investing public and working miners may be protected from such fiascoes as resulted from the so-called Granites and Arnheim Land finds, he will lay on the table of the House all the information obtainable in his department as to where and how Mr Hummerston obtained his original specimens? Will he also send out a qualified surveyor, a mining engineer, and a police officer to investigate Mr Hummerston's original find, and also the new one? members that questions should not be based on newspaper reports unless honorahle members can vouch for the accuracy of the statements contained in the reports. member was good enough to inform me that ne proposed to ask a question on this subject, and I am therefore able to furnish him with the following information :-Hummersto n originally claimed to have discovered a rich reef in the south-eastern portion of the Northern",11,Proposed Repatriation Legislation
11,Mr Lyons,by leave-As the result,12,Lasseter S Reef
12,Mr Beasley,According to press,12,Lasseter S Reef
13,Mr Lyons,I take it that the,12,Lasseter S Reef
14,Mr Forde,Can the Prime Minis,12,Lasseter S Reef
15,Mr Lyons,I received a com,12,Lasseter S Reef
16,Mr Gardner,Has the attention,12,Lasseter S Reef
17,Dr. Earle Page,I have not seen,12,Lasseter S Reef
18,Mr Blain,In view of the report,12,Lasseter S Reef
19,Mr Speaker,I remind honourable,12,Lasseter S Reef
20,Mr Paterson,"The honorableTerritory, or over the border in Western Australia. He first came into contact with the Department of the Interior by requesting permission to travel through the reserve for aboriginals. information submitted to the department, approval was given for him to proceed through the reserve on the condition that two government officers accompanied him for the purpose of verifying his alleged find of a very rich reef. The party set out from Alice Springs, but after travelling for several, days the track became impassable, and the party, including the officers., returned to Alice Springs. The only connection which the department has had with Hummerston was the sending of the two officers on the trip mentioned. No financial assistance was granted to him. It is. understood that subsequently Hummerston, with a party organized in Sydney; set out for the reef. He was notaccompanied by government officers on that expedition. It is stated that he found a rich reef in Western Australia over the border of the Northern Territory, and brought back specimens. The department has no official advice regarding the matter, which, apparently, is now one for the Government of Western Australia. Minister whether, in view -of the fact that a great national event of Australia will be held next Tuesday, ho will indicate, for the convenience of honourable members, the Government's proposal for the sittings of the House next week? honourable member refers, has been overshadowed by business of very much greater importance and urgency, and the Government has not, therefore, been able to consider the matter mentioned by the lionorable member. I ask him to place his question on the notice-paper. Commerce whether he is in a position to outline the policy of the Government for the assistance of farmers in droughtstricken areas? has not yet been determined by the Government, and will not be until its general wheat policy is under consideraOn the tion. ter for Defence proceeds with the construction of a landing ground for aeroplanes at Derby, will he make inquiries with the object of ascertaining whether sufficient local labour is available for the job? It has been rumoured that a considerable number of men who were employed on the construction of a landing ground at Port Hedland, are to be taken to Derby to do similar work there. I assure him that plenty of men are already available at Derby for the work. shall make inquiries into the matter. If sufficient local labour is available it will be employed unless special considerations have to be taken into account. BEEF, LAMB AND EGGS. Mr E. F. HARRISON I ask the Minister for 'Commerce whether his attention has been drawn -to comments published recently by Sir Stanley Argyle regarding the quality of beef, lamb and eggs exported from Australia to the London market? If so, do the views therein expressed coincide with the Minister's own views on the subject? Stanley Argyle, on his return to Melbourne on the 28 th October from a visit to London, made sweeping criticisms of the quality of Australian exports. His statements may be taken as a condemnation principally of methods of production and preparation for export, but they also involve a criticism of exporters and the export inspection system. In the first place, control over production is exercised by the State governments which engage in instructional work amongst farmers, I ask the Minister for and are responsible for the inspection of manufacturing and processing establishments. For example, the inspection of dairy farms and butter factories, as to cleanliness and efficiency, is carried out",12,Lasseter S Reef
21,Mr Gander,I ask the Prime,13,Australia N Exports
22,Mr Lyons,The event to which the,13,Australia N Exports
23,Mr Nairn,,13,Australia N Exports
24,Dr. Earle Page,That subject,13,Australia N Exports
25,Mr A. Green,Before the Minis,13,Australia N Exports
26,Mr Archdale Parkhill,I,13,Australia N Exports
