speakerGroups,speaker,theText,pageNumbers,title
92,Sir Donald Cameron,"Peopl eschools of thought. There are "" new forces moving on the forehead of the world"". enthusiasm have rolled back into the trough of disenchantment. High hopes lie extinguished and the peoples of a distracted world do not know which path they should follow. Despite all that has been urged by pacifists, an undefended country is undoubtedly a temptation to war and will be so long as the barometer of civilization has not been pegged at "" set fair "". threatening us? never been in doubt as to what are the honourable member's ideas on defence; he has never hesitated to express them. However, his opinions on such matters are not mine. Defences need not be on such a scale as will wholly resist attack. That often would he impossible. If they are provided onsuch a scale as will make attack a serious and doubtful undertaking and a hazard they will prove effective. Few nations can provide immediately for all that is required for their effective defence, but a fixed and continuous policy is essential. Such a policy should be designed to cover a definite period, and should be one which will meet requirements at a given time; being progressive, it will be less wasteful than a spasmodic plan. The old military proverb-""Bette r an indifferent plan steadfastly adhered to than a good plan constantly changing""-hold s good here. If the protection of a country is the first now living, be wholly or even reasonably obligation of its population, then it would seem but logical that all who are capable should be required to contribute to the country's defence. Unfortunately, some"" people fear that a universal system of military training breeds a militaristic tendency; experience and reflection upon experience prove such a conclusion to be wrong. Undoubtedly, there are moral advantages in requiring all to contribute to their country's welfare, and a wise military training such as is now encouraged will uplift physically and mentally theyouth of the country. I repeat that we cannot close our eyes to the disturbed state of the old countries of the world to-day. I emphasize that point, particularly for the benefit of the honourable member for Batman( Mr Brennan). From time immemorial, morally and instinctively, the obligation Since the war, the waves of has rested upon the men and youths of a nation to defend their homes and womenfolk should occasion arise. Modern civilization has not in any way modified that obligation. Whatever efforts our statesmen may make to maintain peace -and they should make unceasing efforts -it remains the duty of an able-bodied man to prepare himself in any, and every, way possible to help defend his country in case of need. From my own experience at Geneva, I am convinced that the voice of the British Empire is the greatest influence for peace and goodwill in the world to-day. I give way to no man in my desire for peace in my time. Those who have known war fear it most of all, because they realize the appalling results, 'both to the victors and vanquished, of war under modern conditions. The world need never fear any military measure we may take in Australia. Whatever may be the case elsewhere, military training with us is purely defensive. The smallness of our population makes this quite obvious. Also it is an additional reason why, on each citizen personally, should rest the obligation to defend this country, if necessary. We cannot really make Australia secure by any process other than by peopling this country with people of our own race; and as, at the present rate, the natural increase of our population will not ensure our safety for 100 years at least, we cannot, within the life-time of people safe against possible aggression. We have only two lines of defence-first , our foreign policy, so far as it is compatible with maintaining a white Australia, is peaceful, favouring mutual trade and understanding; and secondly, we try to maintain such defence forces as will enable us to protect this country against destructive raids, or attempts at local invasion, until the full force of the British Empire can come to our aid. We cannot become secure without the help of the British Empire; we rely absolutely upon the Mother Country's assistance. We have a fair claim to expect that assistance, as we went to Britain's aid in a great struggle. But it would not be fair to expect the Mother Country to come to our aid unless we do something for",48,Fishing On The Barrier
93,Mr Bbennajt,What country is,49,Fishing On The Barrier
94,Sir Donald Cameron,"I haveourselves. All of us are pacifists in a sense; we want to avoid war. But it would be a cheap kind of pacifism, which would say to the Mother Country, "" We expect you to keep up a big navy for us, but we are not going to keep up any army or navy for ourselves; we object to it on principle "". Possibly a day will come when we will simply contribute our share to an international defence force, safeguarding not only the Empire, but also all law-abiding countries. Even then, we shall have to do our share; but until then, wo cannot shirk our responsibilities. I give place to no man in my desire to maintain peace, not only in this, but in future generations as well. However, I cannot overlook the obligation that rests upon this Parliament to provide for the security and defence of the country if the occasion for it should, unhappily, or unfortunately, ever arise. A few months ago, on the occasion of the opening of the Singapore air mail service, the Minister for Defence, Mr service each way between Brisbane and Parkhill) made an interesting speech in Queensland on the subject of civil aviation. He saidThe indications arc clear that the world nificant record. While I appreciate the to-day is entering upon an air age. Australia efforts of the Government to improve the is attempting to play well its part, and the Commonwealth Government intends to spare existing facilities, I urge that everything no reasonable effort to develop air transport to possible be done to provide new aerothe advantage ancl benefit of our community. 1 congratulate the Government upon its improvements be made to existing ones. efforts to develop air transport in every possible way. The honourable gentleman of the Leader of the Opposition ( Mr also saidAviation has assumed an important place vernment to re-establish the military colin the world's affairs, .and air transport serlege at Duntroon. The honourable gentlevices carrying mails, passengers and goods now link many countries and many nations throughman expressed strong opposition to the out the world. The nations of the British proposal, and referred to the expense of Commonwealth were not slow to appreciate the college at Duntroon. Up to the end of the advantages of civil aviation, both for the 1934 the total number of graduates from internal needs of their various vast territories and Ih linking those territories more'closely to the Duntroon college was as follows:the heart of the Env.iire, and to one another. The development of civil aviation would be facilitated by the provision of additional landing grounds and aerodromes throughout the Commonwealth. I realize the difficulty that faces the Government in this regard, but I am firmly of the opinion that if additional landing grounds were provided civil aviation could be developed much more rapidly. On the route between Sydney and Brisbane large planes can land only at Newcastle, Old Bar, Coif's Harbour and Lismore. I have flown over this route on many occasions, and those are the only suitable landing groiuids for large planes of whicli I know. Farther north from Brisbane the landing grounds at Mackay, in the Herbert electorate, and at Gladstone, in the Capricornia electorate, are unsafe or unsuitable for planes in wet weather. get the Government to improve the aerodrome at Gladstone, but so far without success. that the Government is doing everything possible to improve our landing grounds, although I feel that more should be done to provide additional landing grounds on the route between Sydney and Brisbane. I take this opportunity to express my great admiration of the New England air mail service, which is not subsidized by the Government. For four years it-has maintained a regular daily Sydney, and in that time not a single accident has occurred, and not one passenger has been injured. That is a magdromes and landing grounds and that I wish to refer briefly to the remarks Curtin) regarding the decision of the Go' Australia .. .. .. 375 New Zealand .. 61 Total ..436 Of the 375 Australian graduates, 186 are now serving the nation. At first sight the wastage appears great, but actually it has not been excessive, for 42 Duntroon graduates were killed in the war, while in 1922 the army was greatly reduced, and many graduates were retrenched, while in 1930 a further small retrenchment occurred, and encouragement was given to",49,Fishing On The Barrier
95,Mr Forde,We have been trying to,50,Fishing On The Barrier
96,Sir Donald Cameron,"I believeall officers of the permanent forces to find military service. It must be obvious to employment elsewhere. officers took the opportunity at that time to transfer to the British or Indian armies. The cost of the college for the last five years has been as follows:Year. Location. Number of Cadets In Cost. Training. £ 1930 1931 1932 Sydney 30 16,236 1933 Sydney 29 16,203 1934 It is not quite fair to compare the cost of the college at Duntroon with the cost of it at Sydney, for not only has there been a reduction of the number of cadets maintained in Sydney, but also certain facilities used in Sydney, such as personnel, horses and motor transport, have been charged to other sections of the defence vote, and undoubtedly have to be maintained at higher strength owing to their use by the college. badly with the cost of university training in say, the engineering or law courses. no information at hand on that point; but I hope that the Minister for Defence will be able to furnish information as to the cost of similar military colleges in other countries, particularly those of Prance, Belgium, Germany, Canada, the United States of America, and England. I point out to the Leader of the Opposition that, when Lord Kitchener recommended that the college should be established, it was definitely set out that no restriction should be placed upon the entry of cadets to it. The boys of the poorest people were to have equal opportunity with the boys of the wealthy people, and wealthy parents were not to be permitted to assist their sons financially in any way except with pocket money. My impression is that the cost of the college 1930-31 at Duntroon will compare favourably with 1931-32 that of similar colleges in other parts of 1932-33 the world. I do not think that any 1934-35 . . 8,800,000 12,091,000 3,291,000 other nation has attempted to establish, right in the heart of a big city, a military Speaking in Perth a few months ago college to provide training in artillery, as Acting Prime Minister, the Minister mounted work and other branches of for Commerce (Dr. Earle Page) said Many young everybody that a college with such objects could not succeed as well in a big city as at a place like Duntroon. fer from Sydney to Canberra a college which has only 33 cadets in it. the view that, if the college is re-established at Duntroon, the number of cadets will very soon be doubled, if not trebled. Sydney 31 24,324 up accordingly. Sydney 33 16,976 think so. I consider that the Government is acting wisely in bringing the college back to Duntroon. I wish now to speak briefly on the subject of national insurance. I listened with interest to the speeches delivered by the honourable member for Watson( Mr Jennings), the honourable member for Riverina( Mr Nock), and the honourable member for Moreton( Mr Erancis). The last-mentioned honourable gentleman was a member of the royal commission which investigated the subject of national insurance in 1925. The Treasurer ( Mr Casey) has pointed out that, at the end of June, 1935, 273,978 invalid and old age pensions were in force, these figures showing an increase of 13,313 in the last financial year. The total amount expended on pensions in 1934-35 was £11,762,030, which was the greatest amount in any one year since the introduction of our pensions system. It is estimated that the expenditure for the current financial year will be £12,770,000. The following table, showing the revenue from income tax and the expenditure on invalid and old-age pensions during the period 1930-31 to 1934-35, is arresting:Invalid and Income Tax Old-age Excess of(a) Year. Revenue. Pensions over (6). Expenditure. £ £ £ 13,604,374 11,710,953 1,893,421 13,481,982 11,125,956 2,356,026 10,878,718 10,771,061 107,657 1933-34 .. .. 9,314,768 10,963,090 1,648,322",50,Fishing On The Barrier
97,Mr Cubtin,The cost compares very,51,Fishing On The Barrier
98,Sir Donald Cameron,I have,51,Fishing On The Barrier
99,Mr Cubtin,It seems absurd to trans,51,Fishing On The Barrier
100,Sir Donald Cameron,I hold,51,Fishing On The Barrier
101,"Duntrooa 65 44,937 Mr Mabtjsns",And the cost will go,51,Fishing On The Barrier
102,Sir Donald Cameron,"I do notthat the Commonwealth Government was "" looking into the matter of national insurance."" since that right honourable gentleman moved the second reading of the National Insurance Bill in 192S. know about that. The Minister added thatTlie Government realizes that there must be introduced some measure which will give the people a feeling of security, when they are no longer able to earn a living through old-age Cameron) regarding the budget speech or sickness. As pointed out by the honourable member for Moreton, the system of national insurance originated in Erance in 1850. voluntary, but it was not long before the voluntary system was found to be useless, and a compulsory form of insurance was introduced. Other nations followed the example of Erance in the succeeding years. In some of them, the scheme of national insurance included invalid and old-age pensions, sick pay, medical attendance and medicine, maternity benefit, hospital and nursing treatment, funeral allowance, maintenance of surviving children, and unemployment benefit; in others, the benefits are more limited. collected from the employers of insured persons as well as from the insured employees, and the funds are supplemented by a subsidy or regular contribution from the State. A sound scheme of national insurance would give to every needy person an assured income in his old age, and remove entirely the suggestion of charity, thus making the recipients more independent and self-reliant. I realize that the inauguration of a scheme of national insurance in Australia would present many difficulties, and that the Government would have to give it a "" push off "". But such a scheme, once it had been soundly established, would remove a load from governments and raise the subject of pensions above party politics. I have been interested in the subject of national insurance for many years, and I know that there are objections to it, but I trust that no one will suggest that those who advocate such a scheme are opposed to the payment of invalid and old-age pensions. Those who draw attention to the increasing pensions bill do so only because they cannot see how this country can afford to meet an increased liability of £1,000,000 a year except by adding to the already heavy burden of taxation. The TEMPORARY CHAIRMAN. The honourable member's time has expired. do not share the enthusiasm of the honourable member for Lilley( Sir Donald delivered recently by the Treasurer ( Mr Casey). Indeed, I was disappointed with it, because I admire the honourable gentleman's ability, and I expected that At first, insurance was his first budget speech would reveal something of that originality which he displays in all his work. Unfortunately, his speech lacked originality, and was full of time-worn platitudes about the restoration of confidence through stable government, and orthodox financial methods. What was more unfortunate was his recourse, in order to bolster up his platitudes, to the use of figures that were not unchallengeable, particularly those which dealt with loan finance and unemployment. The budget speech was not well received by those journalistic backers Usually the contributions are of the Government whom we know as the press. They were not satisfied that there were sufficient reductions of taxation forecast by the Treasurer. The Government has not honoured its promise to the poorer sections of the community who made real sacrifices under the emergency legislation, although it has remitted large sums payable as taxes by wealthy persons in the community, many of whom were not called upon to make any sacrifice during the depths of the financial crisis. As a matter of fact, many of those who have benefited from the remissions of taxation granted by this Government have done well out of the depression. As shareholders of companies, they have reaped increased dividends and swelled their bank balances because of the taxes which have been remitted. The columns of the Sydney Morning Herald inform us almost daily that many companies, particularly in'New South Wales, have been able to declare increased dividends because of the remissions of taxation",51,Fishing On The Barrier
103,Mr Curtin,It has been doing so,52,Fishing On The Barrier
104,,Sir DONALD CAMEEON I do not,52,Fishing On The Barrier
