speakerGroups,speaker,theText,pageNumbers,title
70,Mr Francis (Moreton) [6.4],"I £17,610,000. We were told that whenincreased to 371,000; in 1933-34, to 406,000, and this year to 451,000. Also as the result of the sound policy of this Government, internal and external, confidence has been created both in Australia and abroad; the Australian High Commissioner in London( Mr Bruce) has been able to bring about the successful conversion of loans amounting to £160,305,000, upon which we were formerly paying interest rates of from 5 per cent, to 6£ per cent., whereas the average interest rate now paid is only £3 13s. 5d. per centa reduction of practically If per cent. The annual saving of £2,925,000 thus effected is made up of interest, £2,341,000, and exchange, £594,000. This is a conservative budget, though I find no reason for conservatism unless it be the disturbed condition of the world and anxiety throughout the world generally in regard to developments in Abyssinia. Substantial reductions of taxation have been made, but I suggest that if further reductions were made, greater revival in private industry, which, after all, absorbs 80 per cent, of the workers, would follow; industry would expand and develop, and more persons would be employed. Crippling taxation hampers trade. As I have said, the budget, in my opinion, is too conservative; but let me quote the views of competent judges overseas. According to th? Telegraph, the London press is reported to have referred to the budget in these termsHow (The Loudon, Tuesday. "" What a splendid race those Australians aro! How magnificently they have met and overcome adversity! Now they are settled on -A course ,of prosperity; long may it reign!"" This is the comment of the Daily Express on the Commonwealth budget. The Manchester Guardian congratulated Australia upon relying on sound, cautious principles of finance. "" This contrasts pleasantly with some of tlie budgetary methods followed in Europe the newspaper adds. ""The Federal Treasury rightly can boast that world trade improvement is now most noticeable in tlie Empire."" The Financial Times observes that internal adjustments, inherent in the financial relations between tlie States and the Commonwealth, still involve many difficult problems, but so far as the outside world is concerned the position of Australia is one of growing strength. These observations clearly indicate that outside Australia the Commonwealth's budget has been received with enthusiasm and that as the result of the financial policy adopted by this Government, Australia's prestige has been substantially improved. The greatest weakness in the budget to-day is the ever-increasing provision that has to be made for social services. AlthoughI believe that social services should be as generous as the nation can provide, there are factors concerning the payment of invalid and old age pensions that call for serious reflection and action on definite lines. In 1911, when we had in Australia a population of 4,500,000, invalid and old-age pensions cost £2,149,650; to-day, with a population of 6,750,000, the pensions bill amounts to £12,750,000. During this period, while our .population has increased by 50 per cent., our invalid and old-age pensions have increased by 600 per cent. The 1933 census results disclose that the age distribution of population is changing rapidly, and that an increasing proportion of the population is approaching the pensionable age group, with the result that during the next ten years, the annual increase in the number of pensions will be double that of the last ten years. The following figures show how the percentage has gone up:FOR BUDGET. Males aged Females aged Census. 65 years GO years ""Telegraph."" Bpoeial.) Per cent. Per cent. 1901 4.33 5.73 1911 4.37 0.30 1921 4.46 7.31 1933 6.38 10.07 All factors seem to be exerting a trend in the same direction, and we find that the percentage of old-age and invalid pensions to the total population is as follows:Per cent. 1911 .. 1.80 1921 .. 2.58 1933 .. .. 3.76 It will thus be seen that the financing of this system on the present voluntary basis in future years will present continually increasing difliculties. If the principle of adequate old-age and invalid pensions is to be followed-and it must bea contributory system will be tbe only alternative to an increase of taxes. It is obvious from this rate of increase, that future budgets will be crippled by payments for social services, and no one Avill in the long run be more seriously affected than those Ave desire to assist by the payment of these pensions. In my opinion, the only Avay to tackle this problem is by the institution of a scheme of national insurance. I Avas a member of the Royal Commission on National Insurance that recommended the adoption of such a scheme. National insurance Avould, I am sure, provide definite security for our aged and infirm citizens. The greatest and most constant anxiety of the wage-earner is the possibility that he and his dependants may be placed in serious financial difficulties as the result of sickness, accident, invalidity, or old age. National insurance would provide a remedy for this, one of the greatest evils in the community. The fundamental doctrine underlying the whole fabric of national insurance appears to be that all sections of the community should :be protected by the strength of the community as a whole against the incidence of misfortune that befalls a section or an individual. It is now recognized in the Old World that in order to advance the prosperity of the nation as a whole and conserve its vital forces, it is better that a misfortune befalling an individual should be distributed and borne lightly by the Avhole commimity than that the individual should be crushed by the weight of his own trouble. ^Sitting suspended from 6.15 to 8 p.m. mission's reports proved that national insurance has long since passed the experimental stage, having become an integral part of the social system of most important countries of the Avorld. In this regard Australia is far behind the times, notwithstanding the fact that we claim to lead the world in social legislation. Legislation on this subject was enacted by Austria-Hungary in 1854, Belgium in 1868, Germany in 1883, France in 1894, Luxembourg in 1901, Norway and Iceland in 1909, Italy in 1910, the United Kingdom in 1911, Roumania and Russia in 1912, Holland and Sweden in 1913, Bulgaria in 1918, Czechoslovakia, Portugual and Spain in 1919, Poland in 1920, Denmarki n 1921, Esthonia, Japan, Latvia and Yugoslavia in 1922, and the Irish Free State and Argentina in 1923. In most of those countries the original schemes have since been considerably extended, and are continually being made more comprehensive. In not one instance has there been any suggestion to abandon national insurance, and return to the less satisfactory preinsurance methods. Those who were amongst the most bitter critics of the schemes at their inception subsequently became their strongest supporters. My experience on the National Insurance Commission has convinced me that the need for such a scheme in Australia has been proved beyond all doubt. Many wage-earners are unable to provide unaided for circumstances that may arise from incapacity to work. The worker is unable to make provision for the whole of his life from the wages received during his effective working years. His greatest and most constant anxiety is that, should he be unable to continue at his employment, he and his dependants will be involved in serious financial difiiculties. Through sickness each worker loses on the average twelve days' employment per annum. One-third of the normal unemployment in Australia is due to sickness or accident suffered by the workers engaged in industry, and 6 per cent, of the Avorkers are injured annually. Many are permanently incapacitated, and more than 3 per cent, of all wage-earners in Australia are drawing the Commonwealth invalid pension. Many more persons are invalids, but because it cannot be proved that they are totally and permanently incapacitated they are not able to secure the assistance they so greatly need. National insurance will give them the necessary relief. Quite 16 per cent, of our native-born citizens are applicants for the old-age pension. The whole community suffers as the result of the wage-earners' incapacity to work. Wages to the amount of £10,000,000 are lost each year on account of sickness, and the non-circulation of this money is a",37,Budget 1935 36
71,Mr Francis,"The royal comserious matter for the worker and for trade. The resultant loss in production is estimated at four times this amount, while the social and economic burden created is enormous, and is most inequitably distributed. Existing systems of mutual and other assistance in Australia have been of great .advantage. They have served a national need, but they have failed to help adequately the majority of wagd-earners to make provision for the difficult circumstances in which they may be placed as the result of sickness, accident, invaldity or old age. They represent a stage in the evolution of national insurance. The existing friendly societies and other mutual benefit associations have expressed the fear that a scheme of national insurance will destroy their voluntary organization. The experience in Great Britain, however, has proved the opposite; the voluntary organizations there are stronger to-day, both numerically and financially, than prior to the inception of the scheme of national insurance. The membership of the British organizations 6,000,000 to 8,000,000 persons since the scheme was inaugurated, and in addition, their' accumulated funds have increased from £50,000,000 to £100,000,000. The friendly societies should realize that a scheme of national insurance is but an extension of the principles which they have advocated for years, and consequently tbey should render the Government all the assistance in their power to make the new scheme a success. The friendly societies claim that free medical treatment is the greatest benefit thej 7 confer on their members. The scheme recommended by the commission does not destroy that benefit. The only duplication is in respect of sickness benefits, which at present Benefits in connection with superannuation, invalidity, and maternity are to-day the sole function of the Commonwealth Government; they are not provided by the friendly societies. The appropriation for old-age pensions and invalid pensions since their inception has been £171,250,000, and the fact that this year's vicinity of Rabaul and along the coasts expenditure is approaching £13,000,000 should convince the Government that the institution of a scheme of national insurof protecting natives, preventing illegal ance is imperative. After long discussions with a committee of actuaries, and consultations with leaders of friendly societies, tbe then Government, in September of 1928, introduced into this Parliament a bill based on the recommendations of the Royal Commission on National Insurance. At the general elections shortly afterwards that government was defeated on an arbitration issue; there followed the Scullin Government and the depression. With the advent of the Lyons Government the financial position has improved, and, with all the information available on which the bill was drafted, with the experience of governments the world over in the administration of schemes of national insurance to guide them, the Government should have no difficulty in introducing a measure to provide for national insurance covering sickness, invalidity, and old-age. The first step should be the establishment of a national fund providing for old-age and invalid benefits only; medical and unemployment benefits could be has increased from added as the organization was built up. Relief to the unemployed and the provision of employment are urgent, but. no scheme of unemployment insurance could give immediate benefits. Many months must elapse after parliamentary approval is given, before the organization could be set up, and contributions from wages would have to be made over a period before unemployment benefits could be paid. I desire to draw attention to the delay of the Government in providing patrol boats for northern Australian waters. For over two years the proposals of the Government in this respect have been made available to the press from time to time. The public were told that there are inadequate. were to be three patrol boats, whicli, among other duties,' would be available to render assistance to the air liners plying backwards and forwards over the Timor Sea should such assistance be needed. Other areas to be patrolled were the Barrier Reef, northern Queensland generally, and the waters in the of New Guinea. The boats and their crews were to be engaged in the work fishing, particularly on the Barrier Reef, preventing breaches of quarantine regulations, and checking the drug traffic. So far, however, only the Defence Department seems to have done anything at all. It has placed an order for a patrol boat which is now under construction, but, as far as I can ascertain, the other departments, whether the Department of the Interior, the Department of Trade and Customs,, or the Territories Branch, have done nothing at all. exists in the north at the Government's delay, and almost every Queensland newspaper that one picks up contains some reference to the matter. The following article, published in Courier-Mail, of Brisbane, clearly shows that, because the Commonwealth Government has failed to carry out its promise to patrol the northern waters, the efforts of the Commonwealth departments to cheek the operations of the Japanese sampan crews are nullified:Commonwealth health and customs authorities in Brisbane said yesterday that, under present conditions, they were severely handicapped in checking tlie landing of Japanese sampan crews on the North Queensland coast. They expressed confidence, however, that the use of speed boats, as approved by the Federal Government, would place their work on an improved footing. The officials were commenting on the statelate to move in the matter. Proving ment made in Sydney by a Torres Straits shipping master that sampan crews, after long journeys from the East, landed on the coast against quarantine and customs regulations, and sometimes came in contact with the natives. "" Until the launches suggested by the Federal authorities are provided, we are really working in the dark; but wo arc doing all we can with the machinery at our disposal,"" said Dr. C. R. Wiburd (Commonwealth Health Department). take any action it was necessary to make direct contact with the sampan crews. Strict Watch Kept. Any persons who were suspected of having come into contact with sampans were, however, kept under close surveillance, to prevent Reef, would be welcomed by Australians the possibility of spread of disease. A strict watch was kept on the crews of luggers working between Thursday Island and Townsville. The Collector of Customs( Mr R. B. Curd) agreed that the crews of sampans would probablv find it easy to land on the coast, particularlv about the Gulf of Carpentaria. They would, of necessity, come ashore for supplies of water and food, and mission authorities had. complained that they had come into contact with the blacks. Mr Francis. The Brisbane Telegraph published the following warning regarding the same matter:Daring Activity in North. Japa.nese sampan crews in Northern Australian waters had now reached such a pitch of arrogant defiance of this country's Jaws that they were almost openly landing on parts of the mainland coast north from Cooktown, said a northern shipping man to-day, commenting upon the published statement by The greatest indignation Captain L. S. Diamond, well-known in Torres Straits waters, that the Japanese had dropped all pretence of concealment and were openly working what remained of the trochus shell ground's along the Barrier Reef. the The article also claimed that the Australian shell industry would be exterminated within a very short period, as shells of all description were being removed by the Japanese sampan owners. come from New Guinea. have made are not isolated. The Japanese sampan owners are defying our laws. Press reports indicate that scores of sampans are operating, arid the Commonwealth Government, despite its promises, is doing nothing to patrol the waters which the sampans are pillaging. Again, I emphasize that, unless the Government moves quickly, it w ill be useless to attempt anything, and it w ill be too that not just one or two, but many, sampans are engaging in illegal fishing in Australian waters, the following comments in the Brisbane Telegraph are of interest:SCORES OF SAMPANS. Work Openly. Sydney, March 31. Before bis department could Captain S. L. Diamond, a Torres Straits shipping master, who arrived in Sydney by the Taiping to-day, said that the Commonwealth. Government's decision to use speed boats to check Japanese sampans operating in the trochus shell areas of the Barrier engaged in the industry. Captain Diamond proceeds to say that in the last eighteen months he has seen scores of sampans at work. Sometimes they work in the same areas in which the Australians are working. Bitter resentment exists among the Australian fishermen, and a serious clash seems imminent.",39,London Views It And Over And Over
72,Mr Jennings,Simila r complaints,41,Fishing On The Barrier
73,Mr Francis,"The complaints I 'According to a paragraph in the Courier-Mail, Mr Francis Edgar Hocking informed the Tariff Board in Brisbane that 'the Australian shell industry was practically in the hands of the Japanese, who were defying every endeavour to prevent their operations. He told the inquiry that the Commonwealth departments did not have sufficient power to combat the menace. Another illustration of the extent of the depredations of the Japanese sampans is the report that 25 sampans were recently poaching in waters north-west of Western Australia. So impressed is the Brisbane Chamber of Commerce with the dangers threatening the Australian shell-fishing industry, that it has carried a resolution protesting against the delay in carrying out the undertaking to provide patrol boats for the northern waters. The newspaper which published the text of that resolution also, on the same day and in the same column, published a report that an Australian trawler had been seized for having engaged in illegal fishing in the waters of New Zealand and the offender was to be prosecuted. extracts from newspapers prove my contention that the owners of sampans are acting in wholesale daily defiance of our laws concerning quarantine, customs and fishing, and that the Commonwealth departments are unable to prevent them. The departments are working in the dark, but they are doing all they can with the machinery at their disposal. The Bishop of Carpentaria, at the meeting of the Anglican Provincial Synod at Townsville recently, declared .chat the. difficulties involved in looking after the natives were accentuated by the presence of the Japanese sampans and their crews. The statements I have made are based on reports in most reputable newspapers. think, to make it plain that the Commonwealth Government has grievously failed to carry out the promise it made two years ago to take action to r i d Australian waters of the Japanese poachers. I trust that the Minister, in replying to this debate, will inform the committee of what it has done and when we may expect the Government's promises to be kept. support the amendment moved by the Leader of the Opposition ( Mr Curtin). The honourable member for Wentworth ( Mr E. J. Harrison) made sneering references to the record of the Scullin Government, but in doing so he exposed the skeleton in the cupboard. This Government definitely pledged itself before the last election to relieve the suffering among the unemployed youth of Australia. Australian mothers, no doubt, voted for the supporters of the parties now in power because of their promises, but so far nothing has been done to honour those promises. I am at a loss to understand, not only how the Government can continue to occupy the treasury bench in the face of its display of hypocrisy, but also how its supporters can have the audacity to rise in this chamber and claim that the Ministry has taken action to remove the cause of suffering among the young people of this country. About 100,000 boys and girls leave school every year, and only 60,000 of them are absorbed into industry. Forty thousand are compelled to walk about the streets in a shocking state of poverty. All these The manhood and the industries of Australia will languish if provision is not made for the absorption of the young men and girls who at present are compelled to live on their parents. Australian mothers and fathers sacrifice many of the pleasures of life to provide their children with education to fit them to take a place in industry, but after the children leave school, no industrial activity exists for many of them. The Commonwealth Government, I know, will take shelter from public scorn by declaring that it is not the responsibility of the Commonwealth to remove the cause of my complaints. It , however, has a great responsibility to Australian youth. The United Australia party cannot disclaim I have said sufficient, 1 that responsibility. party. the Country party, which has at all times been ready to dip its hands into the Treasury on behalf of the interests it represents. The young men and women of Australia are just-as essential to the economic welfare of the Commonwealth",41,Fishing On The Barrier
74,Mr Mahoney (Denison) [8.20],I,42,Fishing On The Barrier
75,Mr Boseveak,No r can the Country,42,Fishing On The Barrier
76,Mr Mahoney,"That is so; nor canas are the wheat-growers. They are required as replacements in industry for the men and women who have to retire because of age. Without fear of accurate contradiction, I declare again that no supporter of the Government can justifiably take an opportunity in this House to claim that the Government has honoured its obligations. I concede that it did vote to Tasmania £25,000 for forestry, hut the Tasmanian Government iu spending that money did a very good job on behalf of the unemployed youth of the State. I have visited the camps set up in Tasmania and seen the wonderful conditions of training that have been carried out under the Tasmanian Forestry Department and the Minister( Mr Cosgrove). Mr Cosgrove has spent well the money doled out «by this ""humanitarian"" Government known as the United Australia party Government, or the ""Unemployed or poverty party"" government. Before the last elections, the Commonwealth Government said that it would do its utmost to solve the unemployment problem, and this year £100,000 has been voted for the relief of unemployment on special works. It , however, has no money to give to the State governments to enable them to carry out a policy which will result in the re-engaging of Australian youths in industry. If the Commonwealth Government were sincere, it would cooperate with the States and have a policy placed in immediate operation which would fulfil its promises in this respect. Its principal adviser, a member of the United Australia party, who was selected to be in control of unemployment, is globe-trotting to-day. What is the objective of his world meanderings? seeking information for the Government, or is he seeking to form a scheme to enable the Government's promises to be fulfilled? I submit that he has made no attempt to do that. The only person I know who has achieved any benefit is the honourable gentleman himself. gentleman referring? the honourable member for Parramatta ( Sir Frederick Stewart), Order! Denison must confine his remarks to the matter before the Chair. the Government. honourable member is going outside the Standing Orders in criticizing any one. in criticizing member is not entitled to reflect on honourable members. if I have touched the Government on a sore spot, but supporters of the Government are always reflecting on the Scullin Government. vernment had to nurse this country through a serious crisis, but the present Government has been in power in a period of prosperity unexampled for many years, despite which it has neglected to honour its obligations. The Government has done nothing to alleviate the sufferings of the unemployed. The least that should be given to those unfortunate persons each week is four days' work or sustenance equal to four days' pay at the basic wage rate. I think the average family in Tasmania is a man and wife with two children. Single men should receive each week two days' work or sustenance amounting to two days' pay at the basic wage rate to enable them to live. They require at least that sum to enable them to live; otherwise they would be unable to meet their obligations. Surely the Government will admit that they are entitled to sufficient money to enable Is he them to pay house rent. If their wages merely covered the cost of food the Government would be imposing upon the owners of the houses which they occupy. Throughout the depression many landlords received no rent whatever from their properties, but, of course, had to pay rates and taxes on them as usual. The treatment which the unemployed section has received is very different from that meted out to the wheat-farmers, to whom substantial subsidies have been paid. Among the members of this Parliament are wealthy wheat-growers who have received this 'bounty. The unemployed, The honourable member for as well as the unfortunate ""cockies"",",42,Fishing On The Barrier
77,Mr Peice,To whom is the honourable,43,Fishing On The Barrier
78,Mr Mahoney,I am referring to,43,Fishing On The Barrier
