speakerGroups,speaker,theText,pageNumbers,title
127,Mr Blackburn (Bourke) [5.18.],"means "" pitilessness, cruelty and mercilessuess"". I cannot understand a civilized nation transvaluating in this way, and converting pagan vices to Christian virtues. Ruthlessness is cruelty. Ruthlessness is the determination to do whatever one likes without regard for the lives or happiness of others. In war one conceives that armies may be ruthless, but even there a code of international law precludes that; yet my mild friend from Flinders( Mr be utterly and entirely untrue. WhatRyan), for whom I have the greatest respect, advocates a policy of ruthlessness towards one another in this country as an essential to winning the war. That means that we should treat each other without pity or mercy as an essential means towards winning the war. has no other meaning than that. I can understand that the honourable member, having committed himself to the policy of ruthlessness, believes that the people have no option but to accept that policy. So that the people shall have no means of punishing^those who practise ruthlessness towards them we shall constitute a national government, because that will mean that every one and every party in this country will take an equal share of the responsibility for anything done. Those who advocate a national government in this country do so to achieve, not the greatest measure of unity, but the greatest measure of irresponsibility. They desire a system of government not responsible to the people. The only thing which makes a government responsible to the people is the party system with a government kept in check by a critical opposition. That is the only means by which a government can be held responsible for its misdeeds. It is only by the people being able to put out the existing government and put. in another government that they have the opportunity to govern themselves. equally responsible for what has been done, the people have no choice whatsoever. It is only when the parties desire to put upon the people some piece of legislation or a policy which the people do not desire that they come together and form a national government or a national policy. country great issues still divide the people, and the only result of forming a J/r. Blackburn. national government would be that the will of the people would be avoided by the device of avoiding responsibility. A great deal has been said about the relations between Australia aiid Great Britain. Unfortunate things have been said on both sides. It is unfortunate that there should be in this country people who believe that Great Britain has behaved badly towards Australia and let us down. I believe that to ever we did at the start of this war we did on our own initiative. We were not requested to do anything. When we said at first that we should not do anything, that was accepted by Great Britain and even defended in British newspapers and Ruthlessness by British spokesmen. What we did we did on our own initiative, and we did not thereby establish any claim on Great Britain or entitle ourselves to say that we have been deserted by Great Britain. Strongly as I object to that, I object more strongly to the people who say that, but. for Great Britain, this country would not exist. If this country at the beginning had done for itself all that it could have done, it would not have been in its present peril. But I realize that the people who believed that we ought to send men and arms abroad believed that that policy was in the interests of Australia and they applied it primarily in the interests of Australia, not of Great Britain. The less we say in the future about our past relations between Australia and Great Britain the better. We have to understand that Great Britain is fighting for its life in what I believe to be the principal theatre of war. We ought to understand that, and ought not to put ourselves in the position of blaming either ourselves or Great, Britain; It is unfortunate that ° friction should exist between the British But. if all parties are Government and the Australian Government as it appears to exist. I should not say that one was more responsible than the other; responsibility rests equally upon the British Parliament and Government and our own Parliament and Government. It is folly, but it is only one example of the friction that is I object to that. In this weakening our effort. We are not using to the greatest value the Government organization we have in Australia. We should develop a hierarchical system of government by which the Commonwealth would not attempt to do everything itself, but would devolve powers upon the State Governments and upon municipal and local authorities. There should be a diffusion of power throughout Australia so that authority would be brought as near to the people as possible. I have expressed that opinion before and I express it again. It was a great mistake for the Commonwealth Government to enter into the domestic matter of the Werribee beef ban. The Victorian Government had its own policy and had expressed its mind over and over again on that subject, and it was folly to overrule the State. All should co-operate, and until we do so we cannot achieve the greatest efficiency of government that we can get in this conn try. This is the thirteenth week of this year. In that time we have had 340 sets of regulations and a number of orders, which to all intents and purposes have the same effect as regulations. Regulations are being turned out at the rate of more than ten a week. Orders come out at about the same rate. One thing which has a bad effect on this country is that we are departing from the system of government by legislation with which the people are familiar and substituting a system of government by regulation .which the people do not understand. I am a man whose business it is to know something of regulations, but I cannot keep track of them. I know one lawyer in Victoria who says that he does keep track, because he devotes one hour a day to the regulations as they come out. I asked him whether he would not be inclined to agree that in respect of every matter dealt with by regulation there are at least two inconsistent regulations. He said that that was probably right. If one went, through the sheaf of regulations one would find that nearly every matter covered is dealt with inconsistently, at least twice, by different, tion than matters of regulation. regulations. The regulations do not dovetail into one another. This policy of government, by regulation should be used as carefully as possible. Parliament should legislate upon the main topics, and the Government ought not to continue to make enormous changes merely by regulation. I repeat my suggestion made on another occasion that before regulations are made there should be greater consultation, not merely of members of parties in this House, but also of interested people outside. It is announced in the press that a regulation is to be made and sooner or later a regulation is made, but its form is different from thai f oresbadowed in the press. No one knows whether the press announcement is a true forecast of the regulation or not. It is desirable for us to get back as near as possible to the old system with which people are familiar. Regulations should be made to deal with details of government and organization. But, if we are to continue to use the present system, I make two suggestions, first, that there should be frequent consultation on regulations on various subjects, so that we shall not have a bundle of regulations dealing with the same subject; and, secondly, that there should be periodical acts of parliament passed to deal with matters covered by regulations, in order to place them on a statutory basis and enable them to be discussed and considered by Parliament in their relation to one another. lations in statutory form? but, after the regulations have been in operation, the Government should submit to Parliament a bill to deal with the topics covered. Parliament would then be able to say whether it would continue the Government's plan or alter it. Of course one expected that this Parliament would support the Government. That is the natural thing to expect. But, at, any rate, Parliament would.have the right to reject what the Government had done, and the Government, would not make some of the regulations which are now being made if it had to submit the proposals to Parliament. Matters of statute would receive much more mature and careful consideraRegulations are very difficult to follow. Indeed it is difficult to understand what the regulations have done. I have before me a memorandum from one department which says that hotel keepers need have no worry, because the contracts adjustment regulations give relief to them. I",36,Curtin
128,Mr Falstein,Consolidat e the regu,38,Curtin
129,Mr Blackburn,"Not necessarily,have studied the contracts adjustment regulations, and I cannot see where they relieve hotel keepers of -the problems which administrative ability should be assobeset them. Mr Justice Richardson said yesterday. hear that such a distinguished lawyer as he confirms my belief. There is no doubt that the people, of this country more pardays, but because the Labour party ticularly, because it is not so bad in Great Britain, are finding their liberties and their traditional way of life and action taken from them. ""We are told that we are fighting for their maintenance, but we are losing them in the process. We do not have to do that at all. Ministers are talking to us in the language of Duces and Fiihrers. They give orders and do not explain. That is not the government of a democracy. The Government, in effect, sayst am the blessed Glendover; 'Tig mine to speak and yours to bear. The Government could get the co-operation of the people, of every association of people, and of all trade unions by taking them into consultation, and by vesting trade unions with power to deal with minorities instead of delivering at the pithead orders under iStatutory Rule No. 77 as the policeman delivers summonses. I believe that the people of this country would have a different spirit if there were less dictation and more consultation. You cannot infuse a different spirit into the people from above or by throwing orders to them. If there were fewer speeches by Ministers, fewer public statements, fewer broadcast utterances, tin's country would be a lot happier. Speeches disturb and trouble this country. of the honourable member for Flinders They should be made only on matters of great moment or in order to explain coveramen t policy. am participating in this debate because of experience. We need the best brains of the last two speeches that have been delivered. The honourable member for Bourke( Mr Blackburn) has entirely missed our point concerning the desirability of the formation of a national government. I have advocated the formation of a national government ever since my election to this Parliament, but for reasons other than those suggested by the movehonorable member for Bourke. My view Employment) is that honourable members on both sides of the house who possess great and proved ciated with a national government in such critical times as these. The fact is that honourable gentlemen sitting on this side of the house have had long years of administrative experience which could be used to great advantage in these will not agree to join in a national government those honourable gentlemen must confine their activities to such work as is open to private members of the Parliament. The Prime Minister had a good deal to say yesterday about the need for unity in this country. I consider that there is far more unity among the Australian people than there is among the members of this Parliament, although we should, in fact, set a good example to the general community. I do not reflect upon the capacity of Ministers, because they are really raw recruits. They came into office only a few months ago and are doing the best they can in the circumstances, but the plain fact is that they lack the administrative experience which would enable them to work rapidly. gentlemen opposite complained that we were working too rapidly. vernment were formed, the Minister for Labour and National Services( Mr. Ward) would find himself on the back benches. My desire for a national government is due to my earnest wish that the very best brains of the Parliament shall be at the service of the country in these momentous times. I support the remarks ( Mr Ryan) in this connection. To-da.y certain honourable gentlemen opposite are endeavouring to administer the affair.* of their departments without the requisite the nation to help us to make a maximum war effort. Question resolved in the affirmative. Motion to DISALLOW REGULATIONS. That the National Security (Waterside Regulations under the National",38,Curtin
130,Mr Hoj.t,That is what His Honour,39,Waterside Employment
131,Mr Blackburn,I am glad to,39,Waterside Employment
132,Mr Marwick (Swan) [5.35],I,39,Waterside Employment
133,Mr Waed,I thought honourable,39,Waterside Employment
134,Mr Marwick,If a national go,39,Waterside Employment
135,Mr Holt (Fawkner) [5.40],"ISecurity Act, made by Statutory Rules 1942. Xo. 19, be disallowed. These regulations are a political outrage. The issue of them is a piece of administrative vindictiveness directed, at the behest of a militant majority, against its industrial competitors. This is ruthless 'use of political power for partisan purposes. It is a merciless repression of the rights of hundreds of Australian workmen, many of whom are returned soldiers. The Opposition is constantly raising objection to the use, by this Government, of emergency war-time powers for the fulfilment of its political policy. It would be difficult to imagine a more blatant illustration of the application of this policy than that provided by the issue of these regulations. The principal purpose of the regulations is to establish a committee at the port of Melbourne to register employers and employees and to regulate labour on the waterfront. It is proposed that a committee consisting of a chairman, appointed by the Government, and three representatives each of employers and employees shall be appointed for the purpose of maintaining the register of -employers and employees and of making recommendations for the better working -of cargo at the port. that? tive, and a proper purpose for the issue -of regulations. The Opposition does not -challenge the wisdom of setting up this machinery. In fact these regulations 'have flowed from action initiated while the previous government was in office. Under the Transport Workers Act a -committee of five persons, a government -nominee as chairman, and two representa-tives each of the employers and employees supervised operations at the port of Melbourne. The chairman was an officer of the Department of Commerce. One of the employees' representatives was a member of the Waterside Workers Federation and the other was a member of the Permanent and Casual Wharf ""Labourers Union. union. 'WorkersA c t "" at one time had a familiar ring in this chamber. The act was most unpopular with the workers on the waterfront. It was known as the "" dog-collar "" act. At the request of members of the Waterside Workers Federation it was repealed, and its repeal involved the dissolution of the committee. It was repealed on representations to the effect that such action would lead to industrial harmony on the waterfront and to greater activity in the loading and. unloading of cargoes. The committee had done useful work, and the suggestion was put to me while I was Minister for Labour and National Service that similar machinery should be set up in order that the good work could be continued. Following the representations made to me. several conferences were held under the auspices of the Department of Labour and National Service. As Minister, 1 occupied the chair at the early conferences, but subsequently Mr Pat. Sheehan. an officer of the Department of Labour and National Service, presided. Mr Sheehan is well known to honourable members on the Government side of the House. He has done valuable work for the department, and I have pleasure in paying this tribute to him. I do not think that any honourable member opposite, however, would go so far a3 to say that Mr Sheehan would look on waterfront problems with a prejudiced eye. He is well known in the Labour movement and, on different occasions, has appeared as an advocate for industrial unions. He is in every way fitted to preside over conferences of this description. Subsequently Mr Sheehan submitted a number of recommendations to me as Minister. One of these was that a committee, similar to the committee which had operated under the Transport Workers Act, should be appointed to regulate work at the port of Melbourne. This was to be regarded as experimental, and if the method was considered to be successful at that port, the principle was to be extended to other ports. The recommendation was that the committee should consist of a. chairman nominated by the Government, four representatives each of the employers and employees. Of the four representatives of the employees, three were to represent the Waterside",39,Waterside Employment
136,Mr Rosevear,What is wrong with,40,Waterside Employment
137,Mr Holt,It is an admirable objec,40,Waterside Employment
138,Mr Rosevear,"That is the ""scab""",40,Waterside Employment
