speakerGroups,speaker,theText,pageNumbers,title
78,Mr Spooner,"Although the interdecisions, but quite another matter for those decisions to be carried into effect. 1 do not always blame Ministers. They are human, and have no more hours in a day than has anybody else. Ministers cannot possibly give personal and detailed attention to the execution of every matter that passes through their hands, but must depend not only upon, the highest executive officer, hut also a huge staff, the members of which are remote from him personally and unknown to bim because of lack of opportunity to meet them. Those men should be charged with the duty and responsibility of carryprinciple can be applied to government ing matters through with expedition. What man in this House who has held ministerial responsibility can deny that delays occur even when Australia is in the gravest peril? I maintain that even now it is possible for the Government to cut away red tape. mentary under-secretaries ? to their appointment, but I am not advocating it now. I believe that Ministers should have understudies who can help to push through the details of matters under their administration. The Minister should have power under National Security regulations to say that such files must be dealt with free of impeding regulations, and if they are not so dealt with, tbe person at fault should be held responsible to the Minister. Only last year, when the Man-power a.nd Resources Survey Committee travelled through Australia, the committee took evidence from a high public official in one of the States. He was asked the reason for certain delays and his reply was: "" There is an Audit Act. After the last war, a royal commis= . ion inquired into certain matters which, it was alleged, had been done wrongly during the war period "". The worse thing that can happen to Australia is that an enemy should gain a foothold on OUT shores. Audit acts are only a secondary consideration. I have the utmost confidence in public officers. T was going to say in 99 per cent, of them, but I do not know why T should exclude even 1 per cent. I would not fear to remove the requirements of the Audit Acti n respect of matters urgently needed for the protection of Australia. It has already been partiallydons in connection with the production of munitions, which has been placed under the control of a DirectorG-eneral. grade move. I think, it was a very sound move, and Australia has benefited enormously from the speeding-up of production which has resulted from the greater freedom enjoyed by that department. The same departments proper to a much greater degree than ever before. In June of last year, the Man-power Committee inspected the construction of the graving dock in New South Wales. I recalled then that T, in another sphere, had been interested in negotiations leading up to the choice of Woolloomooloo Bay as the site for the dock. That was in 1937. We are now in 1942. five years later, and if that dock were now in use, it would be of tremendous advantage to our American allies. It is not completed. I have a conviction that if its construction had been entrusted to the Americans, or to some of our enemies, it would have been finished long before now. I also believe that one of our great Commonwealth departments fell down on the job in not pushing the construction forward more rapidly. The Department of the Interior failed to take advantage of the services of outside engineers and technicians, who could have brought their knowledge to bear upon problem? associated with this work. terial responsibility for that. Air. SPOONER I agree. There must be ministerial responsibility for everything. I did not speak yesterday upon the subject of the delegation of ministerial powers, but I agree entirely with those who spoke of the need for the retention of ministerial responsibility. I do not believe that men who assume ministerial rank desire to evade responsibility. Unfortunately, when they get into office, they find themselves tied up with regulations and procedure, so that they are unable to get to the root of the matters with which they have to deal. We should make it easier for them to",21,Curtin
79,Mr Morgan,What about parlia,22,Curtin
80,"Mr Spooner,",I have no objection,22,Curtin
81,Mr Calwell,That might be a retro,22,Curtin
82,Mr Spooner,I do not think so.,22,Curtin
83,Mr Calwell,"There must be minisgrapple with, problems of administration. If Ministers of the Crown had forced upon them the responsibility for making some of the appointments to their departments it would be better for every one. At present, Ministers often do not take steps to satisfy themselves as to the qualitime of crisis. I admit that the State fication of those appointed to high positions in their departments. I admit that AO Minister can accept responsibility for yunior appointments, or even for semisenior appointments, but it is of vital importance that he. should scrutinize very carefully the qualifications of every man whom it is proposed to place in an important position. If the wrong man be appointed, it may be assumed that he does not possess the quality of obtaining effective service from his juniors, and thus his own inefficiency percolates through his entire staff. The pity of it is that some of the men appointed to high positions would be capable of rendering excellent service in some other sphere. In their present positions, they are square pegs in round holes. Ministers should be prepared, if necessary, to break friendships. Ministers become very appreciative of the personal qualities of some of those who work for them, and it is a difficult thing to say to some one, "" You are not the man to push through this policy which my Government has decided upon for the successful prosecution of the war"". However, that is what must be done in Australia to-day if we are to have effective driving force within our administration. In order to obtain this there must be a greater measure of freedom from restricting regulations, and we must appoint men who are more suitable to their positions. In many instances, this would entail the appointment of younger men. There is an unfortunate tendency, when men are being sought to fill high executive positions from outside the Public Service, to select men with big names, it being thought that, because of the prestige they enjoy in the community, they must be good administrators. is not always a fallacy, but it sometimes is. Some such men have had all their successes in the past. The Government should select men, not for their past records, but for their future potentialities, and for this it should choose men preferably in their forties. They can be Mr Spooner. found if the Government will look for them. We want men who will have some years of active government service in front of them, if need be; at any rate, men who can spare a few years to help in the administration of the war effort at this Government services have been combed fairly effectively, but that was not done until recently. Until a few months ago, some of the best administrators in the Commonwealth were still in the State services. Apart from these, however, there are still men attached to local governing bodies, and others in the business world, as well as practising architects, engineers, solicitors and accountants, with experience and ability, and the desire to serve their country, who could be attached to the administration, and who would help to infuse energy and enthusiasm into it. top jobs. all cannot get top jobs. them. of such men who do not seek top jobs, but who are prepared to put forward their maximum effort in the service of their country. Some recent regulations issued for the security of the country have had the effect of placing many men in the position that they cannot fully occupy their time in their professions. I refer to engineers, architects manipulators. member has mentioned the members of the stock exchange. I shall not call them manipulators, as he did. Many of them are men of experience, with outstanding qualifications and abilities, who could quite profitably be brought into the service to do a job for the Government. The That secret of such success as our enemies have achieved lies in their ability intensively to organize their own affairs. They have done what we have failed to do; they have more completely used the national resources available to them. They have departed from stereotyped methods and have used initiative. We must fight them with their own weapons. Not only must",22,Curtin
84,Mr Calwell,Such men want the,23,Curtin
85,Mr Spooner,That is not so. They,23,Curtin
86,Mr Calwell,They all are after,23,Curtin
87,"Mr Spooner,",There are thousands,23,Curtin
88,Mr Calwell,Stock exchange,23,Curtin
89,Mr Spooner,"The honorablewe send our young men into the fron t others who have charge of the expenditure line to risk their lives, not only must we of public moneys. The Audit Act was not find technicians to go into the factories passed without a very good reason. The and make munitions, but also we must AuditorjGeneral was made independent find men who can make our administraof Parliament, so that he could criticize tive organization function like a machine. Ministers impartially and without fear There must he no delays, no hitches, and of victimization or interference. It was no injustices. Let us be frank. The found very necessary, in the early public are to-day suffering injustices, in development of the British parliamentary many cases gladly suffering them, because system, to appoint an official to audit they are necessary in the interest of the public funds. The things that happened nation. because of the way in which the adminisI have in mind particularly the things tration is carried on by men who do not which happened under Lord Holland, the properly understand how to administer. elder Eox-prov e conclusively how necesThe question which I asked to-day sary it is that money voted by Parliaregarding the immobilization of small ment should be expended in accordance craft along the coast and in the rivers with the wishes of Parliament, and the estuaries is a case in point. But that need only be mentioned as one of hundreds of instances. The things which the honourable member for Robertson was have to be done by the Government can an ornament, and its predecessors, found bo done in either a correct way or a clumsy it desirable to introduce the cost-plus way. Unfortunately, they are often done system and to exclude from the private in the clumsy way and trouble is made for munitions annexes the permanent officials people who do not deserve to be inconof the Commonwealth Public Service who venienced and who desire only to help might not have been quite so ready to the country in the conduct of the war. pass expenditure as perhaps were others We are not lacking in organizers. We who were not public servants but who, in are just as good organizers as are the some instances, were the accountants of Germans or any other nation. We have the firms that were making munitions brains in Australia which can do any for the Government. That is a most unjob. Let the Government use them! Like the Quaker, I speak as the spirit moves me. I had not intended to contribute anything to this debate, but the speech of the honourable member for Robertson ( Mr Spooner), who has had a long record as a Minister of the Crown in New South Wales, impels me to contradict some of the statements that he uttered, or at least to put the other point of view. I do not disagree with the general purport of his remarks that the best brains in the community should be ut-'cd in the service of the country in a time of unprecedented crisis, and that every body who is anxious and willin g to serve should be found a position in the service of the nation. But I do disagree with the method by which he proposes to bring about that very desirable change. I do not favour the suspension of the Audit Act. In my opinion, this statute is :i very necessary safeguard against peculation by Ministers and officials, and by They are suffering injustice in the reigns of the early Georges-and I regret that the Government in which desirable arrangement to allow to persist, and this Government w ill be f a i l in g in its duty if it permits the accountants of companies which are making munitions for the Government to audit the accounts that the companies in question submit to the Treasuryi n order to receive payment for the munitions. The cost-plus system has so many defects that it would be far better for the nation if the Government took over the control of the whole of industry in order more effectively to prosecute the war. We on this side of the House seem to be very tender-hearted when it comes to interfering with "" b i g business "" in accordance with the planks of the platform, of the Labour party. In peace-time we declare that we wish to nationalize industry. In war-time, the Government which should exercise f u l l control of industry forgets about nationalization. The Government should pay the cost of manufacturing instruments of war and at the conclusion of hostilities, it could return the businesses to the owners.",23,Curtin
90,Mr Calwell (Melbourne) [3.52],"the manufacture ? the Public Service could undertake the work, the Government should appoint the managers of the factories as public servants; and they would not then be answerable to a board of directors concerned primarily with profits. They would be answerable to a Minister of the Crown. I regret that at this moment, I have not brought with me some illuminating figures to instance what profits are being made in many munitions factories in Australia. These factories are receiving not only the cost of their materials, but also a profit and establishment fees. They are doing so well that it is no wonder that the Joint Committee on War Expenditure, in the report which it presented to Parliament yesterday, found that undue and fantastic profits are being made by private manufacturers of the implements of war. mittee on War Expenditure did notpresent its report yesterday. The information that the honourable member mentions was published in the press. were presented to the House, and so many notices of motion for the disallowance of regulations were given yesterday, that it is pardonable for an honourable member to forget the order in which the reports were tabled. The honourable member for Robertson declared that the public services of the several States had been combed in order to find the best men for the purpose of assisting the war effort. That was not done in regard to the public service of at least one State. Ministers and permanent heads of State departments, like a lot of other people in the community to-day. think primarily of themselves and they do not wish to lose good men. As Statutory Rule No. 77 of 1942 has been, used effectively against striking coalminers, striking members of the building trade and other people who show contumacy, particularly when they belong to the working class, the Government should n=e the statutory rule to compel State Ministers and State departmental heads to release officers when Commonwealth departments demand their services so urgently. When travelling from Canberra to Melbourne a week ago, I met an official of the Aircraft Production Commission. He informed me that in. one State tool-makers were employed by the Railway Department. The Aircraft Production Commission sought their services for the urgent manufacture of aeroplanes, but the State Commissioners of Railways in this instance insisted upon retaining their services and to date no finality has been reached. The way in which to deal with recalcitrant officials who act as these Commissioners of Railways have done, is to apply to them Statutory Rule No. 77. To date, the Government has been reluctant to do that. I agree with those honourable members who believe that the days of State Parliaments are finished, and that if they are not finished, they ought to be. The quicker they are finished, the better it will be for Australia. I urge the Joint ComMinister for Air( Mr Drakeford) to bring to the notice of his colleagues the necessity for effectively combing the public services of the States, as has been suggested by the honourable member for Robertson. New .South Wales has lent to the Commonwealth several hundred men out of a total staff of several thousand ; but Victoria, has lent only twenty men out of a staff of several thousand. That is not sufficient. The Commonwealth requires, not ordinary clerks, but men possessing considerable experience and ability. In my opinion, more administrative ability and experience is to be found in the public service of Australia than in the business world. Many people who hav e gone into the business world 7 did so because they failed to pass the examinations that are set for entrance into the Public Service of Australia. Some of those who now want to obtain admission to the public services, because he+ exigencies of war have deprived them of their occupations, formerly spurned the civil service because the remuneration was low, although that was offset to some degree by security of tenure. Those persons wanted to get rich quickly on the stock exchanges, and in the legal and other lucrative professions. Now that their occupations are vanishing as the result of the activities of the Department of War",24,Curtin
91,Mr Badmak,Who would supervise,25,Curtin
92,Mr Calwell,If no member of,25,Curtin
93,Mr Badman,The,25,Curtin
94,Mr Calwell,"S o many reportsOrganization of Industry, in addition to other causes, they think that the time has come when they should find for themselves a niche in some department of the Public Service. I assure the honourable member for Eobertson that most of the people who want to enter the Public Service desire to take tie top jobs. That accounts for the fact that the Minister for Air has been inundated in recent months with thousands of applications for appointment to the administrative section of the Royal Australian Air Force. tised. has always been a standard, or standing advertisement for persons required for the administrative section of the Royal Australian Air Force, but I have been informed that the Air Board has received many thousands of applications from persons who want to join the administrative section. There are many more applications for appointment to the administrative section to-day than there were twelve months ago, because the applicants want senior rank and high salaries. might be such that they consider that it is very necessary for them, in order to cover their commitments, to obtain a position that will carry remuneration similar to that which they received in civil life. The public services of Australia have been very well conducted, on the whole, for many years. In the very early days of our public services, patronage was rife. Persons were appointed to positions because of their relationship to Ministers of the Crown. Some Premiers of Victoria secured positions for their sons, and in one notorious instance, a Premier promoted at least 14 persons in order that his son also would secure advancement. The nepotism which obtained in those days was so rampant and obnoxious that a Public Service Act was passed in Victoria for the purpose of preventing further abuses. Similar legislation was passed by other State Parliaments and later by the Commonwealth Parliament. The purpose was to ensure that applicants for appointments to the Public Service should possess merit, and that no other qualification should obtrude in determining whether a public servant should be promoted. With merit, of course, goes seniority and other factors. If , because of the war, we cut those safeguards adrift, we shall open the floodgates to favouritism and every other "" ism"". Instead of securing efficient service, we shall cause discontent and dissatisfaction so that the last position will be much worse than the first. I believe in utilizing the services of every one, as the honourable member for Robertson suggested, but I cannot countenance the things that he proposed. If delay has occurred in carrying out ministerial directions, the public servant has not always been at fault. Ministers are late in making up their minds, and then make impossible demands to try to meet the difficulties of the situation. No Minister could to-day say to the Public Service, ""Find so many thousand aircraft, because we need them "". The fault lies in the failure of governments in this country for years to lay the basis of an aircraft production scheme. You cannot produce something out of nothing. The production of aircraft requires a lot of things, including machine tools, material, and trained Their economic condition labour. The hard-worked Public Service of the Commonwealth cannot do to-day all that is required to be done, primarily because successive ministries in this House failed to do the things that they ought to have done in the national interest. These people knew what ought to be done, but because of fear of electors or some other consideration which involved heavy taxation, they left the responsibility to some body else. Colloquially, they "" passed the buck "". Those with a keen sense of salesmanship, who come close to Ministers, have the opportunity to impress the Minister whom they are serving with their qualities of mind and their capacity for leadership. Basking in the full sunlight of ministerial recognition these people have, in many instances, secured advantages over their fellows, who are very good officers, but, as the honourable member for Robertson says, are generally unknown to the Minister. That fault of our present system is hard to avoid. We hope to have in this country a public service, which, whilst its members can in their",25,Curtin
95,Mr Coi.es,The positions are adver,26,Curtin
