speakerGroups,speaker,theText,pageNumbers,title
0,"""Broadcasting","Mr Calwell (Chairman), Senator Amour, Senator Cooper, Senator Herbert Hays, Mr Barnard, Mr Johnson, Sir Charles Marr, Dr. Price, and Mr Riordan. Senator Cooper, Senator Uppill, Mr Speaker, Mr Badman, Mr Barnard, Mr Francis, Mr Guy, Mr Mulcahy, and Mr Watkins. .LIBRARY Mr Speaker (Chairman), the President, Senator Armstrong (appointed, 20th November, 1941), Senator Cameron, Senator Collett, Senator Collings (discharged, 20th November, 1941). Senator Fraser, Sonator J. B. Hayes, Senator Sampson, Mr Bronnan, Mr Coles, Mr Hutchinson, Mr Paterson, Mr Riordan, and Mr Rosevear. Gibson Senator J. B. Hayes, Senator Johnston (died, 6th September, 1942), Senator Allan -PUBLIC WORKS -Senato r Braud (Chairman), Sonator Cooper, Senator Lamp, Mr Badman, Mr James, Mr Jolly, Mr Martens, Mr Mulcahy (elected, 24th February, 1943), Mr Sheehan, and Mr Stncey (""resigned, 16th February, 1943). Courtice (appointed, 12th November, 1941), Senator Large (appointed, 12th Novomber, 1941). Mr Clark (discharged, 25th March, 1942), Mr Marwick, Dr. Price, and Mr Watkins (discharged, 12th November, 1941). Herbert Hays, Senator Johnston (died, 6th September, 1942), Senator Uppill, Mr Baker (appointed, 12th November, 1941), Mr Broen (appointed, 2nd October, 1942), Mr Frost Mr Marwick (appointed, 30th September, 1942), Mr Pollard (discharged, 25th March, 1942). Mr Scully (discharged, 12th November, 1941), and Mr Wilson. (appointed, 12th Novomber, 1941), Senator Coopor, Senator Keane (discharged, 12th November, 1941), Mr Blackburn, Mr Perkins (resigned chairmanship, 12th November, 1941), and Mr Ryan. WAB EXPENDITURE -Sonato r A. J. McLachlan (Chairman), Senator Arthur (appointed, 12th November, 1941), Senator Ashley (discharged, 12th November, 1941), Senator Clothier (discharged, 12th Novembor, 1941), Sonator Darcey (appointed, 12th November, 1941), Senator Lamp (appointed, 12th Novomber, 1941), Mr Badman, Mr Beck (discharged, 6th May, 1942), Mr Conelan (discharged, 12th Novomber, 1941), Mr Johnson, Mr Jolly, Mr Lawson discharged, 5th March, 1942), Mr Mulcahy. Mr Paterson, and Mr Rosevear (appointed, 4th June, 1942 ; discharged, 3rd September, 1942). Senator Crawford, Senator Gibson, Senator Sampson, and Senator Uppill. November, 1941), Sonator Clothier, Senator Cooper, Senator Courtice, Senator Herbert Hays, Senator Large (appointed, 20th November, 1941), and Sonator Allan MaoDonald. Senator Darcey, Senator Herbert Hays, Sonator Johnston (died, 6th September, 1942), Senator Keano, Senator Lamp, and Sonator A. J. McLachlan. Loader of the Opposition, Mr Beasley, Sir George Bell, Mr Blackburn, Mr Makin, and Sir Earle Page. (EIGHTH PERIOD.) „ u ,„,< » o t . . . .",8,Setup
1,"Macdonald, Mr Beck, Mr Falstein, Mr Mccall, Mr Morgan, Mr Rankin, And Mr Ryan.",,8,Senate
2,"(Discharged, 12th November, 1941), Mr Langtry (Appointed, 12th November, 1941), Mr Mcleod,",,8,Senate
3,"(Discharged, 12th Novomber, 1941), Mr Mccall, Mr Morgan (Appointed, 12th November, 1941:","An Act to amend the Australian Soldiers' Repatriation Act 1920-1941, and for other purposes. An Act to amend the Commonwealth Bank Act 1911-1932, and for other purposes. An Act to make provision for the granting of long-service leave to Commonwealth Employees. An Act to provide for the Validation of Collections of Duties of Customs under Customs Tariff (Canadian Preference) Proposals. An Act to provide for tlie Validation of Adjustments in Duties of Customs under Customs Tariff (Exchange Adjustment) Proposals. An Act to provide for the Validation of Collections of Duties of Customs under Customs Tariff (New Zealand Preference) Proposals. An Act to provide for the Validation of Collections of Duties of Customs under Customs Tariff (Special War Duty) Proposals. An Act to provide for the Validation of Collections of Duties of Customs under Customs Tariff Proposals. An Act to authorize the Service of Members of the Citizen Military Forces in the South Western Pacific Zone for the duration of the present war. An Act to provide for the Validation of Collections of Duties of Excise under Excise Tariff Proposals. An Act to amend the Income Tax Assessment Act 1936-1942. An Act to impose a Tax npon Incomes. An Act to amend the Invalid and Old-age Pensions Act 1908-1942. An Act to grant and apply out of the Consolidated Revenue Fund a sum for Invalid and Old-age Pensions. LOAN ACT .1943 (No. 3 of 1943)An Aot to authorize the Raising .and Expending of a certain Sum of Money. An Act to amend the Maternity AUowance Act 1912-1942. An Act to establish a National Welfare Fund. An Act to amend Part IX . of the Navigation Act 1912-1935 relating to Courts of Marine Inquiry. An Act to provide Relief to Primary Producers by stabilizing the Price of Superphosphate and for other purposes. An Act to amend the Superannuation Act 1922-1942. WAR-TIME (COMPANY) TAX ASSESSMENT ACT 1943 (No. 21 of 1943)An Act to amend the War-lime (Company) Tax Assessment Act 1940-1942. An Act to amend the Widow? Pensions Act 1942. (EIGHTH PERIOD.) (To END OF EIGHTH PERIOD.) discharged. Loave to bring in granted in Third Period. reading. Representatives; second reading. in Seoond Period. reading. Fourth Period. Second Period. Second Period. Second reading; Initiated in the House of Representatives. Initiated in the House of Death Of Mk. Joseph Francis Hannan.................................................................................................................1736 Income Tax Bill 1943 .........................................................................................................................................1737 Question Question Question FOOD SHORTAGES ..................................................................................................................................1738 Hospital Staffs.....................................................................................................................................................1739 Question FILM CENSORSHIP...................................................................................................................................1739 Question Question DR. EVATT AND SOCIAL CREDIT .........................................................................................................1740 Question Question Question Question Question Question New And Opposed Business After 11 P.m Australian Soldiers&#39; Repatriation Bill 1943 Second Reading............................................................................................................................................1742 Income Tax Bill 1943 .........................................................................................................................................1763 Australian Soldiers&#39; Repatriation Bill 1943 Second Reading............................................................................................................................................1772 Adjournment .......................................................................................................................................................1787 Papers..................................................................................................................................................................1793 Answers To Questions Canteens Administration ..............................................................................................................................1794",8,Senate
4,Mr Curtin,"No ............................................................................................................................................1742House of Representatives. took the chair at 3 p.m., and read prayers. Minister) -It is with regret that I record the death of Mr Joseph Francis Hannan, a former member of this House and of the Senate, which occurred in Melbourne on Sunday, the 14th M)arch last. A stalwart member of the Labour party, Mr Hannan was elected to this House for the division of Fawkner at the general elections in 1913 and 1914. He was defeated at the general elections in 1917, but was subsequently elected to the Legislative Assembly of Victoria for the constituency of Albert Park at a by-election held on the 13th May, 1918. He held this seat in the State Parliament until October, 1919, when he resigned to contest again the Fawkner seat at the Commonwealth general elections; on that occasion he was defeated. On the death of Senator Barker, the Parliament of Victoria on the 22nd July, 1924, chose Mr Hannan to fill the Senate vacancy, and he was a member of that chamber until his defeat at the general elections in 1925. The deceased gentleman was a former president of the Melbourne Trades Hall Council and of the Victorian branch of the Australian Labour party. He served the Labour movement in Australia with zeal and ability. Since his retirement from active participation in political life, he has been engaged in commercial pursuits. Many members of this Parliament will have had personal knowledge of the late Mr Hannan. When I was quite a young man, he very generously accorded to me his friendship. On one occasion when we were candidates for neighbouring constituencies, he helped me very greatly, hut his help was unavailing, although he himself was returned with a handsome majority. To my knowledge, he gave Tuesday, 16 March, 1948. (Fremantle-Prime",11,Tuesday 16 March 1943
5,Mr Spkakbb (Hon. W. M. Nairn),,12,Hannan
6,Mr Ctjrtin,"to the public of Australia, and particuthe Senate to press a request for amendlarly of Victoria, a devotion which was ment has never been admitted by the marked by very great ability. He was House of Representatives, though on prealso a man of strong integrity, and he vious occasions this House, having regard had a winning personality. I regret to the fact that public welfare demanded very much the passing of a friend to the passing of certain legislation, has rewhom I owed a very great deal. I move That this House expresses its deep regret at the death of Mr Joseph Francis Hannan, a former member for the division of Fawkner and of the Senate for the State of Victoria, places on record its appreciation of his meritorious public service, and tenders its profound sympathy to his relatives in their bereavement. Deputy Leader of the Opposition) On behalf of the Opposition, I second the motion and endorse the remarks of the Prime Minister( Mr Ourtin). It was my privilege to know very well the late Mr Hannan; for some years we were fellow members of the same political party. I knew him in both the industrial and political spheres of the Labour movement. He was a fine specimen of Australian manhood, upright and honourable. He had great ability and, as the Prime Minister has said, a winning personality. I have not seen him in later years, and the news of his death comes to me as a great shock. Labour has lost a stalwart champion who devoted his life to its service and strove zealously and loyally to advance its interests; and Australia is the poorer for his passing. I deeply regret his death and extend my profound sympathy to his relatives. Question resolved in the affirmative, honourable members standing in their places. -I'hav e received the following message from the Senate:The Senate returns to the House of Representatives the bill for "" an Act to impose a Tax upon Incomes"", and acquaints the House of Representatives that the Senate has considered message No. 188 of that House in reference to such bill. The Senate has resolved to press its request for amendment No. .1, and again requests the House of Representatives to make such amendment, as shown in the annexed schedule. I feel that I should direct the attention of the House to the constitutional question this message involves. The right.of frained from a determination of its constitutional rights and -obligations. It rests with the House to determine whether it will receive and consider the message. OrderedTliat the consideration of the message by the House be made an order of the day'for a later hour this day. SydneyCOMMUNIST PARTY. RAIL PEIOEITIES TO MEMBERS-EUREK A the Minister for Transport seen the statement attributed to Mr J. B. Miles, general secretary of the Australian Communist party, published in the Sydney Sunday Telegraph, that 50 interstate delegates had been granted rail priorities to attend the thirteenth national congress of the Australian Communist party? If so, will the honourable gentleman state what class of priority has been granted to these delegates and, if the issue of such priorities indicates that the need for imposing restrictions upon travel is not so pressing now as it has been, will he consider the extension of similar facilities to the wives of soldiers? seen the statement, but I shall read it and reply later to the honourable gentleman's question. ral see a report in the press at the end of last month that members of a club known as the Eureka Youth Club have been carrying out extensive training operations in guerrilla warfare in the vicinity of Monbulk? This club, I understand, has Communist affiliations. If the Attorney ^General has seen the report, has he made any investigations of the matter? If he has not done so, will he at once take steps to have the matter fully investigated ? heard of it, but'I shall have investigations made -",12,Hannan
7,Mr Hughes (North,,13,Youth Club
8,Mr Speaker (Hon. W. M. Nairn).,,13,Youth Club
9,Sir Frederick Stewart,Has,13,Youth Club
10,Mr George Laws On,I have not,13,Youth Club
11,Mr Ryan,Did the Attorney-Gene,13,Youth Club
12,Dr. Evatt,"This is the first I haveGeneral seen the statement in the last issue of the Sunday Telegraph that sessions of the national congress of the Australian (Communist party in the Balmain TownH a l l next Saturday and Sunday w ill be closed to the press and public? As section 42 of the National Security (General) Regulations provides that persons shall not endeavour to in fluence public opinion in a manner likely to be prejudicial to the defence of the Commonwealth or the efficient prosecution of the war, will the Attorney-General instruct members of the Security Service to attend the meeting for the purpose of seeing that no breach of the regulations is committed? investigates alleged breaches of the provisions of section 42 of the National Security (General) Regulations without any specific instruction from myself. I shall bring the honourable member's question to the notice of the chief of the Security Service. C m r , CONSTRUCTIONAL CORPS: LEAVE TO honourable member for Bourke( Mr Blackburn) and the honourable member for Melbourne ( Mr 'Calwell) asked questions concerning leave said to be owing to employees of the Allied Works Council. read a statement concerning that matter last Friday afternoon. the Interior has forwarded to me the following answer:The matter of leave for members of the Civil Constructional Corps serving in the Northern Territory has been under consideration for some time. In the early stages an undertaking was given to a very limited number of men that leave would be granted at the end of six months. This has never been applicable to all men of the Civil Constructional Corps in the Northern Territory. The granting of leave involves serious problems of transport, and the matter is one for consultation with the Army authorities in the Northern Territory. The problem is '.being considered as sympathetically as possible in the light of 'the prevailing difficulties, and H as the Attorneyhaving regard to the extreme urgency oi many of the projects involved. The Director General of Allied Works is working out a scheme to ensure that all the men concerned are treated as equitably as possible. ister seen the statement in to-day's Courier-Mail by the State secretary of the Australian Workers Union, Mr. Fallon, that the Australian Workers Union was advising its members not to work under the new award of the Federal Arbitration Court, which fixes wages for members of the Civil Constructional Corps? In view of the fact that Mr. Fallon's statement must be regarded as an incitement to strike, and to hold up vital war work, what action does the Prime Minister propose to take to enT h e Security Service sure that the award of the court shall be obeyed ? report, but I shall ascertain whether it is reliable. I shall ask Mr Fallon what he has to say about it , and in the light of his reply I shall decide what action is required. I have known Mr Fallon long enough to ask h i m to tell me presponsible officer of a responsible organizaFallon on a. statement that comes to me indirectly, however bona fide may'be the L as t week, the intentions of the honourable member in putting his question. FOOD SHORTAGES . Prime Minister a question, and so that he may understand the sense of it I quote a telegram which I have received The Ministerf or from a colleague of mine in SydneyBread is off, milk is rationed, fish is unobtainable, fruit and vegetable prices prohibitive, meat position precarious. What are you doing? As the Prime Minister has been entrusted with the running of the country I ask him now, so that I may give an intelli gent reply to my colleague in Sydney, what is he doing? whether I could obtain any guidance in this matter from the parable of the loaves and the fishes. The problems which the honourable member has stated so shortly",13,Youth Club
13,Mr Collins,,14,Arbitration Court Tion I Am Not Prepared To Judge Mr
14,Dr. Evatt,,14,Arbitration Court Tion I Am Not Prepared To Judge Mr
15,Mr Lazzarini,,14,Arbitration Court Tion I Am Not Prepared To Judge Mr
16,Mr Calwell,The Prime Minister,14,Arbitration Court Tion I Am Not Prepared To Judge Mr
17,Mr Lazzarini,,14,Arbitration Court Tion I Am Not Prepared To Judge Mr
18,Mr Francis,H as the PrimeM in,14,Arbitration Court Tion I Am Not Prepared To Judge Mr
19,Mr Curtin,I have not seen the,14,Arbitration Court Tion I Am Not Prepared To Judge Mr
20,Mr Hab . Rison,I desire to ask the,14,Arbitration Court Tion I Am Not Prepared To Judge Mr
21,Mr Curtin,"I do not knowrequire very serious consideration. Insofar as shortages are due to seasonal conditions, they are beyond the control of the Government. Insofar as they are due to the demands of the fighting services on the man-power resources of Australia, it is inevitable that if a choice has to he Department of Supply and Shipping, the made between fighting the enemy and tightening our belts, we must decide in favour of fighting the enemy, and to that eud we must not deprive the fighting forces of the man-power which will enable them to defend the country. of tightening belts, but of settling the bread strike. ber mentioned fish as well as bread. In so far as shortages are due to remedial causes, I take it that the Government will act. I do not know what has taken place in regard to the bread supply of Sydneywhether the trouble is due to strikes, or to other causes. However, I shall make inquiries. The ""honourable member, in asking this question, has piled together a number of commodities which are alleged to be in short supply, but the explanation for the shortage would differ in every case. He, however, has compounded them for a compound objective. Sydney, evidence was tendered before the Social Security Committee to the effect that hospital staffs were set down by the Department of Labour and Social Security as priority No. 12. point of order. Is the honourable member, who is a member of a parliamentary committee, entitled to ask a question based on evidence given before that committee-evidenc e which is not yet the property of this House? one. No member of a parliamentary committee is entitled, before the committee has made its report, to disclose evidence tendered to the committee. for Labour and National Service what priority is given by his department to staffs employed in hospitals? Allocations Committee has been appointed consisting of representatives of the Department of Munitions, the Department of Aircraft Production, the Department of War_ Organization of Industry, the Shipping Board, and the Man Power Directorate. In .order to deal with allocations of labour, these State committees meet at least once in every four weeks. Industries have been divided into nineteen groups, and hospitals are in what is known as No. 12 group. That, however, does not indicate the order of priority in respect of labour. It is very difficult to make a strict allocation of labour, but I assure the honourable member that full regard is had to the needs of the hospital services. At the moment, urgent investigations are being made so that the labour requirements of hospitals may be fully met. staffs of some hospitals are not sufficient to provide meals for the nursing staff. As hospitals generally are understaffed as regards female labour, will the Minister for War Organization of Industry consider the advisability of tightening up the ban on the employment of domestic servants in order to divert to hospitals the necessary volume of female labour? Labour and National Service is responsible for the ^administration of the Restriction of Employment of Domestic Servants Order. He has been watching closely the number of domestic servants who have been released by the operation of the order, and I understand that he is preparing a report for submission to Cabinet upon the advisability of applying further restrictions. If the Minister advises that the staffing problems of hospitals can be alleviated by placing additional restrictions upon the employment of servants in private homes, his report will receive careful consideration from the Government. FILM CENSORSHIP. asked the Minister for the Army a question about the censoring of the film, Moscow Strikes Back. I now ask.",14,Arbitration Court Tion I Am Not Prepared To Judge Mr
22,Mr Harbison,This is not a matter,15,Hospital Staffs
23,Mr Cltrtin,The honourable mem,15,Hospital Staffs
24,Mr Barnard,"Yesterday, in",15,Hospital Staffs
25,Mr Abchie Cameron,I rise to a,15,Hospital Staffs
26,Mr Speaker,The point is a good,15,Hospital Staffs
27,Mr Barnard,I ask the Minister,15,Hospital Staffs
28,Mr Ward,In each State a Labour,15,Hospital Staffs
29,Mr Rosevear,The kitchen,15,Hospital Staffs
30,Mr Dedman,The Minister for,15,Hospital Staffs
