speakerGroups,speaker,theText,pageNumbers,title
111,Mr Martens,"My electorate willnow represented on the committee. It is conceivable that the members of that party could improve the work which the committee has already been able to do. The parliamentary committees which, within recent date, have been set up on non-party lines to investigate pensions, broadcasting, and various other subjects, have proved of great value, not only to the Parliament but also to the people of the Commonwealth as a whole. I commend the system of standing committees. The position legislatively would be greatly improved by its extension. Some committees have made unanimous recommendations to the Parliament. With half a dozen men devoting a considerable time to the solution of a given problem, or assisteye, and the whole of his left shoulder ing in the drafting of regulations for the department and the Minister concerned, benefit would accrue to the people, because the legislation enacted would become much mo-re effective. In past years, we have witnessed the auctioneering of promises. I hope that such a practice will cease in relation to ex-soldiers or any other section of the community. Having commended the Government and the committee on their labours, I now express the hope that the Government will recognize the wisdom of widening the scope of the measure. The proposals that I intend to advance will be submitted in the friendliest manner, for the sake of the people whose cause I espouse. The bill is essentially one for consideration in committee, not for lengthy debate on the second reading; consequently, I shall reserve until that stage has been reached some of the remarks that I wish to make. I commend the Government and the Repatriation Commission upon the proposed extension of the vocational training system by means of which an inestimable amount of good was done during and after the last war. Returned soldiers were trained for various positions, and jobs were found for them, and, although some lost their jobs, I should like to see that system extended. man should be discharged from the Army without being trained for a position or without work being found for him. been drawn up, and consideration is now being given to it. Sir Charles Marr. hear that. Such a scheme would receive the support of all honourable members. RecentlyI have seen discharged men walking about the streets almost without a penny in their pockets, no work having been found for them. My attention was directed to the fact that two men had been seen sleeping in an empty carriage at the Central Railway Station in Sydney, but I do not suggest that that incident was attributable to defects in the present repatriation system. A returned man recently came to Canberra at his own expense, looking for a job. He had been in the Army for three years. As the result of an explosion, he had lost his left was badly affected. His body is badly deformed and there is hardly a portion of it free from skin-grafting operations. After five months in hospital, he was discharged by the Army last Friday week. It was stated on his discharge form that he was a member of the Citizen Military Forces, but he was actually discharged from the Australian Imperial Force. It was said that he had a wound on his right side, whereas most of his wounds were on his left side. With a month's pay still owing, he was discharged, and told to see whether he could find a job. his-home and could not be found. He resided at Double Bay, but did not leave a new address. was not changed, but I do not blame the Repatriation Department for what happened in that case. discharged he comes under the notice of the Repatriation Department. the Repatriation Department has an officer who inquires into cases of that No kind. The ex-soldier is informed, on applying to the Repatriation Department for assistance, that although his discharge from the Army may indicate total disability, he is not necessarily classified by the Repatriation Department as totally incapacitated for work; but",37,Charles Marr Parkes And Present From All Soldiers Organiza
112,Mr Frost,A tentative scheme has,38,Charles Marr Parkes And Present From All Soldiers Organiza
113,Sir Charles Marr,I am glad to,38,Charles Marr Parkes And Present From All Soldiers Organiza
114,Mr Frost,That man was away from,38,Charles Marr Parkes And Present From All Soldiers Organiza
115,Sir Charles Marr,His address,38,Charles Marr Parkes And Present From All Soldiers Organiza
116,Mr Frost,The day after a soldier is,38,Charles Marr Parkes And Present From All Soldiers Organiza
117,Sir Charles Marr,"I believe that there should be no break between his discharge and the t i m e when he' is taken under Department. Sitting Sir CHARLESMARR to continue m y remarks at a later stage. Leaveg r a n t e d ; debate a d j o u r n e d. Minister) [8.1] -Following upon . MrI should be glad if you let me know at your Speaker's statement earlier to-day on the message received from the Senate o n the Incom e T a x B ill ( v i d e page 1737) , I moveTliat this House takes note of the statement of Mr Speaker in relation to the constitutional questions raised by message No. 171, received from the Senate in reference to the Income TaxB ill 1943, but refrains from the determination of its constitutional rights in respect of such message and resolves to consider it forthwith. I move this m o t i o n w it h a l l the greater pleasure because, earlier to-day, I directed a letter to the Leader of the O p p o s it i o n ( MrF a d d e n ) , suggesting t h a t perhaps a consultation between representatives of the t w o Housesm i g h t overcome the d if f i c u l t y . T h a t letter is as f o l l o w s : Dear Mr Fadden, In view of the situation that has arisen between the two Houses in respect of the Income Tax Bill and the proclamation clause which has reference to the National Welfare Fund Bill, I desire to conform to practice and believe that a consultation between representatives of both Houses would be an advantage. It may even resolve the difficulty. I suggest that at the consultation both Houses should have equal representation, say five from each House, and that the majority of opinion in each House should be represented by a majority of representatives from that House. I would suggest, subject to any comment or variation you might submit, that the representatives of the House of Representatives should comprise myself, the Treasurer ( Mr Chifley), the Attorney-General (Dr. E v a t t ) , the Leader of the Opposition ( Mr select its own representatives will be respected. Fadden),. and the Deputy Leader of the Opposition ( Mr Hughes). In regard to the Senate, I would suggest that the representatives of the Government be the Leader of the Government in the Senate (Senator Collings) and the Minister in charge of the hill (Senator Fraser) and that the Opposition should be represented by the LeadeT of the Opposition in the Senate (Senator McLeay), the Deputy Leader (Senator McBride), and Senator Spicer (who moved the request to the House oi Representatives). if the consultation could take place as early as possible to-day. Mr Fadden w a it e d u p o n me, a f t e r w h i c h I wrote to h i m a second letter, w h i c h is the care of the R e p a t r i a t i o n as f o l l o w s : Dear Mr Fadden, suspended from 6.15 to 8 p.m. W it h reference to your oral intimation to me a few minutes ago that the proposal conI ask leave tained in my letter to you of to-day regarding the holding of a conference of five representatives of the House of Representatives and five representatives of the Senate was agreed to with the modification that the members to represent the Senate Opposition should be (Fremantle-Prime chosen by that Opposition, I desire to inform you that this modification is acceptable to me. earliest convenience to-day the names of the members to represent the Opposition in the Senate. Mr Fadden then sent to me a letter confirming his o r a l in t i m a t i o n , and enclosing n letter received by h i m from the Leader of the O p p o s it i o n in the Senate r e l a t in g to the suggestion for a conference. Senator McLeay's letter is as f o l l o w s : The party have given consideration to the letter from the Bight Honourable the Prime Minister to you of even date in which he makes certain suggestions with a view of resolving the difference that has arisen between the Senate and the House of Representatives in respect of the Income TaxB ill . With every respect to the suggestion of the Prime Minister, we cannot concede that a conference between the Houses in respect of this matter conforms to any practice which ha,s heretofore been followed. May I point out that the Senate has expressed its complete agreement with the Government's taxation proposals. The point to which the Senate takes exception is one of considerable importancethe invasion of the rights and privileges of the Senate. No question arises at this stage as to the National Welfare FundB ill , save that the Senate insists upon preserving its right to discuss that measure unfettered, and on its merits. Having regard to the wishes of tlie Prime Minister, and out of courtesy to him, we are prepared to meet in conference as suggested. I anticipate that the rights of the Senate to As the Prime Minister has communicated with you as Leader of the Opposition, I send you this communication, which you are, of course, at liberty to pass on to him. L a t e r, Mr Fadden sent me another c o m m u n i c a t i o n enclosing the f o l l o w in g letter from the Leader of the O p p o s it i o n in the Senate:Dear Mr Fadden, It would be an advantage With reference to the further letter of to-day's date, addressed to you by the Right Honourable the Prime Minister, I now have to",38,Charles Marr Parkes And Present From All Soldiers Organiza
118,Mr Curtin,"advise you that the following Senators have been selected to represent the Opposition in the Senate:Senator the Honourable George McLeay, Senator the Honourable P. A. McBride, Senator J. A. Spicer. The consultation took place this afternoon, and, as a result, it was agreed that this submission should he made .to the parties concerned, and to the Houses involvedThe consultation has been concluded. It has been agreed tliat the House of Representatives, while reserving its rights under the Constitution, accepts the request of the Senate in respect to the Income Tax Bill and that the Senate, while reserving its rights under the Constitution, immediately thereafter will consider the National Welfare Fund Bill and will complete the consideration of the bill by the termination of Thurday's sitting. I lay on the table the following papers in connection with the constitutional aspects of the matter:Constitutional opinionsOn whether clause 2 of the Income Tax Bill 194.3 contravenes section 55 of the ful things would happen. Eventually, ConstitutionBy Sir Robert Garran, KC., Sir George Knowles, Professor K. H. Bailey and Mr G. B. Castieau. By Sir George Knowles and Mr G. B. Castieau. By Mr David Maughan, KC. On whether the Senate has a right to pres3 a request for tlie amendment of a money bill-B y Sir Robert Garran, KC, Sir George Knowles, Professor K. H. Bailey and Mr G. B. Castieau. [8.7] -It is not my intention to oppose this motion; but I do not think that a matter of this kind should be allowed to go through without comment. Por the last four or five days the press and the air have been filled with references to a political, crisis, and the possibility ofan early election. However, the Government had a sufficient supply of white calico to make a white flag, which it hoisted when the pressure was put on. There is this to be noted about white flags: they may also be used as shrouds for those who do not survive the battle. It is interesting to note that several legal opinions have been obtained in regard to this issue. This morning, every honourable member received a copy of those opinions, though, apparently, in the final analysis, they had no more effect on the resolution of the crisis than on those honourable members who read them-o r on those who did not. A great deal of intellectual sweat was wasted, and much paper and ink used, in producing something which in no way influenced tbe outcome. We cannot overlook the fact that, among those members of the Government who adorn the front bench to-day, is one of Australia's leading constitutional lawyers, the Attorney^ General (Dr. Evatt), and it is interesting to observe that a government which enjoys the advantage of such a fount of legal knowledge on constitutional law should have got itself into a succession of constitutional tangles during the last few months. First, we had the fiasco over the Constitution Alteration (War Aims and Reconstruction) Bill, which is still on the notice-paper, though it has not been considered by the House. We were told that it was a measure of the very first importance, and that if Parliament did not pass it all sorts of dreadhowever, the Government seems to have thought that it was not worthwhile going on with the bill, although it has created arguments in every State parliament in Australia. We are entitled to ask just what is meant by these constitutional meanderings of the Government. In the present instance, the Senate has had a 100 per cent. win. I met Senator McLeay in the precincts of the House to-day, and, although I did not look at his boots, I should say that they ought by now to be very clean indeed. No self respecting government should raise such an issue unless it is prepared to go on to the bitter end. From now on, we on this side of the House will be entitled to treat the Government, on matters of this kind, at any rate, according to the valuation it has placed upon itself, having regard to the surrender that the Prime Minister( Mr Curtin) has announced to the House to-night. am not quite clear whether we have been hit or whether we ducked. That is a question which must be left for final settlement at some future date. The honourable member for Barker( Mr Archie Cameron), true to the traditions of his clan, and in a manner appropriate",39,Incometaxbill 1943
119,Mr Archie Cameron (Barker),,40,Incometaxbill 1943
120,Mr Brennan (Batman) [8.13],"Ito his martial habiliments, seems very sad at heart that the fight should .be off. pected it to be on. I have been saying that all the week-end. imagine that, once he is accoutred in the habiliments of war, the battleground should naturally be transferred to the floor of the House of Parliament, which is supposed to be a deliberative assembly. I cannot join with him in his vain regrets. I am old-fashioned enough to believe that we are here, in somewhat difficult circumstances from the standpoint of the political balance of parties, for the purpose of discharging very serious duties. No one has denied that, and I thought that the proposition was accepted, if not universally, then at least with enthusiasm by the Opposition. But apparently it is not so. I think the course outlined by the Prime Minister is correct. side of the House, but entirely on my own behalf, I consider that the Senate, as a corporate body, had some grounds for dissatisfaction with the way in which the two bills were linked and presented to it. I make that statement with the greatest respect to those who have expressed more or less considered opinions to the contrary. sidered opinions. member for Warringah is supporting me, I am placed at a great disadvantage. Obviously, the constitutional issue involved in the bill was missed ' by the lawyers in thischamber. speak as one of them, in a humble way, as a -general practitioner. But the matter does not appear to have heen adverted to by any layman or lawyer in this House. As a general practitioner, I am inclined to take the view that on the practical side, and regarding the spirit, if practice. Par be it for me to appear even not. the letter of the law, to use the very carefully chosen words of the right honourable member for Kooyong when he spoke on this matter under protest at 1J30 a.m. bed. grievance that a constitutional issue should be forced on him at that hour. No eminent lawyer likes to express a considered legal opinion, at short notice, in his pyjamas. One does not like to be taken by surprise in these matters. But the right honourable gentleman did take the safe course of saying that if not according to the letter then at least according to the spirit of the Constitution, this was the kind of political offence known as ""tacking"". Inasmuch as the consideration of the Income Tax Bill by honourable senators involved a knowledge of the details of another measure which they had not discussed, I think that at least in the spirit if not according precisely to the written word, it did amount to ""tacking"". That leads me to mention that we have at last discovered what we had concluded was the undiscoverable, namely, something which really is a non-party question. Speaking not for this I express my view without presumption or any degree of positiveness, because I have not studied the question. As a general practitioner, and a representative of the working class in a working-class constituency, I have put aside the study of straw-splitting constitutional questions. I have left them to the masters of that art. I say that without disrespect to the eminent lawyers who specialize in these matters. The honourable member for Barker, with his airy persiflage, which he would have us believe was really a serious contribution to debate, referred to the number of legal opinions that have been submitted to this chamber. Opinions were written by the Solicitor-General, Sir GeorgeI Knowles, and the Assistant Secretary of the Attorney-General's Department, Mr Castieau; and even Sir Robert Garran was awakened from his well-earned rest in order that he might contribute a very mature legal opinion on the same subject. We are drifting into a dangerous remotely to censure my eminent friend, the Attorney-General (Dr. Evatt), for whose opinion I have the greatest respect; and specialists' share that opinion with me. But it has always been the custom for the Attorney General to apeak entirely upon his own",40,Incometaxbill 1943
121,Mr Archie Cameron,I never ex,41,Incometaxbill 1943
122,Mr Bbennan,He appears to,41,Incometaxbill 1943
123,Mr Spender,""" More or less "" con",41,Incometaxbill 1943
124,Mr Bbennan,If the honourable,41,Incometaxbill 1943
125,Mr Conelan,They got him out of,41,Incometaxbill 1943
126,Mr Beennan,"He had a justresponsibility regarding legal issues involved in legislation. Where a layman has been appointed to tbe position of Attorney-General, it is naturally assumed that he has been advised. Some of our best Attorneys-General have been laymen. Mr 'CALWELL -Queenslan d deliberately debars lawyers from holding the portfolio of Attorney-General. Mir. BRENNAN I do not think that tbe honourable member for Melbourne is correct. number of instances. that my old friend Johnnie Mullan, a layman, has been Attorney-General for many years in Queensland. O'Keefe. some Attorneys-General were laymen; but I should hate to think that a great and progressive State, through its successive Labour governments, has been guilty of prohibiting trained men from occupying the position of Attorney-General. the practice. Attorney-General, it is taken for granted that when he speaks as the law officer of the Crown, he has been advised by the legal authorities behind the scenes. But those who work behind the scenes should not be brought before the footlights. That is not the place for them. The Afctorney-'General is himself eminently well qualified to withstand the slings and' arrows even of outrageous fortune if it should come to that; and even the joint opinions of the eminent men advising him behind the scenes might not' be followed on the floor of the House by such an authority as himself. But whether or not that is so, we have the advantage of being supported by a highly intelligent, industrious and loyal Public Service. To no department is that statement more applicable than that over which, in a political sense, it was my privilege to preside for two or three years. We should stick fast to the old rule. Let the politicians take the buffets. to speak in this House in support of The Public Service should remain immune from p -rsonal criticism. I hope, with great respect to my learned friend, if he will allow me in my junior capacity to call him so, that that practice will be followed in the future, as it has been respected in the past. principal matter which I wished to discuss was covered at some length and in some detail in the latter remarks of the honourable member for Batman( Mr Brennan). am. I can cite a member for Pawkner another constitutional authority? constitutional authority. But those who did express a view opposed to the opinion of the constitutional authorities a few days ago, have had the satisfaction of seeing their view upheld by the action of the Government in adopting the course which we so strongly urged at that time. The Prime Minister( Mr Curtin), in support of the general statement that he made, laid on the table of the House a number of opinions of eminent legal gentlemen. I do not challenge either their eminence or their learning, and I concur in what the honourable member for Batman said as to the conspicuous public service rendered by the officers of the Crown Law Department. But I entirely share, his view that the practice of quoting the opinions of Crown Law officers in support of government legislation should not be encouraged or even permitted. It has not been the practice in the past. I understand that the right honourable member for North Sydney( Mr Hughes), in the fifteen years in which he was Attorney-General, never put forward the views of his own officers in order to strengthen any particular case or view which he advocated. As the honourable member for Batman has pointed out, the Attorney General takes the responsibility, and, although he should seek the best advice that he can get from Crown Law officers or eminent counsel outside, the views he puts forward should be the views of himself and the Government. The Government should accept the responsibility and not shelter behind those who are unable their views. The practice of putting forward the opinion of Crown Law",41,Incometaxbill 1943
127,Mr Calwell,I,42,Incometaxbill 1943
128,Mr Beennan,I am quite aware,42,Incometaxbill 1943
129,Mr Conelan,S o also was Jack,42,Incometaxbill 1943
130,Mr Beennan,It may be that,42,Incometaxbill 1943
131,Mr Calwell,That is the effect of,42,Incometaxbill 1943
132,Mr Beennan,When a layman is,42,Incometaxbill 1943
133,Mr Holt (Pawkner) [8.29],The,42,Incometaxbill 1943
134,Mr Lazzarini,I s the honourable,42,Incometaxbill 1943
