speakerGroups,speaker,theText,pageNumbers,title
184,Mr Mcronald (Corangamite),"was a unique body, consisting wholly of returned soldiers from the last war. All had been front-line soldiers and had been wounded. 'Some have sons in the armed forces of this war. The committee consisted of a colonel, a captain, a lieutenant, a sergeant, a sapper and a driver in the last war. With their background and knowledge of the problems of soldiers the members of the committee would naturally want tbe comrades with whom they shared many dangers and hardships to have the very best that could be given to them. We had to approach this matter from a practical standpoint. We have heard various criticisms of the committee. The honourable member for Warringah ( Mr Spender) was kind enough to pillory us and to ask many questions. He constituted himself the prosecuting counsel, the jury and the judge, and I think that, without exception, he found all of us guilty. He said tliat he could not understand how we ever arrived at the decision to have such a pension-on e that would not vary. sort. I asked how the committee reached a decision to recommend an increase of the rate of pensions by 20 per cent. agree to pegging soldiers pensions in this way ?"" was what the honourable member said. I shall not tell the honourable gentletralia first suggest that figure? If man what I am reading from. I invite him to look at his own speech. Mr 'SPENDER -The honourable gentleman is not quoting from my speech as reported in Hansard. honourable gentleman is not able to understand the motives which actuated us in recommending an increase of 20 per cent, or in pegging pensions is not a matter for wonder. I know that the honourable member does not have the background that every member of that committee had. WhatI do object to is the honourable member's blaming the committee for his own lack of comprehension. It was not fair of him to put the responsibility on us for the fact that he was unable to understand why we adopted the increase of 20 per cent. The honourable member went on to say that the increase should be 50 per cent. that. honourable member a lot before I am finished. We were anxious to know whence came the figure of 50 per cent. We were told at first that it came from the Manly branch of the Returned Sailors, Soldiers and Airmen's Imperial League of Australia, in the honourable member's constituency, but the honourable member provided documentary evidence to prove that, on the 23rd July, 1941, he communicated to the then Prime Minister( Mr Menzies) his view that the pension should be raised by 50 per cent. At that time, the honourable gentleman was Minister for the Army, and members of the Australian Imperial Force were receiving 7s. a day-5s . down and 2s. deferred. If he based his submission that pensions should be increased by 50 per cent, on the rate of pay ruling in the Australian Imperial Force at that time, I find it difficult to reconcile his figures. member did not tell us how he arrived at the figure of 50 per cent. It is like the mystery of the hen and the egg-whic h came first? Did the honourable member for Warringah, or was it the Manly branch of the Returned Sailors, Soldiers and Airmen's Imperial League of Austhe honourable member was not the first to suggest it, did he suggest to the Manly branch that it should? If he did, that is probably the cause of all this stir. We invited all Federal and State ex-servicemen's organizations to make their representations to us. essence of the contract. Orally? The federal organizations, yes; but the State, no. When it was suggested that, as we were sitting in Melbourne, the Victorian branch of the Returned Sailors, Soldiers and Airmen's Imperial League of Australia might give oral evidence, I was the one who opposed it. I said that we could not allow one State branch to submit evidence orally, and refuse to hear oral evidence from other State branches. It was impossible in the time for us to visit every State. We were told that the report was",52,Australian Soldiers Repatriation Bill 1943 Second Reading
185,Mr Spender,I said nothing of the,53,Australian Soldiers Repatriation Bill 1943 Second Reading
186,Mr Mcdonald,""" How can you",53,Australian Soldiers Repatriation Bill 1943 Second Reading
187,Mr Mcdonald,The fact that the,53,Australian Soldiers Repatriation Bill 1943 Second Reading
188,Mr Spender,Tel l me where I said,53,Australian Soldiers Repatriation Bill 1943 Second Reading
189,Mr Mcdonald,I shall tell the,53,Australian Soldiers Repatriation Bill 1943 Second Reading
190,Mr Spender,I did not.,53,Australian Soldiers Repatriation Bill 1943 Second Reading
191,Mr Mcdonald,The honourable,53,Australian Soldiers Repatriation Bill 1943 Second Reading
192,Mr Spender,Orally?,53,Australian Soldiers Repatriation Bill 1943 Second Reading
193,Mr Mcdonald,"Tim e was of theneeded as soon as .possible in order that legislation might he introduced to give a greater measure of justice to ex-servicemen than they had received in the past. We sat continuously and obtained all the evidence we could. Those organizations which did not' have the opportunity to submit evidence orally did have the opportunity to submit documentary evidence. The honourable member for Warringah had the same opportunity. The only organization which submitted evidence favouring a greater increase than that recommended by the committee was the Victorian Branch of the Returned Sailors, Soldiers and Airmen's Imperial League of Australia. There was merit in that proposal, because that branch compared the rates of pension with present day rates of pay, not the rates that the soldiers were receiving when the honourable member for Warringah was Minister for the Army. The rate of pay operating when the honourable gentleman occupied that position was only 17 per cent, greater than the rate that operated in the last war. It was also said that there had been a 20 per cent, increase of the cost of living since the pensions were established, but that is not so, for, in 1919, the pared to fight for themselves, if justice is index number was 1,022, whereas, in December, 1942, it was 1,122, an increase of 11.2 per cent. the country will accept the contention that the cost of living has increased by only that much. figures of the Commonwealth Statistician. Possibly that authority will be accepted by honourable members. The point I emphasize, as one who has been actively associated with returned soldiers' organizations since my return from the last war, is that I have always found that the "" digger"" does not want his pension to vary according to the rise and fall of the cost of living. What he asked for, had the right to expect, and received, was a pension commensurate with the disability he suffered as the result of war service. Por that principle, I am prepared to fight for ever. In 1939, the £1 was worth considerably more than it was worth in 1919, when the pensions were .fixed. So, what the returned soldiers lost on the swings, they got back on the roundabouts. The honourable member for Warringah produced documentary evidence that 21 months ago he advocated an increase of repatriation pensions by 50 per cent. In doing that, the honourable gentleman was trying to show what a model of consistency he was. I remember that it was only about three weeks ago, that between sunset and sunrise, he turned a complete somersault. He holds the world's record as a mental contortionist. He came back to this House to say that one thing be had advocated before he was now opposed to. What a man to boast that he was a model of consistency! and tell us how the committee arrived at the figure of 20 per cent. on the committee was a front line soldier who had experienced the dangers, hardships and trials of modern warfare, the difficulties of being restored to civilian life, and the risk of being submerged in that sea of selfishness which actuate many citizens of this country. We have learned that the "" diggers "" must be preto be done to them. Here, I pay tribute to the Returned Sailors, Soldiers and Airmen's Imperial League of Australia. I believe that it has done a remarkably good job. I do not concur with the views of those people who believe that the returned soldiers have had nothing from the country. If honourable members look at the second-reading speech of the Minister for Repatriation ( Mr Frost), they will find that, since the cessation of the last war, more than £275,000,000 has been expended on behalf of ex-service men. What people fail to realize is that because of the strain imposed on them, those men were not able to meet fierce competition on their return from the war. They had been under a system of discipline for three or four years. They were not allowed to think for themselves in the Army. A ll they did was what they were told to do. On their return to civil life they had to be safeguarded. Relatively few were totally and permanently incapacitated. We agreed that those men should be given a sum that would allow them to",53,Australian Soldiers Repatriation Bill 1943 Second Reading
194,Mr Spender,I suppose the people of,54,Australian Soldiers Repatriation Bill 1943 Second Reading
195,Mr Mcdonald,I am using the,54,Australian Soldiers Repatriation Bill 1943 Second Reading
196,Mr Spender,"Get back to the bill,",54,Australian Soldiers Repatriation Bill 1943 Second Reading
197,Mr Mcdonald,"Yes. Every manlive in comparative comfort. I believe that this bill will do that. People overlook the fact that SO per cent, of the returned soldiers are receiving good wages. Some are on big salaries. Those wages and salaries rise in accordance with rises of the cost of living, but the cost of living bears little relationship to the pension paid to them. But we did think, on review, that the basis of 1919 was a little too low. Instead of increasing the rate by 11 per cent., according to the index number, we recommended that it be increased by 20 per cent. our report had been considered by the Government and embodied in legislation six months ago, it would have received the plaudits of every section of the community. how the committee arrived at 20 per cent. ? told the honourable'member. We found that the cost of living had increased by 11 per cent. We considered that the rate of pensions fixed in 1920 was a little too low and for that reason we suggested an all-round increase of 20 per cent., with increases of 25 per cent, and 66J per cent, in special cases. I do not say that the committee has said the last word on repatriation problems. We shall have problems that have not even been considered. The committee carried on its deliberations entirely free from party politics, and it is a pity that this bill cannot be debated in a similar way in this chamber. If it were, justice would be done to the returned soldiers, and advantage would accrue to all. I shall not deal with many aspects of the bill, because I realize that it is a measure which can be more easily discussed in committee, but I am pleased that the Government has seen fit to adopt most, of our recommendations. I regret that, at the present juncture, it has not seen fit to accept our recommendation that preference shall, wherever possible, be given to returned soldiers, and I hope, that before this bill leaves the House, the Government will have made up its mind that that principle shall be inoluded in it. I have heard some say that preference should be given only where other things are equal. That is not preference at all. Men who have given three or four years of the best years of their lives in the service of their country should not be asked to do the same as can be done by men who have stayed behind and lived in comparative luxury. Where a returned soldier is able and willing to do a job it is the bounden duty of the Commonwealth Government to set the example and give preference to him. The honourable member for Warringah asked whether the committee considered that the suggested rates of pension were fair. I say quite frankly that I do. We must be practical in this matter. It would have been of no use to suggest -rates that might frighten the Government. I asked myself, "" If I were a member of the Government how much would I be prepared to recommend ? "" I considered that was a fair attitude to adopt. Oh the evidence submitted to us by the representatives of the organizations that appeared before us, I formed the opinion that they would be entirely satisfied with the recommendations that the committee has made. the recommendation be brought up to date? it, but I make it clear that I intend to stand by the report of the committee. I referred to tlie policy of preference to returned soldiers, because that is mentioned in the report. deal with that issue. provision of that nature should be inserted in the bill. If it were there, we should meet with less difficulty. I do not consider that such a provision could be described as ""tacking"". all repatriation tribunals. fact, and I pay tribute to the fine work that the Repatriation Commission has done. I do not think that any commission appointed in this country has done a bigger or a better job. We hear a great deal of criticism of the commission, but not much about the fine work that it has done for many thousands of returned men",54,Australian Soldiers Repatriation Bill 1943 Second Reading
198,Mr Spender,Why?,55,Australian Soldiers Repatriation Bill 1943 Second Reading
199,Mr Mcdonald,I submit that if,55,Australian Soldiers Repatriation Bill 1943 Second Reading
200,Mr Spender,But I want to know,55,Australian Soldiers Repatriation Bill 1943 Second Reading
201,Mr Mcdonald,I have already,55,Australian Soldiers Repatriation Bill 1943 Second Reading
202,Sir Frederick Stewart,Should not,55,Australian Soldiers Repatriation Bill 1943 Second Reading
203,Mr Mcdonald,I do not dispute,55,Australian Soldiers Repatriation Bill 1943 Second Reading
204,Mr Lazzaritti,This is not a bill to,55,Australian Soldiers Repatriation Bill 1943 Second Reading
205,Mr Mcdonald,I consider that a,55,Australian Soldiers Repatriation Bill 1943 Second Reading
206,Mr Frost,Returned soldiers sit on,55,Australian Soldiers Repatriation Bill 1943 Second Reading
207,Mr Mcdonald,"I am aware of theand women. A few disgruntled people complain, but nothing is beard from tbe many wbo are satisfied. .Individual cases of hardship cannot be avoided. In my experience every applicant who appears before the commission or its tribunals receives sympathetic treatment and a good hearing if he can submit a reasonable case. We have been most fortunate in the personnel of the commission. Those who appeared before the committee to give evidence were asked whether they would prefer the commission to be abolished and a board appointed to administer the act, or whether they would suggest that repatriation should be placed under the Department of Labour and National Service. The witnesses were unanimously of the opinion that the commission should be retained. They made it perfectly clear that they did not want the bill to be damaged in any way; they wanted it improved. They left us in no doubt of their opinion that the Repatriation Commission had done excellent work during the last twenty years. I do not say that the bill is incapable of improvements. Obviously, the combined wisdom of the whole Souse should be able to suggest some improvements, but, for my part, I intend to stand by the recommendations of the committee. bill has been drafted as the result of numerous conferences between the present Minister for Repatriation, former ministers in charge of the department, many experienced groups of returned soldiers and representatives of returned soldiers' organizations, and also as the result of the report of the committee of ex-soldier members of this Parliament. All contingencies have been visualized by men of experience in repatriation. The approach to the subject has been practical and realistic, and I believe that the provisions of the bill are such as to make possible an effective rehabilitation of war-weary and war-broken soldiers. Por that reason I wholeheartedly support the measure. I wish, however, to refer to one or two aspects which seem to me to have been given a little less than full consideration. The Minister in his second-reading speech saidOther important legislation relating to the welfare of soldiers was the introduction, .under the National Security Act, of regulations whereby an employer is compelled, having regard to the state of his business, to reinstate a soldier in the position which he previously occupied, or a similar one. This applies to all services-Roya l Australian Navy, Australian Imperial Porce, Royal Australian Air Force and the women's auxiliaries. Other regulations have been made under that act for the benefit of ex-soldiers, such as the War Service Moratorium Regulations. In view of the implications of that statement, the bill inadequately meets the needs of the case. We have to remember that it will be necessary to rehabilitate not only the men and women who have heen broken by the harsh realities of war, but also many others who, after the war, will need to be absorbed into our national economy as rapidly as possible. Figures published in the Commonwealth YearBooh show that about 300,000 young men and 300,000 young women in the important age group 20 to 24 years have been diverted from civil to war activities of one kind or another. If such an absorption continues for four years, it is obvious that a complete age group will disappear from the ranks of civilian life. Unless we can do something to counter that loss, we shall be in danger of an economic collapse of a serious character. It is in the age group 20 to 24 years that our young men and women complete their post-graduate study or their training in the arts and crafts of life. Immediately following those years, these young people, as a rule, gain the practical experience which fits them to take their proper place in the life of the nation. This is true whether they be professional men and women, mechanics, or artisans. Obviously, if they do not receive their complete training during the years in which they are in that age group, it must be provided for them as effectively as possible immediately they are demobilized. It has been made quite clear to us that the .fighting forces need the services of all these people, and we know from practical experience that as soon as young people reach an age approaching twenty years, they are called up for service. Up to the end of last year, only a very small",55,Australian Soldiers Repatriation Bill 1943 Second Reading
