speakerGroups,speaker,theText,pageNumbers,title
66,Mr Watkins,"Ful l authority to.agitation from New South. Wales for ; a 50 per cent, increase of pensions. I remind the honourable member that the service that a soldier renders to his country cannot be measured in terms .of money. ment could try to give him a reasonable reward. -member, for Wentworth ( Mr Harrison) -resign fropi the committee? patriation ( Mr Frost) knows quite well -that my military duties would not permit me to remain on the committee. My .apology was conveyed to the Prime Minister and it ill becomes the Minister to .ask such a question. bers of the committee would like to see -the returned soldiers andtheir dependants receive all the assistance that it is possible to give to them, but I repeat that J the committee's task was to bring in, as .quickly as possible, a report which would be reasonably sure ' of acceptance. -'Repatriation is something more than the -mere payment of pensions. In reply to -the criticism that has been expressed in -this chamber because this measure will .effect only a 20 per cent, increase of pensions and dependants' allowances, I point out that pensions and allowances are not -in any way connected with the basic wage ,or the cost of living. A pension is -granted to a returned soldier because of -the disability that he suffers as a result of his war service, and the increase of 20 -per cent, merely represents a common sense decision by the committee. I would 'like to make particular reference to those returned soldiers who are suffering from tuberculosis. On medical ..evidence it is practically impossible to determine the origin, of this disease, and although I a.m. a signatory -to the report that forms the basis of this legislation, I consider that more generous treatment must be given to tubercular -returned soldiers, not only in the interests of the sufferers themselves, but also in 'the interests of the -nation. ber is finding fault -with his own report. making a suggestion. Incidentally, I remind the honourable member that a returned soldier suffering from tuberculosis receives not only his service pension, but also an invalid pension, and that his wife and dependants receive allowances. It is important also that the rate of pension be considered side by side with rehabilitation. We must not engender in the minds of returned soldiers other than those who are totally and permanently disabled the belief that they can sit back and do nothing all their lives and receive a pension. They must be encouraged to rehabilitate themselves as far as possible. Actually the committee has gone further than that and has recommended not only vocational guidance, but also post-war training in many spheres of activity. In conclusion, I point out that this measure is not unalterable, but may be amended by either House. If honourable members believe that they can improve the bill they should endeavour to do so. I recommend the measure to the House and, at the same time, I ask the Minister for Repatriation ( Mr Frost) to consider the setting up of a parliamentary committee on repatriation to deal with all repatriation problems that arise from time to time. pliment the joint parliamentary committee on the excellence of its report and the care which evidently was bestowed on its preparation. A report in such detail reflects the greatest credit on its authors, because it furnishes evidence of an examination of the matter in the proper spirit, for the purpose of presenting material that would appeal to the Government and give necessary assistance to those who are rightly entitled to it. In common with other honourable members, however, I consider that the proposed increase of the pension by 20 per cent, is, for various reasons, totally inadequate. Because of the higher pay which present-day soldiers receive compared with those who fought in the last war, the increase of the cost of living, and the inadequacy of the pensions paid after the last war. I shall support a move to raise the rate still higher. I shall listen carefully to the debate in committee, and shall then advocate what I consider will bast suit the interests of returned",23,Australian Soldiers Repatriation Bill 1943 Second Reading
67,Mr Harrison,A t least the Govern,24,Australian Soldiers Repatriation Bill 1943 Second Reading
68,Mr Watkins,We are trying.,24,Australian Soldiers Repatriation Bill 1943 Second Reading
69,Mr Frost,Why did the honourable,24,Australian Soldiers Repatriation Bill 1943 Second Reading
70,Mr Harrison,The Minister for Re,24,Australian Soldiers Repatriation Bill 1943 Second Reading
71,Mr Watkins,Naturally all mem,24,Australian Soldiers Repatriation Bill 1943 Second Reading
72,Mr Harrison,The honourable mem,24,Australian Soldiers Repatriation Bill 1943 Second Reading
73,Mr Watkins,No; I am merely,24,Australian Soldiers Repatriation Bill 1943 Second Reading
74,Mr Collins (Hume) [4.20],"I comsoldiers themselves, the wives of incapacitated members of the forces, the widows view, the men who have given of their of men who have made the supreme sacribest in defence of this country and its fice, those who have been made limbless or democratic institutions in time of war are in other ways totally incapacitated, and entitled to expect from the nation its the dependants of men who, on account utmost endeavours to rehabilitate in civil of their war disabilities, are no longer life those who are fit and well, and a just .able to provide the amenities which they assessment of the disabilities of those who might have enjoyed in other circumare sick, maimed, or invalided from other stances. I also congratulate the Minister causes, with adequate compensation in the for Repatriation ( Mr Frost) upon havform of a pension. Those are the ing introduced a bill based on such an premises upon which I base my approach ably prepared report. The pensions to the consideration of this measure. granted after the last war were in the In the first place, I offer congratulapauper class, especially in respect of tions to the Government upon having set many men who had been decorated for up an all-party committee to examine the the gallantry they had displayed. I menAustralian Soldiers' Repatriation Act and tioned recently in this House a winner of to report to the Parliament as to the Victoria Cross who had been comhow it could be improved. The act pelled to tramp the country seeking food. has been a controversial subject ever That should not happen. seeking work. I have received to-day a fhe joint parliamentary committee, the e letter from another winner of the VicGovernment made an excellent first aptoria Cross who was responsible for heroic proach to the matter. The decision that deeds in the last war. His decorations the committee should be composed wholly include the .Distinguished Conduct Medal of returned soldiers was well conceived; with bar, the Distinguished Service Order, because of the experience which they had and the Victoria Cross. He advanced had of active service conditions it could from the rank of private to that of lieunot be argued that there was any likelitenant. He is only 44 years of age, and hood of their being unsympathetic to is physically fit and well, yet is unable ether soldiers who were less fortunate to secure acceptance of his application to than they. The committee, too, deserves join the service. He has been working the highest praise for the report which it in the Civil Constructional Corps. I presented to the Parliament; and the hope to discuss the matter with the MinisGovernment acted with commendable wister for the Army( Mr Forde), and shall dom when it accepted broadly the recomthen .place before him the particulars that mendations that were placed before it. have been supplied to me. Cases of this The Minister for Repatriation ( Mr kind must be examined. The men who Frost) and his staff also must be conare fighting for the preservation of our gratulated upon the preparation of the rights and privileges, and the freedom splendid comprehensive second-reading that we esteem so highly, have the greatest speech which the honourable gentleman stake in the country. In other spheres made to this House in explanation of the of activity associated with war operations, provisions of the bill. there is wastage of millions of pounds. In many instances, waste cannot be has never previously been equalled. avoided: but much of it could be prevented by the exercise of greater care. honourable member for Ballarat( Mr Because of what our soldiers have done Pollard). It was certainly a very fine and are doing in the cause of Australia and the Empire, the pensions which they exposition of the bill, enabling honmay later be obliged to seek should be orable members to be fully informed commensurate with their sacrifices. I of its provisions. ""With certain of shall await the committee staae to make the provisions I entirely agree; they further remarks along these lines. since I became a member of this Parliaare excellent, and are certainly an improvement of the act. For example,",24,Australian Soldiers Repatriation Bill 1943 Second Reading
75,Sir George Bell,"I s he a pensioner? ment, and doubtless for many years prior",25,Australian Soldiers Repatriation Bill 1943 Second Reading
76,Mr Collins,He is not. H was to that event. In the appointment of,25,Australian Soldiers Repatriation Bill 1943 Second Reading
77,Mr Barnard (Bass) [4.24],In my,25,Australian Soldiers Repatriation Bill 1943 Second Reading
78,Mr Pollard,Its comprehensiveness,25,Australian Soldiers Repatriation Bill 1943 Second Reading
79,Mr Barnard,"I agree with the clause 6 provides that the number of commissioners shall be increased from three to five. Three commissioners may have been sufficient in days gone by; but the subject of repatriation in the early postwar years will confront the commission with tremendous problems, which will need the attention of at least five members. Whilst it has not yet been definitely stated, I believe that the Government contemplates the appointment of a woman to the commission. There should be a woman member of it, because this war is entirely different from the last conflict, at all events in this country. In Australia we have marshalled, not only manpower, but also woman-power, and our women have made a valuable contribution to the war effort. In fact, their help has been invaluable, and they are entitled to have a woman on the commission in order to watch the interests of women who have given war service. The provision in the bill relating to the onus of proof is a great improvement on the present law, and the Government is to be commended for its action in the matter. The bill gives effect, broadly, to the recommendations of the special parliamentary committee, but no monetary payment is adequate compensation for men who become incapacitated as the result of war service. All that we can do is to make a token payment to them. I credit the committee with having been conscientious in its recommendations, and I accept its opinion as to the amount to which service pensions should be increased. It has recommended that the present rates be increased by 20 per cent., but, as 1 have already said, we cannot adequately compensate men for disabilities arising from war service by a mere monetary reward. Like my friend, the honourable member for Plinders( Mr Ryan), I am deeply interested in the rehabilitation of returned soldiers and other ex-service men. I regard that as an important aspect of the repatriation work that has been undertaken since the last war. The Repatriation Commission has done valuable work for returned soldiers, particularly n the provision of vocational ; training for their children. Consideration could be given with advantage to the extension of that benefit to the civilian population, in the interests of both the Mr Barnard. present generation and posterity. We should not overlook those who, because of their skill and ability, have been required to serve in the workshops. Owing to the important work performed on the factory front, the conditions in this war are not on all fours with those in the last war. Many of the womenfolk who have joined the fighting forces will also have to be rehabilitated, and I am glad to notice that the committee, in its recommendations, has not overlooked their interests. After this war, I hope that we shall not have the spectacle, referred to by the honourable member for Hume( Mr Collins), of the soldier or the munition worker being reduced to the dole, because of inability to obtain work. The repatriation of soldiers and the rehabilitation in industry of both returned soldiers and industrial workers interests me greatly because of my close association with the work of the Social Security Committee, and my knowledge of what its investigations have revealed. I trust that before the life of this Parliament expires it will have achieved good results with regard to this problem. I look upon the repatriation benefits contemplated under this bill as closely related to social benefits generally, and I draw the attention of honourable members to what has been done in the United States of America in this matter. An article in the January issue of the International Labor Review, dealing with the proposed extension of social insurance in the United States of America, shows the trend of the mind of thinking people throughout the world regarding, not only the repatriation of soldiers, sailors and airmen, and the women who are serving in the forces, but also social services generally. That journal, referring to a bill introduced in September last to extend the scope and benefits of insurance under the United States Social Security Act, statesThe bill establishes a Federal Social Insurance System, consisting of two branches: (1) old-age survivors and permanent disability insurance; arid (2) unemployment and temporary disability insurance, both administered by the Social Security Board. That is a provision for social security of a general character. The International Labor Review further remarksUnemployment benefit and temporary disability benefit are calculated in the same manner, namely, at about 60 per cent, of the .average earnings during tliat quarter of the great ideals for which we are now fightprevious year in which the earnings were highest. A supplement of $1 to $2 is added for each dependant. Benefit is payable in respect of each contingency for a maximum of 20 weeks. The social security benefits in the United States of America apply, not only to ex-soldiers, but also to the whole of the population. It indicates the trend of thought among people living in democratic countries. I endorse the remarks of the honourable member for Flinders in agreement on these matters-o n the subject of vocational training. rehabilitation of our soldiers after the war is of paramount importance, and vocational training is an important part of this work. Indeed, it cannot be overemphasized. The honourable member for Flinders pointed out that there were 3,000 deaths from tuberculosis in Australia each year, and the fact that these deaths occur among an average number of 30,000 infected persons, is evidence that we should sit up and take notice. In many instances, the condition of returned soldiers suffering from tuberculosis is not due to their war service. Other factors are responsible for their contracting the disease, factors which are common to them and other members of the community. It is the opinion of eminent authorities that tuberculosis could be not only controlled, but even totally eradicated within a couple of generations. In the meantime, however, the returned soldier sufferers require adequate protection. The Government must tackle the problem of the rehabilitation of our soldiers in civil life, and to this end must give attention to the vocational training and guidance of soldiers and their dependants. I trust that we shall be able to broaden bur approach to the problem of repatriation by linking it up with social services generally, so that not only the soldiers who fought in the war, the women attached to the various services, and men and women engaged in the manufacture of munitions will benefit, but also the citizens of the community generally. ""We should not regard the winning of the war as an end in itself. We must keep in mind after the war the ing, including the establishment of a better way of life. Mr RI0RDAN (Kennedy) [4.46] 1 congratulate the Government upon having brought down this measure, and also the parliamentary committee which collected evidence and submitted the recommendations upon which the bill is based. Amendments to the Repatriation Act were long overdue. It contained many anomalies which operated harshly against the returned soldiers on whose behalf it was originally introduced, namely, those The who fought in the last war. Some honourable members opposite have criticized this bill on various grounds and I do not. wish to reiterate their statements. The honourable member for Wentworth ( Mr Harrison), who was once Minister in charge of Repatriation, criticized the measure, but I ask him what he did while he was Minister to improve the act. He did nothing to remedy the shortcomings against which he is now ranting. Why was that? It was either because he feared that he could not give the soldiers what they wanted, or because he was afraid that any bill which he introduced might produce political reactions against himself or the government of which he was a member. I could suggest some improvements to the bill but, taking it as a whole, it is worthy of acceptance by honourable members. It would, appear, from listening to the speeches of honourable members, that the most controversial provision in the bill is that relating to the rate of pensions. The Government, in providing for an increase of 20 per cent., accepted the recommendations of the parliamentary committee. The chairman and various members of the committee have said that they wished to make recommendations that would be readily acceptable to the Government. For my part, I believe that they have done the soldiers a good service. Many of us would like the increase to be greater. The honourable member for Wentworth criticized the Government for not having made it greater, but what did he do when he was Minister for Repatriation, and what did the Opposition as a whole do when it was in power? An increase of 20 per cent, was recommended by the parliamentary committee. We",25,Australian Soldiers Repatriation Bill 1943 Second Reading
