speakerGroups,speaker,theText,pageNumbers,title
103,Mr Haylen (Parkes) [9.1],The,53,Chifley
104,Mr Abbott,That is a lie.,53,Chifley
105,Mr Haylen,When we are in,53,Chifley
106,Mr Gullet,The honourable member,53,Chifley
107,Mr Haylen,"It depends on howRussia as one of the reasons for intransigence and non-co-operation. We could name other reasons too, including the veto. If we go back to first causes, we must remember that bad treaties were made at the conclusion of WorldW a r I . and also during World War II . , and more bad treaties wil l be made if we are not courageous enough to oppose the tendency to go back to holeand-corner diplomacy. What is happening in the United Nations finds its parallel in the history of the League of Nations. The League of Nations failed solely because the United States of America was not an active participant. Whilst its small organizations, such as the International Labour Organization and some other bodies did good work, the League of Nations failed because there was no complete co-operation on the part of the great nations of the world to achieve the purpose for which it was established, which was the maintenance of world peace. New systems bring new techniques. It was considered by the United States of America that because of its policy in those days of not taking any active part in settling the troubles of Europe, it could remain out of the League of Nations. Whilst Russia has joined the United Nations it is following the same course. In short, America remained outside the league, but was unprovocative; Russia joined the United Nations and became obstructive. If we are honest with ourselves we must seek the causes of these disagreements no matter where they may lie. We must place responsibility on Russia because of its lack of co-operation and because of its insistence on the use of the veto. The honourable member for Warringah has accused the Minister for External Affairs of having no courage, and of not pursuing a settled policy in his fight against the veto. The right honourable gentleman waged a veritable dog fight against the veto. Indeed, honourable members opposite have complained that he has fought too vigorously, and that at times the voice of Australia has been out of a l l proportion to our importance and prestige in the world. The veto is a blot on the record of the United Nations. The pattern is clear in perfect, crystallised form. While matters are in the talking stages, the Russians are with us; when a decision is to be made MadameL a Guillotine is rolled in and down comes the knife, which cuts off any possibility of decisions. The Russians walk out. H o w little the nations can achieve in these circumstances must be apparent to all honourable members. Deliberations are slowed down and even minor decisions are delayed. The whole atmosphere generates acrimony and disputation. F o r that reason the veto engenders ill feeling among the smaller nations and prevents agreement even between those which may exercise it. Thus, the prospects of securing an enduring world peace to-day are much less bright than they were even after Versailles, when a victor's peace was i mposed upon the peoples of the world. The. position is more dangerous since we must look also for causes other than Russia's unwillingness to co-operate with us. We must look at the mistakes we ourselves have made. One of these is the Y a l t a Agreement. A t Y a l t a , where the British Empir e was represented by Mr Churchill, and the United States of America by the late President Roosevelt, decisions were made which, in my humble opinion, have given rise to the present misunderstandings and mistrust. A t Y a l t a concessions were given to the Russians which practically amounted .to the conclusion of a separate peace. No world organization could resolve the difficulties that have been created as the result of the Y a l ta Agreement. Russia gained, in effect, the Baltic States before any peace was made with them. The agreement established for all time an extension of the sphere of Russian influence in the Balkans and other European states adjacent to the western powers. Under that agreement we were to receive Russian assistance against Japan, hut the war concluded dramatically about 24 hours after the agreement became effective. Even worse than the infamy of Versailles was the stupidity of Y a l t a . H a d we, before the conclusion of the war, shown Russia that we were ready to bargain realistically, much of the trouble that has occurred since could have been avoided. But even Homer nods, and while we can be critical of Y a l t a to-day, with all the facts before us, we can sympathize with the anxieties of the democratic leaders trying to buy time in Europe for the final offensive. -It is obvious, however, that the High 'Command of Britain -and the United States of America always considered that 'the war in Europe must be won first. Then Japan could be conquered. General MacArthur, however, believed that there could and should be a contemporaneous conclusion-and he was right. At Yalta Russia got much the best of the bargain. The honourable member for Warringah ( Mr Spender) drew attention to the fact that Russian policy is inflexible. I, like other members of this House, have been trying to find the cause of Russia's absolute opposition to democracy in any shape or form. Can it be that things have gone wrong inside Russia itself and the Russians are finding it necessary to proclaim, in some way, the glorious emancipation of the proletariat? Russians, because of their inability to succeed with five-year plan after five-year plan, or because of the devastating war destruction-they to and including the battle of Stalingrad, and later in the sweep back to the heart of Germany itself-been so impoverished in. their economy that they must look for some other lift to the hearts of their people? Have they fallen into the trap of militarism? Is this hatred, fear, a vital part of their foreign policy? Is the "" iron curtain "" nothing but a smokescreen ? On the answer to these questions depends the peace of the world. The pattern of the United Nations to-day, with its frustrations, and the stupidity of the veto, is something like the circumstances leading to Versailles. The signing of the Treaty of Versailles was tantamount to saying, "" We condemn the children born to-day to be killed in turned out, the twenty-first of many of them was also their Wood baptism. The perpetuation in the United Nations of some of the injustices of the earlier ill-considered peace treaties is one of the Russian attempts to garner the of the main reasons why the United Nations organization is not working effectively to-day. It is difficult to understand story of Russian non-co-operation at the the reversion in Russia to-day to old fashioned imperialism. guess at the reason for this, I suggest that it has been necessary to offer some Mr Ha-ylen. substitute for blood, sweat and tears. What is happening to-day behind the "" iron curtain ""I detest the phrase because, although it is apt and was used by Mr Winston. Churchill, it was originated by Dr. Goebbels? Behind the so-called "" iron curtain "" there is activity at which we can only guess. But we can see the trend of Russian imperialism which makes the imperialism of the Czars look like a mere circumstance. Countries are being overrun. It has been suggested in this House that some of them have been willing victims. Undoubtedly, certain small nations, particularly those adjacent to Russia, have found it expedient to accept the support of Russia, at least temporarily. But imperialism is very hard to "" sell "" to any socialist, and the Russian socialists must be swallowing Have the hard when they hear of these "" victories "", involving the aggrandisement of the Soviet Union at the expense of smaller nations, because whatever has happened to were valiant allies up tbe revolution in Russia, it sprang originally from the socialists. Now it has been degraded into Communist imperialism. All these things have been canvassed ad nauseam, but they do come into any discussions of the affairs of the United Nations, and, of course, they are referred to in the statement that was tabled by the Prime Minister( Mr Chifley). Probably the most disturbing aspect of international affairs to-day is the complete and utter insistence by the Russians on something that is worse than imperialism, namely, the old, notorious and filthy habit of demanding crippling reparations from conquered nations. If these demands are pressed they will constitute a most fruitful cause of war. Even a action"", and, indeed, as it cursory survey of history will show that birthday nations that have been conquered and raped of their possessions as war payments have lived to rise again in strength and themselves become conquerors. The story gold and the capital goods of the defeated European countries is as sombre as the United Nations and the imperialistic Hazarding a policy that it has enforced upon other nations. About two years ago, speaking on foreign affairs in this House, I drew attention to the harsh terms imposed at that time by the Russians upon Finland. Under that agreement, Russia was to take the whole of the Karelian Isthmus, the most productive part of Finland, and in addition Finland, deprived of this valuable territory, was to pay Russia approximately £70,000,000 or £80,000,000 a year for ten years. ""When I was in the Scandinavian countries, information coming from Finland indicated that the hardy Finns had accepted these terms with reluctance, and were preparing to work and buy their way out of bondage. At that time, I thought that the reparations imposed upon the Finns were the harshest that ""World War II. would produce, I agree with the honourable member for West Sydney( Mr O'Connor) who, last night, attacked the principle of reparations because of its danger to the world. Reparations do not breed a placid hatred, but an active burning hatred which will flare up into war when the opportunity offers. Humble a nation, take its production potential, grind its face, and there is a war of vengeance ready-made. Yet Russia is demanding from Germany the sum of ten billion dollars as reparations. again the same pattern is being followed. Between 9,000,000 and 13,000,000 Germans have been removed from Upper Silesia, one of the most productive areas in Germany, to tlie American and British /.ones. The ten billion dollars is being sought in the form of goods out of current production, despite the fact that the British and American authorities are endeavouring to feed the starving people of Germany, restore communications, revive industries, and diminish poverty so that the country will not sink altogether into oblivion. There is to be no consideration of the treasure that is beingmust be said we stand divided. Let us poured into Germany by the Allies. Russia wants its pound of flesh. This pattern of reparations, which is so dangerous to the maintenance of peace, is seen also in Austria. In defiance of section 45 of the Potsdam Agreement, the Russians are seeking the whole of the assets taken over by Germany after the Anschluss, which means that everything that was seized by the fascists is to be the loot of the Russians in the form of reparations. The confiscated funds of union organizations and the possessions of a business man whose only crime was that he was a Jew-som e jack-booted larrikin from the red light district of Berlin marked on his window the unholy word "" Jude "", thus depriving him of his livelihood-ar e all to be taken to Russia and locked up in the Kremlin. Thus, Russia's war against fascism does not extend to fascists' loot. There, too, is another potential cause of war. This pattern of reparations followed by the Russians is another indication that they have decided upon certain actions which we must investigate. If we attempt to peer behind the ""iron curtain"", what do we see? The answer is-, that the Russians no longer believe that, there are any true democracies in the world. They are firmly convinced! that in this war between communism and: capitalism the democracies will perisfe because of their very incompetenca. So everything they do is justified by the glowing future that will come when the fascists are eliminated. That may be the reason for this continued and embittered approach by the Russians. The United Once Nations' deliberations so far as Russia is concerned are a blind, because not one decision has been made, except in the case of Palestine, with the co-operation of the Russians. They have used the veto persistently and extensively. The Russians have shown by their conquests and imperialism that they have no desire for a settlement in Europe, and by insisting upon the harshest of reparations they have shown that they are not interested in the drawing up of peace treaties for Europe. Russia, if it is to remain in the United Nations, must convince the world of its sincerity or it have an end of dishonesty. All we have at the United Nations at the present time is peace sitting on a pile of atomic bombs, and ready to desert the pile when it becomes higher on the Russian side: The deliberations and aspirations of the United Nations amount to no more than an injunction to ""praise the Lord and pass the ammunition "". It is a sad commentary on the effectiveness of the organization that so little headway has been made. However, the strictures of the Opposition upon the work of the United Nations are too stringent in view of the ideals and hopes of the organization, and what it means to the world. An attempt was made with the League of Nations to do something in the way of creating an international peace authority. The formation of an Empire bloc is something to be considered if the United Nations eventually fails. The United Nations organization has done some splendid work, but mostly of a minor character. Its plans for peace have been frustrated, chiefly by Russia, with its exercise of the veto. If honourable members are impatient with the achievements of the United Nations, there is a lot upon which to feed their impatience in the reports presented by the Minister for External Affairs, but we must give the organization every opportunity to survive. Even if we are unable to find out just what is behind the Russian attitude, there may be certain ways of overcoming the difficulties arising out of it. I do not know what is in the minds of the higher authorities abroad, but, during the war, we found it necessary to confer with our allies, including Russia. If differences can be resolved only by conferences between the leaders of the nations, then let us have conferences. Let us have a meeting between Attlee, Stalin and Truman, who are the only persons who can do anything in the present situation to promote world peace. We should not abandon the United Nations because the organization has failed to do everything we expected. Neither should we he content to speak and write millions of words upon the subject, and leave it at that. We have an obligation to the young people of the world to make an honest effort to prevent war from coming to this -r any other country. There are other aspects of foreign affairs calling for criticism, and one cantheir participation in the victory of E l not but be filled with despair over some of the decisions of the Council of Foreign Ministers, decisions for which Russia was not entirely to blame. The Potsdam Agreement is a sloppy and indecisive arrangement, which leaves a great deal to be desired. Surely it can be moulded nearer to the heart's desire, which is peace in our time, and continuing peace. When one takes the stump against the Russians, one finds that the count against them is a Mr Haylen. heavy one. Another item is their refusal to co-operate in the Marshall Plan. This may be due to the fact that all the Russian plans for industrial development have failed, and a diversion may be necessary. Russia may be having difficulty in convincing its soldiers that everything in the democratic countries is utterly bad for them. Therefore, the Soviet Government warns the people of eastern Europe to have nothing to do with the capitalist democracies which come with food in their hands and promises of prosperity. The Russian answer to the Marshall plan was the formation of the Cominform, a congress of nations which favours the Soviet way of life.. Russia has persistently libelled the trade unions as collaborators with capitalism, but one observes in these attacks a note of anxiety rather than a challenge to the workers to rise. One wonders just what is happening in Russia to occasion these sporadic outbursts of anger. Some of our own statements, rabid, inane, and provocative of war, have done little to lull the Russian suspicion. We come now to the question of the Italian colonies, which are of particular interest to Australia, because so many Australians fought in that area. Therefore, it was astonishing to learn that the proposal that Australia should have a voice in the disposal of the Italian colonies was vetoed, not so much by the Russians, as by the four great powers generally. The deputies of the foreign ministers appointed a committee to consider the disposal of the colonies and, despite the protests of the Australian Minister for External Affairs, this country was not represented. That was a tragedy, even though our British colleagues were there to act on our behalf. Surely the heroic defence of Tobruk by Australian soldiers, and Alamein entitled Australia to be represented. .Did none of our allies hear of Bardia and the "" Brown Gods from Down Under"", or was that just good public relations propaganda? ternal Affairs ruined our case by asking for equal representation. with the honourable member. It",53,Chifley
108,Mr Mcewen,The Minister for Ex,57,Chifley
