speakerGroups,speaker,theText,pageNumbers,title
0,An Act Relating To Acoustic Laboratories. An Act To Amend The Apple And Pear Organization. Act 1938,"1947. An Act to grant and apply an additional sum out of the Consolidated Revenue Pund for the service of the year ending the thirtieth day of .Tune, One thousand nine hundred and forty-eight, and to appropriate that sum. An Act to provide for the transfer to the Commonwealth Service of curtain employees of the Commonwealth, and for other purposes. An Act to amend the Commonwealth Electoral Art 1918-1946 and the Senate Elections Act 1903-1922. An Aot relating to Duties of Customs. An Act relating to Duties of Customs. An Act relating to Duties of Customs. An Act relating to Duties of Customs. An Act to amend the Customs Tariff (Canadian Preference) 1934-1939. An Act to amend the Customs Tariff (Canadian Preference) 1934-1939, as amended by the Customs Tariff (Canadian Preference) 1948. An Act to amend the Customs Tariff (Canadian Preference) 1934-1939, as amended by the Customs Tariff (Canadian Preference) 1948 and by the Customs Tariff (Canadian Preference) (No. 2) 1948. An Act to repeal certain Acts relating to Adjustments in Duties of Customs. An Act to amend the Customs Tariff (New Zealand Preference) 1933-1934. An Act to amend the Customs Tariff ('New Zealand Preference) 1933-1934, as amended by the Customs Tariff (New Zealand Preference) 1948. An Aot to amend the Customs Tariff (Southern Rhodesian Preference) 1941. An Act to provide for the Validation of Collections of Duties of Customs under Customs Tariff Proposals. An Act to provide Retirement Benefits for Members of the Permanent Defence Forces of the Commonwealth, and for other purposes. An Act relating to Duties of Excise. An Act relating to Duties of Excise. An Act relating to Duties of Excise. An Act to provide for the Validation of Collections of Duties of Exciso under Excise Tariff Proposals. HMAS. Sydney REPLACEMENT FU ND ACT 1948 (ACT NO. 34 OF 1948) An Act relating to the Expenditure of the Moneys standing to the credit of the HMAS. Sydney Replacement Fund. An Act to approve Acceptance by Australia of the International Wheat Agreement. (FOURTH PERIOD.) An Act to repeal the Primary Produce Export Organization Act 1935 and the Primary Product Krport Clmrges Act 1935-1938, and lor other purposes. QANTAS EMPIRE AIRWAYS ACT 1948 (ACT No. 30 OF 1948)An Act to approve the purchase liy the Commonwealth of certain Shares in Quutus Empire Airways Limited and subscription by the Commonwealth t« issues of Capital by that Company, and for other purposes. An Act to increase the Number of Senators and for other purposes. An Act to amend the Superannuation Act 1922-194 7 and fur other purposes. -SUPPLEMENTARY APPROPRIATION ACT 1946-47 (ACT NO. 36 OK 1948)An Act to appropriate, a further sum out of the Consolidated Revenue Fund for llio scm'oo of the year ended the thirtieth day of June, One thousand nine hundred and forty-seven. An Aot to appropriate a further sum out of the Consolidated Revenue Fund for the service of the year ended the thirtieth day of June, One thousand nine hundred and forty-seven, for the purposes of Additions, New Works, Buildings, &c . An Act to grant and apply a sum out of the Corsolidated Revenue Fund for the service of the year ending the thirtieth day of June, One thousand nine hundred and forty-nine. An Act to amend the. Supply and Development Act 1939-1944. An Act to grant and apply a sum out of the Consolidated Revenue Fund for the service of the year ending the thirtieth day of Juno, One thousand nine hundred and forty-nine, for the purposes or Additions, New Works and other Services involving Capita] Expenditure. An Act to provide for the payment of Allowances to certain Transferred Officers. WAR PENSIONS APPROPRIATION ACT 1948 (ACT NO . 22 OF 1948)An Act to grant and apply out of the Consolidated Revenue Fund a sum for War Pensions. An Act relating to Weights and Measures. An Act to grant and apply nut of the Consolidated Revenue Fund a sum for the purpose of Financial Assistance to the State of Western Australia. F.53I1 2 (FOURTH l?ERIOD.) Acts Interpretation Rill 1946. Initiated in the House of Representatives; second reading. Australian Capital Territory Representation Bill 1948. Initiated in House of Representatives second reading. Papua and New Guinea Bill 1948. Initiated in the House of Representatives: introduction. Question Question ArmedForces ......................................................................................................................................................885 Question Question Question Question Question Question Question Question Question Question Question Question Question War Gratuity .........................................................................................................................................................892 Question Question Question Hansard Staff Retirement of Mr A. P. AdamsPromotions ...............................................................................................894 Question Adjournment .........................................................................................................................................................941 Papers....................................................................................................................................................................943 Answers To Questions Communism...................................................................................................................................................943 House of Representatives. Thursday, took the chair at 2.3,0 pmi., and read praters. G i r i KED WEAPONS . RANGE . liEQiiiiiitasMEWX's WE ARMY P-EESO-NIN Bit. visit, to the W'oomera guided weapons atppeaue.di in to-day's-, issue of the; Daily range,, army personnel servingin that T edleyvarph stated that; the Gweirnmenit ibcality made representations to me repjioiposes; pBOgressiveliy to neduee. our garding remote area leave and a special fauces: iiu Japan.. Has: the: Minister for clothing issue, due; to thenature of the fihe Aumry 3een> the import to which' I work, which involves heavy wear and tea-ilie-fiei';. ajud,. i£ so, canhe give the House on the present issue. Subsequently', 1 amy informationconcerning it? discussed! these matters: with the Minister t'outhe Anmgx Will the: honourable article to which the honourable member gentrlenram infioi'm-me whether-ha; has: aonli-as referred . The strength of #he Aussidened fckese uequeals? siderationtoUhe requests which the honc-cissedi at; the last meetingof Ministers orable member brought to my notice-. on She DefenceCouncil, and it will: be Remote area leave has already been uHscussecr' by Cabinet at a laterdate, granted to the troops in that locality, afterwhich, I hope to be able to. make and I feel confidentthat the authorities, a statement. onmy, appcoach. to them,, will gr.ant the additional: issue of elo.thing. KPr. HOWSE -Will' the Minister for Anny and' the militia, and some newsCommerce and' Agriculture inform mo papers claim that the uniform is more what is the amount of the first payment, like, that of a commissionaire. to wheat-farmers for the 1.947-48 crop? understand', that the Minister for the D'oes the Government consider that this Array decided' that the new uniforms first advance is a reasonableone in view .should Be issued in addition to the of the price which the Austnalian, Wheat present battle-dress Board receives for the grain ?' Whenwill die Minister inform, me whether the tlie next advance be rnad'e on thiscrop ? newspaper reports areco.nrect, and', if so, Will the Minister give an assurance that what the issue of the new uniforms will any g-rowei? who has not so far Deceived cost? Would it not be better to utilize an advance on his1947-48 crop will be the material.' from which the new unipaid without any further delay?' on the 1947-4'S' crop was 4s. 6d. a bushel endeavours to recruit moremen and' to for bulk wheat and 5s. a bushel for bagged continue to issue theolfier typeof wheal?.. Possibly; a few wheat-growers uniform ?' have' not. yet received) first payment-. The delay' may bediiie to onet or two f.actoiis. The'fiinsfc.istihaifr,becamse the. crops-was so theissue of ai new. type of"" uniform, large novae licensediwceiiv.ers-ofi wheat and my action has been given a great deail have been late in submitting their acco.umts. Then again,, some growers who have made: deliveries, over a. period of 15 April, 1948. weeks may no.t have promptly submitted their claims. However,, I hav,e askedthe Australian Wheat Board to. expedite pay ment, by. ercery means possible. It is anticipated that a fiiur.the.iadvance will be madeat aai earliy, date. Mn.. 0'e.O.iNiNrO.iti -An articlewhich 1 tralian contingent of thi* .Bi-i'tisB Comgiv,en in the press to the new type of uniform, which it is proposed to issue to, members of the Australian RegularI uniforms. Can forms-are to be manufactured* for civilian punposes-, oralternatively,, toexpend the 1 Mi-.. CHAMBERS ! , have: approved",8,Acoustic Laboratories Act 1948 No 15 Of 194 8
1,Mr Speaker (Hon. J. S. Eosevear),,12,Armedf Orce S Australians In Jasajs U Is Ifo Ms
2,Mr Rtjs's'eee,During my recent,12,Armedf Orce S Australians In Jasajs U Is Ifo Ms
3,Mr Gjtambee's,1 have given conmon wea-l'tihOccupation Fowre was^ dis,12,Armedf Orce S Australians In Jasajs U Is Ifo Ms
4,Mr Pollard',The first advance money involved: in their nianuf-aelnire in,12,Armedf Orce S Australians In Jasajs U Is Ifo Ms
5,Mr Chambers,I have seen the,12,Armedf Orce S Australians In Jasajs U Is Ifo Ms
6,Mr White',"Publicity has beenof publicity in the press. However, a census taken of members of the Australian Regular Army during the last few days proves conclusively that they desire to be issued with a smarter walking-out dress. Furthermore, I am confident that those who have taken particular notice of the uniform which Australian soldiers are at present wearing while on leave consider that it is not one of which we can he proud. I believe that the new uniforms will be an added incentive to young men to join the militia, because they will be better dressed and more attractive to the eye. Ex-servicemen's organizations, including the Returned Sailors, Soldiers and Airmen's Imperial League of Australia, have spoken very highly of the new uniforms. for the Army state the Government's plans in respect of Australian women who desire to join their husbands serving with the British Commonwealth Occupation Force in Japan? sideration permission for the families of Australian servicemen serving with the British Commonwealth Occupation Force in Japan to go to Japan was withdrawn as from the 31st March last. The time our forces will remain in Japan is running out. It will be the Government'sresponsibility to house them when they return to Australia. There are many Australian families now in Japan. Families that have returned from Japan due to ill health or other reasons have found it impossible to obtain housing. In all the circumstances the Government believes that it is in the best interests of all concerned that no further families of serving members of the British Commonwealth Occupation Force should be sent to Japan. requests from my constituents to support their applications for permits to purchase new motor cars and utility trucks. In view of the desperate position which confronts many primary producers, will the Minister for Transport inquire into the practicability of releasing a higher percentage of motor vehicles for purchase by people in country areas? to the Secretary of the Department of Transport so that the present system of allocation of new motor vehicles may be reviewed and an endeavour made to institute some arrangement to meet the honourable member's wishes. Transport table a list of the permits issued during the past twelve months for the acquisition of Buick cars, showing the grounds on which the applications were granted? Will he also state what percentages of these cars were made available to Commonwealth and State Ministers and parliamentary officers, to members of Parliament for their own private use, and to government department and private applicants? work would be involved in preparing a full answer to the honourable member's questions or whether sufficient staff could be provided for this purpose. However, I shall have the matter examined and obtain whatever information is available. ber, 1947, I addressed a question to the Treasurer regarding the payment of increased pensions to members of the Commonwealth Retired Officers' Association, Western Australian Branch. A reply was given on the 19th February last. The concluding paragraph of the reply, dealing with paragraphs 4, 5, and 6 of my question, statedThe matter was referred to a Treasury committee during the parliamentary recess and a report by that committee is now receiving the attention of the Government. Can the Treasurer say whether the Government has considered that report? If it has done so, is the right honourable gentleman in a position to reply to the unanswered paragraphs of my original question ? examined by a Treasury committee and a report was made. I hope to be able shortly to furnish the honourable member with the information he seeks.",12,Armedf Orce S Australians In Jasajs U Is Ifo Ms
7,Mr Falkinder,C a n the Minister,13,Superannuation
8,Mr Chambers,Afte r serious con,13,Superannuation
9,Mr Fuller,Every day I receive,13,Superannuation
10,Mr Ward,I shall refer the question,13,Superannuation
11,Mr Lang,W ill the Minister for,13,Superannuation
12,Mr Ward,I am not sure how much,13,Superannuation
13,Mr Hamilton,On the 4th Decem,13,Superannuation
14,Mr Chifley,"The matter was the Minister representing the Minister for Trade and Customs been drawn to an article, entitled "" Poisonous liquor on sale at some Sydney hotels"", which appeared in a Sydney Sun-day newspaper recently and in which it was claimed that some kinds of liquor now being sold contained sufficient wood alcohol to cause blindness or even death? If so, has-the Minister had an investigation made with a view to determining whether illicit or adulterated spirits are in fact being offered for sale in Sydney? If such liquors are being sold, is any action to be taken against the persons concerned ? report to which the honourable member has passed legislation to enable that to be referred. I understand that the ingredients done, and Western Australia and Tascontained in alcoholic liquors, and the mania are considering such legislation. prosecution of vendors who offend against The Australian Government desires that the law in that regard are matters for all the States shall pass legislation prothe State governments. The question viding that tenants may purchase the will be brought to the notice of the State homes they occupy. Ex-servicemen who authorities concerned. ing that more restrictions may be imHomes Act. posed upon imports into Australia from dollar areas, will the Prime Minister say whether any decision has been made concerning withdrawals by Australia from Australian reserves in the International Monetary Fund? If a decision has been Minister whether MrJ . Healy is still made, will the right honourable gentleman a member of the Stevedoring Industry announce it? If a decision has not been Commission. Is he the person who while made, when is the matter likely to be a member of the commission incited considered and decided? honourable member's question, as I underin this position? stand it, is whether consideration has been given by the Government to borrowthe right honourable gentleman refers to ing from the International Monetary the federal secretary of the Waterside Fund for the purpose of obtaining dollars Workers Federation. I believe that the to help to bridge the gap between dollars person mentioned is the representative of earned from exports and dollars expended that body on the Stevedoring Industry upon imports. I have made it clear from Commission. I have no particulars of time to time that further restrictions what he said about the Queensland strike, upon imports from dollar areas are likely but I know that his position on the Steveto be imposed. Despite the Marshall plan, doring Industry Commission is due to dollars will continue to be in very short his connection with the Waterside supply within the Empire. The dollar Workers Federation. deficits of the Dominions will not be met by aid given under that plan. ""With regard to the second part of the question, the Government has given no consideration to this matter. for ""Works and Housing what is being done to offer for sale to tenants houses built under the Commonwealth-State Housing Agreement and what procedure is to be followed. Will ex-servicemen be able to purchase those houses under the War Service Homes Act? right and have been encouraged to sell to tenants houses built under the Commonwealth-State Housing Agreement. I have not seen the New South Wales and Queensland have are eligible to purchase War Service Homes and are tenants of houses built under the Commonwealth-State Housing Agreement may purchase those houses Queensland waterside workers to strike?",13,Superannuation
15,Mr Daly,Has the attention of,14,Stevedoring Industry Commission
16,Mr Pollard,,14,Stevedoring Industry Commission
17,Mr Mcbride,In view of the warnunder the provisions of the War Service,14,Stevedoring Industry Commission
18,Mr Chifley,The purport of the Does the Government see any anomaly,14,Stevedoring Industry Commission
19,Mr Conelan,I ask the Minister,14,Stevedoring Industry Commission
20,Mr Lemmon,The States have the,14,Stevedoring Industry Commission
21,Mr Fadden,I ask the Prime,14,Stevedoring Industry Commission
22,Mr Chifley,"I understand thatPEAC E TREATIES. Minister when it is expected that the Italian Peace Treaty will take effect. Are avoidable delays preventing it from coming into immediate operation? Peace (Italy) Act was passed by the Australian Parliament last year. The itneaty does not .deal with the matter of the disposal of former Italian .eolonies, hut it contains a provision Hinder which Trieste is to be a free city. The honourable member is probably .aware that it is now proposed to alter that -provision and to restore Trieste to Italian control. The treaty has not yet been ratified and consultations are taking place on the future .of Trieste. I hope for an early decision. I will inform the honourable gentleman of the result of the consultations. Parliament anathorized the caitifieatioaa of the 'peace treaties fionaLiii'ded with Roumania, Hungary and Bulgaria.. In -tike a-bsenee <of the Minister for Ex<te»ail Affairs, I task the Prime Minister to indicate why the neqwisite .executive -action in relation to those treaties ^as not yet (been taken ? How soon after such action has (been taken will regulations 'be made permitting British subjects formerly resident in those countries, but now living in Australia, to make (claims for 'compensation'? -on the treaties to which the honourable member ""has referred has heen Jield up pending consideration of some matters -which I 'have already .mentioned. As to -the latter part of the question, I .am unable to furnish the requisite information offhand. I shall examine .tlie matter ,and advise the honourable member in .due course. representing the Minister for Trade .and Customs what provision has -been amade .for the importation from the United States <of America of spare parts for industrial machinery.? The Newcastle -Boot Repairers' Association ihas complained that its memiboj's are unable to procure spare parts for the Landis boot I ask the Prime stitching machine. As a consequence repair work is seriously delayed in the Go.st'ord area and in .other districts. Will .the Minister examine the position in order to see what can be done to help the .trade in this respect? applications for permits to import machinery from the United States of America are screened by the Department of Trade and Customs. I shall bring the honourable member's question to the notice of the Minister for Trade and Customs and shall ascertain whether any assistance can be rendered to the trade. Minister for Transport supplied to in"" figures showing the aggregate amounts paid to the States in recent years under *he Commonwealth Aid Roads and Works A..et. Wdl'l he have the aggregate amounts <lisseeted to show the sums allocated and -exipendfid for specified purposes? What -amounts have been allocated to 'be expended in sparsely-settled districts in -each State? Can he assure the House that the sums allotted in fJhat respect have been so expended? not give any .assurance that all -the moneys -allocated to the States under the -Commonwealth Aid Roads and Works Acit have been .expended. .So far as I know ..all ,the moneys have -been allocated for -the purposes for which they-were voted iby the parliament, aaid -reports are now .being obtained fsr.om the -Statesi n .order -to ascertain the laanounts which remain unexpended. I shall endeavour :to have the figures .dissected as tfche honourable .member Bequests,. Repatriation whether it is a fact that I -ask the Minister doctors in privaite practice cannot .obtain streptomycin for .use a>n tubeneulosis -cases -which ithey axe -assured .can -be assisted !by the drug ? Is it a fact that whilst, 1 departmental! medical officers say that ! -streptomycin is in short supply, officers -of the Department of Tr.ade and Commerce on the other 'hand say .that ithe supplies",14,Stevedoring Industry Commission
23,Mr Sheehan,,15,Streptomycin
24,Mr Chifley,The Treaty of,15,Streptomycin
25,Mr Falstein,iS.oaau e time ago ithe,15,Streptomycin
26,Mr Chifley,The formal action,15,Streptomycin
27,Mr Williams,,15,Streptomycin
28,Mr Pollard,I understand that,15,Streptomycin
29,Mr Adermann,Recently the,15,Streptomycin
30,Mr Ward,"A t the moment, I can",15,Streptomycin
31,Mr Sduthie,"I ask the Minister foravailable are sufficient to-: meet our needs? Would the Government allow, the dollar shortage to restrict unduly the importation of streptomycin from the United States of America? might be more appropriately addressed to the Treasurer. Generally, the provision of adequate supplies of streptomycin is a difficult problem. Conflicting reports have been made of the quanity of the drug available in Australia for use by doctors in private practice. I shall ascertain the facts for the honourable member. OF TEMPLARS . last Friday's press stated that the Chinese wife of an Englishman, Mr Carver, who is visiting Australia temporarily from Malaya, is to be deported as from the 10th July next. I ask the Minister for Immigration what is the reason for that decision, and whether such action is mandatory under the law? Does the decision mean that should an Australian marry a Siamese, or an Indian, or a woman of any other nationality to which the Minister might take objection the wife will be deported ? If that is the law, does not the Minister consider it to be too rigid, impolitic and inhuman and, therefore, should be amended? our immigration laws have been the subject of consideration by the High Court of Australia from time to time. Not even a United Kingdom born .subject has a right to enter Australia. There was a case known as the Mrs. Freer case some years ago, about which certain honourable members opposite might know a good deal. Eventually, the High Court decided that a person of British nationality, other than an Australian-born subject, had no right under our laws to enter Australia. It has been the practice of all Australian governments for the past 47 years to refuse permission to any person to enter Australia to whom the restrictive sections of our laws applied, whether they were married to Australian or United Kingdom subjects, or whether their State was still that of single blessedness. rao] The decisions which I have made have been in accordance with that 47-yearold practice. If the honourable gentleman desires the practice to be altered he should commence an agitation for the alteration of the law. There seems to me to, be good reason for the practice to continue and I do not propose to alter it. The Englishman himself who is concerned in this case would have no right to be in Australia if the government of the day decided that he should not remain here. has operated since 1901 or 1903. While honourable members opposite were in power they had every opportunity to alter the law and, as they did not do so, they cannot complain about its enforcement now. discretion; but it has been uniformly administered in one direction. I do not propose to depart from the existing practice, and all the sentimentalists, emotionalists and the rest of the minority groups throughout Australia, who bave become so stirred up over the question of altering our laws because of the marriage of certain Australian or other British people to Asiatic ladies, will have, no effect upon my decision. If honourable members opposite or anybody else throughout the community teel agitated aibout those decisions, let them try to alter the law rather than to reverse a practice which has obtained for so long. Later: personal explanation. honourable member claim that he has been misrepresented ? necessary for an honourable member to explain the formal procedure that he follows in referring to Ministers the requests which he receives from his constituents. The Minister for Immigration said that I made representations for the admission to Australia of fourteen Roumanian Jews, and advanced that as evidence of my inconsistency, as a member of the Parliament, in making other claims to him. As a representative of the",15,Streptomycin
32,Mr Barnard,The last question,16,Immigratio N Status Of Married Women Admissio N
33,"Mr Ryan ,",A report published in,16,Immigratio N Status Of Married Women Admissio N
