speakerGroups,speaker,theText,pageNumbers,title
335,Mr Davidson,"Some of it is. Ibeen forced to reinforce the defences of Hong Kong because of tnat threat. The position in the Netherlands East Indies is, at the moment, indeterminate, and we do not know what will develop there. The statement that Japan has been completely destroyed as a military power is a most dangerous one to be made by a man who holds the position of Minister for the Army. theless. any one who knows how Japan emerged 50 years ago from the dark ages and was able to develop itself to a position where it could do what it did in the last war can say that that nation has been completely destroyed as a fighting force. From what I have seen, Japan, if given a free leg, could become in ten years a serious menace to Australia. It is obvious that it will not he long before a peace treaty with Japan will be signed. The feelers are out already and it is obviously the desire of the United States to finalize such a peace treaty so that it may develop Japan into something in the nature of an ally. There have already been suggestions that Japan may be permitted a certain degree of rearmament. That is the thin end of the wedge. Let us remember that greedy eyes in Japan are turned towards New Guinea. Those honourable members who have been to Japan will bear me out in that statement. Japan who consider that one of the outlets for surplus Japanese population lies in the direction of Australia. In view of these facts-and they are facts-the statement that Japan has heen completely destroyed as a possible threat to Australia cannot be sustained. In addition to the menace facing Ausnot only one small aspect of it because tralia which I have briefly outlined it after all we speak here as the represenmust also be remembered that Australia tatives of a member of the British Comhas certain obligations under the North monwealth of Nations. Honourable memAtlantic Pact, and lately there have been bers opposite have displayed recently a suggestions that a Pacific pact should be really anti-British attitude on every brought into being. According to recent occasion on which we, on this side statements that have been published it of the chamber, have mentioned the appears as if the United .States, which British Empire. We must study this previously was not very favorable to the matter in a large sense. The British suggestion for a Pacific pact, is now turnEmpire is founded on a strong fighting ing its thoughts to the development of navy and a strong merchant navy. It such a pact somewhat along tbe lines of would be futile to say that defence of such the North Atlantic Pact. Australia would have to play a major part in such a pact. Having regard to Australia's present capacity for defence I ask whether we could expect America to place any great reliance upon this country as a partner in the Pacific. We should certainly not be in a position to do anything of a major nature in respect of taking any great share of the obligations which we might incur under such a pact. Yet the development of such a pact is vastly important. If we could show that we were moving towards a realization of our obligations, as New Zealand has done, the likelihood of such a pact coming into existence would be increased. I conclude by placing a plea before the Minister for the Army to pay some attention to tbe opinions expressed by honourable members on this side of the committee. I assure him that those opinions are not voiced for purely political purposes. They are based on sound knowledge. If the Minister would care to appoint a select committee of the House of Eepresentatives to investigate charges that the training of the militia forces is not proceeding as it should be doing, and call in service chiefs who would not otherwise be in a position to speak their minds, he would discover that there is a substantial basis for our charges. I m provements in the scheme which would result from sucb an inquiry would lead There are Americans in to a development of Australia's defence policy so that this country could claim eventually that it was in a position to defend itself. That is not the position at present. is necessary to take a thorough overall view of the whole defence position and",75,Camekon I Placed A Honourable Gentleman Was Then Himself
336,Mr Chambebs,It is true never,76,Camekon I Placed A Honourable Gentleman Was Then Himself
337,Mr Davidson,I do not know how,76,Camekon I Placed A Honourable Gentleman Was Then Himself
338,Mr Sheehy (Boothby) [8.25],"I ta scattered Empire as ours could be maintained without tbe existence of a strong British Navy. The Government has been criticized because of its attitude towards would be of inestimable value should our defence. An examination of the relevant figures will show that there is no basis for such criticism. Tbe Royal Australian Navy now has a strength of 10,000 effective personnel compared with a strength of 5,000 effective personnel in 1939. are non-combatants. ber for Balaclava ( Mr White) has been at sea all his life, and so I can put a true value on his remarks. If any one who has never been in the Navy can be said to be always at sea, it is the honourable member for Balaclava. The figure of 10,000 members in the Royal Australian Navy is exactly double the number of men in the Navy when the defence magnates on the opposite side of the committee controlled the government prior to and for the first two years of the last war, when they told us that the Pacific area was safe. Now those gentlemen say that this Government is not applying itself to the defence problem. honourable gentleman's remarks that he did not intend to adopt a party political attitude to this matter. party political attitude. I am merely stating facts. The point is that as soon as we on this side advance concrete facts honourable members opposite start to squeal or laugh like hyenas. Let us consider what has been done by the present Government in respect of naval defence. The Menzies Government spent £9,000,000 or £10,000,000 on naval construction, but since 1947 the present Gomeet the requirements of service in cervernment has expended £60,000,000 on naval defence. Honourable members opposite would have the people believe that this Government has not played its part in taking measures for the defence of this country. In the ANZAC Pact we have agreed with our sister dominion, New Zealand, to take joint measures for our protection and security. I underis that Australia is to play an important stand that the fleets of the two dominions part in the construction and development are now engaged on joint manceuvres. off the Australian coast, in which they will gain experience in joint operations which countries again be plunged into war. That is merely another step that has been taken by the Labour Government in discharging its responsibilities for the defence of Australia. We have also reached an understanding with our great ally, the Tjnited States of America, with regard to the defence of the Pacific area. Honourable members opposite have indulged in a good deal of criticism regarding the aircraft carrier HMAS. Sydney, which is the latest addition to the Eoyai Australian Navy. They have said that the vessel is already obsolete. Nothing could be further from the truth. It is well known to most honourable members that after the laying of the keel of a vessel alterations are' frequently made in design and construction before the vessel is completed. I had an opportunity to inspect a number of large aircraft carriers in Great Britain the construction of which had been deferred because of alterations in the original design. That is occurring continually in the Mother Country, which is the home of the British Navy and which has taught the peoples of other nations howto man and use ships to the best advantage. It ill becomes honourable members opposite to criticize the efforts that have been made by this Government to honour its obligations to safeguard the defence of the Commonwealth. During World War II . , when our fighting forces returned from the Middle East, they had to be re-trained in order that they would be able to acquit themselves adequately in jungle warfare, for which they had not previously been trained. Similarly, in the building of warships, frequent changes of design are made, either to tain waters or to provide for variations in the design of armaments. Honourable members opposite would have the people believe that because a Labour government is in oflice in this country it can not be trusted with the secrets of scientific warfare. I have never before listened to such claptrap as that. The simple fact",76,Camekon I Placed A Honourable Gentleman Was Then Himself
339,Mr White,Fiv e thousand of them,77,Camekon I Placed A Honourable Gentleman Was Then Himself
340,Mr Sheehy,The honourable mem,77,Camekon I Placed A Honourable Gentleman Was Then Himself
341,Mr Harbison,I thought from the,77,Camekon I Placed A Honourable Gentleman Was Then Himself
342,Mr Sheehy,"I am not adopting aof secret war weapons. I had the privilege of listening to the British Defence Minister outline his views on the future of secret weapons in the defence of the British Commonwealth. No suggestion was made by him that Australia was mistrusted in this matter. On the contrary, he said that we must all work with those with whom we knew we can work amicably. The truth of that statement is borne out by the fact that Australia was subsequently selected as the proving ground for long-range weapons which are on the secret list. Honourable members opposite cloud and misconstrue the facts to suit their own purposes. They would have the Government reveal all its defence plans. If that were done our potential enemies would be jubilant. If tbe British Commonwealth is to survive every member of it must develop a virile naval force. The British Navy has always played an important part, not only in the winning of wars, but also in the maintenance of peace. No one can say that the British Navy did not play a very important part in maintaining peace in tbe world in tbe period between the two world wars. It is useless for honourable members opposite to indulge in destructive criticism of the kind that has marked their contribution to the debate on these Estimates. For the preservation of our scattered Empire, it is essential that all its component parts shall play their part in developing naval strength to the utmost of tbeir ability. At least the Australian Labour Government can claim that it has played its part in that direction. propose to reply briefly to some of the remarks that were made by the honourable member for Boothby( Mr Sheehy). Nobody can be satisfied that any branch of our armed services is satisfactory to-day. Everybody realizes that the future is fraught with great difficulties and that the possession of one aircraft carrier and a limited number of naval craft does not give us any cause for satisfaction. If the honourable member for Boothby is satisfied with that state of affairs he bas no cognizance of the problems that beset us. The Government is much too complacent in this matter. In the very limited time at my disposal I propose to deal briefly with the failure of the Government to adopt an adequate and sound defence policy. The mere fact that a guided weapons range has been established at Woomera, in South Australia, does not satisfy me that the Government is doing everything possible to take advantage of the latest developments in scientific warfare. The Minister for the Army( Mr Chambers) has said that the permanent forces now number 15,500 personnel. In answer to a question which I asked on the subject the honourable gentleman admitted that more than one-third of that . number are non-combatants. That means that we have only approximately 10,500 combatant personnel. The honourable gentleman also admitted that 5,000 men had recently left the forces. That is a very sad story which does not justify the complacency that has been exhibited by the Government in relation to defence matters. On every occasion on which the Minister for Defence( Mr Dedman) bas answered questions relating to defence or has dealt with matters relating to defence, he has boasted that Australia now has a larger defence force than it has ever had in its history during a time of peace. Such statements can be characterized as irresponsible and dangerous nonsense. In 1938, just prior to the outbreak of World War II . , the right honourable member for North Sydney( Mr Hughes) was requested by the Lyons Government to increase our militia forces from a total strength of 30,000 to 75,000. At the right honourable gentleman's request I was given the task of assisting him in Queensland. As the result of his efforts the militia forces of this country were increased beyond the target strength to a total of 85,000. After three months' training those 85,000 young men became the nucleus of the 2nd Australian Imperial Force which played such a prominent part in World War II . I invite honourable members to compare the strength of the militia forces in those days with the pitifully small permanent army that we have to-day. Surely the Minister for Defence cannot be satisfied with his efforts. How can he claim that he is perfectly satisfied with the manner in which the Government's five-year defence programme is being implemented? During the eighteen months in which that",77,Camekon I Placed A Honourable Gentleman Was Then Himself
343,Mr Francis (Moreton) [8.38],"Iprogramme has been in operation he has succeeded in enlisting a permanent army of a total strength of only 15,000 of whom one-third are non-combatants. Honourable members on this side of the chamber and the people of Australia generally are dissatisfied with the Government's defence policy. A great deal of time has been wasted by honourable members opposite in trying to convince the people that they should derive a great deal-of satisfaction from the fact that, in conjunction with the British Government, the Commonwealth has established a guided weapons range in South Australia. That project will make little or no contribution to the defence of Australia for some time to -come. It is merely experimental, and if it is successful a long time will elapse before practical advantage can be taken of it. What this country wants more tban anything else at the moment is an army of skilled specialists to use the mechanized equipment with which modern wars are fought. Large numbers of trained personnel wbo served in World War II . are willing and anxious to help to train young men in the use of modern equipment. The Minister should do everything possible to secure their services by making tbe conditions of service in the armed forces attractive. I have a gr'eat regard for Lieutenant-General Savige, who is well known to every member of this Parliament. Lieutenant-General Savige has been most forthright in his condemnation of the state of our military forces, He does not bandy words. According to the press, this great soldier, who served witb distinction in the two world wars, is unequivocally dissatisfied with our militia forces as they exist to-day. He is reported to bave said recentlyThe Federal Government's failure to train an adequate number of men to use modern weapons of war was a menace to the safety of by 19 per cent, since last year, that tbe Australia. How can Ministers remain complacent in the face of such a statement by a distinguished Australian soldier? tenant-General Savige has spent a lifetime in the service of his country. He was a member of the militia forces prior to World War I. and in the period between the two world wars. He rendered brilliant service to his country in both Mr Francis. world wars. The report to which I bave referred continuesSince tlie second world war there had been some big changes in the science of war. Only by universal training would it be possible to keep enough men abreast of these developments. Lieutenant-General Savige was commenting on a statement by the Prime Minister( Mr Chifley) that the Government had considered universal training and was of opinion that the present defence policy provided the maximum of security within the resources available. He said the present voluntary system of training was most obviously a failure-no t enough men were being trained. Those who were in charge of Australia's forces early in the last war knew how dangerous it was to t r y to properly t r a in men for battle after the enemy was on the march. In the future it would be more dangerous. There would be less time for men to learn how to use weapons of more intricate and scientific design. In the last war the infantryman had dropped his old role as a foot-slogger, and had become a highly-trained specialist, using a great variety of scientific weapons. It took a. long time to train these specialists. Australia was desperately short of them. Universal military training was the only answer. I ask the Minister, in the interests of the defence of Australia, to take note of the observations that have been made from time to time by a number of senior Australian officers who served in World War II . I appeal to tbe bonorable gentleman to ensure that we have forces that are adequate for the defence of this country. On the 17th September, tbe American combined Senate Foreign Relations and Armed Services Committees stated that Russia had more than 5,000,000 men in its armed forces. In a joint report on President Truman's arms programme, the committees said that Soviet ground forces were in a better condition now than at any time since tbe war. Other points in the committees' report were that Russia had increased its military budget number of Soviet troops in Germany had increased from 70,000 to 100,000, and that the Soviet had intensified security Lieumeasures along its borders and those of its satellites. The Minister must be aware of the Russian advance in Asia. Russia was thwarted in Europe and has now turned to the east. Communist forces are advancing in China, and are present in considerable numbers in the Netherlands East Indies and South-East Asia generally. This country cannot remain complacent while Eussia is expanding its military forces and bringing the Iron Curtain closer to our coasts. Eussia is trying to ensure that nobody shall learn of what is being done behind the Iron Curtain. ""We must strengthen our defence forces. We owe a duty to our young men to ensure that they are given an opportunity to receive military training. We cannot expect that in the future otber countries will keep the enemy away from us while we are establishing our own defence forces. gentleman say that we cannot get behind the Iron Curtain? cut to learn what is being done there. hind the Iron Curtain, how does the formation that he has given to the committee is correct? in the efficiency of the American military organization. We saw it in operation in Australia. We are indebted to it for the ample opportunity for honourable gentlepart that it played in the defence of men opposite to state plainly their intenthis country and for the lessons that we tions in connection with compulsory bave been able to learn from it. I bemilitary training, but they bave not lieve that the American combined Foreign done so. Relations and Armed Services Committees are very alarmed about the possibility of the maintenance of the future peace of the world. I believe that the report made a good speech. The right honourable that they made to President Truman was gentleman was forced into the position made with the object of ensuring that of having to do his utmost to justify the steps will be taken to maintain the forces actions before the war of the Government of the Tjnited States of America at the of which he was a member and to attempt highest possible degree of efficiency. According to the Minister for the man tried to blame the Labour party for Army, we have a regular army of 19,000 the condition of the defence forces of this men. I regard that force as a nucleus country at the outbreak of war in 1939. upon which to build. We must increase He quoted tbe words that were used by the size of the militia forces, which will, some members of the Labour party when in my opinion, be required to shoulder they were opposing proposals of the Gothe greatest burden if war occurs. If we vernment that was in office at that time. approach this problem properly, we shall Neither tbe right honourable gentleman be able to establish a militia force that nor bis predecessor as Prime Minister will be worthy of Australia. In 1938 we was game enough then to do what he increased the size of the militia to thought should be done. The Australian 85,000 men, and I believe that we could people will surely be puzzled by the do so again if the necessary effort were attempt of the right honourable gentleman made. Nobody who has the interests of to blame a party that was in a minority this country at heart can be satisfied with tbe present position. I appeal to the Minister to accept the advice of senior military officers, especially Lieutenant General Savige, who has stated that the lack of men in Australia who bave been trained in the use of modern weapons is a menace to the safety of this country. If the speeches that have been made by honourable gentlemen opposite upon the proposed votes for the defence services mean anything at all, they mean that it is the intention of the Opposition, if it is successful at the forthcoming general the honourable election, to reintroduce compulsory military training in Australia. However, honourable gentlemen opposite have not. stated specifically that that is tbeir intention. I ask them whether they are prepared to make that statement and let the people know where they stand. able member for Henty( Mr Gullett) to Before the sitting was suspended the Leader of the Opposition ( Mr Menzies) to explain its failure in the early years of the war. The right honourable gentle-",78,Camekon I Placed A Honourable Gentleman Was Then Himself
344,Mr Chambers,Did,80,Camekon I Placed A Honourable Gentleman Was Then Himself
345,Mr Francis,I say that it is dim,80,Camekon I Placed A Honourable Gentleman Was Then Himself
346,Mr Chambers,If we cannot get be,80,Camekon I Placed A Honourable Gentleman Was Then Himself
347,Honourable Gentleman Know That The In Mr Gullett,Of course they are.,80,Camekon I Placed A Honourable Gentleman Was Then Himself
348,Mr Francis,I have confidence make that statement officially.,80,Camekon I Placed A Honourable Gentleman Was Then Himself
349,Mr Thompson (Hindmarsh) [8.50].,,80,Camekon I Placed A Honourable Gentleman Was Then Himself
350,Mr Thompson,I want the honor,80,Camekon I Placed A Honourable Gentleman Was Then Himself
351,Mr Rankin,Giv e us a chance.,80,Camekon I Placed A Honourable Gentleman Was Then Himself
