speakerGroups,speaker,theText,pageNumbers,title
157,Mr Dedman,"The Commonwealthregulation. I agree that it would be of benefit to the community if some authority undertook such investigational work. The regulation to which I have referred was disallowed by the Parliament after it had operated for only a short period, and the Commonwealth did nothing further about the matter. If representations were made by the State governments that they were interested in this subject and that they believed that in the public interests investigations sbould be made into the contents of patent medicines, with a view to ascertaining whether they were really efficacious for the purposes for which they are advertised, the Commonwealth would gladly co-operate through the instrumentality of the Commonwealth Scientific and Industrial Research Organization. However, until sucb time as the governments that have constitutional power over this matter show some interest in it, I do not think that the Oommonwealth Scientific and Industrial Research Organization should be asked to undertake such investigations. The honourable member for Fremantle has also asked whether any allocations of nioney have been made for scholarships in the United States of America, and, if so, what amounts had been made available for that purpose. No specific funds have been allocated for that purpose. From time to time the executive of the Commonwealth Scientific and Industrial Research Organization makes recommendations to me that particular individuals should be sent to the United States of America to investigate certain problems. The executive also makes recommendations that individuals in the United States of America who have particular knowledge of specified subjects should be asked to visit Australia to assist us in the solution of our problems. Each of these recommendations is investigated on its merits. If it ie thought that a scholarship in a particular subject would benefit this country only if the student went to the United States, the recommendation is approved subject to a very thorough examination being made to ascertain whether the student concerned could not obtain the desired knowledge and training in some soft currency country. The same principle applies to recommendations made to me by the executive of the if r . Dedman. organization in relation to proposals to invite American specialists to this country. Not long ago a recommendation was made to me that an American expert in the science of genetics, Professor Lush, should be invited to visit this country. I asked whether it would not be possible to obtain the services of an expert from the United Kingdom who would be equally as reliable as Professor Lush. I was informed that the only individual in the United Kingdom who had the specialized knowledge which the organization wanted to impart to our own people who are interested in this matter was not available to pay a visit to Australia. In those circumstances, I approved of the recommendation that Professor Lush should be brought from America. Professor Lush subsequently visited Australia and I understand that the information which he imparted to our people who were engaged in the study of both animal and plant genetics has been of very great value to the organization. I believe that I have dealt with all the matters that were raised by the honourable member for Fremantle. If I have overlooked any matter I shall be glad to furnish what information I have about it at a later stage. I was very interested in the speech made by the honourable member for Fremantle ( Mr Beazley). When the honourable gentleman first came into this Parliament we gave him credit for inexperience, but we also gave him credit for intellectual honesty. However, during the brief period of his membership of the Parliament he has shown The TEMPORARY CHAIRMAN ( Mr Lazzarini) -Order! The honourable member must deal with the Estimates now under consideration. honourable member's intellectual honesty has deteriorated, I mention the fact that he referred to a booklet which, he said, had been issued by the Department of Labour and National Service. He went on to say that the booklet was so impartial that any government should be prepared to authorize its publication. However, he neglected to mention that in the foreword to the booklet, which was written",48,Commonwealth Scientifi C And Industrial Eesearch Organization
158,Mr Anthony (Richmond) [3.46],,49,Commonwealth Scientifi C And Industrial Eesearch Organization
159,Mr Anthony,"To show how theby tbe Prime Minister( Mr Chifley), the following statement appears:Even when Australia was in the grip of war, tlie then Prime Minister, Mr Curtin, agreed with me that social security in the post-war era demanded a comprehensive social services programme. We felt that the misery and hardship of past years were things which Australia should never have to endure again. that? Labour propaganda. Notwithstanding that fact, the honourable member for Fremantle endeavoured to persuade himself nnd those who may have been listening to his speech that this booklet is a straightforward document and that thousands of copies of it should be printed at the expense, not of the Australian Labour party, but of the public. I understand that 1,000,000 copies of tbe booklet are on order with the printers. Apart from that, I want to show how the Australian Labour party has debased this booklet. A copy of the booklet which has been handed to me by the honourable member for Swan( MrI t required Mr Kaiser himself, at a Hamilton) who, like the honourable member for Fremantle, comes from. Western Australia, has plastered all over it the words, "" Vote Labour. Webb for Swan "". We have been told that this booklet is not a propaganda document, that its printing involves a reasonable expenditure of government money, and that its contents would be endorsed by every right-thinking and fair individual in the community. Apparently the honourable member for Fremantle has slipped very greatly in the three short years of his membership of this Parliament. The honourable member invoked the name of General Eisenhower, saying that, as president of the Columbia University, that distinguished gentleman had refused to accept funds from the United States Government for use by the university if such acceptance involved a. promise of secrecy in relation to any research work undertaken by the university. Those are not the facts. The honourable member for Fremantle deliberately clouded the issue. Melbourne Herald of the 6th June, 1949. the following paragraph appeared:educationists, including General Eisenhower, President of tlie Columbia University, and Mr James B. Conant, President of Harvard, said to-day that Communists should be barred froi.i the teaching profession . . . It is because members of the Communist party are required to surrender the right to think for themselves as a consequence of becoming part of a movement characterized by conspiracy and calculated deceit that they should be excluded from employment as teachers. is w r o n g w it h Although the honourable member for Fremantle invoked the name of General Eisenhower., he omitted to mention those facts, of which I presume he was aware. The honourable gentleman spoke of young Kaiser. The Minister for Postwar Reconstruction ( Mr Dedman) has frequently assured the Parliament and the country that there is no need for us to worry about Communists in Australia having access to information about secret projects, and in his speech to-day he has given the committee assurance after assurance to that effect. He has said that we need not worry, because the screening authorities in Australia are so perfect and efficient that a Communist could not possibly get through the net. demonstration in London, to indicate that he had Communist sympathies. The assurances that the Minister gave us months ago, long before that demonstration occurred, have proved to be of no more value than other assurances that he has given us from time to time. The Minister's reputation in the Parliament is such that we on this side of the chamber cannot accept any assurance that he gives unless it is accompanied by documents that place the matter beyond any doubt. Although we have been told from time to time that there are no Communists in the employment of the Commonwealth Scientific and Industrial Research Organization, or the Council for Scientific and In dustrial Research as it was known at one time, they have come to light. I shall name one Communist, of whom the Minister has some knowledge, who was employed by the Council for Scientific and Industrial Research. I refer to the notorious Mr Rudkin, who was convicted In ' the during the war of treason. He endeavoured to impart military information to a foreign power. He served a term of six months imprisonment in a West Australian prison during the war, and after",49,Commonwealth Scientifi C And Industrial Eesearch Organization
160,Mr Calwell,What,50,Washington Wednesday Twent Y Lending
161,Mr Anthony,"Every line of it ishis release he was appointed, under the authority of the Minister for Post-war Reconstruction, to an important position in the Council for Scientific and Industrial Research. The Minister defended that appointment on every occasion when the matter was raised in the Parliament. He argued that Mr Rudkin was employed iu the forestry division of the Council for fied since the glorious plan of the GoScientific and Industrial Research and that he could not in such employment possibly obtain ' information . about secret work. The Minister may not be aware that Mr Rudkin has been endeavouring to secure employment in the physics laboratory of the University of Melbourne. In his application for employment he has doubtless referred to the fact that he was approved by the Council for Scientific and Industrial Research. I shall say no more upon that subject. Although the Minister told us that he has not approved of the appointment of Communists, we have found Communists popping up in the departments for which he is responsible. The honourable gentleman told us that the noted Dr. Atcherley was not a Communist, but the bonorable member for Reid( Mr Lang) produced evidence which showed that he was the secretary of the Canberra branch of the Communist party. member for Richmond( Mr Anthony) nization have not been concerned with suggest that Dr. Atcherley was employed the work of the organization but with by the Council for Scientific and IndusCommunist infiltration into it. I have trial Research? he was employed by that organization. I nization in respect of the work that it say that the Minister repudiated the sugis doing or the work that it is not doing. gestion of the honourable member for Reid The criticism that I now propose to offer that Dr. Atcherley was a Communist and relates to the failure of the Government endeavoured to prove that the honourable to provide sufficient money for the exgentleman hacl made a false assertion, but tension and development of the organizafinally evidence was produced which tion. showed that Dr. Atcherley was acting, under the very nose of the Government, as the secretary of the Canberra branch man complaining that there is not enough of the Communist party. In those cirsocialization ? cumstances, what confidence can we repose in statements by honourable gentlesocialization. We require scientific remen opposite that the Government is prosearch work to be undertaken so that tecting the community against the infiltraprivate industry may take advantage of tion of Communists into government it and use it for the development of departments? The eommittee is considering the prois one of the strongholds of private posed vote for the Department of Transenterprise in the British Commonwealth port. That department is supposed to be engaged upon the standardization of railway gauges in Australia. I think that a sum of £200,000,000 was appropriated for that purpose four or five years ago. Not long ago, I asked the Minister for Transport ( Mr Ward) how many miles of railway line had been univernment was unfolded to the Parliament, and I was told that not one mile of railway line had then been unified. 1 sincerely hope that there is a much better fate in store for the Snowy Mountains scheme, wbicb, on the eve of a general election, is being greatly publicized. It seems that man proposes, but that God, in His wisdom, disposes. High Court. there is a High Court. I hope that the justices of the High Court will live to be very healthy old men. I am sure that the members of the Labour party are wishing them a very short period of life, so that tbe Government can pack the High Court Bench. The criticisms that have been directed by honourable members on this side of the chamber against the Commonwealth never criticized the Commonwealth I do not say that Scientific and Industrial Research OrgaAustralia in a proper manner. Canada",50,Washington Wednesday Twent Y Lending
162,Mr Dedman,Does the honourable Scientific and Industrial Research Orga,51,Washington Wednesday Twent Y Lending
163,Mr Anthony,,51,Washington Wednesday Twent Y Lending
164,Mr Thompson,Sometimes it is the,51,Washington Wednesday Twent Y Lending
165,Mr Anthony,I thank God that,51,Washington Wednesday Twent Y Lending
166,Mr Calwell,I s the honourable gentle,51,Washington Wednesday Twent Y Lending
167,Mr Anthony,"We do not wantAccording to a document that was presented to the Canadian Parliament with the Canadian budget papers, in 1948-49 the Canadian Government expended 4S,000,000 dollars upon national scientific research. That sum is probably the equivalent of approximately £20,000,000 Australian. Although the Canadian Government has expended £20,000,000 in a year upon scientific and industrial research, the Australian Government is prepared to make only £2,000,000 available this year for that purpose. There are many jobs that the Commonwealth Scientific and Industrial Eesearch Organization could do that it is not doing. by the Government of which the honourable member Anthony) was a supporter? Council for Scientific and Industrial Eesearch. The honourable member for Brisbane( Mr George Lawson) apparently of thought that expects to where it should begin. There would be no development if theories of that kind were adopted throughout the world. The Governnient of which I. was a membei' established the Council for Scientific and Industrial Eesearch and laid the foundations of most of the work for which this Government is now claiming the credit. On the north coast of New South Wales there are many noxious weeds that the landholders themselves cannot possibly control or eradicate, and the Commonwealth Scientific and Industrial Research Organization could do some experimental work in that connection, but, PO far as I know, it has not done so. Nothing has been done in connection with hemp, which is fast invading some of our best land there. Very little has been done by the Commonwealth Scientific and Industrial Eesearch Organization in relation to the deficiencies of the soil along the coastal areas of New South Wales. The organization has one man at the experimental f a r m at Wallambah, but he has not yet submitted a report. I believe that in many instances the Government is not paying adequate salaries to its scientific and industrial research workers. The Commonwealth and the States are losing some of their best scientists to other countries because of the low salaries that they offer. The honourable member for Brisbane knows that Dr. Young, who is well known to many members of the committee, is now employed by the Government of Ceylon. State authority. salaries that are paid by Commonwealth and State departments have a certain relationship. If the Commonwealth were to increase the salaries of its scientific workers, the State governments would be forced to follow suit. Mr Lewcock, one of the most noted scientists in Queensland, is now employed in South Africa to advise for Eichmond( Mr upon agricultural problems there. Many of our scientists have been badly treated. Recently, I spoke to a man who has spent It founded the eighteen years of his life in a Government department. He is a Bachelor of Agricultural Science and a Master of Agricultural .Science. A f t e r eighteen years of belongs to the school service his salary is less than £500 a year. finish That man is employed by a State authority, but the salaries that are paid by the Commonwealth Scientific and In dustrial Eesearch Organization are similar to those that are paid by State authorities, although they may be a little higher. I suggest to the Government and to those who are responsible for the administration of the Commonwealth Scientific and Industrial Research Organization that the time has come to review the salaries of our scientists, especially those of the top-grade men who are now being attracted elsewhere. We must expend more money upon research and redevelopment of scientific techniques. At the present time almost every brancli of trade and industry in Australia is confronted with problems that can only hesolved w i fh the assistance of scientific investigations. What can we hope to achieve on a budget of £2.000,000 ? The reports that are issued by the Commonwealth Scientific and Industrial Research Organization reveal that the work of the organization covers many fields, but there is still much to be done. I am a practical farmer. I study the reports that are issued by the Commonwealth Scientific and Industrial Research Organization and other scientific",51,Washington Wednesday Twent Y Lending
168,Mr George Lawson,What was done,52,Washington Wednesday Twent Y Lending
169,Mr Anthony,,52,Washington Wednesday Twent Y Lending
170,Mr Beazley,He was employed by a,52,Washington Wednesday Twent Y Lending
171,Mr Anthony,"T h a t is so, but thebodies and try to make sense of them. I consider that the Commonwealth Scientific and Industrial Research Organization should publish its findings in such a manner as will enable them to be understood by the ordinary man on the land, who has to give effect to them. to judge, the Council for Scientific and Industrial Research adopted the view that once it completed an investigation, its responsibility in the matter ended, and that State Departments of Agriculture should distribute the information among interested sections of primary producers. I did not 'agree with that view. I have always believed that, from beginning to end, the Council for Scientific and Industrial Research, now the Commonwealth Scientific and Industrial Research Organization, should conduct investigations and give the widest possible publicity to its findings and recommendations. The problem of hemp which is most serious in the coastal areas of New South Wales and Queensland, must be solved. This plant pest is rapidly enveloping thousands of acres, and farmers, with their present knowledge and facilities, are unable to control it. Tbey urgently require financial and scientific assistance from the Commonwealth to enable them to maintain production in those areas. If the Government adopts a passive attitude towards that problem, our production of food, especially in the dairying districts, will further decline. The Minister for Post-war Reconstruction has defended the screening methods that are employed to exclude Communists from the staff' of the Commonwealth Scientific and Industrial Research Organization. I wonder whether the honourable gentleman's attention has been drawn to the report of a meeting of tbe Sydney University Labour Club some time ago, at which some 200 students protested against the dismissal from the Commonwealth Scientific and Industrial Research Organization of Mr Kaiser, who had participated in a Communist demonstration in London. The report states that a Dr. Makinson, lecturer in physics, saidAmerica is endeavouring internal policy. Mr Anthony. I. do not assume that Dr. Makinson is a member of the staff of the Commonwealth. Scientific and Industrial Research, Organization, but I point out that thestatement which he made is very much on. the Communist line. Some 200 studentsof the university supported the motion of."" As far as I am able protest. vvith the Commonwealth ? The TEMPORARY CHAIRMAN ' ( Mr Lazzarini) -It certainly is not related to the Estimates of the departments under consideration. Post-war Reconstruction defending the Communists? The TEMPORARY CHAIRMAN. The honourable member for Richmond had better leave the matter there, and deal with a subject that is relevant to these Estimates. the matter further than to say that an amount of £115,000 has been voted this year for security measures. Tbe TEMPORARY CHAIRMAN. Order! That is too thin. upon the assurances of the Minister for Post-war Reconstruction that the Commonwealth Scientific and Industrial Research Organization is completely screened against infiltration by Communists, the vote should be considerably increased. sonal explanation. In the early part of his speech, the honourable member for Richmond( Mr Anthony) referred to some remarks that I had made and endeavoured to refute my suggestion that the booklet on social services was not partisan. He said that I knew that that booklet contained the words, "" Vote for Labour, Webb for Swan"". I bave examined the 32 pages of the booklet, and I find that that statement does not occur on any of the pages. The bonorable member held up a copy of the booklet, and it was obvious that those words had been inserted with a rubber stamp. Having made that statement, the honourable member proto dictate our ceeded to wave the booklet about his head, and claim that it contained statements",52,Washington Wednesday Twent Y Lending
172,Mr Dedman,What has that to db>,53,Washington Wednesday Twent Y Lending
173,Mr Harbison,I s the Minister for,53,Washington Wednesday Twent Y Lending
174,Mr Anthony,I shall not pursue,53,Washington Wednesday Twent Y Lending
175,Mr Anthony,If we have to rely,53,Washington Wednesday Twent Y Lending
