speakerGroups,speaker,theText,pageNumbers,title
98,Mr Mccolm (Bowman) [5.18],"Iseveral business enterprises wbich run their own private aircraft, and personally I do not think there can be any valid objection to the Commonwealth Bank, or its governor, running an aircraft. I turn now for a few moments to a matter concerning the Department of Works, which, I feel, has given a considerable amount of concern to many honourable members. I have heard such concern expressed in private discussions, and at public meetings, and I believe that something should be done to investigate fully what is happening in the Department of Works which gives rise to all the talk one hears about inefficiency and over-expenditure of moneys. Responsibility for these shortcomings should be sheeted home. If they are the result of poor administration, steps should be taken to remove the officers who are responsible. [ f the Minister, because of the various tasks that he has to perform, is falling down on tbe job, serious consideration should be given to placing in charge of the department a Minister who would be prepared to do something about tlie situation. An investigation is warranted. I direct the attention of honourable members to page 37 of tbe annual report of the Auditor-General for 1954-55 on which, in relation to the control of labour and materials, particularly on projects in Papua and New Guinea, the following statement appears:Audit investigations in the Papua and New Guinea region have revealed a most unsatisfactory position regarding departmental control of projects constructed under contract hy various firms, including the following features:(i) lack of adequate design and forward planning; (ii) faulty cost of estimation; (iii) insufficient supervision of work in progress; (iv) over-expenditure of funds; (v) performance of additional work without authority; (vi) failure to process cost variations promptly; and (vii) failure to perform progressive quantity surveys to guard against incorrect that the department is placed on a much work and overpayments. That is only one small section of the criticism that is contained in the Auditor General's report. In his report for 195354 also, he offered some very severe criticism. Only comparatively recently, a public servant came down from New Guinea to Australia and gave to a lot of people first-hand information about what was ha2>pening in the Territory. As far as I know, all that has happened since is that some newspapers have carried articles dealing with the matter, and the Prime Minister( Mr Menzies), in answer to a question, has stated that he did not propose to take any action on the statements that had been made by that public servant. The Minister for Territories ( Mr Hasluck) wrote a. letter about this man, which was not quite accurate, and he did an injustice to him. The point is that those allegations were made by a man who had everything to lose if they were not accurate. Tbe Auditor General's Department has made a series of very similar accusations which bear out, to a large degree, the statements of that man, but, as far as I know, no action has been taken. I understand that the Public Accounts Committee proposes to visit the Territory of Papua and New Guinea, to investigate the activities of the Department of Works, and to submit a report upon them. I believe that the committee is unlikely to be able to make the visit for some considerable time-possibl y not within a year or more. The fact that so much has been said about the Department of Works and that the Auditor-General has made accusations in his reports suggests that urgent action should be taken. I should like to see such an investigation placed high on tbe priority list of matters that are to be investigated by the Public Accounts Committee. That is all I wish to say about this matter. I wanted to take advantage of the opportunity to direcl the attention of the committee to this lamentable state of affairs. Some action should be taken fairly quickly to ascertain whether there is any truth in the allegations that have been made, and whether the Auditor-General's report is accurate. If the allegations are accurate, some action should be taken to ensure sounder and more efficient footing. Mr W. M. BOURKE (Fawkner) [5.25], I wish to speak to that section of the Estimates which relates to the Department of Trade and Customs. I think every member of the community will agree that the big problem that confronts this country is the lack of balance in our overseas funds. ""We are living beyond our income. We are importing more than we are exporting, and we are eating into our accumulated overseas funds. I have heard no reference in the discussions on this urgent problem-ver y urgent as far as Australia is concerned-to the operation of tbe Ottawa Agreement and of imperial preference generally, wbich [ think constitute an important factor in this situation. This would be a very appropriate time for the Government to bave discussions on the operation of the Ottawa Agreement with the United Kingdom Secretary of State for Commonwealth relations, the Earl of Home, who is now in Australia and who to-day delivered a very fine address to members of the Parliament. As I understand the situation, the Ottawa Agreement is having an adverse effect upon our economy in two very serious ways. Eirst, it is resulting in the importation of goods which are up to 20 per cent, dearer than is necessary. Because of the operation of the agreement, >ve are paying up to 20 per cent, more than is necessary for consumer goods and capital goods that are being imported from countries other than the United Kingdom. That means that the cost of living in Australia is being pushed up accordingly at a time when it is so imperative that we should keep it down. Secondly, because of the inequitable manner iu which it operates, the Ottawa Agreement, in my opinion, is adding considerably to the general lack of balance in our overseas payments, and is contributing to the fact that we are importing very much more than we are exporting. BeforeI cite facts to illustrate my points, I want to make it quite clear that f support the general principle of imperial preference. T support the spirit that underlies the Ottawa Agreement, and [ believe that that spirit and that principle should continue to prevail. After all, the. crimson thread of kinship runs through all of us. and I think it is a very estimable principle that we should keep trade ""within the family circle as far as possible. Everything should be done to establish a system of imperial preference so that, as between Australia and the United Kingdom, and as between Australia and the other dominions of the Oommonwealth, we should have as much preference on a two-way basis as is possible. I repeat that I want to make i i perfectly clear that that is my belief, and. I think, the belief of the average Australian. AEost Australians support the spirit of the Ottawa Agreement and the principle of imperial preference. The manner in which the operation of the Ottawa Agreement has developed is such that I am afraid it is not working equitably for Australia, but is imposing a burden on our economy. The agreement dates from 1932, which was one of the depression years. It was never particularly favorable to Australia, and developments since 1932 have resulted in it now being a real handicap to our economy. Under the agreement, Australia, contracted to give to the United Kingdom a substantial preferential margin over all foreign competitors on all British manufactured goods coming into this country. No distinction is made between consumer goods and capital goods. It is in connection with capital goods, which Australian manufacturers sometimes prefer to bring in from Germany or tbe United States of America, that trouble arises particularly. Under the agreements, we give preference to all British-manufactured goods sent to Australia and, in return, the United Kingdom gives preference, not to all Australian exports to the United Kingdom, but only to some. For example, on our two main export commodities, wool and wheat, we do not get any preference on the British market. Although the agreements are based upon a sound principle with which we all agree, they are not working out equitably for Australia. We give preference to all British manufactured goods that come here, but we are given preference only on some of our exports to the British market. Then the methods of giving preference to the goods that come to Australia from the United Kingdom and to the goods that we send to the United Kingdom are different. That difference works against the interests of Australia. Goods that we import from the United Kingdom receive preference by way of an ad valorem duty, which is a duty hased on a percentage of the cost of the. goods. As I underthe protection is given to our goods exstand the position, the preference ranges from 12£ per cent, upwards and is close to 20 per cent, over the whole range of manufactured goods that come to Australia from the United Kingdom. But although the preference that we give to British goods that come to Australia is based on a percentage of the total cost of the goods, the preference given to goods imported into the United Kingdom from Australia is a fixed money margin per unit, regardless of the cost of an individual item. Eor example, we get a preference of 15s. per cwt. on butter and 4s. 6d. per cwt. on apples and pears. The important fact to remember in considering the difference between the methods of giving preference to Australian goods exported to the United Kingdom and goods brought from the United Kingdom to Australia is that since the agreements came into operation in 1932 there has been a substantial increase in prices generally. British-manufactured goods imported into Australia receive a form of protection based on a percentage of the value of the goods, so it will be obvious that the value of that protection has increased considerably since 1932, because I think it is fair to say that the cost of the goods has risen by three or four times since then. The quantum of the protection given to British-manufactured goods coming to Australia has increased proportionately with the increase of the cost of those goods. But the protection which our exports enjoy on the United Kingdom market is a fixed sum per unit. Although the price of our goods has gone up, the unit of protection has remained constant. As the cost of our goods has risen by three or four times since 1932, the value of the protection given to them now is only about 25 per cent, of what it was when the agreements first came into operation. Because there has been a substantial general increase in prices since the Ottawa agreements first became effective, the whole effect of the agreements has been altered and they are operating inequitably to Australia. Tbey are operating against the interests of the economy of this country, because there has been no attempt-a t any rate no successful attempt-to alter the bases on which ported to the United Kingdom and to British goods exported to Australia. There has been no attempt to bring up to date the measure of protection given to our exports and to make it more realistic in terms of present prices. We must be frank about these matters. I bave evidence to support what I am about to say. In addition, I am afraid that some British importing interests are taking advantage of the present position. I think that, in effect, they are departing from the real spirit of the agreements. We saw an example of that in connection with wheat. In 1952, Mr Butler, who was then the British Chancellor of the Exchequer, pointed out, quite rightly, that Australia was the main supplier of nondollar wheat to the British Commonwealtb, and he appealed to us to increase our production of wheat, but, subsequently, British importers bought wheat from the Argentine and the United States. They spent dollars to import wheat from those countries, although we had surplus wheat in this country. Because of this defect in tbe agreements, our wheat enjoys no measure of protection on the United Kingdom market. So we lost those possible sales of wheat to the United Kingdom-sale s that would have helped materially to improve our balance of trade. Similarly, it appears that some British manufacturers have not lived up to the spirit of the agreements. I have said before, and I say it again now because I do not wish to be misunderstood on this matter, that I support wholeheartedly., and so, I believe, do all tbe people of Australia, the spirit of imperial preference, tbe spirit of keeping trade in the family. But some British manufacturers bave not lived up to the spirit of the Ottawa agreements. Tbey have a preferential duty of up to 20 per cent, operating in their favour in respect of their exports to this country. They bave taken advantage of that fact to increase the prices of the goods that thpy send to Australia. They are selling goods to Australia at prices higher than those at which they are selling equivalent goods in other overseas markets and on the British home market. I believe that is a -ery serious state of affairs, -which is to the detriment of the Australian economy. I think there is a clear responsibility on this Government to do something to ensure that those British manufacturers who are not playing the game and are evading the spirit of the Ottawa agreements, will not be permitted to continue to treat the Australian consumers in that way. The Tariff Board, in its report for the year that ended on the 30th June, 1954-the latest report that I have been able to get-dre w attention to the fact that British manufacturers have been wsing tbe preferential tariff that they enjoy in this country, not as a basis to enable them to compete with manufacturers in other countries, but as a means to secure on the Australian market higher prices for their good3 than they can get -either on the local market in Britain or -on markets in other countries. The Tariff Board, in paragraph 26 on page 7, of its report for the year 1953-54, after referring to the appearance before it of -some representatives in this country of British manufacturers, statedAustralia is still an importer of some Taw materials from the United Kingdom. The Board has found many instances where United Kingdom suppliers have charged Australian -consumers prices much higher than those -charged to domestic users. The f.o.b. export prices charged to Australian users in one year -on three related products used as raw -materials by Australian industries totalled -approximately £125,000 more than the prices charged to domestic users in the United King-dom. United Kingdom interests can contribute -towards a lower t a r i i l level in Australia with greater effect and sincerity by removing such causes than by opposing the defensive measures taken by Australian industries. Despite the restrained language used in the report, that is a striking illustration which are allocated to them, if I may -of the fact that there is a clear responsiremind honourable members of something bility on this Government to see that the which most of them may already know, Ottawa agreements will be revised so that Australians travelling abroad are allowed they will not continue to operate in the a sum of £1,300 in the United Kingdom, lop-sided manner in which they have been of which £300 may be spent on the con-operating so far. the honourable member for Fawkner( Mr This is not an outright, unconditional W. M . Bourke), I wish to address myself licence, as one might expect. It is 'to the proposed vote for the Department astonishing to discover that Australian -of Trade and Customs. However, before travellers overseas, who number approxi-saying what I intend to say, I should like mately 50,000 a year, are not permitted to express my concurrence in general with to use their own money as they please. what the honourable member for Fawkner has said concerning the operation of the Ottawa agreements. I think that members from every corner of the chamber will agree on the value of those agreements, as in the past they have undoubtedly benefited the export industries of this country; but I think the committee will also agree with the honourable member for Fawkner that the time is long overdue for a revision of them, and that our own economy is being endangered by the manner in which they are operating at present. It must be said that the honourable member for Fawkner has rather overlooked the fact that the Government, so far as I know, is very well aware of these considerations. Unless1 am misinformed, some months ago the Minister for Commerce and Agriculture and negotiations in London along the lines that the honourable member has indicated. It is certainly not the fault of the Government that hitherto no revision of the agreements in Australia's interests has been possible. I believe the position to be that the representations of the Minister for Commerce and Agriculture were not heeded by the British Government, and consequently it will be necessary for him and the Government to renew the cry at the first convenient opportunity. WhatI have to say this afternoon concerns an entirely different matter, and 1 say at once that it is not of the same cardinal importance as that which has been raised by my friend, the honourable member for Fawkner. I refer to the limitation placed on Australian travellers overseas in regard to the manner in which they can 3pend the not very liberal funds tinent of Europe. In addition, I am informed, 200 dollars are permitted for",38,Department Of Health
99,Mr Downer (Angas) [5.40],Lik e travel in the United States of America.,42,Department Of Health
100,( Mr Mcewen) Entered Into Conversations,"The TEMPORARY CHAIRMAN Will the honourable gentleman indicate the item which he is discussing? tbe first item, Salaries and Allowances, in the schedule at page 178 of the Estimates. The point I am coming to deals with import licensing. I regret that 1 bave to take up time with this preface in order to make the point. The TEMPORARY CHAIRMAN Lt is in connexon with the Department of Trade and Customs? ing, this is not an outright, unconditional the morning. I hope that the Ministers licence. It is granted, apparently, solely in the chamber this afternoon will direci to cover the cost of travel, living, and clothing, and this sum may also be used for the purchase of small personal articles O'Sullivan) to this anomaly, and seek to and a variety of minor gifts. The facts have been brought to my notice by travellers who wished to bring home to Australia for their own personal use some of the many fascinating objects in which, as we all know, the old world abounds, -such as an old master, a modern painting, a piece of antique furniture, a dinner serfrom the fact that the Minister for Trade vice, or a particularly pleasing Persian rug. Many of these items are unobtainable in Australia, but may be purchased relatively cheaply, in comparison with our own costs, in England and in various countries of Western Europe. Australians abroad, even while keeping within the total travel allowance of £1,300, can well afford to pay for them out of these permissible funds. Imagine their surprise, however, upon discovering that they aro not allowed by the Department of Trade and Customs to do so. No import licence will be granted for articles bought in this House of Representatives and the Senate, way out of this allocated amount. I suggest to the Government that this is a regulation which is at once an unwarranted infringement of the liberty of Australian travellers and an affront to common sense. The economics of the matter surely are that each overseas travel allowance is reto British Commonwealth countries. garded as an import. I think that that is incontestable. Is it wrong, then, to spend a small portion of this money, which I emphasize is the money of the Australian traveller concerned, on goods of value and durability? Is it right to spend it entirely on consumer goods or services of an entirely evanescent nature, such as fares on aircraft, hotel bills, clothes, or parties and entertainments? Surely the national interest is better served by the purchase, for example, of a fine picture than by giving a monster dinner party a' the Savoy. The former might well enrich the private and public art collections of this nation for centuries. A dinner, afwe all know, will be consumed in a few hours, with nothing left except hazj memories, an enormous bill-that is quite certain-and , for some of the participants at any rate, the inevitable sore head in the attention of their colleague, the Minister for Trade and Customs (Senator have it rectified at the first possible opportunity. It is quite illogical, it is contrary to the public interest, and it if indefensible on any reasonable ground. I should like now to pass to another subject for general consideration, arising and Customs does not belong to this committee, but sits in another place. It is true that I have said this before in other years, but as no notice has been taken 1 hope the committee will bear with me if 3 say it again. There has been some talk about tbe appointment of a committee consisting of members on both sides of the two houses to consider a revision of the Commonwealth Constitution. I suggest that one of the many reforms which this committee might consider is to allow an interchange of Ministers between the for tbe purpose of piloting through estimates such as we are now considering, and also so that the Minister in charge of a bill could direct it through each of these constituent assemblies. There is, of course, nothing novel in this idea. The system operates in various other legislatures, and particularly in two belonging I refer to the Parliament of the Union of South Africa and also to the Parliament of Northern Ireland. From inquiries I have made, this system works well in both those countries, and I should imagine that if we are to improve the",42,Department Of Health
101,Mr Downer,I am dealing with,43,Department Of Health
