speakerGroups,speaker,theText,pageNumbers,title
121,Mr Johnson,"I am relating mycapacity of the industry to earn money overseas. Large overseas shipments of asbestos from Wittenoom have been made during this year. It is understood that tbe firm orders held by the company for this calendar year total 6,000 tons, at an f.o.b. price of £100 a ton. That means that our balance of payments will be assisted to the extent of £600,000 during the current year. If the tariff requested were approved, that figure could be practically doubled, because imports could be reduced. But that aspect of the matter meant little to the Tariff Board, because apparently it was not even considered by the board in arriving at a decision. It seems odd that 6,000 tons of asbestos can be sold on the world market at £100 a ton f.o.b., while the Tariff Board has valued the material at only £56 a ton f.o.w. if used in Australia. On that basis alone, the board declared the industry to be uneconomic. In view of those points, and having recontinue. gard to the fact that the balance of payments and the restriction of imports are playing such a major part to-day in our economy and probably will continue to do so in the future, I strongly recommend that the Government review the valuation placed on the industry by the Tariff Board, particularly as imported asbestos cost over £3,000,000 during the last finanour minds that had this industry been cial year. Doubtless the Government will accept the Tariff Board's report and recommendations, but I hope that full and favorable consideration will be given to the provision of some other form of assistance by the Government to this vital industry. I believe that the Commonwealth, in conjunction with the Western Australian Government, should make every effort to keep the industry moving. It has been responsible for the establishment of a town in one of the most isolated parts of the north-west of Western Australia. It has done a magnificent job. It has provided amenities for its workers which are equal to those enjoyed by workers in any other part of the State. I appeal to the Government to give consideration to the possibility of assisting the industry. I point out that it is an industry which tion of the document should be made at is not without strategic value to this country. Let me read a letter, dated the 22nd December, 1943, written by the Director-General of War Organization of Industry. It is published in a booklet entitled The Australian Mineral Industry. The letter is as follows:. . . inquiries have been made amongst all the Commonwealth Departments concerned, and I am now able to place on record the fact that there is complete agreement as to the importance and urgency attached to your projects for the production of asbestos fibre in Tasmania and Western Australia. That gave the company encouragement to continue in 1943. Because of that encouragement and the assistance received from the Federal and State governments this industry was established. If it does not now receive financial aid from the Federal Government another ghost town will be seen in Western Australia. One of the newest towns that have been developed in that State will go down overnight, unless action is taken urgently to give the industry an opportunity to every justification for the plea of the honourable member for Kalgoorlie ( Mr Johnson) on behalf of the blue asbestos industry at Wittenoom Gorge. Here is an opportunity for the Government to dispel an idea which may be prevalent in established on the eastern side of the Nullabor Plain the plea which is being made for assistance would not need to be made so strongly and without result. I support the remarks of the honourable gentleman. Tbe persons who established this industry are deserving of the highest praise and every encouragement to continue an undertaking which is very valuable. I want to make some reference to a White Paper which has been distributed to the Parliament in connection with the budget and which makes its appearance for the first time in the Parliament's history. The White Paper deals with the civil works programme for 1955-56 and, while its contents will come up for discussion under the proposed votes for capital works, it is appropriate that menthis stage, because the works to which it refers are to be carried out by the Department of Works. For the first time in",54,Department Of Health
122,Mr Leslie (Moore) [9.1],"There ishistory, honourable members are able to know where the Government proposes to expend some of the vast amounts of money which they will be called upon ultimately to approve. It is more than three years since, from my place here, I attacked the holus-bolus presentation of the budget, with honourable members being asked blindly to approve the expenditure of tremendous amounts of money. The proposed expenditure of about £1,000,000 for an Australian embassy in India was submitted to the Public Accounts Committee. Parliament had approved the expenditure of that vast amount of money by approving an initial expenditure of about £500. The civil works programme amplifies the information given in tbe Estimates, and it indicates not only the amount which it is proposed to spend during the year, but also the amount authorized in previous years, and the balance required for further expenditure, so that honourable members will be aware of the Government's commitments in connection witb its works programme during the year. I pay a tribute to the Minister for the Interior( Mr Kent Hughes) for having initiated this very valuable move. It is in conformity with recommendations which were made to the Parliament by the Public Accounts Committee. The adoption of the suggestion encourages the honourable member for Warringah ( Mr Bland), with myself and other members of the committee, to hope that eventually, and within a reasonabletime, parliamentary control of public affairs will be restored, if it ever existed. starts, of course, in the right way with Tbe proposed vote for the Department of Health is £1,136,000, which is only the cost of administering the department. I should like to see included in the Estimates some reference to the funds which are actually controlled by a department. The Department of Health has a wonderful record and could very well include for the information of the Parliament the amounts which it proposes to spend during the coming year as well as a comparison with the expenditure for past years. Honourable members would then be made aware of the wonderful effort of the Government towards improving the health of the people of this country. Ln 1949-50, when the Government took office, the total vote for health provisions in the Department of Health, including tuberculosis, medical, pharmaceutical and hospital benefits, and children's nutrition, amounted to £7,508,877. This year the department will disburse for these purposes £40,000,000. That is not a bad effort in five years. It reflects great credit upon the Minister for Health( Sir Earle Page). It is a tribute to his wisdom and illustrates the tragedy which would befall the people of this country should they be denied his services in this place. The proposed expenditure this year is £4,250,000 in excess of the amount provided last year. That is not additional money going down the drain in mere expenses. It is made up of additional health benefits provided to the public. The policy of the Department of Health, which is also the personal policy of the Minister because of his medical knowledge, has been the prevention of ill health rather than its mere alleviation. As I see it, the medical benefits scheme is based on prevention. Statistics could tell a story of great success in this direction in the field of tuberculosis. I am only a layman, but I have gained some knowledge from personal contact witb people in this field. The Minister could confidently assure the country that, provided we can exclude people infected with tuberculosis, the day is in sight when we shall have this disease completely under control, and within a reasonable time after that we may expect its almost entire elimination from Australia. This is a very fine record indeed. The Minister the nutrition of school children and the provision of health benefits for them. I am always concerned that in every field of governmental action there is always a cleft down which some unfortunate people are likely to slip because of a conflict between departments or because of a division of responsibility. I am concerned for that section of the people who might fall into this cleft. I refer to the physically handicapped young people. The Department of Health is concerned with the health of the people, and witb sickness; but tbe physically-handicapped children, and even the adults, are not necessarily sick people, so they do not come within tbe ambit of the department. They may come within the ambit of the Department of Social Services, once they have the right to claim social services benefits. Between tbe two, they seem to be nobody's baby. I suggest to the Minister for Health that the time has now arrived when he should call into consultation the Minisin order to make certain that this particular group of people is not allowed to 3lip into this cleft between the two departments. The Commonwealth cannot escape its responsibility in this connection. together on their part. It has to do the job. Up till now, the job has been neglected. I am not prepared to say that any particular government is responsible for that neglect, but the problem must be tackled now. I was fortunate enough to attend a conference of the Australian Cerebral Palsy Association in Brisbane last week and I learned from leading medical men that the problem of cerebral palsy was submitted to the medical profession for action as far back as 1S61. It was not until five or six years ago that this probmedical or hospital benefits, their claims lem of cerebral palsy of spastic children was attacked, and then it was by voluntary effort of laymen. Fortunately, it is recognized to-day in medical quarters that this problem is their real responsibility. It is also the responsibility of governments, and something can and should be done about it. I do not know whether this is the result at death and the company having no of the influence of our Minister, but the keynote of discussion in the medical and educational fields at that conference was prevention, and I was delighted to learn from the highest medical authorities in the Commonwealth who were in attendance that provided appropriate action is taken at the proper time, this is a preventable No stigma is now attached to cerebral palsy, yet nothing was done for children in this group, although their case was put forward in 1861, until laymen voluntarily undertook to provide what we have in Australia to-daya clinical and educational centre in every State, maintained by voluntary contribution from the public. The purpose is to assist a section of young people wbo hitherto have been kept hidden away in back yards and dark rooms, because the public did not understand the nature of the complaint. That section demands attention to-day. These centres have proved what can be done for these children, and that demands action by all governments. I am not prepared to say that it is the responsibility of either the Department of Health or the Department of Social Services alone. I believe it is a problem whicb concerns both departments. I believe that the problem demands some getFinally, I ask the Minister for Health to investigate the system of collection of medical benefits contributions from members of medical benefit societies or companies, whatever they may be called. It has come to my notice that certain organizations collect contributions from their members by the sale of stamps, which are stuck on to a piece of cardboard, or a piece of paper. When the contributors to those companies or societies claim either are recognized only upon the production of that cardboard or piece of paper. Tbey may have contributed for years, but if they cannot produce the card or paper, their rigbt to any benefit under the scheme disappears. That is a slip-shod way of conducting the affairs of such an organization. Imagine any one paying premiums to a life assurance company for a benefit record of whether or not the insured person had kept up his contributions and relying completely upon the production of the policy in the event of a claim ! Some investigation needs to be made, and some better method should be evolved so that there will be a record of whether a person is financial, up to the time of his claim complaint. or up to the time of his illness, in the organization in which he may be enrolled as a member. If the department should make an investigation of the financial circumstances and liabilities of these organizations I do not see how any of them could satisfy it that they are solvent and able to meet claims made by those who have been contributors unless they have registers of their financial members.",55,Department Of Health
123,Ter For Social Services ( Mr Mcmahon),"The TEMPORARY CHAIRMAN. Order! The honourable member's time second place, the honourable member for bas expired. [9.16] The honourable member for good enough for me "", and that "" What is, Moore( Mr Leslie) will find very few is best"" and all proposals for change Australians willing to join in his paean should be rejected. In that, he echoes of praise of the present Minister for the philosophy which truly represents Health( Sir Earle Page). While this the political outlook of the members of Minister may have pleased the representathe Liberal and Australian Country tives of vested interests who sit on the parties who over the years have resisted Government benches, he will go down all change and all progress until they in history condemned by the great majorhave been reluctantly forced to make ity of the Australian people because of some change by the forces of progress bis destruction of the splendid system represented by the Labour party on this of throughout the Commonwealth by the Chifley Government. He will be remembered as the Minister whose parsimony the Commonwealth will operate the ambuin refusing to increase even by Is. a day lance services, just as I hope to live to the 8s. a day paid by the Chifley see the day when the Australian ParliaGovernment for each occupied bed, ment will possess unlimited legislative and thus refusing at a time when powers under the Constitution. We will inflation had taken half the value have then a truly national parliament, out of that money, contributed to clothed with power both to raise revenue the suffering of tens of thousands of and to direct its expenditure. Instead hospital patients, and caused the increase of the present system of six sovereign in hospital fees in various States, Liberal State governments, we will have twenty and Labour alike. The Minister will also be remembered delegated powers and responsibilities as for the introduction of a policy comare handed to it by a sovereign national pletely opposed to the modern social parliament. thinking in that he has created once again a flat-rate contribution scheme for hospital and medical benefits under the people of Canberra to-night by the which the poorest person in the communhonorable member for Bennelong as ity is levied exactly as much as the richest unusual, because it is unusual in these member of the communitya policy that days to hear such an attack made publicly was in defiance and repudiation of the in this chamber. It is, of course, not present-day concept that people should uncommon to hear such criticisms voiced contribute according to their means privately by tbe members of the Gotowards the services of the community. vernment parties. I was very interested Before passing on to deal for a few Liberal members around him applauded minutes with the most remarkable attack his attack on the people of this National made by the honourable member for BenneCapital, because what he said was in long ( Mr Cramer) upon the people of direct line with the attitude that was Canberra, I should like to refer to the taken by those who were the predecessors statement so flatly made by the honorof the present Liberal members of this able member for Oxley (Dr. Donald Parliament. They resisted the establishCameron) that ambulance services are ment of Canberra. They have never had the responsibility of the State governany sympathy with the ideal of a ment and never the responsibility of the national capital. Federal Government. In the first place, he completely forgets that even under its limited constitutional powers, the Bruce and I brought the people up here. Commonwealth has powers that enable it What the honourable member bas said is to conduct ambulance services. In the Oxley is an outstanding exponent in this chamber of the philosophy that "" What free hospitalization established side of the chamber. I hope that the day will come when or more new States, or provinces, each in its own area, administering such I have described the attack made on to observe the manner in which his fellow Sir EABT.E PAGE -We voted for it.",57,Department Of Health
124,Mr Allan Fraser (Eden,"Monaro) was good enough for my grandfather isabsolute nonsense. He should look at the inscriptions on the foundation stones. deny to the Minister for Health any of the pleasures of recollection that he has. minute! I cannot allow to fall on the right honourable member for Cowper the mantle of the great King O'Malley, and I cannot allow him to claim the credit for the establishment of Canberra; the decision was taken before his day. proclamation from the English Parliament. The TEMPORARY CHAIRMAN . -The honourable member for Eden Monaro should get back to the Estimates. with the proposed votes for the Department of the Interior, which relate to Canberra. Of course, what particularly angers the honourable member for BennelongI shall leave the right honourable member for Cowper for the time being -is that in this National Capital, it is not possible for private speculators to make any money out of unimproved land values. Bennelong is, in his own profession, the direct representative of the collectors of unearned increment in the community. The City of Canberra-indeed , the Australian Capital Territory as a wholestands out as an oasis in Australia. It is the one place in which that form of exacting tribute from the people who really do the work and create the values is not permitted. One can walk throughout the whole extent of Canberra and not see on any unoccupied block of land a "" Eor sale "" notice, because in this area land speculators and private estate agents have no means of taking an unearned profit by holding land out of use until the surrounding community has increased its value and then taking that value for themselves. business here. able member for Bennelong could not set up his business here. That is what annoys him so much. He does not like to see such a system in existence. He therefore says that harsher terms should be imposed on tbe citizens of Canberra who are the tenants of the Government and the occupiers of government property. He says that they are not paying enough for the houses which they occupy. He refused to accept the figures that were so courteously offered to him by the honourable member for St. George( Mr Lemmon), which show that the citizens of Canberra are paying rent on the basis of 6 per cent, of the capital value of tbe houses that they occupy. Of course, the honourable member for Bennelong does not think that that is nearly enough. In these matters, he is a bit of a usurer; he would like to see a basis, not of 6 per cent., but of 10 per cent., 15 per cent., or 20 per cent., if he could get that much out of the unfortunate tenants of the houses which are owned by those people whom he represents in the community. The people of Canberra, next, I should say, to the people in the electorate of Eden-Monaro, are the most intelligent people in Australia. honourable member for Mallee, who is interjecting, deny that that is so? After The honourable member for all, the electors of Mallee did not show mucb intelligence in their choice of a representative in this Parliament. The people of Canberra set an example to the whole of the remainder of the people of Australia. The TEMPORARY CHAIRMAN. Order! That matter is not covered by the proposed votes for the Department of the Interior. full for the homes that they occupy and, indeed, in many cases tbey pay and suffer considerably for the fact that they have to live in this city. They miss in Canberra many of the social services which are available in the States. By living in a city which is so spread out as this one is, they are compelled to pay particularly high transport charges. I consider that the present rentals and other charges which are levied on them by the Minister for the Interior( Mr Kent Hughes), far from being too low, are in many cases far too high, and I believe that the members",58,Department Of Health
125,Mr Allan Eraser,I would not,59,Department Of Health
126,Sir Eakle Page,Tel l the truth for a,59,Department Of Health
127,"Mr Allan Eraser,",I am afraid,59,Department Of Health
128,Sir Earle Page,I received the,59,Department Of Health
129,Mr Allan Eraseri Am Dealing,,59,Department Of Health
130,Mr Russell,He could not set up his,59,Department Of Health
131,"Mr Allan Fraser,",The honor,59,Department Of Health
132,Mr Turnbull,You will get on!,59,Department Of Health
133,Mr Allan Fraser,Would the,59,Department Of Health
134,"Mr Allan Fraser,","They pay inof the Liberal party, in the Australian Commonwealth contribution to the Capital Territory at least, will be the first revenue of the hospitals has grown from to repudiate the utterances that have been just on £6,000,000 to more than made in this chamber on behalf of that £13,000,000. In the case of New South party to-night. for Health) [9.28] I rise to rebut the to get out of the red. In the year that statements that have just been madeextravagant, fantastic and false stateMelbourne wrote to me and stated-as ments-by the honourable member for they had written to their own State Eden-Monaro( Mr Allan Fraser). He Premier-that they had reached a stage said that we have treated the States with at which they were unable to keep their parsimony. Let me tell him what the beds open. Dr. Schlink, tbe chairman of State Premiers thought when the Labour directors of the Royal Prince Alfred HosGovernment, of which he was a member, pital in Sydney, said that he would have forced its scheme down their throats. At to close whole sections of his hospital the conference of Commonwealth and because of the position. What is the State Ministers that was held in Canberra position to-day ? We are now giving them on the 16th and 17th August, 1949, three approximately £13,000,000 a year instead months before this Government came into of the £6,000,000 that they were getting office and started to provide some real before. Some States are receiving three relief to the hospitals of Australia, Mr times as much as they received before. Hollway, the then Premier of Victoria, As a result, every available hospital bed saidAlthough the Labour Government may claim after hospital has sent me its accounts to that it provided free hospital treatment, it show how its financial position has was done very largely at the expense of the improved. I was recently asked to a States. Mr Hanlon, the Premier of Queensland, which the Leader of the Opposition (Dr. saidI do not suppose that any of the Premiers he was the representative of Balmain in thinks that he can get it both ways. If the the New South Wales Parliament for Commonwealth's hospital increased, that fact will be taken into conthat for the first time the hospital had sideration in fixing the general Commonwealth allocation to the States. There is a ended the financial year with a credit catch in this hospital benefits scheme, and balance. The gathering, which was held the States were foolish to enter the agreement on the occasion of the 80th anniversary in its present form. South Wales, said the same thing in large body of waterside workers was regard to the States being penalized by present. that scheme. Every one of the States was anxious to get it altered as soon as we by the former Labour Government were came into office. Labour's scheme was simply a snare and a delusion. Take its simply a trick, under which the State miserable offer to the States in relation governments were given a certain amount to mental institutions: The Labour Goof money on condition that they ceased to vernment asked the States how much they collect a similar amount. It did not were collecting. The amounts collected result in any increase at all of general by the respective States varied between hospital revenues. They were sick and 8d. and Is. a day for each patient. The tired of it. Finally, they all came into allegedly generous Labour Government, this Government's scheme on the 1st which the honourable member for EdenOctober, 1952, when, as honourable memMonaro says showed us a good example, bers will recall, we were at the height of informed the States that it would give the inflationary period. Under this Gothem Sd. a day for each patient if they vernment's scheme, the amount of the would cease their collections. Not one Wales, the amount has grown from £2,500,000 to £6,500,000. The scheme that action was taken, every hospital in is in use at the present time. Hospital function at the Balmain Hospital, about Evatt) should know something, because contribution is some years. I was told at the function of the opening of tbe hospital, was The social services that were promised",59,Department Of Health
