speakerGroups,speaker,theText,pageNumbers,title
0,(First Session,"SECOND PERIOD.) An Act to provide for the Grant of Leases, Licences and Trading Rights in connection with Commonwealth Airports. An Act to grant and apply out of the Consolidated Revenue Fund a sum for the service of the year ending the thirtieth day of June, One thousand nine hundred and sixty, and to appropriate the Supplies granted by the Parliament for that year. An Act to grant and apply out of the Consolidated Revenue Fund a sum for the service of the year ending the thirtieth day of June, One thousand nine hundred and sixty, for the purposes of Additions, New Works and other Services involving Capital Expenditure and to appropriate the Supplies granted by the Parliament for that year. An Act to amend the Australian Capital Territory Representation Act 1948-1949, as amended by the Australian Capital Territory Representation Act 1959. An Act relating to the Promotion of the Sale of Canned Fruit. An Act to amend the Canned Fruits Export Control Act 1926-1956. An Actuating An Act to impose a charge upon Canning Fruit. An Act to amend the Commonwealth Employees' Compensation Act 1930-1956. An Act relating to the Liability of the Commonwealth and Commonwealth Authorities in respect of Death or Personal Injury caused by, or arising out of the use of, certain Motor Vehicles. An Act relating to Duties of Customs. An Act relating to Duties of Customs. An Act relating to Duties of Customs. An Act to provide for the Validation of Collections of Duties of Customs under Customs Tariff Proposals. An Act relating to Retirement Benefits for Members of the Defence Forces of the Commonwealth. An Act relating to Duties of Excise. An Act relating to Duties of Excise. An Act to provide for the Validation of Collections of Duties of Excise under Excise Tariff Proposals. An Act to amend the Export Payments Insurance Corporation Act 1956, as amended by the Export Payments Insurance Corporation Act 1959. An Act to amend the Law relating to Income Tax. An Act to amend the Law relating to Income Tax. An Act to impose upon Incomes a Tax by the name of Income Tax and Social Services Contribution. An Act to amend the Income Tax and Social Services Contribution Act 1959. An Act to impose Income Tax and Social Services Contribution upon certain Dividends derived by Non-residents. to the Payment and Collection of the Charge imposed by the Canning-fruit Charge Act An Act to amend the Income Tax (International Agreements) Act 1953-1958. An Act to approve Acceptance by Australia of the International Wheat Agreement, 1959, and for other purposes. LIFE INSURANCE ACT 1959 (ACT No. 93 OF 1959)An Act to amend the Life Insurance Act 1945-1958. LOAN ACT 1959 (ACT NO. 100 OF 1959)An Act to Authorize the Raising and Expending of a certain Sum of Money for Defence Purposes. LOAN (HOUSING) ACT 1959 (ACT No. 75 OF 1959)An Act to authorize the Raising and Expending of Moneys for the purposes of Housing. LOAN (SHORT-TERM BORROWINGS) ACT 1959 (ACT NO. 61 OF 1959)An Act to Authorize the Borrowing of Money by the Commonwealth for Short Periods and the Expending of the Money so borrowed. LOAN (WAR SERVICE LAND SETTLEMENT) ACT 1959 (ACT NO . 74 OF 1959VAn Act to approve the Borrowing of Moneys for a Defence Purpose, namely Financial Assistance to the States in connection with War Service Land Settlement, and to authorize the Expending of those Moneys. An Act to amend the Loans Securities Act 1919-1956. An Act relating to Marriage and to Divorce and Matrimonial Causes and, in relation thereto, Parental Rights and the Custody and Guardianship of Infants. An Act to amend the National Health Act 1953-1958. An Act to amend the Nationality and Citizenship Act 1948-1958. An Act to Encourage the Search for Petroleum in Australia by Subsidizing Stratigraphic Drilling and certain other Operations. POST AND TELEGRAPH RATES ACT 1959 (ACT No. 56 OF 1959VAn Act to amend the Post and Telegraph Rates Act 1902-1956. An Act to amend the Rayon Yarn Bounty Act 1954-1956, as amended by the Rayon Yarn Bounty Act 1959. An Act to amend the Repatriation Act 1920-1958. An Act relating to the Classification of certain Motor Vehicles for the purposes of Sales Tax. An Act to amend the Science and Industry Research Act 1949. An Act to amend the Seamen's Compensation Act 1911-1954. An Act to amend the Seamen's War Pensions and Allowances Act 194U-iy58. SEAT OF GOVERNMENT (ADMINISTRATION) A CT 1959 (ACT NO . 90 OF 1959)An Act to amend the Seat of Government (Administration) Act 191U-1S53. An Act to amend the Social Services Act 1947-1958. An Act to grant Financial Assistance to the States. ST A X AX&G An Act relating to Superannuation. An Act to amend the Taxation Administration Act 195J-1!0'. AnEvidence Act to amend the Therapeutic Bill 1959. NO . OF THE 73 OF SESSION. 1959)Initiated inSubstances the HouseAct 1953. of Representatives. Read a first time. PensionsHealth Benefits To Pensioners Petition...........................................................................................................................................................265 Social Service Benefits Petition...........................................................................................................................................................265 Pensions Petition...........................................................................................................................................................265 Ministerial Arrangements......................................................................................................................................265 Question Question Question Question Question Question Question Question Question Question Question Question Question Question Question Question Question Question Question Question Question Hour Of Meeting...................................................................................................................................................273 Matrimonial Causes Bill 1959 Second Reading..............................................................................................................................................273 Suspension Of Standing Orders ............................................................................................................................296 Question Answers To Questions Supreme Court of Papua and New Guinea .....................................................................................................321 Statutory Rules...............................................................................................................................................322 Lung Cancer...................................................................................................................................................323 Medical Benefits Scheme...............................................................................................................................323 Shipbuilding...................................................................................................................................................324 Tuesday, 18th August, 1959. took the chair at 2.30 p.m., and read prayers. Petition. from certain citizens of Australia, praying that the House will1. Give immediate consideration to the matter of increasing the rate of age, invalid and widows' pensions to at least 50 per cent, of the basic wage; 2. Amend the National Health Act to make the pensioner medical service available to all pensioners irrespective of means; and 3. Provide increased pharmaceutical benefits for pensioners. Petition received and read. Petition. certain electors in the States of the Commonwealth praying that the House will take immediate steps to increase social service benefits for mothers and their children. Petition received and read. Petirion. a petition from certain members of the Pensioners League of Queensland praying that the House will give immediate consideration to the matter of increasing pensions to no less than 50 per cent, of the basic wage as the minimum. The petition is respectfully worded, concludes with a prayer and bears the Clerk's certificate that it is in conformity with the Standing Orders of the House. It is not in conformity with my own views. F.6207/59 -R -[10 ] sistent with petitions presented to the House in the past week, I move that the petition be received. Petition received. Mr Speaker. I desire to ask you whether it is a fact that a member of this House is obliged to vote as he calls, and, if this is so, whether it is also a fact that members who present petitions advocating certain changes are obliged to support those petitions. House that the Minister for External Affairs( Mr Casey) has left Australia on a visit to South-East Asia and Europe. The Minister left Australia on 17th August for Singapore and Bangkok, where he will attend the last day of a regional conference of heads of External Affairs missions in South-East Asia. From Bangkok he will proceed to Europe, spending about two days at each of our posts in Rome, Paris and Bonn, and a week in London in discussions prior to the United Nations Assembly, which commences on 15th September. The Minister will visit Ottawa before going to the United States of America, where he will attend an Antarctic conference at Washington. conference, and it will be held on 15th October. Jt might have been better if the Antarctic conference had been held in August, for climatic reasons. However, it is to be held in October. He will also attend an ANZUS meeting, the date of which has yet to be arranged. On his return journey he will represent Australia at the ministerial Colombo Plan conference to be held at Jokjakarta from 10th to 13th November, after which he will return to Australia. My colleague, the Attorney-General( Sir Garfield Barwick), will act as Minister for External Affairs while the Minister is abroad, and the Minister for Health (Dr. Donald Cameron) will act as Minister in charge of the Commonwealth Scientific and Industrial Research Organization.",6,Setup
1,Mr Speaker (Hon. John Mcleay),,10,Ministerial Arrangements
2,Mr Kearney Presented A Petition,,10,Ministerial Arrangements
3,Mr Fulton Presented A Petition From,,10,Ministerial Arrangements
4,Mr Pearce,"Mr Speaker, I present",10,Ministerial Arrangements
5,Mr Speaker,Order!,10,Ministerial Arrangements
6,Mr Pearce,As this petition is con,10,Ministerial Arrangements
7,Mr Ward,"I rise to a point of order,",10,Ministerial Arrangements
8,Mr Speaker,Order!,10,Ministerial Arrangements
9,Mr Menzies,I desire to inform the,10,Ministerial Arrangements
10,Mr Haylen,He blows hot and cold!,10,Ministerial Arrangements
11,Mr Menzies,"It is a very importantthe Postmaster-General been directed to certain criticisms by the publishers of religious newspapers, to the effect that as a consequence of the new postal regulations which the honourable gentleman announced last week many of these publications may have to go out of existence, and that in any case the costs of distribution of the publications will rise, as a result parison as being valid in the case that he of the new regulations, by anything up to 800. per cent.? representations from various bodies, mainly newspaper organizations, regarding the possible impact of increases in bulk rates of postage on their circulations and costs. However, I find it extremely difficult-as a matter of fact impossible-to see how an increase from, say, 2id. to 5d. for the first weight unit in the bulk postage rate could increase the costs of distribution by 800 per cent., as suggested by the Deputy Leader of the Opposition. However, I shall certainly have a look at this matter. Postmaster-General. By way of preface, interviewed in a "" Meet the Press"" session I direct the Minister's attention to the fact on Channel HSV7, in Melbourne, on 30th that his department charges pensioners May this year, and saidonly 10s. per annum for a wireless listener's licence, whereas the normal fee is £2 15s. In view of the fact that only a small pergovernment-an centage of pensioners are telephone subgovernment of the Chinese mainland. scribers, will the Postmaster-General give consideration to offering a similar concesDid the Minister make that statement? If sion in respect of telephone charges, on the so, does it represent the views of the Ausproduction of a medical certificate stating tralian Country Party? that a telephone is a necessity? I ask the honourable gentleman to bear in mind that many invalid and age pensioners who are interviewed on television by various living alone are entirely dependent on a stations and that I was asked a question telephone, and that the recently announced relating to Communist China, to which I increases in telephone charges will largely made a reply. This matter has been the offset the increase of 7s. 6d. a week in subject of some correspondence and dispension rates. ber for Henty mentions the fact that a asked me about the question I was asked reduced fee is charged for broadcast lisand the answer I gave. I have been able teners' licences to certain classes of pento make available a correct transcript. I sioners. That is correct. The honourable would be glad to do the same for the member suggests that the same privilege honourable member, if he wishes. should be accorded with regard to telephone charges. I point out to the honourable member that the cases are not comparable. In providing a telephone and the service that goes with it the department is involved in very considerable expense, averaging almost £300 for each telephone installed. No such cost is involved in providing radio licences. Therefore I cannot accept the honourable member's computs forward. The proposal put forward by the honourable member has been examined on a number of occasions by the department and by various committees, and it has been decided that certain charitable organizations should be allowed to make local calls at half the normal charge, whilst paying other charges in full, but that is the only relief that is afforded, because if relief of this sort were given to one organization there would be a great number of other organizations equally entitled to such relief. Trade a question. It is reported that the I think if Communist China remains the d I see no reason why it should not-the n it will be recognised as the de facto cussion. I ascertained that the television station automatically made a recording of",10,Ministerial Arrangements
12,Mr Calwell,Has the attention of,11,Communist China
13,Mr Davidson,I have had some,11,Communist China
14,Mr Fox,"I direct a question to the Minister, when Acting Prime Minister, was",11,Communist China
15,Mr Davidson,The honourable memthe interview. Whenever anybody has,11,Communist China
16,Mr Cope,I ask the Minister for,11,Communist China
17,Mr Mcewen,"It is true that I wasMinister for Labour and National Service. I refer to his recent timely exhortation to employers to employ, wherever possible, physically handicapped persons who seek to rehabilitate themselves. Can the Minister indicate whether, and if so to what extent, the Commonwealth Government has set an example to private employers by itself employing such people? hopes that all people who can employ physically handicapped persons will do so in appropriate circumstances. So far as the Commonwealth is concerned, it is a matter for each individual department to decide how many physically handicapped people will be employed, and in what classifications. My department does make opportunities available for the employment the policy of the federal office of the of physically handicapped people, and Musicians Union of Australia is to seek certainly the Department of Social Serfrom each member of the Czech Philharvices, if I may speak for my colleague, monic Orchestra an affiliation fee and also goes out of its way to see that physically a quarterly subscription. I think this was handicapped people are employed. I think I might add that the Boyer Committee, which recently reported on the Public Service, did make"" some recomcomplete arrangements have not been mendations as to the way in which made, but I think that it is the wish of the physically handicapped people should be federal organization that the greatest goodemployed in the Commonwealth Public will should be shown to these people. As Service. That report is now being a personal suggestion, I throw out the idea examined within the departments conthat if the union wishes to extend the maxicerned and, as soon as the relevant pormum goodwill to a rather wonderful tions come to hand, I expect the Prime orchestra, it might think in terms of giving Minister will make it available. Prime Minister a question. Has the right honourable gentleman's attention been directed to the report by a committee of leading Indian jurists who have concluded, after two months' investigation, that events now taking place in Tibet consititute the crime of genocide within the meaning of the Genocide Convention, and that the Chinese Communist authorities are held prima facie by the committee to be guilty of genocide? If so, what action does the Government propose to take on this matter, in the United Nations or elsewhere? have not yet seen this report. But having regard to what the honourable member says, I will ask for it right away and have a look at it. of the Minister for Labour and National Service been invited to the rumours that the Musicians Union of Australia proposes to claim union dues from the 122 members of the Czech Philharmonic Orchestra, which is to visit Australia shortly? Is the union entided to do this? If the answer is "" Yes"", are employers' organizations equally entitled to claim fees from the Czech Communist Government, which employs the orchestra? intended to give the full benefit of Australian trade unionism to the Czechs who will be employed in Australia. As yet the the members of the orchestra honorary membership. As to the last part of the question, with respect to the claiming of fees from the Czech Government, I know the honourable member's personal views about Communist countries, but this is not the kind of matter on which I should like to comment in answer to a question. the Minister for Territories. Has the Minister received a telegram from Mr Ward and Mr Brennan, of the Northern Territory Legislative Council, in Darwin?",11,Communist China
18,Mr Forbes,I ask a question of the,12,Mixed Marriages With Aborigines
19,Mr Mcmahon,The Government,12,Mixed Marriages With Aborigines
20,Mr Beazley,I desire to ask the,12,Mixed Marriages With Aborigines
21,Mr Menzies,I regret to say that I,12,Mixed Marriages With Aborigines
22,Mr Anderson,Has the attention,12,Mixed Marriages With Aborigines
23,Mr Mcmahon,"As I understand it,",12,Mixed Marriages With Aborigines
24,Mr Mctvor,"I direct my question toIf so, what were the contents of the telegram, and what was the Minister's reply? Does the honourable gentleman propose to take any action in regard to the requests set out in this telegram? Ward and Mr Brennan, both of whom are members of the Legislative Council for the Northern Territory. I cannot quote the telegram exactly, but the general purport of it was a request to me to instruct the Administrator to take certain action in respect of an aboriginal woman named Gladys, whose hand had been requested in marriage by a European named Daly. The gist of my reply was that this was a matter in which I relied on the judgment of the Administrator and the Director of Welfare, and that I did not propose to give them any directions beyond expressing to them the view that the primary consideration in the handling of the matter had to be the welfare of the woman, who is under their guardianship. tion of the Minister for the Interior. Is Reference to this fact was not omitted the east coast of Australia equipped with from my statement for the purpose of concyclone detectors? Is the west coast, which cealment because anybody who has folis subject to severe cyclones, similarly lowed the political life of this country over equipped? If not, will the installation of recent years could not be ignorant of the cyclone detectors on the west coast be fact that Mr Anderson had been a very considered as an urgent measure? Australia is being equipped progressively him, in the absence of other merits, for with a radar system for cyclone warning. appointment to the board, by the same The north-west coast of Western Australia token it certainly should not disqualify him. is not similarly equipped. Cyclone warnings are given by the Perth divisional office of the Commonwealth Bureau of Meteorbe interested to know that when considerology and reports are received from ing appointments to this very important Darwin, Broome, Port Headland, Onbanking organization I explored the possislow, Meekathara and other stations bility of appointing a senior and equally in the area, and also from Cocos Island. respected member of the trade union moveI think that the people in the north-west ment. Unfortunately, I was not able to will agree that they receive warnings of secure an affirmative reply on that cyclones in that area fairly well in occasion to my request to the peradvance. The bureau of meteorology has prepared will take a more balanced view of these a comprehensive plan for extending cyclone matters and that we shall have the kind of warning systems over the whole of balanced representation on the board that Australia according to the frequency of both the honourable member and I seek. cyclones, the violence that can be expected and the likely damage that will result, but under that programme it is not likely that the north-west will receive a radar warning system in the very near future. whether he has appointed to the Reserve Bank Board a gentleman who, until recently, was the federal president of the Liberal Party of Australia. Was this qualification omitted from the Treasurer's lengthy statement concerning the new appointee because he felt it to be irrelevant or because he thought it might be embarrassing? When the Treasurer next fills a vacancy on the board will he appoint a prominent member of the Australian Labour Party to the position in order to preserve a bi-partisan balance on the board? one of the persons appointed to the recently created Reserve Bank Board is Mr W. H. Anderson, who at one timeI would not. say in recent times because it is more than a year since he held the office-wa s federal prominent, successful and respected federal president of the Liberal Party. While his The honourable member for Werriwa may son concerned. I hope that in the course of time the trade union movement",12,Mixed Marriages With Aborigines
25,Mr Hasluck,Lat e yesterday after,13,Banking
26,"Noon, I Received A Telegram From Mr Mr Whitlam",I ask the Treasurer,13,Banking
27,Mr Browne,I desire to ask a quespresident of the Liberal Party of Australia.,13,Banking
28,Mr Freeth,The north-east coast of occupancy of that office should not qualify,13,Banking
