speakerGroups,speaker,theText,pageNumbers,title
69,Mr Lionel Bowen (Kingsford,"Smithme is false. He obviously did not understand the year of the three years mentioned in my question. had not yet been possible with the Tasmanian So, as I was perfectly correct in the facts of my Government. question, I would appreciate an acknowledgeIntentionally or otherwise, as has been the pracment of that fact from the Treasurer. tice in recent times, the honourable member, as a Dr KLUGMAN (Prospect)-I wish to make a Government member, stated the exact opposite of personal explanation. the truth. I read into Hansard precisely what I said, which makes the matter clear and answers the honourable member's incorrect quotation of claim to have been misrepresented? my remarks. On page 46 of Hansard of 21 Aprilwas listening to the Leader of the Opposition ( Mr said: Peacock) 01.1 2GB in Sydney, but understand that The history of the matter is indeed a sad and sorry one. it was also broadcast on 3A W in the Derryn Within days of its election to office, the Hawke GovernHinch show yesterday morning, and the Leader of ment determined that it would institute legislative action the Opposition said, inter alia, that I had said, which would effectively pre-empt any further attempt at dealing with the question of the external affairs negotiation and reconciliation with the sovereign State of powers and their use and the question of the TasTasmania. manian dams, that a Labor Government could Mr MacKELLAR (Warringah)-Mi Speaker, have a treaty with South Africa on subversion and I claim to have been misrepresented. then outlaw a political party. I did not say that. your ruling about incorporating letters, Mr make a personal explanation. WhatI said on 26 January was: answer to a question I asked of the Prime Minister Lawyers are arguing whether the current High Court( Mr Hawke), he implied that I had moved away would grant the Commonwealth Government power to from the commonly accepted procedure of a biintervene and prevent the construction of the Tasmania partisan approach towards matters of security. I Dam under the external affairs power of the Constitution. point out to the House that I did not do that in the May I, as one who tends to oppose increased Governquestion and that in fact the matters were ment powers of most kinds, caution those Labor supreported in the Press and therefore were common porters who may approve of the extension of such power in this particular case. knowledge. I would also point out that the Prime Minister, in his reply to me, did not mention the What would prevent an Australian Government signing a treaty with South Africa dealing with 'subversion'. fact that he had already discussed the matter with Could an Act endorsing such a treaty then give an Austhe Labor Caucus. I hope that he will treat the tralian Government unlimited powers, denied to it by the Parliament more properly in the future. High Court (in the referendum) in the early 1950's. Before endorsing the use of the external affairs power to tralian Government could find a number of foreign nominations of members to be members of the folgovernments prepared to sign all kinds of treaties conferlowing committees of the House of ring very unpleasant powers on our government. Representatives: Let me emphasise again the whole point I was making: When we come to certain conclusions, we Standing Committee on Aboriginal Affairs are not making them for one particular governMr Blanchard, Mr Campbell, Mr Gorman, Mr Hand ment but for all governments in future. and Mr O'Neil have been nominated by the Government Whip; Mr Andrew and Mr Porter have been nominated personal explanation. nominated by the National Party Whip. claim to have been misrepresented? Mr Chynoweth, Mr Ronald Edwards, Mr Milton, Mr Tasmanians were being referred to as maggots Government Whip; Mr Burr and Mr Connolly have been nominated by the Opposition Whip; and Mr Ian Robinson and vandals, the honourable member for Griffith has been nominated by the National Party Whip. ( Mr Humphreys) saw fit to refer to me in his speech, at page 255 of Hansard, and said: Standing Committee on Road Safety The honourable member for Denison( Mr Hodgman) Mr Brumby, Dr Charlesworth, Mrs Darling, Mr himself recognised two weeks ago that the introduction of Gorman and Mr Wells have been nominated by the this Bill meant effective negotiation and reconciliation Government Whip; Mr Dobie and Mr Good luck have",22,Australia China Council Government The Treasurer S Allegation Against
70,Mr Speaker,Does the honourable member,23,Membership Of Committees
71,Dr Klugman,"Grievously, Mr Speaker. I and you will note the difference, Mr Speaker. I",23,Membership Of Committees
72,Let Me Make Quite Plain What I Said. Because Of Mr Speaker,The honourable member may,23,Membership Of Committees
73,"Speaker, I Shall Have To Read Four Paragraphs. Mr Mackellar","Earlier this afternoon, in",23,Membership Of Committees
74,Circumvent The Constitution Let Us Remember That An Aus,Mr SPEAKER-I wish to inform the House of,23,Membership Of Committees
75,Mr Hodgman (Denison),I wish to make a by the Opposition Whip; and Mr Ian Cameron has been,23,Membership Of Committees
76,Mr Speaker,Does the honourable member Standing Committee on Environment and Conservation,23,Membership Of Committees
77,Mr Hodgman,"I do. Last Thursday, when Allan Morris and Mr Reeves have been nominated by thebeen nominated by the Opposition Whip; and Mr Katter Of course a lot of work will be involved in has been nominated by the National Party Whip. processing claims for medical and hospital serare already doing this work under the existing sysMembership tem of health insurance, and they have put up a That, in addition to Mr Speaker, ex officio, Mr Andrew, Government to carry out this processing and Mr Blanchard, Mr Cross, Mr Maher and Mr O'Keefe be associated customer contact. members of the Library Conimittee. If one accepts that the Government will proMembership in having private funds, including Medibank Private, handle this business. Firstly, the funds are That Mr Andrew, Mr Brumby, Dr Harry Edwards, Mr familiar with it, have a widespread network of be members of the Publications Committee. offices and have all the customers on their books. It would be easy for them to do, in effect, the same Discussion of MaUer of Public Importance ditional customers who came in under the scheme could easily be signed up at their wide network of ton) proposing that a definite matter of public imSecondly, it would maintain one-stop shopping portance be submitted to the House for disfor all those people who wished to take out supcussion, namely: plementary insurance. Over half of those curThe grave threat to the jobs of 5,000 Australians in the rently insured choose to have more than basic inhealth insurance industry posed by the Government's censurance. Under the Labor scheme they will tralisation of health insurance. continue to do so as many will not be satisfied I call upon those members who approve of the with no choice of doctor in hospital or no option proposed discussion to rise in their places. of a private bed or paramedical services, which is what they would have under the Medicare levy. If More than the number a/members required by the private funds continue to handle the basic the Standing Orders having risen in their cover as well as these extras, their existing cusplacestomers will be able to transact all their business at pose today is not to discuss the merits or otherwise the. private funds and placed elsewhere, people of Medicare-I will be doing that on another will have to do business with two separate organoccasion and perhaps on many occasions in the isations, and that I submit is a nonsense. succeeding months-but to examine one aspect of Thirdly, a contract system to have the basic the implementation of Medicare that threatens cover business handled by the private funds would the jobs of over 5,000 people working in the priprevent an expansion of the Public Service or of vate health insurance industry. Let me try to exemployment in statutory corporations. In my plain this in the simplest terms. Under Medicare, view, it is cheaper and more flexible to subconbasic hospital and medical insurance currently tract to privately run institutions, especially in provided by the health insurance funds will be this case when the private institutions are all nonreplaced by the Medicare levy. Also, the funds profit institutions. With the exception of the relawill be prevented from offering supplementary tively more expensive Medibank Private, their medical insurance to cover the gap between the staffs are on ordinary, not Public Service, awards; Government subsidy and the actual fee charged their managements are not constrained by Public by the doctor. The funds will, however, be alService rules and regulations; and their employees lowed to provide additional insurance for choice do not have permanent tenure as the employees of of doctor in public hospitals-something people Medibank Private do. If the funds do not perform will not get under the Government levyas agents they can be sacked, and that is a guarantreatment in a private hospital or other protee of efficiency. fessional service such as dentistry or physiotherapy. What all this amounts to is that over 60 It would therefore seem that the Government per cent of the business of the health insurance would not hesitate to accept the offer of the funds funds will be transferred to the Government levy to act as agents. Why, then, should we have any scheme. cause for alarm as expressed in the terms of this",23,Membership Of Committees
78,Motion (By Mr Young),by leave-agreed to: perfectly sensible proposal to act as agents for the,24,Health Insurance Work As Agents For The Government Any Ad
79,Motion (By Mr Young),by leave-agreed to: already handling this type of business. They are,24,Health Insurance Work As Agents For The Government Any Ad
80,"Gear, Mr Lindsay, Mr Mcgauran And Dr Theophanous",,24,Health Insurance Work As Agents For The Government Any Ad
81,Mr Speaker,I have received a letter from offices.,24,Health Insurance Work As Agents For The Government Any Ad
82,The Honourable Member For Mackellar ( Mr Carl,,24,Health Insurance Work As Agents For The Government Any Ad
83,Mr Carlton (Mackellar) (3.L9),"My purone place. If the basic cover is taken away frommatter of public importance? Unfortunately, other hand, from the funds for the supplementary there is abundant cause for alarm. In March the or ancillary cover. Health Insurance Commission, which runs Medibank Private, put a submission to the new What are the employment effects on the priMinister for Health (Dr Blewett) asking to be alvate funds? This is a matter that I raised during lowed to take over all the basic cover business the election campaign. The Minister admitted from the private funds. Firstly, this would involve during the election campaign that there would be Medibank-the Health Insurance Comsome loss of employment in the private funds. mission-in additional staff-up costs before the There is a particular difficulty because, even commencement date of Medicare of $65m of taxthough Medibank Private will recruit, as it says, payers' money. Secondly, according to the subover 2,000 new employees-taking them out of mission, in the first year of operation there would the private sector into the public sector, I might be additional administrative costs of $75m, which say-it will be doing that after the period when of course is three times the estimate of $25m given the existing funds will have to maintain their by the present Minister before the election camservices-right up to the administration of the paign. I queried that estimate at that time but I new program. That is, Medibank will be recruitwas assured by the now Minister that the $25m ing while the private health funds have to hold on was perfectly adequate. We have it in the report to their staff. There will be great difficulties for to the Government from the Government's own people in the private funds knowing what to do. Health Insurance Commission that the additional cost in the first year would be $75m and not $25m. If the Government adheres to its announced Thirdly, there would be the recruitment of an adpolicy for the operation of the Medicare program, ditional 2,600 staff of Medibank to operate the it is estimated that approximately 60 per cent of new system. On this last point I quote from the the staff of voluntary health funds or around Medibank submission to the Minister in March 5,150 employees would become redundant. The because it has very sinister connotations for those use of the existing registered health funds. as currently employed by the private funds. It states: agents for Medicare would of course avoid this It is unfortunate, but inevitable, that the program will severe unemployment problem. I have talked cause staff surplus problems in the health insurance with representatives of the funds who tell me that industry. the loss of 5,000-odd employees has been deterNoting staff levels in the industry at present, and the remined after a careful analysis of the impact of quirements which are forecast for Medicare's future operMedicare on the existing health insurance busiations, it would be impossible for the Commission to ness of the funds. absorb all of the labour which will be displaced. The Government's announced policy is to centralThe single most important factor influencing ise basic health cover.. I understand that the redundancy is the intention to deny the funds all Government does not favour the proposal put medical insurance-the area which involves parforward by the private funds. In line with its anticularly labour intensive processing procedures. nounced policy it favours the centralist approach Medibank Private, in seeking the sole operation of of Medibank. Whether the health proposals are Medicare, indicates a need for 2,600 additional run by Medibank or by the Federal Department staff including 700 positions now in the Departof Health they will still be centralised and there ment of Health. If the Government were to will still be the same threat to the employment of accede to this suggestion, it is clear that the net people in the private funds. The only semblance effect would be to increase. national unemployof a reason that I can find for doing this-other ment by around 3,250 persons; that is the net than a doctrinaire socialist approach to health figure nationally. The eventual total influence on insurance-is that a centralised system will prounemployment would be greater than this bevide better information against fraud and oversercause of the secondary effects in other areas-for vicing by doctors and hospitals. Of course, that is example, the printing industry. The major impact no reason, as it can be made a condition of conof the net increase in unemployment of 3,250 pertract that the health funds provide the necessary sons would be amongst female employees under information. Indeed, their information would be 30 years of age who are employed predominantly more valuable because, if they had one-stop shopin the branches-that is the suburban and country ping for all the customers, all the relevant inforoffices-of the health funds. mation relating to each of the customers could come in a consolidated form from the private This is a very serious matter for all those curfunds and not be taken, on the one hand, from the rently employed in private insurance funds and all central body, for the ordinary cover and, on the those dependent upon their earnings. At a time when the Government has declared that its p'rione wants to go to a private hospital or requires mary emphasis in economic policy is to try to imparamedical services, dentistry and the like, one prove economic growth and the job climate-it has to insure in addition to the Government levy. has made various promises to stop the It is not a simple system. There will be two stop disemployment of people in various industries-it shopping if the business is not left with the existwill by deliberate act of policy create unemploying funds. The third reason is that obviously the ment in the private health insurance industry of at Government will prevent an expansion of the least 3,250 persons and will directly threaten the public sector at a time when more costly public actual employment of over 5,000 because not all employment is something that this country needs of them will be able to move into the areas like a hole in the head. Efficient private sector emrequired by the new Medicare operation. The ployment is the best job creating employment. In reasons for this are very simple. It strikes me that this case it also represents the best job holding emthe same advisers are advising the present Minisployment. If the Government proceeds with this it ter as advised the earlier Minister, the current will have on its hands the disemployment of over Minister for Foreign Affairs( Mr Hayden), when 3,000 people net and it will have on its hands a dihe was setting up the original scheme. They are rect threat to the employment of over 5,000 quite determined to centralise. They are quite de, people. termined to move people out of private sector emdetermined to bring more of the employees as a Johnson)-Order! In inviting the honourable proportion to Canberra. In the process of doing member for Henty( Mrs Child) to preside over this they are prepared to carry out extraordinary the proceedings of the House, I inform ,honourphysical changes and more or less double the able members that, as I understand it, this is the number of Medibank outlets when the private first occasion on which a female has occupied the funds already have the necessary facilities in place chair in this chamber. to carry out the work and have offered to do so at Dr BLEWETT (Bonython-Minister for quite reasonable costs. Health) (3.33)-Madam Deputy Speaker, in Of course, if there were negotiations on cost I opening may I congratulate you on the unique am sure the Government could agree with the role which you fulfil in this House. The most strikfunds on a fair return. It would have the guaraning aspect of the matter of public importance tee that employment of this kind would not be which was put forward by the honourable threatened. It would have the whip hand in promember for Mackellar ( Mr Carlton) is its sheer viding contracts for these private funds. The hypocrisy. It expresses the grave concern of the Government would be able to say what inforLiberal Opposition for the unemployment of its mation it required from these funds for the prefellow Australians. I ask the House: Where was vention of fraud and overservicing, or for whatthat concern over the last seven years? What did ever other purposes it desired the information, the Fraser Government do about the unemployand would have a stability of employment for ment, not just of 5,000 Australians but 500,000 those currently employed by the funds. It escapes Australians? In December 1975 there were me why any government with any compassion, 278,400 people unemployed in this country. By which proclaims to have concern about jobs in the March 1983, the figure was 731,600. There was an community, could proceed in this doctrinaire increase of nearly half a million in unemployment fashion on a predetermined course which flies in the seven years of Fraser rule. On6 March the against all reason. . former Prime Minister, Mr Malcolm Fraser, said: It is quite clear that the reasons given for wantWhatever out problems, Australia has been handed to Mr Hawke's new Government in a condition that is equal ing to leave the business with the private funds are to or better than any other Western country. substantial ones. I will repeat them. The funds already handle the business; they are already That has now become a joke in every other Westdoing it. If additional people who are not curern country. We were handed the worse unemrently insured come in, they can easily be soaked ployment since the Great Depression, the greatest up by the very wide network of offices, but most deficit in Australia's peacetime history, and a of the customers are already on the books. The rising rate of inflation distinctly above the average second reason is that the system would maintain of most Western countries. Yet 10 weeks after the one stop shopping. Not everybody realises that Opposition's clear rejection by the Australian under the proposed Medicare plan one does not people it has the hide to come into this House and suddenly have to forget about insuring. If one proclaim its concern for the unemployed. It is no wants a choice of doctor in a public hospital, if wonder that every serious commentator in this",24,Health Insurance Work As Agents For The Government Any Ad
