speakerGroups,speaker,theText,pageNumbers,title
112,"The Public Spirit Ness Of The Responsible Minister, Mr Ruddock","As you are aware, Mr Deputy",42,Customs Tariff Amendment Bill Cent Plus Of Income Goes To Governments That
113,Mr John Brown (Parramatta,"Ministerthe House simply amazes me. I have sat here for Opposition to suggest there is ab'out to be a deseven years and seen the previous Government valuation of the currency. In Opposition, we cerbuild up a record unparalleled since Federation tainly desisted that temptation because of the delnot only of breaking promises but also of having eterious effect it can have on the nation's an absolute disregard for any form of decency or economy. honesty in its conduct of government in this The now Leader of the Opposition was imcountry. A Prime Minister now removed had the moral enough constantly to parade himself peculiar 'honour' of having a rather responsible around and to tell people that now there was a newspaper one day devote the front page of its Labor government in power there would be a publication to three simple words, namely, 'lies, need to devalue. Of course his suggestion became lies, lies'. The basis for this' honourable member to the fact. It was a self-fulfilling prophecy, because come in here now and suggest that this new the only way in which the incoming Government Government is breaking a promise is simply becould stem the flow of capital from Australia was yond imagination. to ,devalue and, of course, it took the responsible Let us have a look at the text of the honourable action of doing just that shortly after assuming the member's amendment. It is true that the Prime Treasury bench. No one in Australia, least of all Minister( Mr Hawke) in his election speech said the economic writers, suggested that that was anythat we would reduce the price of petrol and also thing but the correct action to take. The result that we would disregard movements in currency was the the proposed reduction in petrol price was in order to implement that promise. But let us discounted to the extent of the devaluation. That examine the context in which that promise was is why it became 1tc a litre, not 3c a litre. So it ill made. becomes honourable members now in opposition to criticise the incoming Government for having upon it by two circumstances that were the result all. The honourable member will be wriggling Government misled the Australian public as to when I am finished with him. At that time, of the extent of the economic disaster which faced course, the truth had not been revealed about Australia when it left the Treasury. Secondly, we Australia's financial position. It took the election had the ill-founded and ill-advised statements of of the Labor Government to establish just what the present Leader of the Opposition, who our situation was. The Labor .Government was suggested that there would be a devaluation. As I advised by the Secretary of the Trt<asury that we have explained, that forced investors to take their were in fact facing a deficit of $9.6 billion. That money out of Australia and eventually forced this was the prospect that was facing an incoming Government to devalue. The result of all that was government. The position was bad enough when a diminution in the promised reduction in the we thought we were facing a deficit of $6,OOOm. price of petrol. Thus, the Government feels no But the deceit of the previous Government, the sorrow and no guilt whatever in that regard. If deceit of the then Treasurer in not revealing to the any guilt is to be apportioned it can be fairly Australian public what our financial position was, sheeted home to the former Government. Therecertainly has great relevance to whatever commitfore, we discount the amendment and refuse to ments the Prime Minister may have made in his accept it. election speeches. Amendment negatived. Let me turn to the reason why this Government Original question resolved in the affirmative. needed to devalue. Perhaps it might embarrass the Bill read a second time. honourable members opposite a little more when they realise why we had to devalue. I will tell Third Reading them why. The now Leader of the Opposition Leave granted for third reading to be moved ( Mr Peacock), once we had got into government, forthwith. started speaking as often as he could about how this new Government would have to devalue. The Bill (on motion by Mr John Brown) read a effect of that was, of course, that money flowed third time. out of Australia by the bucketfull. Thousands of GOVERNOR-GENERAVS SPEECH millions of dollars of overseas investment in Australia was taken away. The now Leader of the Address-in-Reply Opposition had broken every decent convention Debate resumed from 5 May, on motion by Ms of this Parliament. It is never ever the estate of an Fatin:",42,Customs Tariff Amendment Bill Cent Plus Of Income Goes To Governments That
114,Mr Fisher,You are wriggling. taken that very responsible action-action forced,43,Customs Tariff Amendment Bill Cent Plus Of Income Goes To Governments That
115,Mr John Brown,"I am not wriggling at of actions of the former Government. Firstly, thatThat the Following Address-in-Reply to the Speech of In this tiny area, the smallest Federal electorate His Excellency the Governor General be agreed to: in Australia, all the diversity, contrasts and MA Y IT PLEASE YOUR EXCELLENCY: inequalities that exist in Australian society can be We, the House or Representatives of the Commonfound. Australia is an unequal society. In Phillip wealth of Australia, in Parliament assembled, desire to those in-qualities are very evident. One can see express our loyalty to our Most Gracious Sovereign, affluence and poverty in the same suburb and in and to thank Your Excellency For the Speech which you the same street, side by side and across the road, have been pleased to address to Parliament. looking at each other. As well as the luxury units MR DEPUTY SPEAKER ( Mr and the $300,000 bungalows, Phillip cOrisistently Mountford)-BeforeI call the honourable has above average unemployment figures and a member for Phillip, I remind the House that it is far above average number of single parent familthe honourable member's maiden speech and she ies. Despite the strong conservative element in the should be heard in silence. electorate Phillip has, almost more than has any other electorate of Australia, a high number of Ms McHUGH (Phillip) (5.18)-Thank you, non-traditional families. We have also a great Mr Deputy Speaker. It gives me pleasure to begin many age pensioners. This mix of people decided by congratulating you on attaining your office and that the former Government had to go. in asking you to pass on my congratulations to the As a matter of fact, we still do not know just Speaker and the Chairman of Committees. Also, I how many of the residents of our area actually congratulate those new members who have so successfully preceded me in the Address-in-Reply dewanted a change of government. So many did not bate. I will try to make my comments as relevant have the time to get on the rolls. We will not know until we get a better system than one which allows as were theirs. a Prime Minister to call an election at whim, givThe Australian Labor Party won the seat of ing insufficient time for new electors to enrol. The Phillip as part of the strong swing against the polinew electors include the young and those who cies of the former Government, which had almove in and out of an electorate such as Phillip, lowed Australia to develop chronically high unwhich has such a high turnover of residents. Also, employment, unacceptable inflation and interest there are' in our area a lot of people who, for rates, growing inequality of wealth and incomes reasons of their own, understandable to them, and a deep and widespread feeling amongst the hesitate to register with any sort of authority. people of division and lack of direction. That feelThey are the people who need a Labor governing has now been replaced by one of cautious ment and who very bitterly resented the fact that, hope, generated I think by the change of governfor once in their lives, they wanted to vote and did ment itself that the electorate had the courage to not have time to get on the rolls. Thank heaven bring about. There is amongst people now a good they got a change of government anyway and forwill towards the new Government that is almost tunately that situation will not occur again. tangible, certainly as I go around our electorate. From all sections of this multilevel society in The swing against the former Government ocPhillip people came to help us, the rank and file curred in Phillip because it represents a microbranch members of the Labor Party, to win cosm of the Australian electorate. Most people Phillip from the previous Government. I want to know something of Phillip-either the beautiful mention two groups in particular, not just to acbeaches from Bondi to Coogee, Randwick Raceknowledge their role in our campaign, but to decourse, or the University of New South Wales, the clare my commitment to a common cause with largest in Australia. The electorate is superbly them. One group is the Tasmanian Wilderness Sopositioned. It is 20 minutes from the airport and, ciety . Young people in their thousands turned to with the advent of the Eastern Suburbs railway, it Labor on the issue of South West Tasmania. is now less than 20 minutes from the city. It is not Labor, for them, offered the promise of stopping a bad place to live if you are a professional person, that bit of carnage of a part of their environment, well-heeled, with concern for your time, health their land, their heritage. They are not single issue and petrol savings; in fact, it is a great place to people. They represent the aspirations of the live. But should it be available only to the young and the sensitive in our society to protect wealthy, only to those who can afford to live the beauty in our natural environment from the there? Property values are naturally as high as ravages of short term commercial interest, generthey are anywhere in Australia. The rise in propally exercised for the profit of a few. I share their erty values has resulted in demographic changes aspirations and so does my party. In government of significance to the character of the area and, of we need even more the support of these people to course, to voting patterns. carry through our policies. It was and always will be a matter of great pride 'duties' kept them isolated at home, politically to us in the Australian Labor Party branches in either unaware or uninvolved, and those full time Phillip that we were joined in our campaign by so housewives and mothers who from now on, I many men and women fr-m the trade unions. -s hope, will become active participants in the unionists they came to gIve generously of then decision-making process. work and comradeship, as part of the broad labour movements' effort to achieve a Labor government in Canberra. The trade unions and I have never thought that the entry of individthe Labor Party were originally formed because ual women into the Parliament would, of itself, there was a need for them. That need still exists necessarily better the condition of women in and always will for the majority of Australians, Australia. I must admit, though, that it is not a that is those who have to work. The strength of a bad job for the individual women who come into Labor' party and a Labor government lies in its parliament. After my 23 years outside the paid links with the union movement because they are work force, I think it is perhaps one of the few the links with the Australian working people. jobs available for which I am still qualified. HowI want also to thank the women of New South ever, as individuals in Parliament I think we can Wales for their support and for their joy in the rebe swallowed up by the system. There are other sult in Phillip, a joy which crossed all party lines. women whom we must think of. Society depends Not once since Federation had a woman from to a very large extent on the unpaid work of New South Wales been elected to the national women at home. I want those women to start askParliament. We have waited so long and so many ing back from society a fair return for the contrishould have been here before. I am very proud to bution that they make to it-a fair return by way have on my desk a pair of scissors and a paper of better education, better housing, better health knife that belonged to the magnificent Jessie care, better transport, et cetera. Women must use Street. They were given to me because among the their political potential to gain these better many paths that the great Jessie Street first trod conditions. bravely for us was the path that could have led to this place. She stood for the seat of Phillip when it The issue that is politicising women at present was created in 1949. more than any other is that of disarmament and the nuclear arms race. It reminds me of how we The fact that at this time this particular woman were politicised nearly 20 years ago by the Vietenter Parliament is part of an evolutionary pronam war. Now, as then, women particularly have cess. I am a link between the older women of the joined so many others and decided to show their Labor Leagues and today's younger feminists. concerns-and yet they are called dupes, just as The older women fought the first battles for we were then, by those who refuse to acknowlwomen's rights in the work place and for equal edge that we care about human suffering caused pay. I love and honour those women. Today's by war. I am reminded that in the last election the younger women have taken on, as well as the old Vietnam veterans, when asking both parties for an continuing struggles, the demands to meet new independent inquiry into the problems that had circumstances and new expectations in areas such occurred as a result of their serving in Vietnam, as child care and women's refuges. All these were quite clear in their recognition of where we women fought against the forces of oppression stood. One burly soldier said to me: 'I couldn't and intolerance which would not allow a woman understand you, love, when you marched down to make her own decision, no matter how painful the street in the moratorium years, but I certainly or distressing, in relation to child bearing. I am understand you now. The Government that sent glad that, thanks to the courage and common us to Vietnam has dumped us. You care.' sense of generations of responsible women, the single issue campaigns of the intolerant have become irrelevant and ineffective. I am reminded of the misunderstanding and misinterpretations implicit in the advice given to . By chance, I have become that inevitable link us not to talk about things like disarmament, bebetween the all male representation from New cause we might get into trouble, and certainly not South Wales of the last SO-odd years and the to mention a word like 'peace', which has become many women from that State who will from now a bit of a dirty word. In this Parliament I would on take their places in this Parliament, both here like to rehabilitate three words that mean a lot to and in the other place, with their male colleagues. me: 'Peace', 'unions' and 'socialism'. I resent good But by far the most important thing for me is that concepts being besmirched through I will be, 1 hope, a link between those generations misrepresentation. I am tired of being called naive of full time housewives and mothers whose because I join those who want to prevent war. I think it is more likely that those who do not realise success of course, but there is the guarantee of they are being manipulated by the arms merfurther economic regression if industry and chants are the naive ones. government fail to take up the challenge of the More and more Australians are becoming new, high technology industries. aware of the dangers to world peace because of the increase in nuclear weapons. On March 27 Mr Barry Jones-Hear, hear! show their concern. A Labor Government, as our of New South Wales are delighted by the enthusipolicy sets out, must reject the escalation of nuasm of the new Minister for Science and Techclear weapons and work to bring about positive nology ( Mr Barry Jones). FinallyI wish to talk disarmament negotiations. Our Government has about the reason for which this Government was the responsibility to call on all nuclear powers to elected and the task ahead of us. The problem of reduce their nuclear weapons arsenals and to deunemployment in Australia was one of the key clare that we will not be part of a nuclear war mafactors in the election campaign. The unchine. It is wrong, in my view, to allow Australia's employment rate rose from 5 per cent to 10 per uranium to circulate in such a way that it will incent under the previous Government. For the evitably enter the world nuclear weapons chains. I young it rose to 28 per cent. Of course, it was have long opposed the use of nuclear energy in worse for women and girls. The Fraser Governany form and I have long been convinced that ment promised more of the same policiesthat Australia should not mine or export its uranium. is, it promised more unemployment-and it lost The other disgraceful situation that comes office. Labor is committed to addressing the unabout by the world's preoccupation with war is employment problem. We carry no illusion that it the huge expense involved. Perhaps there would will be easy. Governments in other industrialised be no starvation in the world, no want, no uneducountries with socialist objectives such as our own cated kids, no homeless people and probably have been elected with similar mandates and fewer international tensions if we could find a way. clearly have been unable to make any but very to stop spending the $1.5 billion each day that the slow progress. But socialist parties have advanworld spends on armament. What a sad reflection tages over conservative parties in addressing the on our civilisation that so much money is wasted! problem of unemployment. What country can be so rich that it can squander its richness in such a dangerous manner? It is an We are prepared to acknowledge one of the key indktment of our society that billions of dollars go aspects of the long term unemployment problem into the arms race yet people still hold raffles to throughout the industrialised world, that is, that get money for cancer research and women still the economic system as it has evolved, motivated work in voluntary canteens in schools to get pens by profit, increasingly dominated by monopolies and paper for their children's education. and integrated on a world wide basis, is no longer It is a further indictment of our civilisation in able to provide full employment and a reasonable this age of science that more scientists are living standard of living for all. We cannot accept the today than in the combined history of the past philosophy that says to working people: 'You can 1,000 years and the majority of them are today have a job, if you are prepared to work at the employed to invent more and more weapons of internationally going rate of pay'. We are not pre-war. We can put our scientists to so much better pared to underwrite such a massive drop in the use. Our technological base has not changed much standard of living of Australians. In this approach since the 1950s. New skills are required for the we are joined by many of the small business, mer1980s. Viable alternative employment opportunichant and professional groups. We are prepared ties are being encouraged and promoted. The to look honestly at the causes of unemployment. Labor Government can invest dollars and faith in We are prepared to take the far-reaching steps research to establish new high technology 'sunrise' necessary to provide jobs and decent living stanindustries. These include biotechnology, software dards for all. We are prepared to intervene in the for personal computers and communications economic system and to stimulate employment technology-a great deal of work in this area is through both the public and private sectors-a being done in our electorate of Phillip at the Unislow but sure process. We are prepared to consult versity of New South Wales. Either we will have and to plan for the longer term. I take this opporto develop our own technology in consultation tunity to tell the electors of Phillip that I too am with the workers or, as with most things to date, prepared to consult and to listen. I certainly hope we will have to buy from overseas. To meet the they will be listening to me and consulting with demands of Australian society, the economy must me and that the dialogue will continue for a long generate more wealth. There is no guarantee of time.",43,Customs Tariff Amendment Bill Cent Plus Of Income Goes To Governments That
