speakerGroups,speaker,theText,pageNumbers,title
93,"Mr Reeves (Northern Territory) About 170,000. A Sub","committee of the Constithe Federal Government makes a conscious deover 'the next five years. Jobs will also be created cision to leave our northern coastline unattended in other manufacturing areas. and open for attack, or drug trafficking or e-try Another justification for the railway is defence. by illegal immigrants, it has only one alternatIve, Many old-timers in Darwin can still remember and that is to maintain its financial support for the the bombing of Darwin in 1942. That was the first development of the vast northern regions of this Australian town in our history to suffer war damcontinent. The light at the end of the tunnel for age. That unfortunate incident should serve as a the Federal Government, paradoxically,is that reminder that Australia's north must be 'kept seeventually, after it spends and continues to spend cure. The railway will offer a reliable, rapid and money in the Northern Territory, the so-called cost-effective method of transporting heavy dediseconomies of scale will be overcome as the fence equipment, supplies and personnel to the North expands and its population increases. Then north. It will link in with the development of the the Territory will become less dependent on FedTindall air force base and other defence facilities eral support. in the north. Those who claim that the railway is For the past 70 years or more, the north-south useless in this context completely ignore history. railway line has been identified as the linchpin in In 1944, after the bombing of Darwin and after the development of the Northern Territory. In Australia finally woke up to the fact that the 1911, the Territory was officially excised from north was effectively undefended, the railway line South Australia and placed under the control of between Larrimah, , which is just south of the Commonwealth Government. The South Katherine, and Darwin was part of a supply lifeAustralian and Commonwealth legislation giving line which carried 247 trains a week at its peak. effect to that conveyancing transaction contained That line was closed by the former Government an agreement that the Commonwealth Governin 1976. Darwin is now the only Australian capiment would build the north-south railway from tal city which is not serviced by a railway link.' South Australia to Darwin. To this day, the Commonwealth Government has not met that An inhibiting factor in the Territory's d,evelopcommitment. Parts of the railway line were built. ment and population growth is the higher cost of Most of these have since been closed down and living experienced by Territory residents., The torn up. The exception is the Tarcoola to Alice cost of living in the Territory is estimated to be beSprings standard gauge link, which was commentween 15 per cent and 20 per cent above the Ausced by the previous Labor Government and tralian capital city average. Most of this differcompleted in 1980 by the former Government. ence is freight costs, and, on top of that, sales tax is applied to the landed cost of goods. Thus, TerriMuch has been said in recent times about the tory people have to meet the additional burden of Alice Springs to Darwin rail link, and not all of it sales tax on freight. The Labor Party has a policy has been favourable. Some say that the cost canto remove this iniquitous tax. The proposed not be justified. Those same critics would probnational road freight inquiry should also assist in ably have said exactly the same things about the bringing the spotlight on some of the more exSnowy River scheme. That project is now h-ld up treme road freight pricing policies. In 1980 the as a symbol of our vision and ability as a nation -o Joint Study Group, studying the economics of the fight back when times are tough. Most publIc railway, noted that road freight charges for operations in this country would be closed down smaller items to the Territory ranged from $119 to tonight if we were to apply the strict economic $725 per tonne. The comparative rail freight rates justification rule. Australian National Line, Tra?s at the time were $32.50 to $113.80. It is easy to see Australia Airlines, Qantas Airways Ltd, every aIrthat a rail line, coupled with the removal of sales port, just about every port and most public tax on freight, will reduce the territory's costs of transport systems would be closed down. living. The north-south railway line can be justified as If the north-south railway is developed as a a national development project. It is this sort of national development project, it will pay for itself project that Australia has pursued in the past as a national development project. In other when times were tough. This project offers employment. Some 280 workers will be directly inwords, if the Federal Government makes a grant volved in the construction and about the same for the costs of development so that the debt servicing and other capital costs are not included in number will be involved In the operation of the the operational costs, the freight and passenger railway. Furthermore, thousands of workers at revenue should cover the costs of operations. Whyalla will be indirectly employed. It is estimated that the steel rails alone will account for Last week, Mr Davidson of the Age newspaper some 20 per cent of Whyalla's annual production described the people of the Northern Territory and Tasmania as parasites. I do not want to be of the work force. In fact, it was Xavier Herbert identified with the honourable members who repwho said that Darwin's only exports were empty resent various electorates in Tasmania. But Mr bottles and full public servants. Over 15,000 TerDavidson made a comparison of the the per capita ritorians are on fixed incomes. There is a large Federal expenditure in the two areas and noted number of single parent families. Mining, tourism that the Northern Territory and Tasmania and primary industry are the three major indusreceived, respectively, one and a half times and tries. The towns of Alice Springs and Katherine five and a half times the New South Wales and have experienced substantial growth associated Victorian expenditure per capita. He implied that with the tourist industry and the Territory will apthe people of the Northern Territory and Tasplaud what the Federal Government has already mania were sucking the lifeblood out of the done and proposes to do in establishing a denation. He and many other people who live in the partment with emphasis on tourism. south-eastern corner of Australia ignore the fact The mining centres of Tennant Creek, Gove that most of the money spent in the Northern and Groote Eylandt have suffered set-backs in reTerritory goes straight back into the pockets of cent years, but it is hoped that those set-backs will manufacturers, mining companies, construction be short lived. Not many people realise that Darcompanies and banks in the south-east corner. win is closer in distance to the hundreds of The Territory has next to no manufacturing inmillions of people of South East Asia than it is to dustry, and its business suffers from the branch Sydney, Melbourne or Canberra. The Territory is office mentality that Queenslanders have growing, both economically and in population. screamed about for years. Taxation on profits That growth will bring the Territory and JTIl!-de by most big companies in the Norther TerriAustralia face to face with the need for further tory is usually paid in the State of those constitutional development in the Northern Tercompanies' head offices. Raw figures can be ritory in the not too distant future. When that grossly misleading. The overwhelming majority of occurs I hope it is a Labor government that will be the construction work undertaken in the uranium dealing with it because history shows that Labor province in the Northern Territory went to intergovernments have shown the concern for and state manufacturers and contractors. The same ability to achieve constructive constitutional deapplies to the Yulara tourist village at Ayers velopment for the Northern Territory. apply to the railway line. There are many TerriDeputy Speaker, may I congratulate you on what tory contractors who are not too happy about I believe is your first effort in the chair. I can that. They have other ideas about who the paraassure you that I will not cause you any trouble in sites are. the course of my speech. The Referendum (ConA simple comparison of per capita expenditure stitutional Alteration) Amendment Bill is one also ignores the problems associated with supplythat the Opposition accepts. In fact it is one that ing basic services to people in the sparsely was being promoted by the previous Government populated areas of Australia's outback. About 24 and has now come to fruition in the term of this per cent of the Territory's population is of Government. I believe that it is important that we Aboriginal descent and about 80 per cent of those accept it in the spirit of what the referendum Aboriginal people live in small, remote communiindicated in 1977, that at last the people of the ties, in the main on their traditional lands. Many Territories, that is the Australian Capital Terriof these small communities still do not have a tory and the Northern Territory, be given rights basic water supply. Various non-government and that have been denied them until that time. From government agencies have been struggling to prowhat I understand, it was not until about 1922 vide this country's original inhabitants in the that the Territories had representation in this Northern Territory with basic health, education, House at all. As the honourable member from the transport and communication facilities-the sorts Northern Territory ( Mr Reeves) said, they did of facilities that people in the south-east corner not get their full voting rights-and this includes take for granted. But still unemployment among the Northern Territory-until about 1968 and the Aboriginal people in the Northern Territory is people of the Territories were not represented in estimated to be as high as 75 per cent. The sad fact the Senate until 1974. is that we have a long way.to go. These human This Bill is a further step forward towards givfactors do not show up in the raw figures. ing rights to people from the Territories, people The Territory has ayoung population, an averwhom we were always happy to call Australians age age of 24 years compared to Australia's 29 but who somehow were denied the right of paryears. Publicservants account for about one-third ticipation. The former member for the Northern",33,Health Insurance Have Not Mentioned The Secondary Effects Of
94,"Rock. The Same Will Probably, Unfortunately, Mr Braithwaite (Dawson) (4.26)","MrTerritory, Mr Sam Calder, said: 'We pay our Territory does lack a firm industrial base, until it taxes, we obey the laws; why are we treated as secgets a power source such as the one to be ond or third class citizens?' I think that is a very promoted by the new power house, it cannot step important point to make. into solid manufacturing and other industries. I.do hope that that becomes a reality for the Territory. Mrs Kelly-That goes for the people of the Australian Capital Territory too. Other difficulties are forced on the Territory by this Parliament, through the manner in which people of the Australian Capital Territory too, tat ion of the many departments of the Commonand I am sure he was too. The Australian Capital wealth. The local officers seem to be directed by Territory has a population of over 200,000; the people who live in Adelaide, at arm's length from Northern Territory has a population of 100,000. the Territory that they are supposed to be To be denied basic rights simply because some administering. I feel it is essential that Canberra people have transferred from States where they give effective recognition to the worth of the have those rights to one of the Territories is an Northern Territory by having offices established irony that has been forced on us by the Constiin the Territory itself so that the officers can be tution. The Opposition sees no problem in acceptcloser to the action and can command the respect ing this Bill. of the local people. I mention one department, the The aspect of the Northern Territory is one Department of Housing and Construction. As the that I should like to speak about, particularly in honourable member for the Northern Territory the light of the Constitution. Tasmania was menindicated, so much of its work which goes out of tioned by the previous speaker as having had prothe Territory could well be done within it. I mentected by the Constitution its right to elect five tion groups such as consulting erigineers and members to this House, irrespective of the size of consulting architects, people in the construction its population. Just going through the last election game who know the basic requirements Of the results for the seats in Tasmania, the effective Territory. If only the various departments could number of voters in those five seats would have give these people a freer rein, I believe there averaged about 54,000 or 55,000. I am not sure would be a lot more work done, probably at a what the average number of voters in the Auscheaper rate and more effectively, because these tralian Capital Territory would be-certainly it people know local conditions. would be a lot more-but I do note that the I believe it should be a desire of this Parliament Northern Territory has a lesser figure. I feel that and the people representing the rest of Australia perhaps this constitutional reform should go a that we go that step further and give the people of step further and recognise the place that the Terthe Territories, in particular the Northern Terriritories play in the economy and the life of tory, that extra right to look after their own Australia and that more effective representation affairs. In many other ways, the Northern Terrishould be given in that area. I go back to the Tastory is discriminated against by laws that are manian situation to give that point a little more passed here and are effective within the Territory ,emphasis. itself. I have only to mention the aspects of land The previous speaker mentioned that it was rights, mining and quite a few of the other areas only the Australian Labor Party in government that are being held back in the Territory because which had ever had any concern for the Northern of the pre-directions that are issued from CanTerritory. I would deny that because in 1977 the berra. Perhaps in the fullness of time we will recNorthern Territory was given self-government. It tify this situation too. is flourishing there and, I believe, is well accepted I think it is important that we recognise, not and is certainly bringing governmynt closer to the only now but also in the future, that the.peop1e in people than it could ever be in Canberra. In that the Territories, the Australian Capital Territory regard, it was the previous Government which and the Northern Territory, do make up a fair gave the encouragement as far as the Alice proportion of the Australian popUlation. They Springs to Darwin rail link is concerned. It gave certainly provide a fair proportion of the taxes an indication that it would carryon with that rail and other requirements needed to make Australia link. I hope that the present Government does not work. They take their share of the strain. They renege on that offer by the Commonwealth. In the make their contribution. The people of the Northarea of the build-up of the defence bases, both ern Territory would probably believe that they naval and air force, the previous Government take a bigger strain in that they are closer to those made indications, as it did with regard to the teeming millions in the further north-in Asia and power house for Darwin. While the Northern in the islands. The Territory people are the first",35,Health Insurance Have Not Mentioned The Secondary Effects Of
95,Mr Braithwaite,"I am referring to the laws are made. I refer to the matter of represenline of defence, not only as far as defence is conthe Northern Territory the right to vote in Fedcerned but also as far as the illegal migrant, the eral referenda. The Bill is longoverdue and it is an drug running and all of the other things are conabsolute disgrace that until now approximately a cerned, and they do require some additional conquarter of a million Australian citizens have been sideration. Certainly, I hope that the defence disfrachised merely because they happen to live in aspect of the Northern Territory could be built up a Territory, either the Australian Capital Territo a greater degree than it is at the moment, where tory or the Northern Territory. The right to vote only token forces are represented by the three is a fundamental principle of all democracies and Services. yet the right of Australian Capital Territory resiSoI have pleasure in supporting this Bill, as dents to vote in national referenda has been does the Opposition. I just bring those matters to ignored until now. It has taken a Labor Governthe attention of the House to indicate that there is ment to recognise and respond quickly to this real discrimination not only in the Territories but glaring deficiency in our electoral system. in the north of Australia in prices, transport and I know that all territorial residents will appreciso many other areas. Isolation often means ate the speed with which the Labor Government neglect and forgetfulness by those people who has acted to ensure territorial voting rights in should take a more real part in the management referenda. The Labor Government took action to of those areas. correct this electoral deficiency within its first The people of Canberra have up until now been weeks in Parliament. This speedy attention to the denied the right to vote on referendum matters. I rights of Australian Capital Territory residents believe this legislation will give effect to the feelcontrasts sharply to the previous Government's ing that Canberra people have to be more closely lack of attention to those rights. The previous associated with the rest of Australia in their indusGovernment let the matter slide for almost six trial, commercial and social life. Only then might years, and even after all that time showed no signs we get a more tolerant view of the situation in the of rectifying the situation. That is how much conrest of Australia. sideration was given to the rights of the people of the Territories. It will be recalled that the 1977 Mrs Kelly-Are you saying I am a social referendum gave Territory electors the right to outcast? vote in referenda but from 1977 to the time of the I just said it would give them a better feeling. I did ment took no action to give legislative effect to not say what the feeling was outside. I do not rethis right. What a shameful record. Yet it is typigard these people as social outcasts at all but I becal of the way the previous Government treated lieve it would be better to treat the people of the people of Canberra. Australia as one and give them all the same rights. After all they all claim to be Australians. We As all honourable members know, there is no should work towards that common cause. form of local or State government in the Australian Capital Territory. We have only an advisSpeaker, I begin by congratulating you on assumpend entirely on the actions of the national ing the chair for the first time. I ask you to pass on Parliament for their well-being and future develto the Speaker my congratulations on his assumopment. When the national Parliament ignores ing his high office. BeforeI conclude my congratuthe rights and needs of Australian Capital Terrilations it would be most appropriate to point out tory citizens there is no other avenue of appeal. to the House that when the honourable member Too often in recent years the needs of Australian for Henty( Mrs Child) took the chair earlier Capital Territory citizens have been ignored, today it was an historical occasion because it was overlooked or given the lowest priority. In many the first time that this House had been presided vital matters affecting the day to day lives of local over by a woman. I congratulate also my colresidents the previous Government adopted a league the honourable member for the Northern most cavalier attitude, making ad hoc decisions Territory ( Mr Reeves) on a very fine maiden overnight which often caused havoc in the local speech. I think we can see from that maiden economy. I am reminded of the many decisions speech that he will make a great contribution to taken by the previous Government which had this Parliament and be an effective lobbyist and little support from the community but which were member for the Northern Territory. pushed ahead simply because they were GovernI support the Referendum (Constitution Alterment policies and had a very serious and damagation) Amendment Bill 1983 because it will give ing effect on the community-for example, the residents of the Australian Capital Territory and razor gang decisions. In Canberra the previous",36,Health Insurance Have Not Mentioned The Secondary Effects Of
96,Mr Braithwaite,I did not say that at all; March election this year the previous Govern,37,Health Insurance Have Not Mentioned The Secondary Effects Of
