speakerGroups,speaker,theText,pageNumbers,title
57,Mr Tim Fischer (Farrer) (3.33),"We nine months in gestation? The Minister for Defthis answer to the Minister, to the Parliament relation to that that of greater consequence than and to the nation. It is as well that one officer the average wastage rate are the wastage rates has left the Public Service; one wonders what is of middle ranking officers and technical sailors going to happen to the other officers who may which are of major concern to Navy and bear have been involved in this particular matter. But directly on the successful attainment of Navy's above all we have the word of the independent medium term aims. We have a Navy that is Auditor-General, saying very clearly that the bleeding slowly to death in terms of its experianswers and actions have been 'unnecessarily enced personnel; likewise the Army and the and unreasonably slow'. The honourable memRoyal Australian Air Force. The naval establishber for McPherson has been very responsible in ment shortfall in seamen lieutenants is 23 per raising these matters and in further highlighting cent, in engineer lieutenant commanders it is 45 them here today. His actions have been vindiper cent, and in communications radio operacated by those words of the Auditor. The Mintors-a fairly necessary manning requirement, as ister has failed to ensure proper procedures in I am sure the honourable member for Groom the giving of a reply to a question on notice. He( Mr Taylor) and other honourable members has failed in administering his Department and would point out-it is 41 per cent. This horrible in administering the new system which the forsituation goes directly to the responsibilities of mer Minister for Defence, the honourable memthe Minister for Defence as the overall senior ber for Corio( Mr Scholes), brought into being Minister who is in charge of coming up with the and which I am sure the Minister was briefed right mix of government policies and priorities about when he became Minister for Defence in to ensure we retain an adequate, competent, December 1984. No action concerning public experienced and capable defence force. risk waivers was taken until July 1987. In fact, the Minister would have been briefed that eight The Minister has failed in that he has presided locations plus another five locations were going over the worse period of wastage in the Navy, Army and Air Force in years. He has failed in to require public risk waivers under these safety guidelines for ammunition dumps around Ausareas that are directly available to the Governtralia. It is a chilling situation that in fact the ment to rectify. Let me refer briefly to one of Minister was misled on this matter and that by those areas, coming under one of the Minister's his own resources he was not able to detect that two junior Ministers in cohesion, Ministers in misleading. It is a chilling situation that the some form or arrangement under his portfolio jurisdiction. I refer, of course, to the Minister Parliament and the nation as a whole have been misled on this fundamental issue. for Defence Science and Personnel ( Mrs Kelly) and the Minister for Veterans' Affairs( Mr The wastage of experienced personnel in our Humphreys). defence forces adds further to this chilling situation. It is legitimate for us to consider that in I refer to the chopping and changing of the this debate and when we look at the statistics defence service home loan scheme. They have involved. I would like to quote from a document had about four goes at arriving at the right that has not fallen off the back of a truck; it is defence service home loan scheme. As far back a legitimate submission of the Royal Australian as May 1985 Treasurer Keating announced a Navy to a Senate committee investigating wastransfer of the Defence Service Homes Corpotage. It says: ration to the private sector. Three years later nothing has been achieved. All the Government There is clear evidence that within the Department of Defence the existing departmental machinery is inhas done is chop back the maximum period of adequate to cope with the need to view these items loan from 32 years to 25 years. Have not our within reasonable timescales. . . . soldiers, sailors and airmen the right to expect a Some conditions of service matters have been held up defence service home loan? Have they not the in the system for long periods, . . . right, after all their transfer postings in their careers, to take out a loan and build a house It goes on to analyse the Hamilton report on the with some commitment? The maximum term effect of service life on spouses, produced in has been reduced from 32 years to 25 years. I 1986. There was no action on that in any way, will concede that the Government has introshape or form until January 1988 when the first duced portability, but at the same time it has financial action was taken. I think a statement abolished the $10,000 grant alternative. by the Minister on this has now been put back until tomorrow. The submission states that the There are four key charges against this Minoverall wastage rate in the Navy is running at ister at this time. Why did he or his ministerial 12.6 per cent. The committee report stated in office fail to double-check the reply to the question with notice from the honourable member the track into implementation of the White Pafor Hughes? Why was there nine months delay? per. This makes this Minister different from Why did the Minister not get on top of proceedother Ministers for Defence. So often in the past ings for that very key question with notice? And we have had white papers and Ministers of why did he accept the snowing by his Departgovernment who have talked about policy direcment, by those two departmental officers, of the tions and things that they wished to do for provision of the proper information to him, to Australia in relation to defence, but they have the Parliament and to the nation? That is the not been able to carry them out for one reason first charge. The second charge is: why did the or another. I totally reject the suggestion in this Minister or his ministerial office fail to follow matter of public importance of incompetence up the whole issue of public risk waivers, which displayed by this Minister. It is utter nonsense. was originally notified-in effect signed-in late 1984, which saw no action until the first public As I said, we are now one year down the risk waiver came forward in July 1987? The track in implementing the White Paper. We are Minister should have heard warning bells ringing in the process of moving the Army into the loud and clear with regard to the massive delays. north of Australia. We have already fully develHe is taking actions now-too little, too late, oped the Tindal Royal Australian Air Force base and only as a consequence of what the Opposiand we have started to build up the Stirling naval base in Western Australia. I want to talk tion has put up. more about that shortly, because Stirling is in The other areas are: why is the Minister dealmy electorate and I am very familiar with a ing with the Government policies and priorities number of the changes that have already taken which are leading to the massive wastage and place there. allowing the unions to run riot in terms of delaying some of the submarine contracts? I remind the House of the way in which the Minister and his Department relate to the people Order! The honourable member's time has based, and also to the naval personnel who are expired. being moved into that region. BeforeI say more Ms FATIN (Brand) (3.43)-The previous about that, I would like to quote briefly from a speaker, the honourable member for Farrer( Mr news release entitled 'Achieving Self RelianceTim Fischer), said that the Minister for Defence The First Year', that was released by the Min( Mr Beazley) has failed. We are talking here ister on 22 March this year. The Minister said: about the greatest Minister for Defence since With careful management we have maintained the World War II. There is no question about that. vital programs outlined in the White Paper despite the People all round this country recognise that the unprecedented discipline on public spending by the present Minister for Defence is the greatest MinHawke Government. ister for Defence that this country has seen since And we have laid foundations for even more imporWorld War II. tant additions to the ADF in the years to come. In the past year we have signed contracts for six new submamight have been equally good. I join this debate nership with New Zealand. today with a great deal of pleasure. I want to We have also allocated significant money and effort refute a number of the claims that have been to improving conditions for Defence people. Pay and made and also to make my own comments. allowances, housing, family support and education are all being improved. FirstlyI want to say that this Minister for Defence is the first Minister to actually set the So much for the honourable member for Mcparameters of a defence debate in the way in Pherson( Mr White), who said that this Minister which we are seeing it today. He set the direchad an obsessional interest in equipment only, tions of the defence debate. When the House not in his Department and not in personnel. had before it the White Paper entitled The DefThat is nonsense, as has certainly been demonence of Australia we did not just find ourselves strated in many of his actions in the past three with a white paper that people read with a great years. The release continues: deal of interest; we found ourselves with a white Our achievements since the White Paper was released paper that had begun to be implemented. a year ago confirm that with disciplined Defence planning and careful management Australia can build a We find that the Government's policy has Defence Force that fulfils our responsibilities to ourbegun to be implemented. We are one year down selves, to our allies and to our neighbours.",24,Minister For Defence Minister Accept Responsibility For That Or Does He
58,Mr Deputy Speaker ( Mr Mountford),"in the town of Rockingham, where Stirling is",26,Minister For Defence Minister Accept Responsibility For That Or Does He
59,Mr Hollis,"Mr Curtin may be in there, too. rines, and work has begun. Within a few weeks we will",26,Minister For Defence Minister Accept Responsibility For That Or Does He
60,Ms Fatin,"It was suggested that Mr Curtin call tenders for eight new frigates, to be built in partI would suggest that that is exactly what the to write about. The report was tabled and, I people of Australia have been demanding of might add, many of the recommendations have government for a number of years and we find been implemented. that this Minister is in fact implementing just I will refer to some of them briefly, because it that. is relevant to do so. Mrs Hamilton recommended It has been suggested that he has this obsesthat we set up an Australian Defence Force sion with equipment only, and not personnel. Information Service-that has been done. She Let me briefly refer to some of the equipment recommended that social workers be appointed that the Minister is concerned about. Undoubtat a number of bases to assist with familiesedly we have to talk about submarines. Certainly that has been done, and I met the two social we need new submarines. Our Defence Force is workers who were appointed to HMAS Stirling in need of these and we are in the process of only three weeks ago. Mrs Hamilton advised building them. If we are going to build new that housing was a major problem. The Governsubmarines and have a submarine force, it is ment already knew that. The previous Governnecessary to be concerned about the safety of ment's record in this area was absolutely the submariners, the persons who sail in those shameful. However, something is being done and submarines. at bases such as HMAS Stirling some of the I was with the Minister last Friday in my best defence housing in Australia is provided. electorate when he opened the new submarine We are building good housing and facilities not escape facility at HMAS Stirling. It happens to only at that base; also we are repairing and be one of six in the world. It is the most modern, constructing similar houses throughout Australia. the most efficient and the best in the world. If IfI recall, about $70m was spent on that alone we are going to rely heavily on our submarine this financial year. fleet, what better can we do than establish a Mrs Kelly-It was $119m. who gave the okay to spending the $17m plus ommended that the Government review posting that went into putting that facility together. That policies to reduce short term postings to bring I suggest is a Minister who is concerned about about stability for family life and schooling. This equipment and concerned about personnel. is already in train. She also recommended that a Mrs Kelly-And their safety. range of allowances, for example for tuition, Minister for Defence Science and Personnel just available-and they are available. It is absolute said. When we are talking about personnel, I nonsense for an honourable member to come remind the House that it was this Minister for into this House today and complain about this Defence who determined that he wanted a junior Minister in the terms we have heard or, I might Minister, the Minister for Defence Science and add, in any terms. This Minister must be praised, Personnel, to give particular attention to defence as must the Government, for the policies on forces and their families. These people have been defence. The Opposition can show only inconsisnyglected in previous years. It was this Minister tency in its policies. Honourable members opfor Defence who, because of his concern, asked posite say spend, spend, spend, yet we hear the for and was given a junior Minister, and also shadow Treasurer, the honourable member for commissioned the Hamilton report. Kooyong( Mr Peacock), agreeing with the BusiA lot of people might dismiss the Hamilton ness Council of Australia, saying that defence report as an interesting document and not think expenditure must be cut. That is totally incontoo much about it, but I assure the House that sistent. How can we spend money on new numany people in this country believe that it is a clear submarines and aircraft carriers, increasing most significant report, because this is the first defence expenditure by three per cent, yet cut time attention and recognition has been given to funds? Australia and spoke to the wives and husbands Order! The honourable member's time has exof personnel of the defence forces about their pired. I understand the Minister wishes to table difficulties and problems. She returned to Cana document. berra, compiled a report and in due course the that that procedure took a long time. I suppose passed to me by the Secretary to my Department. to a lot of people and there were many things concluded.",26,Minister For Defence Minister Accept Responsibility For That Or Does He
61,Facility Such As This? It Was The Minister Himself Ms Fatin,Thank you. Mrs Hamilton rec,27,Minister For Defence Minister Accept Responsibility For That Or Does He
62,Ms Fatin,"Exactly-and their safety, as the removals, single personnel and childcare, be made",27,Minister For Defence Minister Accept Responsibility For That Or Does He
63,Defence Families. Mrs Hamilton Travelled Around Mr Deputy Speaker ( Mr Mountford),,27,Minister For Defence Minister Accept Responsibility For That Or Does He
64,Minister Tabled That Report. It Has Been Claimed Mr Beazley,I table the document that was,27,Minister For Defence Minister Accept Responsibility For That Or Does He
65,"That It Did, In A Sense, But Mrs Hamilton Talked Mr Deputy Speaker","The debate isReports heritage buildings. the provisions of the Public Works Committee wealth offices at the Haymarket, Sydney, has Act 1969, I present the fourth and the fifth evolved from complex site conditions and planreports for 1988 relating to the following proning criteria. The design solution incorporates a posed work: 31-storey office tower to the south of the site, a Construction of new Commonwealth offices, Melnine-storey wing to the west of the site with a bourne; and construction of new Commonwealth offices, two-storey podium to the north-east. The buildHaymarket, New South Wales. ing will provide 50,000 square metres net of office space to accommodate some 3,000 staff Ordered that the reports be printed. and approximately 1,600 square metres net of the Government's policy of increasing its ownfor the Commonwealth. Three historic buildings ership of office accommodation and thereby reand an underground gas holder base will be ducing rental outlays from high priced central restored and have been integrated into the decity locations, the Parliamentary Standing Comvelopment. The building has been designed spemittee on Public Works has recommended the cifically in harmony with the heritage character construction and fitout of two new Commonof the Haymarket area and the scale of the wealth office buildings, one in Melbourne on the surrounding streetscape particularly along Hay corner of Spring and Lonsdale Streets at an and Pitt Streets. The Department of Administraestimated cost of $ll8m for construction and tive Services has consulted with the Australian $18m for fitout and the other in Sydney at the Heritage Commission on heritage issues and will Haymarket on the corner of Pitt and Hay streets continue to do so as conservation work is docuat an estimated cost of $143m for construction mented in detail. The National Trust of Ausand $20m for fitout, all at April 1987 prices. tralia and the Heritage Council of New South Wales will also be involved in those consultaThe new Commonwealth offices in Melbourne tions to take advantage of their particular will be a 42-storey building consisting of a nineexpertise. storey podium and a 33-storey tower. The building will provide 60,000 square metres net of During the Committee's investigation of the office space to accommodate some 4,000 staff proposal, planning and heritage groups expressed and include shopfront accommodation for deconcern about the overshadowing of Belmore partments with a high level of public contact. Park and Eddy Avenue to the east of the site by the tower development. After examining all The site for the building is portion of a larger of the issues, the Committee concluded that the Commonwealth owned block bounded by Spring, Department of Administrative Services had exLa Trobe, Exhibition and Lonsdale Streets. Other amined a range of design options and that almost developments proposed for this block are stage any viable building on the Haymarket site would two of the Commonwealth offices building and produce some overshadowing of Belmore Park new offices for Telecom. The block is being and Eddy Avenue irrespective of the design sodeveloped as an integrated whole even though lution. The Public Works Committee is satisfied development is planned in stages. As the block that the Department of Administrative Services has not been redeveloped since it was acquired has developed a design that keeps overshadowing by the Commonwealth in 1948, an archaeologito a minimum while providing an economically cal investigation was undertaken on the block. viable building for the Commonwealth. The proThe Department of Administrative Services and posed office buildings will generate savings on Telecom each provided $50,000 for the archaeCommonwealth office accommodation rental and ological salvage project on the block. lead to an improved overall standard of ComA number of heritage buildings located on the monwealth office accommodation with conseperimeter of the new Commonwealth offices site quent improvements in operational efficiency and will be retained and preserved by the Commona reduction in operating costs. form part of the development proposal. The posals that have been presented to the House by Committee has recommended further consultathe Chairman of the Parliamentary Standing tion between the Department of Administrative Committee on Public Works relate to the conServices and the Victorian Ministry for Planning struction of two new Commonwealth offices, one",27,Minister For Defence Minister Accept Responsibility For That Or Does He
66,Mr Hollis (Throsby),In accordance with The design solution for the new Common,28,Public Works Committee And Environment Concerning The Future Of The
67,Mr Hollis,by leave-In accordance with retail-commercial space including shopfront space,28,Public Works Committee And Environment Concerning The Future Of The
