speakerGroups,speaker,theText,pageNumbers,title
87,Mr Connolly,"What are we going to do ment; persons are in poverty if they are a memof the Australian Council of Social Service, Mr One of the major related problems-and this Julian Disney, said that, even after the full immatter is not unique to the present Governpact of the Government's new family allowance ment-is that when reference is made to cash supplement, about 400,000 children would still transfer payments from the Budget, such payremain impoverished. Academics Brownlee and ments are very obvious. Everyone knows about King in their paper 'The Working Poor' claim them, they are clearly seen and people get upset that the main group of families has been lifted about the fact that 28 per cent of the Budget above the poverty line but that much more goes in social security payments, et cetera. Peoneeds to be done for families on pensions and ple are not aware of the fact that support can benefits. As I said previously, housing is a funalso be made available through the taxation sysdamental problem. Housing costs should be tem. Then, the figures are effectively hidden. placed high on the policy agenda in continuing The time has come when a very thorough analthe fight against poverty. An analysis of the poor ysis needs to be done about what sections of the demonstrates one interesting fact: those in greatcommunity do best out of the tax transfer arest poverty are those who are paying private rangements on the one hand, and out of direct rent. In places like Sydney in particular, people support through the taxation system on the other. are facing extremely difficult situations and the I believe such an analysis will reveal some glarpoor have effectively been driven out of the ing inconsistencies. inner suburbs towards the fringe of the city. As I have said, the Opposition parties support That creates another set of problems involving the essential ingredients of this legislation. From communications, transport and so on, making it time to time the need arises to introduce into even more difficult for many of those people to the House arrangements that will improve social find employment. security legislation and overcome anomalies when Examinations have also been made on the they appear. Regrettably, changes such as those impact of the Government's family package in contained in the legislation demonstrate that quite reducing both the number of children living in a few problems have arisen. However, essentially poverty and the size of the gap between family the objective of social security policy must be to incomes and the poverty line. After considering create a more equitable distribution of wealth in the costs of providing housing, Brownlee and our society. Different mechanisms can be used King found that 148,000 children in working to achieve that goal. families and 260,800 children in pensioner benAs the Institute of Family Studies has pointed eficiary families would still be living below the out, not enough consideration has been given poverty line. In their study they stressed the over the last few years-certainly not over the need not just for money incomes but that the last five years-to the fundamental problem that, Government must consider 'other forms of maunder the existing taxation system, the people terial well-being' such as assets or fringe benefits. who decide to bring up children in our society They also noted that consideration of income and who thus play a vital role in assuring the transfers alone did not attack the root causes of continuity of our population have not been given poverty and stated that parallel policies are rea fair go. The only support they have effectively quired in areas such as employment, education received from this Government-and, as I have and housing. In other words, it will take much said, it has been very belated-has been through more than increased income to eliminate child the family allowance supplement in the fifth and poverty. sixth years of the Government's administration. I would like to make a few observations about To that point, nothing was done. On the conthe impact of the taxation system in this whole trary, the Government changed the taxation sysarea. While people tend to say that the very tem in such a way that it gave up any pretence poor do not pay any taxes because they are of support through horizontal equity. below the threshold and that therefore the taxThat is the point with which I started my ation system cannot affect them, the difficulty speech and it is one of the points with which I contemporary Australian society faces is that the want to finish it. The taxation system needs to threshold of poverty is in fact going up-in other be reviewed to give special emphasis to the probwords, more people are finding themselves on lems facing Australian families who are bringing the margin or below that line. That increase in up children, often in very real distress. There is poverty automatically suggests that the current not the slightest doubt that people who have tax thresholds are not adequate to keep up with children in their family suffer a fall in real the problem. income, but that obvious fact has so far been completely ignored by the Government, and a the debate has gone as wide as that, and I do change of policy in this direction must be made not intend to allow it to get any more wide as soon as possible, hopefully by May. ranging. I ask the honourable member for Canescaped the notice of the House that the honsentiment, I remind the honourable member. ourable member for Bradfield ( Mr Connolly) in this case the Opposition would do. We should Deputy Speaker. However, I agree with my colconsider the way in which the Opposition conleague the honourable member for Moore( Mr ducts itself these days, whether in relation to Blanchard) that it has been a wide ranging depolicies on taxation, television ownership rules, bate, and taxes were mentioned. As to the forsocial security, health or anything else. The Opmulation of policies, I asked the honourable position is long on rhetoric but short on detail. member for Bradfield to tell us what he would The honourable member for Bradfield said that do, and he did not do that. He spoke about $43 was necessary to maintain the standard of people living in caravans in Sydney, saying how living as at March 1983. The question one pondistressed he felt in seeing them in that state. ders is that, if everything was so rosy in March All members of the House would agree with 1983, why were the Liberals thrown out of office? him. However, we must look at why people are living in those conditions in 1988 and also conout next time? present Government has been in office now for last time and the time before, and it will be the state of the economy in 1983 they will realise saying it next time. The fact is that it was that at that stage it had collapsed because, over thrown out of office in 1983 and it was kept out a number of years, governments had sat on their of office twice subsequently because it just does hands and done nothing. We are now paying the not have the answers to the important questions penalty for that. facing us. The longer we go, the more we see how incompetent the Opposition is. Mr Deputy Speaker, you would be aware that in the five years since the Government has been In Melbourne a couple of weeks ago there in power we have attempted in all areas to was the talk about the consumption tax-what ensure that the Australian economy in 1988, and a fiasco that was. The great debate in the Liberal as we move into the 1990s, will be such that Party about the consumption tax amounted to people do have jobs. Our record shows that the putting a muzzle on-Government has created over one million new ourable member for Canning will recall that in of the Fraser Government of 200,000. That fact the House last week we got into a certain amount directly affects the number of beneficiaries under of trouble on the question of relevance. I would this legislation. As the honourable member for ask, to avoid that same problem arising in relaBradfield said, the Government introduced the tion to this Bill, that the honourable member family package of tax free cash assistance, which keep his remarks relevant. provides $22 per week per child and more for teenagers aged 13 to 15 years. That package uty Speaker. I have just listened to the honour1.2 million children, at a cost of $500m a year. able member for Bradfield and, with respect to (Quorum formed) There is no doubt that the your ruling, his remarks were wide ranging. I Opposition wastes the time of this place. The think that some discretion should be given to Liberal Party should think of taxpayers when it members on this side, as well. calls for quorums. It is just not good enough to ourable member for Moore for his help. I heard whim of a member of the Opposition. Everybody the honourable member for Bradfield refer to listening to the broadcast of this debate should horizontal equity. I do not recall his remarks know that the Liberal Party is wasting taxembracing the consumption tax. I do not think payer's money.",42,Social Security Amendment Bill German Government To People Who Were Per
88,Mr Deputy Speaker ( Mr Rocher),Is ning to make his remarks relevant.,44,Social Security Amendment Bill German Government To People Who Were Per
89,The Amendment Seconded? Mr Gear,I appreciate the sentiment in your,44,Social Security Amendment Bill German Government To People Who Were Per
90,Mr Good luck,"Yes. ruling, sir.",44,Social Security Amendment Bill German Government To People Who Were Per
91,Mr Gear (Canning) (5.35),It will not have Mr DEPUTY SPEAKER-It is more than,44,Social Security Amendment Bill German Government To People Who Were Per
92,Did Not Respond To My Invitation To Tell Us What Mr Gear,"I acknowledge your ruling, Mr",44,Social Security Amendment Bill German Government To People Who Were Per
93,Mr Connolly,And why will you be thrown sider the state of the economy in 1988. The,44,Social Security Amendment Bill German Government To People Who Were Per
94,Mr Gear,That is what the Opposition said five years. If honourable members look back to,44,Social Security Amendment Bill German Government To People Who Were Per
95,Mr Deputy Speaker,"Order! The honjobs, compared to a loss of jobs in the last year",44,Social Security Amendment Bill German Government To People Who Were Per
96,Mr Blanchard,"On a point of order, Mr Depaffects more than 600,000 working families with",44,Social Security Amendment Bill German Government To People Who Were Per
97,Mr Deputy Speaker,"I thank the honstop the workings of parliament to cater to thethat the Government has introduced the family Deputy Speaker. I draw your attention to the assistance package, which deals directly with extreme lack of relevance of the honourable many of the points raised by the honourable member's remarks. This is supposed to be a member for Bradfield. There is no doubt about debate on a social security Bill, not a tax Bill. ble members opposite are always gunnas. When ourable member for Canning has been asked to they are in opposition they say they are gunna remain relevant. I will allow him a couple of do it; they never did it when they were in sentences to get back to the Bill. government. I remind the honourable member he should remember that during the whole period I was going on to point out how it is apparent of the Fraser Government the top tax rate stood from the Minister's second reading speech that at 60c. We brought that down to 49c. What is we are targeting that money at people who do more important to this debate is that the bottom need it. I was picking up the point made by the tax rate during the Liberal years was 30c. As we honourable member for Bradfield, who raised are talking about people on low incomes, I rethe point of order. I noted when he was speaking mind the House that the bottom tax rate is now that he referred to higher taxes. I am responding 24c. It is all right for the honourable member to him, yet now he takes a point of order. I am for Bradfield to lecture this Government about telling him why there are higher taxes and why how we should go about eradicating poverty. we are getting more taxes now. This Government has done more than the preI have listened to members of the Opposition vious Government ever did in all areas of social on a number of occasions. They talk about Aussecurity, as well as in industrial policy and taxtralia as a high taxing country. In actual fact, it ation reform, to bring about improvements. Inis not true. The honourable member for Braddeed, the Minister for Social Security( Mr Howe) field wants Turkish tax rates with Swedish social in his second reading speech stated: security provisions. He is not honest enough, We have substantially increased the real level of penwhen talking to pensioners in the community sions, benefit and allowances while reducing the level of about social security, to mention raising taxes. social security expenditure as a proportion of gross He talks about high taxes to one audience, but domestic product. I can imagine what he says about social security What we are doing is targeting that money to provisions to a pensioners' meeting. Will he ever those people who need it and making sure that tell them why he is going to slash taxes and who the wastefulness that was there previously is is going to pay for it? the assets test. When this Government moved to than they are now and they know it. You saw make sure that people with millions of dollars them at the public rally out there a few months did not receive the pension, the Opposition opago. to indicate to this Government that it would Government. ister. They booed him back into the House. field talk about the higher taxes that this Govourable member for Bradfield will stop interjecternment collects. It is true that we collect more ing, particularly after the Chair has asked him tax now in 1988 than we did in 1983, and there to come to order. expanded economy. We have a million people ble member for Bradfield because he made a now paying taxes who never used to pay taxes. number of relevant points in his contribution. We have an economy that is producing more. When he speaks about pensions, social security The gross domestic product has gone up. So one provisions and a rally of pensioners outside this would anticipate that the taxation take would place, he is speaking from the Opposition be very much higher. Also, many people in those benches. The question he has to ask himself is: days were not paying taxes. The fringe benefits If he is so good, why is he sitting on the Oppotax, in particular, we are told will raise about sition side? Why are we sitting over here? At $2 billion this year. So honourable members can the next election it will be the same story besee that the tax take is higher. cause, when one looks at our social security",44,Social Security Amendment Bill German Government To People Who Were Per
98,Before I Was Interrupted I Was Pointing Out Mr Connolly,"I raise a point of order, Mr",45,Social Security Amendment Bill German Government To People Who Were Per
99,It: When It Comes To Giving Out Advice Honoura,Mr DEPUTY SPEAKER-Order! The hon,45,Social Security Amendment Bill German Government To People Who Were Per
100,For Bradfield That When He Talks About Taxation Mr Gear,"Thank you, Mr Deputy Speaker.",45,Social Security Amendment Bill German Government To People Who Were Per
101,Eradicated. Nothing Exemplifies That More Than Mr Connolly,The pensioners were better off,45,Social Security Amendment Bill German Government To People Who Were Per
102,Posed That Measure. Nothing Has Been Said Since Mr Deputy Speaker,Order!,45,Social Security Amendment Bill German Government To People Who Were Per
103,Repeal That Provision If It Became The Mr Connolly,They booed your Prime Min,45,Social Security Amendment Bill German Government To People Who Were Per
104,I Listened To The Honourable Member For Brad,Mr DEPUTY SPEAKER-Order! The hon,45,Social Security Amendment Bill German Government To People Who Were Per
105,Are A Number Of Reasons For That. We Have An Mr Gear,"I am responding to the honourarecord dealing with pensioners, one finds that cannot provide housing for as many people as we have raised the age pension by 8.4 per cent we would like. Certainly, they are the people in real terms. We have taken it from 22.7 per who are affected by the provisions in this Bill. cent of average weekly earnings, where the OpMy response is that we have doubled funding position left it, to over 25 per cent. Does the for public housing so that people who are receivhonourable member really think that pensioners ing the family assistance supplement-many of will applaud him for keeping down the pension them are living in public housing or are renting and give him a second chance? privately-will be assisted by the passage of this to the cost of living. I return to the point I was making before. In about the cost of living. He should look at his sure that we target our social security dollars to record. When Mr Fraser came to government he those people who need them. I remind the House was going to tackle inflation. That was it: tackle again that the percentage of gross domestic inflation and everything will fall into place. When product spent on social security now is lower the previous Government was kicked out of than when we came to government. The Oppooffice inflation was running at 11.7 per cent. sition cannot say that we are raising too many That is how good he was and he talks about the taxes and spending money in an undisciplined cost of living! way and then talk about cutting taxes because hurts. High inflation hurts people on low intaxes which will impinge directly on the Social comes. So for the whole seven years of the Security Amendment Bill. When we hear Opprevious Government it set itself the task of position spokesmen talk about a $11 billion to combating inflation. It flunked. When it was $13 billion cut, we have to ask: How will the kicked out inflation was higher than it was when Social Security Amendment Bill be affected by it came to government. that? The truth is that it will be affected substantially because 28 to 29 per cent of all our spending is on social security. If those opposite have created a million new jobs. I will go back it is up to them to tell us where the money will to the cost of living because it does impinge on come from. Are they going to cut age pensions? the very people we are talking about in this Bill. Will the family assistance supplement be disconourable member for Canning wants to make this have to tell the people. We were reminded by a debate on the economy it will be possible for the Business Council of Australia just recently others to do the same. He knows that. I asked in its submission-is not a debate on the economy. I point out that I am still responding to the to drag me away, but I will come back to the honourable member for Bradfield, who was alBill. We were reminded by the Business Council lowed to make wide ranging remarks in the of Australia that $2.5 billion could be cut from debate, even though he was relevant. I am trying the Federal Budget. Indeed, it went into some to be relevant in responding. detail on the social security provisions, including tightening the assets test, which I know the ourable member for Canning will not reflect on about those sorts of things to come up with cuts the Chair. The honourable member for Bradfield of $2.5 billion, and then the shadow Treasurer remained in order. He spoke to the Bill before says that it is not going far enough, I think this the House and to his amendment. I caution the Parliament and the people of Australia have a honourable member to do the same. right to know where they are going to make the able member for Bradfield spoke about public are going to slash taxes, as was indicated by the housing and the long waiting lists. I agree with honourable member for Bradfield in his speech. him that it is just not good enough that we They just cannot go on saying that they are",45,Social Security Amendment Bill German Government To People Who Were Per
106,Mr Connolly,Look at what you have done Bill.,46,Social Security Amendment Bill German Government To People Who Were Per
107,Mr Gear,The honourable member talks the provision of social security we are making,46,Social Security Amendment Bill German Government To People Who Were Per
108,Mr Courtice,And whom does that hurt? we are spending it in that undisciplined way.,46,Social Security Amendment Bill German Government To People Who Were Per
109,Mr Gear,My colleague asks whom that Members of the Opposition talk about cutting,46,Social Security Amendment Bill German Government To People Who Were Per
110,Mr Snowdon,What about employment?,46,Social Security Amendment Bill German Government To People Who Were Per
111,Mr Gear,"As I have already mentioned, we are going to make cuts of $11,OOOm to $13,OOOm,",46,Social Security Amendment Bill German Government To People Who Were Per
112,Mr Deputy Speaker,Order! If the hontinued? These are the sorts of things that they,46,Social Security Amendment Bill German Government To People Who Were Per
113,Him Earlier To Be Relevant. I Ask Him To Do So. It Mr Snowdon,Supported by this mob.,46,Social Security Amendment Bill German Government To People Who Were Per
114,Mr Gear,"Thank you, Mr Deputy Speaker. Mr GEAR-The honourable member is trying",46,Social Security Amendment Bill German Government To People Who Were Per
115,Mr Deputy Speaker,Order! The honOpposition opposed. When those opposite talk,46,Social Security Amendment Bill German Government To People Who Were Per
