speakerGroups,speaker,theText,pageNumbers,title
148,One Point Which The Opposition Has Raised Mr Andrew,"Mr Deputy Speaker, at thetime-wasting action, at least it ensures that I He was prepared, frankly, to offer up as a sachave an audience in the House to hear what I rifice to the people of Australia the children have to say. I thought the best illustration of living in poverty. what this debate is about was given by the It has been almost indecent to sit and listen honourable member for Adelaide( Mr Pratt), to the debate that has raged tonight on the social who came into this chamber and listened to security amendments. One could be forgiven for what the honourable member for Hawker( Mrs presuming that all compassion had been vested Harvey) had to say. As honourable members in the Government benches and was solely on opposite would have noticed, he then came over the other side of the House. This has been a to me and said, 'Neil, I thought we were in debate where the image projected into the galfavour of this legislation. What is she on about?' lery and to any of the community listening has I had to assure him that indeed we are in favour been that this is a them and us debate and that of it, that in fact the Opposition is not opposing the measure of compassion in Australian society the legislation before the House. If members of is the measure of what we, the people of the the community listened to Government speakers Parliament, do with the taxpayers' money. Once such as the honourable member for Hawker, the again I remind the people of this Parliament and honourable member for Capricornia ( Mr of the nation that what we do with the taxpayWright), the honourable member for Canning ers' money has little, if anything, to do with ( Mr Gear) and, to a lesser degree, to be fair, compassion. Real compassion is not measured by chard), they could have been forgiven for thinkactually ours to spend. We acquire it; they do ing that the Opposition was opposed to the not give it to us. We demand it; they do not legislation and that the whole question of social volunteer it. Real compassion is measured by security amendments was a matter where all what we do with our own resources. That is the compassion had been vested in the Government real measure of compassion. We are here as benches and that there was a desert on this side nothing more than the stewards of the resources of the House in terms of any sense at all of that the taxpayers of Australia have unwillingly compassionate feeling. As a matter of fact, the made available to us. The difference across this honourable member for Hawker said that she Parliament on this debate tonight is not a differthought it was a favourite ploy of the Opposition ence in degree of care but a difference in degree when challenged to ask something to avoid the of responsibility. In 1988 the truth, relative to question by turning it back on the Government. the social security debate, is that if a person I wonder whether I have ever heard a better fathers or mothers a child he or she must assume illustration of just what the Prime Minister( Mr responsibility for that child. No responsibility Hawke) is about day in and day out in this will be endowed upon him or her as acute as House. that responsibility for his or her own flesh and The honourable member for Hawker said that blood. Parenting is not a role that can be duplione great luxury the Opposition enjoys is that cated by the Government. With the best will in because it is in Opposition it can just talk; it the world the Government cannot provide some never has to deliver the goods. Let me remind sort of substitute parenting role. the honourable member for Hawker that no-one To take up the points made by the honourable sits on this side of the House without intending member for Sturt( Mr Wilson) earlier in this to occupy the government benches and then be debate, we have the quandary where a single immediately accountable. If that is not illustraparent earning the same income as a two-parent tion enough, let me remind the honourable memfamily will find himself or herself entitled to ber for Hawker of just what the Prime Minister more in the way of benefits. We find that a less was about when in the July 1986 election he than ideal situation. His plea, my plea and the had the sheer barefaced audacity to be so cruel, plea of all members on this side of the House is knowing that he could not deliver, as to say that not for less compassion, less care, but for a by 1990 no Australian child would be living in comprehensive family policy that does not dispoverty. He knew, we knew and Australia knew advantage those who grow up in what we would that that could be nothing but empty words, loosely call normal families. What has been be that the promise could never be delivered. The hind the Opposition's debate is that we do not accusation made by the honourable member for in any sense want to be less compassionate or to Hawker and levelled at the Opposition is deny resources to people in real need, but we do groundless because it is precisely the tactic used want to resist the emergence of a nanny state. I by her own Prime Minister as an election ploy. use that term because, if ever a nanny state",60,Social Security Amendment Bill Reduced Pensions By 2 4 Per Cent It Is The Same
149,The Honourable Member For Moore ( Mr Blan,"what we do with taxpayers' money; that is neverapplied, it applies to this debate in that a nanny consideration this Government has for poor peoeffectively is a substitute parent. ple. In the face of my statistics I ask him to IfI am to deal tonight with the question of substantiate that sort of claim. The truth is that poverty and poverty as it affects Australian famwhile the Government claims to have a particuilies, I cannot resist the temptation to bring to lar concern for poverty in this nation, no-one the Government's attention the real focus of can escape-not even by the convenient statistics poverty in our nation. The truth is that, whilst used by the honourable member for Hawkermost people merely presume that poverty-and the truth that the rise in government expendipoverty as addressed by the legislation currently ture under this Government has been $30 bilbefore the House-exists in urban Australia, in lion. Thirty billion dollars has been taken away fact real poverty exists in rural Australia. from the taxpayers of Australia and vested in the Parliament. The only defence we heard from Mr Robert Brown-Rubbish! the honourable member for Canning was that, that that is rubbish. Let me refer him to a recent cate 12 millionaires who happened to be on the study by Mr Bruce Mackenzie, a senior lecturer pension. Is that the real measure of what this at the Warrnambool Institute of Technology, Government is about? and Dr Jim Lees, Director of the Rural DevelIn the half decade since 1983 we have facedopment Centre at the University of New Engand the Government acknowledges this fact; let land. It is not a Liberal Party document; it is us be fair-declining living standards, increasing not a National Party document. Mr Mackenzie queues for houses, as the shadow minister for and Dr Lees discovered that, of the 37 poorest housing and public administration, the honouraelectorates in Australia, 33 are in rural areas and ble member for Barker( Mr Porter), could well only four are in the cities. Furthermore, they and truly substantiate, and a real tax burden found that 76 per cent of Australian families such as we have not seen before on middle who are earning less than $12,000 a year are Australia. The Opposition has indicated that it rural dwellers. is prepared to support the Government's initiaI can understand why the honourable member tives but we have moved an amendment to make for Grey( Mr O'Neil) is listening attentively to the debate that much more honest by focusing my statistics. His electorate and mine are dion the Government's shortfalls. I regret that in rectly affected by these statistics. We have the this debate, in which we have indicated support classic case of poverty being vested in rural for the Government's initiatives, Government Australia and the legislation before the House is speakers have chosen to divide the House down currently targeted towards urban Australia. Bethe middle and create a 'them and us' mentality. fore he in any sense disagrees with that stateIt is little wonder that the electorate is so cynical ment, let me ask him-and it is pertinent to ask about the exercises we go on with in this place. the Minister for Employment and Education When we consider both the amendment moved Services( Mr Duncan), who is at the table, as by the honourable member for Bradfield and the well-in regard to the existence of poverty in statement made by the Prime Minister in the rural Australia, in areas of South Australia rep1986 election campaign, when he frankly promresented by the honourable member for Grey ised-and me, why Dr Cornwall, the State Minister for Health, intends to deny people in the towns 1986. of Laura and Blyth, the home town of the honadd-The Prime Minister had the audacity to promise what he knew he could not deliver in terms of ridding children in Australia of poverty. It is electorate of the honourable member for Barker. it is. Why does the State Minister intend to deny tal right to some sort of adequate health care? (9.06)-1 was somewhat amused by the contribution from the honourable member for WakeOurable member for Capricornia in his own parhe has been reading. I do not know whether he ticularly evangelical way talk about the special has been reading Phantom comics or Donald",61,Social Security Amendment Bill Reduced Pensions By 2 4 Per Cent It Is The Same
150,Mr Andrew,"An honourable member says in the process, the Government managed to lo",62,Social Security Amendment Bill Reduced Pensions By 2 4 Per Cent It Is The Same
151,Mr Free,We did not have an election in,62,Social Security Amendment Bill Reduced Pensions By 2 4 Per Cent It Is The Same
152,"Ourable Member For Adelaide, Might I Digress To Mr Andrew","In 1987, I beg your pardon.",62,Social Security Amendment Bill Reduced Pensions By 2 4 Per Cent It Is The Same
153,Mr Porter,And Tailem Bend.,62,Social Security Amendment Bill Reduced Pensions By 2 4 Per Cent It Is The Same
154,Mr Andrew,And Tailem Bend in the little wonder that the electorate is as cynical as,62,Social Security Amendment Bill Reduced Pensions By 2 4 Per Cent It Is The Same
155,People In The Poorest Electorates That Fundamen,Mr SNOWDON (Northern Territory),62,Social Security Amendment Bill Reduced Pensions By 2 4 Per Cent It Is The Same
156,Mr Porter,"Tailem Bend is a railway town. field ( Mr Andrew), as I am sure were all those",62,Social Security Amendment Bill Reduced Pensions By 2 4 Per Cent It Is The Same
