speakerGroups,speaker,theText,pageNumbers,title
23,Relationship Between The Government And Its Mr Allan Morris (Newcastle) (12.15,"making. It needs to take into account the $6.8 from the previous speaker about the state of billion the Prime Minister( Mr Howard) the manufacturing industry when she was promised the people that he would spend. young. What she did not say-what she does He also promised them that he would give not even know-and what those opposite that spending preference over dealing with have never understood is that the manufacturany budget deficit. In other words, he gave a ing industry we had was all based on overseas solemn promise that, if the figures were licences. The vast bulk of it was governed wrong, he would run a deficit rather than cut and controlled by licences, tools and equipthose promises. We have seen how long that ment that were overseas owned and managed. lasted. It did not last beyond the first week. The vast bulk of it was not Australian owned Day by day and week by week we are seeing or native. That was not Australia's choice; it evidence of it. As recently as last week there was a choice of the owners. Ericsson from was a massive attack on the state governSweden, which had a plant in Australia, ments, which effectively was an attack on the would not allow its product to be exported people. The idea that somehow the state beyond Australia. That was not an Australian governments can find $1.5 billion without decision, but a decision by Ericsson in recourse to the community or wiping out Sweden about the Australian product and services is just ludicrous. An article in the licences. That sort of thing occurs with any Sydney Morning Herald earlier in the week company you care to name, be it Heinz or about it being a gun at the head approach was various others. very apt. This means that the opposition does not There was a proposed cut to the Public understand that, to generate real wealth and Service of 2,500 jobs through natural attrition. real long-term jobs, we have to generate extra We are now looking at 20,000 or 30,000 job production. That is what it is about. The idea losses. I imagine that there would be 2,500 that somehow small business people and job losses north of Hornsby alone let alone in single family businesses will generate in the rest of Australia. creased production is a nonsense. Most of The Prime Minister was also very strong on them require someone else to do the producthe notion of job growth and the idea that ing. Business is broken up into two kinds. small business would massively employ if The distinction is not between big and small given some concessions. I find it quite interbusinesses but between producers of wealth esting that no-one ever seems able to explain and recyclers of it. Most small businesses to me why small business people would recycle wealth that someone else creates. employ someone extra rather than buy a new They do it very well and it is a very importcar or house or have a holiday, which many ant function. of them need, if they made extra money Unless the wealth is being generated by because of a change in taxation or something somebody, there is nothing to recycle. The else. Increasing profits and employing more steel producers, car makers, pharmacists, people are supposed to be magically related. farmers and whoever generates that wealth are The fact that more than half of all small the ones that policy should be directed at. businesses employ nobody extra seems to They can then generate more so that there is escape some people. When small business more to recycle. The idea that you can somegrew or when company profits improved quite how regard small business as generating a dramatically during our term, we did not greater national product for Australia is a necessarily see a concomitant increase in nonsense and always has been. It was a employment. The relationship between cutting nonsense when the opposition was previously provisional tax a.nd lifting employment is nonin government. That explains its failure to causal. It is a bit of mythology. understand the changing world and why in Going slightly further than that, this govern1983 we inherited an economy, as the memment fails to understand that it has not learnt ber for Charlton( Mr Robert Brown) said, that from its 13 years in opposition. We heard was an industrial graveyard. The previous government had the task of interrelated and the task of government is to taking Australia through the transition 10 balance and explain those. What we hear from years too late. It should have been done 10 to those opposite is never about people. All we 15 years earlier when the world was chanhear is a mantra. This is government by ging. It was happening in Europe in the mantra, government by slogan, government by 1960s. Australia was held back by the coaliquick quip. tion government because it failed to underWhen the government's backbench starts to stand what was occurring in the world. realise what their ideology and their economic The transition to technology changes, policy really means to people, I hope they industry changes, changes in world trade, keep on screaming. Holsworthy has nothing miniaturisation changes and computerisation on the impact their policies will have. Holschanges-all those things-was postponed worthy is a drop in the bucket. People will be until we came to government. In making hurt much more and for longer by this ecothose decisions about that transition we had nomic strategy than by any airport. to take into account the effect they would The choice between people and economy have on the economy and on people. partly comes back to who works for whom. Our budget for last year and the budgets we I think many parliamentarians on both sides projected for this year and the year after of the chamber would share the view that the would have balanced people with the econeconomy is there to support the community; omy. They would have balanced the need for the community is not there to support the fiscal restraint and fiscal sensibility with the economy. We do not sacrifice our people, our effect that would have on people. We are now workers and our youth for some so-called seeing a jettison of that principle. When the economic goal or objective; we harness the now Treasurer says that our deficit was by people to make the economy work, and the choice, he is correct. It was by choice. The economy works for the community. choice was either hurt more people and put Let us look at what we have seen so far in more people on the scrap heap or carry a terms of the rhetoric versus the reality. We deficit for longer and allow the economy and have seen a shift to Telstra. We have seen a productive growth to come through to recovgovernment say that foreign debt is bad and er. That was a choice, and it is the choice should be reduced, and then it introduces a governments have to make. bill to sell $2.8 billion worth of shares in a The government's whole strategy for this fully publicly owned company which will parliament is to reverse that choice and go increase the foreign debt by $2.8 billion. back to the Fraser era and to the Thatcherite Those shares will be acquired by local subsidpolicies of attacking only the economy and iaries borrowing from overseas fund holders. disregarding the community. I hope the So that will increase the foreign debt. previous speaker will be shrieking and wailThe government is talking about reducing ing loudly when she sees the unemployment government debt. It is going to sell an asset these policies create, because these policies which is now earning 13.5 per cent on its are draconian. We are talking about a governasset value to pay off debts which are costing ment by its policy choices deliberately reducseven per cent. This is a very clear set of ing growth by half a per cent, at least, in the strategies! If you can borrow money at seven next one, two or three years. It is deliberately per cent and earn 13.5 per cent on that monchoosing to reduce 40,000 jobs. That alone ey, people would say go and borrow some means that there will be 40,000 less jobs in more and do more of that. If you can earn at the next year than there would have been least six per cent on your borrowings on otherwise. That is the price of a so-called behalf of the community, that is a good budget surplus. investment. But Telstra, which is earning 13.5 It needs to be understood very carefully that per cent on its $24 billion worth of assets, is governments make choices to balance social to be sold to pay off debts which are costing, damage with economic damage. The two are at most, seven per cent-it is probably closer to five per cent. This is clever economics? It elected to this parliament to represent Australis surprising that this has not sunk in. ia and to do national things, not to give away We have seen the government's changes to national responsibilities. housing. It has cut the states back to a oneI want to move to a more particular issue at year budget so they cannot plan ahead, wiped the moment. In recent days a number of out any capacity for involvement in urban people have said that, for the 13 years I have planning and at the same time moved towards sat in this parliament, I have been a relatively a shift in a voucher system. What it is really serious speaker. I am not frivolous by nature. doing is taking from the building industry and I do not think I have ever been called to order giving to the rental market increased rents all for interjections. I have been quite strenuous over Australia by giving people rental vouchin seeking clarification on a number of issues ers. It is not about helping people; it is about in this parliament. helping certain segments of business. It There is a reason for that, and I think I displays an absolute ignorance of how our need to explain it for you, Mr Deputy Speakeconomy works. er, and for the Speaker in his absence. I have The other absolutely terrifying proposal that sat here for 13 years watching: I watched the the government has on the table is the transfer vilification of Speaker Childs-she was to the states of a series of services-disability treated with absolutely vile behaviour. In the services, the home and community care last couple of years I have watched those program, hostels and nursing homes, and opposite-they are now in government-bring health. When people out there in the comthe role and function of parliament on to the munity realise what this means, they will be national political agenda. It was a political absolutely horrified because the Commonissue. The independence of the Speaker was wealth is in those programs because they were a political campaign and an election issue. not being done by the states. The CommonThe expectation created was very strong. wealth does not go around volunteering Many of us agreed with that. Many of us on money for programs if those programs are the other side were not comfortable with some already being done. It funded them because of the things done or statements made by no-one was doing them. If you look at the some of our colleagues. We actually believed history of the SAAP program or the home and that there would be some changes. What we community care program, you will find that have seen has been an absolute charade. states were not doing them well enough, or at Reid)-The honourable member must be very all. careful not to cast reflections on the chair. the whole area of youth and youth homelessMr Deputy Speaker. I am very mindful of the ness? Because no-one was doing it. Nothing standing orders. What we have seen is an was happening. We had families and children absolute charade. We have seen the Prime in enormous difficulty. If you look at the Minister goading the gallery to make noises. history of that state by state around Australia, This is the Prime Minister who was going to you will find that there are massive differchange the standards. The Prime Minister said ences in services and standards. In one part of in his opening remarks to the parliament that Australia the service is not equal to that in things are going to change. The Speaker also another part of Australia. We are not one made some opening remarks about what he country; we are seven, eight or nine for many was going to do about the independence of issues. the parliament. I, for one, felt he would be This government is now talking about under some pressure, so I was quite deliberate abdicating responsibility-transferring relative in asking a series of questions on interpretafunctionality to charities and non-government tion, particularly standing order 82: anticipaorganisations and transferring a lot of respontion of debate. If you look at those questions, sibilities to the state governments. People are you will see that I was very careful. I was",46,Governor General S Speech
24,The Commonwealth Is In Them Because The Mr Deputy Speaker (Hon. N.b.,,49,Governor General S Speech
25,Why Was The Commonwealth Involved In Mr Allan Morris,"I am very careful,actually trying to assist and clarify because it Check what he was saying in his points of is very important, particularly for new speakorder and see what he is saying now. The ers. The first few months for new speakers are new backbenchers should go and read Hansvery difficult, as I have observed in the past. ard. (Time expired) careful with those questions. Reid)-BeforeI call the honourable member The matter that I refer to now became for Bowman, I remind the House that this is obvious in recent days-the establishment of the honourable member's first speech. I ask parliamentary committees, which some of us the House to extend to her the usual courteworked incredibly hard to get. The executive sies. maintain their funding and sovereignty. We Thank you, Mr Deputy Speaker Reid. May I watched them being taken over by the execoffer my congratulations to you on your utive, by the Prime Minister appointing the appointment. Would you pass my congratulachairmen. In other words, backbenchers lost tions to the Speaker and the other Deputy ownership of their committees. Funding for Speakers as each of you continue the duties committees has been lost; they have now been in this 38th Australian Parliament. I congratuemasculated, with their capacity being relate our Prime Minister( Mr Howard), who, duced financially; and their functionality is through his strong and steady leadership, was now changing. That enraged me quite seriousgiven a resounding vote of confidence by the ly and it became very obvious that all the Australian electorate. rhetoric about the executive and the parliaThere has never been, and perhaps never ment was rhetoric. will be again, the same make-up of elected In the next six to 12 months the people out representatives due to the extraordinary events there will recognise that this government is of the previous 13 years. The choice of the doing more of what it complained about. Australian electorate on 2 March sent a Yesterday I heard the member for Flinders resounding shout from the homes and work( Mr Reith) complaining about points of places across Australia that voters had had order-the hide and audacity of him in enough of Labor tyranny, they had had particular! enough of the heavy-handed bureaucratic order. representatives out of touch with the real needs of the Australian taxpayers, to whom all of us here today are accountable. lous person. I never make frivolous points of order and I never will. Read the standing For their part in electing me to this the orders and check the record and find out House of Representatives I truly thank the previous interpretations. Go back and read electors of Bowman. It is with pride and what your people were asking themselves. humility that I look forward to representing their needs. I pledge today to represent all point of order: the member is reflecting on the campaign theme-for all of us, not just for Speaker. He is claiming that the Speaker is some. I congratulate all newly-elected memnot acknowledging good points of order. bers to the House. I extend to them my best point of order. I did warn the member for members in achieving our policy aims and Newcastle on that particular point. goals. loose points of order. I suggest that people go Australia who suffered loss and trauma at the back and look at what was said in the previtragedy at Port Arthur, I offer sincerest ous parliament about points of order from this condolences from myself, my family and my side, particularly from the person in the chair. constituents. The tragedy brings home the",49,Governor General S Speech
26,Ministers Do Tend To Run The Show. I Was Very Mr Deputy Speaker (Hon. N.b.,,50,Governor General S Speech
27,Never Wanted Them. We Worked Very Hard To Mrs West (Bowman) (12.35 P.m.),,50,Governor General S Speech
28,Mr Randall,"Like frivolous points of decree, and they had had enough of political",50,Governor General S Speech
29,Mr Allan Morris,I am not a frivo,50,Governor General S Speech
30,Mr Abbott,"Mr Deputy Speaker, on a electors of Bowman, as this was part of our",50,Governor General S Speech
31,Mr Deputy Speaker,There is no wishes and look forward to working with all,50,Governor General S Speech
