speakerGroups,speaker,theText,pageNumbers,title
0,"Thursday, 20 June 1996 Ber That We All Have A Duty To Maintain The Integrity Of The Westminster System. Although I Must Confess To Republican Obe) Took The Chair At 9.30 A.m., And Read Debt To The British System We Inherited In This Prayers. Place. That Involves The Concept Of A Demo","cratically elected parliament and an independent public service-and I will talk about that Address-in-Reply later-but it also involves the separation of Debate resumed from 9 May, on motion by powers and an independent judiciary. On Mrs Gash: those three tiers, basically the whole system of our parliamentary democracy and the rights That the following address-in-reply to the speech of our citizens rests. of His Excellency the Governor General be agreed We, the House of Representatives of the gentleman mentioned Burma. It is a perfect Commonwealth of Australia, in Parliament assemexample of a takeover by the military, a bled, desire to express our loyalty to our Most situation where parliamentarians, democratiGracious Sovereign, and to thank Your Excellency cally elected, have been imprisoned and an for the speech which you have been pleased to address to Parliament. arrogant military dictatorship simply refuses to answer the questions that are posed to it by a.m.)-I entered the Victorian parliament in parliamentarians who are languishing in gaol, 1963 and this parliament in 1977, so this, I subject to torture and abuse and separation suspect, unless some kind of revolution takes from their families. These are issues which I place, will be my last address-in-reply speech think should concern all of us. in this House. I begin, sir, by congratulating you and your deputies on your election to the I now want to tum to some questions difficult task of presiding over this House, which, in the cut and thrust of debate, we do which, from past experience, is not always as not often ask ourselves. There are clearly orderly as it ought to be. differences between the philosophy of the incoming government and that of the former I think we take many things for granted in government. I am bound to say that I have this nation, and one of the things we take for never been in a parliament when any governgranted is our system of parliamentary democment has not made mistakes. I say particularly racy and the Westminster system upon which to the newer and younger members of this it is based. We take it for granted that we institution that the role of the parliamentarian, have had a change in government, that there the backbencher, is to try to ensure that, as far were no armed police on the streets, there was as possible, the government he or she supno military presence, there was an orderly ports does not make mistakes. transition of power and we have lots of new faces in the parliament. That does not happen That is an awe-inspiring task and, given the in many parts of the world. nature of our government process, I think it is true to say, regarding the endeavours that For my sins, I am a member of the Interare made from time to time by people who Parliamentary Union Committee on Human might disagree with government policy, that Rights. There are over 130 parliamentarians party discipline in our system is such that it in gaol as a result of military actions or is not always easy to speak out and disaptakeovers and they are there for no other prove of some aspects of policy. reason than the fact that they sought to carry important on an occasion like this to rememI think it is time we asked ourselves some",13,Setup
1,"Mr Speaker (Hon. R. G. Halverson Sentiments, I Have To Say That We All Owe A",,13,Governor General S Speech
2,To: Mr Cobb,They would like that in Burma.,13,Governor General S Speech
3,May It Please Your Excellency: Mr Holding,I am glad the honourable,13,Governor General S Speech
4,Mr Holding (Melbourne Ports) (9.31 International Tribunals As To The Fate Of Those,,13,Governor General S Speech
5,Out Their Democrat Mandate,mandates that Mr Filing-It is too restrictive.,13,Governor General S Speech
6,"We Take For Granted. Therefore, I Think It Is Mr Holding","That is right. Therefore,pretty important questions. I am concerned seek that from a senior public servant. In my about what I believe is the erosion of the introduction to the parliamentary scene in Westminster system in state parliaments and Victoria, that was very much part of the in this parliament. The thrust towards process. There was no difficulty about getting privatisation is, I believe, out of kilter and out the head of Treasury to speak to opposition of balance. I don't believe that there is any members or to a shadow minister-none at overwhelming evidence that privati sing an all. It was simply a question of ringing the area of government or handing it over to Premier or the Treasurer and asking and there private consultants ultimately does anything was never an occasion when that permission more for the government than that which has was not given. traditionally been performed by a public service. In Victoria that system has now changed because the public servant's position is no It is not an accident in Australia that, longer guaranteed. He is now under contract despite the crossfire of politics, we have never for three years-not even to his minister but had a serious allegation of corruption-some to the Premier. And his salary, of course, has have resigned because of wrong judgmentsgone up enormously, with very big retirement against any Commonwealth minister in carryallowances-you are looking at millions of ing out the responsibilities of his portfolio. dollars. The problem is not necessarily the There have been errors of judgment, yes, but emolument, which I think is excessive. The never an allegation of corruption. problem is that the public servant, as head, That is not an accident. That comes about can be sacked with three to four weeks notice. because, basically, the pressures on ministers That makes the concept of an independent and the range of information and material that public service a highly questionable exercise they have to deal with comes from a public indeed. I do not know that those systems service which, over years of tradition, has which are appropriate to a private company produced a process whereby, by the time the ought necessarily be the systems that apply to material comes onto the minister's desk, he or government administration. I think the role is she has had an opportunity to make decisions clearly different. on the best available material. The decision is his or hers. The minister will be argued with We also need to look at the social problems by public servants but there are only two that are occurring in many parts of Australkinds of ministers: those who run their public ia-not merely unemployment but the rift that servants and those who are run by them. is developing between rural Australia and the metropolitan areas. There was a time when no Independence is important. By the time a political party, state or federal, could go to government contract reaches the minister's the polls without real policies on decentralisadesk, it is not possible for him to say, 'You'd tion and the moving of resources from the better take it away because there happens to centres out to the bush. In fact, the Whitlam be a factory in my electorate which I think government had a very constructive policy but could do a bit better than this,' or 'I have the only thing, I think, that remains of that some friends you ought to go and talk to.' It now is the Albury-Wodonga complex. is just not on. Therefore, I am concerned at the thrust of what is taking place in my home We are seeing a cutback in services at state. One of the roles of the Public Service many levels to regional towns and cities, and is not just simply to advise the government that is a matter of concern. As a parliament, but to brief the opposition, which they used we have to ask ourselves whether banks have to do with great skill and discretion. Some a social responsibility or whether they are matters are properly formulated in government simply private agencies that set their own policy which they would not want to discuss. policy standards and can say, 'It's bad luck But if either the Leader of the Opposition or for a country town of 800 or I ,000 people but a parliamentarian needs advice on some we're going to have to close the bank and the aspect of government policy, he is entitled to small shopkeeper may have to drive an hour and a half to do his normal financial busiWe cannot continue with a situation where ness.' the Minister for Employment, Education, Training and Youth Affairs (Senator Is that an acceptable standard? Does this parliament simply say, 'We'll just simply let Vanstone) can contemplate a level of cuts and we are then told that universities need not it run. Banking is not really a question for plan. If what is being proposed-and one can this House'? The kinds of social infrastruconly speculate at this stage-by the minister tures of regional centres and country towns for education takes root, then you are taking are being destroyed. That has to be a question our tertiary system, and the capacity of that does not affect merely members repreyounger people from poorer families to enter senting rural constituencies; it affects all of tertiary institutions, back to pre-1948. There us. Therefore, I believe it is important that are many people in this House, there are more emphasis be given to these issues. many people now holding leading positions in It is not good enough for banks simply to Australian society, for no other reason than say, 'Our main concern is profit and the the fact that the Chifley government in 1948 bottom line. Running a small bank which brought in a scholarship system which opened services a country town of 800 people or up our tertiary institutions. There are people 1,000 people means that the turnover is not in this parliament who are beneficiaries of great enough. We'll take our banking services that. We simply cannot turn our backs on that out. Within five years they'll all be doing it situation and say that we hope the minister for electronically anyway.' education will get it right. We have to ask ourselves some serious It is the same with unemployment. We still questions. I do not really care whether the have a high rate of unemployment. I believe Treasurer ( Mr Costello) was bested by the there is a genuine concern and commitment state premiers or he believes he bested them. on the part of all members on both sides of I think that is irrelevant and, apart from that, the House that it must be brought down. But the ego of the Treasurer is such that he will you do not bring it down by cutting existing never concede the argument anyway. services which are working, and working It is important, however, that one look at well. In my electorate-and, I suspect, in the cutback in services in every state. In my many other electorates-there are structures own electorate, one has only to go to the which are training younger people and getting Alfred Hospital to see the cutback in services them jobs or training them to run small there and the problems that are facing our businesses. But the people running those health system. Our public transport system is services with very high success rates are now such that if you are getting on a train you putting everything on hold because they do need a pretty tight bladder these days because not know what their funding is going to be. the toilets are closed. Not many families will We have to ask ourselves: is this an effective now allow their daughters to travel on public level of management? transport, particularly train services, late at I am deeply concerned about a view that night. Frankly, that is a position which should seems to be emanating from members of the not be accepted by anybody in a parliaopposition whereby they see an attack on the mentary institution who realises that there are trade union movement as solving all of Auspeople who need those services. tralia's problems. We have seen that developEqually, at a time when our universities ment in Great Britain under the Thatcher ought to be gearing and planning for a fresh government, where they confronted an entireintake of young Australians, what has haply hostile trade union movement. I have heard pened? There is not one university in Victoria the argument, and I accept it, that many trade and, I suspect, every other state, where there unionists would have voted against the reare not meetings every day of academic staff election of the Keating government. Many to talk not about teaching or intakes but about unions and many unionists were unhappy survival. about the responsible leadership which tied the trade union movement into an accord. We ways by their culture and religious tradition. had a period of industrial peace. Union (Time expired) restricted while they saw company profits honourable member for Petrie, I remind the going through the roof. House that this is the honourable member's The trade union movement has been the first speech and I ask the House to extend to subject of unreasoned attack in this House. her the usual courtesies. Nobody will argue that the trade union moveMs GAMBARO (Petrie) (9.51 a.m.)Mr ment or business corporations are perfect; Speaker, may I extend to you and to your they are not. We know, for example, that in deputies my congratulations on your election my electorate, and in every metropolitan to the most esteemed position in this parliaelectorate in Melbourne that has any industrial ment. base, the Clothing Trade Union, due to lack of resources, has never been able to deal To take a first step in the Commonwealth effectively with the problems of backyard and parliament is one of inspiration and, faced illegal outwork. There are migrant women with the daunting size and magnitude of the being grossly exploited and underpaid by occasion, and with the support of the people private contractors who then take the garment of Petrie, family and friends, I stand here and compete with legitimate small businessdetermined and prepared for whatever challenmen running properly based manufacturing ges might lie ahead. I take my seat in this industry. They are having to compete with chamber with no foreseen expectations. I have these backyarders. That is not just a problem the strong belief in the mandate to be a true for the trade union movement; that is a representative and to give clear voice in the problem for government. Do we believe that decision making of this country. there is social progress involved in that gross My first speech marks more than one exploitation of women and children? achievement. I am the first female to repreEqually, I find it extraordinary that while sent the seat of Petrie, the first female of there is this emphasis on privatisation, in my Australian-Italian origin to take a seat in the own state we are talking about privati sing House, and it is indeed a privilege to take a levels of public administration while the seat in the first Howard government. mates of the Premier are given a private I wish to take this opportunity to thank monopoly to run a casino. I do not have any those from all walks of life who have been problem with casinos per se. Personally, I important in my journey to this present would like to see two or three smaller, bouposition. In particular, I wish to make mention tique style casinos like you see in Europe. I of the contributions by the Liberal Party team, would have no problem with them also being at both a state and a federal level, and the in Mildura, Bendigo or Ballarat. But I find it tireless efforts of my campaign director, BiII extraordinary that, without any kind of reLunney. His dedication and persistence in search into its social impact, we have this achieving the goal of success at the federal ever increasing structure which has a private election were enormous contributions to monopoly. So it is monopolies for mates on ensuring my seat here today. the one hand but privatisation of public assets I wish also to thank Terry Barlow for his on the other. support and years of dedication and service I find that very difficult to understand from and his wife Lois for the hundreds of cups of a state administration which says, 'We believe tea she made. I wish to thank Anne Hobbs, in competition and we believe in private who joined me in door knocking the electorenterprise.' I think it is time that we talked ate, and Geoff Green, who kept my finances about this because Australia is part of a in order throughout the campaign. Thank you capitalist system. I do not think that is going also to branch members across the electorate to change. So is America and so is Japan. for their tremendous efforts and support. I Each of those systems is constrained in many wish to thank the many people in the local",13,Governor General S Speech
