speakerGroups,speaker,theText,pageNumbers,title
207,Someone Who Constantly Raised Points Of Order Mr Mcarthur (Corangamite) (5.56,"and the other is the Shearers and Rural WorkPicketers say they are being financially supported ers Union run by Mr Steven Roach. The and their bills being paid by funds coming from shadow minister at the table, the honourable other unions collected at sites in Geelong and Melbourne. even know Mr Roach, because he is not too So-called responsible unions are helping their well liked by colleagues in the Labor Party. mates keep other workers out of a job and The AWU was the union covering this force a very reputable wool scouring company plant. Because Mr Stephen Roach wanted to to get into very serious financial difficulties get some members into his union, he brought because they have some internal problems. about a dispute in the plant. After that situaThis is the position here in Australia. It has tion arose, there was a secondary boycott. been brought about by attitudes generated by 100 years of industrial relations. It is a 'them We have had picketers on this plant for 17 and us' situation, where the unions have weeks. The shadow minister at the table undue power. (Time expired) would understand the impact of that. Workers have been unable to come or go. As a result, House adjourned at 6.00 p.m. half the work force has been sacked because it went on strike. The other half has been NOTICES picketing. Police have been providing protecThe following notices were given: tion at shift changes so that this company can continue to operate. Mr Beazley to move: This situation exists under the current That this House: industrial relations arrangements in Australia. (1) notes that when the Department of FinanceA rogue union seeking members has brought cos ted the Coalition's election commitments, about a secondary boycott. Transport operaas published in Meeting our commitments, a tors are afraid and unable to bring wool to the total shortfall of some $4 billion over three plant. I spoke to one personally. He said that years was identified; he cannot go there or send his drivers to that (2) notes that the Department of Finance analysis plant because they throw stones at the truck showed that there were clear and explicit and abuse the driver. He is no longer able to costing errors totalling $1.2 billion over three deliver wool to the plant. The plant is running years; at half production in fairly difficult financial (3) notes that a shortfall of some $1.4 billion was times because of two unions having an interidentified in Coalition commitments which nal dispute about the way in which they totalled $3.3 billion, but which were so lacking should represent the workers. in detail that policy experts in the Department of Finance were unable to supply accurate The secondary boycott will now no longer costings; operate. Those who wish to supply the firm with wool ready for scouring are unable to. (4) notes that further shortfalls totalling $1.3 billion were identified in commitments relating The company is working at half production. to the abolition of the Better Cities Program, In terms of the final result, Mr Robinson's car the Development Import Finance Facilitation has actually been torched. The article in the (DIFF) Scheme and the Better Practice Propaper states of Mr Robinson: gram, as well as redundancy costs associated with public service staff reductions; However, he said that such actions were not surprising bearing in mind the ongoing guerilla (5) calls on the Government to release to the attacks he alleged were being waged against the House and the people of Australia a full company by its employees. costing of the Coalition's election commitments; and He goes on to say later in the article: ""This is Australia and I believe our people have (6) calls on the Government to assure the House a right to work, but we can't defend ourselves that the plan to cut the Commonwealth Budget against illegal and irresponsible activities ... by $8 billion is not being pursued to finance the $4 billion black hole in the Coalition's This is the key point: election promises.",117,Adjournment To At Least Maintain The Level Of Common
208,"Member For Canberra ( Mr Mcmullan), Might","83, 84, 85, 86, 87, 88, 89, 90, 91, 92, 93, 94, 95, The following papers were deemed to have 96. been presented on 20 June 1996: Australian Bureau of Statistics Act-Australian Bureau of Statistics-Proposal 1995 No.4. MC 2476 MAIN COMMITTEE Thursday, 20 June 1996 Thursday, 20 June 1996 Consideration resumed from 30 May. Second Reading That the bill be now read a second time. The purpose of the Sydney 2000 Games (Indicia and Images) Protection Bill 1996 is to protect the Sydney 2000 Olympics and Paralympic Games licensing revenue from being undermined by unauthorised use of the games indicia and images by corporate competitors of the official games sponsors. The bill will achieve this by regulating the use for commercial purposes of the indicia and images associated with the games. The hosting of the Olympic Games in the year 2000 is an event of great significance to Australia. It provides a unique opportunity to demonstrate to the world this country's skills, talents, environment and achievements. Preparations for the games have proceeded in a very professional manner. This has been under the guidance of the Sydney Organising Committee for the Olympic Games, SOCOG, and with a high level of cooperation between the New South Wales state government and the Commonwealth government. The organisation of the games is an inspiring venture and the public interest in every aspect of the build-up is intense. The government will ensure that the cooperation which has marked the first two years of preparation for the games continues. We will continue to cooperate with SOCOG and other agencies and organisations involved in organising the games. This cooperation is to ensure that Australia's competitors in the games are given every opportunity to succeed and that the games will be an outstanding success. The task of organising the games is very large and complex. It is also very expensive. As the host nation for the year 2000 games, Australia will be expending considerable sums of money in the lead-up to the year 2000 for the construction of facilities and infrastructure, organisation and marketing. The cost of staging the Sydney 2000 Olympic and Paralympic Games is estimated to be around $2 billion. It will be shared between the organising committees, SOCOG, and the Sydney Paralympic Organising Committee, SPOC, the government of NSW and the Commonwealth government. The Commonwealth government's overall budgetary contribution to the games will exceed $400 million. Sources of revenue to meet the costs of the Sydney Games include the sale of television rights, ticket sales and the licensing of the right to use the games indicia and images. After television rights, licensing or sponsorship rights are the most important source of revenue to meet the costs of organising and staging the games. It is expected that the revenue raised from official sponsorships would need to be of the order of $700 million to meet the revenue budget of the games. The ability of SOCOG and SPOC to attract sponsors will depend to a large extent on the degree of exclusivity afforded to the licensed indicia and images. Official sponsors recognise the commercial value of associating themselves with events of the magnitude of the Olympic Games and are willing to pay considerable sums of money to use the words and symbols",118,Adjournment To At Least Maintain The Level Of Common
209,Mr Deputy Speaker ( Mr Nehl) Took The Chair At 10.00 A.m.,,120,Representatives Main Committee
210,Mr Moore (Ryan,"Minister for Industry, Science and Tourism) (10.00 a.m.)-I move:Thursday, 20 June 1996 MAIN COMMITTEE MC 2477 associated with the Olympics. In this regard, I note that SOCOG has announced that Telstra and IBM are to jointly contribute more than $100 million. They are the first members of Team Millennium, the corporate sponsorship program for the Sydney 2000 Games. The agreement was negotiated in anticipation of the strengthening of the legislative protection of intellectual property rights associated with the Sydney Games. Ambush marketing, however, has the capacity to seriously erode the official sponsorship revenue if not stopped or minimised. Ambush marketing is the unauthorised association of businesses with the marketing of an event, such as the Sydney Games, without paying for marketing rights. Typically it is the competitors of official sponsors of major sporting events that engage in these activities. Australian and overseas experience of recent Olympic Games has highlighted the threat that uncontrolled ambush marketing activities can pose to the value of exclusive licensing rights on Olympic Games symbols and indicia. Because ambush marketing can be very effective in creating a perception that the free-rider is in fact an official sponsor, it can dissuade official sponsors from continuing their association with the Olympics. It can also substantially reduce the amount that sponsors are prepared to pay for the rights. The preservation of sponsorship revenue is fundamental to achieving a sound financial outcome for the games thereby ensuring the least call on the public purse. The government of NSW has underwritten and bears full responsibility for any deficit between the games income and expenditure. The protection of official sponsorships against ambush marketing is therefore critical. The terms of the host city contract for the Sydney 2000 Olympics present obligations to the signatories for these matters. The host city, the New South Wales government, the Australian Olympic Committee and SOCOG are obliged to ensure that there are no other marketing programs in the host country which will have an impact on the games marketing program. The measures introduced to the chamber today are the result of a series of initiatives from the coalition parties. In 1994, the Liberal and National parties initiated an inquiry into the effects of ambush marketing on sponsorship revenue for the games. This followed early indications of serious problems for the organisers, the sponsors, and therefore ultimately the taxpayers. In February 1995 we announced we would support legislation to provide property rights in the words and expressions and names of bodies associated with the 2000 Games and the Paralympics. In March 1995 the Senate Standing Committee on Legal and Constitutional Affairs unanimously supported this position. The AOC, SOCOG and the previous New South Wales government had called for this legislation from the time of awarding of the games to Sydney. The previous government introduced the Sydney 2000 Games (Indicia and Images) Protection Bill 1995 into the Senate on 29 November 1995. It did not introduce it in time to make it law before the proroguing of parliament. This has created the very real risk of part of SOCOG's marketing revenue being siphoned off, with the cost being borne indirectly by Australian sport and the taxpayer. The bill I am now introducing is essentially the same as the bill introduced into the Senate last year with the exception of three minor amendments. The amendments clarify the legislation and provide additional protection in accordance with the organising committees' wishes. It gives additional protection to that provided by the Olympic Insignia Protection Act MC 2478 MAIN COMMITTEE Thursday, 20 June 1996 1987 which protects Olympic symbols such as the five rings and the designs of the Olympic flame and torch. That act was amended in 1994 to extend the protection available. The new legislation will protect the use of a wide range of words and expressions against ambush marketing during the lead up to and including the Sydney Games. It will pick up most of the recommendations made in March 1995 by the Senate Legal and Constitutional References Committee in its report entitled Cashing in on the Sydney Olympics: protecting the Sydney Olympic Games from ambush marketing. The bill will have a limited period of application and will cease to have effect after 31 December 2000. I will now briefly outline significant features of this legislation. The bill seeks to provide protection to indicia encompassing words and expressions associated with the Olympic and Paralympic Games. Words and phrases such as 'Olympic', 'Olympiad', 'Paralympic', 'Paralympiad', 'Sydney 2000', 'Sydney Games', 'Millennium Games', 'Team Millennium' and 'Summer Games' will be protected against unlicensed commercial use under this legislation. Particular word combinations will also be protected under this legislation. These include, for example, any combinations of the words 'Olympics', 'Olympian', 'Paralympics' and 'Paralympian' with words, numbers or phrases such as 'Sydney', '2000', 'Two Thousand', 'Games', 'Medals', 'Gold', 'Silver', 'Bronze', 'Green and Gold' and 'Sponsor'. In addition to protecting particular words, numbers and expressions, the bill also seeks to provide protection to certain images that in the circumstances of their presentation suggest, or are likely to suggest, a connection with the Sydney 2000 Olympic or Paralympic Games. These images may be either visual or aural representations. The rights in the above protected indicia and images vest with SOCOG and SPOc. These two bodies have the power to use and to license others to use the indicia and images identified in the legislation for commercial purposes. To constitute use for commercial purposes, the Sydney Games indicia or images must be applied to a person's goods or services for advertising or promotional purposes, or for enhancing the demand for the goods or services, and in a manner which would suggest that the person is or has been a sponsor of, or is or has been providing other support for, the Sydney 2000 Olympic or Paralympic Games or both. That is, a person who sells or promotes their goods or services by using any of the protected indicia or images in a way that would be reasonably understood as suggesting that the person is claiming sponsorship of, or to be providing other support for the games, would be using them for commercial purposes. In order to enable the public to be aware of the identity of those licensed to use the Sydney Games indicia and images, a register will be established and maintained by SOCOG. It will be made accessible to members of the public at its office in Sydney. The register will also be accessible throughout Australia at state offices of the Australian Industrial Property Organisation. An entry in the register will include details such as the name and principal place of business of the licensed user, the Sydney Games indicia and images that the licensed user may use, and the circumstances in which the indicia and images may be used. A person whose name is entered on the register is to be taken to be a licensed user of the Sydney Games indicia or images specified in that entry. A document certified by the chief executive officer of SOCOG is evidence that the particulars set out in the document are entered in the register. This bill, however, is not about placing an absolute fetter on any use of the protected Sydney Games indicia and images. The government recognises that the preservation of sponsorship revenue is essential to achieving a good budget outcome for the games. But the fundamental Thursday, 20 June 1996 MAIN COMMITTEE MC 2479 rights of the community to freedom of expression must be respected, particularly in relation to words that have passed into common usage. It must therefore be emphasised that restrictions on the usage of the Sydney Games indicia and images will apply only to unlicensed commercial use of the protected indicia and images. Moreover, it is made clear in the bill that the legislation is not intended to affect the working of many aspects of everyday business. It is recognised that some individuals and corporations already use the indicia prescribed in the legislation in conjunction with their goods and services. There are, for example, goods and services which either have the trademark 'Olympic' or include the word 'Olympic'-such as Olympic tyres and Olympic Airways. This legislation is not about stopping traders who have been using these indicia and images for years from continuing that use. The established rights of owners of registered trademarks or designs containing those indicia and images remain unaffected, so long as the trademarks or designs are not used in a way so as to imply a connection to the games. The use of the Sydney Games indicia or images solely for the purposes of providing information, or for the purposes of criticism or review, is not of itself prohibited. Examples of such provision of information include the reporting of news and presentation of current affairs, the factual description of goods or services provided by a business, such as stating that accommodation is available at a hotel that is located near the Olympic site or the factual statements by an athlete to promote their own achievements. Examples of criticism and review are those which are likely to appear in newspapers, magazines or similar periodicals, in a radio or television broadcast, or in a cinematographic film. The government recognises that the reasonable needs of sporting bodies in relation to fund raising for and promotion of their preparation of athletes and teams for the Sydney Olympic and Paralympic Games should be allowed to continue. Those reasonable needs could involve use of the Sydney Games indicia or images for the purposes of providing factual information. As I have just explained, the bill is not intended to affect this type of use. In the interests of clarity and certainty, the government believes it would be desirable for sporting bodies to negotiate memoranda of understanding with SOCOG to cover their proposed use of the Sydney Games indicia and images. The Australian Sports Commission has negotiated such an agreement. While strategies are being devised to ensure that new business opportunities will flow to all industries, including small and medium enterprises, the tourism industry in particular has the greatest contribution to make in securing and dispersing spin-off benefits from the games. It has therefore been a major concern that the legislation does not inhibit the capacity of tourism marketing bodies and individual firms to undertake advertising and promotional activities which complement the role of SOCOG and the Olympic bodies. The provision of the information clause, which I have just mentioned, accommodates tourism marketing. That is, tourism marketing involving the provision of information that is both generic tourism promotion by official marketing bodies and factual statements about products and services by individual firms, should not require SOCOG's approval. Those tourism businesses wishing to become directly associated with the games will need to apply to The bill provides various remedies to SOCOG, SPOC and licensed users to enforce their rights in relation to the Sydney Games indicia and images. Thus, where an unlicensed user uses Sydney Games indicia or images in contravention of the bill, SOCOG, SPOC or a relevant MC 2480 MAIN COMMITTEE Thursday, 20 June 1996 licensed user may bring an action against the unlicensed user. The remedies available under the bill include injunctions, damages and corrective advertising. However, in addition to those remedies, the courts have the discretion to provide remedies under any law (whether a law of the Commonwealth, a state or a territory) that confers any rights or powers on SOCOG, SPOC or a licensed user. Most notable in this regard are the remedies provided under the Trade Practices Act 1974 in relation to engaging in conduct that is misleading or deceptive. The bill also includes appropriate customs measures to limit the possibility of the importation of goods which seek to ambush the games marketing. The ongoing cost to the government of administering this legislation will be minimal. The Australian Customs Service will be able to carry out the measures of this legislation relating to the monitoring of imported goods at the barrier within their existing resources. It is likely that the increased security of the Olympic 2000 indicia and images will enhance SOCOG's and SPOC's capacity to ensure the financial viability of the 2000 Games through its marketing program. I believe that the bill introduces significant protection for the Sydney Games indicia and images. The protection provided by this bill will both complement and enhance the protective measures already in place under Australia's current intellectual property laws to ensure, to the extent possible, that a good budget outcome is achieved for the Sydney 2000 Games. I commend this bill to the House and present the explanatory memorandum to this bill. Tourism( Mr Moore) for reading the second reading speech again on the Sydney 2000 Games (Indicia and Images) Protection Bill 1996. BeforeI make some comments about that, Mr Deputy Speaker, I make a suggestion for you to take up with the Speaker. I should have made this suggestion previously. When the bill has already passed through the Senate, perhaps the opportunity could be pursued for second reading speeches to be incorporated in Hansard in the House of Representatives. It might save the honourable minister's time and those of us who are going to speak will know that the debate has already occurred in the other place. We can get hold of the legislation from there and prepare our response accordingly. convey his views to the Speaker. not oppose the Sydney 2000 Games (Indicia and Images) Protection Bill 1996. In fact, we wholeheartedly embrace it. As the honourable minister indicated, this particular bill with three minor changes in fact had been put before the parliament just before it was prorogued last year, and regrettably did not therefore receive passage. As a result, it has had to be put in again now. Clearly, because of all the reasons that the minister has espoused, it is a bill that should be supported. I do want to pick up on a couple of the points that are there, though, because I do think it is extremely important that we not understate one or two very significant matters associated with the year 2000 Olympics in Sydney. Very recently, I had the opportunity to visit the Homebush site. If members of this parliament get the opportunity to organise a visit to the Olympic site at Homebush, I commend the visit. It is extremely enlightening to see the work that has already taken place and that is ongoing. It is a real eye-opener to look at the plans that are in place and to look at the magnitude of the proposal which Australia was successful in obtaining.",120,Representatives Main Committee
211,Mr Martin (Cunningham) (10.17 A.m.),"I thank the Minister for Industry, Science and",124,Representatives Main Committee
212,Mr Deputy Speaker ( Mr Nehl),I thank the honourable member and I will certainly,124,Representatives Main Committee
