speakerGroups,speaker,theText,pageNumbers,title
151,Impression,Mr Reith-The rules on this are quite,83,Questions Without Notice Goes On Up At That End Of The House At All
152,Mr Speaker,Get onto the point of the where he has been misrepresented and then to,83,Questions Without Notice Goes On Up At That End Of The House At All
153,Mr Fitzgibbon,By selectively reading is just debating it.,83,Questions Without Notice Goes On Up At That End Of The House At All
154,Mr Speaker,He is using a statement as,83,Questions Without Notice Goes On Up At That End Of The House At All
155,Nothing Could Be Further From The Truth. Mr Allan Morris,I am quoting my,83,Questions Without Notice Goes On Up At That End Of The House At All
156,Mr Speaker,Thank you. Resume your,83,Questions Without Notice Goes On Up At That End Of The House At All
157,Mr Fitzgibbon,I haven't explained Mr SPEAKER-You are beginning to,83,Questions Without Notice Goes On Up At That End Of The House At All
158,Mr Speaker,You have. Resume your Mr ALLAN MORRIS-I am quoting my,83,Questions Without Notice Goes On Up At That End Of The House At All
159,Mr Fitzgibbon,"I assure you, Mr Education and Training had a room fuII of",83,Questions Without Notice Goes On Up At That End Of The House At All
160,Mr Speaker,Resume your seat. repair agent who employed people to repair,83,Questions Without Notice Goes On Up At That End Of The House At All
161,Mr Allan Morris (Newcastle) (3.17 Chairs,all through this DAS office. That,83,Questions Without Notice Goes On Up At That End Of The House At All
162,Mr Speaker,Do you claim to have,83,Questions Without Notice Goes On Up At That End Of The House At All
163,Mr Allan Morris,"Yes, Mr Speaker. Mr SPEAKER-I present the folIowing",83,Questions Without Notice Goes On Up At That End Of The House At All
164,Mr Speaker,Proceed. Auditor-General's audit report No. 30 of,83,Questions Without Notice Goes On Up At That End Of The House At All
165,Mr Allan Morris,"Mr Speaker, on mentation of competition in case manage",83,Questions Without Notice Goes On Up At That End Of The House At All
166,Office In Newcastle. Following Question Time Motion (By Mr Reith),by leave-agreed,83,Questions Without Notice Goes On Up At That End Of The House At All
167,"And Local, Which Means That All Our Local Mr Reith (Flinders","Leader of theDetails of the papers will be recorded in the Party; it is where John Howard fell apart in Votes and Proceedings and Hansard. his campaign to be Prime Minister in 1987. The schedule read as followsIn a letter from the minister for health on 21 February to the residents of his own electorate Australian Institute of Health and Welfare Act-Australian Institute of Health and Welhe said: fare-Report-AustraIia's health 1996. Present Medicare rebates will not be changed. Foreign Affairs, Defence and Trade-Joint StandHe went on to give this personal undertaking: ing Committee-Report-Visit of Defence Subcommittee to Exercise Kangaroo 95, 8-11 August The pharmaceutical benefits scheme, which subsi1995, September 1995-Government response. dises the cost of many vital drugs, will be retained. given by no less than the Prime Minister and Medicare the Minister for Health and Family Servicesfrom the honourable member for Dobell( Mr rebates. Those were the promises made before Lee) proposing that a definite matter of public the election. What has happened since? An importance be submitted to the House for article in the Daily Telegraph headed 'The $5 discussion, namely: Medi fee' says that the bulk-billing pledge is The widespread concern and confusion caused by in doubt over cost cuts. An article in the the government's failure to rule out cuts in Newcastle Herald of 23 April is headed Medicare rebates and the government's plans for 'Minister silent on Medicare'. That was when the wholesale transfer of health and aged care the minister for health refused to give his programs to the states. state colleagues an assurance that there would I call upon those members who approve of not be the introduction of a compUlsory the proposed discussion to rise in their places. patient fee for visits to the doctor. More than the number of members required An article in the Age of 17 June states by the standing orders having risen in their 'Medicare promise wavers'. That was in placesresponse to the minister's remarks recently on a few members of the government still in the Sun-Herald, under the headline 'Up up up' chamber today. How many will still have there was the very clear statement that the smiles on their faces come 20 August, when government intends to increase the cost of this government intends to cut the rebates visiting your doctor by $6 to $10. On the which are provided to Australians for their front page there is a photo of the Prime Medicare treatment? We will see how many Minister sipping chardonnay, just to make the of them have smiles on their faces when the point about the extent to which he is caring government introduces the legislation to cut about the promises he made on these issues the rebates which are paid to Australian before the election. families when they go to see their doctors. The reason that we are so determined to The reason we have every right to be upset keep this government honest on the promises is that before the election specific promises they made before the election is that the were given to the Australian people. The Prime Minister has set a very high standard Prime Minister( Mr Howard) promised to on these issues. We all remember during the retain Medicare. The Prime Minister promised last parliament he set a high personal standard to retain bulkbilling. The minister at the table, for people like the former minister for health. the Minister for Health and Family Services At that time he said the following things: (Dr Wooldridge), gave personal undertakings to the people who live in his electorate. I will We want to assert the very simple principle that truth is absolutequote from a letter sent to the residents of Box Hill South on 21 February. Box Hill is this was said by John Howard, the current a very famous place for the Australian Labor Prime Minister-",83,Questions Without Notice Goes On Up At That End Of The House At All
168,Mr Speaker,I have received a letter that there would be no cuts to Medicare,84,Matters Of Public Importance So They Were The Promises And Commitments
169,Mr Lee (Dobell) (3.21 P.m.),"There are the Face to Face program. In last Sunday'struth is supreme, truth is never disposable in ment, and the minister at the table in particunational political life. lar, have twisted and turned on these issues. So we make the simple point that if truth is We saw very early in the piece the minister absolute, if truth is supreme, if truth is not at the table meeting with the Australian disposable in national public life, then the Medical Association and floating a proposal minister for health cannot dispose of truth in with the Australian Medical Association to national public life in his role not just as the introduce a compulsory patient fee. We saw minister for health but as the member for in the Daily Telegraph under the headline Chisholm. He cannot simply dispose of the 'The $5 Medi fee' the following article: promises, the personal undertakings, which he Bulk-billing pledge in doubt over cost cuts. Patients gave to the residents of Box Hill when he would have to pay a fee of between $2 and $5 wrote to them promising that Medicare reevery time they see a doctor under a change to bates would not be cut. Medicare being considered by the Federal Government. Health Minister Michael Wooldridge met the No doubt in a few minutes the minister will AMA, radiologists and other doctors groups this come to the dispatch box and say that, no week and told them the payment was an option for matter what promises were made before the saving about $500 million. election, he and the Treasurer ( Mr Costello) have been shocked to discover that there is a So at the first meeting that the minister for much bigger deficit than the Liberal Party health has with the AMA he tells them that expected when they were making their promthis is an option to which he is giving serious ises throughout the election. consideration. But, within 24 hours, the Prime Minister jumped in. Actually, he sent his I think most Australians are becoming tired media adviser and press secretary to the press of governments claiming that, once they get gallery to try to talk the journalists out of elected and open the cupboard, shock and running this story. In fact, the Prime Minister horror, they find that the cupboard is bare and gave certain assurances to the journalists that they have to ditch all their election promises. the government would not be introducing that I think the Australian people should adopt this co-payment. It was run under the headline attitude: every time they hear a Liberal claim 'Medi retreat'. I quote from the Daily Telethat there is a much bigger deficit than they graph: expected, they should expect to hear another Liberal explaining and excusing why they are This move was a rebuff to the health minister, Dr Wooldridge, who told doctors last Wednesday that breaking the promises they made to the the co-payment was a serious option for saving Australian people. They will be using that and $500 million. other excuses to try to explain why they are undermining Medicare, why they are underHaving let the health minister go out and tell mining bulk-billing, why they are going to cut the AMA that this was a serious proposal, the the Medicare rebates, why they are going to Prime Minister pulls the rug out from under disrupt the pharmaceutical benefits scheme. him and says that no further consideration will be given to it. Yet, when the opposition The whole reason is based on this bogus raises the issue in the parliament to seek an cutback, this bogus deficit. We all know the assurance from the Prime Minister or the real reason why they are going through this minister that there will not be a compulsory process of cutting back government programs. patient fee for visits to the doctor, they refuse It is to pay for the $4 billion of unfunded to rule it out. When we ask them to give an election promises that John Howard and the assurance that the cost of pharmaceutical minister for health made at the last election. services will not be increased, as suggested in I think we all have to try to make sure that the Sunday Herald Sun under the headline everything is done to keep the minister for 'Bitter pill for the elderly', Gerard McManus health and the Prime Minister to the promises ran a story that suggested that the government they made before the last election. was considering a proposal and that the It has been quite interesting to watch the minister for health's own department and the way in which various members of the governDepartment of Finance were looking at increasing the cost of pharmaceuticals for Miss Jackie Kelly-Scaremongering! suggests that pensioners will have to pay $4 this is scaremongering. She might have a for each prescription, up from $2.50, while different point of view if she actually has to the general public will have to pay up to $20 fight a by-election in the electorate of Lindsay a script, up from the current $16.20. and try to sell cuts in Medicare rebates. We When we asked the minister to rule that know what you are really going to do come out, the minister refuses to do it, the Prime the budget on 20 August. It would be interestMinister refuses to do it. Is it any wonder that ing to have a referendum in Lindsay on we have concerns about what they might whether or not it is right for this Minister for really be up to? It is no secret as to what the Health and Family Services to cut the rebates Prime Minister's real views are on Medicare. for Medicare treatment. It will be interesting If you go back to the last occasion when John to see whether we get a referendum in LindHoward wanted to be the Prime Minister of say on whether the people of western Sydney Australia, he let us know his real views on want to pay more for their visits to the doctor. Medicare. I quote from what he said in 1986: Would you like us to have a referendum in Medicare has been an unmitigated disaster. Lindsay on that? I can tell you what the result That was in November 1986. That is what he would be: Ross Free would be elected with an really believes; not what he is saying now. overwhelming majority as the member for Lindsay. I can certainly tell you that we have Mr H-rdgr-ve-Ten years ago. very valid reasons to be concerned about what believe that Medicare has been an unmitigated people are who would be hardest hit with a disa-ter, because that is what the current reduction in Medicare rebatesPrime Minister was saying in 1986. Miss Jackie Kelly-The average family. Order! The member will address his remarks right-average families would be hardest hit through the chair. Members on my right will if Medicare rebates were cut. The elderly and be quiet. the chronically ill would also be badly hit. 'Last night the government should have taken proposals that are floating around at the a knife to the expensive failed Medicare moment. The Sun-Herald says that the system.' When he was the Leader of the minister has got a plan to cut Medicare Opposition, the now Prime Minister of Ausrebates for a visit to a GP by five per cent tralia was saying, 'You should take a knife to and to cut the rebates for visits to a specialist Medicare.' In June 1987 he sai<,i, 'We will by 10 per cent. Some people might think, 'A end bulk-billing which produces a scandalous five per cent reduction in the Medicare rebate wasof money.' He went on to say, 'As far for a visit to the GP is only a cut of $1.20.' as Medicare was concerned, we'll pull it right Most people in the gallery today would think apart.' Those are the real views of the Prime that, because their GP bulk-bills, they currentMinister on Medicare. He believes that bulkly see the GP for free and that, if they have billing is a scandalous waste of money and he got to pay $1.20, that is something they might wants to take a knife to Medicare. be able to afford. But what they do not Is it any wonder that we have got doubts understand is that doctors have made it clear about what this government really wants to in every survey that has been done that, if the do? That is why we are concerned that this rebate is reduced five per cent, from 85 per government is really about reducing the cent to 80 per cent--even if it is only $1.20Medicare rebates. It is an attempt by stealth the majority of GPs will no longer bulk-bill. to wind back bulk-billing. Eighty per cent of People in the gallery may not know that the doctors these days bulk-bill, particularly AMA's recommended fee for a visit to the GPsGP is $34. The reduction of $1.20 that the",84,Matters Of Public Importance So They Were The Promises And Commitments
170,Pensioners And General Patients. The Article Mr Lee,The member for Lindsay says,86,Matters Of Public Importance So They Were The Promises And Commitments
171,Mr Lee,Do you believe that? Do you you are up to. You can imagine who the,86,Matters Of Public Importance So They Were The Promises And Commitments
172,Mr Deputy Speaker ( Mr Nehl),Mr LEE-The member for Lindsay is,86,Matters Of Public Importance So They Were The Promises And Commitments
173,Mr Lee,"-In May 1987 he was saying, That is why we are so concerned about theminister is planning does not mean that you not have the cost of their pharmaceuticals will be paying $1.20 to see the GP-you will undermined by a wholesale transfer of these have to pay up to $34 when you see the GP. responsibilities to the states. You will get your rebate from Medicare, but Dr WOOLDRIDGE (Chisholm-Minister you will still be about $15 out of pocket. for Health and Family Services) (3.36 p.m.) Every time you or your child needs to see the What a curious debate. There are so many GP you will be up for $34 up-front instead of illogical inconsistencies in it that I do not being treated free of charge by being bulkknow quite where to start, but allow me to billed. Even after the Medicare rebate you have a go. will be $15 out of pocket. If the average person visits a doctor 10 times a year, that is Mr Stephen Smith-Start with your letter. quite a substantial impost on the average letter, and I table that letter. Given that it has Australian family. been mentioned so many times and given that it is such a good letter, I think it should be It is for these reasons, we believe, that any tabled so the House can have a look at it. cuts in the Medicare rebate will hit the elderminister to the promises that he made to the letter, and I stick by what I say to my conpeople in his electorate before the last elecstituents. In the end I will be judged by them tion. We are going to make sure that this on my performance as a minister and my minister is held accountable for the personal performance as a local member. Given the undertakings which he gave to the residents quality of the people you have been putting of Box Hill and to the other residents in his up against me for the last 10 years, I will electorate. If this minister has been rolled by keep winning my seat in spite of the best that the ERC and is forced to break his promise to you can do. I would like to say a few things the electors of Chisholm by cutting back the about what the shadow minister for health, the Medicare rebates, he will be placed in an honourable member for Dobell( Mr Lee), said untenable position. If this minister has been because the hypocrisy index in this place is rolled by the ERC and has to cut back getting a little bit high. Medicare rebates, he will be responsible for We will be judged at the end of three years breaking his promise to his own constituents. on the whole content of our health policy and This has happened before. When the former what we have been able to deliver. The member for Barton, Gary Punch, was placed shadow minister should not get too worked up in a similar position he resigned. He was a speculating about what might happen in the minister. He knew the honourable thing to do budget, because in the end this is all speculawhen he had to break his personal undertaktion. All that is coming from this side is what ings to his own electors. If, on 20 August, comes from the government before every this minister is responsible for any cutbacks budget: that is, we refuse to rule things in or in the Medicare rebates he will have broken out. There is nothing exceptional or unusual his undertaking. He will have broken the about this. In fact, before the last budget the pledge that he made with his own hand to the then Leader of the Government in the Senate electors of Box Hill South and the other and now shadow Treasurer, the honourable people who live in his electorate. On 20 member for Holt( Mr Gareth Evans), in August this minister will have to face up to response to a question in another place said: the decisions that are being made by the . . . to suggest that the government is going to ERC-of which he is a member-and we are introduce any new taxes ... is nothing more than determined to make sure that he is held budget speculation and obviously neither I nor anybody else is going to be in the business of accountable. We are determined to make sure confirming or denying any particular element of that the Australian people keep Medicare, do budgetary speculation, not because to do so would not have their Medicare rebates cut and do be to reveal anything about that particular proposal,",86,Matters Of Public Importance So They Were The Promises And Commitments
174,$150 For Every Member Of Every Family,Dr WOOLDRIDGE-The first thing is my,87,Matters Of Public Importance So They Were The Promises And Commitments
175,"Ly, The Chronically Ill And Young Families The Mr Lee",Do you stick by it?,87,Matters Of Public Importance So They Were The Promises And Commitments
