speakerGroups,speaker,theText,pageNumbers,title
94,Member For Canberra ( Mr Mcmullan) Just Beer And Convivial Company Has Been Men,"way which was nevertheless well intentioned but I know one thing's for sure-he hasn't and generally well received. got any teenage kids.' An example of his great concern for others Mick also had that extraordinary ability to was a phone call I received from him soon mix well at any level. He looked equally at after the last election in which he consoled home in a pub with the boys, in tough politime about the result of the election. It was cal meetings in the parliament or in the only in the course of that phone call that I company of the rich and powerful. But he learned that he was actually suffering from genuinely enjoyed the company of workingleukemia, yet he was ringing to console me. class people and identified very much with He bore this affliction, as has been mentioned, them. His career as a union official with the with great stoicism and, as it eventuated, AWU ensured this identification was turned misplaced optimism. But I was immensely to a dedication to assist the ordinary working impressed that even in these circumstances he people of Australia. I remember him saying still had this irrepressible good humour and to me when we were both ministers, 'What a he had me laughing despite the sadness of his thing to be-a working-class hero!' He meant news. that he would love to be one, but the irony of the situation was that to the many workers But he was no mere caring comedian, as who knew him that is already exactly what he has been said by others. Mick was a shrewd was. Although he enjoyed good food, good and canny politician and a great parliamentary company and the good life, he never forgot performer. He was a great party official, and his roots and he never forgot what he was in I do not need to elaborate on that. His quick politics to achieve. wit and great one-liners ensured that he As has been said by the member for Port excelled in parliamentary repartee and made Adelaide( Mr Sawford), it is a great tragedy him a formidable parliamentary opponent. He that Mick ended his parliamentary life and had that unique ability to make the person then had his mortal life ended far too soon. who was the subject of the mockery or the He was greatly missed as a parliamentary and ridicule laugh along with everyone else. I ministerial colleague when he resigned from could never understand why that was so, but parliament in 1988. He will be greatly missed perhaps this was because he always laughed as a friend and colleague now that he has at his own jokes. I must say that is a fairly gone to that great shearing shed in the sky. annoying trait in others, but in Mick somehow Finally, I express my very sincere condoit was a likeable trait. lences to his wife Mary, his family, his Despite some well publicised misjudgments children and his wider family. In their grief when he was a minister, for which he paid they at least have the satisfaction of knowing heavily, his political judgments were generally that his was a life that really mattered; that he very sound indeed. I regarded him as a great contributed greatly to the cause to which he source of political wisdom in the party and in was passionately devoted; that the deprivathe cabinet. In cabinet he had that great and tions and travails that they bore through his rare ability to puncture high flying rhetoric or absences and his involvement in political to get through turgid detail and bring the turmoil were not in vain; and that he will be discussion back to the coalface of political long and fondly remembered by the vast array reality. To give one instance of that, we were of people whose lives he touched and enhaving a discussion once about telecommuniriched in the course of his exceptional life. they had seen some reference in the press to p.m.)-I had a very special relationship with timed telephone calls. This started some Mick Young which arose out of some of the discussion on that subject and, as this was internal traumas in the Labor Party in Vicgoing on, Mick brought it back and virtually toria. If you want to have a fun time in ended the discussion by saying, 'Well, I politics, try having an exercise in federal dunno who it is who's promoting this stuff intervention when in fact at various levels of",63,Condolences More Than 60 Years Ago
95,Cations Policy And Somebody Mentioned That Mr Holding (Melbourne Ports) (8.12,"the party, at both a federal and a state level, Mick's humour, involving a story that I do you have got those who quite sincerely not think bears repeating in this House. believe that they had a role to preserve their view of political purity and that that was more Mick will not merely pass into the history important than winning elections. It came to of the Labor Party for the job that he did for a head in my state, and when Mick had to this parliament and the organisational strucplay the very active role that he did as the ture but he will become part of the legend of then federal secretary his presence was absothe Labor Party. He served it in an adminislutely vital and necessary and his political trative capacity. He was a great parliamentarjudgments were inevitably sound. Ian. His capacity on the floor of this HouseI do not think I have seen equalled on many For those of us who were political leaders occasions. He was devoted to his electorate at that time, people who one had grown up and the people he represented. I believe that with in the party, friends of long standing, he has already not only become a Labor hero became political enemies overnight. That and regarded as one of the architects of a certainly affected me, it affected the federal different sort of Labor Party but also become leader, but at no stage did it affect Mick a part of the folklore of a party which was Young. In all of that heady exercise I never born out of adversity and which represents the heard, at any level, a criticism of Mick. If you hopes and aspirations of working people. He want to get into that sort of dogfight, having was always an outstanding exponent in the someone like Mick, with his good sense of good times and the hard times for that comhumour and his capacity to relate to people, munity. is essential. That exercise changed the course of Labor history. His early death has affected all of us. I The stories about Mick are legendary. My express sympathy to his family and his wife, other colleagues have mentioned his sense of Mary. As a family they had to bear not just humour. I have seen him turn debates both the tribulations of the last few months but within the party and within this parliament Mick's constant absence from home as he with a wisecrack made at the right time. For carried out his range of duties. There is those new members of this parliament, there nobody on this side of the House that does was a time when the then opposition decided not owe Mick and his family, who made that the most important thing in Australia was sacrifices by virtue of his responsibilities, a for the chair from Old Parliament House to be debt of gratitude. His name will always have brought in here, even if it involved knocking a very honoured place not merely amongst half the building down. I recommend the those who knew him but, when the history of reading of that Hansard to anyone who was this party is written, for future generations of here, because by the time Mick had finished, Australians. without reflecting in any way upon the opposition, the opposition was laughing at itself. to join with others in this House in this I have never seen that before, having spent condolence motion for Mick. Unlike the over 30 years in two parliaments. It was a others who have spoken, I did not serve in unique capacity, the like of which I hope we this parliament with Mick. I came here in will see again, although I doubt it. 1990, two years after he prematurely left it-a When Mick got into his rhyming slang with point that has been made by many on this Ben Humphreys and Eric Walsh, one someside. My association with him spans more how felt a little left out of the conversation. than a quarter of a century and it goes back . You might as well have been sitting down to the time that many have mentioned-his with several Tibetan monks speaking Tibetan. involvement in the intervention of the VictoriHis capacity not merely to tell a story but to an branch of the Labor Party, a time when I invent a story, particularly if it involved a was starting my career in the labour moveclose political associate, was legendary. On ment with the then Storemen and Packers more than one occasion I was the victim of Union.",64,Condolences More Than 60 Years Ago
96,Mr Crean (Hotham) (8.17 P.m.),"I wantMick was one of the architects of the tellingly able to ask in the context of an intervention but, more than that, he had to industrial relations dispute was: what sort of implement it. That is a very difficult double ptQc.e-ures were being used to move wool task. It means courage as well as foresight in bales labelled 'Nareen' so that they could be the initial stages. Mick had both. The reality supplied to the Soviet economy? It was a very is that, as a result of those sorts of decisions, telling point because the Prime Minister of what happened in Victoria in 1970 was the the day hated it and, from memory, he precursor to the modem Labor Party-a Labor stormed out. I think this highlighted what Party that not only won office with the became something of a slogan in the 1970sWhitlam government in 1972 but also domithat is, that Malcolm's wool was keeping the nated federal politics and lot of state politiCs Russians warm. At the same time he 'was for the following 20 years. In that sense, we actively oot there advocating a boycott by our owe a lot to Mick. athletes. Mick struggled in the early days in Victoria. Much haS been spoken about Mick's role in It was a very lonely experience. That fact has the shadow ministry and ministry. When I been referred to. I remember back to 1971, was the president of the, trade union movewhen we found those restaurants that Barry ment, Mick was always the first Labor politiJones said he took time finding in Melbourne. cian to ring about ACro congresses and ask We went up to Carlton one night. Iwru; about the sessions and the order. He was fortunate enough to be invited, along with Bill always there. He believed very much in Landeryou, who was the secretary of my keeping in touch with the trade union moveunion. Tom Bums and Mick Young were ment. He was always welcomed to the ACTU there. As we walked back to the Trades congresses and, between 'congresses, to the Hall-and members in Victoria might rememJohn Curtin Hotel, where we were still meetber the small church that was beside it. -..we ing on regular occasions. noticed there was banner up out the front Many things have been said about what which read, 'If you died tomorrow, where Mick achieved as a minister. I simply want to would you spend eternity?' When Tom Borns repeat those points which I think have been read this to Mick, Mick said, 'Where else but fundamental to the strengthening of our Victoria.' It is an indication that, even in the democratic values in this country: the declaradifficult periods, the times when he felt lonely 'tion of political donations; the legislation and wondered where it was all going to end :-mbodied 'in the one-vote, one-value system; because he had many enemies and few 'redistributions-we are not too happy about friends, he could still see the humour and; iti them when they affect us in oUl: own seats, a self-effacing way, relate it back to his own but the principle is very important and it was circumstance. Mick more than others who pursued that-and People have spoken here today of the way the public funding of election campaigns. in which he was able to use wit to great effect Mick joined a proud group of very effective in the parliament. I recall the way he used his immigration ministers, many of them on our serious side to great effect in the parliament side of the parliament. I just want to underpin and how he showed some degree of duplicity the point that whatever Mick put his mind in the parliament. Again, this was at the and commitment to he did exceedingly well. expense of the then Prime Minister, Malcolm Port Adelaide was always a great place to Fraser. visit. I remember many occasions at the Colac This was in 1980 and my union had been Hotel and at the Port Adelaide Football Club. involved and still was involved in a very The communitY spirit that has been referred lengthy wool dispute. Wool was not moving. to in Port, Adelaide and through the football It also happened to be at the time when club, was carried on. I must say that pleased Malcolm Fraser was urging a boycott of the me because it was the first club to offer job Moscow Olympics because of the invasion opportunities, through its contacts, to uneminto Afghanistan. The question that Mick was ployed people in Port Adelaide, where there was a very high level of youth unemployhis grand daughter. My sincere condolences ment. to all of you. I know you do miss him; that They are the sorts of legacies Mick left at came through at the funeral service. But we the local and community level. He was very miss him, too, and our thoughts are with you. senting people in this place or being in the p.m.)Mr Speaker, may I congratulate you industrial and political wings, involved in on your election to your high office. organisational aspects of the party. He did it I would like to convey to Mary, Janine, better than anyone I know. Mick did epitoMichael, Duane and Isabella from my family mise the bridge between old Labor and our comfort and deepest sympathy at your modern Labor. He had the common touch but family loss. I offer it from each member of he was never out of touch. Indeed, Mick's my family to each member of your family and astuteness and ability to be so perceptive to the young brothers who reminded me very about issues that he could give that wise much of my brothers. counsel that all of us have experienced at some stage was due to the fact that he had a Those of us here appreciate the support great political antenna. He kept in touch, he from your family-without your knowledge knocked around, he knew what the issues at times-in the taking of Mick's time over were and he had a great gut instinct. the years and I appreciate the comradeship I received from him. Mick was a true son of He was also a tremendous social leveller. It the labour movement who never forgot his did not matter what group you went into, roots. He remained accessible to all throughMick was always comfortable and made out his career, no matter the stations he came others comfortable in that environment. He to occupy at various stages of that career. did all this with warmth, compassion and Like the member for Gellibrand ( Mr Willis), dedication. He was much loved and admired I first met him in a preselection. Would you not only in this House but also in the wider believe it was the Shortland preselection? community . We will miss him because he did My condolences to Mary, his wife of 36 do you? I happen to remember it, too. At one years, who was a constant source of support stage during that preselection he had the and companionship. He spoke often of you, temerity to accuse me of not being able to Mary, when he was away with us on his own. count. He told me to go away and learn how My condolences to Michael. Many people to count. That was when we first met. In the have talked about the service at St Mary's 25 years that followed he always remained as Cathedral. I think one of the moving speeches approachable, easygoing and humorous as was made by Michael, who referred to his when I first met him. That was one of his father as his best mate. I think the circumgreat qualities. stances where sons and fathers can also be He was ever ready to help out with a Labor best mates is a great tribute to the relationship cause or a community cause. His sense of and the family commitment. humour was spontaneous, sparkling and, at My condolences to Janine, who got Mick times, destructive. It did not carry malice or out to a Rolling Stones concert that I also ill will, as previous speakers have said. I often happened to be at. I could not quite work out thought of him and Fred Daly as a kind of whether it was your role, Janine, in keeping twins-not in age, but in style, behaviour and him in touch with the community or whether presentation. They both used similar weapons he was just reliving the past. I think that, and both had a similar spontaneity and a when he was talking to me, it was the latter. pleasure in company. We had a great night. Earlier, the member for Melbourne Ports My condolences to Duane and to Isabella. ( Mr Holding) mentioned Mick's great presWe all know how much Mick adored Isabella, ence of mind. I remember an occasion down",65,Condolences More Than 60 Years Ago
97,"Much A Grassroots Politician, Whether Repre",Mr PETER MORRIS (Shortland) (8.27,67,Condolences More Than 60 Years Ago
98,"Leave Us, Not Just Here But In Life, Far Too Mr Mcmullan",We all remember that.,67,Condolences More Than 60 Years Ago
