speakerGroups,speaker,theText,pageNumbers,title
71,Mr Warwick Smith (Bass,"Minister a world record for the distance covered in 24off the bike,' but by then the crowd realised He later went on to become Australia's what was happening and resumed its chant, High Commissioner to Malta. In his maiden spurring him on for another 79 minutes and speech to parliament, Sir Hubert said: another world record. I know that just as the juvenile admires the champion, walks like him, acts like him and follows his The performance was so impressive that in example, so we in our malleable condition will be a poll of more than 1Y2 million people confashioned by the example set us by the older ducted by a Paris newspaper Sir Hubert was members of this House. voted the most popular sportsman in Europe. The press decided that the reasons for this If today' s aspiring athletes can take on board were his courage, loyalty and perfect smile. just a sample of Sir Hubert's qualities, this There was, of course, no question as to his country's sporting heritage is certainly asloyalty and courage but what the French did sured. As a nation we are undoubtedly poorer not realise was that his perpetual smile for the passing of Sir Hubert Opperman. Like stemmed from the fact that at the time he did all of my colleagues, I extend my condolences not understand a word they spoke. to his family. On his return to Australia, Oppy continued pleased to speak in support of this condolence on his recording breaking spree, including the motion for Sir Hubert Opperman. I came to phenomenal achievement in 1932 of cycling know Oppy during the last seven years of his some 1,380 kilometres in 24 hours-a record life. He was one of my constituents. He lived which still stands today. In fact, that record in Salford Park Retirement Village, which is stands as one of the three greatest single in the centre of my electorate. As I got to performances by Australian sportsmen, along know him over those years the full measure with Sir Donald Bradman's 309 test runs in of the man gradually became apparent, but a day and Herb Elliott's 1,500 metre victory not from him because he was a very modest at the 1960 Rome Olympics. man. It was others who had to tell the stories. Through this part of his career, Sir Hubert As the Prime Minister( Mr Howard) alluded was one of a handful of Australian sporting to earlier, for those of us who attended the heroes to lift the spirit of the nation during memorial service in Melbourne last week the the Great Depression. Along with Sir Donald full sweep of his life, that incredible life, such Bradman, Walter Lindrum and Phar Lap, Sir as him being a sportsman, all his records and Hubert gave Australians suffering through the time he held those records, was gradually those hard times something to cheer about. revealed in the eUlogies. What grabs me, and There was certainly plenty of cheering in indeed so many people, when you look back 1932 when he was the first person to ride a at those years is that he rode pretty antiquated bicycle across the newly opened Sydney equipment compared with what we ride today. Harbour Bridge. Amazingly, Oppy was also They did not have the gear then that we have the first person to ride a bicycle through the today. It was really old, heavy gear. When he Sydney Harbour Tunnel after it was opened went to Europe he did not have the latest gear in 1992. that all the Europeans had. He was riding Sir Hubert's racing career ended with the very backward equipment by comparison but outbreak of World War II, in which he served he still won all those races and set all those as a Flight Lieutenant in the RAAF. Personirecords. fying the adage that 'old cyclists never die, He served in the air force and did his duty they just change gears', Sir Hubert turned his to his country. We have heard in some detail many abilities to the political arena in 1949, about his record as a parliamentarian and as winning the Victorian seat of Corio. His a minister-defeating a minister to win the political career carried numerous highlights, seat that had never been a Liberal seat; including positions as Government Whip, defeating Bob Hawke and holding on to it for Minister for Shipping and Transport and all of those years; an immigration pO,licy that Minister for Immigration. was enlightened before its time; a successful",47,Condolences More Than 60 Years Ago
72,Mr Nugent (Aston) (6.46 P.m.),"I amdiplomat; and a friend and servant of the The overwhelming thing about Oppy was blind, amongst many others. That was perhaps that, in spite of fame and the power and particularly appropriate living in the seat of trappings of office and his achievements, he Aston, which is named after Tilly Aston, who was a man of outstanding humility. He was a was the founder of the braille library of man of humanitarian values. He always Victoria. considered others before himself. I think I will not go into all the details that have another of the outstanding features of his life been covered by many of the previous speakthat he would wish to have remembered was ers. I will mention some of my personal the constant support, wherever he went, of his experiences. I knew Oppy during the last wife, Lady Mavys. seven years of his life. I first met him in 1989 He was one of life's true gentlemen. He when I was the candidate for Aston and died on his exercise bike, with the cycle clips aspiring to defeat the incumbent Labor memstill around his legs and the famous beret on ber. I went along to Salford Park to address one side. He was found like that by staff. We 200 or 300 residents at a meetinghave lost a truly great Australian. I offer my Aston, and Salford Park in particular, to Lady Order! The honourable member will resume his seat. I would like to draw standing order Mavys, his son, Ian, and all of his family. who just stood. I commend it to your study. calling the next speaker, I commend standing order 57 to the attention of the honourable member for Wentworth. or 300 residents of Salford Park and thought senior looking gentleman stood up at the back p.m.)-I would like to be associated with the and gave me a fairly thorough work-out Prime Minister( Mr Howard), the member for during question time. After it was all over, Corio( Mr O'Connor) and other members of and having survived this fairly rigorous workthis House in the condolence motion for Sir out from this very knowledgeable and intelliHubert Opperman. As other members have gent gentleman at the back, I inquired of the said, he died in his 92nd year still riding his management who the person was. It turned bike-a remarkable achievement in itself. I out to be Oppy. I said to somebody, 'I draw the attention of the House to the fact thought he was supposed to be on my side.' that when Oppy became a member in 1949 it That did not stop him giving me a good was the beginning of the long 23 years of work-out. Having done that, I went up and Menzies government. There was great exciteintroduced myself and that is when I got to ment in Geelong, I well recall-I was a know him: young boy-when Oppy beat J.J. Dedman by 235 votes, a very narrow margin. All of us Oppy not only appeared with his wife, Lady who had some interest in politics were very Mavys, in some of my publicity brochures, excited that the Menzies government had been but also sent me 'Oppygrams' on a regular swept to power and that this famous cyclist basis. For those who do not know, he was was now our local member, though by a very well known for his 'Oppygrams' which were narrow margin. little pieces of paper usually of a pro forma nature but handwritten. During the subsequent The other interesting aspect of that election campaigns and other campaigns these would was that Oppy beat a minister in the Chifley arrive at regular intervals. They would give government, the Hon. J.J. Dedman, who was me encouragement, tell me what I had done quite famous for cutting the tails off shirts as wrong or tell me what to do differently. Even a wartime measure. That was the highlight of the odd donation came along as well. He was the campaign-and the member for Corio as delighted as we all were when we subseshould draw Mr Scholes's attention to that. quently won the next election. I have met him Oppy was always a very strong member, on a number of occasions since then. being a holder of a marginal seat. As a young",48,Condolences More Than 60 Years Ago
73,Mr Deputy Speaker ( Mr Nehl),condolences and those of all residents of,49,Condolences More Than 60 Years Ago
74,57 To The Attention Of The Honourable Member Mr Deputy Speaker,Order! Before,49,Condolences More Than 60 Years Ago
75,Mr Nugenti Was Addressing The 200,,49,Condolences More Than 60 Years Ago
76,I Was Going Fairly Well Until A Somewhat Mr Mcarthur (Corangamite) (6.52,"man, .J had a number of conversations with That the House expresses its deep regr him about how you hold a marginal seat as a death, on Monday, 8 April 199 minister of the Crown. He always returned Michael (Mick) Jerome Young, AO, House of Representatives for the Division of Pon: home: on Saturday mornings to talk to conAdelaide, South Australia, from 1974 to 1988;. stituents. He said to me, 'You must always Special Minister of State in 1983 and from 19-4 t_Q have a feel for what they are saying here in 1987; Minister for Immigration and --c Affa(rs Geelong because, if you don't attend here on in 1987; Minister for Immigration, Local Governa regular basis, you won't have the seat the ment and Ethnic Affairs and Minister Assi-ting dinext time around.' That aspiring politician Prime Minister for Multicultural Affairs frQm 1-7: to 1988; Leader of the House in 1983. -d ·(from Western Australia, Bob Hawke, came 1984 to 1988; and Vice-President of the Exe-tiV.over in 1963, I think, to give it a run. Oppy Council in 1983 and from 1987 to 1988, places ·.dealt with him in a strong fashion. It took a record its appreciation of his long and meritorioulong while for that young Bob Hawke to public service, and tenders its profound sympathY return to the political fray. to his family in their bereavement. ·· Other members have made strong refere:qce I am very pleased to acknowledge tp!;C-c to Oppy's prowess as a cyclist. All of us in ence in the public gallery of Mary 'Y-mng and. the Geelong region and in Victoria know Mick' s daughter and son, l:!Dd other mem-t-: Oppy to be a true hero in terms of those of his family. .· ' remarkable performances in France and As somebody who entered parliament as a Europe and, as the member for Corio said, in political opponent of Mick Young's, ...nd on that famous W armambool to Melbourne bike the same day, I want to say a few w-rds. race where Oppy dominated in terms of about him. We were both elected to fastest time. I do not think he won it but three parliament midway through the thtW""ye.ai times he was the fastest time bolder. That, in period of the Whitlam era---on 18 May 1974terms of cycling, is a very high honour, apart Mick Young and I, over the time that l>Oth of from his international reputation. us were in parliament, said some very v-go;; As other members have said, he was a very rous and, on occasions, quite insulting tbi-gs· human local member. As a young man, I had about each other. He would not retrospectiyea number of conversations with him about ly, in any sense, thank me for engaging in politics, the way he saw the Australian parliaany humbug or for denying that that hapment and how he saw the handling of a very pened. We were vigorous opponents. marginal seat. He was a great Australian in He was a great debater; he was a very the tradition of all those sportsmen mentioned. humorous man; he had a capacity to deliver This House is indeed honoured to have a political ridicule in a fashion I do not think I person of that calibre as a minister. He was have encountered in its blunt form from an international sportsman and a wonderful anybody else in .the time. I have been in the human being. I join with others in this condoparliament. He did have what was characterlence motion and pass on my sympathies to istically often described-whether accurately Lady Mavys Opperman and her son. I also or not-as that earthy, Irish-Australian wit. convey the condolences of former member He did it very well, he did it with style and Tony Street. I know he was very close to Sir he did it very effectively for his party. Hubert. The electorates of Corio and Corangamite are the Geelong electorates and there has There is no doubt that Mick Young was a been a long association over many years. I very distinguished son of the Australian Labor join with other members in this very historic Party. It is appropriate on occasions like this condolence motion to a great Australian. that the lengthier, more personal eulogies be delivered by the party colleagues of the Question resolved in the affirmative, honperson who is being remembered. But it is ourable members standing in their places. also appropriate to acknowledge the tradition Young, Hon. Michael Jerome, AO of your political opponents. Minister) (6.57 p.m.)-1 move: the Labor Party's working-class tradition. He",49,Condolences More Than 60 Years Ago
77,Mr Howard (Bennelong,"Prime Mick Young came right out of the centre ofdid reflect, when he came to parliament, that union that he represented and from which he it had been a long journey from the shearing came. shed to the House of Representatives. He Mick Young was a devoted member of a tV""ified the Irish-Catholic tradition of the tight-knit family. He brought to public life a .' ..stralian Labor Party, a tradition that, I note, tradition which many of us look upon with is now perhaps not quite as powerful as it respect-even though we may not always once was. As I listened to some of the names agree with its expression. I certainly respected being read out today, I began to imagine that him as a tough opponent. He dished a lot out the Irish-Catholic tradition is at least in part to me. I dished some back. Neither of us ever being transplanted to the Liberal Party of apologised, and that is the nature of politics. Australia and to the National Party of Australia. On an occasion such as this I would like to record my sympathy to Mary and to Mick's On occasions like this, one ought to reflect two children. I was privileged to attend the upon the traditions that have made up the two memorial requiem at St Mary's Cathedral in great sides of Australian politics. I have no Sydney. It was a marvellous tribute. Many doubt, as a student of politics, that Mick moving speeches were delivered, not least the Young has been one of the most significant speech delivered by the Leader of the Opposifigures of the past generation in the Australian tion ( Mr Beazley). It was a cavalcade of labour movement. There is little doubt that Labor Party tradition and history over the past the Labor Party would not have won in 1972 20 or 30 years. Mary, to you and your chilwithout Mick Young's organising skills. As dren and to others in the chamber and in the somebody who, in the concluding months of gallery who knew Mick best and were associthe coalition's reign in office in 1972, was ated with him over many years, I extend the aware of the seeming inevitability that change sympathy of my government and of my party was going to occur, I respected Mick Young's and express our respects for the contribution organising ability. There is no doubt that he made to the cause in which he so passionwithout him, as Gough Whitlam has acknowately believed. ledged, the Labor Party would not have come By way of anticipatory apology I must say to power in 1972. that, quite properly, this condolence motion Mick Young understood the need for strong will go on for some time as there are many party organisations. He understood the need people, particularly on the Labor Party side of to change the nature of the Labor Party in the House, who will want to pay their reVictoria. He had a capacity to work very spects to Mick. However, I have a commiteffectively with his federa}. parliamentary ment to some guests. I hope that none of leader. He was, as I recall, the first national those opposite and none of Mick's family will secretary of the Australian Labor Party. As regard it as in any way disrespectful of me if somebody who has, on occasions, witnessed I am not personally present when the debate the vagaries of federalism inside my own concludes. party, I can understand that it took quite an On behalf of the Liberal Party of Australia effort to bring about the establishment of a and of the government, I extend our sympathy federal Labor Party secretariat under Mick to Mick's family and I record my respect for Young. the contribution he made to the robust politiOn behalf of the government, I say to cal tradition which he so effectively espoused Mick's family and to all his friends in the over such a long period of time. cant mark on the political life of this country Opposition) (7.04 p.m.)-I thank the Prime over the last 20 or 30 years. He was a likeMinister( Mr Howard) for his remarks and for able, robust and direct character. He had great the spirit in which he delivered them. I am passions. He had a great passion for his party. sure his views will be appreciated by all who He had a great passion for the Port Adelaide knew and loved Mick on this side of the football team. He had a great passion for the House and much further afield. It is an indica-",50,Condolences More Than 60 Years Ago
