speakerGroups,speaker,theText,pageNumbers,title
241,Mr Tanner,"My question is to the important illness in Australia.diabetes and its complications can be preventof these women go on to develop diabetes in ed. later life. There is not a single Chinese endoThe honourable member asked about the crinologist in Australia and there are very few government's response to it and I am pleased Chinese or Chinese speaking diabetes educato announce that, yesterday, we announced tors. So we are working with the Australian $6.2 million worth of funding for projects Chinese Medical Association and the Australspecifically in response to the national stratian Chinese Health Foundation to try to look egy report. I hope that this will not be the end at the causes and prevention. In the end, a lot of it. I hope in the future that people in state, of what I do as health minister is about territory and Commonwealth governments treating illness once it happens. This is a great working together through the structure I have message of hope for people with diabetes that set up will be able to do much more. Briefly, we are going to try to prevent illness as well. there are four areas in particular that I find Waterfront very exciting and that I think give great hope The first is that we are going to run, Prime Minister. Does the Prime Minister recall saying on the Today show on 29 Januthrough the auspices of Diabetes Australia, a very substantial community awareness camary: paign because one of the biggest problems is All we have done is to change the law to allow ... that half the people with diabetes in Australia new stevedores to come into the business ... and as far as I am concerned ... they will have the full do not know that they have it. If they do not support and understanding of my government. know they have it, they cannot get proper treatment and we cannot prevent the compliCan the Prime Minister confirm that, accordcations. ing to the 7 July cabinet document: The second thing is that studies in Sweden There are no signs that any substantial new stevehave shown that almost half the blindness due dores will emerge to break the unions' monopoly supply of labour. The only prospective new operato diabetes can be prevented. There are tor, aaeL ... has done a deal with the MUA. 44,000 people, as of today, whose sight is in imminent danger from diabetes and the Does this not show that, as far as you are prospect of preventing half that blindness is concerned, achieving an efficient waterfront something that any health minister should be runs a very distant second to your ultimate very excited about. goal of destroying the Martime Union of Australia? The third thing we are doing is establishing had that in Australia. The Australian Institute rather than a question but I will still be very of Health and Welfare is going to auspice this happy to answer. Of course I recall saying register, which will put all new cases of that and I made that remark in the context of insulin dependent diabetes on the register. It the very welcome intervention into the stevewill be for the very long term; it should still doring business of the farmers. I congratulate be operating in 50 years time. It will give us the National Farmers Federation on the a capacity with research that we have never courage, foresight and tenacity that the Nabeen able to have before; it is something we tional Farmers Federation displayed in getting have only been able to dream of. involved in this matter. Finally, there is a particular problem with While we are talking about work forces, I diabetes in the Asian, particularly South-East want to take a moment, as this is a very Asian, communities. In my home town of general question, to thank and congratulate Melbourne, one in every three cases of the non-union staff of the farmers stevedoring gestational diabetes in a hospital is of a group who had the courage to work on the Chinese or a Vietnamese woman. The Chiwaterfront after 7 April, because those parnese and Vietnamese communities have very ticular men and women were subjected to an high rates of gestational diabetes. Two-thirds enormous amount of intimidation and abuse.",83,ANZAC Tradition Products Beefeater Barbecues Are Now Taking
242,For People With Diabetes. Mr Tanner,My question is again to the,84,ANZAC Tradition Products Beefeater Barbecues Are Now Taking
243,A National Diabetes Register. We Have Never Mr Howard,"That is a commentaryMr Lee interjectinghateful language about his fellow Australians. generates. You have this visceral tribal hatred Mr Lee interjectingbelonging to a union. Dobell. alone, and that is the determination of the sUbjected to intimidation and abuse by memmonopoly on the Australian waterfront. That bers of the Maritime Union of Australia but is what it is about. If there were no MUA insulted and reviled by members of the monopoly, we would have had higher producAustralian Labor Party. tivity levels. If there had been higher producof order. It was a very specific questionmonopoly, it would not have been necessary for a newly elected coalition government to specific answer. government as far as OOCL was concerned. make no apology at all for the activist strategy we followed because that strategy was sition does not have to make a speech on it. Australian waterfront. It was against the off the mark as far as that is concerned. against the background of years and years of sition will resume his seat. ground of the former government having spent $425 million for no measurable imas to whether I recall an interview I gave on background of people who had wanted to the Today show, yes, I do recall it. I spoke remain out of the trade union being physically then against the background of what the bullied and mentally intimidated into joining farmers had done. TodayI speak in praise of the MUA. what the farmers did in this dispute and I speak in praise of what their employees did. Mr O'Connor-Voluntary unionism! played in trying to involve themselvesCorio! Mr Robert Brown-Scabs. for Charlton, mutters the normal Labor mantra reality was that, unless you agreed to belong of 'scab'. to a union, you did not last on the Australian Mr Robert Brown-That is what they waterfront. are-scabs. Mr Robert Brown-Yes, and in the coaland you are entitled to be described as the infamous adjournment speech. nod and you think it is right, and by your nodded assent you validate the very argument Mr Robert Brown-They are scabs, and that we have been using. When the chips they always will be scabs. were down on this issue, you in the Australfor Charlton, as he knows, but I am very lined up with the thugs who wanted compulsorry that he used such vile, unforgiving, sory unionism, you lined up with the men and",84,ANZAC Tradition Products Beefeater Barbecues Are Now Taking
244,Mr Speaker,The member for Dobell! That is basically what this kind of dispute,85,ANZAC Tradition Products Beefeater Barbecues Are Now Taking
245,Mr Howard,And if everof anybody who wants to work without,85,ANZAC Tradition Products Beefeater Barbecues Are Now Taking
246,Mr Speaker,I warn the member for This issue is about one thing and one thing,85,ANZAC Tradition Products Beefeater Barbecues Are Now Taking
247,Mr Howard,They were not only Maritime Union of Australia to maintain a,85,ANZAC Tradition Products Beefeater Barbecues Are Now Taking
248,Mr Beazley,"Mr Speaker, I raise a point tivity . levels and there had been no MUA",85,ANZAC Tradition Products Beefeater Barbecues Are Now Taking
249,Mr Howard,AndI am giving a very embark upon an activist reform strategy.,85,ANZAC Tradition Products Beefeater Barbecues Are Now Taking
250,Mr Beazley,relating to the position of the I say again on behalf of the government: I,85,ANZAC Tradition Products Beefeater Barbecues Are Now Taking
251,Mr Speaker,The Leader of the Oppodesigned to boost the productivity of the,85,ANZAC Tradition Products Beefeater Barbecues Are Now Taking
252,Mr Beazley,The Prime Minister is way background of years and years of rorts. It was,85,ANZAC Tradition Products Beefeater Barbecues Are Now Taking
253,Mr Speaker,The Leader of the Oppolow productivity. It was against the back,85,ANZAC Tradition Products Beefeater Barbecues Are Now Taking
254,Mr Howard,To the specific question provement in productivity. It was against the,85,ANZAC Tradition Products Beefeater Barbecues Are Now Taking
255,I Thank Them For The Courage That They Dis,Mr SPEAKER-I warn the member for,85,ANZAC Tradition Products Beefeater Barbecues Are Now Taking
256,Mr Howard,Voluntary unionism was,85,ANZAC Tradition Products Beefeater Barbecues Are Now Taking
257,Mr Howard,"My friend, the member a myth on the Australian waterfront. The",85,ANZAC Tradition Products Beefeater Barbecues Are Now Taking
258,Mr Howard,Apparently you are a scab mines too.,85,ANZAC Tradition Products Beefeater Barbecues Are Now Taking
259,Member For Charlton Described Them In His Mr Howard,"Yes, that is right. You",85,ANZAC Tradition Products Beefeater Barbecues Are Now Taking
260,Mr Howard,"I rather like the member Ian Labor Party lined up with the rorters, youwomen on the Australian waterfront who government was that it did nothing in this wanted to preserve the stranglehold. area to assist indigenous Australians gain the I will ever remain proud of the fact that my opportunities that they wanted. It was not government, with the help of the National interested in results; it was interested in Farmers Federation, was determined to bring throwing money at programs which did not about reform in accordance with the laws of work. There has been a record number of Australia. But reform we were determined to 5,000 traineeship commencements for inbring about, because we believe it is in the digenous Australians in the year up to the end long-term interests of the Australian comof May. These figures exceed last year's munity to have a reformed and more competirecord levels. It is worth comparing this with tive Australian waterfront. Labor's last year, 1995, when there were only 1,321 indigenous trainees. Apprenticeships This government is taking practical measto the Minister for Employment, Education, interested in results. I had the great pleasure Training and Youth Affairs. Can the minister two weeks ago to be present at a graduation inform the Houseceremony at Notre Dame University in outrageous? I have not got it out yet. diploma courses. Many of these indigenous Australians were from remote communities. Paul! faction of meeting with representatives from honourable member for Hinkler might address Schools-people who have been empowered his question. by educational choice-who spoke to me with the House of the progress in the field of new are making in remote communities to assist apprenticeships? Furthermore, what opportunitheir students. ties are there for indigenous Australians in In recent months the government has education and training? announced $35 million for a range of practiHinkler for his question. I acknowledge the tralians get educational opportunities, includfact that he has been a tremendous supporter ing school buses to bring students to school, of young apprentices in his electorate and has houses to attract teachers and projects to been very active in that regard. The reinforce literacy outcomes. government's aim has been to put in place a not going directly from school to universityI am very pleased to be able to tell the is not interested because he is covering up 13 House that there have been record numbers of years of failure and humbug in this area and new traineeships over the year to 1 June. this government has put in place practical Some 49,320 young Australians have entered measures. The failure of the Leader of the these new traineeships-14 per cent up on last Opposition unfortunately gave many Australyear. One of the most encouraging features of ians the impression that nothing was being these figures is that a very significant number achieved in this area. WhatI am showing is of these new apprenticeships have gone to that we are achieving practical results. The indigenous young people. I think one of the member for Oxley apparently believes that most tragic failures of the previous Labor nothing practical has been achieved.",85,ANZAC Tradition Products Beefeater Barbecues Are Now Taking
261,Mr Neville,My question is addressed ures to help indigenous Australians. We are,86,ANZAC Tradition Products Beefeater Barbecues Are Now Taking
262,Mr Rocher,This is outrageous! Broome where 27 indigenous students gradu,86,ANZAC Tradition Products Beefeater Barbecues Are Now Taking
263,Mr Neville,How can you say it is ated with certificates for teaching from their,86,ANZAC Tradition Products Beefeater Barbecues Are Now Taking
264,Mr Rocher,"Three questions in a week, While in Broome, I also had the great satis",86,ANZAC Tradition Products Beefeater Barbecues Are Now Taking
265,Mr Speaker,I would suggest the the Aboriginal Independent Communities,86,ANZAC Tradition Products Beefeater Barbecues Are Now Taking
266,Mr Neville,Can the minister inform enormous pride about the progress that they,86,ANZAC Tradition Products Beefeater Barbecues Are Now Taking
267,Dr Kemp,I thank the member for cal measures to help young indigenous Aus,86,ANZAC Tradition Products Beefeater Barbecues Are Now Taking
268,Range Of Practical Policies To Assist Particu,Mr Beazley-Table the speech!,86,ANZAC Tradition Products Beefeater Barbecues Are Now Taking
269,Larly The 70 Per Cent Of Young People Who Are Mr Howard,You are not interested in it.,86,ANZAC Tradition Products Beefeater Barbecues Are Now Taking
270,The Young People Neglected By Labor. Dr Kemp,"The Leader of the OppositionGovernment members-Where is she? my cabinet colleagues and think of the nuWhere is she? merous discussions we had about this issue, again; another absence from the House. She more united determination to achieve an is not interested in these important national objective that was good for Australia than this issues and she apparently does not support one. Of course we authorised whatever was these special measures to help indigenous necessary. Of course, we did! CanI say that Australians. the policy of the government was to achieve reform of the Australian waterfront, and the preferences! discuss issues with players, and of course to will remain silent. always consistent with the laws of Australia. human dignity and to the right to opportuniaddressed to the Minister for Veterans' Afties in this society. This government has been fairs. A number of young veterans in my elecprepared, by its focus on results, by its action, torate of Paterson have approached me seekby its positive policies, to give indigenous ing assistance to obtain civilian employment. Australians the opportunities that they were Minister, what hope does the government denied for ]3 years and to put in place poliprovide for veterans in this situation and to cies that will work. others who may be experiencing difficulties Our message to the Australian people is continuing in their current employment? past under the previous government, with a ledge the member for Paterson and the tireless focus on results-empowering indigenous work that he does for his veterans community Australians who want to take charge of their in the seat of Paterson. own lives and their own opportunitiesMI' Melham-He is Paterson's curse! results can be achieved and we will work with them to achieve those results in a united MI' SPEAKER-The member for Banks Australian community. has been warned. I suggest he remain silent. members of this House that the government Prime Minister. Prime Minister, can you seen service for their country and who have confirm that the waterfront strategy which you had difficulty finding civilian employment or discussed in early July 1997 involved 'signifiwho are having difficulty remaining in emcant public expenditure'? Can you confirm ployment. The government recognises the that the discussion included a proposal for unique nature of the training of those who 'the formation of a Cabinet sub-committee of have served this country, particularly those Messrs Reith, Sharp, Fahey and Costello to who have served in a war zone, and the effect authorise the necessary expenditures to it does have on many of these people, both achieve the Government's waterfront reform psychologically and physically. Through my objectives'? Prime Minister, was that commitdepartment, we have introduced a vocational tee established and, if so, what expenditures rehabilitation scheme and I want to reassure on the waterfront has it approved? all members of the House-and the member been saying all day, and that is that my because he has a very large population of government was determined to reform the veterans in his own community, particularly Australian waterfront. It was a whole of Vietnam veterans; I think there are over 270 government commitment and, as I gaze upon Vietnam veterans currently receiving assist-",86,ANZAC Tradition Products Beefeater Barbecues Are Now Taking
271,Dr Kemp,Where is she? She is not here I cannot think of an issue where there was a,87,ANZAC Tradition Products Beefeater Barbecues Are Now Taking
272,Mr Melham,"Well, don't give her your policy was to talk to, to listen to, and to",87,ANZAC Tradition Products Beefeater Barbecues Are Now Taking
273,Mr Speaker,The member for Banks provide whatever assistance was appropriate,87,ANZAC Tradition Products Beefeater Barbecues Are Now Taking
274,Dr Kemp,Indigenous Australians have Veterans: Employment,87,ANZAC Tradition Products Beefeater Barbecues Are Now Taking
275,Equal Rights With Every Other Australian To Mr Bob Baldwin,My qucstion is,87,ANZAC Tradition Products Beefeater Barbecues Are Now Taking
276,This: That While There Has Been Waste In The Mr Bruce Scott,I want to acknow,87,ANZAC Tradition Products Beefeater Barbecues Are Now Taking
277,Waterfront Mr Bruce Scott,I want to assure all,87,ANZAC Tradition Products Beefeater Barbecues Are Now Taking
278,Mr Mcmullan,My question is to the does provide assistance to those who have,87,ANZAC Tradition Products Beefeater Barbecues Are Now Taking
279,Mr Howard,"This confirms what I have for PatersonI know is most interested in this,ance in his electorate from my departmentWaterfront going to be forced on any veteran and I want to the Prime Minister. Can the Prime Minister to reassure members of the House of that confirm that the 7 July waterfront strategy point. cabinet paper recommended that he meet with What those veterans get is a personally the CEOs of P&O, who were resisting his tailored rehabilitation service to assist them strategy and Patrickthe fonn of professional advice to make sure that they are getting the right advice to MI' BEAZLEY-It says it in your document'to convey the government's intentions remain in that work, but also, importantly, if they have had trouble-particularly those to pursue the activist strategy outlined in the younger veterans with entitlements-they cabinet paper'? Prime Minister, three weeks know that when they are on this scheme those before Stephen Webster was given 'a special entitlements are legislated and will not be job for Mr Howard', five months before taken away from them. I think that has been Dubai, six months before Webb Dock and a major barrier for many younger veterans nine months before the Patrick sackings, were who feel that the entitlements that they have, you given your own special job-namely, to should they enter the work force, may be lean on P&O and give Chris Corrigan the revisited by my department. Let me assure green light for industrial aggression? entitlements will not be taken away while theory. are entitlements that they are entitled to while tion right? You should have let Hotham ask The scheme has been running for about six it. Kim, you got it wrong; he should have months now. Whilst the numbers who have asked it. in work are only modest, there are many more ing. It does deserve the support of all members of the House on both sides that we bers of the parliament. resume some silence so that we can all hear the Prime Minister. scheme coming from the younger veterans simply this: that naturally, as Prime Minister particularly, we now will be contracting that and somebody who is interested in waterfront service out through the Commonwealth reform, I met the chief executive of the rehabilitation scheme. That means it will be stevedoring company-and do not hold me to able to bring professional advice and profesthis; I will have to check my records; I think sional services to veterans right across AusI had a discussion with Lord Sterling, who is tralia. the Chairman of P&O, when I was in LondonI just want to say to those veterans who in the middle of last yearsee a need to seek that professional advice test match? compulsory. I am certainly looking forward to ham. being in the electorate of the member for a subject that will be dear to many of his meetings with Mr Hine. From recollection--",87,ANZAC Tradition Products Beefeater Barbecues Are Now Taking
280,That This Scheme Is Entirely Voluntary. It Is Not Mr Beazley,My question is addressed,88,ANZAC Tradition Products Beefeater Barbecues Are Now Taking
281,Either To Remain In Work Or To Find Work In Mr Tuckey,How do you know that?,88,ANZAC Tradition Products Beefeater Barbecues Are Now Taking
282,The Civilian Work Force. The Assistance Is In Mr Downer,How do you know?,88,ANZAC Tradition Products Beefeater Barbecues Are Now Taking
283,Them And Members Of This House That Those Mr Howard,This is an interesting,88,ANZAC Tradition Products Beefeater Barbecues Are Now Taking
284,They Are On This Rehabilitation Scheme. They Opposition Members Interjecting,,88,ANZAC Tradition Products Beefeater Barbecues Are Now Taking
285,They Under This Scheme. Mr Howard,Didn't you get the ques,88,ANZAC Tradition Products Beefeater Barbecues Are Now Taking
286,Been Through The Process And Are Actually Now Honourable Members Interjecting,,88,ANZAC Tradition Products Beefeater Barbecues Are Now Taking
287,Coming Forward. And That Is Very Encourag,Mr SPEAKER-I would suggest to mem,88,ANZAC Tradition Products Beefeater Barbecues Are Now Taking
288,Because Of The Level Of Interest In The Mr Howard,The situation is this,88,ANZAC Tradition Products Beefeater Barbecues Are Now Taking
289,Choose To Take Up This Scheme Because They Mr Martin,Was that on the way to the,88,ANZAC Tradition Products Beefeater Barbecues Are Now Taking
290,That They Will Be Able To Get It. It Is Not Mr Speaker,The member for Cunning,88,ANZAC Tradition Products Beefeater Barbecues Are Now Taking
291,Paterson Next Week Where I Know This Will Be Mr How Ard,I have had a number of,88,ANZAC Tradition Products Beefeater Barbecues Are Now Taking
292,Constituents' Hearts. Mr Martin,"At the test match?ham will remain silent. know what it is like. They know what the Mr Corrigan; I would have met him in a know what the problems of lack of reliability social environment on one or two occasions. are. It is further evidence of the need for reform, but it is also welcome evidence of the Opposition members-Oh! support for reform. As David Edwards, who conspiratorial. It is well known that the The survey found that nearly three-quarters of pofederal politician that Mr Corrigan has had users at the Port of Melbourne supported moves to the closest association with over the years in introduce greater competition to stevedoring this place is Paul Keating. I may well have services such as that initiated by the National met-and I would have to check my diariesFarmers Federation. other representatives of stevedoring comIt was then said: panies, as I have met representatives of the trade union movement. So what? It would be The clear message is that the majority of port users want, need and support waterfront reform, and will a very strange Prime Minister who did not continue to do so should the current dispute meet the chief executives of large companies; escalate. Port users are conscious that continuing the fact that he meets them hardly represents unrest will cost them money. However, the survey a conspiracy. I remain defiantly proud of what shows that most are prepared to weather these costs my government has done to achieve reform of in order to realise longer term benefits. the Australian waterfront. I believe that it was My message for all those people who signed being pursued in the interests of the Australup to that proposition is that this government Ian community. is prepared to stick at this issue to see genuine waterfront reform. Waterfront to the Minister for Workplace Relations and view that it is not just the users of the waterSmall Business. Minister, are you aware of front who support reform; I actuaHy think any research which further supports the need there are a lot of rank and file MUA members for reform of Australia's waterfront? Minister, who also believe that it is time that some of if so, what is the government's response to these issues were addressed. I have absolutely this research? no doubt that there are very large numbers of rank and file MUA members who would like member for the question. package. I am told that, when Mick O'Leary Mr Martin Ferguson-You will be doing went down to East Swanston dock the other a paper on prison reform soon. day, he got up in front of the crowd and he to undertake real reform.' And he went esting survey put out by the Victorian Emimplemented for real reform on the waterployers Chamber of Commerce and Industry front, like contracting outthis week onMr Martin Ferguson-What about prison pened. reform? will remain silent. strates graphically is that there is very wide own version and table it. waterfront reform amongst the users of the you.",88,ANZAC Tradition Products Beefeater Barbecues Are Now Taking
