speakerGroups,speaker,theText,pageNumbers,title
58,Mr Quick (Franklin) (12.29 P.m.),"It is asking the Minister for Aboriginal and TorresSenator Herron says later on: process on the significance of cultural heriWe have a process for accreditation of minimum tage. This bill in my mind does not provide standards ... for indigenous involvement in decision makPartial accreditation applies where a state or ing on significance and threat. The proposed territory regime does not cover all categories director of indigenous heritage must regard covered in the minimum standards-for example, indigenous people as the primary source of if it does not cover objects or the reporting of information on these matters, but there is no indigenous human remains-and accreditation requirement in this act that the director be decisions will be subject to disallowance by parliament in any case. The minister may withdraw indigenous and no structure for involving accreditation if state or territory legislation changes indigenous people in the decision making and consequently fails to meet the minimum process. In my mind, this Office of Indigenstandards. ous Heritage is a far cry from the recommenWe then have a quote from Mr John Van dation by Justice Evatt that Aboriginal heriBeurden, from the Office of Indigenous tage committees be set up in this country. Affairs: Another area of concern for me revolves In tenus of the level of minimum standards, we had around the definition of 'areas and objects to to pitch them at a level where we felt they would be protected'. This bill adopts the definition provide for the essentials of what was required in heritage regimes but without tying it down to the used in the current act regarding areas and extent that it would be difficult for states to adapt objects which are of particular significance in their laws to their own conditions and also to other accordance with indigenous tradition. The laws they might have which might connect with recommendation by Justice Evatt to adopt a those laws. That is why they are not quite in the new approach based on an assessment of the detail that some people might like. Obviously, in degree and intensity of belief of Aboriginal administering the act, the minister will have discretion in tenus of what he approves and what people concerning the area or object involved he does not, and parliament can disallow any seems, in my mind, far better. The focus on decision to accredit if they feel it is inadequate. tradition has been maintained, despite its I then stated: tendency to exclude areas and objects that are of significance for historical considerations. There is this contentious thing about minimum Experience under the current act indicates that standards. Why can't we raise the minimum to the highest rather than the minimum down to the it is necessary to further define 'traditions' in average? the bill to ensure that it is an evolving thing that changes over time. Senator Herron said in response: We are putting a very high level of minimum There are some positive aspects of the bill standards that need to be accepted by the states and which address problems experienced under the territories before they are accredited. If they do not 'current act and make for better processes. reach those, they are not accredited and it stays These beneficial changes include the separawith the Commonwealth. tion of decision making on significance and word ... focus on resolution through negotiation and Mr Van Beurden-I guess we did not think mediation, which I think is a very important about that public perception aspect when we first drafted the act . . . issue, stronger protection for culturally sensitive information, the provision for acceptance Commonwealth standard rather thanunder accredited state regimes, legislative Senator Herron-I accept that. clarification of substantive and procedural those fears and say, 'The Commonwealth legislaapplications, provision for the minister to tion is the standard ... delegate the power to make interim and Senator Herron-That is certainly the intention. emergency declarations, the provision for the My concerns are as well with the lack of making of such declarations while state or indigenous control in the decision making territory processes are being pursued, and",44,Aboriginal And Torres Strait Trary To The Recommendations Of The Evatt Islander Heritage Protection Report And The Report Of The Minority In The
59,Mr Quick,"So is 'minimum' perhaps the right threat from decisions on protection, stronger",45,Chairman Maybe They Should Be Called Of Findings Flowing From Acceptable Processes
60,Mr Quick,"Perhaps we can allay a lot of requirements in relation to reports prepared onfin,ally a requirement for state processes to be I have followed this debate very closely. As exhausted before Commonwealth consider a member of this place I thought that that was ation, emphasising the role of the Commonwhat I should do and in the end make up my wealth as an optiot;l of last resort. mind about how I should vote. Now, as a But these beneficial changes pale into leader of a minor party in this place, that is insignificance in the scenario provided by this the responsibility I have. Indeed, I am finding bill, where the states are easily and quickly the privilege I now have is not to do as I did accredited and the Commonwealth withdraws for so many years-come in here and sit with from involvement in virtually all cases except members on one side or the other, depending those few that are perceived as having nationon what had been decided, often without even al significance. knowing what I was doing. I have thought about these issues, I have listened to the p.m.)-I am pleased to make a short contributhat, on this occasion, I will support the tion in this debate on the Aboriginal and opposition in voting against this legislation. Torres Strait Islander Heritage Protection BillI want to say very briefly why I am going to 1998. I understand the government wants to do that. stop the debate at a particular point in time. I must say that I do not feel particularly As I said, I listened to all contributions. I constrained by those arrangements. One of the listened to the contribution of the member for government whips asked me if I was going to Kalgoorlie ( Mr Campbell). I do not agree speak. for five minutes. I am taking an opporwith what he had to say, although I admire tunity to make a contribution in a debate that the conviction with which he says it and the I believe is very important in Australia, and logic that he expresses. I can only assume, I will not be intimidated by arrangements that because the government has only participated have been put in place. As far as I am conin this debate with two speakers-neither of cerned this parliament, of which I am a them terribly convincing, having listened to member, gives me the opportunity to come in them-that the government agrees with the here and speak on issues such as this which member for Kalgoorlie's view. The member are important. I refuse now, in my new role, for Riverina( Mr Hicks), who was in here a to play the games that are set up between the moment ago, said 'Hear, hear' at the end of government and, to some extent, the Labor the member for Kalgoorlie's contribution. I Party. I am prepared to cooperate as far as I happen to regard the member for Riverina as can but I reserve my right to speak. In fact, a very decent man, but it really concerns me this is the way this place should be conthat he could say 'Hear, hear' at the end of ducted, in my view. If there is a debate going the member for Kalgoorlie's contribution. I on here and members want to come and am sorry about that. There must be something contribute to it, they should surely be able to I am missing. The member for Riverina did come in and take part. not speak in the debate but he apparently point of order. I think this is wide ranging Kalgoorlie said. and getting away from the debate. I ask you to draw him back to the debate. I think the request of the opposition spokesman on Aboriginal affairs, the member for Reid)-I have been listening to the member. aside and given further consideration is, in the He should be addressing the question before circumstances, a very reasonable request. The the House and confining his remarks to that. way the debate has unfolded and the contribumaking what is quite obviously an introducsome fundamental concerns. If the governtory comment about why I am speaking in the ment takes the view, and it apparently does, debate, and I do not care to be interrupted in that the matter will be sorted out in the that way. Senate, then it further makes the point of how",45,Chairman Maybe They Should Be Called Of Findings Flowing From Acceptable Processes
61,Mr Bradford (Mcpherson) (12.37 Contributions And I Have Come To The View,,46,Chairman Maybe They Should Be Called Of Findings Flowing From Acceptable Processes
62,Mr Marek,"Mr Deputy Speaker, I raise a agreed with everything that the member for",46,Chairman Maybe They Should Be Called Of Findings Flowing From Acceptable Processes
63,"Mr Deputy Speaker (Hon. N.b. Banks ( Mr Melham), For This Matter To Be Put",,46,Chairman Maybe They Should Be Called Of Findings Flowing From Acceptable Processes
64,Mr Bradford,"I understand that. I was tions made by Labor Party members underlineinadequate this House of Representatives is in as I have done-re-read it and try to underdealing with important matters. I do not think, stand it. But I need to say, in the context of in the context of what is happening in our this debate, which is about Aboriginal affairs, nation at the moment with the whole scenario that I do not believe that all of the member of reconciliation, that there is any more for Oxley's supporters are deranged. She important matter that we ought to be considermade that point and I think she is quite right. ing. Yet it seems to me that the government But they are deluded. Many of them are wants to push this bill through, with some thoroughly decent people. Many of them are amendments which we are not aware of at my constituents and they are entitled to their this point in time, and then ultimately sort the views. But we who have different views have matter out in the Senate. I, as a member of a responsibility to counter the member for this House, the people's House, do not regard Oxley's views in these particular areas. I saw that as a satisfactory way to proceed at all. yesterday a strong attempt to do that on This is important legislation because it deals behalf of the government, but as one who has with the protection of Australia's indigenous attempted to invite the Prime Minister to do heritage. I happen to regard that as important. that much earlier I am disappointed that he chose not to do so. I regard it as important for a lot of the reasons that have already been stated in the Perhaps what is happening is a process we debate, but if for no other reason, if you have to go through as a nation, but I must say wanted to get to the bottom line, than that that that particular party, ironically named heritage is important to us as a nation and it One Nation, is sowing the seeds of fear, is valuable as far as our tourism industry is hatred, division and mistrust. Those seeds will concerned. Those points have already been grow as they are nurtured, and I know that made. there is plenty of fertile ground out there for them to do so. I wonder where the member for Oxley (Ms Hanson) is at this moment and whether she is Just very briefly, in finishing off-in an in Canberra. She might be in her office attempt to enter into the spirit of some arlistening. I hope so because she has, I now rangements that have been made here-I will find, a deep interest in indigenous affairs. Her quote the Council for Aboriginal Reconcilispeech in the appropriation debate on Tuesday ation on the legislation before us. I note that night, which I have read and re-read, was yet my running mate for the Senate in Queensanother low point in the standard of debate in land is a member of that particular council, this place. I am not sure whether it was she and I am speaking, of course, of Kerry Blackor the speech that she made that was deman. The Council for Aboriginal Reconciliscribed by the Prime Minister( Mr Howard) ation said: as 'deranged'. That may not have been my A united Australia which respects this land of ours choice of word-I just looked it up in the values the Aboriginal and Torres Strait Islander dictionary and found that it meant 'insane'heritage and provides justice and equity for all. but certainly in that speech her ravings about This debate is in that broader context of the the prospect of the establishment of independreconciliation processes going on. ent race based states in Australia were quite that is to be signed in 2004. I would have very specifically to cultural and indigenous thought there was plenty of time between now heritage, but the broader context in which this and 2004 to understand what that particular debate is occurring in our nation at this time treaty, which I had not heard of before, was is the process of reconciliation, and I can only all about. assume-and agree with some of the Labor She talks in that speech about the disinteParty members who have spoken-that the gration of our nation. What utter rubbish that government have simply got it wrong again. is when you read the speech carefully and do The spirit of what they are attempting to do-",46,Chairman Maybe They Should Be Called Of Findings Flowing From Acceptable Processes
65,"Incredible. Apparently, From Trying To Make Mr Cadman","No, it is not; it is culture.",47,Chairman Maybe They Should Be Called Of Findings Flowing From Acceptable Processes
66,"Sense Of Her Speech, It Is Based On Some Treaty Mr Bradford","Of course it is relatedlet alone the technical problems which have McPherson will be given an opportunity to been adequately pointed to by a number of speak in the consideration in detail stage. members-and the timing are absolutely wrong. Hence my support for the member for Dr WOOLDRIDGE (Chisholm-Minister Banks when he suggests that it would be for Health and Family Services) (12.49 better to put the bill aside for further conp.m.)-in reply-I would like to thank honsideration to be given to it. ourable members for their contribution to this debate on the Aboriginal and Torres Strait The Evatt report and the subsequent parliaIslander Heritage Protection Bill 1998. I mentary inquiry made a number of recomwould like to also thank the member for mendations, but this bill implements neither McPherson( Mr Bradford) and I welcome his the bulk of the Evatt recommendations nor interest in Aboriginal issues. I would have the recommendations of the 11th report of liked to have had a bit of the support when I that joint committee. Evatt concluded: was shadow minister from 1990 to 1993. The Commonwealth has international, moral and legislative obligations to ensure that Aboriginal The report of the parliamentary Joint Standheritage in its broadest sense is nurtured and ing Committee on Native Title and the Aboprotected in a comprehensive and consistent way. riginal and Torres Strait Islander Land Fund on this bill was tabled earlier this week, and But this bill does not-in my understanding the government is now carefully considering of it-do that. It is complex and I have that report. If there are any amendments that attempted to read and understand it, but in my are acceptable to the government that flow view this bill does not achieve that. There are from the report, they will be moved in the significant divergences between this bill and Senate. the Evatt recommendations. The majority of government members who will come in to I would like to take members through the vote in favour of this in a moment, probably government's policy on indigenous heritage do not understand that, but they ought to. protection that has led to this bill. The There are a number of issues of concern. government made a commitment to ensure The whole question of the national interest is that, in consultation with states and territories, fundamentally important. A fact that has indigenous heritage was protected. The already been contributed in this debate is that government considers that the minimum the Commonwealth has responsibility for this standards will ensure the proper protection of issue in its entirety and not the states. ATSIC indigenous heritage. Each of the standards have said: sets an appropriate benchmark which the states must meet to gain accreditation. The The proposal to remove the right to negotiate from standards do not require uniform legislation native title is now reinforcedbecause the Commonwealth recognises that and that is the contextthere are different circumstances applying to by an effective Commonwealth withdrawal from the various states which need to be taken into Aboriginal and Torres Strait Islander heritage account in the framing of heritage protection protection. laws. As I said, we have not heard much from It is widely acknowledged that the Northern government members on it, but my reading of Territory's heritage protection regime reprethis legislation is that it is deficient in a sents current best practice. While not requirnumber of major respects. ing states to have a regime identical to the Motion (by Mr Cadman) agreed to: Northern Territory's, the standards in this bill That the member be not further heard. reflect many of the elements of that regime. Accordingly, a number of states will be indulgence, I understand from the government ments before they have the capacity to be that, if this goes through, the member for accredited. As a safeguard, the bill requires",47,Chairman Maybe They Should Be Called Of Findings Flowing From Acceptable Processes
