speakerGroups,speaker,theText,pageNumbers,title
408,Mr Campbell (Kalgoorlie) (10.13 A.m.),"It always amuses me when members ofThursday, 4 June 1998 MAIN COMMITTEE 4935 we do not bring in these schemes when the industry is buoyant. What happens is that the general public gets the idea that the rural sector has been greatly assisted when it has not. Of course, there are many other things the government can do. I believe that we should re-establish a development bank with the charter of the original development bank to go out and lend money to farmers long term, at reasonable interest rates, without full regard to security, based on their hard work, initiative and the integrity of the Australian people. This, of course, cannot work with the present Commonwealth Development Bank, which is nothing more than a grubby merchant bank-and has been for about 30 years. In fact, in a privatised system, it is probably ultra vires the company law for it to be operating at all, as the requirement under company law is for directors to maximise the income of the company for the shareholders. The Treasurer ( Mr Costello) keeps talking about the low interest rate regime available to the community. This is generally not available to farmers. I have many farmers who are currently paying 12Y2 per cent interest. I would like the Treasurer to explain just how this can be when he tells us interest rates arc low. The reason is that there is a real premium put on the farms by banks, and, in many cases, the worse offender is the Commonwealth Development Bank, which has locked people into long-term loans at interest rates way above the market. The previous speaker, the honourable member for Murray( Mrs Stone), talked about some of the other problems with the rural sector. She mentioned fire blight. AQIS recommended that we allow in New Zealand apples because they felt the risk of bringing in fire blight was very small. Unless that risk is zero, they should not be allowed in. Nowhere in the world where fire blight is established has it ever been successfully eradicated. While it is true that apples are quite resistant to it, the new types of apples, which Australia has pioneered, are very susceptible to it and even more so are pears. The reason New Zealand does not have a pear industry is that it has fire blight. If fire blight were to get into the electorate of Murray, it would simply destroy the pear industry in Australia. Governments and government departments do not have the right to do these sorts of things. While talking about this bill, I want to talk about where governments clearly affect the interests of the rural sector on other issues. The pig industry is in crisis in this country, and they are not in a position to access this legislation. They simply are not going to have any earnings to set aside. Had we had this scheme in buoyant times things would be different, but that is not the case. Why are things in the industry so bad? I would submit simply because of government action. the world and that we should increase production. They talked about the markets in Asia, which, of course, are so ephemeral. You would think that Keating was running that department. That market did not eventuate but increase in production did. Then the government said that it would allow in Canadian pork partly to keep pressure on, to keep the Australian pig producers honest and partly because they had signed this treaty which stopped us banning the import. ABARE predicted that in the first year 3,900 tonnes would come in. In fact, 12,000 tonnes came in. One has to wonder, when the industry is so badly affected by actions and forecasts of the government, why the government does not have a responsibility to compensate, to make good the results of their actions. We are told that we have a level playing field. Quite clearly, we do not. Let us get this straight: it is not Canadian pork coming into the country; it is American pork. It is coming 4936 MAIN COMMITTEE Thursday, 4 June 1998 in from ConAgra farms in America, going across the border to ConAgra plants in Canada and coming out to ConAgra agents here. Quite clearly, as a result of these trade agreements which the previous government signed, but it was fully supported by this government, we are supporting multinational companies at the expense of the interests of our own producers. I think that is a scandal. If we were to have a level playing field, I believe that we should make the Canadians send in whole pig. We are told that we cannot bring in whole pig because there is disease in the bone. Disease in the bone! If there is disease in the bone, how do we stop it going from the bone to the meat? Let us review that argument all over again. As a fall back position, let us say, 'Okay, bring in the whole boned pig.' This will not occur because they can get more for the sirloin in North America than they can get here. They are attacking Australia with leg meat, which is Australian prime meat where it is not so in the United States and Canada. So they clearly have a big advantage. There is no level playing field. I believe, very strongly, that to make it level we should insist that they bring in the whole pig, not just selected portions. But that is unlikely to happen where governments in this country show far more interest in treading the world stage and abiding by GAIT than they do in the interests of our own farmers. I just wish that some of our ministers could go to France and get bitten by some French politicians so that there are people who will look after the interests of our farmers. This bill is a feel-good bill in many ways. It is simply not going to achieve very much. Unless we address those other issues which I have mentioned, nothing substantial will happen in the rural sector. Let us look, too, at orange producers. Orange producers are not going to be able to take advantage of this. This industry is in crisis. It is interesting to see that the government has put great stress on the fact that the National Farmers Federation supports this legislation. Well, who is the National Farmers Federation? Whom do they represent? They certainly do not represent rural producers. NFF clearly stands for no family farms. These people are entirely imbued with the rational economic theory. Their advice to government was, 'There are winners and losers. You can sacrifice the orange producers in the interests of the beef, wheat and wool producers.' Those beef, wheat and wool producers are my constituents, and they are not going to be better off one iota if you kill the orange industry. They are, in fact, going to be worse off because what you do is you contract the whole rural vote. That has to be realised. Let us face reality. We only produce half our requirements of orange juice so we have to import. It was not Brazilian farmers bringing in concentrate to Australia; it was American agribusiness. They wanted to flood the market to kill the whole industry. They knew that once the trees were out they would never be planted again. But the rational economists that seem to inhabit government these days seem to have the view that you pop trees in the ground, pull them out and pop them back in again. It is simply not like that. If you kill that industry, those trees will never grow up. Bear in mind that we only produce half that juice because we had a spate of pulling trees out some years ago. We have been saved in the short term by the drought in Brazil, which, of course, is a good thing for us. It makes me think that perhaps there is a god after all. So much needs to be done for the rural sector. When you kill the rural sector, when you drive people out of the country towns into cities, the cost imposed on society is enormous. There is not one person who goes to a capital city that does not require new infrastructure, Thursday, 4 June 1998 MAIN COMMITTEE 4937 but our cities are bursting at the seams, yet we anleaving all that infrastructure in country towns underutilised. There can be no sense in that. You would have to be a rational economist to perceive any. I support this bill. As I say, it does very little. In reality, it certainly is not a bill that can be accessed by farmers at the present time. I am hoping there will be an upturn in improving conditions. One thing has to be realised by this nation, and that is this: there is not one capital city of Australia that lives on its intrinsic worth. Everyone lives by sucking the lifeblood out of the rural sector and the mining sector. They work on the wealth of the hinterland. That is what keeps Australian cities going, not intrinsic value. That has to be realised because, if that is not, the continual dichotomy will grow in Australia between city and country people. If that is allowed to continue, this country cannot survive because it cannot survive as a nation divided against itself. the Taxation Laws Amendment (Farm Management Deposits) Bill 1998. I note some of the comments of the member for Kalgoorlie ( Mr Campbell). I would hope that this is not a nation divided against itself but a nation where city and country can work together. Under this government we will have the opportunity to perhaps extend the arms from the city to the country and from the country to the city and bring people together to benefit. I put to you too that this government for the first time has really taken on the concerns of country people through the Agriculture-Advancing Australia policies. We have addressed ourselves to some of the issues that are really affecting country Australia today, particularly in my area of Gippsland, in the seat of McMillan and country Victorians generally. It is not denied by anybody that we are faced with a drought at the moment that runs from central New South Wales right down through the Monaro into Gippsland and down into Tasmania. This has caused enormous hardship for communities, but the member for Kalgoorlie actually denies that there has been restructure going on in rural communities. Since the 1960s the change in transport, the change in information technology and the change in the way we communicate with one another has changed the whole face of the farming community. I would agree with the member for Kalgoorlie and say this: the soul of the cities is in the country. We rely on country people for the national soul. They look to country people for the expression of everything that is Australian. I do feel that locally in the seat of McMillan, and I know the member for Kalgoorlie expresses that generally in his approach to his politics. I can accept that there are those that are passionate about how we go about holding together our country communities. There is the thrust of the government's approach and the thrust of the approach of the Prime Minister( Mr Howard) in his response to the pork industry that the member raised. The Deputy Prime Minister( Mr Tim Fischer) yesterday said that he agrees that there is no level playing field but there is a minefield out there that we are having some success in addressing ourselves to. There is the good work done by the Minister for Primary Industries and Energy( Mr Anderson) in bringing all these pieces together into one cohesive policy where the previous government failed to do that. There are farmers right now in parts of my area who are in great distress because of this drought. We have gone through a shocking period for dairy farmers. We are automatically restructuring the beef industry throughout the whole of Gippsland because of the size of",130,Representatives Main Committee
409,Mr Broadbent (Mcmillan) (10.26 A.m.),"Thank you for the opportunity to speak on4938 MAIN COMMITTEE Thursday, 4 June] 998 properties, because of the structure and make-up of our communities and the withdrawal of services caused by the reduction in population throughout our country areas. We have to find ways to address ourselves to keeping rural communities together. Part of Agriculture-Advancing Australia is to put in a program to support rural communities, which we have done. With the granting of drought exceptional circumstances in Gippsland it has been proved for the first time ever that we are not drought proof, unlike the electorate of Murray, and that the great lush land of Gippsland can be affected by the lack of rain or by the excessive amount of rain and then the withdrawal of that rain. Under the government's proposal for exceptional circumstances for farmers, we look at a number of issues including meteorological conditions, agronomic and livestock conditions, water supplies, the impact of production, environmental impacts, the impact on farm income, sale and significance of the events, and other forms of support being provided or which are available from Commonwealth or state government agencies. In combination with the state government, we were recently able to deliver a $3.7 million package to farmers in Gippsland. That package has been extended to East Gippsland and has also been extended further into the Monaro. This is the first time government has had to turn and react in these parts of Australia. My concerns are that we put proposals and programs in place-such as the bill before us, that will at least give some opportunity for farmers and producers across Australia to address the issues, particularly of good years and bad years. That is what the bill does in this instance. The member for Kalgoorlie also addressed the issue of farmers in contract work. I will take up the proposal that he put forward, because a tremendous number of the farmers in Gippsland are also contractors. I would not like the nature of their work to prevent them accessing this program because, without that contracting out work which is often done for other farmers, it would make a mockery of the opportunity for this program to work effectively on behalf of farmers. But we must not forget in that process that, in this global economy, we have a number of areas in which Australia has to address itself to the whole of the issue rather than to one individual grouping at any given time. We have to look at the beginning of our pork exports and the fact that we have begun to export citrus products. Our beef markets need to be protected. We as a government have put in labelling legislation which will also help the pork industry and there is, too, of course, the anti-dumping legislation that only this government has been able to provide. This is important legislation not only for the pork industry but also for the paper and pulp industry. It gives a clear indication for Australia as to what is a product of Australia and what is made in Australia. It is only this government, through the Minister for Customs and Consumer Affairs( Mr Truss), that has been able to deliver on behalf of Australian producers. Today, with this farm management bill, we have taken the opportunity to deliver, once again, on a promise to rural Australia and particularly rural Victoria. It is one of the many lists of core promises that this government under the Prime Minister( Mr Howard) has delivered and will continue to deliver. But it is not just about legislation; it is not just about economics; it is about people. This Agriculture-Advancing Australia package, of all of the legislation that we have been addressing, is directly about people: people on the farms, people in regional areas, people that have a real concern about their future and about the generations to come. Thursday, 4 June 1998 MAIN COMMITTEE 4939 Mr Deputy Speaker Forrest, you would know from your own area that there is a concern out there as to where rural people are going to be in 10, 15 and 50 years time. Are we going to have the family farms that are currently there? Will there be further rationalisation? Will there be the opportunity for their children to stay? Some of the information that we have read says that the numbers of people between the ages of 24 and 34 in country areas right across Australia are diminishing. We have an ageing community with some 14 per cent of the community made up of children. The income in the rural areas is no longer the dream, where city people often used to see farming life as giving a large income and a great lifestyle. That is certainly not the case across Gippsland. We are constantly addressing ourselves to the issues that affect people on those farms, in those communities and in those small businesses. In another place today I will be addressing some of the issues that have impacted so badly on regional Australia. I will remind this Main Committee chamber of one of those issues; that is, after the 1993 election campaign the taxes in this country were increased. The wholesale sales taxes were increased to the tune of $4 billion and the taxes that were going to be reduced to those people by another $4 billion. The previous government actually cost every person $444. That was done by stealth. It was unfair. There was no compensation for it. Who paid it? Teachers in rural communities, farmers, women trying to manage the household budget, low income families in country areas-all of those regional people. They are the ones that paid it. They suffered it. Mr Melham interjectingof the former federal government in 1993. These are real people out there that had to pay a real unfair cost when they were previously promised that there would be no tax increases. So never ever talk to me about social justice. I remember a member sitting in this House giving his maiden speech on social justice. Every time he mentioned social justice, he had his bus load of people in the parliamentfor that person at that timeto actually sit there and claim social justice after increasing taxes by 10 and 20 per cent to the poorest parts of our community, which is often in rural Australia where they do not have the service, they do not have the transport, they do not have the opportunities and they do not have the educational opportunities. Those people were never, never compensated. Mr Bruce Scott interjectingbe dealt with very effectively and quickly. I have taken my time, but I just remind the committee that any time anybody from the previous government gets up and talks about social justice, we can just tell them that Agriculture-Advancing Australia is what social justice is about. The gold card for veterans is what social justice is about. Social justice is about what this government has delivered, which is the reduction of our debt, and fairness in our whole approach. What you will see from the government is one of the fairest packages that this government has ever put together. Mr Melham interjecting-",133,Representatives Main Committee
410,Mr Broadbent,"No, I am talking about the inconsistency and the shameful performance",135,Representatives Main Committee
411,Mr Melham,There were four bus loads.,135,Representatives Main Committee
412,Mr Broadbent,at that time clapping him. I tell you what: it must have been shameful,135,Representatives Main Committee
413,Mr Broadbent,"Anybody from the gallery who is able to shout across this table should4940 MAIN COMMITTEE Thursday, 4 June 1998 the procedures on making contributions to the chamber. I ask him to observe them. Ml' BROADBENT-I am very happy that the member for Banks is in here because on every occasion I raise social justice I would like to have the member for Banks in the room. I want to drive home to the member for Banks and his fellow members--one of whom has just arrived-the message that, if they want to talk about social justice, I am going to drive it home to them on a daily basis, day after day after day, because what they did not deliver after 13 years of government was social justice for rural Australians. I look forward to taking up the cudgels again on another occasion. today to support the Taxation Laws Amendment (Farm Management Deposits) Bill 1998, which is delivering yet another coalition promise. It will be a cost to revenue of approximately $20 million but, in effect, it amalgamates the old income equalisation deposit scheme and the farm management bond scheme, neither of which were working well. They were hardly used at all. They were so structured that they were virtually ineffective. In fact I will never forget that, when the Labor Party came to power in 1983 in the month of Marchbecause, two months down the track, in May, the Labor Party totally gutted almost every measure that the farming community enjoyed, one of which was the IED scheme. That scheme never worked after that. Peter Walsh was one of the driving forces in getting rid of that scheme. He is a former Labor member whom I do have some regard for and I enjoy reading his weekly comment in the Financial Review, but he did make a mistake in this area because that scheme was put in place to allow farmers in good years to provide for themselves in bad years, rather than calling on the taxpayer. After that scheme was done away with, some years down the track the Labor Party realised their terrible mistake when we had difficulties with the wool industry. They fiddled, prodded and poked with various measures to try to reinstate it, but none of them worked. I am pleased to say that, after 13 long years of Labor and within two years of a coalition government coming to power, the Minister for Primary Industries and Energy( Mr Anderson) has introduced a workable scheme back into the parliament. The farm management deposit scheme will be run by financial institutions, which is another refreshing change. Rather than the deposits being held by the Department of Primary Industries and Energy, something I was always uneasy about, they will now be held by financial institutions. The FMDs will be a tax linked management tool and they will be much more commercially attractive than IEDs and farm management bonds ever were. They allow farmers to deal with the uneven income streams that are inevitable with agriculture-not only inevitable but very common, particularly over the last decade or so. Farmers will be able to set aside money in the good years-and we hope they return soon for the mainstream primary industries-for when farm income is low. So farm management deposits are to be used to complement other risk management strategies, such as putting away fodder in reserves, water conservation, diversification of income streams, forward selling and all these other tools they have had. Drought, very sadly, has been very common particularly in eastern Australia over the last 10 years or so and it has been a tragedy for primary producers, having gone through wool price collapses, beef price collapses and grain price collapses. Just about every commodity has gone",135,Representatives Main Committee
414,Mr Deputy Speaker ( Mr Forrest),Order! The honourable member for Banks knows,136,Representatnes Main Committee
415,Mr Cobb (Parkes) (10.39 A.m.),It is with some pride and satisfaction that I rise to speak,136,Representatnes Main Committee
416,Mr Melham,It was a very good year.,136,Representatnes Main Committee
