speakerGroups,speaker,theText,pageNumbers,title
0,"Thursday, 4 June 1998 Informed Consent Of The People For Whom This Legislation Is Supposedly Framed. Consistent With This Imposed Dictatorial Took The Chair At 9.30 A.m., And Read Prayers. From Involvement In Decision Making. Con","BILL 1998 parliamentary joint committee on this matter, indigenous people will have no role in deterSecond Reading mining the criteria for accredited state regimes, nor in the assessment of how those Debate resumed from 2 April, on motion by criteria will apply. Whilst being able to give Mr Moore: evidence in issues that go to heritage signifiThat the bill be now read a second time. cance and threats to sites, they will have no role in the evaluation of that evidence. They Aboriginal and Torres Strait Islander Heritage acting on behalf of the minister. In the same Protection Bill of 1998 comes before this old failed model they will be done unto, they House without the unqualified support of any will not do. They will be told, not asked. member of the Parliamentary Joint Committee on Native Title that inquired into it. It arrives The bill is fundamentally flawed. It would in the wake of substantial criticisms of it by be fatuous to say that the issues that are dealt the author of the most recent and most authwith in this bill are simple and straightfororitative report on indigenous heritage protecward. It would beggar belief to say that all tion in this country, the Hon. Elizabeth Evatt. the answers are readily at hand. But this is It comes without any endorsement from the not a government for hard decisions or compeople whose interests it purports to protect, plex problems. Whilst the 1984 bill applied Australia's indigenous people. the best advice and the most acceptable This government would do well to set this methods available at that time, the 1998 bill bill aside now, in the interests of good govis anything but contemporary in its reflection ernment, in the interests of Australia's interof the understanding and more enlightened national reputation and in the interests of approaches that have emerged in the intervenequity and justice. Those who ignore history ing 14 years. are doomed to repeat the mistakes of history. Australia has struggled to deal with the The doom is for those this history is repeated problem of treating indigenous heritage issues on, much more so than those it is repeated by. in a way that is sensitive to indigenous This bill is yet another instrument of control cultural values. This is a problem with many over indigenous Australians. However well manifestations and it is at the heart of some intentioned it may be, it is yet another instruof the questionable assumptions underpinning ment in a long line dating from the claiming this bill. The bill persists with methods that of this continent for the British sovereign assume that indigenous heritage can be whereby those with power impose controls protected by means and through processes over matters of concern to powerless indigenthat are intrinsically offensive to indigenous ous people without proper consultation with values, practices and beliefs. The positivism them and without their consent. What legitiand legalism of mainstream culture demand macy can there be in this legislation when to methods that identify, locate, name, map and the extent that indigenous people have been register for general information the sites of consulted they have expressed dissatisfaction significance to the stories, rituals, songs and with it? At no time, either through representadreaming of our indigenous peoples. Traditive bodies, interested groups or individuals, tional custodians are thereby placed in an has there been any attempt to obtain the impossible dilemma.",13,Setup
1,"Mr Speaker (Rt Hon. Ian Sinclair) Model, The Bill Excludes Indigenous People",,13,Aboriginal And Torres Strait Trary To The Recommendations Of The Evatt Islander Heritage Protection Report And The Report Of The Minority In The
