speakerGroups,speaker,theText,pageNumbers,title
113,"Given To Foster Children, Often Without Govern","Mr ALBANESE-The Minister for ComAttorney-General, but let us quote the supporting double-dipping. They are saying minister herself. This is extraordinary. This is that it is okay to double-dip. The interesting the minister just after she had to abandon her point with the moralistic sort of stand that great welfare announcement. Just after she put some members of the opposition are taking is that in the bottom drawer, this is what she that, if we were so wrong, why is it that had to say on the ABC radio's Life Matters: ATSIC and the leadership of ATSIC are ... the 32% of the mothers with children between supporting these amendments? ATSIC has the ages of 10 and 14 (who do not work) are either always being known to be fiercely independquite wealthy or they have no skills to offer and no ent in its views of government policy, and we confidence to try to be like all other women. accept that. But ATSIC is accepting the What a disgraceful comment from the amendments. The amendments have strong Minister for Family and Community Services. support from the Aboriginal and Torres Strait What a disgraceful comment from the graduIslander Commission. It seems as though the ate from the Margaret Thatcher school of Labor Party is not listening to that. It is not kicking beggars. What a disgraceful position listening to this peak organisation which we from a minister who talks about compassion. recognise looks after indigenous Australianswho have been disadvantaged for many The opposition will be supporting the years-and which acknowledges of itself that Democrat amendments in the Senate when this policy of not double-dipping is correct this bill goes back there. We will be supportand that the amendments that have been ing those because we have been consistently moved by the Democrats in the Senate are of the view that the people who are singled wrong. out for cuts in order to fund tax benefits for the big end of town in the government's Ralph review, in the GST changes and in the Yet members of the Labor Party are trying income tax cuts should not be single parents, to beat up this little story of our being uncarshould not be indigenous Australians and ing and not being supportive when the facts should not be the disabled. are that the indigenous community recognise that the amendments that are being proposed Every time the government has a look at are wrong. The CDEP scheme has been this issue, it is as if it gains pleasure from operating for many years-well before Work attacking the most vulnerable people in our for the Dole. Indeed, the fact it has been society. It says it is doing it for consistency, working so well is one reason we decided to but that is just not true. Consistency requires extend the mutual obligation principle to that indigenous people be allowed-as nonmany other members of the community. But, indigenous people on parenting payments are historically, there has been an anomaly that allowed-to eam up to $100 a fortnight. Nonlone parents on CDEP schemes could legally indigenous people are allowed to do it, claim their CDEP wages plus their pension Minister. Why are indigenous Australians payments. being singled out? They are being singled out because of the One Nation type agenda being The opposition are saying that that is okay pursued by the government when it comes to and are encouraging people to double-dip. We the issue of race and when it comes to the do not believe that is correct. People should issue of the most vulnerable in our society. be entitled to their payments but only their Right now, single parents can use the CDEP entitlements. Even when the same well-reto supplement income. What is wrong with spected indigenous organisation, ATSIC, says that, Minister? What is wrong with indigenous that it agrees that the amendments are wrong, Australians being encouraged to contribute to the opposition conveniently forget this, for their community? (Time expired) political purposes and point scoring. The Community Services) (4.24 p.m.}-I stand backwards; we do not try to politicise this, as here amazed by some of the remarks from the member for Grayndler unfortunately does. members of the opposition. They are basically He is stooping to university style politics.",41,Further 1998 Budget Measures The Senate Recently Made A Number Of Legislation Amendment Amendments To The Further 1998 Budget
114,Mr Anthony (Richmond,"Minister for government acknowledge this. We are notThe government acknowledges the considertaxpayers. It acknowledges that the opportuable disadvantage faced by indigenous lone nistic amendments moved by the Democrats, parents. However, it does not believe that with the tacit support of the Labor Party, are double-dipping is a satisfactory solution. Both wrong. the board of ATSIC and Ian Spicer, who conducted an independent review of the p.m. )-One thing I have learnt this afternoon CDEP scheme in 1997, believe this doubleis that the Minister for Community Services dipping loophole should be changed. Indigenhas absolutely no idea how the CDEP operous lone parents do receive assistance through ates or, indeed, where it operates. Nor has he other measures-we recognise that-such as any idea of the conditions in which people the Jobs, Education and Training program, who are participants in the CDEP live. I JET. For instance, JET funding has enabled doubt whether he has ever seen a CDEP creches to be set up by the CDEP scheme to community, and he comes in here and waxes train child-care workers in indigenous comlyrical about the sorts of services that are munities. In some cases, it has led to permaavailable to single parents in remote communent child-care centres operating and other nities where the CDEP operates. innovative child-care solutions. After the changes, lone parents will still be better off You are living in cloud-cuckoo-Iand, broparticipating in the CDEP than remaining ther. You have absolutely no comprehension solely on income support. They will also about what life is like for people who live on remain slightly better off financially than CDEP in my communities. You have absoother CDEP participants. lutely no idea about the level of poverty that people are subject to when they live in these Access to CDEP is being extended to all communities. You have no idea at all about other pensioners for the first time under this the lack of universality of services-about the measure. It is a good measure. Age and services which do not apply in those commudisability support pensioners have been eager nities. I just heard you talk about how JET to participate in the scheme, and extending operates in Aboriginal communities. I suppose the current treatment of the CDEP income to you will tell me that your employment prothese pensioners will create further disparities grams generally operate in Aboriginal combetween customers in similar circumstances. munities. Let me tell you that they do not. In Quite frankly, the Labor party are not even fact, the net result of the efforts of your going to divide on this bill. If they feel so government over successive budgets has been passionately about it, maybe they should. to whip out the funding not only from ATSIC Underneath it all, they are just playing polibut from those other agencies that provide the tics, and they are recognising that doublesorts of support services that you were just dipping should not be supported by any waxing lyrical about. members of the community. And it should not be supported by the opposition. There is no doubt about it: the most disadvantaged people in Australia, bar none, are The whole reason we try to have a very the people living in severe poverty in these open and transparent welfare system is so that Aboriginal communities who are subject to people who are entitled to that assistance CDEP. In reference to that level of disadvanreceive it, whether they are indigenous Austage, studies by the Northern Territory Detralians or any other Australians. But we do partment of Health have demonstrated that the not support double-dipping, and neither would cost of living is higher for the people who the opposition if it were open and transparent live in those remote communities where they about this. It is whipping up a storm in a get the privilege, which they themselves have teacup for pure political purposes. Even accepted since 1972, to work for the dole-body that looks after indigenous people in this simple basket of goods in most of these country, recognises that this anomaly is communities in remote Northern Australia is incorrect and unfair for other Australian 140 per cent of the cost of a basket of goods",42,Further 1998 Budget Measures The Senate Recently Made A Number Of Legislation Amendment Amendments To The Further 1998 Budget
115,Mr Snowdon (Northern Territory) (4.29,"planning to do by these proposals is whip out I note that the Minister for Community $80 per fortnight in income and assistance to Services, in defending this callous action by some of these people. You should understand the government, has quoted ATSIC. I want to the impact of this on these communities. quote ATSIC myself, from the letter that they wrote to the Leader of the Australian DemoYou, along with your government, continue crats on 31 December 1999, signed by Gatjil to talk about your concerns for young AustralDjerrkura, the Chairman of ATSIC: ians, single parents and indigenous AustralWhile the Board has expressed concern over the ians. Well, we have never seen the colour of potential impact of the new income arrangements your money. We are seeing here an effort by for lone parents, pensioners on CDEP ... you and by your government to withhold There it is: ATSIC themselves have expressed from these Australians their legitimate rights, concern. But, because this government has a to withhold from them their legitimate needs take it or leave it approach and because of the that should be being met by your government. way it disguises cuts as reforms, ATSIC were In some measly-minded way, you believe that once again put in the position of: 'Here is the somehow or other they are dOUble-dipping. package-take it or you get nothing.' Let me tell you: they are being treated no differently from other sole parents. That is The ALP moved a number of amendments what the equation should be about: their in the Senate to this bill. We fixed up the treatment vis-a-vis other Australians. I have crisis payment and the changes that the the privilege, and have had the privilege, of government was proposing in knocking off knowing many of these single parents. I the education and employment entry payunderstand and know how difficult it is for ments. We fixed it up so that there will now these people to make ends meet. I know how be a choice of either getting that one-off hard it is for these people to put clothes on payment or having a loan of between $50 and their children's backs and shoes on their $400. We also fixed up the pensioner educachildren's feet and to supply appropriate tion supplement issue. In fact, we have fixed nutrition because of the level of geographic up a number of the inadequacies with this isolation they suffer and the cost that they bill. But one of the things that we also moved incur as a result. on was this issue. I have said to the minister that we would have preferred that it not be What you are proposing to do now is subject to a time frame. We would have further undennine that ability to provide these preferred this move to have just been knocked essentials of life for their children. That is off completely because, as ATSIC themselves what the test is about: whether it is reasonable say, there is no doubt that people wi1lleave and whether it is fair. It is very clear that it is this scheme as a result. If you take away any neither reasonable nor fair. It is just another financial incentive whatsoever for people to extension of the attitude of your government, participate in the CDEP-so that instead of historically and until now, and of your dispagetting $100 a fortnight, they get $20 a raging attitude towards those people who live fortnight-you say to them: 'Don't bother; in remote Australia generally and, most . don't bother trying to improve your situation particularly in this instance, towards those or trying to contribute to your community people who are on CDEP. I ask you, Minister: because we do not believe that you should if you really are sincere about understanding participate.' The inequity in this is just extrathese things, go and look at the impact of the ordinary. The double-dipping argument is decisions that are being made by your governfalse. ment in terms of the withdrawal of services, The fact is that other people who are in particular and in general, from these remote receiving parenting payments can earn up to communities as a result of fmancial stringency $102 per fortnight. The difference with this and the budget cuts being made by you and scheme is that they are actually earning $330, your government. not $100. Therefore, $230 remains with the",43,Atsic The Premier Organisation And Peak Nothing More The Cost On Average Of A
116,In Sydney Or Melbourne. What You Are Mr Albanese (Grayndler) (4.34 P.m.),"communities in which they are contributing, (3) Schedule 2, item 54, page 39 (line 31), omit and only $100 per fortnight goes into their ""1231A(lA)"", substitute ""1231(lA)"". own pocket and into the mouths of the chilI table the supplementary explanatory memodren they have to feed. This government and randum. this minister want to take the food out of Amendments agreed to. those children's mouths. This government wants to take the clothes off those children's Motion (by Mr Anthony) agreed to: backs. It wants to take the books off those That, in the message returning the bill to the children. If you were to think of who in our Senate, the Senate be requested to reconsider the community would be the most vulnerable, bill in respect of the amendments made by the House of Representatives to the bill. where would you begin but with indigenous sole parents in remote areas? It is just extraTELECOMMUNICATIONS ordinary that this minister and this govern(INTERCEPTION) AMENDMENT BILL ment speak about these people ripping off the 1999 taxpayer. I am sorry, Minister, but here we are speaking of 4,000 indigenous sole parents Second Reading who have been subjected to 200 years of Debate resumed from 2 September, on discrimination-and you say to them, 'We're motion by Mr Williams; going to take $80 off you.' Minister, you are That the bill be now read a second time. joking! The opposition will not be opposing the off your high horse.' Minister, we will conment Bill 1999, but I will make a couple of tinue to stand by these indigenous sole parpoints in the course of the debate. The bill ents because we know that this grubby, uncaritself is relatively straightforward, but the ing government, made up of graduates of the issues which it traverses are frequently and Thatcher institute for kicking beggars, does appropriately controversial and sensitive. In not care about these people. This government particular, this legislation relates to the regulais looking for budget savings measures whertion of information obtained with search ever it can get them. Then it will be able to warrants through, as the title of the bill says, fix up its tax cuts for the big end of town. It telecommunications interception. The internawill be able to reduce capital gains tax. It will tional community, as we would expect, be able to put in place all these measures for generally is concerned about how this area is the wealthiest in society whom it represents regulated. Clearly, society has an interest in whilst, at the same time, introducing this effective law enforcement, but equally that pitiful measure for the meagre savings it will has to be balanced against the rights of bring. individuals. Motion (by Mr Anthony) agreed to: For instance, article 17 of the International That the question be now put. Covenant on Civil and Political Rights proOriginal question resolved in the affirmavides: tive. 1. No one shall be subjected to arbitrary or unlawful interference with his privacy, family, home or Community Services) (4.39 p.m.)-I move: honour or reputation. (1) Schedule 2, item 53, page 22 (table item 3, 4th 2. Everyone has the right to the protection of the column), after ""I 066A-B 1"", insert ""(including Jaw against such interference and attacks. any amount required to be added by point l066A-C1)"". The provisions of article 8, the European Convention on Human Rights, are also to (2) Schedule 2, item 53, page 23 (table item 4, 4th column), after ""1066A-Bl"", insert ""(including similar effect in a little more detail. So the any amount required to be added by point international community, in respect of multi1066A-C1)"". lateral treaties, has recognised the balance",44,Atsic The Premier Organisation And Peak Nothing More The Cost On Average Of A
117,Mr Mcclelland (Barton) (4.41 P.m.),,45,Atsic The Premier Organisation And Peak Nothing More The Cost On Average Of A
118,Mr Anthony,Get off your high horse.,45,Atsic The Premier Organisation And Peak Nothing More The Cost On Average Of A
119,Mr Albanese,"The minister says, 'Get Telecommunications (Interception) Amend",45,Atsic The Premier Organisation And Peak Nothing More The Cost On Average Of A
