speakerGroups,speaker,theText,pageNumbers,title
144,"Mrs Deanne Kelly (Dawson) (9.47 Plan. However, With A Sense Of Understanding","those abuses of the scheme that had been audit and compliance activities'. Let us hope detected. The result, according to the Audit it is $23.4 million worth of more critical audit Office, was that at least $23.4 million was and compliance activities. overpaid to complainants in 1994-95. This bill addresses these issues by providing Who are the dipsticks? Who could not run guidelines on eligibility, entitlements and a diesel fuel rebate scheme and who saw record keeping, thus providing the scheme's $23.4 million lost to taxpayers because of administrator, the Australian tax office, with overpayments? The member for Paterson went extensive powers to impose penalties, recover on about compliance and the power to stop overpayments-which the previous governand search vehicles. It is a pity the Labor ment never could and never attempted-and Party did not stop and do a bit of searching gain access to claimants' records and premand do the right thing by the taxpayer. They ises. They are complaining about onerous could not run a chook raffle! They could not compliance, but they could not run a Diesel run a fuel rebate scheme, and they are not Fuel Rebate Scheme. even going to vote for the compliance measWhile a compliance strategy is yet to be ures we have put in place. fully developed by the ATO, my advice is I would like to go on because there is even that it will be based on two key areas. Firstly, more. What is even worse is the fact that the there will be an information and education 1996 report revealed that what were described campaign to help claimants understand their in the earlier 1991 report as 'significant obligations, and I very much welcome this deficiencies' in the administration of the initiative. When I reflect upon the many truck scheme had not been remedied in 1996. They owners and operators in my electorate who had five years-in fact, they had 13 years will benefit-a great deal-I can say with overall-and they still could not get it right. assurance that none would willingly and The Labor Party in government presided knowingly engage in any rorting. However, over a scandalously wasteful, inefficient rort education and information is certainly needed that they knew about for five years and that about the new guidelines and will avoid any they did nothing about. The member for inadvertent errors. The information and Batman talked about a dirty little deal. I just education campaign is welcome. refer to the arrangement with the Australian The second area to be developed for the National Audit Office. If there is a dirty little compliance strategy is understood to incorpodeal, it has to be that one. The deal we are rate risk management approaches, including offering rural and regional Australia is a developing sector and user profiles against saving of 23c a litre. What is the Labor Party which claims can be monitored. In other offering? They are offering 43c a litre. They words, there will be figures to indicate when are trying to muddy the waters and pretend a particular business may have gone right that they are helping regional and rural outside the typical user profile and give the Australia, that they are going to save them ATO not the sort of scaremongering the from our generous offer of 23c a litre reducLabor Party is talking about but a profile to tion in fuel costs, and they could not run the compare and then perhaps ask some questions Diesel Fuel Rebate Scheme from 1991 to of the particular user. 1996. The risk for inadvertent error is always Under the coalition, thappalling, shoddy considerable when any new scheme is introand careless administration that we were left duced, even with the best will in the world. by the Labor Party will be overhauled and I know the tax office will adopt a fair and tightened up, and a great deal has been done reasonable approach to meet its enforcement already. The Customs Service has implementresponsibilities and be judicious in its aped a modernisation project, which has includproach. We have to get a better result than the ed redeploying staff away from claims proprevious government. It is significant that the cessing to what are described by the service government has recognised in this bill that in its 1997-98 annual report as 'more critical there 'will be some grey areas, and those are yet to be defined-for example, what constidown the Bruce Highway in Queensland tutes a point and hence a journey for the bringing goods from Melbourne and Sydney purposes of an entitlement? to our towns and taking melons, mangoes and Under the provisions of this bill, however, tomatoes from Dawson to the markets down the taxation commissioner must consult with south. It is going to be a tremendous boon, the Bus Industry Confederation, the Australian and I will go into the figures very sh0l1ly that Trucking Association Ltd, the National Farwill accrue to businesses right across my mers Federation and a range of other organielectorate. sations. This is a most sensible provision and There has been criticism of those cut-off should go a long way towards ensuring that points which were agreed in the negotiations disputes and disagreements are ironed out between Minister Anderson and the Australian before they become a major source of aggraDemocrats, but it is a much better deal than vation. we were ever offered by the Labor Party. I would like to recount to the House the They are still offering 43c a litre, and we extent of the benefits in this scheme. As the have cut that back by 23c a litre to 20c a litre minister for transport said when introducing diesel excise. the main bill in June, there will be large and I will talk about the cut-off points for enduring benefits to regional Australia, to the vehicle classes for a moment. The fact is that environment and to transport operators in the 4.5 tonnes is a natural cut-off point for vehiroad, rail and marine sectors. In the second cle classes because different licensing requirereading speech, the minister said: ments apply at this level-a truck drivers Businesses across Australia will all pay less for licence is needed to operate such vehicles and fuel than they do now because they will get back very few vehicles use petrol at this threshold. the GST paid on inputs . . . It is expected that Some 99.9 per cent of articulated vehicles and businesses should save around 6c to 7c per litre by 90.5 per cent of rigid trucks already use this measure alone, although the actual amount will diesel, as do a similar percentage of the bus not be determined until next year after the final fleet. These figures demolish some of the pre--GST half-yearly CPI adjustment to excise rates. wilder claims that there will be a wholesale In addition to the GST input tax credits on fuel switch from petrol to diesel in these heavier purchased, the Diesel and Alternative Fuels Grant vehicles thus contributing to environmental Scheme will provide a further major cut in costs, with grants in the order of 16c to 17c per litre of damage. diesel used for a wide variety of Australian busiThe Australian Conservation Foundation nesses that provide transport services to country claimed last March that reducing the price of areas. diesel would in fact lead to increased diesel Importantly, the government is also extending usage. Let us examine that claim. The Nationconcessions available under the Diesel Fuel al Farmers Federation President, Mr Ian Rebate Scheme by recognising rail as an offDonges, rightfully responded by pointing out road user of diesel-a big component of the that it was just absurd to try to claim that transport industry in rural and regional areas, farmers would want to spend more time and certainly in my electorate of Dawson-and money than they already do harvesting grain therefore extending to the railways the full and planting crops. Mr Deputy Speaker excise rebate, and by also extending this full Adams, you come from a regional electorate. rebate for diesel and like fuels to marine use You do not harvest your crop twice just and other qualifying uses, including agriculbecause fuel is cheaper. You do not haul the ture, fishing and mining. same product twice to market just because Broadly speaking, eligibility for grants diesel fuel is cheaper. Nor do truck drivers under the scheme is limited to vehicles happily take the long route between two weighing between 4.5 and 20 tonnes operating points because diesel fuel is cheaper. outside metropolitan areas and all vehicles In fact, the NFF President pointed out that weighing more than 20 tonnes operating in all if the view that cheaper fuel means greater areas. They are the trucks that go up and vehicle usage had any merit at all then there would be greater usage in Brisbane than in cost of living for regional and rural Australthe other capital cities because of lower fuel ians. prices there due to the absence of a state fuel I would like to share with you some figures tax. I am happy to advise that this is not the that have been done on the benefit for a fact. According to the Australian Bureau of business in roy own electorate of the substanStatistics, Brisbane motorists actually drive 10 tial cut in diesel fuel excise offered by the per cent less than the national average, travelMinister for Transport and Regional Services. ling 10,300 kilometres a year compared with This exercise was undertaken by the National the national average of 11,400 kilometres. Mr Truck Association for a trucking business in Donges also pointed out last March that in the my electorate of Dawson. It is a moderately previous two years the pump price of petrol sized family business with a turnover of $2 and diesel had fallen dramatically, yet conmillion a year. It is probably not an atypical sumption was 48,178 megalitres in 1996, business in the transport industry, but it is for 47,813 megalitres in 1997 and 48,025 a family run business. Their diesel fuel bill megalitres in 1998. The facts do not support per annum is in the order of $400,000. On the the Australian Conservation Foundation's Truck Association's figures they are going to assertion. Farmers do not drive their product save-and I hope the Labor Party are listentwice to market. In Brisbane, where fuel is ing because they were not going to deliver cheaper, motorists drove less than the national it-$132,500. average of kilometres. The reality is that there is no correlation between fuel prices and Mr St Clair-How much? include the wholesale sales tax on parts, oil, you the facts, but you do not want to hear my figures; they are the National Truck them. That is typical of the Labor Party. They Association's figures. So for that one small do not want to offer a diesel fuel rebate of business, the total sum of the savings is 23c a litre. In fact, it can be well argued that $207,760. That money will go right throughthe benefits from the tax package, including out the electorate, not into the coffers of cheaper fuel and cheaper vehicles, will have Canberra for the Labor Party to waste. impact because businesses will be better able pretty quickly. less polluting vehicles. As the Minister for your money plenty. Do not forget the black Transport and Regional Services said in June hole you created with your debt. We all when introducing the main bill for this remember. scheme, 'In fact, viewed in the context of the cities will actually fall dramatically.' to the member on the other sideof rural and regional"" Australia. It moves I would rather you did not. Just say it to the produce to markets and it delivers the neceschair and ignore the member on the other sities of life. Thus the cost of this transport side. on domestic and international markets and on rather direct my comments to you, Mr Deputy the cost of virtually everything needed for Speaker. But I thought the events of last -eek day-to-day life. Cheaper fuel. means lower were very significant when the former Pnme costs which, in turn, means enhanced prosMinister, Mr Keating, went on radio -d pects for our exports and. a dampening on the television making the statements that he dId.",85,Atsic The Premier Organisation And Peak Nothing More The Cost On Average Of A
145,Usage. Mrs Deanne Kelly,"$132,500. If you",88,Atsic The Premier Organisation And Peak Nothing More The Cost On Average Of A
146,Mr Emerson,"Oh, come on! tyres and so on, they are looking at a saving",88,Atsic The Premier Organisation And Peak Nothing More The Cost On Average Of A
147,Mrs Deanne Kelly,"I have given in addition to that of $75,260. They are not",88,Atsic The Premier Organisation And Peak Nothing More The Cost On Average Of A
148,A Very Positive Economic And Environmental Mr Emerson,We will be in government,88,Atsic The Premier Organisation And Peak Nothing More The Cost On Average Of A
149,To Purchase New And More Fuel Efficient And Mrs Deanne Kelly,You wasted,88,Atsic The Premier Organisation And Peak Nothing More The Cost On Average Of A
150,Full Set Of Environmental Commitments Made Mr Emerson,Don't be nasty.,88,Atsic The Premier Organisation And Peak Nothing More The Cost On Average Of A
151,"By The Government, Particulate Emissions In Mrs Deanne Kelly",CanI just say,88,Atsic The Premier Organisation And Peak Nothing More The Cost On Average Of A
152,Road And Rail Transport Is The Very Lifeblood Mr Deputy Speaker ( Mr Nehl),"-No,",88,Atsic The Premier Organisation And Peak Nothing More The Cost On Average Of A
153,Impacts Heavily On The Price Of That Produce Mrs Deanne Kelly,"I would muchMany people had forgotten what the Labor access to documents, computer files, goods or Party was really like. I had people stopping other property. The occupier of the land or me in the street all day saying, 'Remember premises will be obliged to provide the Keating-God save us.' It all came backofficers seeking access with reasonable access political deja vu. Boy, did it come back. They and assistance, including advice, as to where had not forgotten; the memory had dimmed. relevant information is kept. If an authorised But it all came back, as you can see by the officer has reasonable grounds to believe that poll results. Theyremembered the 22 per cent a vehicle is involved in obtaining fuel grants, interest rates. They remembered, as my the officer may stop the vehicle for the colleague the member for New England so purposes of searching it or for taking a fuel rightly said, the constant increases in the sample. That is where the dipsticks come in. diesel fuel excise and petrol excise starting They have moved from thermometers in from 6c going right up-dimbing and climbchooks to dipsticks in diesel fuel tanks. An ing. They remember the wholesale sales tax. officer of the government can follow a truck They remember the l-a-w tax cuts. It all came driver into his or her house and demand the back-political deja vu. Just look at your poll production of documents and can get out the results. So while you are over there crowing dipstick and put it in the fuel tank to seek to about that, remember that we are the ones enforce what is an ill-conceived and hastily delivering. (Time expired) cobbled together scheme. crowing about anything. already appear to be in this legislation. For Just as the GST will prove to be, in the an eligible vehicle is entitled to a grant for prophetic words of the Treasurer, a nightmare the entire journey from a non-metropolitan to on main street, so too will the Diesel Fuel a metropolitan destination. Yet an identical Rebate Scheme prove to be a nightmare on journey in the other direction seems to be Mount Lindsay Highway, for Mount Lindsay eligible only for that part which is outside the Highway is a major road that travels through metropolitan area. The consequence of this is the electorate of Forde and into my electorate that it would increase the cost of goods of Rankin. This scheme will be wide open to transported to regional areas compared to rorting. identical trips in the opposite direction. Surely The member for Dawson spoke euphemistithis is not an intention of this legislation. The cally about grey areas. What she is referring intended consequences of this legislation are to is opportunities for rorting of this scheme. bad enough as they are, but, if this is correct, In response to those opportunities that are this is one of the many unintended consecreated by this hastily cobbled together quences of the legislation, where trips one scheme, the tax commissioner has been given way are given the full diesel fuel rebate but very strong powers indeed because the only part of the trip coming the other way government knows that the arrangements that would be given such a rebate. This is a have been put in place through this legislation hastily cobbled together scheme. are wide open to rorting. I would like to commend the member for I draw the attention of the House to some Calare, representing a rural electorate, who of the provisions of the enforcement scheme spoke eloquently of the shortcomings in this that is being put in place through this legislalegislation and predicted-l believe quite tion. On production of an identity card to an accurately-that the Diesel Fuel Rebate occupier, authorised officers must be given Scheme will not reduce the cost of goods and entry at any reasonable time to land or premservices delivered in rural and regional areas ises where those officers have reason to very much, if at all. It is being hailed as a believe that there are documents, goods or great boost to rural and regional Australia, but any other property relevant to the operation of when you look at the impact of this so-called the act. The officers are to be given full reduction in the cost of diesel fuel and trans-",88,Atsic The Premier Organisation And Peak Nothing More The Cost On Average Of A
154,Mr Deputy Speaker,I am not I point to some of the anomalies that,89,Atsic The Premier Organisation And Peak Nothing More The Cost On Average Of A
