speakerGroups,speaker,theText,pageNumbers,title
124,Corruption Can Have On Our Society. For This Mr Crean (Hotham,"Deputy Leader ofpledge, as the fuel credit scheme that was disgrace because Labor and the public should announced by the government in fact retained have been entitled to have the opportunity to fuel excise. This meant no reduction in petrol dissect that bill and fully understand it before tax for ordinary motorists and an increase in it was dealt with in the House. Because of the the city-country price differential-a bad deal confusion surrounding the scheme, the for country Australia. But that is only the government could not give us details on it at beginning of it. the time. This is what happens when you rush things through-when you rush through what The government promised a whole package of measures on diesel which it has reneged has been a deal done on the run to secure a GST at any cost. on. This House recently dealt with legislation where the government was trying to renege on We remember Tim Fischer, the then Leader a deal cut with the Democrats to get the GST of the National Party and Deputy Prime through. The Prime Minister used the diesel Minister, saying to us, when we asked about fuel rebate in the forestry industry as a barthe further detail, 'Wait, it is all going to be gaining chip in order to fool the Democrats. explained in the explanatory memorandum.' He promised to cut the diesel fuel rebate to He said that everything would be revealed foresters to secure Democrat support for the therein. We waited for the explanatory memoGST, and now he has reneged on that deal. randum and it revealed that the government This legislation is one more step in the did not know what the scheme that they had government ratting on the promises it made agreed to was actually all about. The governto the road transport industry. ment wanted us to pass that legislation and The former Leader of the National Party then wait for months until they worked out promised that he would resign if he did not how it was to be applied through administradeliver the full diesel promise. The deal done tive arrangements. The truth is that we have with the Democrats ensured that he did not been cooperative as an opposition, and we deliver on that promise. He has since resigned want to try to end the confusion for the road for different reasons, but the truth is that, if transport industry. On that basis, we reluctanthe were true to his word, he should have done ly agreed to that approach, flawed as it was. it anyway. The current Leader of the National Tonight we have before us the next piece of Party also promised that he would resign if legislation, which is supposed to deal with the deal was not delivered. He has not rethese administrative issues-the issues that signed, but he has reneged on the deal as they said would be cleared up later. But what well. This Diesel and Alternative Fuels Grant do we find? We find that this legislation still Scheme came about because the deal with the does not end the confusion. Rather, it defers Democrats was unconstitutional. The deal was yet again the issue of the boundaries between so bad that it was against the Constitution-it the city and the country-the so-called urban was against the Constitution to divide the conurbation boundary lines. The defmition of nation into city and country regions and to those boundaries is critical because journeys impose differential tax regimes. That is how by vehicles, by trucks, wholly within the the government originally wanted to do it, but conurbation do not get the grant-they do not they could not. get the concession that now has to be given So we are left with this uncertainty surin a grant form. If they cross any part of the rounding the grant scheme. The government conurbation, they can-qualify for the whole of could not do what they wanted to do through the grant. If you understand that point, you the tax mechanism because of the differentiunderstand that the defmition of the conurbaation between rural and city, so they came up tion is actually critical. Without it, the scheme with this scheme. It is the second piece of is meaningless. Yet now the second piece of legislation concerning the diesel grant scheme. legislation is before us and we still do not The first piece was introduced at 9.30 one have the defmition of those boundaries. What night and debated at 9.30 the following incompetence-deals done on the run and still morning. That in itself was an absolute total uncertainty. Apart from the difficulty in the definitionthey are worried about what a nightmare they which we say is critical and which we say, are going to impose on the transport industry without it, is a meaningless proposal-it gets or they have no idea, in which case how can worse because the new scheme imposes a they seriously depend upon the rigour of the huge new compliance burden on transport figures associated with the Prime Minister's operators. It involves more paperwork, more press release? It is for these reasons that I record keeping requirements, more expense in move the second reading amendment which seeking professional advisers to navigate has been circulated in my name: through the red tape and the potential for That all words after ""That"" be omitted with a penalties if people make mistakes. So not view to substituting the following words: only do the small transport businesses have to ""whilst not declining to give the Bill a second contend with the GST compliance nightmare reading, the House condemns the Government for: and all of the compliance burden that that (1 ) continuing the uncertainty in the transport entails-which the Treasurer himself coined industry by not releasing the details of the as the nightmare on main street-but these boundaries of urban conurbations for the businesses get the double whammy because purposes of the Diesel and Alternative Fuels they get the next instalment: a nightmare on Grants Scheme (the Scheme); highway 1. (2) not disclosing, prior to the last election, the new powers being proposed for the CommisSince June, Labor has been asking: what are sioner of Taxation to stop, detain and search the areas that qualify for the grant and what vehicles; are the areas that do not? We have had many (3) imposing a complex neW layer of administraexamples raised in this House--questions tion on transport operators in connection with about where people can locate their transport the Scheme, in addition to the new compliance operations to take advantage of the scheme by burden associated with the Goods and Services operating just outside of the conurbation and Tax; and coming into the capital city. We are constant(4) its failure to disclose the basis of its claims ly told that it will be explained soon. Howthat the programs agreed with the Democrats will counter the greenhouse gas increasing ever, each time that has occurred, we find effects of the Scheme."" nothing but continued silence and a continued inability to answer from the government. Since June, in this House, we have asked repeated questions about how the nightmare Transport operators have the right to be will work. We never get any answers. All of able to plan their businesses with certainty. the transport operators who live and work This government is not giving them that around urban centres have a right to know certainty. They have a right to expect that whether they will qualify, yet they are being governments set out the rules simply and with kept in the dark. There is important new adequate time to prepare for them. It is now information in this bill but, as usual, there are more than four months since the dirty deal more questions posed than answered. was struck with the Democrats, yet we still do There are the record keeping requirements, not have the detail of the scheme----even for example. These impose the new red tape though it is a scheme that the government has for the grants. If you fail to satisfy the provicosted down to the last million dollars. How sions of clause 18, you do not qualify for any can the government do that, unless it has an grant. We now know that, but what we do not idea of what these boundaries are? know is what you have to do to satisfy the Either the government know exactly where clause. As usual, in this legislation the detail the boundaries are between those that get the is not specified but is deferred to a determinagrant and those that are discriminated against tion not yet issued by the tax commissioner. and they are not going to tell anyone, or they So we do not know what the record keeping still do not have any idea of what they have requirements are in order for people to qualify agreed with the Democrats and they have just for the grants. Qn top of that, we still do not made up the figures. Either they are hiding know which journeys will qualify for the the truth from the Australian people because grant. But there are new provisions which are visit for a reasonable time. According to complete. These are the new powers of the clause 47(2)(d), he has a right to inspect, diesel police. These are the new powers that examine, count, measure, weigh, gauge, test transport operators will now face. This bill or analyse any such goods or other property allows virtually unlimited access to premises. on those premises to that end and, to that end, It creates an offence if people do not comply take samples. exactly. But that is not all. This bill also What a lovely little piece of administration creates new powers for the tax commissioner this is. This is all about putting the diesel to stop vehicles and to search them. So this dipstick into place. We have got such a is legislation that sets up the diesel police. complicated system that, firstly, we do not First of all, we have the GST police. They know what the boundaries are and, secondly, are armed with the thermometers, going we have the diesel police not just with the around the food stalls determining, when food dipstick but with a search warrant going in goes from hot to cold, whether or not the and occupying the house and undertaking all GST applies. Now we are equipping the of this investigation. But don't worry about diesel police with the dipstick. There they will that, this is all part of this brave new world be, out on the pillbox on the border of the the Treasurer has talked about-you do not conurbation, dipstick in pocket, stopping the have to cook him dinner; you just let him run vehicle, sticking in this dipstick to work out through the house and check and assess what how much the vehicle has used coming across he wants. The government is providing itself the border. Not only will they have dipsticks with all these new powers. It is imposing new but they will have the power to search and requirements on transport operators, but it has seize. You would have to be a dipstick to not addressed any of the confusion it has introduce this proposal-that is the truth of it. caused with the deal done with the DemoThis is absolute madness. This is what hapcrats. pens when you cobble together something on Why did the Democrats insist upon this as the run. . part of the overall dirty deal? They claim that their motivation was the environment. Let us Truck drivers in Australia will now face have a brief look at the achievement on that. 'unprecedented intrusion in their businessesIn essence, we had the Treasurer admitting indeed, in their personal affairs. You can just that this was done because the Democrats: imagine the truck driver who has been on a long haul. He arrives home later than normal. .. .. wan-eto keep t?J?1es and emissions doin The wife is at the door. 'Hello dear. Why are capltaCIties, large CIties and large conurbatIOns. ?' H 'Th' .. That IS the agreement that we have reached to you so 1ate. e s-ys, e tax .commlsslOner. protect rural and regional Australia, help the was there on the hlghway. He Jumped out of trucking industry and reduce diesel excise. the pillbox and ordered my truck to be . . stopped and searched. I've just experienced That -s :what -e sald. on 31 May when he was the nightmare on highway l--one of many. expla-nmg thls deal m amongst the thermomFor the last few hours, they've tried hard to eters m chooks, the. packets of salad and a.ll work out what needs to be done. This is what of the other crazy thmgs that came out of thlS Labor warned would happen and the governdeal. ment said wouldn't.' The wife then looks But, if that is what the Democrats sought to behind him and says, 'You've brought someachieve, did they? They had an expert advisone home for dinner.' He says, 'Well, not er, a Dr Clive Hamilton, from the Australia exactly, but since the tax commissioner Institute advising them on this and other believes that there are some documents here environmental issues. He was their expert to relating to the diesel grants scheme he has help them through their considerations, their decided to enter the home and stay here for negotiations, their deliberations with the ""a reasonable time"".' The tax commissioner government on the GST. What did he do? He can do that because clause 47 of the bill examined what the government was offering enables him to. By the way, he does not just the Democrats-this incomplete legislation we now have before the House-and advised in terms of the grant involves significant them against it because it was a nonsense paperwork, significant policing and uncertainproposal in terms of protecting the environty about the boundaries in which they can ment and then he resigned when he saw that qualify. the Democrats were committed to it. It is against that background that I have Dr Hamilton is a man of integrity and he moved the second reading amendment. We refused to be associated with this dud deal. believe that this is another example which He knew that the Democrats were getting highlights the haste that was undertaken in conned by the government, and he tried to trying to implement and secure this deal. warn them. But they did not listen. They did There are many of those examples, and we not care. They were going to shaft the comhave used the House each time we have had munity with the GST and shaft the urban the legislation before us. There have already environment as well. Their theory was: don't been significant amendments to the original give the subsidy in the city because it will GST bills, and there are more to come. And encourage diesel and air pollution. You might there will continue to be more to come. This say on the face of it that is a worthy objecis not a simpler system. This bilI before us tive, but under the scheme the operator can today indicates the complexity that is going still get it in the city so long as they travel to be associated with this new tax regime. outside the conurbation. No wonder Dr This is something that the transport operaHamilton resigned. These are dills who tors are going to have to come to grips with negotiated this deal, either unwittingly or between now and when it is implemented in prepared to be conned. the middle of next year, but it is something The fact that the truck operators would also they have not been given any assistance, any face an administrative nightmare did not encouragement and any clarification on by the worry the Democrats either. So they did not government. We will continue to expose the succeed in their objective, which was supdeficiencies in the government's legislation. posed to be environmentally driven. In the We will continue to use the forms of the process, they have imposed an administrative House to try to ensure that these problems do and compliance nightmare on diesel truck in some way get mitigated, but the fundamenoperators operating in the transport industry tal point is that this is a bad deal for the on top of the compliance nightmare that they transport industry, just as the GST was a bad have given them with the GST and the deal deal for the Australian public. done on the GST. They were naive and they We will have many more opportunities to were gullible, but this is just the sort of highlight the deficiencies, but the Australian people that the Prime Minister likes to prey public should be very wary of what is in store on, and we have seen many examples of that. for them. At the moment the government But the truth of it is that the Australian believe this is off the agenda-that they have transport industry is now having to bear the got the deal through, it has been passed and cost of these compromises. It is the industry legislation is coming forward and people will that is going to have to deal with these be happy as it gets implemented. They will nightmares, this confusion and this intrusion. not be happy with the implementation, beAs well as copping the paperwork and uncercause once they understand what it involves, tainty, they now face unprecedented governhow it impacts upon them and how it adversement powers. This is not what they expected ly impacts upon them they will have a very when the government told them that they different view to the government's of the were going to introduce this brave new benefits of this legislation. taxation world. They were told that this would be a simpler system. They were told that this Adams}-Is the amendment seconded? would be a system that would give them does not give them benefits. The qualification and reserve my right to speak at a later time.",59,Atsic The Premier Organisation And Peak Nothing More The Cost On Average Of A
125,Mr Deputy Speaker (Hon. D.h.,,63,Atsic The Premier Organisation And Peak Nothing More The Cost On Average Of A
126,Benefits. This Is Not A Simpler System And This Mr Emerson,"I second the amendmentAustralians certainly will be pleased when the need to exert against those in whose markets Diesel and Alternative Fuels Grants Scheme we compete is not damaged by the incredible (Administration and Compliance) Bill 1999 distances that Australian producers have to comes into action next year. This is a farface--distances not only from farm or factory sighted meeting of Australia's vital needs in to waterside but from wharf to ultimate the expensive transportation of our goods destination. around the nation. Australia is two to three The legislation is simple because the grants times more reliant on its road transport sysscheme applies to vehicles with a gross mass tems than any other equivalent nation. In fact, of 20 tonnes or more and will require little information that has been given to me indirecord keeping of kilometres travelled, litres cates that the trucking industry slogan of used and receipts. So we remove with one 'Carrying the Nation' is not far wrong, and swift swipe all of those vehicles with a gross Australia has a dependency on road transport mass of 20 tonnes or more. Eligible fuel used which is three times the OECD average. So in vehicles between 4.5 and 20 tonnes outside everything that is done within this nationthe metropolitan area will not have complifrom our great farming enterprises to our cated record keeping processes either. So the factories, even to the point of transporting our nalTOW area where there is complexity to goods by sea to their ports of destination-is some degree is for those vehicles which have affected by fuels, and mainly diesel fuels. a mass of 4.5 to 20 tonnes which operate in This legislation that the House is debating and outside metropolitan areas. Extensive tonight is something that should have been records will be required for those vehicles. introduced into Australia many years ago. The There is no doubt about that. It is not the Diesel and Alternative Fuels Grant Scheme is government's wish or the government's a program which covers not only diesel fuel intention. The member for Dickson may well but other fuels as well, such as compressed smile. She might have been part of the pronatural gas, liquefied petroleum gas, recycled cess if she had not been here. The fact of the waste oil, ethanol, canola oil and other prematter is that for that narrow area there is scribed fuels. These fuels are all prescribed in increased complexity, and more extensive the act as a way of reducing costs and making record keeping will be required. our nation more efficient in what we do. The scheme applies not only to the moveThe advantages of reducing the price of ment of freight and goods-the products of fuels-because that, in fact, is what this our farms and factories-but also to the legislation does-apply to rail as much as to movement of people. The Bus and Coach road. Whilst the opposition would want to Association have committed themselves muddy the waters and make it appear that this tonight to an extensive program of cooperatis a difficult to administer piece of legislation ing with the greenhouse challenge that conand that there will be chaos in the streets, fronts Australia and the commitments that the what they will find as it comes into action is Australian government has made. They that for the majority of those in the transport happen to be here this night for this very industry it will be quite simple. Far from important occasion. But every bus and coach being a heavy-handed process of surveillance operating in an urban area will also, if they and supervision, this is nothing more than are between that 4.5 and 20 tonnes in weight, what goes on now with checking weights and have the complexity of record keeping and a lengths of road transport units-something disadvantage compared with fleet or motor that is done every day in every state of vehicle owners. Australia. Sitting suspended from 6.30 p.m. to I want to commend the government for 8.00 p.m. make massive differences to costs, which will tonight the Diesel and Alternative Fuels have the effect of bringing the nation closer Grants Scheme (Administration and Compli-",63,Atsic The Premier Organisation And Peak Nothing More The Cost On Average Of A
127,Mr Cadman (Mitchell) (6.22 P.m.),together so that the competitive force that we,64,Atsic The Premier Organisation And Peak Nothing More The Cost On Average Of A
