speakerGroups,speaker,theText,pageNumbers,title
0,"Tuesday, 12 October 1999 Quite A Long Period Of Time, Developed A Strategy To Achieve A Smooth Transition Of The Timor Gap Treaty From Indonesia To East Chair At 2.00 P.m., And Read Prayers. Key State And Territory Governments In This Country As Well As With Industry. Before 30 August, The Date Of The Ballot, The Minister) (2.01 P.m.)","Mr Speaker, the with key international players and not just Minister for Defence will be absent from with the East Timorese. The exact date on question time today, and questions relating to which I discussed the treaty with Xanana defence matters should be directed to the Gusmao was 25 February. We did not think Assistant Minister for Defence, the Minister it was appropriate to discuss the issue too for Veterans' Affairs and, in relation to other publicly and too openly before the 30 August matters for which he takes questions in this ballot, because obviously that would have preplace, questions should be directed to the empted the outcome of the ballot and we did Minister for Sport and Tourism. not want to give the public impression of any would go. Since 30 August, the government Timor Gap Treaty: Interim has been implementing its transition strategy, Arrangements including through talks with the United is to the Minister for Foreign Affairs. Given tives. My officials have discussed it with Jose Indonesia's imminent revocation of control Ramos Horta and, just last week, with Mr over East Timor, what interim arrangements Mari Alkatiri, who is a senior CNRT official does Australia propose for the Timor Gap whom the honourable member may have met. Zone of Cooperation to ensure that the ElangHe is also an energy expert for the CNRT and Kakatua oilfield continues production and that has confirmed to officials a desire to move the $2.1 billion Bayu-Undan liquids and gas forward on future treaty arrangements. We see project proceeds as planned? Are you aware this as consistent with an early and smooth of the recent statement of the Indonesian transition providing a solid basis for conMinister for Mines and Energy that Indonesia tinued long-term investment in the Timor will formally revoke the Timor Gap Treaty Gap. Some adjustments will have to be made and, in doing so, presumably shut down the to the treaty, of course-primarily in the Australia-Indonesia Joint Authority for the arrangements for the joint authority, which the Zone of Cooperation? Is it not also the case honourable member referred to in his questhat the Indonesian technical director of the tion. It is the joint authority which manages joint authority has declared Indonesia may the rights and responsibilities under the treaty well assert a continuing claim to parts of the on a day-to-day basis. Timor Gap? What action has the government In any case, I can report to the honourable taken to clarify Indonesia's intentions and to member and to the House that we are happy discourage disputation which may jeopardise with the way the discussions are proceeding. the project and this substantial future revenue We think that the Indonesian government will source for East Timor? be very cooperative in the process of transiable member for his question and for raising and have been right from my meeting with this important issue. When I first met Xanana Xanana Gusmao on 25 February-from the Gusmao and some of the East Timorese way East Timorese as well. So we do not foresee back early this year, this was, even then, one any significant difficulties, but obviously there of the issues on our agenda; so I want to will be the sorts of transitional issues that the make it clear that the government has, over honourable member alluded to that will have",13,Setup
1,Mr Speaker ( Mr Neil Andrew) Took The Timor,"in consultation with, of course, the",13,Questions Without Notice Expectation Of How We Thought The Ballot
2,Mr Howard (Bennelong,Prime government informally discussed the issue,13,Questions Without Notice Expectation Of How We Thought The Ballot
3,Mr Brereton (2.01 P.m.),My question Nations and the East Timorese representa,13,Questions Without Notice Expectation Of How We Thought The Ballot
4,Mr Downer,"First, I thank the honourtion. Equally, all the signs are very positiveto be concluded. I might just make one other remote areas during the wet season and point as well. After the MPR has passed its continued support for air and sea transport vote East Timor will move to be a United services between Darwin and East Timor Nations territory and so we have been diswhich back up the ongoing relief effort. cussing this issue with the United Nations in As I said at the beginning, we are very particular because it is they who will have to concerned about the humanitarian situation in administer the treaty as well in the interim West Timor as well. We do welcome the period. recent repatriation flights from West Timor as East and West Timor: Displaced Persons a first step, but we continue to encourage the Indonesian government to permit voluntary is also addressed to the Minister for Foreign cing today, $2 million will be directed to Affairs. Would the minister inform the House displaced people in West Timor, including of the Australian government's efforts to funding for United Nations High Commission assist internally displaced people in both East for Refugees repatriation programs. It will and West Timor? provide for basic needs of displaced persons member for Menzies for his question and for West Timor until they are able to return to his interest. Members of the House :will be their homes. The task of recovery for these aware that there are a very large number of people will be difficult. The government calls displaced East Timorese in both East and on the international community to join with West Timor. The United Nations High ComAustralia in helping these people. But we are missioner for Refugees estimates that somedetermined to provide practical and effective where between 150,000 and 230,000 disassistance to the East Timorese people. placed people are in West Timor. While it is difficult to quantify, there are reports of Business Tax Reform: Trusts within East Timor itself. to the Treasurer. I ask whether he has seen Today the government is announcing a $6 the recent comments of small business million package of additional assistance to spokesman Rob Bastion: displaced East Timorese people. We are very We're most concerned about the proposal to tax concerned about the conditions of these trusts as companies. But that's not set to come in people-in particular, leading up to the wet until 2001, so we have time to lobby the government to try and change that. season, which is about to begin. So this assistance will address some of those issues. Treasurer, given that you have already put We are providing emergency shelter materials. this measure off for a year, costing up to Family kits will be provided, which will $900 million, will you guarantee not to water comprise items such as plastic sheeting, it down further? containers. There will be enough kits to part of the question is no. In relation to the provide basic shelter for around 18,000 second part of the question, this was the people. We are also ready to assist those who government that came up with the policy of have the capacity to begin to support their entity taxation. We remain committed to own food needs. Now is a very low point in introducing it. Needless to say, I would point the agricultural cycle. We will be providing out that in 13 years of government the Aus30,000 seed and tool packs through Australian tralian Labor Party showed not one whit of non-government organisations. The governinterest in this subject-not one whit of ment will provide funding and logistical interest. As per usual, it took the coalition to support to help the United Nations World deal with the legacies of Labor failure and Food Program activities-and that includes mismanagement. The Labor Party. only ever purchasing 10 four-wheel drive trucks to got interested when it had the capacity to do allow the delivery of relief assistance to nothing. When it had the capacity to do",13,Questions Without Notice Expectation Of How We Thought The Ballot
5,Mr Andrews (2.06 P.m.},My question repatriation. Of this package we are announ,14,Questions Without Notice Expectation Of How We Thought The Ballot
6,Mr Downer,I thank the honourable living in camps or within host communities in,14,Questions Without Notice Expectation Of How We Thought The Ballot
7,"Around 200,000 East Timorese Displaced Mr Crean (2.09 P.m.)",My question is,14,Questions Without Notice Expectation Of How We Thought The Ballot
8,"Timber And Tools, As Well As Soap And Water Mr Costello","The answer to the firstsomething, it showed not one whit of interest. selling the property to go into town on retireIt got interested in this issue only once the ment-under the coalition proposal, which the capacity to do anything about it had comLabor Party will not support, the sale of that pletely gone from it after 13 years. asset will be capital gains tax free. And won't that be great news for the farmers of AustralBusiness Tax Reform: Capital Gains ia! In addition to that, as a result of the is addressed to the Treasurer. Treasurer, per cent of Australians directly own shares. In would you infonn the House of the benefits the sale of the first tranche of Telstra, 560,000 for small business, farmers and families Australians purchased shares. I believe that in flowing from reductions in capital gains tax? relation to that first tranche something like 75 per cent of Telstra employees took up shares. member for Kooyong for his question. Like The Labor Party wants to tax them on the other members of the Liberal and National gain at 48c-Telstra employees taxed at 48c parties, he will be very interested in the on the Telstra shares they took out. benefits to small business from cutting capital gains tax. On this side of the House, where Thirty-one per cent of Australians now there is a deep commitment to the small owning shares need to know this: the Labor business community of Australia, we make no Party wants to tax them at full marginal rates apology for cutting Labor's capital gains tax on the gains on those shares. The Labor Party, on small business. Labor was the party that first having tried to prevent them taking up introduced capital gains tax-some of the shares, now wants to tax them for the privihighest capital gains taxes in the developed lege of having taken them up-modem world-and it appears that Labor is going to socialism in the hands of the Labor Party: fight to retain them. first of all, try to prevent them getting a saving and, if they manage to slip through the On this side of the House we have annet, try and tax the saving at rates of 48 per nounced real provisions to help small busicent. On this side of the House, we have a ness. The first thing we say for small business policy to encourage share ownership. We people is that when they sell their businesscongratulate those Telstra employees who in which they have wrapped up all of their have taken out shares and we think they life, all of their savings and all of their deserve tax relief on their savings. This is the work--only 50 per cent of the assets of that side of the House that wants to deliver benbusiness will be taxable. That is an extension efits to the Telstra employees and to the to the small business owners of this country. millions of Australians that now have shares In addition to that, for the 50 per cent that in Australian companies. will be taxable, the government intend to introduce a 50 per cent disregard in relation Business Tax Reform: Charities Labor Party to announce their position as they again to the Treasurer. Treasurer, given your desperately search around for a policy on this insistence that Ralph's findings be accepted issue, but it appears that, as on most occaat face value, do you accept his finding that sions, because they are unable to articulate a your crackdown on the fringe benefits tax policy, they will say, 'No, no, no. Vote no, exemption for charities is flawed because, no, no,' and oppose any reform. rather than save over $200 million per year, The small business people of Australia will it will actually cause a significant loss to be interested to know that Labor supports revenue? Treasurer, are you relaxed about this higher taxes on their business. The coalition revenue loss or are you prepared to consider wants to cut the capital gains on the small an alternative? tion to that, if they hold an asset for 15 years findings, he said that you should not have any and they are retiring-a fanner, for example, exemption for charities. The government has",14,Questions Without Notice Expectation Of How We Thought The Ballot
9,Mr Georgiou (2.11 P.m.},"My question government's share ownership proposals, 32",15,Questions Without Notice Expectation Of How We Thought The Ballot
10,Mr Costello,I thank the honourable These are Telstra employees who own shares.,15,Questions Without Notice Expectation Of How We Thought The Ballot
11,"To The Gain. We Are Waiting, Of Course, For The Mr Crean (2.15 P.m.}",My question is,15,Questions Without Notice Expectation Of How We Thought The Ballot
12,Businesses And Farmers Of Australia. In Addi,"Mr COSTELLO-As I recall the Ralpha provision for $17,000, grossed up value, going to drive the Toorak tractors off the being exempt for charities. I make the point road, the Labor Party said: to the charities that it excludes all of the A Labor government will reform the fringe benefits things that are not subj ect to FBT in the first tax to limit the value of FBT benefits that can be place-it does not apply to their computers, provided by certain institutions which enjoy or their laptop computers, or their briefcases concessional FBT treatment to $17,000 of grossed or their airline memberships. All of the up benefit. excluded benefits are not taken into account So he walks to the dispatch box to query his in relation to that $17,000. It means that own policy. Bring back Gareth! charities can still give a car, completely taxa policy of a grossed up value of $17,000. cluded his answer; the Deputy Leader of the should not have any exemption and that, if Rural and Regional Australia: New you wanted to help charities, you should Apprenticeships Program Ralph said. is addressed to the Minister for Education, is that the government has a more generous been made with the government's new aptreatment than is recommended by Ralph. prenticeships initiative in rural and regional From the interjections of the member for Australia? Is the minister aware of any alterHotham, I take it he disagrees with the native approaches? him the opportunity to answerLongman for his question and I acknowledge have ever known him to be silent in the opportunities leading on to real jobs. Earlier House of Representatives: you ask him what this year, I announced the rural and regional his policy is and you stop the interjections, new apprenticeships initiative, which delivMr Speaker. ered on the government's commitment to provide a much-needed boost to training and floor. The Treasurer knows that he is not free initiative provided an additional $1,000 to invite the Deputy Leader of the Opposition payment to employers of new apprentices in to respond to questions. I invite him to reoccupations where there were skill shortages. spond to the question he was asked. I am pleased to inform the House that followParty will oppose this policy, as they oppose new apprenticeship numbers in rural and all policies. Just before they make a formal regional Australia. Between January and June announcement opposing the government's of this year, there have been over 6,400 new policy on this, and hold out to the charities apprenticeship registrations in occupations their opposition to it, let me say that I went eligible for the rural and regional new apprenback and got the Labor Party policy in the ticeship incentive payment. That is a 14 per last election. Right after the part where they cent increase on the number of registrations promise to increase capital gains tax on preover the same period in 1998. The govern1985 assets, and right after the part where the ment expects that some 30,000 new apprenmember for Hotham promised to put higher tices over a five-year period will benefit from taxes on four-wheel drives, because he was this initiative.",15,Questions Without Notice Expectation Of How We Thought The Ballot
13,"Free, Plus About Another $1,000 Of Benefits. Mr Crean",Mr Speaker,16,Questions Without Notice Expectation Of How We Thought The Ballot
14,Mr Ralph Said Nothing. The Government Has Mr Speaker,The Treasurer has con,16,Questions Without Notice Expectation Of How We Thought The Ballot
15,Mr Crean,He did actually say something. Opposition will resume his seat.,16,Questions Without Notice Expectation Of How We Thought The Ballot
16,Mr Costello,Mr Ralph said they,16,Questions Without Notice Expectation Of How We Thought The Ballot
17,Instead Send Them Grants. That Is What Mr Mr Brough (2.20 P.m.),My question,16,Questions Without Notice Expectation Of How We Thought The Ballot
18,Mr Crean,OhlI see. Training and Youth Affairs. Would the,16,Questions Without Notice Expectation Of How We Thought The Ballot
19,Mr Costello,The point I am making minister advise the House what progress has,16,Questions Without Notice Expectation Of How We Thought The Ballot
20,"Governments' Policy. Mr Speaker, I Am Giving Dr Kemp",I thank the member for,16,Questions Without Notice Expectation Of How We Thought The Ballot
21,Mr Speaker,The Treasurer knowshis deep interest in providing young people in,16,Questions Without Notice Expectation Of How We Thought The Ballot
22,Mr Costello,This is the first time. I his electorate with good-quality training,16,Questions Without Notice Expectation Of How We Thought The Ballot
23,Mr Speaker,"Treasurer, I have the jobs in rural and regional Australia. This",16,Questions Without Notice Expectation Of How We Thought The Ballot
24,Mr Costello,"I assume that the Labor ing this initiative there has been a boost ofWhile the government is expanding job Republic Referendum: Proposed Model opportunities and quality training for young other side of the House. I was asked whether to the Prime Minister. Prime Minister, given I was aware of alternative policies. We saw your undertaking at the 1998 Constitutional what the member for Batman put forward Convention that, should it fail to express a when he was in the shadow portfolio--not a clear view on a preferred republic model, the single question or issue raised in this House people would be asked to vote in a plebiscite during question time since the election. Of on alternatives, and given that less than half course, that is what we would expect from the the delegates at that convention supported the member for Batman, a failed ACro president. parliamentary appointment model, why was They still have not got over the disappointno plebiscite held? Why is this unpopular ment at the failure of their attempt to wreck model now being put to referendum at great the apprenticeship system. The record of the expense? With opinion polls consistently member for Batman presents a challenge to showing that about 70 per cent of people the member for Dickson. She is known for want a directly elected President model, her lack of portfolio activity but it is very where will you take the republic issue if the hard to believe that she will not be tempted proposed model is rejected on 6 November? at some time to ask a question in this House. Her first press release confirmed that she is will be aware of the history of this matter going to follow in the footsteps of the memthat: before the 1996 election I undertook ber for Batman. She did not mention apprenthat, if the coalition won, we would hold a ticeships or training when she took on the Constitutional Convention. We delivered on portfolio. It was apparently beneath her that commitment. I was a participant in that notice. When she was interviewed on the convention, along with many others in this Sunday program, she was actually quite chamber. The announcement I made at the explicit about the strategy that she intends to end of the convention that we would put the pursue. She said: model that received clear support at that convention to the Australian people was I think that there are some rules that seem to greeted with widespread support, including operate when I open my mouth. from the leaders of the Australian Republican The reporter said: 'Yeah.' The member for Movement, the Leader of the Opposition and Dickson went on to say: the Leader of the Opposition in the Senate. I say with great respect to the member that any I'll just have to keep my mouth closed. attempt now, months after that event, to pretend that at the time what I announced the So there we have a declaration of intent that government were going to do was not in there will be no policy from the member for accordance with the wishes of the convention Dickson on apprenticeships and quality is completely wrong. This is a matter on training. Vocational education and training is which the government parties are allowed a vital to Australia's future. This Howard free vote. I do not intend to pass any comgovernment has breathed new life into the ment on the merits of the arguments for or apprenticeship system. We have rebuilt the against the question because I do not believe, apprenticeship system after Labor put the given the free vote stance of the government, ACTU in charge and very nearly wrecked it. question time is an appropriate forum to do Now we are increasing opportunities for that, but I will talk on process. I would quality training for young people in regional remind the member for Calare that at every and rural Australia, and on the other side of stage I and the government have been totally the House there is nothing but a crashing candid with the Australian people. policy vacuum which reflects the lack of Opposition. what you've been.",16,Questions Without Notice Expectation Of How We Thought The Ballot
25,"Australians, There Is A Deathly Silence On The Mr Andren (2.24 P.m.)",My question is,17,Questions Without Notice Expectation Of How We Thought The Ballot
26,Mr Howard,The member for Calare,17,Questions Without Notice Expectation Of How We Thought The Ballot
