speakerGroups,speaker,theText,pageNumbers,title
134,Mr Crean (Hotham,"Minister for compared to 13 per cent when Labor were in the debt truck into a B-double. Yes, there has nine months: the one from Chile, one of the been failure on the trade front but it is all most comprehensivesounds like failure to me, shadow minister, and I think you ought to be honest about gument that they would have done it had where the failings have occurred. they been there. This is a government that The other point I would make, by way of did not have the will or the wit to negotiate comparison, is this: in the 12 years that your the basis upon which this proceeded. I tell party was in office, net exports contributed to you this, Mr Deputy Speaker: the AANZFTA economic growth in only two of those years; involved really hard negotiations and politiyet, when Labor was in office for the 13 cal will. years previously, net exports contributed to economic growth in 10 of those 13 years. there! That is why we have to ensure that our tradtributor to economic growth. We have to enthere. This country was fortunate that we did sure that the Australian economy sustains not have the trade minister from the other itself beyond the resources boom. That is side there. The trade ministers from the other why we not only campaigned for but also side, up until the present shadow minister, have proceeded to implement what we have had always come from the National Party-a referred to as the twin pillars approach-a declining party, a party that the electorate is new approach to trade policy to turn around turning against, a party whose preoccupation the sclerotic, appalling performance by the is with agriculture, and broad agriculture at previous government. They did not just be that. We say that the trade interests of this queath us a high-inflation economy to deal country require a diversified approach to with; they bequeathed us a pathetic tradetrade policy, one that recognises the imporperforming economy. Thank you very much. tance of agriculture, of resources, of manuThat is the extent of their failure. As for the factures, of services and of investment flows. twin pillars, I will take the minister through That is what we will do; it is what they never where we have redirected and recalibrated did. As I was saying, in nine months we have trade policy to start turning it around: trade concluded two free trade agreements. We liberalisation at the border complemented by have unfrozen the stalled talks with China economic trade reform behind the border. after the previous geniuses went into the neWhy is that? Because there is not much point gotiations with China and gave them what opening up markets if the economy is not they wanted without getting anything in recompetitive enough or productive enough to turn. They gave China market economy take advantage of those openings. That is status and got nothing in return. They were why we have persisted in the market access inept negotiators. We have unfrozen those opportunities. talks. There still has to be some hard bargaining, but the commitment that we have Let us go to some of these trade questions. made to these negotiations with China has The shadow minister says we have not paid produced far more significant results than any attention to bilateral trade agreements. anything the previous government delivered. That is just plain wrong. His was a governLikewise, we have an agreement to bring ment that in 12 years produced three free trade agreements. We have produced two in",51,Matters Of Public Importance Has Been More A Haphazard Collection Of
135,Sheeted Home To That Government. That Opposition Members Interjecting,,52,Matters Of Public Importance Has Been More A Haphazard Collection Of
136,Mr Crean,Do not listen to their ar,52,Matters Of Public Importance Has Been More A Haphazard Collection Of
137,Mr Robert,We were lucky you were,52,Matters Of Public Importance Has Been More A Haphazard Collection Of
138,Ing Sector Again Becomes A Net Positive Con,"Mr CREAN-You were lucky I wasforward the conclusion of the feasibility even if we succeed. If we do get an outcome, study with India. it will provide a very important platform for It is true that theirs was a government that the regional trade negotiations and for our started a lot of things, but it could never sucongoing bilateral trade negotiations. We cessfully complete many of them. Doha is a never gave up on the importance of regional classic example. This government had caror bilateral negotiations. We simply said you riage of Doha from beginning to end and was had to recalibrate the focus-you had to start never able to get anywhere. Again, in the from the top down with the multilateral apnine months that we have been in office, we proach and keep building the platforms to have kick-started those talks and we have got argue for greater liberalisation and greater Doha to the position of being 80 per cent implementation, and that is what we have agreed on. The problem with Doha is that 80 done with AANZFTA. per cent, not being 100 per cent, will not AANZFTA, the ASEAN free trade agreeconclude it at this point, but the fact is that ment, is the most comprehensive free trade there are significant gains already on the taagreement that ASEAN has ever entered into ble, including for agriculture. If you do not and the largest free trade agreement that this believe me, speak to the NFF. Talk to them country has ever entered into, with $71 bilabout how we were instrumental in the negolion in two-way trade and a bigger market tiations in Geneva in the middle of the year. than China, Japan and the US. We have Why? Because we were prepared to put the brought the previous timetable for trade libhard yards in. We were not prepared to just eralisation forward significantly. We will make speeches about these things. We were also do it with PACER, the Pacific Agreeprepared to roll up our sleeves, to get inment on Closer Economic Relations-we are volved in the negotiations and, most imporembarking on a strategy to develop thattantly, to understand what negotiation is and the ASEAN+6 set of negotiations, as about. well as APEC. And those opposite say we I have not given up on Doha even though have not got a trade strategy. I will tell you the other side had. I believe that the other what we got-we got left with a terrible side had given up a long time ago. I rememmess. We have set about, in a short space of ber a very senior member of the National time, putting this in the right direction. In my Party-I will not name that person in this view, if we persist with this approach, we House-said to me, ‘You will never get will make significant gains. Doha up,’ when we were walking through As for the question of the Mortimer rethis building on the day we were sworn in. port, we will release it-of course we will That was the attitude of the previous govrelease it. I always intended to release it. But ernment, the political party that had carriage I will tell you what we commissioned of our trade negotiations-they had given up Mortimer for. It was to ask this fundamental on Doha. This government will not give up question: why was it that Labor was able to on Doha. This government will persist beget the trade performance right in this councause, by far, the biggest opportunity for this try during its term of office and the coalition country will come from a successful concluwere not, and what do we need to do in terms sion to the Doha Round. of the detail and the changing nature of trade It is not only Doha that we are engaged in. to get it right? One of the things I already Doha is not as ambitious as we would like, know the previous government failed to do was to understand the single most important development in terms of services as a basis about correcting it but we should not have to for growing our export base. Services in this pay for their past sins. (Time expired) base and yet they are only 23 per cent of our matter of public importance has been raised exports. When I talk services I also mean in order to focus on the need to create cerservices that relate to our traditional industainty for Australian exporters, which is tries, like agriculture and resources. I am not where the Minister for Trade finished off in arguing that we move away from them; I am his discussion about investment and capital arguing that we do more with them, that we flows. Taking risks in the ruthless export do not just value-add them but understand arena requires considerable courage by exthe intrinsic opportunity there is, with the porters and a long-term strategy. Often forstrength we have in those sectors, to sell the ward investment is actually years ahead of services and the value-added products-not the final outcome and exporters need the just the bulk commodities. I argued that and confidence that they have a government that implemented it when I was previously priis thinking strategically in the long term of mary industries minister. I believe in it and I their interests. want to do it again. But that is something the The minister’s cynical contribution about previous government never did. the need for this MPI is very unfair to exThe other thing that it failed to do was unporters. I would remind the minister that it derstand the difference of approach now in was his Prime Minister in opposition who terms of the significance of capital flows and said Doha was as dead as a dodo. I have the importance of investment and ensuring never believed that, like the exporting that our trade policy picks up the very sighorticulturalists that I represent. We must nificant realisation that a lot of our exports ultimately get an outcome. No-one has unare based on investment in other countries. derestimated the difficulty of doing that, parWe need the coordination of that mechanism. ticularly in a US election year, with the need That is why Invest Australia’s global opporto get the US and the EU over the line in tunities programs have been properly coordirespect of those distorting subsidies they nated for the first time and put into the one have, for agriculture in particular. portfolio. Exporters need to believe there is a longAs for the opposition’s argument about term commitment to decision making that the EMDGS, we have put $50 million extra will support them in the future. From my into it. This is something that they were discussion with exporters, I know they are never prepared to do. They changed the not confident that they are getting that from guidelines by saying that they recognised this government. Let’s start with the May that they needed to support exporters more, budget, which saw the slashing of $100 milbut they did not put one red cent into it. They lion from DFAT in the resourcing of trade were the ones that deceived the exporters of negotiators. This has resulted in the axing of this country and now they want us to pay for important negotiator posts. There are probatheir mess. WellI tell you what, Mr Deputy bly about 100 positions so affected, which Speaker: we will ensure that the EMDG will in particular be a setback for important Scheme is properly funded into the future. negotiations on proposed FTAs with China What we will not do is pay for their ineptiand Japan. tude and their sclerotic performance. We are",52,Matters Of Public Importance Has Been More A Haphazard Collection Of
139,Economy Are 80 Per Cent Of Our Economic Mr Forrest (Mallee) (4.41 Pm),"ThisThen there has been the deliberate policy have to make? Hopefully, when this report decision by the new government to merge from Mortimer is tabled-I hope it is soon, the functions of Invest Australia into AusMinister-we will get some indication of the trade, presumably because the minister failed advice the government is receiving. against the razor gangs. This is because of In addition to all this, the government has short-sighted budget considerations rather told India we do not trust them with the use than strategic ones. The end result of this of our uranium for power generation, despite will be to put back progress in establishing an agreement on that matter being well prostrong networks for export investment and to gressed. As well as further reducing Austraforce such progress as could have been lia’s capacity to enhance its trade position in achieved back to the slow snail’s pace we see a significant commodity, it also reduces Inin the diplomatic sector, rather than having a dia’s capacity to contribute to its emission commercial focus. Exporters need an entity reductions in the global interest. To digress which has a commercial focus rather than a slightly, it is worth noting that this initiabureaucratic one. This decision is typical of tive-this one deal-on its own would satthe Australian Labor Party, who are not able isfy Australia’s entire carbon emission to think in a commercial sense because they abatement requirement in a global context. do not have a background in it. The government has truncated that opportuThen there was the failure of the Minister nity. for Trade, the member for Hotham, to stand To go back to the issue of trade certainty: up to that razor gang in those important of alarming proportions has been the swaybudget funding considerations. Exporters out ing reed-in-the-wind position that the ministhere see all this. Their confidence is falterter has had on the primacy of pursuing multiing, and that will have long-term implicalateral, as opposed to bilateral, approaches to tions for our export effort. We have heard the trade. In the early part of his management of minister boast lyrically-and he has done it this portfolio, we heard a lot about multilatagain today-about the one-off allocation of erals being the be-all and end-all, which we $50 million for EMDG in the 2009-10 year. were not surprised at because we know about On behalf of exporters, thank you for that. the Australian Labor Party’s philosophy on Presumably this whole boast is to distract that matter. They argue that that is in the best from his long-term failure to provide that interests of everybody, particularly poorer certainty that exporters need. He fails to excountries, but with no progress multilaterals plain that this one-off increase in EMDG are worth nothing to exporters. That brings applies only to expenses incurred in the me to the point that the coalition government 2008-09 financial year. It begs the question adopted of not giving up on Doha, as the about the expenses incurred this financial minister alleged, but recognising the difficulyear. The member for Groom has pointed out ties and, in the interests particularly of agrithe implications of that. That needed a reacculturalists and horticulturalists, which I reption as this program continued to grow. resent, creating an opportunity for progress The government has failed to deliver longon their behalf, continuing to work in the term certainty. There are no forward estiglobal arena to get an outcome and removing mates in the budget for 2010-11 or 2011-12, those unfair export distortion subsidies by so where is the opportunity for exporters to the EU and the US in particular. have some certainty that they will get some help with the important investments they Australian agriculturalists are absolutely that they have to plan for. If they falter beimpatient for that elusive breakthrough, but it cause the government is in itself faltering has been pretty hard to get a bead on the and not progressing matters, then I think the minister on this issue. To listen to him wax long-term implications for Australian exportlyrically about the free trade agreement with ers will be dire and will have a negative imChile-which, as a government member, I pact on our overall effort to improve our took a very specific interest in because it trade performance, particularly in exports. involved trading in seasonal fresh fruit and Let us see what Mortimer has to say, Minisinvolved an enormous amount of work ter. Get it out in the public arena as quick as which could not be negotiated in the short you can; but, more important than that, show space of nine months-the way he took some progress on whatever Professor credit, and the way he boasted about the proMortimer recommends. new recognition of the need for bilaterals, Secretary for Defence Procurement) (4.51 beggars belief. pm)-This is certainly a difficult debate to The minister made much of the fact that argue for the members for Groom and the previous government had not made proMallee, given the Howard government’s exgress on this matter. There were trade agreeport performance. I feel for them. I thought ments with the US, Thailand, Singapore while the Minister for Trade was speaking and-almost-Chile. Prior to that, the coaliearlier that I have known him for 23 years. tion government delivered on the deal that Given his breadth of experience, committhe government from before 1996 had with ment, skills and knowledge of industry, it is New Zealand. We delivered on that and did difficult to conceive of someone better posinot complain about it. I must check the retioned to serve as Minister for Trade in this cord-we probably gave the Keating govgovernment and for this country. ernment some recognition for the work they The minister has already correctly identidid on the trans-Tasman arrangements. The fied the hypocrisy that underpins the matter previous government had long-term negotiaof public importance proposed by the memtions with China, Japan, Malaysiaber for Groom. He has also discussed the two Malaysia alone is worth $1.9 billion to this pillars that are driving the Rudd governcountry-and the Gulf states in the Gulf Coment’s approach to trade policy. As he identioperation Council, which are a very imporfied, the first pillar is trade reform at the bortant market opportunity for Australian-built der by multilateral and bilateral mechanisms motor vehicles. to increase market access. The second pillar It is interesting that, of all the 151 counis promoting reform within our own econtries of the WTO-which has been growing omy to improve infrastructure, to boost prodramatically, particularly in the last decductivity, to lift innovation and to drive naade-the only country not negotiating FTAs tional competitiveness. The challenges that is Mongolia. Everybody else has recognised we face in boosting our exports demand that the need to make those bilateral arrangewe lift competitiveness across our economy. ments. A lot of them wait impatiently for I am adopting these two pillars in my own progress, particularly through Doha. I comportfolio responsibilities in defence proplete my contribution by reminding the mincurement, with a strong focus on improving ister of the absolute need for certainty for defence export performance, but I will come investors. These are long-term capital flows to that issue in due course.",54,Matters Of Public Importance Has Been More A Haphazard Collection Of
