speakerGroups,speaker,theText,pageNumbers,title
0,,"---Opposition for his question. Today both the took the chair at 2 pm and read prayers. with the Secretary to the Treasury and the Governor of the Reserve Bank on developovernight and in fact on developments in the Opposition) (2.01 pm)Mr Speaker, on member will be aware, with the developindulgence, at a meeting of the parliamentary ments yesterday in the United States, LehLiberal Party this morning, I was elected man Brothers, formerly the fourth-largest US leader. The member for Curtin will continue investment bank, has now filed for bankas the Deputy Leader of the Liberal Party, ruptcy. This is the largest single filing for and I will advise the House of changes to the bankruptcy in US history. Secondly, with the opposition front bench in due course. Bank of America agreeing to purchase (2.01 pm)Mr Speaker, on indulgence, can I also of the world’s largest brokerage firm in extend on behalf of the parliamentary Labor an all-stock deal worth some US$50 billion. Party and the government our congratulaIn response to these events, US stocks fell tions to the member for Wentworth on being significantly overnight, with the Dow Jones elected as head of the Liberal Party and as industrial average recording its largest drop Leader of the Opposition. It is a rare privisince the aftermath of the September 11 atlege to be elected as the leader of one of tacks in 2001. Australia’s leading political parties and it is a The honourable member asks about congreat honour which has been accorded you. crete measures. The global financial crisis We on our side of the House look forward to has been unfolding since August last year, working with the opposition and with you as and what the government has done since takmuch as is possible in this great and robust ing office in November last year, attendant democracy of ours on a bipartisan basis. I am on the advice provided to us by the Treasury fully mindful of the fact that there are a few and others, has been to take a series of decithings we will probably disagree on. I say to sions to strengthen our financial system. the member for Bradfield how much we have First, in terms of the particular recommendaappreciated his services as Leader of the Options of the Financial Stability Forum, which position during the year, and we wish both is a body involving a number of other leadhim and his family all the very best. ing economies on which Australia has been Economy business of encouraging the full implementation of its recommendations across the global financial community. At the core of this lie tion is addressed to the Prime Minister. What the recommendations concerning transparconcrete action is the Prime Minister now ency, because transparency concerns, which taking to further strengthen the Australian have been evidenced in the various financial economy, in particular the financial sector, in instruments used by US investment banks in response to the bankruptcy of Lehman particular, have in part gone to the heart of Brothers investment bank? the problem. The second concrete action we",17,Setup
1,"Tuesday, 16 September 2008 Mr Rudd",I thank the Leader of the,17,Questions Without Notice Represented Now For Some Time We Are In The
2,The Speaker ( Mr Harry Jenkins) Treasurer And I Have Been In Discussions,,17,Questions Without Notice Represented Now For Some Time We Are In The
3,Mr Turnbull (Wentworth,Leader of global financial markets. As the honourable,17,Questions Without Notice Represented Now For Some Time We Are In The
4,Mr Rudd (Griffith,"Prime Minister) Merrill Lynch, we have had the purchase",17,Questions Without Notice Represented Now For Some Time We Are In The
5,Mr Turnbull (2.02 Pm),"My queshave taken is this: we have supported liquidPrime Minister was saying before, we are ity in the Australian economy by expanding facing one of the most difficult times in in the government bond market to ensure our ternational financial markets, and the diffibroader financial markets operate more efculties of course have their origin in the US fectively, a decision announced by the Treassubprime market. As the Prime Minister urer some months ago. A further measure has noted, overnight Lehman Brothers, formerly been this: to strengthen the protections availthe fourth-largest investment bank in the US, able for eligible deposited insurance policy filed for bankruptcy, a very significant event. holders, we have of course advanced our And of course we have seen the takeover of proposition on the Financial Claims Scheme. Merrill Lynch by the Bank of America. These are concrete measures we have These are serious matters and the governtaken in response to the advice provided to ment, over the last 24 to 48 hours, has been us by Treasury and others in the first six constantly briefed on these developments, months of this year. Upon taking office we first of all, by and through the council of were acutely conscious that this global fieconomic regulators. As the Prime Minister nancial crisis was not over, it had a long way said before, we have been in regular contact to run and, as events in the United States with the RBA and of course with APRA. In have demonstrated in the last 24 hours, rerecent weeks I have also been in regular congrettably it has a long way to run yet. Nonetact with my international counterparts. This theless, I say this to the honourable member: is quite important, because we are not imthe government is determined to prosecute a mune from these events but we are better policy of responsible economic management placed than many countries in the world to to assist in seeing Australia through these weather the storm. difficult global economic challenges, and It is the case that our banks in this country that is what we intend to do. are well capitalised and that is something we ing the honourable member for BallaratStates. Nevertheless, events on international and I welcome her back-I inform the House markets are having an impact on confidence that we have present in the gallery this afteraround the world. The member who asked noon members of a parliamentary delegation the previous question asked what the govfrom the Peoples’ Republic of China. On ernment was doing. We want to ensure our behalf of the House, huanying dajia-a very financial system is as strong and as well warm welcome to our visitors. regulated as it can possibly be. Of course, the member opposite, the new Leader of the OpHonourable members-Hear, hear! position, will well recall legislation put Economy in place a financial claims scheme and also Ms KING (2.06 pm)-My question is to measures to increase liquidity in the bond the Treasurer. Will the Treasurer update the market. I thank him for his cooperation in House on recent global financial market dethat endeavour. velopments? What we can do is build a very strong member for Ballarat back as well. As the global financial turmoil. What we can also",17,Questions Without Notice Represented Now For Some Time We Are In The
6,The Speaker (2.05 Pm),Before callproblems being experienced in the United,18,Questions Without Notice Through This Parliament Some Time Ago To Put
7,Mr Swan,"I certainly welcome the surplus as a buffer against international anddo is to build our investment funds so we ernment, I am unaware at this stage of any have the capacity to invest in the future, to particular exposure. But should other matters expand the productive capacity of our econcome to hand, given that these are recently omy. So it is not a time to be complacent. It occurring developments, then of course we is a time for economic leadership. It is not a will keep the House apprised. time for reckless spending on dodgy projects I would say, however, to all members of which are owned by fundraising mates. It is this House that, as the government has said certainly not a time to call inflation a fairyconsistently throughout this global financial tale and then to turn round and say that the crisis, it is very important to be upfront with government did not cut the budget hard the Australian people about the extent of the enough. It is certainly not a time to vandalise challenges coming at us from the global the surplus. economy. We have been saying that day in, The Leader of the Opposition, in a press day out at the dispatch box since the beginconference that went for 20 minutes today, ning of the year. At the same time, it is very spent $20 billion-he wants to raid the surimportant to be mindful of the underlying plus to the tune of $6 billion-and then he strengths of the Australian economy. The recommitted to a whole set of spending reunderlying strengths are the balance sheets quirements which have been outlined by the of the Australian commercial banks, the previous Leader of the Opposition-$20 bilstrength of our regulatory system and the fact lion in 20 minutes. That is not responsible that the exposures to most of the difficulties economic management, it is not responsible which have occurred in the United States in economic leadership and it is not what this relation to Australian private financial insticountry requires at a time of global uncertutions to date, based on the information we tainty. received, have been modest. Economy It is important therefore to keep the crisis tion is, again, addressed to the Prime Minisknowledge that Australia is part of the global ter. Will the Prime Minister outline to the financial system and therefore is not imHouse the extent of any exposure by the mune. At the same time, with one voice, all Australian federal government and, so far as responsible politicians and leaders in this he is aware, by state and local governments, place should reassert and assert continually to Lehman Brothers and other entities in the underlying strength of the economy, volved in the international financial crisis critical as that is for the continued confiand the risk that this poses to all Australians? dence of our institutions. together with the Governor of the Reserve is to the Minister for Finance and DeregulaBank, in different conversations, were distion. Will the minister outline the need to cussing earlier today. Let me go to Austramaintain a strong budget surplus? What is lia’s commercial banks. Our advice is that the government’s response to suggestions the exposure by the Australian commercial that the surplus be eroded? tion to other entities within the Australian Blair for his question. The government is economy, referring to different levels of govcommitted to responsible economic man-",18,Questions Without Notice Through This Parliament Some Time Ago To Put
8,Mr Turnbull (2.10 Pm),"My quesin context, to acknowledge its reality, to ac",19,Questions Without Notice Through This Parliament Some Time Ago To Put
9,Mr Rudd,"These are the matters that I, Budget",19,Questions Without Notice Through This Parliament Some Time Ago To Put
10,"The Treasurer, The Secretary To The Treasury, Mr Neumann (2.12 Pm)",My question,19,Questions Without Notice Through This Parliament Some Time Ago To Put
11,Banks To Lehman Brothers Is Modest. In Rela,"Mr TANNER-I thank the member foragement, to maintaining a very strong sur$4 billion and the total cost in the 2009 plus and to very substantial infrastructure budget would be well over $5 billion. funds for investment in Australia’s long-term As we all know, we have just had a economic prosperity for the future. We have change of opposition leader. The first quesinherited an inflation rate at a 16-year high tion that the new Leader of the Opposition and 10 interest rate increases in a row, putneeds to answer is whether he is going to ting serious pressure on working people in maintain the commitments made by his this country and of course, most signifipredecessor. Is he going to maintain the irrecantly, increased government spending at a sponsible spending commitments and the rate above five per cent per annum in real wrecking attacks on the budget in the Senterms. That is why the government had to ate? The member for Bradfield has gone off take strong action to ensure that we have into exile. He has joined the member for fiscal settings putting downward pressure on Higgins in indefinite exile in the political inflation and interest rates and to ensure that twilight zone up beyond the bleachers. The Australia’s government is investing for the member for Higgins thinks it is still his surlong term-investing in infrastructure, inplus. He has not noticed there has been a vesting in growing our economic capacity change of government. If it is his surplus, and putting long-term downward pressure on why doesn’t he defend it against attacks from inflation and interest rates. the vandals in his own party? has been under threat in the Senate. The of order. The issue is relevance. I thought strong fiscal settings that the government put this was a day of great concern to the Austrain place in the budget have been under threat lian community and that we didn’t need as the Liberal Party have taken a very strong jokes from a bad actor. stand in favour of cheaper Ferraris and Porsches, in favour of cheaper alcohol for teender. age drinkers and in favour of higher taxes on from the Liberal Party, reflecting where they cover a sense of humour, I will start making really stand on the big issues facing the najokes. That is not all. Along with blocking these will get back to his response. mer Leader of the Opposition, the member fair degree of posturing from the opposition for Bradfield, willy-nilly made big spending on the issue of the pension rate. It was promises over the past six to nine months rightly pointed out yesterday by a number of without ever once hinting where the money members of the government that only about to pay for those promises might come from. I 12 months ago the people undertaking this will mention just a few: pensions, fuel excise posturing actually had an opportunity to do and infrastructure in schools. If you actually something about this. Amazingly enough, add up the dollars, you will see that the total they did not. cost to the 2008 budget surplus of their acI want to add another point to illustrate tions in the Senate-and only three of their how hollow and hypocritical these people unfunded promises-would be in excess of are. Not only were they not doing anything;",19,Questions Without Notice Through This Parliament Some Time Ago To Put
12,Ever Since The Budget Was Handed Down It Mr Tuckey,"Mr Speaker, I raise a point",20,Questions Without Notice Through This Parliament Some Time Ago To Put
13,The Speaker,There is no point of or,20,Questions Without Notice Through This Parliament Some Time Ago To Put
14,Middle,"income Australians-a strong stand Mr TANNER-Wilson, when you dis",20,Questions Without Notice Through This Parliament Some Time Ago To Put
15,Tion. The Speaker,Order! The member,20,Questions Without Notice Through This Parliament Some Time Ago To Put
16,"Initiatives, The Liberal Party, Under The For","Mr TANNER-We have seen recently alet us have a look at some of the things they QUESTIONS WITHOUT NOTICE were doing. For example, in the last 16 Age Pension months of the Howard government-when the member for Bradfield was a cabinet mintoday is to the Prime Minister. When will the ister, the Leader of the Opposition was a Prime Minister deliver on his promise to cabinet minister and the member for Higgins provide financial relief to the thousands of was Treasurer-they spent $457 million on struggling pensioners in my electorate of government advertising. That would have Aston, whom he assured would be paying helped a few pensioners! They spent $350 less for petrol and less for groceries under a million-about three times the ordinary Rudd government? amount spent on industrial relations-on the to top $4½ billion in government grants-10 member for his question. On the governtimes the amount they spent on government ment’s approach to pensions, as I indicated grants only five years before that. So, as well to the House yesterday, in the budget we as looking at the things they did not do for brought in three measures. The first was a pensioners less than a year ago, we should be one-off bonus of $500, which the previous looking at what they actually did spend the government had done for the previous three money on and why government spending years but not for the previous eight years that was increasing at the rate of five per cent per they were in office. That is the first point. annum, all in order to save their political The second was that we increased the utilihides. ties allowance for pensioners from $107 per year to $500 per year and made that permaRegardless of the turmoil in the opposition nent. That was never done by the previous and regardless of who the leader is, they do government and there was no commitment not change their spots. They stand for irrefor them to do so into the future. The third sponsible economic management, they stand thing we did was to increase the telephone for wasteful, short-term spending of govallowance from some $80-plus per year to ernment money and they stand for the intersome $130-plus per year. The honourable ests of well-off Australians at the expense of member asks the question: when will the working people and pensioners. government deliver assistance to pensioners? House that we have present in the gallery mendation that his own party supported in this afternoon members of a delegation from the Senate, we will, through the Harmer in the United States of America, who are visitquiry, reach a conclusion on long-term reing Australia under the auspices of the Ausform for all categories of pensioners. tralian Political Exchange Council. On beThis morning-and I use this as an illushalf of the HouseI extend a very warm weltration in response to the honourable memcome to the members of the delegation. ber’s question-I was in Western Sydney. Honourable members-Hear, hear! With reference to the question of pensioners, the proposal on pensions put forward by the Liberal Party would have excluded some 12,000 pensioners in the electorate of the honourable member for Werriwa. That",20,Questions Without Notice Through This Parliament Some Time Ago To Put
17,Mr Pearce (2.18 Pm),My question,21,Distinguished Visitors Through The Budget We Delivered Those
18,Infamous Work Choices. And They Managed Mr Rudd,I thank the honourable,21,Distinguished Visitors Through The Budget We Delivered Those
19,The Speaker (2.18 Pm),"I inform the measures and, consistent with the recomwould have been 5,277 age pensioner couductive investment one can make in educaples, nearly 5,000 disabled pensioners and tion-research which is so familiar to the 1,500 carers. This goes to why we in the Parliamentary Secretary for Early Childhood government, looking at long-term pension Education and Child Care, the member for reform, are going through every single cateBennelong--when we look at this OECD gory of pension rather than leaving any one report on spending in the early years, we see category out. that we came near the bottom of the class. Education We were 24th out of 26 countries. This is an unbelievable indictment of the record of the Ms VAMVAKINOU (2.21 pm)-My Howard government. These are the nations question is to the Minister for Education, with which we must compete. These are the Minister for Employment and Workplace nations with which our economic prosperity Relations and Minister for Social Inclusion. is tied up. If we cannot compete then, over Will the Deputy Prime Minister inform the the long term, obviously this nation will go House about the release of new education backwards. The Howard years put at risk the data? education system of this country. In the Calwell for her question. I know her deep still is going backwards. Under the Howard concern for educational equity in her electorgovernment we did much worse than stand ate. In the past few days, while they have still: we had 12 years of neglect and underbeen wandering around talking to each other investment in education. about themselves, members of the Liberal This government was elected to bring in Party have missed some very important eduan education revolution, and we are doing cational data that was released by the OECD. that. We are doing that across the boardThe OECD released the report Education at from early childhood education, to schools, a glance. This is a periodic report from the to vocational education and training and uniOECD about the status of a nation’s educaversity. Amongst a comprehensive suite of tion system. policies, this government is investing $11 The OECD Education at a glance report billion in our Education Investment Fund so is a snapshot of expenditure on this nation’s we have a long-term source of funding to education system, its strengths and its weakrenew the capital of our higher education nesses in 2005-that is, it is very clearly a system: both our university and our vocareport card on the Howard government’s tional education and training systems. But years as they relate to education. When we you cannot have $11 billion in the Education look at that report card, there is plenty to be Investment Fund if someone engages in a disturbed about. What it tells us is that public smash-and-grab raid on the surplus. The spending on education was at 4.3 per cent of newly elected Leader of the Opposition, in GDP, well below the OECD average of five spending $20 billion in 20 minutes at a press per cent. We ranked 19th when compared conference today, has indicated to the Auswith our competitor countries in the OECD. tralian people that he is going to lead the We were behind Canada, behind the US, beLiberal Party on that smash-and-grab raid. hind the UK and behind many other EuroWhat that smash-and-grab raid means is we pean countries. Deeply disturbingly, despite cannot make investments in educational inall the worldwide research that shows infrastructure for the long term in this country. vestment in the early years is the most proThe Liberal Party neglected education when",21,Distinguished Visitors Through The Budget We Delivered Those
20,Ms Gillard,"I thank the member for modern world of education policy, standingthey were sitting on the treasury bench. Now the issue of the water health of the Murraythey are trying to damage education from Darling Basin. It is a fact. opposition. This is economic vandalism, Fran BaileyMr Speaker, I rise on a which ultimately means education vandalism point of order. Although this man has absoin this country. lutely no credibility on the environment, I do Murray-Darling River System ask that you bring him back to the question. is to the Minister for the Environment, Herimember for McEwen that, when invited to tage and the Arts. Will the minister explain put a point of order, she should put a point of how diverting 75 billion litres of water annuorder and not make comments. The minister ally from the Goulburn River, a vital part of will respond to the question. and the construction of a pipeline that will Speaker. Coming from an opposition memdestroy farmland, protected areas of state ber who wanted to put green shadecloth over forest and hundreds of hectares of pristine the Great Barrier Reef, I think questions of habitat for native species of both flora and credibility need to befauna is good for the environment? Minister, when will you be prepared to meet with the will return to the question. hundreds of people whose livelihood depends on this water? Fran BaileyMr Speaker, on a point of order: I have been grievously misquoted. Commonwealth to approve the Sugarloaf sume her seat. The member has other opporpipeline was taken on the basis that there tunities if she feels so aggrieved. I have a would be no significant impacts on matters little difficulty in saying that the part of the of national environmental significance and debate which was not necessary to the anthat there would be no allocations from water swer to the question was unparliamentary. I which was identified as being allocated for am suggesting to the member for McEwen the environment, including the Living that, if she is aggrieved, there are other Murray system and Water for Rivers. Those mechanisms for her to put her case on reconditions were made quite clear by mecord. will take those measures but I have asked for Government member-She doesn’t unthe minister to withdraw. derstand. that it beggars belief that opposition memleft are not assisting. bers would get up and talk about their conMr Martin Ferguson interjectingcerns for water and the environment. I am track record of neglect, when in government, for Tourism is definitely not assisting. I am in its exercising of national leadership over indicating that, on this occasion, I think this",22,Distinguished Visitors Through The Budget We Delivered Those
21,Fran Bailey (2.25 Pm),My question The SPEAKER-Order! I remind the,23,Distinguished Visitors Through The Budget We Delivered Those
22,The Already Stressed Murray,"Darling system, Mr GARRETT-Thank you, Mr",23,Distinguished Visitors Through The Budget We Delivered Those
23,The Speaker,Order! The minister,23,Distinguished Visitors Through The Budget We Delivered Those
24,Mr Garrett,I thank the honourable,23,Distinguished Visitors Through The Budget We Delivered Those
25,Member For Her Question. The Decision By The The Speaker,The member will re,23,Distinguished Visitors Through The Budget We Delivered Those
26,Honourable Members Interjecting,"Fran Bailey-Thank you, Mr Speaker. I",23,Distinguished Visitors Through The Budget We Delivered Those
27,Honourable Members Interjecting,,23,Distinguished Visitors Through The Budget We Delivered Those
28,Mr Garrett,The member does not,23,Distinguished Visitors Through The Budget We Delivered Those
