speakerGroups,speaker,theText,pageNumbers,title
165,Mr Gray (Brand,"Parliamentary Secretary for Regional Development and Northerntion for Mitchell, because his favourite football team, the Eagles, did not have such a good year. In fact, they had as close to the worse possible year as you could imagine. That is not going to stop Mitchell from supporting them, because that is what he does. He enjoys football; he enjoys the Eagles. He has been to Eagles training sessions. He has kicked a ball with Andrew Embley. He has learned that living with his disability is something that he can do. For the rest of us politicians who are part of that program, it gives us such a valuable insight into the courage and capacity of families to cope and the things that we can do better here to understand the challenges that these kids face. I commend the program to everyone. Australian Defence Force Parliamentary Program Ms MARINO (Forrest) (4.12 pm)-I rise to speak on the Australian Defence Force Parliamentary Program. I had Warrant Officer Class2 Alan Bungate with me, and I asked him to write something about this program to put into the record. These are Alan’s words: The Australian Defence Force Parliamentary Program was derived from the British Armed Forces Parliamentary Scheme which had been operating successfully at the time for … 19 years. The aim of the program is to provide Members and Senators with practical experience of the ADF so that they can play a more informed and constructive part in the Defence debate. The program has the following objectives: Provide an understanding of the unit’s role and missions Provide an opportunity to experience life as a service person Provide an awareness and understanding of Defence capabilities, personnel and management issues In January 2001, the Minister for Defence Hon John Moore, MP, approved an initial concept plan for the program, and in February 2001 The Hon David Hawker, MP, introduced a private Member’s bill … on the issue which gained bipartisan support. The pilot Australian Defence Force Parliamentary Program… was then planned under the direction of its appointed Head, AVM Brendan O’Loghlin… A range of attachments options were developed by the three Services and were offered to non re-electing Senators for the 2001 Parliamentary winter recess period. The Minister for Defence delegated responsibility for the Program to the Hon Dr Brendan Nelson… in 2001. The Parliamentary Secretary subsequently approved seven Senators and one MP to participate in the pilot Program. In July and August… seven parliamentarians were attached to Defence units for periods of approximately five days. The attachments consisted of … participation in a major Naval and international exercise in the Darwin area, an Air Force maritime patrol mission, an Army Engineers Construction Squadron building accommodation and facilities for remote communities in the Northern Territory and an infantry battalion group preparing for deployment to East Timor. In 2003 an exchange element was introduced into the Program. Selected members of the Australian Defence Force were attached to Parliament House for a week to observe the workings of Government and spend time observing and participating in the daily work schedule of individual parliamentarians (usually those who have participated in Program attachments). Six officers were attached in 2004 and the exchange is now a permanent part of the ADFPP. Since its inception the program has been supported by 86 Participants, 29 Senators and 57 Federal Members. The program provides selected ADF members with an education and practical experience based program broken into five days. The education program covers detailed topics delivered by the Parliament Clerks. ADF members attend sessions with the clerks as well as sessions with members of parliament. MAIN COMMITTEE South-East Queensland Blair Electorate: Boonah Arts Festival Coast and the Sunshine Coast are filling up quickly. So South-East Queensland west is becoming increasingly important in terms of the growth of South-East Queensland. With Ipswich City as its hub, the Somerset area, the Lockyer Valley and the Scenic Rim are becoming more important. As I said recently, Brisbane needs Boonah. I was pleased on 10 September this year to speak at the inaugural South-East Queensland Living Landscapes Forum, hosted by the Regional Landscape and Open Space Advisory Committee. There are many reasons that people come to South-East Queensland, including our outdoor lifestyle and access to a diverse regional landscape, open spaces, public amenity and, of course, rural production. The South-East Queensland Living Landscape Forum provided input into the review of the South-East Queensland Regional Plan and provided an opportunity for discussion and information sharing on key issues facing regional landscapes. The forum was co-presented by the Queensland Department of Infrastructure and Planning and the Council of Mayors South-East Queensland. The forum coincided with the Boonah Arts Festival. The Boonah Arts Collective has 600 members. I was pleased to be there as a sponsor last Saturday night at the culmination of the festival, which lasts a whole week. I want to commend Julie Jackson, Sharon Murakami, Angie Deeks and the rest of the committee for putting on a fabulous show. This small community in terms of population had over 1,000 people there in one of the parks. It was fantastic. And the quality of the entertainment could rival anything we saw at the Beijing Olympics. The talent in the area is extraordinary. It showcased the history of the Fassifern Valley, from the Aboriginal Dreamtime through to now-in appropriate dress. The Boonah Shire Arts Festival has become the hub of the local area, and Julie Jackson needs to be thanked. I would ask that the Scenic Rim council think about putting her on on a full-time basis to coordinate this festival, which is very much supported. But it is not just Boonah; Kalbar has a thriving arts community as well and there are some great jazz festivals in the local area. I have heard some of the best jazz music played ever in the Scenic Rim. It is quite extraordinary what is happening in the area. People are ‘tree-changing’. People from everywhere are going to the area to live. The number of people I have met who have moved there in the past two or three years is amazing. And the locals are accepting them. I congratulate the Boonah Arts Collective and the council for their support. Jetstar not using a microphone, so I will confirm that the microphone is on. I received some really average customer service last Sunday night. I was on a late-night flight from Townsville on Jetstar. Jetstar are quite often late, and often very late, in and out of Townsville. Because it was a late departure I wanted to make sure that I could ring ahead or find out if the flight was on time. I had a look at some earlier flights to use as an example and then rang Jetstar and asked, ‘Can you tell me whether this flight departed on time?’ They said, ‘Actually, it departed an hour ago and has already landed.’ AndI said, ‘But it hasn’t left yet, so how could it have done that?’ They clearly did not know about their own flights. MAIN COMMITTEE",116,Constituency Statements
166,Mr Neumann (Blair) (4.15 Pm),"It is an absolute fact that inner city Brisbane, the Gold",118,Constituency Statements
167,Mr Lindsay (Herbert) (4.18 Pm),"Last week I was criticised by DPS Broadcasting forI then went to their website to have a look, and the website said, ‘We do not recognise that flight number,’ even though it was flying at the time. It was quite extraordinary. SoI rang Jetstar back again and said, ‘Look, I can’t get it on your website and I can’t get you to tell me about it; perhaps you can help me on the plane.’ I had a seat allocation but I wanted to see if I could get in the exit row. It actually costs a few more dollars to sit in the exit row, but it was a long flight and I needed to work on my laptop, and it is just more convenient and easier-and you are not so squashed-in that row. They said, ‘No, your seat’s been allocated; you can’t change.’ But you know what? When I got on the plane, there was a vacant seat in the exit row. I wanted to pay some more money for it, but they said I could not change. What kind of a business are they running? It is just extraordinary. Ultimately, I found out if the plane was on time. And you know how I did it? I rang Qantas. I rang Qantas at Melbourne airport and I said, ‘Could you look at the monitor and see if JQ918 has departed on time?’ The Qantas staff were very, very helpful. They said, ‘Absolutely; it’s right.’ The story ends well, though, because the plane did in fact arrive on time. We departed, flew to Melbourne and arrived a quarter of an hour early-at, I think, about 11 o’clock at night. So, Jetstar, have a look at how you do business with your customers. By the way, I did ask them if they could give me the phone number of the local Townsville airport Jetstar counter, and they said: ‘Oh, Mr Lindsay, of course not. We don’t want customers ringing Townsville.’ Just extraordinary! SoI am a committed Qantas and Virgin supporter; I am not so certain about Jetstar. Corio Electorate: Alcohol Abuse late and you are fast asleep, blissfully unaware of your surroundings-that is, until you are suddenly woken by the sound of smashing glass and what sounds like a brawl going on outside your bedroom door. You spring out of bed, hurriedly throw on some outer clothing and go to investigate. What greets you as you open your front door beggars belief: over 200 youths milling in the street-most intoxicated, some throwing bottles and cans, others trespassing on neighbouring properties, and all causing a disturbance. This is not a work of fiction by Hollywood producers; rather, it was the scene that confronted the residents of Tettenhall Ridge in the Geelong suburb of Belmont on Saturday, 31 August, some two weeks ago. It was the end result of a teenage party gone wrong, one which had been widely advertised through internet services such as MySpace and MSN chat, and fuelled by excessive underage drinking, and a crowd too large to control had ultimately spiralled out of control. Sadly, not even a police presence was sufficient to quell the crowd. When officers arrived, some were set upon; one female officer narrowly avoided being king hit, and bottles thrown from amidst the mob damaged police vehicles. This type of appalling behaviour is not confined to Belmont or Geelong. It is a regular occurrence throughout many towns and cities across our nation that, by virtue of its seeming regularity, casts a damning blight upon our shared sense of community and our social values. It is because of a desire to end scenes such as these that the Rudd government will invest over $50 million to curb what is a binge-drinking epidemic among many young people. Included in this funding is $19.1 million for early intervention programs to assist alcohol-affected youths. Furthermore, the federal government has also committed $300,000 to Geelong under the Safer MAIN COMMITTEE",118,Constituency Statements
168,Mr Marles (Corio) (4.21 Pm),"Picture, if you will, an ordinary Saturday evening. It isSuburbs Plan-money which has been appropriated to the City of Greater Geelong and is to be used in safety initiatives aimed at reducing crime and antisocial behaviour. In Geelong these funding initiatives have been complemented by community action, with over 3,000 local residents, celebrities and businesses supporting the Geelong Advertiser’s ‘Just Think’ campaign. The ‘Just Think’ campaign is a local response to a recent spate of abhorrent and often tragic acts of alcohol-fuelled violence that have occurred in Geelong, and, as the name suggests, the campaign message is simple: just think. Think about the potential effect your alcohol consumption may have on your decision-making abilities and levels of self-control. Think about what your drinking does to your friends, your family, your community and your health. Think about your drinking. Indicative of the success of the Geelong Advertiser’s ‘Just Think’ campaign has been the praise and support it has received from Victorian Premier John Brumby and Victoria Police Chief Commissioner Christine Nixon. Furthermore, it is now being used as the model for the program being run by the Cairns Post to curtail alcohol-fuelled violence in that city. Teenage drunkenness, binge drinking and alcohol-fuelled violence are national problems, and I would encourage all Australians to heed the words of the Geelong Advertiser’s campaign and just think about the effect alcohol has upon their lives. Finally, I would like to thank Sumeyra Eren, a work experience student from Matthew Flinders Girls Secondary College, for preparing this speech. Imtrade Australia Dr JENSEN (Tangney) (4.24 pm)-I am extremely disturbed by the conduct of the Australian Pesticides and Veterinary Medicines Authority in pursuing a chemical company controlled by one of my constituents. Imtrade Australia has been hounded by the APVMA to the extent that it all but had to suspend trading. The company was guilty of an administrative offence, and this it openly conceded. The response of the APVMA was totally over the top, and the Federal Court has now vindicated Imtrade by declaring the agency’s conduct in this case unlawful. In May this year, the APVMA used Australian Federal Police teams to simultaneously raid Imtrade’s offices and plant and the home of its managing director. The raids reportedly took place at dawn and involved up to 30 officers, 10 at each location. We are not talking about dangerous criminals here-just a business which did not complete some paperwork. Such conduct smacks of a police state and is abhorrent to Australians. There was never any suggestion that there was anything wrong with Imtrade’s agricultural products, but the APVMA withdrew approval and recalled them just the same, and then dragged its heels on approving any more products from the company. I applaud the Federal Court decision clearing the way for Imtrade to get back to business and rightfully putting the APVMA in its place. But this situation should never have escalated so far. Federal agencies should be fostering the development of innovative young companies like Imtrade, not hindering them in some vindictive power play-and certainly not using the bullying tactics we have seen in this case. For a federal agency’s conduct to be branded unlawful by the courts is a disgrace and should be a cause of great shame to the government. Finally, we must question the expense of this futile exercise in power. It is the Australian people who must foot the bill for the rogue bureaucrats persecuting this company. And there MAIN COMMITTEE could be more to come, if Imtrade seeks damages to recover the millions of dollars it says the case has cost it in expenses and lost revenue. This is money from all of our pockets which could have been much more effectively spent elsewhere. Mr William Akell Ms KING (Ballarat) (4.27 pm)-I rise today to talk about someone whom it has been my great privilege to know and work alongside in resolving a long standing issue. The person I would like to talk about is Mr William Akell-Bill or, more colloquially, ‘Yank’-who was one of the 108-strong Delta Company, 6th Battalion, Royal Australian Regiment which defeated a North Vietnamese force of between 1,500 and 2,500 troops at the Battle of Long Tan. When I stop to think about that-a battle between 108 men and up to 2,500 men, fought on foreign soil in a foreign climate-it is a miracle that anyone in Delta Company actually survived. To say that it was an act of courage and determination would be an understatement. A long standing concern for the men who fought that battle has been the issue of military medals and the recognition that they are entitled to be awarded and wear the Vietnamese citation. I am very proud to be part of a government that has actually rectified this issue. Harry Smith, Commander of D Company 6RAR, has been offered the Star of Gallantry-equivalent to the Distinguished Service Order-and Platoon Commanders Dave Sabben and Geoff Kendall have been offered the Medal for Gallantry. This restores the original award recommendations by the commanding officers and accepts that the intention was to award Sabben and Kendall higher honours. The strength of D Company 6RAR in Vietnam on 18 August has also received approval to wear the former Republic of Vietnam’s Gallantry Cross with Palm Unit Citation Emblem. Other measures have included the referral of other unresolved concerns regarding individual awards for Long Tan to the independent Defence Honours and Awards Tribunal. I am very proud to be part of a government that understands the significance of the Vietnamese citations and the issue of military medals for those men who have now been offered them. I am very proud to be part of a government that considers the historical context of a decision and is not afraid to overturn the decisions that were made within that context. I first spoke on this matter in the House in 2002 and knew then that it was an issue that needed to be resolved. It had to take a change of government, but finally this matter can be laid to rest and we can take one more step towards helping to heal the emotional wounds of Vietnam veterans who were treated so badly on their return from service. I would like to take this opportunity to acknowledge my colleague Graham Edwards, a Vietnam veteran and the former member for Cowan, who worked tirelessly for the proper recognition of these men. He is sorely missed in this place. The final word needs to go to Bill Akell. I feel so honoured to have assisted in a small way toward something that is so meaningful. I hold the deepest respect for you and your family, for the energy and commitment you have shown-not just for yourself but for all the men from Delta Company. I have learned a great deal from you-not just about battles and wars and medals but also about personal strength and character-and I will always be grateful for the opportunity to have been some help. 193 the time for members’ constituency statements has concluded. MAIN COMMITTEE",119,Constituency Statements
169,The Deputy Speaker ( Mr S Georganas),"Order! In accordance with standing orderSecond Reading Debate resumed from 15 September, on motion by Mr Albanese: That this bill be now read a second time. (National Land Transport) Amendment Bill 2008 and to congratulate the government for continuing this vital program, which was initiated by the coalition. In fact, it was initiated by a small group of people. As I stand here today, I refer to my notebooks of June 2007 when former Deputy Prime Minister the Hon. John Anderson asked us to set up a small task force of Nationals to determine what we believed would be an appropriate response to the issue of road funding. There was John Forrest; there was the member for Parkes, who at the time was Tony Lawler; there was Bob Katter before he became an Independent; and there was Stuart St. Clair, the former member for New England. I was also in that small group of people. As I was looking at this legislation, I came across my working out of exactly what we would require in order to put back into local roads the strength and security required particularly in rural and regional areas-and, obviously, it would be available to some metropolitan areas as well. We all signed off. We determined what we needed. We had about $400 million which was given to local councils. The total road funding at the time was about $1.3 billion. I wanted to go down the hypothecation process whereby you would hypothecate a certain amount of excise to go into roads, because about $155 billion in total revenue was being raised, yet only limited amounts of that money were going into road works. We signed off on two proposals. One was a hypothecation of 1.8c a litre excise into a purpose-designed roads account; the other one was to provide $1.2 billion over a four-year period to be distributed on the same formula as the federal assistance grants, which at the time were going to local government. I took our case to the former Deputy Prime Minister and Minister for Transport and Regional Development, John Anderson. It was through the representation of this small group of working people that we devised, with the department and others, a proposal that would enable us to establish the Roads to Recovery program of $1.2 billion, which was implemented in November 2000. When you come into this House, you may think, being just one of many people in such a big place, that individual members cannot make a difference, but this just shows that you most certainly can. This was an example of how local members, passionate about road transport and local issues, were able to collectively put together a very sensible proposal which was worked through by the department and the minister in charge. They came up with what was undoubtedly the most popular funding program outside Investing in Our Schools. I think Investing in Our Schools became equally as popular, but Roads to Recovery was the most significant program. It sidestepped the state so that roads funding was actually delivered to the people who are doing the work-the states were not creaming off serious amounts of money off the top of it and leaving a small percentage of money to go into on-the-ground work. It was a perfect example of how you could have federal and local government working in close cooperation to deliver huge benefits to local communities right across the nation. Some of those road projects funded in the Riverina electorate were quite significant. The Riverina received $1.55 billion in transport and regional services funding, including very sigMAIN COMMITTEE",121,Constituency Statements
