speakerGroups,speaker,theText,pageNumbers,title
253,Mr Melham (Banks) (9.02 Pm),"I of these accidents and save lives. I am awarecommittee is also of the opinion that the The committee also examined technologistandard should be more strictly enforced. cal solutions to level crossing safety. In this During the course of this inquiry, the report the committee reiterates its support for committee heard that the causes of level intelligent transport systems as stated in the crossing crashes are varied and while there is 2004 report and recommends that the govno single cause of all level crossing crashes ernment support ongoing research into this the most significant factor leading to level important technology to speed its wider imcrossing collisions today is the behaviour of plementation. It also recommended that the motor vehicle drivers. It seems that motorists government, through the Australian Transcontinue to disobey road rules at level crossport Council, encourage further research into ings. The current focus on driver behaviour the feasibility of a radio cut-in warning syshas resulted in a three-tiered approach to tem which would warn motor vehicle drivlevel crossing safety: education, enforcement ers, particularly truck drivers, as they apand engineering. The committee endorses proach a level crossing of the presence of an this approach in its report and notes that imoncoming train. provements in all these areas are required in In the course of its examination of level order to achieve safe level crossings. crossings the committee became increasingly The committee acknowledges the work aware of a distinct lack of aggregate data that is being done by the states and territories which details the causes of these often horto educate motorists of the dangers at level rific crashes across Australia. With this in crossings, but encourages continued effort as mind the committee recommends the estabit is apparent that the message is not always lishment of a national database which will getting through to motorists. For example, collate data from all level crossing crashes the committee was distressed by the results and fatalities in all jurisdictions to provide a of a national behavioural study of motorists better national picture of where and why which showed that huge numbers of motor these collisions occur. The committee also vehicle drivers disobey road rules at level recommends that the 2003 National Level crossings. Therefore the committee’s report Crossing Safety Strategy be updated. The recommends that consistent penalties be set committee strongly supports this national across all jurisdictions and that the speed approach to level crossing safety but believes limit at level crossings on major highways that the strategy should be regularly rethat currently have a speed limit of 100 viewed and kept up to date to provide better kilometres per hour or more be reduced to 80 national policy guidance. Level crossing kilometres per hour. safety is an ongoing problem across Australia. While the states continue to focus on this In terms of engineering, the committee issue, it was the committee’s intention in supports the use of rumble strips at level undertaking this update to focus some nacrossings to alert motor vehicle drivers of the tional attention on the risks posed by level crossing ahead. The report recommends furcrossings around the country. ther trials of passive rumble strips at a selection of level crossings around Australia and a The committee is encouraged by the govprogram to begin trialling active rumble ernment’s recent announcement as part of the strips at some of the most dangerous crossnation building and jobs plan of funding to ings. install 200 new boom gates and other safety measures at high-risk level crossings. It is an unprecedented commitment and one we certainly hope continues. I would like to express amorphous thing moving in front of you. If on behalf of the committee our gratitude to reflective tape or paint is put on the cane bins all those who participated in the inquiry and then, as the car lights hit that, the light is reto the staff of the secretariat: Michael Crawflected back at you. As the train passes ford, Sophia Nicolle and Kane Moir-two of through the crossing, you get this flickering whom are here in the advisers box. effect as each carriage goes by. It is a similar former Standing Committee on Transport on standard or narrow gauge lines. What the and Regional Services inquired into level committee is recommending is not a hard crossing safety in 2004 and produced a rething to do. port entitled Train illumination. That inquiry When the previous committee went to actually started off as a road safety inquiry, Western Australia, we saw a thing that exambut two ladies from Western Australia, Merines the flat spots and bearings on the wheels rilea Broad and Karen Morrissey, who had of trains used in the Pilbara. A foaming brush lost children at the Yarramony level crossing with a jet of water is used on the trains once in Western Australia, appeared before the every month or whenever it is that the trains committee. Their evidence was so compelare washed. I do not think that is a difficult ling and heart wrenching that we decided to thing to do. If the state rail authorities and take level crossings as a separate subset. I the private operators really wanted to put think that was a very good move. their minds to it, that could be done. At the time, we found that about 70 to 80 The committee also looked at the efficacy per cent of train accidents occurred in dayof auxiliary lighting. I think the yellow relight, which made it all the more bewildering volving beacon has some merit. It is cerwhy we had to concentrate so heavily on tainly used a lot in the sugar industry. Somelighting. The new report by the Standing times it is at the front of trains and someCommittee on Infrastructure, Transport, Retimes it is also at the rear of trains. If you gional Development and Local Government come up to a level crossing in a cane areahas gone on to talk more about that. I note not a lot of people go across these crosstwo particular recommendations in the comings-and you see a yellow light coming mittee’s report. One was that the standard through the tops of the sugar cane, you click 7531 be adopted as a mandatory requirement immediately to the fact that there is a train for the ongoing maintenance of retrocoming. To have the flickering worked in reflected materials. Madam Deputy Speaker, such a way that it came on as you came up to let me give you an example of how impora level crossing rather than it being on all the tant that is. When a flat top wagon goes time is, I think, something that we could look through a level crossing it has no lights on it at. and no reflective strips and so it just looks I support the chairman’s comments that like a black streak. If it is a passive crosswe need to do something about rumble ing-one without lights or boom gates-it is strips. If your car goes bumpty, bumpty, very easy, say, for a motor cyclist to ride bump as you come up to a level crossing, straight into it. I am aware of that occurring you are immediately alerted to the fact that on one occasion in Bundaberg. It is a similar there is a crossing there. When you see the situation with cane bins. When cane bins of circumstances of that dreadful accident in cane trains go past you, it is generally on Victoria, you just wonder whether the redarkened crossings. They appear like an",138,Committees I Also Should Not Let The Opportunity Pass
254,Mr Neville (Hinkler) (9.08 Pm),"The situation with state or privately owned trainssponses of the driver-albeit that he has been view of Auditor-General’s reports tabled beacquitted; I go along with that; I think that is tween August 2007 and August 2008. fair enough-might have been triggered a bit Ordered that the report be made a parliamore quickly if there had been that bumpty, mentary paper. bumpty, bump effect as he approached the level crossing. of Public Accounts and Audit, as prescribed Also, some satellite and GPS type devices by the Public Accounts and Audit Committee in cars emit a signal when they pass by a Act 1951, examines all reports of the Audischool. We have recommended that that be tor-General and reports the results of the extended to level crossings so that, as you committee’s deliberations to the parliament. come up to a level crossing and you are, say, This report details the findings of the 150 metres out, you get a similar signal. committee’s examination of five performThere are lots of things still to be done. ance audits tabled in 2007 and 2008. These Many people are killed on level crossings. five reports were selected for further scrutiny Most of them are killed at the front of the from the 54 audit reports presented to the train but some are killed at the side of the parliament in that period. train(Time expired) As usual, these reports cover a range of agencies and highlight a number of areas of Burke)-Does the member for Ballarat wish concern. Two themes which repeatedly recur to move a motion in connection with the reare the need to document processes and proport to enable it to be debated on a later occedures to better understand and manage risk casion? and the need for staff training to ensure more Ms KING (Ballarat) (9.13 pm)-I move: effective and efficient use of existing sysThat the House take note of the report. tems. dance with standing order 39(c), the debate assessing how four departments are impleis adjourned. The resumption of the debate menting the change to a whole-ofwill be made an order of the day for the next government approach to the delivery of Insitting. digenous services. While the committee was Infrastructure, Transport, Regional satisfied overall with the progress being Development and Local Government made, we feel that the process can be imCommittee proved. Accordingly, we recommend that the Report: Referral to Main Committee risks and challenges identified be docuMs KING (Ballarat) (9.13 pm)-I move: mented and that staff training programs be developed to increase awareness of these That the order of the day be referred to the risks. Further, the committee would like to Main Committee for debate. see an action plan developed and published Question agreed to. to track improvements in Indigenous life Public Accounts and Audit Committee expectancy. Report As a result of the investigation into the Ms GRIERSON (Newcastle) (9.13 Australian government’s two natural repm)-On behalf of the Joint Committee of source management programs, we identified Public Accounts and Audit, I present the the need for a clear set of procedures to encommittee’s report entitled Report 414: Resure state and territory compliance with bi-",140,Committees I Also Should Not Let The Opportunity Pass
255,Ms Grierson,The Joint Committee,141,Committees I Also Should Not Let The Opportunity Pass
256,The Deputy Speaker (Ms Ae,,141,Committees I Also Should Not Let The Opportunity Pass
257,The Deputy Speaker,"In accorThe committee reviewed an audit reportlateral agreements. The committee acknowltinues to age and report back to the commitedges the difficulties inherent in operating tee. these diverse programs but is concerned Finally, the committee looked at the audit about ongoing and recurring problems in report assessing the regulatory function of monitoring and reporting. We are therefore the Australian Communications and Media requesting a progress report from the releAuthority under the Australian Communicavant departments detailing implementation tions and Media Authority Act 2005. We of both the ANAO and committee recomfound that ACMA’s complaints-handling mendations. process is ad hoc and lacks systematic methThe committee reviewed the completeness ods, and recommend that ACMA reform its and reliability of the estimates reported in the complaints-handling processes to ensure a Taxation Expenditures Statement 2006. To more efficient and faster handling of comimprove the quality of the tax expenditure plaints. We urge ACMA to complete develstatement, we recommend that Treasury inopment of a complaints-handling manual and clude two additional pieces of information: recommend the introduction of a formal calculations regarding the 20 largest tax extraining program for all staff handling compenditures using both the revenue forgone plaints which would incorporate effective and revenue gained methods to allow comuse of the ACMA information management parison with the budget papers, and informasystem database. tion on the extent to which tax expenditure I would like to acknowledge the valuable reporting has improved through the receipt work of the Auditor-General and the staff at of reliable data from other agencies. We also the Australian National Audit Office. We suggest that Treasury investigate the Canalook forward to continuing reviews of the dian model of taxation expenditure reporting Auditor-General’s reports. I would also acto determine whether it provides a more knowledge the valuable work of the secrecomplete picture of public and parliamentary tariat in assisting us in this inquiry and rescrutiny. port-our secretary, Russell Schaeffer; Dr In this batch of reports, we followed up on Narelle McClusky, who has joined us; and the previous examination of Centrelink’s particularly Shane Armstrong. This is the management of customer debt undertaken first report we have worked on together, previously in 2004-05. We were pleased to Shane, and I thank you for your enthusiasm. see that the audit report found that Centrelink Finally, I would like to thank my colhad successfully implemented the majority leagues on the committee of the 42nd parof the recommendations from both the previliament for the work they have undertaken in ous ANAO report and the subsequent JCPAA completing this review of the Auditorinquiry. However, there are still inconsistenGeneral’s reports. I commend the report to cies across the network and the committee the House. recommends that Centrelink identify regions that have been particularly successful in managing debt, examine their processes and Parliamentary Delegation to Colombia implement best practice methods across the and Argentina, 9 to 24 August 2008 tee was Centrelink’s ageing debt base. We present the report of the Australian parliahave asked Centrelink to conduct a review to mentary delegation to Colombia and Argendetermine the reasons why the debt base contina from 9 to 24 August 2008. The bilateral",141,Committees I Also Should Not Let The Opportunity Pass
258,Network. Of Primary Concern To The Commit,"Mr RANDALL (Canning) (9.19 pm)-Ivisit in August last year was an opportunity business and education industries. The delefor parliamentarians to learn more about Cogation leader also had the pleasure of adlombia and Argentina, to promote Australia dressing the Colombian Senate, which was and to strengthen bilateral ties. The delegabroadcast to a potential audience of 40 miltion was the first Australian parliamentary lion people. visit to Colombia and the first in some years In addition to meetings with parliamento Argentina. The report I tabled today detarians and officials from government details our program activities and observations. partments in Bogota, the delegation had a I wish to acknowledge my delegation colnumber of engagements outside the capital. leagues. The delegation leader was Senator Highlights included a visit to Cerrejon mine, Steve Hutchins and we were joined by Senawhich is one-third owned by BHP Billiton tor Marise Payne, Senator Helen Polley, Mr and is the world’s largest open pit coalmine, Luke Hartsuyker MP and Ms Melissa Parke and their local school for indigenous chilMP. Each delegate was an enthusiastic pardren. We also had valuable meetings with ticipant in discussions and inspections and local government and business representacontributed significantly to the purpose of tives in Cartagena and visited the awardthe delegation visit in a spirit of bipartisanwinning port of Cartagena. We enjoyed parship and goodwill. ticipating in a forum on Australia’s relations The delegation visited Colombia first, with Latin America with university students from 8 to 15 August. In Bogota we had the in Medellin who were keen to learn more distinct honour of meeting the Colombian about Australia. It is not that well known that President, Mr Alvaro Uribe, as well as the Colombia sends 5,000 students to study in Minister for Foreign Affairs, Mr Jaime BerAustralian tertiary institutions each year. In mudez. Uribe’s administration has ushered in Medellin we also visited the Parque Biblioa suite of reforms which have improved seteca Espana, an unusual and successful decurity, facilitated economic growth and invelopment project which uses modern architroduced new health and education protecture and public spaces to inspire social grams. Wherever we went in Colombia we change in disadvantaged communities. learned that the perception of Colombia in From 16 to 22 August the delegation visthe past is not necessarily the reality of Coited Argentina. This leg of the journey was lombia today. Colombians have a renewed commenced in the Misiones province during sense of self-esteem about their institutions a long weekend in order to see the manageand optimism about their country’s future. ment of large tourist flows at Iguazcu Falls We were warmly received by the Presiand to inspect the world’s largest hydroelecdent of the Senate, Senator Hernan Andrade, tric dam over the border at Itaipu in Brazil. and parliamentarians from the Senate and the In Buenos Aires the delegation was honoured Chamber of Deputies, and we were imto meet the President of the Senate and Vicepressed by our counterparts’ level of interest President of Argentina, Julios Cobos, and the in Australia. Engaging discussions were held respective chairs of the foreign affairs comon a range of foreign relations and trade matmittees in the Senate and lower house, toters, including the latest Doha round; foreign gether with colleagues from different parties direct investment; free trade agreements; in the Argentine congress, including memalternative sources of energy; and the scope bers of the Australian Argentine Parliamenfor further cooperation in the mining, agritary Friendship Group. We acknowledge the tremendous assistance and support that Senator Sonia Escudero, Chair of the Friendship the report to enable it to be debated on a fuGroup, provided to us during the visit. Both ture occasion? benefit from her passion and enthusiasm for That the House take note of the report. Australia. It is not well known but she is dance with standing order 39 the debate is South Wales upper house-it will come to sitting. me shortly. Report: Referral to Main Committee Burke)-Let him finish. Stop interrupting. Main Committee for debate. sues were discussed at official meetings with TRADE PRACTICES AMENDMENT parliamentary and government officials, inBILL 2009 cluding the respective parliamentary comFirst Reading mittee systems, shared interests in peaceBill presented by Mr Katter. keeping and environmental matters such as servation, the scope for further collaboration Trade Practices Amendment Bill 2009 seeks in nuclear science and technology, climate to provide protection to unions and their change, and the proposed work on holiday members from being sued if they stop the visa arrangements for Australia. All agreed export of Pacific Brands manufacturing mathat the latter would encourage greater peochinery or the importation of goods to reple to people exchanges. We also visited the place Pacific Brands products. This protecMemory Museum in Argentina which pays tion is provided for secondary boycotts for homage to the victims of the military dictathe purpose of causing substantial loss or torships. (Time expired). damage, secondary boycotts for the purpose of causing substantial lessening of competition and boycotts affecting trade or comSpeaker, I ask that the remainder of my merce. The exception is restricted to circumspeech be incorporated. stances where a government is negotiating low that but, if you wait for two minutes and only allow for unions to be entitled to ban you go to the sheet in front of you, you will such imports for two years. find that you will have another opportunity There is a notice of motion which should in the Main Committee. That is why I was be read in conjunction with this bill. The trying to stop the Parliamentary Secretary for notice of motion calls on the government, Pacific Island Affairs from interrupting. The first, to introduce an emergency measure time allocated for statements on this report under WTO rules to provide an interim 15 has expired. Does the member for Canning per cent tariff on goods that are imported to wish to move a motion in connection with replace TCFs-textiles, clothing and foot-",142,Delegation Reports
259,The Australian And Argentinian Parliaments Mr Randall,I move:,144,Delegation Reports
260,Married To A Former Australian Mp. The Deputy Speaker,In accor,144,Delegation Reports
261,Mr Kerr,Who is that? adjourned and the resumption of the debate,144,Delegation Reports
262,Mr Randall,"Ken, from the New will be made an order of the day for the next",144,Delegation Reports
263,Mr Kerr,Ken Gabb? Mr RANDALL (Canning) (9.24 pm)-I,144,Delegation Reports
264,Mr Randall,No. move:,144,Delegation Reports
265,The Deputy Speaker (Ms Ae That The Order Of The Day Be Referred To The,,144,Delegation Reports
266,Mr Randall,A range of bilateral isQuestion agreed to.,144,Delegation Reports
267,The Preservation Of Antarctica And Wild Con,Mr KATTER (Kennedy) (9.25 pm)-The,144,Delegation Reports
268,Mr Randall,Madam Deputy,144,Delegation Reports
269,The Deputy Speaker,"I cannot alwith a company to protect jobs and wouldwear-such as items produced by Pacific my right here, if we are not doing it no-one Brands; secondly, to abandon its intention to else in this place is likely to, that is for cerabolish the existing TCF tariff regime; and, tain. Every other country on earth has tariffs thirdly, to finance a loan to allow Pacific and other protections. Brands workers to purchase through salaryI conclude on a very specific note. I have sacrificing arrangements a significant share bought Baxter shoes all of my life. People issue made to provide the refinancing funds talk about RM Williams, but my family actunecessary to enable continued manufacturing ally predates RM Williams and we were by Pacific Brands in Australia. probably the first people to actually stock I think it really is lamentable that an IndeRM Williams in Australia. Baxter boots pendent has to move this legislation when a make elastic sided boots. I rang up the place Labor government is in power in Australia. to buy a pair of shoes because I could not When the first parliament was brought to find a pair anywhere and I said, ‘I am so gether it was the Labor Party that joined with pleased that you are still manufacturing.’ He the anti-free-trade people to protect jobs here said, ‘Don’t hold your breath, Bob, because in Australia. When Mr Keating started on next year we will have six people employed.’ this regime I said to myself that if we reWhether that has become a reality or not, I moved all tariff protection in Australia only do not know. He said, ‘We cannot compete two things could happen: (1) we close down against the Chinese manufacturers.’ They every industry in this country and (2) we go had 126 employees when I rang him up. I to the same wage structures as our competisaid to him, ‘What actually precipitated your tor nations in Asia-which is working for a decision?’ and he said, ‘We had the contract bowl of rice. They are the only two possibilifor the shoes for the Army and it was taken ties. I will be presenting legislation on the off us and given to a Chinese company.’ banana industry shortly, but if we expect (Time expired). people to fight for our banana industry then Bill read a first time. it is only right that we should fight for the manufacturing industries. standing order 41(d), the second reading will It is an extraordinary country when we be made an order of the day for the next sitsimply sit in this place and preside over the ting. complete abolition of all manufacturing in this country. I say to every single person that comes into this place that when you go to bed of a night and say your prayers just reFirst Reading member that you better confess that you Bill presented by Mr Katter. were a party to the abolition of manufacturDebate interrupted. ing in this country. The Prime Minister has said-and God bless him for saying it-that a country that has no manufacturing. I have pm, I propose the question: got news for you, Mr Prime Minister: you That the House do now adjourn. try that has no manufacturing. Somebody in minutes on that bill before the House adthis place should be doing something about journs? it. As I said to my Independent colleague on",144,Delegation Reports
270,The Speaker,In accordance with,145,Adjournment
271,He Does Not Want To Be The Prime Minister Of The Speaker,Order! It being 9.30,145,Adjournment
