speakerGroups,speaker,theText,pageNumbers,title
0,,"---right! The member for Warringah has the call. only too happy to prosecute the case that the the House) (12.00 pm)-Given the debate in debate that the Leader of the House wants to recent days, the government can inform the have now, let us have it. Let us move to it Leader of the Opposition that it would be straight away. prepared to provide a facility in the House provide a copy of the alleged email between the Opposition) (12.03 pm)-I move: Dr Andrew Charlton and Mr Godwin Grech That so much of standing and sessional orders which allegedly establishes representations be suspended as would enable the Leader of the Opposition to move the following motion forthby the Prime Minister and his office in supwithport of Mr John Grant and (2) to explain the his office have had with this alleged emailpoint of order. I very clearly indicated that if the Leader of the Opposition seeks leavespeaking on indulgence? Is he moving a momoving a motion for the suspension of standtion? Exactly what is he doing in the chaming orders. Seek leave to move your motion. ber now? It will be granted. Bring it on. ing a motion. I suppose he has taken indulthe Opposition) (12.04 pm)-by leave-I gence, which I am allowing him. He is, move: hopefully, concluding his statement on inThat this House require the Treasurer to: dulgence. (1) immediately attend the House and make a gence to give the Leader of the Opposition sonal involvement and that of his office in the opportunity to come clean about his in the OzCar “deals for mates” scandal and disvolvement and his party’s involvement with close the following information: How many car dealers: this fake email. If he wishes us to do so, we will also provide equal time for the govern(a) received special treatment from the ment to respond. Treasurer, his office and senior Treasury officials-as they were “not your averOn indulgence, it is my understanding that John Grant? the Leader of the Opposition would be only (b) did the Treasurer personally hold teletoo happy to put a case forphone conversations with, to discuss Government members interjectingtheir financing troubles, as was the case with John Grant?",17,Setup
1,"Monday, 22 June 2009 The Speaker",Order! Those on my,17,Treasurer That The Leader Of The Opposition Would Be
2,The Speaker ( Mr Harry Jenkins),,17,Treasurer That The Leader Of The Opposition Would Be
3,Took The Chair At 12 Pm And Read Prayers. Mr Abbott,It is my understanding,17,Treasurer That The Leader Of The Opposition Would Be
4,Mr Albanese (Grayndler,Leader of Treasurer has misled this House. If that is the,17,Treasurer That The Leader Of The Opposition Would Be
5,Now For The Leader Of The Opposition To (1) Mr Turnbull (Wentworth,Leader of,17,Treasurer That The Leader Of The Opposition Would Be
6,Full Dealings That The Opposition Leader And Mr Albanese,"Mr Speaker, I rise on a",17,Treasurer That The Leader Of The Opposition Would Be
7,Mr Abbott,"Mr Speaker, I rise on a point",17,Treasurer That The Leader Of The Opposition Would Be
8,Of Order. I Am Just Wondering On What Basis Mr Hockey,We’re doing it!,17,Treasurer That The Leader Of The Opposition Would Be
9,The Leader Of The House Is Speaking. Is He Mr Albanese,"No, you are not; you are",17,Treasurer That The Leader Of The Opposition Would Be
10,The Speaker,Order! He is not movMr TURNBULL (Wentworth-Leader of,17,Treasurer That The Leader Of The Opposition Would Be
11,Mr Albanese,I am seeking indulfull and unreserved statement about his per,17,Treasurer That The Leader Of The Opposition Would Be
12,Mr Abbott (Warringah) (12.02 Pm),"age constituent”-as was the case with(c) were the subject of regular and lengthy The Treasurer of the Commonwealth of Ausupdates to the Treasurer’s personal tralia has sought to persuade this House, to home fax, as was the case with John create the impression, that Mr Grant’s conGrant? cerns came through the door in the regular (d) had their telephone contact details run of business and were just referred in a handed over to Treasury officials at a mechanical way off to the Treasury officials high level meeting to discuss a half a responsible for dealing with them. They were billion dollar funding proposal, as was the case with John Grant? and sent off and he was treated like anybody else. There was no special treatment. The Treas(e) were described in meetings between urer expressed a complete indifference toTreasury officials and finance companies as an “acquaintance” of the Prime indeed, an ignorance of-what exactly had Minister, as was the case with John transpired. And yet we now know the fact Grant? and that these statements were completely and (2) lay before the House all emails (from deutterly false. partmental, APH and personal accounts), all It turns out, from the emails that have correspondence, all fax records and all phone been tendered in the Senate by the Treasury records related to the OzCar “deals for itself, that the case of Mr Grant was raised mates” scandal by no later than 12 noon todirectly with the Treasury official, Mr Grech, morrow. by the Treasurer’s office. And so concerned On4 June the Treasurer was asked a queswere they when they raised the matter of Mr tion about representations having been made Grant on 20 February that they encouraged by his office on behalf of Mr John Grant. He the Treasury official to raise this matter with answered relevantly as follows: Ford Credit when the Treasury met with Ford It is the case that Mr Grant made representations Credit at a prearranged meeting the followto my office, and he was referred on to the SPVing Monday, 23 February. that is, OzCarNow, that meeting with Ford Credit on 23 just like everybody else. I have no idea what the February was of enormous significance, beoutcome of that was. cause Ford Credit, in common with other That was the Treasurer on 4 June. On 15 finance companies in this industry, were facJune, the Treasurer was asked this question: ing very serious financial challenges. TheyI refer the Treasurer to his statement in question had been struggling, as had others, to raise time on 4 June that Mr John Grant’s representashort-term finance to roll over their commertions in relation to OzCar were referred to Treascial paper and they were seeking financial ury as the responsible agency for this taxpayer assistance from the Commonwealth governfunded finance company. Will the Treasurer adment in the order of $500 million-half a vise the House what manner of assistance his billion dollars. This was a matter of the office requested Treasury officials were to give to greatest urgency, the greatest necessity, absoMr Grant? lutely vital for the continuance of Ford Mr Swan’s response was as follows: Credit’s operations in Australia. It was at that Mr Grant approached my office. He was referred meeting on 23 February that it was proposed to a departmental liaison officer who then referred the case of John Grant would be taken up. So him on to the relevant section of the department. not only would the Treasury seek financial Mr Grant would have received the same assissupport for Mr Grant, this benefactor of the tance as any other car dealer who was referred Prime Minister, this provider of a free car to through that process received. the Prime Minister-who has more cars and planes that one could possibly imagine-but … Godwin will also raise John’s case with Ford this individual was to have his case raised by Credit when he sees them in Melbourne on Monthe Commonwealth, by the Treasury. That in day. itself is bringing to bear considerable influJohn has not yet been in contact with eitherence on his behalf. But then the circumthe other one being Capital Financialstances in which Ford Credit were asked to We are confident we can arrange for John to be provide support were circumstances in which taken up by one of these two. Ford Credit knew that it needed to do anyThen the email goes on to describe in conthing it could, whatever it could, to be agreesiderable detail the situation of Mr John able to the government. After all, it was Grant, the man of whose affairs the Treasurer seeking half a billion dollars of financial actold this House he knew nothing; his was just commodation from the federal government. another representation that came through the What do we imagine, what would anyone inbox. Following that email, we had a report imagine, went through the minds of the exfrom Mr Grech on Friday evening, after the ecutives of Ford Credit when the Treasury meeting. He says to Andrew Thomas: said, ‘Oh, and there’s this chap John Grant; As promised, I raised the case of John Grant with he’s a Kia dealer, he hasn’t been able to get the CEO of Ford Credit, Greg Cohen, during my his floor plan rolled over with his existing meeting with Ford Credit in Melbourne today. provider; do you think you’d be able to help I met with Ford Credit as part of the ongoing nehim out?’ What are Ford Credit going to do gotiations I have been having-along with Credit when they are asked that question and told Suisse-to come up with a possible response to that he is a friend of the Prime Minister’s? Ford Credit’s request of 14 January 2009 that the They are obviously going to do exactly what Government arrange for Ford Credit to access up they did: spring to attention and seek to rento $500 million for around 12 months to allow it der whatever assistance they can. So here we to continue to run its wholesale floorplan financhave a case where the considerable influing business in Australia. ence-and, in fact, leverage-of the ComAs you know, Ford Credit will shut down the monwealth government is brought to bear on business if they cannot secure access to capital. a finance company that is seeking $500 milI believe that we are getting close to a ‘solution’ lion of finance, the provision of which is which I will be putting to the Treasurer … within absolutely vital for its survival. the next 2-3 weeks. Re John Grant-Cohen gave me an undertaking Now, this was all recited to the Treasurer that Ford Credit will actively look at taking Grant in advance. On Friday, 20 February, his on (this would be for the Kia component of his DLO, departmental liaison officer, Andrew business). Thomas, wrote to the Treasurer and said: What we have here is an email sent by Mr Treasurer Grech to Andrew ThomasBoth Godwin Grech and I have spoken to John Government members interjectingGrant this evening. This is this man who was not treated any right! differently from anybody else and in respect this House a complete indifference! Thomas Treasurer’s home fax. What has the Treaswrote: urer learned from this fax? He knows that, consistent with the plan to which he was a",17,Treasurer That The Leader Of The Opposition Would Be
13,The Speaker,Order! Those on my,19,Treasurer That The Leader Of The Opposition Would Be
14,Of Whose Affairs The Treasurer Professed In Mr Turnbull,"and copied to the party the previous week-on the FridayMr In the light of all of that, the Treasurer Grech raised the concerns of his mate, his came into this House and said: ‘ Mr Grant crony, the Prime Minister’s friend and benewould have received the same assistance as factor, with Ford Credit. any other car dealer who was referred Government members interjectingthrough that process received.’ Notice the use of the word ‘would’. the Opposition will resume his seat. This is a Mr Hale interjectingwho shout the loudest. The Leader of the mon is warned. members of this debate can be heard in sidesigned to create the impression that the lence. Treasurer had no direct knowledge of what Speaker. The plan was hatched the previous that he did receive the same treatment as any week that Mr Grant’s case would be taken up other car dealer; he said he ‘would’ have with Ford Credit by Treasury at a time when done, as though he did not really know and Ford Credit was dependent, was relying for he just assumed that the normal mechanical its own survival as a financing business in bureaucratic processes would have been Australia on getting half a billion dollars complied with. That was a calculated decepfrom the Commonwealth. In that context of tion-calculated to mislead the House and enormous vulnerability, when the influence the public-and, until the truth came out, no of the Commonwealth was greater than it doubt it was successful. could ever be imagined to be in normal cirThen on 4 June he said he had no idea cumstances, at that point John Grant’s case what the outcome of Mr Grant’s representawas raised by the Treasury officials. Then the tions had been, and yet we have page after upshot of the meeting was duly reported that page of detailed accounts of who met whom very evening to Mr Swan and to his office and who rang whom. Even the following and, according to Mr Grech, all went well. week, on 27 February, again in an email sent Ford Credit have said that they will shut directly to the Treasurer himself, he is told down their business if they cannot get the about the progress of the dealer of whose $500 million. In the context of that, when interests and activities he professed no Ford Credit was as desperate as any business knowledge at all. The Treasurer is told: could be for $500 million of Commonwealth Grant said that he had a good meeting with Ford money-can we imagine a position where Credit on Thursday and they told him that while the Commonwealth has greater leverage over they are generally concentrating on Ford dealerany business?-at that point with all of that ships … they were prepared to take him on asleverage, with the knowledge, the connivsuming the numbers add up. ance, the support and the request of the And it goes on in considerable detail. Treasurer, the case of one dealer and one What we have here is a shocking abuse of dealer alone is raised with Ford Credit, and power. We have a Treasurer who has used his who is it? The crony and benefactor of the considerable influence to get a favour for a Prime Minister-John Grant. Nobody else. mate-and not just any mate, the mate who He is a very special person. That was prois a benefactor of the Prime Minister. vided to him. Government members interjecting-",19,Treasurer That The Leader Of The Opposition Would Be
15,The Speaker,Order! The Leader of,20,Treasurer That The Leader Of The Opposition Would Be
16,Serious Matter. It Will Not Be Won By Those The Speaker,The member for Solo,20,Treasurer That The Leader Of The Opposition Would Be
17,"Opposition Will Be Heard In Silence, So All Mr Turnbull",It was deliberately,20,Treasurer That The Leader Of The Opposition Would Be
18,Mr Turnbull,"Thank you, Mr had happened to Mr Grant. He did not saybenches can shout and scream and try their tinues to do so as Prime Minister-here has a distraction as much as they like, but these Treasurer who has lied to the House. strate that there was only one dealer who position should be careful. received that support and it was John Grant. That was the dealer in respect of which the sought to use extraordinary leverage to seek government proclaim complete ignorance, an advantage for a mate, and the Prime Minyet they desperately seek to raise a distracister will not lift a finger against a Treasurer tion from the Treasurer’s situation. who has so abused his power. It is impossible Who could imagine any Treasurer survivto imagine any company being more vulnering-in a government that had any integable and more susceptible to government rity-when he has so manifestly and compressure than Ford Credit. They were fightprehensively breached the ethical standards? ing for their life and they were told: ‘JohnI will quote from the Prime Minister’s minisGrant needs help. He’s not a Ford dealer, but terial standards: he needs help. Oh, and he’s a friend of the Ministers must accept the full implications of the Prime Minister; he’s a mate of the Prime principle of ministerial responsibility. Minister.’ This is the culture of the Labor The Treasurer has said, ‘No, I don’t have to Party. They cannot escape from it: cronyism, worry about that.’ He has no concern about patronage and abandonment of thethat. He says that it is nothing special. NotMr Symon interjectingwithstanding that it is abundantly plain that everything that he has said in this House akin is warned! about John Grant is false, he says that he has louder they scream, the more desperate we The government can raise distractions see them to be as they try to hold up in office about other documents and other emails as a Treasurer who has betrayed the trust of the much as they likeAustralian people and prostituted his responGovernment members interjectingsibilities by seeking to leverage the power of up as much as you like. But you cannot esister’s mate. of the Commonwealth of Australia is a onded? Treasurer who has lied to this House. He said that he had no idea of the progress of Mr serve my right to speak. Grant’s application. He said that he was body else treated like this. The only person (12.25 pm)-I move: who got that treatment was a crony and That all words after “That” be omitted with a benefactor of the Prime Minister. view to substituting the following words: This goes to the very core of the ethical “that this House censures the Leader of the Opposition for relying on, actively communicatstandards of this government. This Prime ing and promoting the contents of a fake email to Minister, who, when he was in opposition, constantly stood up and spoke sanctimoni-",20,Treasurer That The Leader Of The Opposition Would Be
19,Mr Turnbull,The government ously about high ethical standards-and con,21,Treasurer That The Leader Of The Opposition Would Be
20,Emails That Were Tabled In The Senate Demon,The SPEAKER-The Leader of the Op,21,Treasurer That The Leader Of The Opposition Would Be
21,Mr Turnbull,The Treasurer has,21,Treasurer That The Leader Of The Opposition Would Be
22,The Speaker,The member for De,21,Treasurer That The Leader Of The Opposition Would Be
23,No Obligation To Step Down. Mr Turnbull,ethical standards. The,21,Treasurer That The Leader Of The Opposition Would Be
24,Mr Turnbull,Good. You can talk it Commonwealth to advantage the Prime Min,21,Treasurer That The Leader Of The Opposition Would Be
25,Cape The Fact That Presiding Over The Finances The Speaker,Is the motion sec,21,Treasurer That The Leader Of The Opposition Would Be
26,Mr Hockey,I second the motion and re,21,Treasurer That The Leader Of The Opposition Would Be
