speakerGroups,speaker,theText,pageNumbers,title
107,Mr Albanese,"Mr Speaker, I am cercluded, he came back into this House and paign has no credibility. He should table the changed his position. He came in and spoke email. And he should resign. again and changed his position and then OzCar called for a judicial inquiry-completely different from the position which he moved tion is to the Treasurer, and I refer the Treasin the parliament today. He cannot hold a urer to his statement in the House on 4 June, position for a matter of hours, let alone for when he said that Mr John Grant ‘received what is needed given the circumstances of the same assistance as any other car dealer’. the government’s position. Will the Treasurer advise the House how But of course those opposite want to enmany other car dealers he spoke with directly gage in this smear campaign. Last Friday, we on the telephone before referring them to had the Leader of the Opposition standing up Treasury for assistance? and calling for the resignation of the Prime Minister, calling for the resignation of the very clear earlier, that I stood by all of the Treasurerstatements that I have made to the House 100 order, reluctantly-and this is on relevance: no special benefit from OzCar and he rehe has been going for four minutes and he ceived no outcome from Ford Credit whatsohas not been relevant at any time to the quesever. It is also the case that I did say that he tion he has been asked. was treated in the same way as other car the House will respond to the question, relatof course referred on to financiers, and I ing his material to the question. The Leader spent some time talking about that in the of the House. House today. House would prefer to have a debate about me for having faxes go to my home. I simply our legislative agenda and our plans for nacould not believe it when we heard the tion building for recovery. That is what we laughter from the other side that the Treason this side of the House want. Those on that urer of Australia might actually have a fax at side of the House are blocking this because 5.14 pm on a Friday! It says something about they have nothing to say about the future of their approach and their work ethic that they this country, because they have no policy would think that it is hilarious that the Treasalternative, no policy vision, which is why urer of Australia would receive a fax at 5.14 they have gone down to the politics of smear. pm on a Friday. I do not think they would The fact that they cannot even hold a posithink at all about busting their gut for the tion-the fact that the Leader of the OpposiAustralian people on a Friday night, a Saturtion has to speak twice in a debate, giving day or a Sunday, but we will do everything contradictory positions-says it all. that we possibly can to support employment The fact is that they came in and promised in the Australian community. My fax whirrs a smoking gun. Well, there was no chk-chk through the night because the thing about a boom in the parliament today. There was global financial crisis is it does not respect nothing at all. The Leader of the Opposition time zones. Around that stage when faxes has fallen flat on his face. His smear camwere coming in, we were working very hard and indeed working around the clock.",61,Ministerial Arrangements Swinging In The Breeze A Leader Of The Op
108,Mr Turnbull (3.27 Pm),My ques,62,Ministerial Arrangements Swinging In The Breeze A Leader Of The Op
109,Mr Swan,"It is the case, and I made it",62,Ministerial Arrangements Swinging In The Breeze A Leader Of The Op
110,Mr Abbott,"Mr Speaker, on a point of per cent. In the case of Mr Grant, he received",62,Ministerial Arrangements Swinging In The Breeze A Leader Of The Op
111,The Speaker,Order! The Leader of dealers were treated. Other car dealers were,62,Ministerial Arrangements Swinging In The Breeze A Leader Of The Op
112,Mr Albanese,"We on this side of the There was also some criticism directed atThere were a variety of car dealers who we maximise the quality of behaviour and contacted my office, other offices and the the transparency, accountability and integrity Treasury. They worked through the MTAA of our parliamentary process and representaand made contact with the Treasury. I tives, we unfortunately cannot prevent everyspoke-and I said this very clearly in my thing from occurring. Sadly, last Wednesday doorstop-to Mr Grant following a represennight at the press gallery ball there was an tation from Mr Bernie Ripoll. I spoke to him incident involving the Leader of the Opposifor a couple of minutes. I referred him to my tion which indicated the limits that are there, DLO and he was then dealt with by that whether we like it or not, because of the beDLO in the way in which the emails indicate. haviour of individuals who do not seem to I spoke to him. I do not apologise for that for treat the obligations and responsibilities of one minute. their offices seriously. I would like to quote Parliamentary Standards from the statement circulated by Mr Andrew Charlton, adviser to the Prime Minister, about this incident. His recollection of the is to the Minister for Finance and Deregulastatements by the Leader of the Opposition tion, the Minister representing the Special to him at that eventMinister of State. What steps has the govand accountability of the parliamentary proctantly rise on a point of order on relevance. ess? Why is it important to maintain public He is drawing an extremely long bow. This faith in the behaviour of the parliament and matter has been extensively canvassed alits elected representatives? ready in the House today. I think that the minister is really abusing the forms of the House to be going on with it again now. Banks for his question. The government does parliamentary process and the behaviour of the response of the Minister for Finance and elected representatives very seriously, that is Deregulation. He must relate his response to why it takes the accusations that were made the question. extremely seriously. The government has quote Mr Charlton’s recollection of the taken a number of very important steps to statements by the Leader of the Opposition: enhance the integrity and transparency of the Let me give you some advice because I think you process of parliament and elected representahave a very promising career ahead of you. tives, such as electoral reform, which unforIntegrity is the most important thing in the career tunately is blocked in the Senate, that would of a young man. reduce the limit on donations and ban foreign … … … donations, such as the Operation Sunlight set That is why I encourage you, no matter what the of transparency reforms for budget disclocircumstances, no matter what the pressure, not to sure and such as the involvement of the lie. Auditor-General in scrutinising government … … … advertising to determine that it is not politiThis whole Ozcar issue will be very damaging for cally motivated. you. Although the government is committed to Let me just give you some friendly advice. all of these reforms and others to ensure that You should not lie to protect your boss.",62,Ministerial Arrangements Swinging In The Breeze A Leader Of The Op
113,Mr Melham (3.30 Pm),My question,63,Ministerial Arrangements Swinging In The Breeze A Leader Of The Op
114,Ernment Taken To Improve The Transparency Mr Abbott,"Mr Speaker, I again reluc",63,Ministerial Arrangements Swinging In The Breeze A Leader Of The Op
115,Mr Tanner,I thank the member for,63,Ministerial Arrangements Swinging In The Breeze A Leader Of The Op
116,Regard The Integrity And Transparency Of The The Speaker,I will listen carefully to,63,Ministerial Arrangements Swinging In The Breeze A Leader Of The Op
117,By The Leader Of The Opposition Last Friday Mr Tanner,"Thanks, Mr Speaker. I… … … the minister, but the minister I fear is neYou know and I know there is documentary eviglecting that admonition. He really should dence that you have lied. relate his answer to transparency and acEverybody knows what the term ‘friendly countability in government, and he is not. ‘crude threat’-that is what ‘friendly advice’ sition where I cannot give a critique of the means in those circumstances. answer. For people to be truthful in public What we have here is the Leader of the life would restore faith in their elected repreOpposition seeking to intimidate a member sentativesa vague recollection of similar words. I noNew England. I say to the minister that he tice that a former staffer to a former member must relate his material to the question. If he for Wentworth, Mr Peter King, had made is unable to do that, he should sum up his similar statements about the conduct of the answer. member for Wentworth some time ago. He was rung at his home by the member for the Opposition, when this matter was raised Wentworthwith him in public a couple of days ago, Mr Hockey interjectingstated that he was simply reminding someSydney is warned. If he wants to raise points seems to do a lot of. There seems to be a patof order, he can get on his feet, but he cannot tern of bullying that fits the Crabb profile do it by interjection. and the behaviour with respect to the CostiMs Julie BishopMr Speaker, on a point gan royal commission. Integrity and behavof order: this in no way relates to transpariour are important in public life. Not only do ency and accountability of the government, we have a situation in which the Leader of and that is what he was asked about. Any the Opposition is prepared to allege corrupanswer that goes to matters that may have tion against the Prime Minister with not a happened years ago in another context is shred of evidence but we have a Leader of irrelevant to this question. the Opposition who has also been engaged, on the basis of what has now been determined to be a fake email, in bullying the his answer to the question. Prime Minister’s staff in order to try and eye was: this matter. You lied, John. You’ve got to tell the truth. People OzCar could go to jail. Just tell me the truth. It is just so There is a remarkably familiar ring to the is to the Treasurer. I refer the Treasurer to his statements that the adviser to the Prime Minstatementister stated had been made by the Leader of Mr Rudd interjecting-",63,Ministerial Arrangements Swinging In The Breeze A Leader Of The Op
118,Advice’ Means In That Context. It Is Code For The Speaker,I am in the difficult po,64,Ministerial Arrangements Swinging In The Breeze A Leader Of The Op
119,Of The Prime Minister’s Staff By Claiming He Mr Windsor,"Hear, hear!",64,Ministerial Arrangements Swinging In The Breeze A Leader Of The Op
120,Has Documentary Evidence That He Lied. I Had The Speaker,I thank the member for,64,Ministerial Arrangements Swinging In The Breeze A Leader Of The Op
121,Mr Tanner,I note that the Leader of,64,Ministerial Arrangements Swinging In The Breeze A Leader Of The Op
122,The Speaker,"The member for North body of the ninth commandment, which he",64,Ministerial Arrangements Swinging In The Breeze A Leader Of The Op
123,The Speaker,The minister will relate,64,Ministerial Arrangements Swinging In The Breeze A Leader Of The Op
124,Mr Tanner,The quote that caught my force that person to lie. That is the truth of,64,Ministerial Arrangements Swinging In The Breeze A Leader Of The Op
125,Important To Tell The Truth. Mr Hockey (3.37 Pm),My question,64,Ministerial Arrangements Swinging In The Breeze A Leader Of The Op
126,The Opposition. Mr Hockey,Do you have something,64,Ministerial Arrangements Swinging In The Breeze A Leader Of The Op
127,Mr Abbott,"Mr Speaker, on a point of to say, Prime Minister?",64,Ministerial Arrangements Swinging In The Breeze A Leader Of The Op
128,Order: I Appreciate That You Have Admonished Honourable Members Interjecting,"Sydney will resume his seat. Order! Werriwa for his question. When it comes to Treasurer. I refer the Treasurer to his statepublic debate, it is more than a little imporment in this House on 4 June when he retant that the highest standards of integrity ferred to Mr John Grant’s case and said: ‘I and honesty be maintained. Our legal have no idea what the outcome of that was.’ framework for dealing with deceptive conWill the Treasurer advise the House how duct in the business world is also vital to many other car dealers had updates on their ensure that consumers and investors are fully cases faxed directly to his home? informed in making financial decisions, because without access to truthful information the market simply would not function proption in the House, I did have no idea of what erly as poor economic decisions would be the outcome of that case was. There were no made. Investors, companies and consumers further emails to me about Mr Grant from have the right to truthful information-much the department and/or updates in my in tray, the same as citizens and voters have the right which I was receiving on a regular basis. The to that truthful information. fact is, this was a very serious matter. I was concerned about what was going on in the I was asked about concerns about the sale industry. I was getting updates from the deof certain insurance companies. The House partment. But on this occasion they were not may be aware of concerns relating to the tacgoing to my home fax because I was not at tics that surrounded the selling of FAI insurhome; they were going to my in tray. There ance to HIH, which played a very important were updates coming through from the derole in the downfall of HIH. In 1997, Goldpartment on the number of dealers that had man Sachs Australia considered being a experienced difficulties and the progress of party to the purchase of FAI. After a thorall of the issues, including the creation of ough study of the business of FAI, the OzCar, the whole issue of Ford Credit and so chairman of Goldman Sachs Australia conon. There was plenty of information coming cluded that the business was in bad shape to me on the state of the industry and how and was worth very little. That chairman was dealers were affected. Mr Malcolm Turnbull. Financial Services Industry On7 September 1998, Mr Turnbull sent a memorandum to Goldman Sachs executives in New York advising them that the assets of to the Minister for Financial Services, Superthe business were worth very little. He said: annuation and Corporate Law and Minister for Human Services. Minister, are you conWe estimate that the true net assets of FAI (that is, after write-downs and unwinding of reinsurance cerned about reports of misleading conduct contracts) is approximately $20 million, comwith regard to the sale of Australian insurpared with a stated book value of $220 million. ance companies? How important is it that people in the financial services industry Fair enough. They did their work with due maintain the highest standards of conduct, diligence and decided that it was not worth accountability and integrity? Minister, what very much at all. But Mr Turnbull then recent threats have there been to these stanagreed to help Mr Rodney Adler sell FAI dards? insurance. In the process of finding a buyer, it would be common practice for FAI to ap-",64,Ministerial Arrangements Swinging In The Breeze A Leader Of The Op
129,The Speaker,The member for North Mr BOWEN-I thank the member for,65,Ministerial Arrangements Swinging In The Breeze A Leader Of The Op
130,Mr Hockey,My question is to the the proper functioning of markets and our,65,Ministerial Arrangements Swinging In The Breeze A Leader Of The Op
131,Mr Swan,When I was asked that ques,65,Ministerial Arrangements Swinging In The Breeze A Leader Of The Op
132,Mr Hayes (3.39 Pm),"My question ispoint an independent valuation expert to give closely to the claims that are being made by potential buyers some information about the the minister. The minister is responding to value of the business. Mr Turnbull not only the question. them not to do it. Mr Turnbull wrote to Mr have a claim seeking $529 million in damAdler recommending against the appointages, comprising the $295 million paid by ment of an independent financial examinaHIH for FAI and $234 million in interest. tion of FAI, stating, ‘It may not be in FAI The HIH liquidatorshareholders’ interests to have such an investigation conducted and presented.’ On 11 January 1999-four months after stein will resume his seat. Mr Turnbull argued that there was little value mation provided by FAI and Mr Turnbull the Turnbull and others misled the non-executive insurance firm HIH purchased FAI for $295 directors of FAI. The Acting Leader of the million. House is on his feet! of order. I hate to be pedantic, but there is a der, Mr Speaker, on the matter of relevance. standing order about referring to members by He is not being relevant to the question. government is trying to do here. It is smear sponding to the question. ringah will resume his seat. The minister will by a confidential settlement. We do not know refer to members by their parliamentary tithe details but we know it has been settled. tles. But there will be no confidential settlement Wentworth therefore noted that the assets in the House over the last few hours. There is were truly worth $20 million but was innowhere to hide from this one. There will be volved in the sale of FAI insurance for $295 no confidential settlement on lying about an million. On 21 June 2006, the liquidator of email, because he might be able to hide beHIH served a claim on Mr Turnbull, the now hind a confidential settlement in the business member for Wentworth-and othersworld but you cannot hide behind one in seeking $529 million in damages, comprispolitics. of order. Implicit in what the minister is sayOpposition of something of which people ing are grave charges. If they want to make should not be accused in this way, other than this kind of charge in the parliament, they by substantive motion. He should withdraw. should proceed by way of a substantive moNot only should he not say it; he should tion. These matters have all been heard by withdraw it. ringah will resume his seat. I will listen ing the 3½ hours that preceded question time",65,Ministerial Arrangements Swinging In The Breeze A Leader Of The Op
133,Did Not Advise Them To Do This; He Advised Mr Bowen,"Thanks, Mr Speaker. We",66,Ministerial Arrangements Swinging In The Breeze A Leader Of The Op
134,Honourable Members Interjecting,,66,Ministerial Arrangements Swinging In The Breeze A Leader Of The Op
135,The Speaker,The member for Gold,66,Ministerial Arrangements Swinging In The Breeze A Leader Of The Op
136,In The Fai Business,on the basis of inforMr BOWEN-This claim was that Mr,66,Ministerial Arrangements Swinging In The Breeze A Leader Of The Op
137,Mr Abbott,"Mr Speaker, I rise on a point Mr Hartsuyker-I rise on a point of or",66,Ministerial Arrangements Swinging In The Breeze A Leader Of The Op
138,Their Proper Titles. We All Know What The The Speaker,The minister is re,66,Ministerial Arrangements Swinging In The Breeze A Leader Of The Op
139,And Smear And Smokescreen. Mr Bowen,I should disclose to the,66,Ministerial Arrangements Swinging In The Breeze A Leader Of The Op
140,The Speaker,The member for WarHouse that this matter has now been settled,66,Ministerial Arrangements Swinging In The Breeze A Leader Of The Op
141,Mr Bowen,The now member for about misleading behaviour on other matters,66,Ministerial Arrangements Swinging In The Breeze A Leader Of The Op
142,Ing The $295 Million,"Mr Abbott-I rise on a point of order, Mr",66,Ministerial Arrangements Swinging In The Breeze A Leader Of The Op
143,Mr Abbott,"Mr Speaker, I rise on a point Speaker. He has accused the Leader of the",66,Ministerial Arrangements Swinging In The Breeze A Leader Of The Op
144,Royal Commission,The SPEAKER-The member for War,66,Ministerial Arrangements Swinging In The Breeze A Leader Of The Op
145,The Speaker,"The member for Warringah will resume his seat. Regrettably, durmade. I ask members to desist from making mumblings! I am saying to people, now, that those comments, and to be careful with the that type of language will not be allowed. Speaker. Strong language is traditionally never lets the facts get in the way of his ampermitted during a censure debate, which is bition-whether it was HIH or the ute affair. effectively what the earlier debate was. It is He cannot hide in this particular matter. The not permitted to accuse members of lying, in Australian people will hold him to account question time. for putting his ambition ahead of the facts. Government members interjectingOzCar ringah will resume his seat. Those on my my question is to the Treasurer. I refer the right! Regrettably, the contention that the Treasurer to his statement in the House on 4 member for Warringah is putting to me is not June, when he said that Mr John Grant ‘made correct. It is assumed that there should be a representations to my office, and he was remore robust debate which I, as the predomiferred on to the SPV, just like everybody nant person that was in the chair for the deelse’. Can the Treasurer confirm that at a bate, allowed. I am now learning my lesson! meeting between Treasury officials and the It is usual, if we are going to have those rochief executive of Ford Credit in Melbourne, bust charges made, that they are part of the on Monday, 23 February this year, at which motions that we are discussing, and on this Ford Credit was seeking access to more than occasion they were not. Perhaps, to clarify half a billion dollars of taxpayers funds, Mr the matter I should have pulled up these Grant’s case was raised and his mobile telecomments earlier in the debate. I have indiphone number handed over by Treasury officated to the minister and those who follow cials in the full knowledge of both the Treasthat they should be a bit more careful with urer and his office? of order. I do not wish to needlessly prolong car dealers in contact with financiers simply this, Mr Speaker, but the member did accuse becausenormally unparliamentary and he should withdraw it. And he should not use that lantime because OzCar had not been established guage in question time. and, as the correspondence makes abuncomments about that. The minister has the who were having their finance withdrawn by call but he will desist, from now on-and I GE Finance or GMAC was for them to be think that is on the basis of what has happicked up by those that were in the market at pened over the last four hours. From now on the moment. I will be alert. cannot hear the Treasurer because of inter-",66,Ministerial Arrangements Swinging In The Breeze A Leader Of The Op
146,There Were Accusations Of A Similar Nature The Speaker,Interjections and,67,Ministerial Arrangements Swinging In The Breeze A Leader Of The Op
147,Language That They Are Using. Mr Bowen,"Thanks, Mr Speaker. We",67,Ministerial Arrangements Swinging In The Breeze A Leader Of The Op
148,Mr Abbott,"I rise on a point of order, Mr now know that the Leader of the Opposition",67,Ministerial Arrangements Swinging In The Breeze A Leader Of The Op
149,The Speaker,"The member for WarMr HOCKEY (3.49 pm)Mr Speaker,",67,Ministerial Arrangements Swinging In The Breeze A Leader Of The Op
150,The Language That They Use. Mr Swan,As I was saying in the de,67,Ministerial Arrangements Swinging In The Breeze A Leader Of The Op
151,Mr Abbott,"Mr Speaker, I rise on a point bate this morning, the Treasury was putting",67,Ministerial Arrangements Swinging In The Breeze A Leader Of The Op
152,The Leader Of The Opposition Of Lying. That Is Opposition Members Interjecting,,67,Ministerial Arrangements Swinging In The Breeze A Leader Of The Op
153,Mr Swan,They were doing it all the,67,Ministerial Arrangements Swinging In The Breeze A Leader Of The Op
154,The Speaker,"I have indicated my dantly clear, the only course for those dealers",67,Ministerial Arrangements Swinging In The Breeze A Leader Of The Op
155,Honourable Members Interjecting,,67,Ministerial Arrangements Swinging In The Breeze A Leader Of The Op
156,Honourable Members Interjecting,,67,Ministerial Arrangements Swinging In The Breeze A Leader Of The Op
