speakerGroups,speaker,theText,pageNumbers,title
171,Mr Truss (Wide Bay,"Leader of The keep on spending.'New South Wales government and the promised the Australian people that he was a Victorian government for having to cut fiscal conservative, Labor delivered their expenditure. This is a further reflection of first budget, promising a $22 billion surplus. the way Labor believe debt should be dealt We all know that that turned into a $27 with. The Queensland LNP government does billion debt. The $70 billion that was in the not want to cut expenditure. They would like bank and that they inherited has now gone to keep going on spending-as all of us and they are way into the red. Our national would like to keep on spending. They are not debt is at a record-a staggering $145 doing this because they want to do it; they billion. are doing it because they have to do it. But they have not stopped the promises. Labor has spent the state into a $70 billion They are still out there with these big debt, rising much higher as time goes by. announcements that are simply not funded. The state has lost its credit rating under That is what has delivered a $120 billion Labor. black hole, on top of the existing debt that Queenslanders are paying hundreds of Australians are going to have to fund. There millions of dollars more than they should is a whole array of announcements. There is because of the higher interest rates caused by to be $10 billion a year for the National Labor spending irresponsibly-and, again, it Disability Insurance Scheme-a project that had no plan to ever pay that money back. everyone would like to see put in place, but Now the South Australian Labor government Labor have not provided the money. They has had its credit rating downgraded. What is have even boasted that they have delivered Labor's response? Keep on spending-spend the National Disability Insurance Scheme, your way out of debt. This is the kind of but it is unfunded. There is $4 billion for a illogical economic policy that has given that new dental health package. They are not state so much trouble over the years. telling the Australian people, who are despairingly starting to wake up to this, that Every Labor government leaves behind a as of last week they have actually cancelled legacy of debt. It is quite clear from the the previous government's billion-dollar minister's recent comment that they do not dental scheme. care. The mantra of the government has been heroic announcements. They revel in rhetoric No-one can now get any government and big-vision type announcements full of funded dental treatment, because the carefully crafted speeches, but with no plan government have cancelled the previous ever to pay for them. They are big on government's billion-dollar scheme. The new overcooked promises but they are hopeless program does not start until 2014-after this on delivery. The cost blow-outs, along with financial year, when they are trying to commodity prices in freefall, mean that any deliver some kind of fake budget surplus. It hope Labor ever had of achieving its $1.5 is a long wait to get your tooth filled, but that billion surplus is long gone. The budget was is where the government are going with their never honest. There was never any likelihood overblown rhetoric. that it would return to surplus. The Gillard There is $6.5 billion a year on the Gonski and Rudd governments have never delivered education program not funded. There is $3.7 a budget surplus. This is not the first time billion for aged care, but there has been no they have promised one-they promised it in new money for a long time and even when their very first budget. After Kevin Rudd had the program is fully implemented most of it will come from older Australians whether this is a place they should invest themselves-it is not a government program. in-we have a government that cannot be There will be $2.2 billion for mental health, trusted, that does not understand economics, but they are actually cutting expenditure for that does not care about debt. mental health this year. The Treasurer has been asked over recent They are up to their old tricks. We have days about what he proposes to do about this seen these grand plan announcements debt and what new taxes are going to be before-big promises but they are not introduced. There are 26 new ones already delivered on. There was GroceryWatch; and another 20 at least are being talked Fuelwatch-it did not even get off the about, including the horrors of death duties, ground; cash for clunkers, abolished before it which the Treasurer was not willing to rule started; the green loans scheme, which has out yesterday. The reality is that Labor left so many people out of pocket; $2.4 continues to deliver record deficits, record billion for the pink batts that went up in expenditure and record incompetence. smoke, with 250,000 botched installations Australians are paying for this at the rate of and a thousand electrified roofs; and then $20 million a day in interest and they will there was the Building the Education keep paying for it for generations. (Time Revolution, which delivered overpriced expired) school halls, and the computers that were Dr LEIGH (Fraser) (15:59): If you want supposed to go to every child between years to know what the member for North Sydney nine and 12, costing $900 million. It cost thinks about debt, don't listen to what he says $2.3 billion and ran years late. Labor is out in this House. You know what those opposite there just cynically trying to buy votes. They say in this House is not to be taken as gospel are talking up the rhetoric, but everyone truth. Listen to what he said on 17 April, needs to remember that the money is not when he travelled to London to give a speech there to pay for any of these programs. and talked about the debt that Hong Kong Labor's $120 billion black hole is not just held. He said that the debt that Hong Kong on paper-it has a direct effect on families. It held was 'moderate'. How much debt does is not pretend money, as the minister Hong Kong hold? It holds debt that is 34 per suggested. There will be an ongoing cost for cent of GDP in gross terms. That is about Australian households and Australian twice Australia's gross debt, which will peak businesses. As a result of this great black at 18 per cent. So the only reasonable way hole, as a result of this debt, there will be the member for North Sydney could less money to be spent on health, education, characterise Australia's debt would be 'low'. roads, defence and all the important things Australia's net debt will peak at 9.6 per cent. that governments must do, because money So, if you want to find what those opposite will first have to be paid as interest to the really think about the economy, look at what bankers. They are the people who are going they say when they go to London. When the to demand interest on this debt, the people member for North Sydney went to London, who will decide whether even the federal he noted that Hong Kong's debt was government can maintain its credit rating if it moderate; therefore, ours would be low. keeps on spending, spending, spending with When the Leader of the Opposition went to no plan whatsoever to pay the debt back. Is it London last year, he said: any wonder that countries around the world are observing Australia and wondering … Australia has serious bragging rights … Berowra, Bonner, McMillan, Wright, Cook, Compared to most developed countries, our Indi, Swan, Moncrieff and Leichhardt all economic circumstances are enviable. hold mortgages, as does the member for The opposition get the economic truth-telling Warringah. His mortgage was a little late in gold when they go to London! The trouble is coming on to the Register of Members' that, when they get back to Australia, they do Interests, but it did get on there eventually, not make the medal ranks because they with a story in June 2010 over his failure to cannot be honest with the Australian people declare a $710,000 mortgage. 'What's that as and tell them that Australia's debt levels are a share of income?' I hear you ask. 'If he's around a 10th of those of the major worried about this country's debt levels being economies. Nine point six per cent of GDP is 9.6 per cent of GDP, I bet he's got a small like someone earning $100,000 a year owing mortgage.' Well, no; in fact, his mortgage a modest $9,600. was then about 300 per cent of his annual If you want to know what those opposite income. There is nothing wrong with that. It really think of debt, again, don't listen to is perfectly fine for the Leader of the what they say in this place; listen to what Opposition to take out a mortgage because they tell the Register of Members' Interests. he thinks that is a good way of securing his If they really believed what they said, that future. I would just like to see him have the debt is a bad idea, then you would not expect same commitment to securing the future of to find that any of them personally held debt, low-income Australians, because they are the would you? You would think that, if debt is ones that get wiped out in recessions. bad for the country, then it must be bad for Let's be very clear about what the them. You would think, for instance, that the opposition's anti-debt strategy means. When member for Aston would not have a the global financial crisis hit, the revenue mortgage. You would think you would not write-downs were two-thirds of the total debt see a mortgage for the member for Forde, the we took on. So, if you take the view that we member for Mitchell, the member for should not have taken on debt, what you are Boothby and the member for Casey. The saying is, 'Bring on the firings; if only the member for Paterson and the member for government had cut back at the same rate as Mackellar also hold mortgages, as do the the private sector when the global downturn member for Dunkley, the member for Sturt, hit, everything would have been all right.' the member for Wannon, the member for But we have a historical example of just that: Canning, the member for Herbert, the Herbert Hoover, in the teeth of the Great member for Flinders and the members for Depression, as the member for Wakefield Groom, Mayo, Ryan and Gilmore. was reminding me earlier, cut back on I note in passing that the member for government spending as the Great North Sydney himself has a mortgage. He Depression hit. But the impact of doing that thinks it is worth taking on some debt for his here would have been brutal to young own future, but he thinks it is a bad idea to Australians and low-skilled Australians, who save the jobs of some poor people. The are the first to be hit when a downturn member for Bennelong, the member for strikes. Kooyong, the member for Pearce, the So, really, those opposite are just playing member for Curtin, the member for Higgins, politics with debt. They do not really believe the member for Hasluck and the members for it. They carry debt themselves; they take out Macquarie, Cowan, Stirling, Dickson, mortgages. But they come in here and rail against Australia's debt. If you take them to Mr Tony Smith: Mr Deputy Speaker London, they might tell you the truth; but Murphy, on a point of order-and I follow bring them in here and they will angrily rail on from the member for Aston'smost awful Lenin quotes: point of order, Member for Casey? It would not matter a jot if three-quarters of the Mr Tony Smith: The point of order is human race were destroyed; the important thing is that what the member is saying should bear that the remaining quarter should be Communist. some relationship to the topic of this MPI, Those opposite seem to be taking a leaf out which is debtof Lenin's book. They would rather see the Australian economy suffer than see Labor for Casey will resume his seat. He knows succeed. That is the Leader of the that an MPI debate is a wide-ranging debate Opposition's modus operandi. As David and there is a lot of licence given to what is Marr's Quarterly Essay reminded us: contributed in this chamber. There was always the Santamaria way: when you haven't got the numbers, be vicious. It's called Dr LEIGH: The destructive politics on minority politics. Abbott would come to play debt are characteristic of the way in which them superbly, having learnt in the Democratic this opposition does business. In a piece Club how small constituencies can cause big entitled 'Small target, big letdown' Peter trouble. Hartcher, writing in the Sydney Morning Mr Marr talks about how the Leader of the Herald, talked about the opposition's strategy Opposition pursued that strategy, first as being in the vein of Achilles: they rage through 'don't know, vote no' in the against everything in front of them. My referendum on the republic, and then in friend Macgregor Duncan has noted, minority parliament. As the then tyro similarly, that the opposition seem to be journalist writing for the Bulletin, now the behaving like an Achilles rather than like a member for Wentworth, wrote of the Leader Hector. The opposition are out there to of the Opposition-this is well before either attack, to criticise to condemn. They are not of them entered politics, but you can imagine there to build and to create. I will end there. Mr Tudge: Mr Deputy Speaker Murphy, the House and Minister for Infrastructure and I rise on a point of order on relevance. This Transport) (16:07): I move: MPI is in relation to debt, and the member That government business be brought on. should be relevant to the MPI. The House divided. [16:11] Murphy): The member for Aston will Ayes ...................... 69 resume his seat. Noes ...................... 67 Dr LEIGH: Malcolm Turnbull wrote: Majority................. 2 The leading light of the right wingers in New AYES South Wales is twenty-year-old Tony Abbott. He Adams, DGH Albanese, AN has written a number of articles on AUS in the Bandt, AP Bird, SL Australian and his press coverage has accordingly Bowen, CE Bradbury, DJ given him a stature his rather boisterous and Brodtmann, G Burke, AS immature rhetoric doesn’t really deserve. Butler, MC Byrne, AM Champion, ND Cheeseman, DL",115,Matters Of Public They Do It The Next Time Too
172,Against Debt. I Am Reminded Of One Of The The Deputy Speaker,What is the,119,Matters Of Public They Do It The Next Time Too
173,The Deputy Speaker,The member,119,Matters Of Public They Do It The Next Time Too
174,Some Of It Is Still There Today,Mr ALBANESE (Grayndler-Leader of,119,Matters Of Public They Do It The Next Time Too
175,The Deputy Speaker ( Mr The Deputy Speaker,"Ms AE Burke)AYES NOES Clare, JD Collins, JM O'Dwyer, KM Prentice, J Crean, SF Danby, M Pyne, CM Ramsey, RE D'Ath, YM Dreyfus, MA Randall, DJ Robert, SR Elliot, MJ Ellis, KM Roy, WB Ruddock, PM Emerson, CA Fitzgibbon, JA Schultz, AJ Scott, BC Garrett, PR Georganas, S Secker, PD (teller) Simpkins, LXL Gibbons, SW Gray, G Smith, ADH Somlyay, AM Grierson, SJ Griffin, AP Southcott, AJ Stone, SN Hall, JG (teller) Hayes, CP Tehan, DT Truss, WE Husic, EN (teller) Jenkins, HA Tudge, AE Turnbull, MB Jones, SP Katter, RC Van Manen, AJ Vasta, RX Kelly, MJ King, CF Washer, MJ Windsor, AHC Leigh, AK Livermore, KF Wyatt, KG Lyons, GR Macklin, JL Marles, RD McClelland, RB Melham, D Mitchell, RG PAIRS Murphy, JP Neumann, SK Oakeshott, RJM O'Connor, BPJ Combet, GI Robb, AJ O'Neill, DM Owens, J Ferguson, LDT Haase, BW Parke, M Perrett, GD Ferguson, MJ Billson, BF Plibersek, TJ Ripoll, BF Gillard, JE Abbott, AJ Rishworth, AL Rowland, MA Rudd, KM Mirabella, S Roxon, NL Saffin, JA Smith, SF Coulton, M Shorten, WR Sidebottom, PS Smyth, L Snowdon, WE Swan, WM Symon, MS Question agreed to. Thomson, CR Thomson, KJ Vamvakinou, M Wilkie, AD BILLS Zappia, A Environment Protection and Biodiversity Conservation NOES Amendment (Declared Fishing Alexander, JG Andrews, KJ Activities) Bill 2012 Andrews, KL Baldwin, RC Second Reading Bishop, BK Bishop, JI Briggs, JE Broadbent, RE Debate resumed on the motion: Buchholz, S Chester, D That this bill be now read a second time. Christensen, GR Ciobo, SM Cobb, JK Crook, AJ to which the following amendment was Dutton, PC Entsch, WG moved: Fletcher, PW Forrest, JA That all words after ""That"" be omitted with a Frydenberg, JA Gambaro, T Gash, J Griggs, NL view to substituting the following words: Hartsuyker, L Hawke, AG ""whilst not declining to give the bill a second Hockey, JB Hunt, GA reading, the House calls on the Minister for Irons, SJ Jensen, DG Sustainability, Environment, Water, Population Jones, ET Keenan, M and Communities to explain: Kelly, C Laming, A Ley, SP Macfarlane, IE (1) the reasons for his decision to reverse the Marino, NB Markus, LE policy that he introduced as Fisheries Minister in Matheson, RG McCormack, MF October 2009 which stated: 'There are Morrison, SJ Moylan, JE considerable economies of scale in the fishery Neville, PC (teller) O'Dowd, KD and the most efficient way to fish may include amendment moved by the member for large scale factory freezer vessels'; Flinders be agreed to. (2) why he effectively invited the Margiris The House divided. [16:26] into Australia by promoting 'large scale factory freezer vessels'; and (The Deputy Speaker-Ms AE Burke) (3) what actions he will take to compensate Ayes ...................... 66 the 50 Australian workers who are losing their Noes ...................... 70 Majority................. 4 jobs as a consequence of this legislation."" Sustainability, Environment, Water, Alexander, JG Andrews, KJ Population and Communities) (16:20): I Andrews, KL Baldwin, RC Bishop, BK Bishop, JI want to thank all members who have Briggs, JE Broadbent, RE contributed to the debate. During the debate, Buchholz, S Chester, D a number of issues have been raised by the Christensen, GR Ciobo, SM opposition and the crossbench. During that Cobb, JK Crook, AJ time the government has circulated Dutton, PC Entsch, WG Fletcher, PW Forrest, JA amendments which I believe address each Frydenberg, JA Gambaro, T and every one of these issues. Gash, J Griggs, NL Ultimately we will not be in a situation Hartsuyker, L Hawke, AG Hockey, JB Hunt, GA where we are voting on a bill that simply Irons, SJ Jensen, DG effects the large changes in fisheries activity Jones, ET Keenan, M which are currently being contemplated. NoKelly, C Laming, A one in the next vote can hide behind a Ley, SP Macfarlane, IE Marino, NB Markus, LE recreational fishing argument. No-one in the Matheson, RG McCormack, MF next vote can hide behind this bill having Morrison, SJ Moylan, JE any impact on social or economic Neville, PC (teller) O'Dowd, KD considerations. No-one in the next vote can O'Dwyer, KM Prentice, J Pyne, CM Ramsey, RE hide behind this being somehow something Randall, DJ Robert, SR that would affect current fishing businesses' Roy, WB Ruddock, PM fishing activity. Schultz, AJ Scott, BC Secker, PD (teller) Simpkins, LXL The bill that is before us has had the Smith, ADH Somlyay, AM astonishing aspect in the debate of people Southcott, AJ Stone, SN being outraged about a marine park that is Tehan, DT Truss, WE 400 kilometres away but not caring about the Tudge, AE Turnbull, MB Van Manen, AJ Vasta, RX depletion of fish stocks 5½ kilometres Washer, MJ Wyatt, KG offshore. In this vote, the government will remain true to its commitment on our oceans-whether it be protecting the Great NOES Barrier Reef, protecting the oceans or Adams, DGH Albanese, AN making sure that we have an appropriate Bandt, AP Bird, SL precautionary principle that applies to Bowen, CE Bradbury, DJ fisheries. Brodtmann, G Burke, AS Butler, MC Byrne, AM Burke): The immediate question is that the Clare, JD Collins, JM Crean, SF Danby, M",119,Matters Of Public They Do It The Next Time Too
176,Mr Burke (Watson,Minister for AYES,121,Matters Of Public They Do It The Next Time Too
177,"The Deputy Speaker (Ms Ae Champion, Nd Cheeseman, Dl","NOES AYES D'Ath, YM Dreyfus, MA Adams, DGH Albanese, AN Elliot, MJ Ellis, KM Bandt, AP Bird, SL Emerson, CA Fitzgibbon, JA Bowen, CE Bradbury, DJ Garrett, PR Georganas, S Brodtmann, G Burke, AS Gibbons, SW Gray, G Butler, MC Byrne, AM Grierson, SJ Griffin, AP Champion, ND Cheeseman, DL Hall, JG (teller) Hayes, CP Clare, JD Collins, JM Husic, EN (teller) Jenkins, HA Crean, SF Danby, M Jones, SP Katter, RC D'Ath, YM Dreyfus, MA Kelly, MJ King, CF Elliot, MJ Ellis, KM Leigh, AK Livermore, KF Emerson, CA Fitzgibbon, JA Lyons, GR Macklin, JL Garrett, PR Georganas, S Marles, RD McClelland, RB Gibbons, SW Gray, G Melham, D Mitchell, RG Grierson, SJ Griffin, AP Murphy, JP Neumann, SK Hall, JG (teller) Hayes, CP Oakeshott, RJM O'Connor, BPJ Husic, EN (teller) Jenkins, HA O'Neill, DM Owens, J Jones, SP Katter, RC Parke, M Perrett, GD Kelly, MJ King, CF Plibersek, TJ Ripoll, BF Leigh, AK Livermore, KF Rishworth, AL Rowland, MA Lyons, GR Macklin, JL Roxon, NL Saffin, JA Marles, RD McClelland, RB Shorten, WR Sidebottom, PS Melham, D Mitchell, RG Smyth, L Snowdon, WE Murphy, JP Neumann, SK Swan, WM Symon, MS Oakeshott, RJM O'Connor, BPJ Thomson, CR Thomson, KJ O'Neill, DM Owens, J Vamvakinou, M Wilkie, AD Parke, M Perrett, GD Windsor, AHC Zappia, A Plibersek, TJ Ripoll, BF Rishworth, AL Rowland, MA Roxon, NL Saffin, JA Smyth, L Snowdon, WE Abbott, AJ Gillard, JE Swan, WM Symon, MS Billson, BF Ferguson, MJ Thomson, CR Thomson, KJ Coulton, M Smith, SF Vamvakinou, M Wilkie, AD Haase, BW Ferguson, LDT Zappia, A Mirabella, S Rudd, KM Robb, AJ Combet, GI NOES Question negatived. Alexander, JG Andrews, KJ Andrews, KL Baldwin, RC Burke): The question now is that this bill be Briggs, JE Broadbent, RE read a second time. Buchholz, S Chester, D Christensen, GR Ciobo, SM The House divided. [16:31] Cobb, JK Crook, AJ (The Deputy Speaker-Ms AE Burke) Dutton, PC Entsch, WG Fletcher, PW Forrest, JA Frydenberg, JA Gambaro, T Ayes.......................69 Gash, J Griggs, NL Noes.......................67 Hartsuyker, L Hawke, AG Majority .................2 Hockey, JB Hunt, GA Irons, SJ Jensen, DG Jones, ET Keenan, M",121,Matters Of Public They Do It The Next Time Too
178,"The Deputy Speaker (Ms Ae Bishop, Bk Bishop, Ji","NOES BILLS Kelly, C Laming, A Environment Protection and Ley, SP Macfarlane, IE Marino, NB Markus, LE Biodiversity Conservation Matheson, RG McCormack, MF Amendment (Declared Fishing Morrison, SJ Moylan, JE Activities) Bill 2012 Neville, PC (teller) O'Dowd, KD O'Dwyer, KM Prentice, J Consideration in Detail Pyne, CM Ramsey, RE Bill-by leave-taken as a whole. Randall, DJ Robert, SR Schultz, AJ Scott, BC leave-I move amendments (1) and (2) as Secker, PD (teller) Simpkins, LXL circulated in my name together: Smith, ADH Somlyay, AM Southcott, AJ Stone, SN (1) Schedule 1, item 1, page 3 (line 7), before Tehan, DT Truss, WE Chapter 5B insert: Tudge, AE Turnbull, MB Chapter 5AA-Oversize Fishing Vessels Van Manen, AJ Vasta, RX Washer, MJ Windsor, AHC Part 15AA-Oversize Fishing Vessels Wyatt, KG Division1 Prohibition 390SAA Civil penalty-fishing activity A person must not engage in fishing activity Combet, GI Robb, AJ Ferguson, LDT Haase, BW using an oversize fishing vessel in a Ferguson, MJ Billson, BF Commonwealth marine area. Gillard, JE Abbott, AJ Civil penalty: Rudd, KM Mirabella, S Smith, SF Coulton, M (a) for an individual-5,000 penalty units; (b) for a body corporate-50,000 penalty units. Question agreed to. Note: If a body corporate is found to have Bill read a second time. contravened this section, an executive officer of the body may be found to have contravened section 494. Burke) (16:32): Order! It being 4.30pm I (1) A person commits an offence if: propose the question: (a) the person takes an action; and That the House do now adjourn. (b) the action is taken in a Commonwealth Mr Albanese: Madam Deputy Speaker, I marine area; and require that the question be put immediately. (c) the action is a fishing activity using an oversize fishing vessel. Question negatived. Penalty: Imprisonment for 7 years or 420 penalty units, or both. Note 1: If a body corporate is found to have committed an offence against this section, an executive officer of the body may be found to have committed an offence against section 495.",122,Pairs Shorten Wr Sidebottom Ps
179,"Roy, Wb Ruddock, Pm Mr Bandt (Melbourne) (16:36",by,123,Adjournment 390sab Offence Fishing Activity Using An
