speakerGroups,speaker,theText,pageNumbers,title
0,Schools .......................................................................................................................... 10584 Health And Medical Research ........................................................................................ 10586 Fisheries ........................................................................................................................ 10587 National Disability Insurance Scheme .......................................................................... 10588 Budget ........................................................................................................................... 10590 Suicide ........................................................................................................................... 10590 Broadband ..................................................................................................................... 10592 Syria .............................................................................................................................. 10592 Budget ........................................................................................................................... 10593 Community Services And Family Payments .................................................................. 10594 Carbon Pricing .............................................................................................................. 10595 Workplace Stress ........................................................................................................... 10597 Carbon Pricing .............................................................................................................. 10598 Queensland Government ............................................................................................... 10599 House Of Representatives Practice ................................................................................ 10600 Privilege ........................................................................................................................ 10600 Presentation ................................................................................................................ 10601 Selection Committee,"Report ......................................................................................................................... 10601 Tax Laws Amendment (Investment Manager Regime) Bill 2012Higher Education Support Amendment (Student Contribution Amounts and Other Measures) Bill 2012Navigation Bill 2012Navigation (Consequential Amendments) Bill 2012Assent ......................................................................................................................... 10602 Budget ........................................................................................................................... 10602 Environment Protection and Biodiversity Conservation Amendment (Declared Fishing Activities) Bill 2012Second Reading.......................................................................................................... 10614 Environment Protection and Biodiversity Conservation Amendment (Declared Fishing Activities) Bill 2012Consideration in Detail .............................................................................................. 10617 Third Reading............................................................................................................. 10623 Leave of Absence ....................................................................................................... 10623 Federation Chamber Centrelink ...................................................................................................................... 10624 Grayndler Electorate: Dorothea Mackellar Poetry Awards ........................................... 10625 Centrelink ...................................................................................................................... 10626 Fowler Electorate: Young Adults Disabled Association ................................................ 10627 Longman Electorate: Dragons Abreast Bribie Island .................................................... 10627 Corio Electorate: Reading Recovery ............................................................................. 10628 RU OK? Day ................................................................................................................ 10629 Radioactive Waste ......................................................................................................... 10630 Macquarie Electorate: Blue Mountains Cancer Help .................................................... 10631 Conservative Policies .................................................................................................... 10632 McDonald, Lance Corporal Mervyn John..................................................................... 10633 Galagher, Private Nathanael John Aubrey..................................................................... 10633 Rackett, Mr David ......................................................................................................... 10638 Housing ......................................................................................................................... 10639 Swan Electorate: National Broadband Network ........................................................... 10640 Bass Electorate: Sporting Achievements ....................................................................... 10642 New South Wales Government: School Funding .......................................................... 10644 Gippsland Electorate: Gippsland Lakes and Catchments .............................................. 10645 Education Funding ........................................................................................................ 10647 Dunkley Electorate: Law Enforcement ......................................................................... 10648 Education: Gonski Report ............................................................................................. 10649 Leichhardt Electorate: Dr Edward Koch Foundation .................................................... 10650 Active Travel for Sustainable Cities.............................................................................. 10652 Superannuation Funds ................................................................................................... 10653 Early Childhood Learning ............................................................................................. 10654 Questions In Writing Post-polio Syndrome Clinics-(Question No. 1133) .................................................... 10656 Thursday, 13 September 2012 from the Senate acquainting the House of the appointment of Senators Ruston and Burke) took the chair at 09:00, made an Joint Standing Committee on the National acknowledgement of country and read Broadband Network; the appointment of prayers. Senator Ruston to the Joint Committee of Public Accounts and Audit in place of Corporations Legislation Amendment of Senator McKenzie to the Joint Standing (Financial Reporting Panel) Bill 2012 Committee on Treaties in place of Senator Australian Citizenship Amendment Birmingham, discharged. (Defence Families) Bill 2012 BILLS Cybercrime Legislation Amendment International Fund for Agricultural Bill 2011 Development Amendment Bill 2012 Marine Safety (Domestic Commercial First Reading Vessel) National Law Bill 2012 Bill and explanatory memorandum Marine Safety (Domestic Commercial presented by Mr Marles. Vessel) National Law (Consequential Bill read a first time. Amendments) Bill 2012 Second Reading (Extended Medicare Safety Net) Bill Secretary for Pacific Island Affairs and 2012 Parliamentary Secretary for Foreign Affairs) (09:02): I move: Migration (Visa Evidence) Charge Bill That this bill be now read a second time. 2012 Overview Migration (Visa Evidence) Charge The United Nations International Fund for (Consequential Amendments) Bill Agricultural Development (IFAD) is a 2012 specialised multilateral organisation of the Assent United Nations. It is based in Rome and Messages from the Governor General dedicated to eradicating rural poverty in reported informing the House of assent to the developing countries. bills. Seventy-five per cent of the world's and men-live in rural areas and depend on National Broadband Network agriculture and related activities for their Committee livelihoods. IFAD projects help poor rural Public Accounts and Audit Committee people improve their food security and nutrition, raise their incomes and increase Treaties Committee their access to financial services, markets, Membership technology, land and other natural resources. Burke) (09:01): I have received messages international development partner. It has an",15,Setup
1,The Deputy Speaker (Ms Ae Sinodinos As Participating Members Of The,,17,Committees Poorest People 1 4 Billion Women Children
2,Health Insurance Amendment Mr Marles (Corio,Parliamentary,17,Committees Poorest People 1 4 Billion Women Children
3,"The Deputy Speaker (Ms Ae Around The World, Ifad Is A Valued","ongoing portfolio valued at US$10.3 billion  offer in-depth country and technical (inclusive of cofinancing). With the funding knowledge in regions and sectors where replenishments made in 2011, it has a target Australia wishes to expand but lacks of lifting 80 million people out of poverty expertise; and between 2013 and 2015.  offer expertise and experience in rural IFAD focuses on: development in fragile and conflict  agricultural production and productivity; affected areas where Australia has a strategic interest but may not be able to  rural finance; directly engage.  support for women and indigenous Reasoning peoples; and Importance of food security/needs of the  building institutions. poor Australia was a founding member of We cannot overestimate the critical IFAD but in 2004 Australia decided to importance of food security to every human withdraw as a member due to a misalignment being-the physical and economic access to with the then government's geographical and sufficient, safe and nutritious food is surely a sectoral development priorities, as well as fundamental human right. internal governance issues. Australia's withdrawal came into effect in 2007. But tragically, for nearly a billion people in the world, this is not the case. Since Australia left the fund, IFAD has gone through a major reform, making it a The United Nation's Food and Agriculture highly regarded development partner by Organization estimates that nearly one donor countries around the world and by the billion people go hungry every day. Twodeveloping countries in which it works. thirds of these people live in the Asia-Pacific region. They are our neighbours. It is now timely that Australia renews its membership of IFAD. In Sub-Saharan Africa almost one in three people suffer from chronic hunger. Australia's membership of IFAD will: Climate change, drought, conflict, and  complement and strengthen Australia's lack of resources and land to grow food all existing support for food security, rural shape this gross inequality. development and poverty reduction; The impact of these challenges is  provide for direct engagement with compounded by the high cost of food, higher smallholder producers who are even than the 2008 levels when the food disproportionately represented among the crisis was at its peak. poor and vulnerable-consistent with the We can attribute the high cost of food fundamental purpose of the Australian aid largely to the failure of global food program of helping people overcome production to keep pace with growing poverty; demand. Population growth, income growth,  address poverty issues in rural areas where changing diets and climatic variability are IFAD is focused and where Australia has just some of the critical factors in this trend. an interest but limited current Forecasts by the United Nations and engagement; World Bank indicate that this trend of high food prices is likely to continue for at least  increasing funding for rural development; the next 10 years. and The magnitude of this challenge cannot be  pursuing trade policy reforms to open up underestimated. markets and allow more free and fair The world is asking why we didn't foresee access to food. the current food crises in the Horn of Africa IFAD's approach to food security marries or the Sahel earlier. We did. It isn't a matter with our own. As I have said, IFAD is of foreseeing; it's a matter of doing dedicated to enabling poor rural people to something about it. improve their access to food and nutrition , Australia's approach to food security increase their incomes and strengthen their Australia has long been at the forefront of resilience. global efforts to improve food security. We IFAD also works in regions of importance as a nation are very fortunate to enjoy food to Australia, including Asia, the Pacific, Subsecurity ourselves. Saharan Africa and North Africa. At the same time we have had to grapple Developing countries value IFAD's work. with issues like climate, water management This was made clear during the most and natural disasters that plague less food recent replenishment of the fund in 2011secure nations. And as a wealthy country, we Argentina increased its pledge by 300 per developed world-class research and expertise cent, Indonesia by 100 per cent, Brazil by 25 in these issues. This is something we can per cent and India by 20 per cent-all during share. a time of economic hardship. Food security is integral to Australia's aid IFAD has reformed its organisational program. structure to increase efficiency, align human Our approach to food security focuses on: and financial resources with strategic objectives, and expand its role as a  lifting agricultural productivity through knowledge institution. agricultural research and development; For every $1 contributed, IFAD mobilises  improving rural livelihoods by another $6 for rural development. strengthening markets and market access; and AusAID's 2011 review of IFAD  building community resilience with social In 2011, AusAID conducted a review of protection programs. IFAD. We found that IFAD had implemented significant reforms and that it These three elements will together was now considered by donors and increase the food available in markets and developing countries to be an increasingly poor households, and increase the incomes effective, results-focused, value-for-money and employment opportunities of poor men partner. and women. The review recognised IFAD's clear Right now Australia is: mandate to reduce rural poverty and hunger  responding to the emergency food needs through working with smallholder farmers of people in the Horn of Africa and the who are disproportionately represented Sahel; amongst the poor, vulnerable and food insecure. IFAD projects currently work with more security funding mechanisms, and found that than 36 million poor men and women, re-joining IFAD would be the best option for supporting them to become food secure additional Australian support in this sector. through increasing productivity, access to Finally, membership of IFAD would markets including microfinance, and allow Australian firms and individuals to be business development. engaged with or employed on IFAD projects. Australia's national interest Only citizens of member states can work on Renewing our membership of IFAD is IFAD projects. clearly in Australia's national interest. It will With the increasing urgency of our global allow Australia to expand existing support food security challenges and obligations, this for food security and help the world's most bill to enable Australia to re-join IFAD will vulnerable to fight hunger. have considerable benefit for not only our IFAD's senior management values national interest, but for the billions of Australia's unique technical expertise in people world-wide who remain acutely tropical and dryland farming, fisheries, vulnerable to food shortages, and whose biosecurity and quarantine. We are lives would be immeasurably improved if considered to have attractive policy and they could achieve the basic human right to regulatory approaches in these areas. food security. Membership will also allow Australia to I commend this bill to the House. draw on IFAD's considerable experience to Debate adjourned. strengthen Australia's own approach to food Environment Protection and security and rural development in our aid Biodiversity Conservation program. Amendment (Declared Fishing Australia's priorities for engaging with Activities) Bill 2012 IFAD are: Second Reading improving food security, raising incomes and strengthening resilience of Debate resumed on the motion: smallholder producers in priority countries That this bill be now read a second time. for Australia; to which the following amendment was  continued commitment to reform to moved: improve governance and management of That all words after ""That"" be omitted with a the organisation, including strengthened view to substituting the following words: focus on results and value for money; and ""whilst not declining to give the bill a second reading, the House calls on the Minister for  ensuring disability inclusiveness and Sustainability, Environment, Water, Population gender equality across all of IFAD's and Communities to explain: programs. (1) the reasons for his decision to reverse the Investment in IFAD would not detract policy that he introduced as Fisheries Minister in from existing support for food security October 2009 which stated: 'There are programs. Financial contributions to IFAD considerable economies of scale in the fishery will be decided through the Australian and the most efficient way to fish may include government's annual budget process. The large scale factory freezer vessels'; 2011 review of IFAD conducted in-depth analysis of alternative additional food (2) why he effectively invited the Margiris know that local community concern has been into Australia by promoting 'large scale factory led, particularly in Tasmania, by the freezer vessels'; and recreational fishers themselves, who are (3) what actions he will take to compensate really concerned to make sure we get this the 50 Australian workers who are losing their right. jobs as a consequence of this legislation."" This bill is essentially about giving the Ms COLLINS (Franklin-Minister for government time to make sure that we get Community Services, Minister for the Status any decisions that we make on a vessel of of Women and Minister for Indigenous this size right, because it is really important. Employment and Economic Development) We have said that we are not ruling out a (09:12): I am pleased to speak in support of super-trawler in the future, but we want to the Environment Protection and Biodiversity make sure that any assessment process is Conservation Amendment (Declared Fishing done properly. Activities) Bill. As many people in this place would know, what has become known as the The Fisheries Management Act has been super-trawler debate has been very big in in place for some time, since 1991, so it is Tasmania and the changes proposed in the now more than 20 years old, and that is why bill are very important to my fellow we have also announced an overhaul of the Tasmanians. I have been contacted by many fisheries policy and legislation. We have said Tasmanians as part of what has truly become that that will be a root-and-branch review to a grassroots campaign. Thousands of petition identify any improvements or changes that signers live in my electorate and thousands need to be made, because we do want to of people have personally contacted my make sure that we have sustainable fisheries going into the future for Australians, office-it is a very big issue in my home state of Tasmania. including of course Tasmanians. Tasmanians were also very concerned about bycatch and I want to spend some time talking about the impacts of the super-trawler on bycatch, what this bill does and about the local so I am glad that Minister Burke has also Tasmanian campaign. The bill strengthens addressed some of those issues. Australia's fishing industries, both commercial and recreational, by ensuring I want to take the time to thank the proposals for large-scale operators are given minister for fisheries and the ministry for the environment for their responsiveness over proper consideration before they get the goahead to fish in Australian waters. We as a the last few weeks when they have been government are taking a cautious approach. contacted by me and other Tasmanians-our We know that a vessel of this size has not two senators, Lin Thorp and Carol Brown, been in Australian waters before. This is the and, in particular, Sid Sidebottom, the second biggest fishing vessel on the planet, member for Braddon and the parliamentary and we do not want to be rushed into any secretary for fisheries. The member for decisions. We want to make sure we know Braddon has been on the ground in Tasmania the impacts of it before we give it the green talking to recreational fishers and other light. We want to make sure we know what people in the community who have concerns will happen. We know the science behind the about this trawler coming into Australian current quotas is sound, but of course the waters. He has been very busy. He has taken science has not been done on the long-term a very considered approach. He obviously effects of a vessel of this size. We certainly has concerns about his local community and about the broader sustainability of fisheries understanding the concerns in the local around Australia. He has been doing a great community and it is aboutjob on the ground in Tasmania. Mr Secker: And you ignore the science! We have seen what is a unique grassroots Ms COLLINS: making sure that we get campaign in Tasmania, led by the our decision-making right and that the recreational fishers, as I said before, and I do science is right before we go ahead and want to congratulate some local people who allow this vessel to fish in our waters. have been instrumental in that campaign. There were some outbursts from my Tyson Clements, Martin Haley and Nobby opponents, the Liberals, over there. There Clark are well known to any representative was an editorial in the Tasmanian Examiner of Tasmania who has been lobbied on this yesterday, written by the deputy editor, issue in recent weeks and months. In fact, I Barry Prismall, in which he said that the think I first met with them around two Liberals in Tasmania have been strategically months ago. They are very passionate outmanoeuvred by the Labor Party in individuals and they have been fighting for Tasmania, and: this not for themselves but because they wanted to make sure Tasmanian fisheries It is mystifying that the head of the next Liberal half-Senate ticket, Senator Richard Colbeck, is were protected in the long term. They were defending the super trawler. really concerned about the future of recreational fishing and commercial fishing, They do not oppose the super-trawler, but and their sustainability. They wanted to the rest of Australia does. It is only the ensure that their children and grandchildren Liberals in Tasmania who do not realise that had the benefits of the unique lifestyle that this is a big issue in Tasmania and in the rest Tasmania offers. We know that Tasmanians of Australia. are particularly passionate about their I commend the bill to the House. understand that decisions about Australia's speak on the Environment Protection and fisheries are based on science and should Biodiversity Conservation Amendment continue to be, and I certainly agree with (Declared Fishing Activities) Bill 2012. This that. They are just saying, 'How can we government could not hold a line between know we've got it right, when a super-trawler the kitchen sink and the stove. Really, the of this size has never been in Tasmanian backflips on policy week after week are waters before?' I think that is a valid becoming so monotonous as to be almost not argument and, clearly, the government think worth comment. The similarities between that is a valid argument. That is why we are this issue and the live cattle export dispute taking our time to look at the issues that have are enormous: within a few days, a been raised to make sure that we do the work government has gone from supporting an before we allow this vessel to operate. There industry to suspending the industry. have been a lot of accusations around the Last week, with the exception of four or place about knee-jerk reactions, about the five people, everybody on that side of the government bowing to pressure, but this is chamber supported allowing this vessel to not about that. It is not about populism. It is come into Australian waters; this week, they about doing the right thing. It is about have completely changed their view. What representing our constituencies, it is about has changed in that time? There has been a public campaign led by GetUp! and the",17,Committees Poorest People 1 4 Billion Women Children
