speakerGroups,speaker,theText,pageNumbers,title
42,The Deputy Speaker (Ms O'neill,"have now found that that assurance has noteffectively to deal with the concerns(Time Sydney rugby union premiership-on expired) Saturday, this weekend-since the club was Centacare formed in 1989. It was only five years ago that their opponents on Saturday, Sydney House today to commend the excellent work from the Sydney rugby competition. So we that Centacare is doing in George Town in will have the opportunity to settle that score my electorate. Centacare Tasmania Family this weekend. Services have been active in the state since 1960. They provide a variety of counselling I congratulate Cameron Blades, the coach, and support services, including on families and all of his coaching staff and the captain, and relationships, settlement services, sexual John Ulugia, and all of his players. I wish health, parenting and supported housing. them the very best for this Saturday's contest. Congratulations also go to club president I recently had the pleasure of attending the Neville Shooter and his deputy, Steve launch of the Challenging Abusive Brittons, ably supported by general manager Behaviour program at Centacare in George Craig Hawkings. I also want to particularly Town. This is another extremely worthwhile thank the club's sponsors: the National program that aims to educate men about Institute of Training, Sylvania BMW, Ocean respectful relationships, leading to a better Monarch, the Tulla Group and McLeish way of life and a more fulfilling lifestyle. Estate. They have been loyal and fantastic The facilitator of the CAB program is Peter supporters of this club as it has rebuilt over Ross. He made the point that domestic the last five years to realise this great violence or abuse in any form is never objective and achievement of being in the acceptable. He has seen first hand the grand final on Saturday. difference the program can make to individuals and the benefits it has for I seek leave to table an agreement families and the wider community. between the member for North Sydney, the member for Hughes and me, which says that For the past 15 years, Centacare has this time next week the loser of this contest provided the CAB program throughout on Saturday, with the member for North Tasmania-always unfunded until now. I Sydney representing the Sydney University would like to sincerely thank the Tasmanian club, will come into this place and give a 90Community Fund for providing funding to second statement congratulating the winner. Centacare to allow them to run the We are looking for that opportunity next Challenging Abusive Behaviour program for week, and I hope the member for North the next three years in George Town. I Sydney will be given the call when Sydney congratulate Centacare for the ongoing University go down. support and services they provide to the Tasmanian community and wish them the Leave granted. very best with this latest program. Education Funding sure the member for Hughes and the member non-government schools in New South for Barton will join me in congratulating the Wales by $66.7 million, or eight per cent of Southern Districts Rebels, who will take part the 2012 total. The cut to the state's Catholic in their first grand final appearance in the system will be $24.5 million. I report to the",82,Committees Poorest People 1 4 Billion Women Children
43,Mr Lyons (Bass) (13:46,"I rise in the University, sought to have the Rebels ejected",83,Committees Poorest People 1 4 Billion Women Children
44,Southern Districts Rebels Mr Murphy (Reid) (13:49,The,83,Committees Poorest People 1 4 Billion Women Children
45,Mr Morrison (Cook) (13:48,"I am O'Farrell government will cut funding forHouse that this decision is causing great turned up and it was standing room only, unrest, dissatisfaction and action across all with people sharing their stories and hearing non-government schools in my electorate of from expert panellists Jeff Kennett AC from Reid. beyondblue, Professor Kulkarni from the For the first time ever, all Catholic schools Monash Alfred Psychiatry Research Centre in New South Wales face a radical and and Quinn Pawson from the Prahran immediate cut to their state recurrent grants. Mission. I mention this because often one of This unprecedented cut in state aid breaks the greatest challenges to people receiving the long-established trust of parents in the help and care they need is no-one continued government support for Catholic knowing there is a problem. schools and comes without prior consultation Today is RU OK? Day, a day where we or reasonable notice. It will require Catholic remind people that they should regularly stop schools to systemically increase fees by to ask those close to them-family, friends about $100 per student and independent and work colleagues-whether they are Catholic schools to increase fees by between okay. Simply lending your ears and listening $58 and $496 per student. That comes after to others, giving support or helping them most Catholic schools have finalised their find the right support, can sometimes be the staffing and budget decisions for 2013. difference between life and death. The first R I have also been forwarded a message U OK? Day was launched in 2009 and was from Newington College, a Uniting Church formed in the memory of Barry Larkin, who non-selective school that is attended by took his own life in 1995. Gavin, his son, many pupils in my electorate. The was the driving force behind the initiative. headmaster's message also points out: the Members on both sides of this chamber lack of notice and consultation; the size of joined together this morning for a morning the cuts and their effects; the timing, when tea to mark this day and to raise awareness most schools have already committed to next that we need to care for those around us each year's staffing and budgets; and the and every day. Organisations like contradiction to the Gonski report, which beyondblue and Lifeline offer fantastic mandates increased funding for all schools. services to those in need, and their work This is a massive betrayal of parents and cannot be commended highly enough. If you children by the New South Wales Liberals, are unsure of where to go, speak to your and Mr O'Farrell should be flogged. local GP(Time expired) RU OK? Day Canberra Raiders Ms O'DWYER (Higgins) (13:51): Ms BRODTMANN (Canberra) (13:53): Mental health care is an issue that affects A few months ago the mighty green everybody, stretching across generations and machine, otherwise known as the Canberra across socioeconomic groups. In my Raiders, was written off by armchair critics electorate-wide survey, mental health care and some sporting commentators. Yet this consistently ranks as one of the top-priority Saturday night the Canberra Raiders will issues. It inspired me to host a Higgins play the South Sydney Rabbitohs in the NRL community meeting on mental health both to elimination semifinal in Sydney. The Raiders share information from our expert panel and are just two wins away from a fairytale grand to receive feedback about how policy in this final spot. This is a remarkable achievement area should be shaped. More than 200 people for a remarkable team. The Canberra Raiders have risen from revitalise Liverpool after decades of neglect near the bottom of the table halfway through by Labor. Ned will also be joined on the the season to win five tough games in a row council by a strong team including re-elected and end the regular NRL season in sixth councillors Tony Hadchiti and Maz Hadid, place. This incredible winning streak is with new faces Peter Ristevski and Gus reward for the great organisation of the Balloot, while our fingers remain crossed for Raiders team and a tribute to coaching staff, Sabrina Mamone and George Germanos. led by David Furner. David Furner was I would also like to congratulate my old under plenty of pressure this year when he rugby team, Southern Districts, who after made some tough decisions and some their 41-22 victory over Manly last weekend unpopular ones. But I see a good sign in will for the first time in the club's 23-year seeing a leader under pressure, criticised in history play in a first grade rugby grand final the media because he made the tough calls, when they take on Sydney University at the hard decisions, and seeing how that pays Concord Oval. Although ex-Sydney off, with unbelievable success! University players, including the members One Sydney league expert wrote this for Warringah and North Sydney, will be about the Raiders: cheering on University, the member for … they are irresistible, a real delight to watch. Cook and I will be in the grandstands They add something to the finals series, and more supporting the Dists. Go the Dists! power to them for doing that. Millennium Development Goals NRL final series alight and I wish them the (13:56): I met recently with Jenny Dundas, a very best in the match against Souths. Go local constituent of mine, and her colleagues Raiders! Go green machine! I want to from the Baptist World Aid program, acknowledge the incredible work of the Catalyst. Catalyst is a program that Raiders coaching and admin staff and all the empowers small community groups to speak players in the squad. Go Raiders! up on behalf of the poor, the oppressed and Mannoun, Councillor Ned the marginalised and enact real change on Southern Districts Rugby Union Club global issues. That was exactly why Jenny came to meet with me earlier this year. She is particularly concerned about the number rise to congratulate my good friend Ned of people in the world living without access Mannoun, who less than three hours ago was to safe drinking water and adequate levels of officially declared the new Mayor of sanitation. She is not alone in her concern. Liverpool. Liverpool is our fourth oldest The United Nations have attempted to halve settlement after Sydney, Parramatta and the proportion of people who live without Hobart, and Liverpool used to be Labor safe drinking water and basic sanitation in central. It was previously the home to both their seventh millennium development goal Gough Whitlam and Mark Latham, but no of ensuring environmental sustainability by longer. Now Ned becomes the first ever 2015. Liberal elected mayor, with a 23 per cent swing. Tonight the blue Liberal flag flies However, of all the goals, this target is the proudly over the city of Liverpool. one most off track. There are things we can do as a nation and as a parliament. We can I look forward to working closely with make a timetabled commitment to lift our Ned. We have a lot of work to do to",83,Committees Poorest People 1 4 Billion Women Children
46,The Canberra Raiders Are Setting This Year's Mr Stephen Jones (Throsby),,85,Committees Poorest People 1 4 Billion Women Children
47,Mr Craig Kelly (Hughes) (13:54,"Iinternational aid budget to 0.7 per cent of Townsville rugby union grand final as well. GNI by 2020. We can increase our aid Go Teachers! allocation to water, sanitation and hygiene to Kingsland, Sir Richard $50 million annually by 2015, and we can join the international Sanitation and Water Dr LEIGH (Fraser) (13:58): Sir Richard for All partnership. Kingsland passed away at Calvary John James Hospital after a short illness on These are small actions that have the real Monday, the 27th. Like many of my potential to provide an additional 8.8 million constituents, his was a life of public service. people with access to safe drinking water and His wartime service was marked by the sanitation and save the lives of more than bravery and ingenuity he displayed in the two million children by drastically 1940 retrieval of Field Marshal Viscount minimising the global incidence of diarrhoea Gort VC from a Moroccan hotel. It is a tale and water and hygiene related malnutrition. of derring-do that befits 007, perhaps with a (Time expired) hint of the Pink Panther. North Queensland Cowboys Having received orders to extract Gort Before the Canberra Raiders take on Souths, police boat, commandeered a car, then shot the mighty Cowboys will carry the weight of his way into the hotel. Then, because the the nation as they go in against bloody French failed to take away his revolver, he Manly Warringah. It will be the mighty shot off the lock, managed to free them both North Queensland Cowboys. We already from the room in which they were held have a Cowboys flag flying out the front of captive and made a dawn escape by flying the member for Brisbane's office, and on out of Morocco under a guard of pro-Nazi Monday morning I expect to see a flag flying police. out the front of the office of the member for He later served with distinction in the Warringah, the Leader of the Opposition, as Royal Australian Air Force, was Secretary of the mighty Cowboys go marching forward. the Department of Veterans' Affairs and was Matthew Bowen will continue to play on awarded the Commander of the Order of the after next year-a true North Queenslander. British Empire, receiving his knighthood in Although Jonathan Thurston is from 1978. He was an extraordinary Australian. Queenslander. All those guys, even the guys Burke): Order! In accordance with standing from Gerringong, are true North order 43, the time for members' statements Queenslanders now. The mighty Cowboys has concluded. will go forward. They will beat Manly this weekend and if they do meet Canberra next STATEMENTS ON INDULGENCE weekend you can only kiss it goodbye, guys, London Paralympic Games eyes are in the west. It is an unforgiving Minister and Treasurer) (14:00): I want to country. It brings out the best. That is where make some remarks on the Paralympians, the Cowboys come from. That is what we who returned from London just this morning. stand for. Go the blue and the gold! That is I had the pleasure, along with the Leader of what we are here for. And go Teachers West the Opposition, the Minister for Disability tomorrow as they beat the fish brothers in the Reform and a number of other MPs, to be",85,Committees Poorest People 1 4 Billion Women Children
48,Mr Ewen Jones (Herbert) (13:57,"from the hotel in Rabat, he first seized a",86,Committees Poorest People 1 4 Billion Women Children
49,"Brisbane Originally, He Is Now A True North The Deputy Speaker (Ms Ae",,86,Committees Poorest People 1 4 Billion Women Children
50,Because From The Gulf Down To Rocky The Mr Swan (Lilley,"Deputy Primethere this morning to welcome the team. It The Paralympic Games are among the was a great honour. It was great to see so most inspiring sporting events in the world. many of their family and friends there and to Our Paralympians are outstanding athletes see how excited they were, because the who have overcome additional challenges to success of the Paralympians in these games those that confront all elite athletes. Many of was truly spectacular-85 medals in the us spent hours watching our Paralympians games, fifth overall in the medal tally, and, compete against the best in the world. We of course, we beat the USA when it came to cheered, whether they won gold and set gold medals. This team was particularly world records or not. We are all equally excited. The swimming team in particular proud of all our athletes, as we know they did very well. There were some absolutely have given their all. Australians watching the remarkable individual achievements. They games were taken on the same roller-coaster wowed the crowds in London, but here the ride of emotions that we saw so clearly on ratings were the highest the Paralympic the faces of our Paralympians. We shared Games have ever had in domestic Australian their hopes and expectations, their triumphs television. So this was one of the best teams and disappointments, but most of all we were ever. There were a record number of overjoyed at their efforts. This is a triumph countries taking part in the games, and for us of the human spirit. Australians are united in to come fifth in the medal count means that our pride at the efforts of our wonderful these Paralympians are well and truly athletes. We welcome them home. Australia's golden team. They left these Reference to Federation Chamber shores a few weeks ago with high hopes. They did not just realise those hopes; they the House and Minister for Infrastructure and exceeded them by far. They blew them right Transport) (14:03): by leave-I move: out of the water. It was just so pleasing to see all of the Paralympians there today, the years That further statements on indulgence in relation to the London Paralympic Games be of hard work and discipline and dedication permitted in the Federation Chamber. paying off for so many of those athletes this morning. On behalf of everyone in this Question agreed to. House, I think, I can truly say we are proud QUESTIONS WITHOUT NOTICE of each and every one of them. Gillard Government Ms JULIE BISHOP (Curtin-Deputy Ms JULIE BISHOP (Curtin-Deputy Leader of the Opposition) (14:02): It is Leader of the Opposition) (14:04): My dreams that inspire people to reach for the question is to the Acting Prime Minister. I skies, dreams of representing our country at remind the Acting Prime Minister that there sport and dreams of being acknowledged as have been seven changes to the carbon tax it among the best athletes in the world. Many was promised would never be introduced, of us have such dreams as young children, five versions of the mining tax, live cattle but very few of us reach such lofty heights of exports that have been allowed and then achievement. Those that do represent our banned and then allowed again, and, in the country are an inspiration to the entire last 24 hours, three versions of the legislation nation, as we marvel at the spirit that drives banning fishing. How can Australian our athletes to greater heights, faster times businesses plan for the future when this and longer throws. government flips and flops, chops and",86,Committees Poorest People 1 4 Billion Women Children
51,Mr Albanese (Grayndler,"Leader ofchanges and just makes it up as it goes to make sure Australians get the fair share along? from the resources they own-100 per cent. Minister and Treasurer) (14:04): I thank the there, once again, is to be entirely negative, Deputy Leader of the Opposition for that to oppose everything, because they would question, because it is not a bad attempt to rather see our economy fail than see this deflect attention away from the savage cuts country succeed, and that is the approach that are being made to health and education that they take on every issue. right across Queensland, the absolutely Now let us go to the issue of the savage cuts-14,000 public sector workers supertrawler. What the government wants to getting the axe in Queensland. see is a sustainable fishing industry in this Mr Pyne: Madam Deputy Speaker, I rise country. The supertrawler poses new on a point of order. If the relevance rule is to challenges to our current regulatory mean anything at all, the Treasurer must be framework, so the government is coming to brought back to the actual question he was the table in good faith, understanding the asked and not this extraordinary attempt to concern of all Australians about the activity avoid his own incompetence. of the supertrawler. As someone who grew Burke): When questions are asked with so lot of time in the water and I have spent a lot much detail, applying a direct relevance rule of time out there fishing along the becomes quite difficult. I will ask the Acting Queensland coast. WhatI want to see for my Prime Minister to return to the question children and what I want to see for my before the chair. grandchildren is the capacity to throw a line in and catch a fish. That is what we want to see, and anyone who wants their children asked about the carbon price. The and grandchildren to see that will be for government has put in place a carbon price sustainable practices in fisheries. to make sure we reduce carbon pollution and to drive investment in renewable energy. But, as is the case with the carbon price, Nothing could be more important to the what we have on the other side of the House prosperity of an economy in the 21st century is a mob of environmental vandals who do than being driven by renewable energy and not understand the importance of making your economy more energy efficient. sustainability-sustainability when it comes We have devoted a lot of time to that over to the need to invest in renewable energy, the past 12 to 18 months, and we have been sustainability when it comes to the need to opposed, tooth and nail, every day of the make sure we have adequate stocks(Time week, by those opposite. But we have got expired) that done, and that will be good for our Economy prosperity in this country and it will increase question is to the Deputy Prime Minister. the investment in renewable energy. So Will the Deputy Prime Minister outline why everyone on this side of the House is proud it is important to invest in reforms to keep of that achievement. our economy strong? taxation arrangements in the mining industry Minister and Treasurer) (14:08): I thank the",87,Committees Poorest People 1 4 Billion Women Children
52,Mr Swan (Lilley,Deputy Prime But of course what those opposite have done,88,Committees Poorest People 1 4 Billion Women Children
53,"The Deputy Speaker (Ms Ae Up On The Queensland Coast, I Have Spent A",,88,Committees Poorest People 1 4 Billion Women Children
54,Mr Swan,"Certainly. First of all, I was",88,Committees Poorest People 1 4 Billion Women Children
55,Economy In The Long Term. It Will Be Good For Mr Hayes (Fowler) (14:08,My,88,Committees Poorest People 1 4 Billion Women Children
56,"And, Of Course, We Have Put In Place New Mr Swan (Lilley","Deputy Primemember for Fowler for that question, dramatic impacts on the lives and lifestyles because the Australian economy walks tall in of tens of thousands of Australian families the world. Our economy is now 11 per cent right around the country, and there is the big higher than when we came to office, and of attack on education spending in New South course we have done that during a period Wales as well-indiscriminately wielding when many other developed economies have the axe, cutting the basic services that go to gone backwards. One of the reasons that we the very basic fabric of our society. are in this strong position is that during the We know that this is just a warm-up act global financial crisis and the global for Tony Abbott and Joe Hockey, because recession we put in place a range of policies they have a $70 billion budget crater. to support employment and to support small Ms Julie Bishop: Madam Deputy business. We did this in the face of the worse Speaker, I raise a point of order. The Deputy global downturn in 80 years. That meant that Prime Minister ought to know by now that we avoided the skill destruction and we you address members by their seat, not by avoided the capital destruction of small their name, and I find it offensive that he businesses that we see right around the continually flouts the standing orders, not world, which are holding all of those just in this instance but quite often. developed economies back. But, most importantly, why did we do Burke): The Deputy Prime Minister will that? We did it to protect communities. We refer to people by their titlesdid it to protect families. We did it to protect small businesses. We did it because we Mr Randall interjectingbring those values towards our decisionmember for Canning is warned! making processes. We want to protect the very social fabric of our communities. Of so sensitive, because they are going to take course, to do that, you also have to invest in the axe to basic services, and they want to the future, and that means investment in keep their agenda hidden just like Campbell education in particular: in schools, in Newman kept it hidden in Queensland. That vocational training and in universities. That is their objective: to have a commission of is why we have found savings in our budget audit to hide the truth, not to tell the truth. over the past five years to make room for those priorities. We have put in place a We on this side of the House understand responsible fiscal policy. It is all about that you have to build up the nation. You making sure that Australians have jobs and have to support your workforce. You do not about getting a fair go, not just everything do it by tearing working people down. going to the fortunate few. Economy stand up for working Australians. We will My question is to the Acting Prime Minister. not have any part of tearing them down, What is the current level of Commonwealth which is why what we are seeing in government debt, today, in dollar terms? moment is so regrettable. The big axe is Minister and Treasurer) (14:12): Net debt being taken to health and education, having",88,Committees Poorest People 1 4 Billion Women Children
57,The Deputy Speaker (Ms Ae,,89,Committees Poorest People 1 4 Billion Women Children
58,Understand That We Live In A Community; We Mr Swan,Certainly.,89,Committees Poorest People 1 4 Billion Women Children
59,"Do Not Just Live In A Corporation, And We The Deputy Speaker",and the,89,Committees Poorest People 1 4 Billion Women Children
60,Mr Swan,I do understand why they are,89,Committees Poorest People 1 4 Billion Women Children
61,We On This Side Of The House Will Always Mr Hockey (North Sydney) (14:12,,89,Committees Poorest People 1 4 Billion Women Children
