speakerGroups,speaker,theText,pageNumbers,title
107,Mr Turnbull,"Thank you very much, Mr Speaker. Our Families Package and the",95,Questions Without Notice
108,Mr Bandt (Melbourne) (14:24,My question is to the Prime Minister. The new United,95,Questions Without Notice
109,Mr Turnbull (Wentworth,"Prime Minister) (14:25): I can imagine no step that wouldsenators, like John McCain. We have seen front-page headlines and editorials. Americans understand they have no truer ally, no more resolute friend than Australia. We have stood together again and again in freedom's name, in our national interest. And, when we commit our troops to war, when we put our men and women of the ADF in harm's way, we do so when they are well led, well supplied and with every effort to ensure they can return safely home, their duty done, their mission accomplished. But I say to the honourable member: the policies of his party would put this nation at grave risk, and we will not have a bar of them. We are standing for Australia, defending our security, defending our national interests, and whenever we commit our troops we do so in the national interest of Australia. That is our duty. That is the nation we serve. Economy outline to the House what the government is doing to ensure that Australia has a strong economy that creates jobs and reduces cost-of-living pressures? How does a competitive economy help hard working Australians get ahead, especially in regional parts of Australia like Canning? scared. It will not hurt you. electorates of those who sit opposite-from the Hunter Valley, as the member for Hunter would know. It is coal that has ensured for over 100 years that Australia has enjoyed an energy-competitive advantage that has delivered prosperity to Australian businesses and has ensured that Australian industry has been able to remain competitive in a global market. Those opposite have an ideological, pathological fear of coal. There is no word for 'coalophobia' officially, but that is the malady that afflicts those opposite. It is that malady that is affecting the jobs in the towns and the industries and, indeed, in this country because of the pathological, ideological opposition to coal being an important part of our sustainable and more certain energy future. Affordable energy is what Australian businesses need to remain competitive. They cannot fizzle out in the dark as those opposite would have them do, as businesses in South Australia are now confronting. On this side of the House, you will not find a fear of coal anymore than you will find a fear of wind-except for that which comes from the Leader of the Opposition; you will not find a fear of sun; you will not find a fear of wave energy; you will not find a fear of any of these sources of energy. What you will find is a passion for the jobs of Australians who work for businesses that depend on energy security that those opposite want to switch off, just like the South Australian Labor government is switching off jobs, switching off lights and switching off air conditioners and forcing Australian families to boil in the dark as a result of their Dark Ages policies. That is not the only thing we are doing to stand up for Australian businesses; our company tax cuts that those hypocrites opposite used to support and now oppose-here he is; the whinger from Watson!",95,Questions Without Notice
110,Mr Hastie (Canning) (14:28,My question is to the Treasurer. Will the Treasurer,96,Questions Without Notice
111,Mr Morrison (Cook,Treasurer) (14:28): This is coal. Do not be afraid. Do not be,96,Questions Without Notice
112,The Speaker,The Treasurer knows the rule on props.,96,Questions Without Notice
113,Mr Morrison,"It is coal. It was dug up by men and women who work and live in theunparliamentary remarks. tax cuts, when it comes to energy prices, what I do know is that there is someone else who knows a lot about digging things out of the ground for the great prosperity of Australians, and that is Twiggy Forrest-do not worry, Leader of the Opposition, he will give you a dinner invitation later! You can tuck your knees under his table, too, as the Prime Minister said yesterday. This is what Twiggy Forrest said today: We've kept our power prices high, which lowers the standard of living, and if we keep our tax rates high we will jack up unemployment and keep people out of work. That is the policy prescription from those who sit opposite, and they should be ashamed. Pensions and Benefits Prime Minister. Is the Prime Minister aware that almost three million children are in families that receive family tax benefit part A? Prime Minister, how many of these three million children are in families that will have their payments cut? opposite for his question. As mentioned earlier, there are about 1.5 million families that we could describe as family tax benefit families in the system. The question has been asked about some numbers, so I will give you some numbers: of those 1.5 million families, 720,000 have children of childcare age-between zero and five years. Of those 1.5 million families, 480,000 have children of after-school care age-aged six to 12 years. All of those families with children of those ages stand to benefit from generation-changing childcare reform-that is 720,000 out of 1.5 million; and 420,000 out of 1.5 million. We will get on to the Leader of the Opposition's number, so let me tell you this: there are one million children of long day care age, between zero to five years, inside the family tax benefit system. There are 1.2 million children of after-school care age, between six to 12 years, and the families of those children all stand to benefit from reform to child care. Let me give you a few examples of how that reform might work: earlier on we heard about Kelly, whose youngest child was aged seven. If, for instance, you had two children aged six and over and were earning a low income of about $50,000, you would stand to benefit $239 a year, because you could access the reforms to child care that we have put on the table. What is fascinating is that we have devised a system where we can find appropriate savings inside the family tax benefit system and reinvest almost all of those into generational reform to child care. Members opposite also made some savings inside the family assistance system, you might realise. In fact, they made $23 billion worth of savings, and sopoint of order. Mr Shorten: My point of order is on relevance. There was no preamble. I asked one simple question: how many of these three million children are in families that will have their payments cut? The minister is talking about children who are not affected by their cuts. We just want him to the answer to one question: how many children are in families that are going to get a cut in family payments?",96,Questions Without Notice
114,The Speaker,The minister will return to the despatch box. He will withdraw two,97,Questions Without Notice
115,Mr Morrison,"I withdraw, Mr Speaker, unreservedly. When it comes to our company",97,Questions Without Notice
116,Mr Shorten (Maribyrnong,Leader of the Opposition) (14:31): My question is to the,97,Questions Without Notice
117,Mr Porter (Pearce,Minister for Social Services) (14:32): I thank the member,97,Questions Without Notice
118,The Speaker,"The minister will resume his seat. The Leader of the Opposition on afrom the family tax benefit system. The fact is that members opposite also made some savings. They made $23 billionquestion and the minister, in the early part of his answer, was very specific with some figures. I have to say to the Leader of the Opposition that at that point I deemed him relevant. Whilst members asking questions would like them answered in a particular way, he was answering them with figures that might have required you to do some calculations. The minister is now moving to a more general area, and I would ask him to either come back to the specifics or seek to wind his answer up. benefit. There are 480,000 families with children who are of long day care age who can also benefit. All of those families stand to benefit from childcare reforms that we have on the table, and what reforms have been offered by those opposite? Nothing. How much of that $23 billion worth of savings did they reinvest into child care? Zero. Energy Security Ms FLINT (Boothby) (14:36): My question is to the Minister for the Environment and Energy. Will the minister update the House on the importance of energy security and affordability to Australia, and particularly to the people of my home state of South Australia in the light of yesterday's blackout? Is the minister aware of what obstacles stand in the way of delivering reliable and affordable energy to hard working Australian businesses and families? thank the member for Boothby for her question and acknowledge her deep commitment to energy security and affordability for her constituents and her state. As I said, yesterday at 6.33 pm 40,000 customers-households and businesses-lost power. They lost it for a total of 27 minutes and the spot price went from around $100 a megawatt hour to $14,000 a megawatt hour. This followed a state-wide blackout last September and other outages in December, in January and now in February. It reminds us that Jay Weatherill's big experiment has failedthe take-up of intermittent sources of power of more than 40 per cent. We on this side of the House know that we need to keep more baseload power in the system-cleaner coal, gas and-as the Prime Minister has talked about-storage, including pumped hydro. I wish I could say that was a view shared by those opposite, but it is not. Jay Weatherill held a press conference this morning, the Premier of South Australia, and this is what he said as to why the blackout occurred last night: 'If they had a carbon price, they could have avoided the blackout last night.' The Premier of South Australia thinks more tax means more wind. The Minister for Mineral Resources and Energy, Tom Koutsantonis, said wind had nothing to do with it, even though wind only got down to providing 2½ per cent of supply. Now we have the member for Port Adelaide trying to blame the operator. Next, he will be telling us that the operator killed Kennedy! Next, he will be telling us that the operator sunk the Titanic! Next, he will be telling us that the operator powered the submarine that took Harold Holt! It was not the operator's fault; it was Jay Weatherill's fault. Now, the Leader of the Opposition wants to take this horror show national with a 50 per cent renewable energy target. You want to sell out the",97,Questions Without Notice
119,Mr Porter,"As I was noting, we have invested all of the money that we are saving",98,Questions Without Notice
120,The Speaker,The minister will resume his seat for a second. It was a very specific,98,Questions Without Notice
121,Mr Porter,"There are 720,000 families out of 1.5 million who will benefit-net",98,Questions Without Notice
122,Mr Frydenberg (Kooyong,"Minister for the Environment and Energy) (14:37): Ijobs of the 3,000 people working at Olympic Dam, the 1,600 people working at Whyalla with Arrium and the 750 people working with Nyrstar at Port Pirie. That is what you want to do. I would say to the Leader of the Opposition: do not ever sacrifice the jobs of blue-collar, hard working Australians on the altar of your ideology, your green ideology. You say you are not a rampant greenie, but you are, Mr Speaker. You are selling out the blue-collar workers. Opposition to see sense? Please tell me, Leader of the Opposition, that the lights will not have to go out at Raheen! a delegation from the Asia-Pacific who are attending the Pacific Research Dialogue at the Australian National University. On behalf of the House, I extend a very warm welcome. Honourable members: Hear, hear! Electricity Infrastructure and Energy. I refer to the statement released today by the operator of the Pelican Point power station, which reads: The second unit … at Pelican Point is not able to provide a market response under the current rules of the … NEM unless directed by the market operator. Why did the federal regulator which reports to this minister force blackouts on South Australian households and business instead of directing Pelican Point to switch on the second unit? is literally unbelievable. You have had successive blackouts in South Australia. You have had written reports from the Australian Energy Market Operator and the Australian Energy Market Commission saying that the system's strength is a weakened as you increase a reliance on intermittent sources of power. The Australian Energy Market OperatorMr Keogh interjectingpeddle. When you play a bad game, you do not blame the operator. This is absolutely pathetic. There are hundreds of thousands of workers in South Australia in the manufacturing sector. Their jobs have now been put at risk as a result of higher electricity pricesMr Keogh interjectingThe member for Burt then left the chamber. South Australia that has seen its electricity prices go up by 50 per cent. Do you know whose",98,Questions Without Notice
123,The Speaker,I just say to the minister: I am not any of those things.,99,Questions Without Notice
124,Mr Frydenberg,"After these recent events, what will it take for the Leader of the",99,Questions Without Notice
125,The Speaker (14:40,I inform the House we have present in the gallery this afternoon,99,Questions Without Notice
126,Mr Butler (Port Adelaide) (14:40,My question is to the Minister for the Environment,99,Questions Without Notice
127,Mr Frydenberg (Kooyong,Minister for the Environment and Energy) (14:40): This,99,Questions Without Notice
128,The Speaker,The member for Burt is warned!,99,Questions Without Notice
129,Mr Frydenberg,disputes the version of events that the Labor Party are starting to,99,Questions Without Notice
130,The Speaker,The member for Burt will leave under 94(a).,99,Questions Without Notice
131,Mr Frydenberg,"Just last week, Senator Ruston and I visited a seafood business inelectorate that is in? It is the member for Port Adelaide's electorate. You have no message of support for them because you have a 50 per cent renewable energy target federally. question, whilst it was long, was very specific in a number of regards. As the minister knows, he will need to address those remarks or discontinue with his preamble and wind up his answer. Labor Party are putting forward. Pelican Point could have come on with the high demand and the high prices. The issue in South Australia was not Pelican Point. The issue in South Australia was the low supply from wind power. This is all about creating a little distraction here, so we do not see what is going on here. To use the words of the Leader of the Opposition in the Senate, Senator Penny Wong, 'your policy is a smokescreen'. This is a smokescreen. The reality is wind power only provided to 2½ per cent of supply in South Australia yesterday. The interconnector, ironically providing brown coal fired power from Victoria into South Australia, was at maximum capacity. The issue here is that wind was so low in South Australia and demand was high because of the temperatures that the system could not cope. If South Australia was like other states, you would not have had this problem and you are only compounding this problem with your 50 per cent renewable energy target, which is putting ideology ahead of jobs. Mr Butler: I seek leave to table the media statement from ENGIE that confirms that this minister and the operator sat on their hands last night. Energy Security representing the Minister for Regional Development. Will the minister update the House on the importance of affordable and reliable energy in regional Australia and what impact would higher electricity prices have on jobs and hard working families in regional Australia? the member for Calare for his important question on what is a very serious issue for regional Australia. The member's electorate in regional New South Wales is home to the Mt Piper power station, which employs in the order of 300 people. It is these power stations which are vital for providing the affordable and reliable energy that regional Australia needs. It is the power stations in regional Australia that keep the lights on in our homes, in our schools, in our hospitals and in our businesses; but it is the people who work there who are being vilified by Labor and the Greens as dirty, big polluters. Many of those people live in my community. I can tell you that they know they have been sold out by the Australian Labor Party. The member asks why it is important for regional Australians to have affordable and reliable energy. One-third of Australians live outside of our capital cities, and we want more people to enjoy the great quality of life we can offer in places like Wagga Wagga, Rockhampton, Mildura, Mackay, Dubbo and Gippsland. We want to build a safer, stronger and better regional Australia where everyone can get ahead. But people living in regional areas have, on average, lower household incomes than people living in our metropolitan areas,",99,Questions Without Notice
132,The Speaker,"I always allow preambles, but we are now into the second minute. The",100,Questions Without Notice
133,Mr Frydenberg,The Energy Market Operator disputes this version of events that the,100,Questions Without Notice
134,The Speaker,Is leave granted? Leave is not granted.,100,Questions Without Notice
135,Mr Gee (Calare) (14:44,My question is to the Minister for Infrastructure and Transport,100,Questions Without Notice
136,Mr Chester (Gippsland,"Minister for Infrastructure and Transport) (14:44): I thankand when the power bills go up it is the people in regional Australia-those who live in homes in regional Australia-who are hit the hardest. Reliable baseload energy is also critical for jobs in regional Australia. There were more than 670,000 regional businesses registered in regional Australia in 2015. But they are getting squeezed by higher energy costs. Our dairy farmers, our retailers, our hairdressers and our workshops are all suffering under high energy costs, and they will only increase under Labor's ideological obsessions. If we are serious about keeping manufacturing in regional Australiaand we especially want jobs right throughout our regions-we need to keep providing reliable baseload energy across the nation. Now, this side of the House understands that. Those opposite have given up on manufacturing. They have given up on coal-fired power stationsthey know it in their hearts. To save their own jobs, to keep getting those Greens preferences, they have sold out the workers in places like Latrobe Valley, and they know it. Mr Broadbent interjectingbaseload energy that comes from these power stations, it is baseload jobs. Mr Rob Mitchell: You sold them off! Labor wanted five years ago when they voted for the Contract for Closure scheme. Those opposite wanted to get rid of coal-fired power stations under the Rudd-Gillard-Rudd governments, and they know it. This Prime Minister has a plan for jobs. He has a plan for reliable and affordable energy into the future. Labor in this place and at state levels right around Australia has given up on the workers that it used to represent. Labor has sold out to the Greens. You know you have sold out to the Greens, member for Maribyrnong, and it is families around Australia who will pay the price if 'Electricity Bill' ever becomes Prime Minister. unparliamentary phrase. He knows he needs to refer to members by their correct titles. Pensions and Benefits Ms MACKLIN (Jagajaga) (14:47): My question is to the Minister for Social Services. I refer to the minister's previous answer, and I quote: … we have invested all of the money that we are saving from the family tax benefit system. But, under its policy, the government is cutting $2.7 billion in family payments and only spending $1.6 billion on its childcare policy. Is the minister aware he was misleading the Australian people, or is he just plain incompetent? all', that is true.",100,Questions Without Notice
137,Opposition Members Interjecting,,101,Questions Without Notice
138,Mr Chester,"They have surrendered to the Greens, and by the sound of their protests,",101,Questions Without Notice
139,Mr Chester,"As the member for McMillan knows, in our electorates, it is not just",101,Questions Without Notice
140,The Speaker,The member for McEwen!,101,Questions Without Notice
141,Mr Chester,They know that this impending closure of Hazelwood is exactly what,101,Questions Without Notice
142,The Speaker,The minister will return to the dispatch box and withdraw that last,101,Questions Without Notice
143,Mr Chester,I withdraw.,101,Questions Without Notice
144,Mr Porter (Pearce,"Minister for Social Services) (14:48): I should have said 'almostcease interjecting. The member for Jagajaga cannot have a point order within 17 seconds; that is a record. The minister has the call. significant reductions in the savings that we have achieved. The reduced savings from the family tax benefits system are about $1.72 billion. The reduced savings from the paid parental leave changes are about $700 million. The childcare costs, in the end, are about $1.6 billion. All of the money that is being reinvested, of course, is very important to making sure that childcare goes ahead. IfI might return to a point that I tried to come to in an earlier answer but was unfortunately prevented from doing but that you have now given me an opportunity to raise, there was a situation that developed with respect to the previous governmentMr Burke: What's going on? her seat. The minister is halfway through a sentence. I heard the Manager of Opposition Business ask, 'What's going on?' I think we are about to find out, but I caution the minister to remain relevant to the question that is being asked, not a previous question. But I do say to the member for Jagajaga that the preamble to her question did refer to his previous answer. The minister has the call. tax benefits system into childcare. The lion's share of the savings from the family tax benefit savings are being reinvested into childcare. It is generational reform. But what is very interesting about the structural changes that allow you to save money in the family assistance system and move it into proper investment in childcare is that over six years members opposite took $23 billion out of the family assistance system. In fact, the list is so long it is on a spreadsheet: changes to rules for receiving family and parental payments overseas; indexation pauses on upper limits of family paymentsMr Bowen interjectingwho provide inaccurate estimates; pause indexation of family tax benefit supplements; extend pause FTB B; remove expansion of link to FTB A; cease fortnightly payments for recipients who do not lodge tax returns. What they moved out of the family assistance system was $23 billion worth of savings that they took out of the family tax benefit system. And how much of that did they reinvest into childcare over six years? Absolutely none. What we are presenting the parliament and the Australian people with is a system that invests a massive amount of money found in savings in the family tax benefit system. That",101,Questions Without Notice
145,Opposition Members Interjecting,,102,Questions Without Notice
146,The Speaker,Members on my left! I am trying to hear the answer.,102,Questions Without Notice
147,Mr Porter,But it does give me the opportunity,102,Questions Without Notice
148,Opposition Members Interjecting,,102,Questions Without Notice
149,The Speaker,The member for Jagajaga will resume her seat. Members on my left will,102,Questions Without Notice
150,Mr Porter,"In the omnibus bill that we brought before the parliament, there are",102,Questions Without Notice
151,Mr Porter,where they did go into the family assistance process,102,Questions Without Notice
152,The Speaker,The minister will resume his seat. The member for Jagajaga will resume,102,Questions Without Notice
153,Mr Porter,I have been asked about the reinvestment of our savings from the family,102,Questions Without Notice
154,The Speaker,The member for McMahon!,102,Questions Without Notice
