speakerGroups,speaker,theText,pageNumbers,title
234,Mr Howarth (Petrie) (10:29,"Mature Australians often make great workers. OlderI have been very heartened to hear of companies now actively recruiting mature age workers for the mentorship that they can offer to junior staff. If you look at the agriculture industry, which has seen a boost in the last 12 months, going from $46 billion to $60 billion in sales, and manufacturing, which has seen some 100,000 new jobs, this is an opportunity to employ some of those older people, to keep them on, to help young people coming through. I congratulate those employers committed to opportunities for mature age workers. It is in our best interest nationally. Centrelink Ms COLLINS (Franklin) (10:32): One of the biggest issues that my electorate office has been dealing with over the summer period has been the Centrelink robo-debts. I have been concerned, since we came back to this place in the last few days, that the two ministers responsible-the Minister for Social Services and the Minister for Human Services-are not aware of the concern that this is causing in the community or they seem not to care about it. SoI thought I would tell some stories that I have been receiving in my electorate office and from a public meeting that I held last week, to give people an understanding of how this is impacting on people in our community. I want to start with Bill. Bill is now an age pensioner but he was working part time, driving a bus for four hours a day and getting a part-Newstart allowance. Bill got a robo-debt letter saying that he owed $3½ thousand or thereabouts. Bill tried to tell Centrelink that the name of his employer and the name that the ATO and Centrelink were using for data matching was different and why it was different. It took him quite a bit of time and energy to try and get through this. But they said to him, 'You've got to start paying this debt anyway while we work it out.' He said, 'I'm happy to pay $10 a week while you resolve it and sort it out.' They said to him, 'You can't do that because we know you've got money in the bank; you need to pay it upfront.' So he paid the whole debt in full, $3½ thousand. He knows he does not owe that money, and he is now stressed that he is never going to get back that money that he has already paid. So that is one example; that is Bill. Maree is a 70-year-old pensioner who received a debt notice. She went through all of her bank statements and totalled up what Centrelink had paid her over the period that they were talking about. She found that Centrelink had actually paid her less than what they were claiming to have paid her. So Centrelink's debt letter actually shows that they owe her money, if what they are saying is true. She has had this debate with Centrelink and she has gone through it all with them and they said, 'Well, you have to prove it to us.' She has spent hours on the phone. She now has to employ an accountant to do her numbers for her so that she can clear up this debt with Centrelink. There is a another woman-a professional woman-who was on Youth Allowance who got a debt notice for $5,400 that goes back to 2012. She phones Centrelink and she was told that she needed to pay the debt and then she got an email saying, 'Oh no, you don't owe the debt.' And then, in the meantime, she got a notice saying that her debt was going to a debt collector. She has found it really difficult to get through to Centrelink, and her frustration was palpable. She works full time. She has two degrees, she is trying to sort out this issue with Centrelink and she does not have the time in her working day to talk to Centrelink. She is getting extremely stressed. She still does not know whether or not she owes this debt. It is a debacle and the government needs to fix it. Tennis (10:35): I rise to speak about the spectacular summer of tennis that we have just experienced. It has been a season like no other with international stars of the court bringing breathtaking matches to the screens of millions of Australians and around the world. The Federer-Nadal grand slam final at the Australian Open last week demonstrated the sheer talent, dedication and persistence of our tennis sporting super stars. Congratulations to Steve Healy, Craig Tiley and all the Tennis Australia team who make Australia's tennis events the most popular with players on the tennis circuit. Close to 100,000 spectators enjoyed the sights and sounds of the Brisbane International for eight days at the beginning of January at the Queensland Tennis Centre at Tennyson. With 334 aces served during the tournament and 12 kilometres of string used for newly-strung racquets, the Brisbane International was a resounding success. Once again, we were honoured to have two Australian tennis greats, Roy Emerson and Evonne Goolagong Cawley, present the eponymous trophies to the men's and women's singles champions. On 18 January, I was privileged to join Ken and Barbara Laffey for the unveiling of the Roy Emerson statue in Blackbutt. This life-sized bronze of the tennis legend pays homage to his 12 grand slam wins from this small regional Queensland town. As a right-hander, Roy was known for his exceptional level of fitness that saw him ready for even the most strenuous match on the hottest of days. The statue is a result of a wonderful community effort over several years, and deserved congratulations to Hazel and everyone involved for a great community event and lasting reminder. Tennis is no longer the sport of yesteryear when white attire and gut-string racquets could be seen on private courts across Australia. Today, tennis is engaging with those from all walks of life. On that note, I must mention the ever-successful Hot Shots program. Launched in 2008, it is designed to help every child, no matter their age or ability, to start playing tennis. Children learn to play on the right-sized court, using racquets that are perfect for small hands and balls that do not bounce too high. Hot Shots encourages fitness, socialising, all round entertainment, and what better sport to do this with than tennis. More than 500,000 children have experienced the program in the past 12 months alone. Which brings me to the perfect time to congratulate two of my schools who showed amazing talent in the Brisbane International Schools Challenge. Brookfield State School coached by Roanne and John Lemmon-Warde won the orange and red ball events; and Jason Carriage and the team from Fig Tree Pocket State School had a fantastic run, finishing in fifth place in the green ball competition. It is wonderful to see the growing profile of tennis throughout the whole of Queensland, including my electorate of Ryan. No matter where you are in the world or what language you speak, pick up a tennis racket and you are bound to meet friends who share your common bond. Congratulations to Lleyton Hewitt and the Davis Cup team on their recent win. As they say in tennis: game, set and match.",143,Constituency Statements
235,Mrs Prentice (Ryan,"Assistant Minister for Social Services and Disability Services)Welfare Reform Ms SWANSON (Paterson) (10:38): There are stories circulating today that the Prime Minister may put on the backburner his plan to raise the pension age to 70. Well, the backburner is not good enough. It should be clearly shelved altogether, scrapped. It is an attack on pensioners. It was always a bad idea, an offensive idea and Labor has opposed it from the get-go. A country like Australia should not have to keep its older Australians working to the age of 70, whilst giving a $50 billion tax cut to big business. Just think about it: working till 70. I know it might be okay if you are sitting around parliament, but, let me tell you, if you are working as a labourer, as a nurse, as a farmer, these jobs require substantial physical exertion. Hardworking people in my electorate of Paterson keep saying to me: 'They must be joking. How are my knees going to keep going?' It is a slap in the face for Australians who have worked physically hard all their lives. They deserve respect; Labor think so. But an attack on older Australians is what we have come to expect, quite sadly, from the government. Every budget they try it on. It is very predictable. Before the 2013 election, they promised no cuts to pensions. What a joke that was! Every single budget since, the Liberals have tried to cut the pension. They never miss a chance. To the Liberals, pensioners are second-class citizens. Pensioners in my electorate are still reeling from the changes to the assets test this year. They are furious at these farcical deeming rates. Tell me: who is getting the percentages that the government claim they are? No-one. They are still furious that the government will not do something about this, even though we keep hammering the point home. I held a forum for seniors in Nelson Bay. I would have been happy if I got perhaps 100 people. Five-hundred people turned up that morning, and they covered a range of issues. They were busting to talk to me about what was on their mind. What would happen to their pension? What could they expect next? Did anyone in Canberra have the faintest idea of what it was like to try to make ends meet on the pension? Why was there no-one in Centrelink who could help them? Why could they never get through on the phone? Why does it take 10 weeks to get a Medicare refund? Why does it cost so much to go to the doctor? Now the government are preparing to throw pensioners under the bus to get their dubious childcare reforms passed. Only a Liberal government would try to sell cuts to family payments as a positive. Enough is enough. The government must start respecting our pensioners and stop treating them as they have. Page Electorate: Awards winners. I acknowledge the Clarence Valley Council Citizen of the Year, Diane Lee, and the joint winners of the Young Citizen of the Year award: Bennett Mitchehill and Hannah Smith, both delightful young people. The Local Hero award winner is Roger Green, a wonderful fundraiser. The Community Achievement award winner is Grafton Midnight Basketball; they also do great work. I thank all the nominees and winners, who are inspirational people in our community. I also acknowledge the winners in the Richmond Valley Council Australia Day awards. The Citizen of the Year award winner is Brian O'Farrell, whose father also won this award",145,Constituency Statements
236,Mr Hogan (Page) (10:41,"I would like to acknowledge recent Australia Day awardpreviously. The Young Citizen of the Year is Aiden Yourell. The Sportsperson of the Year is Robert Johnston. The Young Sportsperson of the Year is Jacob Jolley. The Volunteer of the Year is Bill Bartier. The Young Volunteer of the Year is Nicholas Colbrelli-Adams. Congratulations to all of you. It was a hot day at Woodburn that day, but you are all inspirational people in our community. I thank you for what you do. I also acknowledge the winners of the Lismore City Council Australia Day awards. John Turnbull from Modanville received an OAM for his services to secondary education. Alan Hoskins from South Gundurimba got his OAM for service to the Uniting Church in Australia and to the community more generally. The Citizen of the Year is Jane Boorman. The Young Citizen of the Year is Caitlin Bargwanna. The Junior Sportsperson of the Year is Courtney Linton. The Senior Sportsperson of the Year is Belinda Smith. The Organisation of the Year is the Lismore Kart Club, and I acknowledge Barry Fisher for his work with the Lismore Kart Club and PCYC. The Sustainable Environment award winner is John and Margaret Hildebrand. The Art and Culture award winner is Julian Louis. The Individual Services in the Community award winner is Julie De Nardi. The Group Services in the Community award winner is the Lismore Park Run-Anthony and Belinda Smith. Congratulations. I thank you all for what you do in our community. I also acknowledge all the winners in the latest Australia Day awards for Kyogle Council. Frederick Finch from Kyogle got an OAM for his services to maritime history preservation. The Citizen of the Year award winner is Roslyn Knights. The Senior Citizen of the Year is Vic Walters. The Junior Citizen of the Year is Ebony Lavell. The Sportsperson of the Year is Amber Bryant. The Minor Student award winner is Ella Day. The Minor Sportsperson award went to Oliver Rixon. The Junior Student award was jointly awarded to Thomas Masters and Tegan Pederson. The Senior Student award winner was Eloise Crawter. In Bonalbo, the Citizen of the Year is Duncan Robertson and the Young Citizen of the Year is Mason Newton. The Sportsperson of the Year is Kaitlyn Summers. The Business of the Year is the Dog'N Bull Hotel-Kerry and Paul Horne. The Community Organisation of the Year is the Bonalbo Community Hall. In Woodenbong, the Citizen of the Year is Nan Krarup and the Young Citizen of the Year is Madeleine Barrett. The Junior Sportsperson of the Year is Katelyn Grimmett. The Community Organisation of the Year is the Woodenbong Rural Fire Brigade. I thank you for all that you do in our community. Borg, Mr Fred, OAM Dr FREELANDER (Macarthur) (10:44): TodayI would like to pay tribute to a very significant community figure in Campbelltown, Councillor Fred Borg, who passed away on 20 December last year at the age of 73. Fred was born in Malta in 1943, and like many of Maltese origin he came with his family to Australia after World War II to build a new life, arriving in 1951. Fred gave so much to the people of Campbelltown and he worked hard to ensure our community thrived. He established the 24 Hour Fight Against Cancer, Macarthur's biggest charity event, which raises funds for the Macarthur Cancer Therapy Centre, the oncology ward and the paediatric ambulatory care unit at Campbelltown Hospital as well as the palliative care unit at Camden Hospital. Over the years, I had a lot to do with Fred, who was a very kind and caring man who made sure that Macarthur received the health funding it deserved. He was a life member and one of the pioneer board members of the Campbelltown Catholic Club. He loved the Wests Tigers rugby league team and did all he could to support them. Through owning and running his own printing business he became president of the Campbelltown Chamber of Commerce at a very important time, when Campbelltown was transitioning from a region to a city. Fred was a long-term campaigner for something to be done about the dangers on Appin Road, an issue that everyone in Macarthur is very concerned about and very passionate about, even now. I am doing my best to make sure that Fred's dream of having a safe Appin Road will come true. Fred was an independent councillor on Campbelltown council for 17 years. He is one of the only council members whose name was a household word in our community. Early last year Fred received a special acknowledgement for 50 years of service to the community of Campbelltown, and this year he received a very well deserved posthumous Order of Australia award. Fred knew he lived in a great place with wonderful people, and he supported those people throughout his entire time in the Macarthur community. He loved his community but he loved nothing more than his family. He was the father of four and a grandfather of 11. He is survived by his beautiful wife Maria. Ironically, Fred was very passionate about fighting cancer, and cancer is what finally drew his life to a close. He died, I believe, with great dignity. When I announced that I was standing for election in the last federal election, Fred rang me to tell me that he was a friend of the incumbent, Russell Matheson, my opponent, but he would still do whatever he could to support me. He made sure that at every community event he was at I was acknowledged, and he was very positive about me. I am very grateful to him. Corangamite Electorate: Corangamite Medal Ms HENDERSON (Corangamite) (10:47): The Corangamite Medal is an annual award I have initiated which recognises one exceptional student in each participating primary and secondary school in my wonderful electorate. The metal celebrates the achievements of young people and encourages the leaders of tomorrow-and we all know how important that is. I have been delighted with how well the Corangamite medal has been received across a diverse range of schools. This year some 41 schools participated in the program. It was fantastic to visit so many schools to present the metal and to pay tribute to young people across my electorate who have made such an extraordinary contribution to their school community, and to the broader community in so many cases. I will go through the winners, because I think it is very important that I acknowledge each of them in the national parliament and celebrate their achievements. They are from Trinity College in Colac, Laura De Lorenzo; St Ignatius College, Sophie Crothers; Aireys Inlet primary school, Mina Barley; Ceres Primary School, Cooper Field; Sacred Heart College, my old school, very proudly, Sophie Dowling; Colac West Primary School, Tianna Beckett; Lethbridge Primary School, Brooke Devlin. From Woady Yaloak, which has four campuses, the winners were, at Ross Creek, Larissa Brownbill; at Snake Valley, Jazz Humphrey-Brown; at Scarsdale, Ella Ross; and at Smythesdale, Lilly Hall; from Linton primary, Graice Ronan; Meredith primary, Trent Miller; St Aloysius Catholic Primary School, Claire Martin; Deans Marsh primary, Chloe Hall; Lorne P-12 college, Carl Pulido; Belmont High School, Abbey Lanyon; Surfside Primary School, Brendan Mohr; Mount Duneed Regional Primary School, Tyler Pekin; Oberon primary, Indy Dunn; Colac Primary School, Charlotte Hardy; Oberon High School, Teagan Madden; Colac Secondary College, Nicholas Lenehan-Anderson; Forrest Primary School, Maddy Seebeck; Inverleigh primary, Angus McDonald; Mandama Primary School, Ngara McEwen; Matthew Flinders Girls Secondary College, Laura Bath; Bellarine Secondary College, Amy Thomas; Clairvaux Catholic School, Harry O'Neill; Highton primary, Will Jones; Surf Coast Secondary College, Emma Vescio; Grovedale College, Jessica Loone; Our Lady Star of the Sea Catholic Primary School, Tia Fitzgerald; Ocean Grove primary, Zoe Evans; Torquay P-6 College, Mackenzie Colledge; Barwon Heads primary, Nellie Naulty; Shelford primary, Henry Bennett; Rokewood primary, Lily Terryalmost there, Madam Deputy Speaker Vamvakinou; it is a wonderful, long list-Teesdale Primary, Vincent Weatherly; Grovedale West, Caitlin Dawber; Alvie, Charlotte Little; Beeac, Zac Barwise; Birregurra, Paul Doak; and Point Lonsdale Primary School, Angelica Daniels. Thank you very much. Turnbull Government week of parliament for 2017, the political year is already old. We saw, of course, that over the summer break this government managed to lose a minister, so it is a very unsteady beginning for this government for 2017. Not only did they put us through the torture of losing a minister, but we were then treated to the vaudeville of Senator Sinodinos filling in as health minister for a period. Now, with our first week in parliament, we saw the Prime Minister Malcolm Turnbull resolved to reset the year and reset the debate as best he could. He did that with a speech to the Press Club. A government member: It was a sensational speech. saying it was a sensational speech-but the wonderful irony of it is that no-one would know. No-one would know because he successfully bombed his own speech by having the wit to time it on an occasion where the AEC election records were coming out so that his speech theme around transparency was immediately overrun by questions concerning his donation to the Liberal Party. As a consequence, we had the rather remarkable vision of a Prime Minister needing to go on the 7.30 ABC news program that evening so as to clean up the aftermath of his own attempt to reset the year. And his reset for the year, as a consequence, was entirely about his $1.75 million donation to the Liberal Party. A government member: All his own money. Government members interjectinginterjection and says it was the Prime Minister's own money. I might, of course, make the observation that given that fact, why it is that he held onto it as a secret rather than being clear about it in the aftermath of the election is an enduring political mystery, because the Prime Minister set himself up so that there would be a full 18 months of speculation and interest in a",146,Constituency Statements
237,Mr Feeney (Batman) (10:50,I think it is fair to say that while this might be the first,149,Constituency Statements
238,Mr Feeney,"As you know, with that speech to the Press Club-and a member interjects",149,Constituency Statements
239,Mr Feeney,"By all means, absolutely right. Again, the member makes a finalmatter that you insist is mundane. He worked hard to make it the story that it became and, not satisfied with building a year of suspense, then used that fact to bomb his own reset of the year. Once again, we have seen this government's tactical ineptitude make sure that it has lost control of the debate again and again. But on marriage inequality-this remains a key and burning issue for my electorate-I would like to offer the coalition some free political advice: you have set yourselves up to ensure that marriage equality remains a burning issue in the electorate between now and the next election. Clearly, this is not in your interest. We can get marriage equality done. It can go through this parliament and it can become a fact. I have often made the observation that, the day after we achieve marriage equality, people will wonder what on earth the fuss was about. You have set yourselves up to be pinged by this debate for more years than you need. (Time expired) Fisher Electorate: Australia Day Honours Australians who are also constituents in my local community. The federal seat of Fisher is proud to boast not only the Australian of the year, Emeritus Professor Alan Mackay-Sim, but also many of the wonderful recipients of this year's Sunshine Coast Australia Day awards. Professor Mackay-Sim is famous, as I hope every Australian now knows, for achieving a feat that was previously the preserve only of miracles, that of restoring mobility to a person whose spinal nerves have been completely cut. Following his work, a firefighter, whose life had been almost destroyed by a savage knife attack, can walk and even ride a bicycle again. But Professor Mackay-Sim's work has gone much further: like all great Australians, he has created a great team to continue and build on what he has achieved. His research using olfactory stem cells is now being developed by colleagues in Queensland to advance our understanding of Parkinson's disease, schizophrenia and motor neurone disease. As Australia transitions into the economy of the 21st century, we have a greater than ever need for innovative and creative thinking. Professor Mackay-Sim, the man who recognised how his work on the nose could help people with a traumatic spinal injury to walk again, is an inspirational leader in that area. I congratulate him on being made Australian of the Year. In Fisher, though, we have a great many outstanding people. We cannot, of course, make all of them Australian of the Year, but in our community we give our own Australia Day awards to recognise their contributions. I am proud to be able to tell the chamber about just some of them. Our Citizen of the Year was Julie Penlington, who is the founder of Four Paws Animal Rescue, a local organisation that provides loving homes to rescued animals. Jak Hardy, a personal friend of mine, won our Young Citizen of the Year award for his extensive volunteer work in the community. While achieving great academic success, Jak has featured heavily on local volunteer boards and committees. He has even represented Australia at the Commonwealth Youth Peace Ambassadors Network. In Fisher we are very concerned about the preservation of our beautiful natural environment, and I would like to acknowledge our environmental award winner. Rhondda Alexander has been a tireless servant of the community over the past 40 years. I would also like to acknowledge my very good friend Don Moffatt, who received his Order of Australia for his dedication to community rescue helicopter services and the horseracing community.",149,Constituency Statements
