speakerGroups,speaker,theText,pageNumbers,title
232,The Deputy Speaker ( Mr Buchholz,I thank the honourable member for that,177,Constituency Statements
233,Mr Evans (Brisbane) (10:03,"I am very pleased to report on some recent arts fundingI will say that both Opera Queensland and the Queensland Ballet do actually have a very, very good, enviable regional offering for Queensland. They certainly do much more in the regions than their interstate peers. This, of course, is a Queensland-wide topic, not just a Brisbane-centric issue. I am very happy to report that, together with our other Queensland LNP colleagues, we will be seeking to ensure that Queensland gets its fair share. These funding announcements for opera and ballet are a start, but there is much more work to do. Schools To say that their education plan is about needs based funding it is just wrong and flat out untrue. Let's just compare a couple of schools in my electorate to demonstrate how wrong and misleading this government is. Under the Labor model, Kennington Primary School-one of the largest primary schools in the Bendigo electorate, with over 600 students-would have got half a million dollars under the original Gonski funding next year. What did they get from this mob last night in the budget? It was only $73,900. That is a bit of a difference. That is just a bit of a difference. That is an entire music program, that is quite a few teachers and that is teacher aides. Another example is Bendigo Senior Secondary College. Under Labor's original Gonski model, they would have got $1.6 million in extra funding, needs based funding, for the largest VCE-VCAL program in the state of Victoria, which is delivered at Bendigo Senior Secondary College. What did they get last night in the budget and under this government's version of what it call needs based funding? It was only $265,800. There is a really big difference between $1.6 million and $265,800. The government say it is needs based funding. Last night, I looked on their website at their own calculator. Lightning Reef Primary School-the school of hard knocks-are trying so hard to catch up on numeracy and literacy. They are in a very disadvantaged, low SES area in Bendigo. They forgo watering their oval to keep on a part-time teacher aide. They do not have enough money in their budget to water an oval. What is the boost they get from this government-the top-up? It is less than $40,000 in the government's version of needs based funding, yet another independent school just up the road, which is doing quite well, gets half a million dollars. It is not needs based funding that this government has put forward. Just because you call it needs based funding does not mean that it is. The schools who most need the money continue to miss out under this government. Kennington Primary School, Bendigo Senior Secondary College and our Catholic schools in Bendigo are upset. The ones on the west side of town are doing worse than the ones on the east side of town. This government is now targeting the Catholics, who, quite frankly, are a little bit better at managing money when it comes to schools. This government is not serious about needs based funding. It is not serious about Bendigo schools. The announcements last night prove again that our schools are worse off under a Liberal-National government, and I call on them to implement the full and original Gonski based funding. Bradfield Electorate: ANZAC Day day of enormous significance all around Australia, and certainly in Bradfield we marked ANZAC Day in a way that pays due regard to the rich history of military service and sacrifice in",177,Constituency Statements
234,Ms Chesters (Bendigo) (10:06,The spin from this government is just extraordinary.,178,Constituency Statements
235,Mr Fletcher (Bradfield,"Minister for Urban Infrastructure) (10:09): ANZAC Day is aour area. This year, in commemorating the Centenary of ANZAC, we acknowledged in particular three notable individuals from Bradfield: Sir Tannatt William Edgeworth David, who was instrumental in the detonation of Messines-Wytchaete Ridge and was an active member of the Hornsby community in the years following the war; Cecil Arthur Callaghan, a local of Gordon, who fought bravely in the defence of Singapore and was made a Companion of the Order of the Bath and was active in founding the Ku-ring-gai sub-branch of the RSL; and Dr Lucy Gullett, a pioneering and fearless doctor and Wahroonga local who, at great personal expense, travelled to Egypt to serve with the medical forces and the French Red Cross in London. I had the privilege of attending three services on ANZAC Day to mark the legacy of all those brave Australians and their service and sacrifice over so many years. At Roseville I attended the dawn service organised by the Roseville sub-branch of the RSL at the park just outside the Roseville Memorial Club. I attended the 7 am service at Wahroonga organised by the Sydney Northern Branch of the National Servicemen's Association and then the 9 am service at Turramurra organised by the same organisation. As is the case each year, the number of people in attendance was greater than ever and there was a very large representation of young people. I also acknowledge the organisers over many years of the dusk service held at the Kokoda memorial in Wahroonga, which, regrettably, was unable to be held this year because of ill health on the part of the organisers, Mr Owen Thomas and Mr Greg Hodgson, but I do want to acknowledge their work over so many years. On SundayI had the opportunity to attend the memorial service and ceremonial parade at Knox Grammar School, always an impressive and moving occasion. His Excellency the Governor General, Sir Peter Cosgrove, was the Reviewing Officer. I also attended, the previous week, the ANZAC commemoration service at the Anglican Church of St John in Gordon, which honours the 18 Battalion, or the Ku-ring-gai Regiment, as it is known, which is so tied up with the service in our part of Sydney. And, of course, that church holds two battlefield crosses, one from World WarI and one from World War II. They are indeed very moving relics of conflict and the suffering that was endured by so many Australians. In Bradfield, as around Australia, we marked ANZAC Day and recognised the service and sacrifice of so many Australians over so many years. Budget indeed right around the country have got from this Liberal budget is the middle finger. If you are under 35 in this country, this government has helped to sell you out yet again and continues prosecuting its war on the young. The biggest single area of cuts in this budget is from students and universities. Students are being asked to pay more, to go into further debt and to pay it back earlier, and the universities that are giving them their education will have less money because their budgets have been cut as well. Unemployment is forecast to go up. For all the talk of jobs and growth, the government did not tell you that hidden in the budget papers are forecasts that unemployment is going to keep going up, more than expected, and it is going to hit young people the hardest. And if you are trying to put a roof over your head, the government has squibbed it on housing affordability, pretending that it is not a problem, and has refused to tackle the billions of dollars in taxpayers' money every year that is going not to help people buy their first home",178,Constituency Statements
236,Mr Bandt (Melbourne) (10:12,"The only thing that young people in Melbourne andbut to help people who already have a home to get their second, third or fourth homes through subsidies for negative gearing and capital gains tax. So students and universities are paying billions so that property investors who have three, four, five or six homes can keep getting a subsidy from this government. And what do the government do? They turn around and blame young people for not getting jobs that are not even there. On one hand the government say, 'Unemployment's going to go up and jobs aren't going to be there for you and we've got nothing there to give you a job if you're a young person.' But, on the other hand, they say, 'We're going to blame you for it by kicking you off your welfare.' The government say that the very, very meagre amount that you get if you are unemployed in this country-thanks, in part, to some of the government's decisions-is now at risk because the government say they are going to start randomly drug testing people. If you, the government, actually believe it, then start with your own. When the government front up and say they are prepared to breathalyse every MP or minister before they come in for a speech or a vote then the Australian public might take them seriously. To turn around and say to poor people, 'We are now going to infringe your rights by subjecting you to a random drug test, just because you happen to have the misfortune of not having a job,' when unemployment, on the government's own terms, is forecast to rise, is reprehensible. People will understand that you-the Turnbull government-are not addressing the real problems of youth unemployment and instead are trying to blame the people who cannot find jobs. Those jobs simply are not there. The government have been mugged by reality and have pinched the Greens proposal for putting a levy on the big banks, but they should put that money into education and making housing more affordable, instead of lining the pockets of property investors and donors to the Liberal Party. Canning Electorate: Community Meetings Canning that I would hold a community meeting in every major town and suburb in my electorate before Christmas. In the past four weeks I have visited the communities of Waroona, Preston Beach, Pinjarra, Coolup and North Dandalup to hear their feedback about the things that matter to them. The people of Canning have engaged, and I have heard them loud and clear. Despite the variety of people I have met with, their message has been consistent: the people of Canning want cultural, national and economic security. Like me, the people of Canning are proud of their country, proud of their flag and proud of their way of life. This was evident at the ANZAC Day ceremonies I attended alongside thousands of locals in Coolup, Mandurah, Byford, Pinjarra and San Remo. Canning wants a government that preserves Australia's freedoms. The government's recent changes to citizenship requirements are a timely reminder that anyone wishing to become an Australian citizen must play by our rules. This idea extends to foreign investment. We recognise that Australia needs foreign capital, but the people of Canning want our critical infrastructureports, poles and wires, and gas pipelines-to be owned by Australians so we can be sure of their security. There is widespread anxiety about the uncertain state of our world. Canning's rural communities have international concerns. They watch the unfolding situation in North Korea very closely. Many people have also raised the ongoing fight against ISIS and the threat of fighters returning to our shores. We must do everything in our power to stop that happening.",179,Constituency Statements
237,Mr Hastie (Canning) (10:16,"Earlier this year, I made a commitment to the people ofThe government's announcement to bolster the AFP's security and intelligence operations with an additional $321 million will be very well received in Canning. Everywhere I go, people want to see local jobs for local people. Again, the government have taken a step in the right direction with the 457 visa changes, which will make it easier for Australians to get Australian jobs. Government are responsible for setting the right conditions so that businesses and individuals can flourish. We are doing this by reducing company tax for small and medium businesses and making it easier for employees to train and employ jobseekers with the rollout of the PaTH program. Last night's announcement of the instant asset write-off extension, and our ongoing commitment to cut red tape are, indeed, sensible measures. But, ultimately, when it comes to economic security, the No. 1issue I have heard about is the GST. Western Australians want their GST money invested in Western Australia. They are outraged, as I am, when they look around the Peel region-which Canning takes in-and see critical infrastructure shortages in rail and roads and know that their hard-earned money is instead going to places like South Australia and not coming back to us. I am disappointed that WA state Labor secured nothing from the $2.3 billion infrastructure package for the Peel region. This is a wrong that I will seek to right. Brand Electorate: Schools Ms MADELEINE KING (Brand) (10:19): I rise today to speak about some of the schools I had the pleasure of visiting over the parliamentary break and some of the fantastic young people I have engaged with during this time. Earlier this year I began visiting the many high schools in my large electorate of Brand to meet the many students studying politics and law, as well as students in general humanities and social sciences classes. I visited them to talk about my role as a federal representative and, more broadly, the role of a modern parliamentarian in Australia. On these visits I met with year 9 humanities students from Gilmore College in Orelia as well as year 12 political and legal students from Living Waters Lutheran College in Warnbro. Let me assure you that the future is brighter than ever and rests comfortably in the shared grasp of these great young students. Their intelligence, their attitude, their willingness to learn and engage with wider society, and their curiosity and eagerness to understand the Australian political system fill me with great optimism for our younger generations into the future and their participation in this parliamentary system. It is clear though that much of the credit for the superb attitudes and inquisitive nature of these students comes from the guiding hands of their respective teachers. SoI must pay credit at this time to Ms Leslie Brown from Gilmore College and Ms Lauren Webb from Living Waters Lutheran College-two fantastic examples of educators helping mould our young people into critical thinkers who are driven to succeed and who listen to and are conscious of the opinions of others. I have a strong commitment to all forms of education in this country and I am pleased to contribute in some small measure to inform students about what we as members of parliament do in this place to serve our respective communities, our states and the nation as a whole. As well as visiting these schools for an engaging discussion, I have had the opportunity to view some of the outstanding achievements of the students in and around Brand. The community of Living Waters Lutheran College that I referred to earlier in particular are to be commended on sending their young 'Digibots' team across the country in order to pit their creation against robots belonging to teams of students from other states in the Digibots national competition held in Sydney in March. As their teacher Ms Yolanda Redpath commented, the national competition is a 'varsity sport for the mind'. The program is a fantastic way to showcase the engineering skills, innovative nature, ingenuity and enormous competitive spirit of WA kids, as well as kids from around the nation. Congratulations to Ms Yolanda Redpath and Mr Reg Murugan and the Digibots team. You should all be very proud of your achievements. I would like to add, however, that these successful programs and these positive learning environments are under threat from a mammoth $22 billion cut to schools funding that the Turnbull government is proposing. How can anyone expect these schools to maintain these high standards when on average $2.4 million is being cut per school over the next 10 years? That is to be added into a $50 billion tax break to big business. I really wonder what is going to happen to the six Catholic schools in WA in remote areas that are the only schools providing education to young people in those communities. Molong United Hospital Auxiliary vital role in our country communities, as you yourself know. The Molong United Hospital Auxiliary is certainly no different. In the last financial year the Molong auxiliary raised $29,000 for the Molong hospital-an incredible effort that deserves much praise and certainly the recognition of this House. I would like to take this opportunity to acknowledge the committee members who worked behind the scenes to achieve this magnificent result, including president Janice Oswald and committee members Julie James, Neryl Murray, Judy Andrew, Kim Thurtell, Maureen Curtis, Pat Roberts, Lesley Bye, Chloe Yarwood, Annabel MacSmith, Margaret Kaczorowski, Kim Ramsey, Cheryn Johnson, Robyn Barnes and Carmel Boucher. I would also like to give special mention to the manager of the Molong Health Service, Deborah Kenna, who works closely with the auxiliary. The auxiliary held raffles, catered for an annual theatre production by way of the Molong Players and gratefully received donations from the Molong community and its surrounding districts. They rallied behind the Molong hospital and delivered a range of new equipment, including oxygen concentrators, a dermascope, five dining room chairs that are on wheels, a palliative care bed, and mattresses for high-low beds. Each item purchased through their fundraising efforts has no doubt made a difference to everyone using the facility. The extraordinary efforts of the Molong United Hospital Auxiliary have also been rightfully recognised at the 83rd state UHA conference, held in Bankstown. The Molong auxiliary received the Yvonne Lynch OAM trophy. That trophy was for the most money raised per member by an auxiliary with 10 or fewer members in 2016. I extend my congratulations to the Molong United Hospital Auxiliary, who continue to make Molong proud-not only Molong but also the whole Calare electorate. Their work has made a real difference to the lives of local residents and to patients and staff at the Western NSW Local Health District. Well done, and thank you very much for all of your efforts. The community is very grateful.",180,Constituency Statements
238,Mr Gee (Calare) (10:22,"Deputy Speaker Buchholz, local hospital auxiliaries play aI recently had the good fortune to be in Molong to present the Molong hospital with some new flags. I met members of the auxiliary when we formally handed over those flags and I was able to hear first hand of the wonderful work that they do. The auxiliary members are true community heroes. They worked tirelessly, raising money and going about their business quietly yet extraordinarily effectively. I think the whole community of Molong and the surrounding districts owes them a great debt of gratitude. It is only fitting that we recognise them in this House today. acknowledge the importance of hospital auxiliaries in all regional communities. Wand, Mr Terrence John, OAM Ms McBRIDE (Dobell) (10:25): Today is a special day. Joining us is Terrence John Wand OAM. On behalf of my community, and especially my home town of Wyong, it is an honour to welcome Terry and to share some of his remarkable story. Today would not have been possible without the member for Tangney, my friend Ben Morton. Ben and I were a tag team, as two Wyong kids, on this speech. Terrence John Wand was born in 1941, a descendant of two of Wyong's pioneering families. He married his beautiful wife, Wendy Margaret Whitfield of Lake Macquarie, in 1962, and they had their two children, Trudy and Gavin. Terry often reminisces of his childhood in Wyong and reckons it is still a great place to grow up-and I agree with him. During the 1940s and 1950s, Terry and his mates raided orchards, helping themselves to watermelons, and cooled off in the hot summers in beaut swimming spots. Terry fondly recalls being at Wyong Public School in the post-war years and receiving the first flavoured milk in New South Wales, as the Wyong dairy, in Alison Road, experimented with chocolate and strawberry flavours. Terry has always been a hard worker and when growing up he had no shortage of casual jobs, his first paper run paying one pound a week-good money in those days. Terry loves sport and often says that sport must not be left out of Wyong's story. Terry, it cannot be left out of the story, and it will not be now that you have been awarded an OAM for your contribution. Terry knows how lucky the whole town is to have had a group of men establish sporting clubs in the early 1900s. Those clubs are now over 100 years old. Terry loves sportincluding rugby league. The Wyong Rugby League Club, the Roos, holds a special place in his heart. Terry's playing career lead to a fine coaching career, highlights being winning the New South Wales Rugby League Harold Matthews Cup, in 1980, and coaching many premiership-winning teams. I like his coaching strategy of not wearing you out in the offseason, so keeping you fresh for the main game. It is arguable, however, that his greatest contribution is as a sports administrator, working with Joe Bishop, Morrie Breen and Mr Vaughan to salvage the club, which was formed in 1910, and make it one of the most successful sports clubs in Australia. Terry's heroic efforts as honorary secretary in endeavouring to gain a certificate of registration and liquor licence and build a clubhouse for, I think, the sum of $68,000, is the stuff of Wyong folklore. Terry is a life member of both Wyong Rugby League Club Group and the Central Coast Division of Country Rugby League and holds Wyong's No. 1 badge. On behalf of my Uncle John 'Burkie' and your countless friends on the Central Coast, we salute you!",182,Constituency Statements
239,The Deputy Speaker ( Mr Buchholz,"I thank the honourable member andWand, Mr Terrence John, OAM congratulating Mr Wand on his OAM. I have known Mr Wand all of my life, and he is very dear to me. Mr Wand's contribution is not just to rugby league. Mr Wand is very much involved in the Masonic Lodge on the New South Wales Central Coast, an organisation that he joined on 21 March 1991. On Masonry trips Terry is known to provide travellers with a history lesson on local information and landmarks. People refer to him as a walking encyclopaedia. On trips to places like Muswellbrook, Dunedoo, Tamworth, Scone, Katoomba, Coonabarabran and Vaucluse, Terry and the Masons would raise money for charities and local organisations, like the Wyong hospital, surf lifesaving, prostate cancer and the men's shed at Bateau Bay. Terry progressed through committee positions and became a junior warden in 1997 and a senior warden in 1998, the second-most senior of the lodge. He also became heavily involved in the lodge's ANZAC commemoration service. Terry became Master of the Wyong Tuggerah Lakes Masonic lodge in 1999 and, at the request of the grand master, held this position for two years, a position that is normally held for only a 12-month term. In 2008, Terry became involved in the Grand Officer Committee and was elected to the board of management as operations chairman. Terry excelled himself in this difficult role and is responsible for a number of very important changes to the Masonic reporting system. In 2009, Terry became Secretary of Lodge. He still holds that position today and he remains actively involved in the local masonic widows association. In 2010, the district honoured him by electing him to the position of district grand inspector of workings. He also became a member of the grand lodge administration team. Terry has made a very strong contribution to his community. One of his proudest achievements is that of being the under-16 Central Coast breaststroke champion. His selfless commitment to his community, to the Masons and to the Wyong Rugby League Club Group, and his charitable work, his friendship and his compassion for so many people in the local Wyong community are recognised and applauded today by the parliament of Australia. It does not just happen, and I would like to mention Mrs Wendy Wand for supporting Terry in his work for the Wyong Rugby League Club Group and his work as a Mason. I am very pleased to be a close friend of Terry and his family. I am pleased that he is here today to share this occasion with us. Terry, congratulations on being awarded the honour of the Medal of the Order of Australia. their contribution. I think it is very prudent that we acknowledge, in the way of affirmation, their subject here today. May I join in the affirmation and congratulate you on the contribution you have made to our nation. We are pleased that you are present with us here in the chamber. Thank you. If no member objects, three-minute constituency statements will continue today for 60 minutes. That being the case, I call the honourable member for Makin.",183,Constituency Statements
240,Mr Morton (Tangney) (10:28,I am very pleased to join the member for Dobell in,184,Constituency Statements
